"math/0607083","Simon Donaldson","S. K. Donaldson","Two-forms on four-manifolds and elliptic equations",,,,,"math.DG math.SG",,"  We define a general class of elliptic equations for 2-forms on 4-manifolds,
of which the complex Monge-Ampere equation is a prototype. We obtain some
regularity results and discuss various connections (some speculative) with
modern symplectic 4-manifold theory.
","[{""version"":""v1"",""created"":""Tue, 4 Jul 2006 11:03:55 GMT""}]","2007-05-23"
"math/0607084","Oleg German","Oleg N. German, Evgeniy L. Lakshtanov","On multidimensional generalization of the Lagrange theorem on continued
  fractions","13 pages, 15 references",,,,"math.NT","http://arxiv.org/licenses/nonexclusive-distrib/1.0/","  The Lagrange theorem on continued fractions states that a number is a
quadratic surd if and only if its continued fraction expansion is eventually
periodic. The current paper is devoted to a multidimensional generalization of
this fact. As a multidimensional analog of continued fractions so called Klein
polyhedra are considered: given an irrational lattice in an n-dimensional
Euclidean space, its Klein polyhedron is defined as the convex hull of nonzero
lattice points with nonnegative coordinates.
","[{""version"":""v1"",""created"":""Tue, 4 Jul 2006 11:15:02 GMT""},{""version"":""v2"",""created"":""Wed, 12 Jul 2006 09:38:32 GMT""},{""version"":""v3"",""created"":""Fri, 26 Sep 2008 21:04:40 GMT""}]","2008-09-27"
"math/0607085","Yasuo Watatani","Masatoshi Enomoto and Yasuo Watatani","Exotic indecomposable systems of four subspaces in a Hilbert space","16pages",,,,"math.FA math.OA",,"  We study the relative position of four subspaces in a Hilbert space. For any
positive integer n, we give an example of exotic indecomposable system of four
subspaces in a Hilbert space whose defect is (2n+1)/3. By an exotic system, we
mean a system which is not isomorphic to any closed operator system under any
permutation of subspaces. We construct the examples by a help of certain nice
sequences used by Jiang and Wang in their study of strongly irreducible
operators.
","[{""version"":""v1"",""created"":""Tue, 4 Jul 2006 11:19:06 GMT""}]","2007-05-23"
"math/0607086","Ilya Molchanov","S. Koetzer and I. Molchanov","On the domain of attraction for the lower tail in Wicksell's corpuscle
  problem","6 pages","Published in Proceedings S4G. International Conference on
  Stereology, Spatial Statistics and Stochastic Geometry. Prague, June 26-29,
  2006. Eds: R.Lechnerova, I.Saxl, V.Benes, pp.91-96",,,"math.PR",,"  We consider the classical Wicksell corpuscle problem with spherical particles
in R^n and investigate the shapes of lower tails of distributions of `sphere
radii' in R^n and `sphere radii' in a k-dimensional section plane. We show in
which way the domains of attraction are related to each other.
","[{""version"":""v1"",""created"":""Tue, 4 Jul 2006 11:28:31 GMT""}]","2007-05-23"
"math/0607087","\'Angel del R\'io","Eli Aljadeff and \'Angel del R\'io","Every projective Schur algebra is Brauer equivalent to a radical abelian
  algebra","10 pages",,,,"math.RT math.RA",,"  We prove that any projective Schur algebra over a field $K$ is equivalent in
$Br(K)$ to a radical abelian algebra. This was conjectured in 1995 by Sonn and
the first author of this paper. As a consequence we obtain a characterization
of the projective Schur group by means of Galois cohomology. The conjecture was
known for algebras over fields of positive characteristic. In characteristic
zero the conjecture was known for algebras over fields with an Henselian
valuation over a local or global field of characteristic zero.
","[{""version"":""v1"",""created"":""Tue, 4 Jul 2006 11:38:02 GMT""}]","2016-08-16"
"math/0607088","Dirk Oliver Theis","Adam N. Letchford and Dirk Oliver Theis","Odd minimum cut sets and b-matchings revisited","6 pages. An extended abstract of an earlier version appeared in Proc.
  IPCO X (2004)",,,,"math.OC cs.DM",,"  The famous Padberg-Rao separation algorithm for b-matching polyhedra can be
implemented to run in O(n^2m log(n^2/m)) time in the uncapacitated case, and in
O(nm^2 log(n^2/m)) time in the capacitated case (where n is the number of
vertices and m is the number of edges of the underlying graph). We give a new
and simple algorithm for the capacitated case which can be implemented to run
in O(n^2m log(n^2/m)) time.
","[{""version"":""v1"",""created"":""Tue, 4 Jul 2006 11:39:28 GMT""}]","2011-12-08"
"math/0607089","Christian Houdre","S.Ekisheva, C. Houdr\'e","Transportation Distance and the Central Limit Theorem",,,,,"math.PR math.ST stat.TH",,"  For probability measures on a complete separable metric space, we present
sufficient conditions for the existence of a solution to the Kantorovich
transportation problem. We also obtain sufficient conditions (which sometimes
also become necessary) for the convergence, in transportation, of probability
measures when the cost function is continuous, non-decreasing and depends on
the distance. As an application, the CLT in the transportation distance is
proved for independent and some dependent stationary sequences.
","[{""version"":""v1"",""created"":""Tue, 4 Jul 2006 12:17:59 GMT""}]","2007-06-13"
"math/0607090","Erling Stormer","Erling Stormer","Multiplicative properties of positive maps","8 pages",,,,"math.OA",,"  Let $\phi$ be a positive unital normal map of a von Neumann algebra $M$ into
itself, and assume there is a family of normal $\phi$-invariant states which is
faithful on the von Neumann algebra generated by the image of $\phi$. It is
shown that there exists a largest Jordan subalgebra $C_\phi$ of $M$ such that
the restriction of $\phi$ to $C_\phi$ is a Jordan automorphhism, and each weak
limit point of $(\phi^n (a))$ for $a\in M$ belongs to $C_\phi$.
","[{""version"":""v1"",""created"":""Tue, 4 Jul 2006 12:21:09 GMT""}]","2007-05-23"
"math/0607091","Evgenii Feigin","B.Feigin, E.Feigin","Two dimensional current algebras and affine fusion product","22 pages",,,,"math.QA math.RT",,"  In this paper we study a family of commutative algebras generated by two
infinite sets of generators. These algebras are parametrized by Young diagrams.
We explain a connection of these algebras with the fusion product of integrable
irreducible representations of the affine $sl_2$ Lie algebra. As an application
we derive a fermionic formula for the character of the affine fusion product of
two modules. These fusion products can be considered as a simplest example of
the double affine Demazure modules.
","[{""version"":""v1"",""created"":""Tue, 4 Jul 2006 12:27:22 GMT""}]","2007-05-23"
"math/0607092","Rapport De Recherche Inria","Edmundo Rofman (INRIA Rocquencourt), Melina Rapacioli (CONICET),
  Vladimir Flores (CONICET)","The Genetic Code Degeneration I: Rules Governing the Code Degeneration
  and the Spatial Organization of the Codon Informative Properties",,,,,"math.OC q-bio.GN",,"  The present work is devoted to describe a set of rules explaining the
discriminating versus non-discriminating behavior of the di-basic stages and to
characterize the role of each base in determining such a behavior. Bases are
analyze as dual entities characterized by its chemical type and the number of H
bonds involved in the codon-anticodon interaction. A codon is characterized as
an asymmetric informative entity whose global informative capacity results from
the spatially organized combinatory of the 6 proper-ties assigned by the 3
bases.
","[{""version"":""v1"",""created"":""Tue, 4 Jul 2006 13:23:56 GMT""}]","2007-05-23"
"math/0607093","Eric M. Rains","Eric M. Rains","Limits of elliptic hypergeometric integrals","41 pages LaTeX. Minor stylistic changes, statement of Theorem 4.7
  fixed",,,,"math.CA",,"  In math.QA/0309252, the author proved a number of multivariate elliptic
hypergeometric integrals. The purpose of the present note is to explore more
carefully the various limiting cases (hyperbolic, trigonometric, rational, and
classical) that exist. In particular, we show (using some new estimates of
generalized gamma functions) that the hyperbolic integrals (previously treated
as purely formal limits) are indeed limiting cases. We also obtain a number of
new trigonometric (q-hypergeometric) integral identities as limits from the
elliptic level.
","[{""version"":""v1"",""created"":""Tue, 4 Jul 2006 14:02:36 GMT""},{""version"":""v2"",""created"":""Wed, 5 Sep 2007 20:50:39 GMT""}]","2007-09-05"
"math/0607094","Taras Panov","Mikiya Masuda and Taras Panov","Semifree circle actions, Bott towers, and quasitoric manifolds","22 pages, LaTEX; substantially revised","Sbornik Math. 199 (2008), no.7-8, 1201-1223","10.1070/SM2008v199n08ABEH003959","ITEP-TH-68/05","math.AT math.GT",,"  A Bott tower is the total space of a tower of fibre bundles with base CP^1
and fibres CP^1. Every Bott tower of height n is a smooth projective toric
variety whose moment polytope is combinatorially equivalent to an n-cube. A
circle action is semifree if it is free on the complement to fixed points. We
show that a (quasi)toric manifold (in the sense of Davis-Januszkiewicz) over an
n-cube with a semifree circle action and isolated fixed points is a Bott tower.
Then we show that every Bott tower obtained in this way is topologically
trivial, that is, homeomorphic to a product of 2-spheres. This extends a recent
result of Ilinskii, who showed that a smooth compact toric variety with a
semifree circle action and isolated fixed points is homeomorphic to a product
of 2-spheres, and makes a further step towards our understanding of a problem
motivated by Hattori's work on semifree circle actions. Finally, we show that
if the cohomology ring of a quasitoric manifold (or Bott tower) is isomorphic
to that of a product of 2-spheres, then the manifold is homeomorphic to the
product.
","[{""version"":""v1"",""created"":""Tue, 4 Jul 2006 14:23:31 GMT""},{""version"":""v2"",""created"":""Wed, 4 Apr 2007 10:46:40 GMT""}]","2015-06-26"
"math/0607095","Jose Javier","Jose Javier garcia Moreta","Chebyshev Partition function: A connection between Statistical Physics
  and Riemann Hypothesis","This submission has been withdrawn by arXiv administrators because of
  fraudulently claimed institutional affiliation and status",,,,"math.GM",,"  In this paper we present a method to obtain a possible self-adjoint
Hamiltonian operator so its energies satisfy Z(1/2+iE_n)=0, which is an
statement equivalent to Riemann Hypothesis, first we use the explicit formula
for the Chebyshev function Psi(x) and apply the change x=exp(u), after that we
consider an Statistical partition function involving the Chebyshev function and
its derivative so Z=Tr(exp(-BH), from the integral definition of the partition
function Z we try to obtain the Hamiltonian operator assuming that H=P^{2}+V(x)
by proposing a Non-linear integral equation involving Z(B=-iu) and V(x).
","[{""version"":""v1"",""created"":""Tue, 4 Jul 2006 14:53:00 GMT""},{""version"":""v2"",""created"":""Tue, 12 Sep 2006 18:16:00 GMT""},{""version"":""v3"",""created"":""Thu, 21 Sep 2006 08:09:46 GMT""},{""version"":""v4"",""created"":""Fri, 8 Dec 2006 16:17:03 GMT""},{""version"":""v5"",""created"":""Tue, 6 Mar 2007 11:11:56 GMT""}]","2009-09-29"
"nlin/0607002","Frank B\""ottcher","Frank Boettcher, Joachim Peinke, David Kleinhans, Rudolf Friedrich,
  Pedro G. Lind, Maria Haase","On the proper reconstruction of complex dynamical systems spoilt by
  strong measurement noise",,,"10.1103/PhysRevLett.97.090603",,"nlin.CD physics.data-an",,"  This article reports on a new approach to properly analyze time series of
dynamical systems which are spoilt by the simultaneous presence of dynamical
noise and measurement noise. It is shown that even strong external measurement
noise as well as dynamical noise which is an intrinsic part of the dynamical
process can be quantified correctly, solely on the basis of measured times
series and proper data analysis. Finally real world data sets are presented
pointing out the relevance of the new approach.
","[{""version"":""v1"",""created"":""Tue, 4 Jul 2006 03:50:26 GMT""}]","2009-11-11"
"nucl-th/0607002","Jirina Stone","J. R. Stone and P.-G. Reinhard","The Skyrme Interaction in finite nuclei and nuclear matter","71 pages, 22 figures. Accepted for publication in Prog.Part.Nucl.Phys","Prog.Part.Nucl.Phys.58:587-657,2007","10.1016/j.ppnp.2006.07.001",,"nucl-th",,"  Self-consistent mean-field models are a powerful tool in the investigation of
nuclear structure and low-energy dynamics. They are based on effective
energy-density functionals, often formulated in terms of effective
density-dependent nucleon-nucleon interactions. The free parameters of the
functional are adjusted to empirical data. A proper choice of these parameters
requires a comprehensive set of constraints covering experimental data on
finite nuclei, concerning static as well as dynamical properties, empirical
characteristics of nuclear matter, and observational information on
nucleosynthesis, neutron stars and supernovae. This work aims at a
comprehensive survey of the performance of one of the most successful
non-relativistic self-consistent method, the Skyrme-Hartree-Fock model (SHF),
with respect to these constraints. A full description of the Skyrme functional
is given and its relation to other effective interactions is discussed. The
validity of the application of SHF far from stability and in dense environments
beyond the nuclear saturation density is critically assessed. The use of SHF in
models extended beyond the mean field approximation by including some
correlations is discussed. Finally, future prospects for further development of
SHF towards a more consistent application of the existing and promisingly newly
developing constraints are outlined.
","[{""version"":""v1"",""created"":""Mon, 3 Jul 2006 20:37:43 GMT""}]","2008-11-26"
"nucl-th/0607003","Vladimir Dmitriev","V.F. Dmitriev and A.I. Milstein","Final State Interaction Effects in the $e^+e^-\to N\bar{N}$ Process near
  Threshold","references added, changes in the text according to referee comments","Nucl.Phys.Proc.Suppl.162:53-56,2006","10.1016/j.nuclphysbps.2006.09.063",,"nucl-th hep-ph",,"  We use the Paris nucleon-antinucleon optical potential for explanation of
experimental data in the process $e^+e^- \to p\bar p$ near threshold. It is
shown that the cross section and the electromagnetic form factors are very
sensitive to the parameters of the potential. It turns out that final-state
interaction due to slightly modified absorptive part of the potential allows us
to reproduce available experimental data. We also demonstrated that the cross
section in $n\bar{n}$ channel is larger than that in $p\bar{p}$ one, and their
ratio is almost energy independent up to 2.2 GeV.
","[{""version"":""v1"",""created"":""Tue, 4 Jul 2006 10:54:43 GMT""},{""version"":""v2"",""created"":""Thu, 14 Sep 2006 08:42:41 GMT""},{""version"":""v3"",""created"":""Thu, 19 Oct 2006 08:36:04 GMT""},{""version"":""v4"",""created"":""Thu, 29 Mar 2007 05:05:25 GMT""}]","2008-11-26"
"physics/0607012","Randall D. Peters","Randall D. Peters","Compton-Energy Scale of Friction Quantization","3 pages, no figures",,,,"physics.gen-ph",,"  Numerous different experiments by the author, approaching nearly two decades
of study, point strongly toward the possibility that friction operates around a
mesoscale quantum of energy having the value 11 pJ.
","[{""version"":""v1"",""created"":""Mon, 3 Jul 2006 16:26:38 GMT""}]","2007-05-23"
"physics/0607013","Marcus Mendenhall","Marcus H. Mendenhall","Fast Computation of Voigt Functions via Fourier Transforms","8 pages, 1 figure",,"10.1016/j.jqsrt.2006.11.014",,"physics.data-an physics.atom-ph physics.plasm-ph",,"  This work presents a method of computing Voigt functions and their
derivatives, to high accuracy, on a uniform grid. It is based on an adaptation
of Fourier-transform based convolution. The relative error of the result
decreases as the fourth power of the computational effort. Because of its use
of highly vectorizable operations for its core, it can be implemented very
efficiently in scripting language environments which provide fast vector
libraries. The availability of the derivatives makes it suitable as a function
generator for non-linear fitting procedures.
","[{""version"":""v1"",""created"":""Mon, 3 Jul 2006 16:49:48 GMT""},{""version"":""v2"",""created"":""Thu, 14 Dec 2006 19:33:39 GMT""}]","2007-05-23"
"physics/0607014","Raj Kumar Pan","Raj Kumar Pan and Sitabhra Sinha","Inverse cubic law of index fluctuation distribution in Indian markets","8 pages, 6 figures, final version, to appear in Physica A, 1 figure
  added, appendix elongated to describe TE statistics","Physica A, 387 (2008) 2055-2065","10.1016/j.physa.2007.11.031",,"physics.soc-ph cond-mat.other q-fin.ST",,"  One of the principal statistical features characterizing the activity in
financial markets is the distribution of fluctuations in market indicators such
as the index. While the developed stock markets, e.g., the New York Stock
Exchange (NYSE) have been found to show heavy-tailed return distribution with a
characteristic power-law exponent, the universality of such behavior has been
debated, particularly in regard to emerging markets. Here we investigate the
distribution of several indices from the Indian financial market, one of the
largest emerging markets in the world. We have used tick-by-tick data from the
National Stock Exchange (NSE), as well as, daily closing data from both NSE and
Bombay Stock Exchange (BSE). We find that the cumulative distributions of index
returns have long tails consistent with a power-law having exponent \alpha
\approx 3, at time-scales of both 1 min and 1 day. This ``inverse cubic law''
is quantitatively similar to what has been observed in developed markets,
thereby providing strong evidence of universality in the behavior of market
fluctuations.
","[{""version"":""v1"",""created"":""Mon, 3 Jul 2006 17:11:15 GMT""},{""version"":""v2"",""created"":""Wed, 20 Dec 2006 20:50:10 GMT""},{""version"":""v3"",""created"":""Wed, 19 Dec 2007 10:37:44 GMT""}]","2008-12-02"
"physics/0607015","Alexey Lyashenko","A. V. Lyashenko, A. Breskin, R. Chechik, J. F. C. A. Veloso, J. M. F.
  Dos Santos, F. D. Amaro","Advances in ion back-flow reduction in cascaded gaseous electron
  multipliers incorporating R-MHSP elements","17 pages, 9 figures, submitted to JINST","2006 JINST 1 P10004","10.1088/1748-0221/1/10/P10004",,"physics.ins-det",,"  A new concept is presented for the reduction of ion back-flow in GEM-based
cascaded gaseous electron multipliers, by incorporating Micro-Hole & Strip
Plate (MHSP) elements operating in reversed-bias mode (R-MHSP). About an order
of magnitude reduction in ion back-flow is achieved by diverting back-drifting
ions from their original path. A R-MHSP/2GEM/MHSP cascaded multiplier operated
at total gain of ~1.5*10^5 yielded ion back-flow fractions of 0.0015 and
0.0004, at drift fields of 0.5 and 0.1 kV/cm, respectively. A 2R-MHSP/MHSP
cascaded multiplier operated at a total gain of ~10^5, yielded an ion back-flow
fraction of 0.003. We discuss the concept for trapping back-flowing ions in
these cascaded multipliers and the relevance to gaseous photomultiplier and TPC
applications; directions for further future developments are outlined.
","[{""version"":""v1"",""created"":""Mon, 3 Jul 2006 22:20:04 GMT""}]","2007-05-23"
"physics/0607016","Satoshi Sunada","Satoshi Sunada and Takahisa Harayama","Sagnac effect in resonant microcavities","4 pages, 3 figures","Phys. Rev. A, 74 (2006), 021801(R)","10.1103/PhysRevA.74.021801",,"physics.optics",,"  The Sagnac effect in two dimensional (2D) resonant microcavities is studied
theoretically and numerically. The frequency shift due to the Sagnac effect
occurs as a threshold phenomenon for the angular velocity in a rotating
microcavity. Above the threshold, the eigenfunctions of a rotating microcavity
become rotating waves while they are standing waves below the threshold.
","[{""version"":""v1"",""created"":""Tue, 4 Jul 2006 01:51:59 GMT""}]","2009-11-11"
"physics/0607017","Akinbo Ojo Dr","Akinbo Ojo","Creating a universe from thermodynamic thought experiments I","8 pages, no figures",,,,"physics.gen-ph",,"  We describe a thought experiment using an isolated system of known parameters
and assuming the correctness of Clausius and Boltzmann descriptions of entropy.
The experiment produced an astronomical increase in the number of possible ways
the system can be arranged and inescapably in achieving this, an increase in
the compartment volume of the system. The result may possibly be of
significance to cosmology.
","[{""version"":""v1"",""created"":""Tue, 4 Jul 2006 04:31:44 GMT""}]","2007-05-23"
"physics/0607018","Evangelos Matsinos","Evangelos Matsinos and Wolfgang Kaissl","The geometric calibration of cone-beam imaging and delivery systems in
  radiation therapy","18 pages, 5 figures",,,,"physics.med-ph",,"  We propose a method to achieve the geometric calibration of cone-beam imaging
and delivery systems in radiation therapy; our approach applies to devices
where an X-ray source and a flat-panel detector, facing each other, move in
circular orbits around the irradiated object. In order to extract the
parameters of the geometry from the data, we use a light needle phantom which
is easy to manufacture. A model with ten free parameters (spatial lengths and
distortion angles) has been put forth to describe the geometry and the
mechanical imperfections of the units being calibrated; a few additional
parameters are introduced to account for residual effects (small effects which
lie beyond our model). The values of the model parameters are determined from
one complete scan of the needle phantom via a robust optimisation scheme. The
application of this method to two sets of five counterclockwise (ccw) and five
clockwise (cw) scans yielded consistent and reproducible results. A number of
differences have been observed between the ccw and cw scans, suggesting a
dissimilar behaviour of the devices calibrated in the two rotation modes. The
description of the geometry of the devices was achieved at the sub-pixel level.
","[{""version"":""v1"",""created"":""Tue, 4 Jul 2006 07:19:40 GMT""}]","2007-05-23"
"physics/0607019","Julius Vanko","Julius Vanko, Miroslav Sukenik, Jozef Sima","An Approach to Relate the Weak and Gravitational Interactions","6 pages",,,,"physics.gen-ph",,"  Stemming from simple postulates of nondecelerative nature of the universe
expansion and Vaidya metric application, the paper offers some dependences and
relations between the gravity and weak interactions. It presents a mode of
independent determination of the mass of vector bosons Z and W, and it derives
the time of separation of electromagnetic and weak interactions. Comparisons of
theoretically derived and experimentally obtained data indicate the relevancy
of the used mode and provide a hint for further investigation.
","[{""version"":""v1"",""created"":""Tue, 4 Jul 2006 08:25:29 GMT""}]","2007-05-23"
"physics/0607020","Pierre-Henri Chavanis","P.H. Chavanis","Phase separation of bacterial colonies in a limit of high degradation.
  Analogy with Jupiter's great red spot",,"Eur. Phys. J. B, 54, 525 (2006)","10.1140/epjb/e2007-00021-y",,"physics.bio-ph",,"  We discuss the structure of the equilibrium states of a regularized
Keller-Segel model describing the chemotaxis of bacterial populations. We
consider the limit of high degradation of the secreted chemical where
analytical results can be obtained. Below a critical effective temperature, the
system experiences a second order phase transition from a homogeneous phase to
an inhomogeneous phase formed by two domains with uniform concentration
separated by a thin interface (domain wall). We study the properties of the
interface and determine the bifurcation between a circular shape (spot) and a
stripe as a function of the control parameters. We show the analogy with the
structure of Jupiter's Great red spot which also consists of two phases with
uniform potential vorticity separated by a thin annular jet.
","[{""version"":""v1"",""created"":""Tue, 4 Jul 2006 11:49:39 GMT""}]","2009-11-11"
