"hep-ph/0607152","Santi Peris","Maarten Golterman (UAB, IFAE and SFSU) and Santi Peris (UAB and IFAE)","On the relation between low-energy constants and resonance saturation","15 pages, one figure","Phys.Rev.D74:096002,2006","10.1103/PhysRevD.74.096002",,"hep-ph hep-lat nucl-th",,"  Although there are phenomenological indications that the low-energy constants
in the chiral lagrangian may be understood in terms of a finite number of
hadronic resonances, it remains unclear how this follows from QCD. One of the
arguments usually given is that low-energy constants are associated with chiral
symmetry breaking, while QCD perturbation theory suggests that at high energy
chiral symmetry is unbroken, so that only low-lying resonances contribute to
the low-energy constants. We revisit this argument in the limit of large Nc,
discussing its validity in particular for the low-energy constant L8, and
conclude that QCD may be more subtle that what this argument suggests. We
illustrate our considerations in a simple Regge-like model which also applies
at finite Nc.
","[{""version"":""v1"",""created"":""Thu, 13 Jul 2006 13:05:52 GMT""}]","2008-11-26"
"hep-ph/0607153","Gavin Salam","Gavin P. Salam","Recent developments in perturbative QCD","9 pages, 1 figure. Invited talk at the XIV International Workshop on
  Deep Inelastic Scattering (DIS 2006), April 2006, Tsukuba, Japan",,"10.1142/9789812706706_0006","LPTHE-P06-05","hep-ph",,"  A brief overview of some recently active topics in perturbative QCD,
including: string-inspired recursion techniques at tree level; recursion
approaches and automation of standard techniques for 1-loop calculations; the
status of NNLO jet calculations; and non-trivial structures that appear in
higher-order calculations.
","[{""version"":""v1"",""created"":""Thu, 13 Jul 2006 13:17:21 GMT""}]","2017-08-23"
"hep-ph/0607154","Chris Korthals Altes","C. P. Korthals Altes","Magnetic monopoles in hot QCD","7 pages, two figures, talk given at Continuous Advances in QCD,
  Minneapolis, May 2006",,"10.1142/9789812708267_0031",,"hep-ph",,"  In this talk we review how a dilute gas of magnetic monopoles in the adjoint
describes the spatial k-Wilson loops. We formulate an effective theory from
  $S_{MQCD}$ by integrating out dof's down to scales in between the magnetic
screening mass and the string tension and relate the 3d pressure and the string
tension. Lattice data are consistent with the gas being dilute for all
temperatures.
","[{""version"":""v1"",""created"":""Thu, 13 Jul 2006 15:28:30 GMT""}]","2017-08-23"
"hep-th/0607081","Mohammad Ansari","Mohammad H. Ansari","Spectroscopy of a canonically quantized horizon","49 pages, 8 figures. Published in section: Field Theory And
  Statistical Systems","Nucl.Phys.B783:179-212,2007","10.1016/j.nuclphysb.2007.01.009",,"hep-th gr-qc",,"  Deviations from Hawking's thermal black hole spectrum, observable for
macroscopic black holes, are derived from a model of a quantum horizon in loop
quantum gravity. These arise from additional area eigenstates present in
quantum surfaces excluded by the classical isolated horizon boundary
conditions. The complete spectrum of area unexpectedly exhibits evenly spaced
symmetry. This leads to an enhancement of some spectral lines on top of the
thermal spectrum. This can imprint characteristic features into the spectra of
black hole systems. It most notably gives the signature of quantum gravity
observability in radiation from primordial black holes, and makes it possible
to test loop quantum gravity with black holes well above Planck scale.
","[{""version"":""v1"",""created"":""Wed, 12 Jul 2006 19:52:11 GMT""},{""version"":""v2"",""created"":""Thu, 13 Jul 2006 14:28:25 GMT""},{""version"":""v3"",""created"":""Wed, 6 Dec 2006 17:32:25 GMT""},{""version"":""v4"",""created"":""Wed, 9 Apr 2008 00:30:52 GMT""}]","2008-11-26"
"hep-th/0607082","Stephen D. H. Hsu","Stephen D.H. Hsu","Physical limits on information processing","2 pages, revtex, version to appear in Physics Letters B (reference
  added)","Phys.Lett. B641 (2006) 99-100","10.1016/j.physletb.2006.08.018",,"hep-th gr-qc hep-ph quant-ph",,"  We derive a fundamental upper bound on the rate at which a device can process
information (i.e., the number of logical operations per unit time), arising
from quantum mechanics and general relativity. In Planck units a device of
volume V can execute no more than the cube root of V operations per unit time.
We compare this to the rate of information processing performed by nature in
the evolution of physical systems, and find a connection to black hole entropy
and the holographic principle.
","[{""version"":""v1"",""created"":""Wed, 12 Jul 2006 20:06:38 GMT""},{""version"":""v2"",""created"":""Fri, 4 Aug 2006 21:00:25 GMT""}]","2009-11-11"
"hep-th/0607083","Jo\~ao Penedones","Lorenzo Cornalba, Miguel S. Costa, Joao Penedones and Pedro Vieira","From Fundamental Strings to Small Black Holes","36 pages, 4 figures, argument about minimally coupled scalar
  absorption cross section clarified","JHEP0612:023,2006","10.1088/1126-6708/2006/12/023","LPTENS-06/25, ROM2F/2006/16","hep-th",,"  We give evidence in favour of a string/black hole transition in the case of
BPS fundamental string states of the Heterotic string. Our analysis goes beyond
the counting of degrees of freedom and considers the evolution of dynamical
quantities in the process. As the coupling increases, the string states
decrease their size up to the string scale when a small black hole is formed.
We compute the absorption cross section for several fields in both the black
hole and the perturbative string phases. At zero frequency, these cross
sections can be seen as order parameters for the transition. In particular, for
the scalars fixed at the horizon the cross section evolves to zero when the
black hole is formed.
","[{""version"":""v1"",""created"":""Wed, 12 Jul 2006 20:49:16 GMT""},{""version"":""v2"",""created"":""Mon, 21 Aug 2006 03:50:15 GMT""},{""version"":""v3"",""created"":""Tue, 12 Dec 2006 18:15:15 GMT""}]","2008-11-26"
"hep-th/0607084","Nobuyoshi Ohta","Kei-ichi Maeda, Nobuyoshi Ohta and Makoto Tanabe","Supersymmetric Rotating Black Hole in a Compactified Spacetime","7 pages, 3 figures; v2: comparison with black ring removed, detailed
  discussion of rotation added, refs. added, v3: minor corrections, version to
  appear in PRD","Phys.Rev. D74 (2006) 104002","10.1103/PhysRevD.74.104002","KU-TP 003, WU-AP/256/06","hep-th",,"  We construct a supersymmetric rotating black hole with asymptotically flat
four-dimensional spacetime times a circle, by superposing an infinite number of
BMPV black hole solutions at the same distance in one direction. The near
horizon structure is the same as that of the five-dimensional BMPV black hole.
The rotation of this black hole can exceed the Kerr bound in general relativity
($q\equiv a/G_4 M=1$), if the size is small.
","[{""version"":""v1"",""created"":""Thu, 13 Jul 2006 13:34:08 GMT""},{""version"":""v2"",""created"":""Wed, 18 Oct 2006 14:38:43 GMT""},{""version"":""v3"",""created"":""Mon, 30 Oct 2006 14:11:08 GMT""}]","2009-11-11"
"math-ph/0607025","Michael Aizenman","Michael Aizenman","Perspectives in Statistical Mechanics","Dedicated to Barry Simon on the occasion of his sixtieth birthday","Spectral Theory and Mathematical Physics: B. Simon Festschrift, F.
  Gesztesy, P. Deift, C. Galvez, P.Perry, W. Schlag (eds.) Proceedings of
  Symposia in Pure Mathematics, vol. 76.1 (AMS, 2007).",,,"math-ph math.MP",,"  Without attempting to summarize the vast field of statistical mechanics, we
briefly mention some of the progress that was made in areas which have enjoyed
Barry Simon's interests. In particular, we focus on rigorous non-perturbative
results which provide insight on the spread of correlations in Gibbs
equilibrium states and yield information on phase transitions and critical
phenomena. Briefly mentioned also are certain spinoffs, where ideas which have
been fruitful within the context of statistical mechanics proved to be of use
in other areas, and some recent results which relate to previously open
questions and conjectures.
","[{""version"":""v1"",""created"":""Wed, 12 Jul 2006 16:57:23 GMT""}]","2008-09-29"
"math-ph/0607026","Hermann Schulz-Baldes","Hermann Schulz-Baldes","Lyapunov exponents at anomalies of SL(2,R)-actions",,"Operator Theory: Advances and Applications, OTAMP Proceedings
  2002, Bedlewo, Birkhaeuser",,,"math-ph math.MP",,"  Anomalies are known to appear in the perturbation theory for the
one-dimensional Anderson model. A systematic approach to anomalies at critical
points of products of random matrices is developed, classifying and analysing
their possible types. The associated invariant measure is calculated formally.
For an anomaly of so-called second degree, it is given by the groundstate of a
certain Fokker-Planck equation on the unit circle. The Lyapunov exponent is
calculated to lowest order in perturbation theory with rigorous control of the
error terms.
","[{""version"":""v1"",""created"":""Wed, 12 Jul 2006 16:19:10 GMT""}]","2007-05-23"
"math-ph/0607027","Hermann Schulz-Baldes","Hermann Schulz-Baldes","Low density expansion for Lyapunov exponents",,"Mathematical Physics of Quantum Mechanics, Eds. Asch, Joye,
  Springer 2006","10.1007/3-540-34273-7_25",,"math-ph math.MP",,"  In some quasi-one-dimensional weakly disordered media, impurities are large
and rare rather than small and dense. For an Anderson model with a low density
of strong impurities, a perturbation theory in the impurity density is
developed for the Lyapunov exponent and the density of states. The Lyapunov
exponent grows linearly with the density. Anomalies of the Kappus-Wegner type
appear for all rational quasi-momenta even in lowest order perturbation theory.
","[{""version"":""v1"",""created"":""Wed, 12 Jul 2006 16:23:16 GMT""}]","2015-06-26"
"math-ph/0607028","Hermann Schulz-Baldes","Jeffrey Schenker, Hermann Schulz-Baldes","Gaussian fluctuations for random matrices with correlated entries",,"Inter. Math. Res. Not. 2007 (2007), ID rmn047, 36 pages","10.1093/imrn/rnm047",,"math-ph math.MP",,"  For random matrix ensembles with non-gaussian matrix elements that may
exhibit some correlations, it is shown that centered traces of polynomials in
the matrix converge in distribution to a Gaussian process whose covariance
matrix is diagonal in the basis of Chebyshev polynomials. The proof is
combinatorial and adapts Wigner's argument showing the convergence of the
density of states to the semicircle law.
","[{""version"":""v1"",""created"":""Wed, 12 Jul 2006 16:25:45 GMT""}]","2009-04-24"
"math-ph/0607029","Hermann Schulz-Baldes","Svetlana Jitomirskaya, Hermann Schulz-Baldes","Upper bounds on wavepacket spreading for random Jacobi matrices","final version, to appear in CMP","Commun. Math Phys. 273, 601-618 (2007)","10.1007/s00220-007-0252-0",,"math-ph math.MP",,"  A method is presented for proving upper bounds on the moments of the position
operator when the dynamics of quantum wavepackets is governed by a random
(possibly correlated) Jacobi matrix. As an application, one obtains sharp upper
bounds on the diffusion exponents for random polymer models, coinciding with
the lower bounds obtained in a prior work. The second application is an
elementary argument (not using multiscale analysis or the Aizenman-Molchanov
method) showing that under the condition of uniformly positive Lyapunov
exponents, the moments of the position operator grow at most logarithmically in
time.
","[{""version"":""v1"",""created"":""Wed, 12 Jul 2006 16:28:39 GMT""},{""version"":""v2"",""created"":""Thu, 15 Feb 2007 09:53:13 GMT""}]","2016-10-28"
"math/0607270","Markus Rosellen","Markus Rosellen","A Course in Vertex Algebra","book, 204+x pages, comments are welcome",,,,"math.QA math.RA",,"  This book offers an introduction to vertex algebra based on a new approach.
The new approach says that a vertex algebra is an associative algebra such that
the underlying Lie algebra is a vertex Lie algebra. In particular, vertex
algebras can be formulated in terms of a single multiplication and they behave
like associative algebras with respect to it.
  Chapter 1 is the introduction. In chapter 2 we discuss many examples of
vertex Lie algebras and we show that vertex Lie algebras form a full
subcategory of the category of ""local"" Lie algebras. In chapter 3 we introduce
associative, commutative, and Poisson vertex algebras and vertex algebra
modules and we show that graded associative vertex algebras form a full
subcategory of the category of ""local"" associative algebras. In chapter 4 we
give a systematic presentation of the vertex algebra identities, proving in
particular the equivalence of various axiom systems, and we use filtrations to
prove results about generating subspaces with the PBW-property, with and
without repeats. In chapter 5 we explain three constructions of the enveloping
vertex algebra of a vertex Lie algebra and prove the PBW-theorem. In chapter 6
we prove the Zhu correspondence between N-graded vertex algebra modules and
modules over the Zhu algebra.
","[{""version"":""v1"",""created"":""Wed, 12 Jul 2006 19:06:30 GMT""}]","2007-05-23"
"math/0607274","Alexander I. Suciu","Daniel C Cohen, Alexander I Suciu","The boundary manifold of a complex line arrangement","This is the version published by Geometry & Topology Monographs on 22
  February 2008","Geom. Topol. Monogr. 13 (2008) 105-146","10.2140/gtm.2008.13.105",,"math.GT math.AG","http://arxiv.org/licenses/nonexclusive-distrib/1.0/","  We study the topology of the boundary manifold of a line arrangement in CP^2,
with emphasis on the fundamental group G and associated invariants. We
determine the Alexander polynomial Delta(G), and more generally, the twisted
Alexander polynomial associated to the abelianization of G and an arbitrary
complex representation. We give an explicit description of the unit ball in the
Alexander norm, and use it to analyze certain Bieri-Neumann-Strebel invariants
of G. From the Alexander polynomial, we also obtain a complete description of
the first characteristic variety of G. Comparing this with the corresponding
resonance variety of the cohomology ring of G enables us to characterize those
arrangements for which the boundary manifold is formal.
","[{""version"":""v1"",""created"":""Wed, 12 Jul 2006 17:40:45 GMT""},{""version"":""v2"",""created"":""Thu, 21 Jun 2007 02:27:20 GMT""},{""version"":""v3"",""created"":""Fri, 3 Apr 2009 19:34:38 GMT""}]","2009-04-03"
"math/0607286","Kalle Karu","Kalle Karu","Ehrhart analogue of the h-vector","7 pages, Snowbird talk",,,,"math.AG math.CO",,"  We consider a formula of Stanley that expresses the Ehrhart generating
polynomial of a polyhedral complex in terms of the h-polynomials of toric
varieties. We prove that the coefficients in this expression are all
non-negative and show that these coefficients can be found using the
decomposition theorem in intersection cohomology.
","[{""version"":""v1"",""created"":""Wed, 12 Jul 2006 18:40:42 GMT""}]","2007-05-23"
"math/0607297","Thomas Huettemann","Thomas Huettemann","On a theorem of Brion","11 pages, 3 figures; v2: references updated, minor typos corrected",,,,"math.CO math.GN",,"  We give an elementary geometric re-proof of a formula discovered by Michel
Brion as well as two variants thereof. A subset of R^n gives rise to a formal
Laurent series with monomials corresponding to lattice points in the set. Under
suitable hypotheses, these series represent rational functions. We will prove
formulae relating the rational function of a lattice polytope P to the sum of
rational functions corresponding to the supporting cones subtended at the
vertices of P. The exposition should be suitable for everyone with a little
background in topology.
","[{""version"":""v1"",""created"":""Wed, 12 Jul 2006 16:25:13 GMT""},{""version"":""v2"",""created"":""Tue, 25 Jul 2006 15:19:07 GMT""}]","2007-05-23"
"math/0607298","S?cherre Vincent","Vincent Secherre, Shaun Stevens","Representations lisses de GL(m,D), IV : representations supercuspidales","66 pages, French",,,,"math.RT math.NT",,"  Let F be a non Archimedean locally compact field and let D be a central
F-division algebra. We prove that any positive level supercuspidal irreducible
representation of the group GL(m,D) is compactly induced from a representation
of a compact mod center open subgroup of GL(m,D). More precisely, we prove that
such representations contain a maximal simple type.
","[{""version"":""v1"",""created"":""Wed, 12 Jul 2006 17:17:25 GMT""}]","2007-05-23"
"math/0607299","Nico Spronk","Nico Spronk","Operator space structure on Feichtinger's Segal algebra","25 pages. Proof of Theorem 3.1 repaired. DOI included","J. Funct. Anal. 248 (2007), no. 1, 152--174.","10.1016/j.jfa.2007.03.028",,"math.FA math.OA",,"  We extend the definition, from the class of abelian groups to a general
locally compact group G, of Feichtinger's remarkable Segal algebra S_0(G). In
order to obtain functorial properties for non-abelain groups, in particular a
tensor product formula, we endow S_0(G) with an operator space structure. With
this structure S_0(G) is simultaneously an operator Segal algebra of the
Fourier algebra A(G), and of the group algebra L^1(G). We show that this
operator space structure is consistent with the major functorial properties:
(i) S_0(G)\hat{\otimes}S_0(H)=S_0(G\times H) completely isomorphically
(operator projective tensor product), if H is another locally compact group;
(ii) the restriction map u\mapsto u|_H:S_0(G)\to S_0(H) is completely
surjective, if H is a closed subgroup; and (iii) T_N:S_0(G)\to S_0(G/N) is
completely surjective, where N is a normal subgroup and T_N u(sN)=\int_N
u(sn)dn. We also show that S_0(G) is an invariant for G when it is treated
simultaneously as a pointwise algebra and a convolutive algebra.
","[{""version"":""v1"",""created"":""Wed, 12 Jul 2006 19:11:45 GMT""},{""version"":""v2"",""created"":""Tue, 29 May 2007 19:08:17 GMT""}]","2008-05-23"
"math/0607300","Sunil Chebolu","Sunil K. Chebolu","Classifying subcategories of modules over a PID","6 pages","JP Journal of Algebra, Number Theory and Applications 2 (2009) 211
  - 220",,,"math.AC",,"  Let $R$ be a commutative ring. A full additive subcategory $\C$ of
$R$-modules is triangulated if whenever two terms of a short exact sequence
belong to $\C$, then so does the third term. In this note we give a
classification of triangulated subcategories of finitely generated modules over
a principal ideal domain. As a corollary we show that in the category of
finitely generated modules over a PID, thick subcategories (triangulated
subcategories closed under direct summands), wide subcategories (abelian
subcategories closed under extensions) and Serre subcategories (wide
subcategories closed under kernels) coincide and correspond to specialisation
closed subsets of $\Spec(R)$.
","[{""version"":""v1"",""created"":""Wed, 12 Jul 2006 19:17:28 GMT""}]","2009-12-03"
"math/0607301","John G. Ratcliffe","John Ratcliffe and Steven Tschantz","Chordal Coxeter Groups",,,,,"math.GR",,"  A solution of the isomorphism problem is presented for the class of Coxeter
groups W that have a finite set of Coxeter generators S such that the
underlying graph of the presentation diagram of the system (W,S) has the
property that every cycle of length at least four has a cord. As an
application, we construct counterexamples to two main conjectures concerning
the isomorphism problem for Coxeter groups.
","[{""version"":""v1"",""created"":""Wed, 12 Jul 2006 19:55:49 GMT""},{""version"":""v2"",""created"":""Wed, 12 Jul 2006 20:42:26 GMT""}]","2007-05-23"
"math/0607302","Jackson Chan","Jackson Chan, Michael Goldstein, Wilhelm Schlag","On non-perturbative Anderson localization for C^\alpha potentials
  generated by shifts and skew-shifts","39 pages",,,,"math.DS math-ph math.MP",,"  In this paper we address the question of proving Anderson localization (AL)
for the operator [H(x,\omega)\psi](n) := - \vp(n+1) - \vp(n-1) +
V\bigl(T^n_\omega x\bigr)\psi(n), n\in\mathbb Z where T:\tor^2\to\tor^2 is
either the shift or the skew-shift and V is only C^\alpha(\tor^2) for some
\alpha>0. We show that under the assumption of positive Lyapunov exponents,
(AL) takes place for a.e. frequency, phase, and energy.
","[{""version"":""v1"",""created"":""Thu, 13 Jul 2006 01:34:19 GMT""},{""version"":""v2"",""created"":""Fri, 28 Jul 2006 12:39:27 GMT""}]","2007-05-23"
"math/0607303","Zhixiang Wu","Wu Zhixiang","Construct Weak Hopf Algebras By Using Borcherds Matrix",,,,,"math.QA math.RT",,"  We define a new kind quantized enveloping algebra of a generalized Kac-Moody
algebra ${\mathcal G}$ by adding a new generator $J$ satisfying $J^m=J$ for
some integer $m$. We denote this algebra by $wU_q^{\tau}({\mathcal G})$. This
algebra is a weak Hopf algebra if and only if $m=2,3$. In general, it is a
bialgebra, and contains a Hopf subalgebra. This Hopf subalgebra is isomorphic
to the usually quantum envelope algebra $U_q({\mathcal G})$ of a generalized
Kac-Moody algebra ${\mathcal G}$.
","[{""version"":""v1"",""created"":""Thu, 13 Jul 2006 02:33:47 GMT""}]","2007-05-23"
"math/0607304","Viktor Schroeder","Viktor Schroeder","Quasi-metric and metric spaces",,,,,"math.MG",,"  We give a short review of a construction of Frink to obtain a metric space
from a quasi-metric space. By an example we illustrate the limits of the
construction.
","[{""version"":""v1"",""created"":""Thu, 13 Jul 2006 08:04:30 GMT""}]","2007-05-23"
"math/0607305","Changxing Miao","Jia Yuan and Junyong Zhang","Extensions of Hardy inequality","6 pages",,,,"math.AP",,"  In this paper we prove sharp Hardy inequalities by using Maximal function
theory. Our results improve and extend the well-known results of G.Hardy
\cite{Ha04}, T.Cazenave \cite {Ca03}, J.-Y.Chemin\cite {Ch06} and T.Tao\cite
{TT06}.
","[{""version"":""v1"",""created"":""Thu, 13 Jul 2006 10:46:06 GMT""}]","2007-05-23"
"math/0607306","Margherita Barile Prof.","Margherita Barile","On the arithmetical rank of the edge ideals of forests",,,,,"math.AC math.CO",,"  We show that for the edge ideals of a certain class of forests, the
arithmetical rank equals the projective dimension.
","[{""version"":""v1"",""created"":""Thu, 13 Jul 2006 12:25:32 GMT""},{""version"":""v2"",""created"":""Fri, 22 Sep 2006 15:54:17 GMT""},{""version"":""v3"",""created"":""Tue, 23 Jan 2007 11:05:46 GMT""}]","2007-05-23"
"math/0607307","Turgay Bayraktar","Turgay Bayraktar","A note on composition operators on Hardy spaces of the polydisk","8 pages",,,,"math.CV math.FA",,"  In this work, we prove that weak compactness of composition operator on
$H^{1}(U^{n})$ coincides with its compactness. We also characterize bounded and
compact composition operators on $H^{1}(U^{n}).$\
","[{""version"":""v1"",""created"":""Thu, 13 Jul 2006 13:01:26 GMT""},{""version"":""v2"",""created"":""Tue, 25 Jul 2006 16:19:07 GMT""}]","2007-05-23"
"math/0607308","Wouter Castryck","Wouter Castryck, Jan Denef, Frederik Vercauteren","Computing Zeta Functions of Nondegenerate Curves","41 pages",,,,"math.NT math.AG",,"  In this paper we present a p-adic algorithm to compute the zeta function of a
nondegenerate curve over a finite field using Monsky-Washnitzer cohomology. The
paper vastly generalizes previous work since all known cases, e.g.
hyperelliptic, superelliptic and C_{ab} curves, can be transformed to fit the
nondegenerate case. For curves with a fixed Newton polytope, the property of
being nondegenerate is generic, so that the algorithm works for almost all
curves with given Newton polytope. For a genus g curve over F_{p^n}, the
expected running time is O(n^3g^6 + n^2g^{6.5}), whereas the space complexity
amounts to O(n^3g^4), assuming p is fixed.
","[{""version"":""v1"",""created"":""Thu, 13 Jul 2006 13:18:56 GMT""},{""version"":""v2"",""created"":""Wed, 19 Jul 2006 12:52:49 GMT""},{""version"":""v3"",""created"":""Mon, 8 Jan 2007 16:13:57 GMT""}]","2007-05-23"
"math/0607309","Margaret Combs","William Beckner","Weighted inequalities and Stein-Weiss potentials","version 2, corrected misprint (4 January 2007); AMSLaTeX, 13 pages",,,,"math.AP",,"  Sharp extensions of Pitt's inequality and bounds for Stein-Weiss fractional
integrals are obtained that incorporate gradient forms and vector-valued
operators. Such results include Hardy-Rellich inequalities.
","[{""version"":""v1"",""created"":""Thu, 13 Jul 2006 13:27:49 GMT""},{""version"":""v2"",""created"":""Thu, 4 Jan 2007 14:42:00 GMT""}]","2007-05-23"
"math/0607310","Marta Sanz-Sol\'e","Marta Sanz-Sol\'e and Iv\'an Torrecilla-Tarantino","Probability density for a hyperbolic SPDE with time dependent
  coefficients","15 pages",,,"Preprint IMUB 382","math.PR math.AP",,"  We prove the existence and smoothness of density for the solution of a
hyperbolic SPDE with free term coefficients depending on time, under
hypoelliptic non degeneracy conditions. The result extends those proved in
Cattiaux and Mesnager, PTRF 2002, to an infinite dimensional setting.
","[{""version"":""v1"",""created"":""Thu, 13 Jul 2006 13:29:20 GMT""}]","2007-05-23"
