"astro-ph/0607239","Leonidas Moustakas","L. A. Moustakas (1), P. J. Marshall (2), J. A. Newman (3, 11), A. L.
  Coil (4, 12), M. C. Cooper (5), M. Davis (5), C. D. Fassnacht (6), P.
  Guhathakurta (8), A. Hopkins (9), A. Koekemoer (10), N. P. Konidaris (8), J.
  M. Lotz (11, 13) and C. N. A. Willmer (4) ((1) JPL/Caltech, (2) KIPAC, (3)
  INPA, LBNL, (4) Univ. of Arizona, (5) U.C. Berkeley, (6) U.C. Davis, (7) U.C.
  Berkeley, (8) U.C.O./Lick Obs., (9) Univ. of Sydney, (10) STScI, (11) NOAO
  (12) Hubble Fellow, (13) Goldberg Fellow)","A Strong-Lens Survey in AEGIS: the influence of large scale structure","ApJ Letters, submitted. Part of the AEGIS ApJL Special Issue. 4
  Figures, 1 Table. For a version with full-resolution figures, please see
  http://www.slac.stanford.edu/~pjm/HAGGLeS/astroph/legs.pdf",,"10.1086/517930",,"astro-ph",,"  We report on the results of a visual search for galaxy-scale strong
gravitational lenses over 650 arcmin^2 of HST/ACS imaging in the DEEP2-EGS
field. In addition to a previously-known Einstein Cross (the ""Cross,"" HST
J141735+52264, with z_lens=0.8106 and a published z_source=3.40), we identify
two new strong galaxy-galaxy lenses with multiple extended arcs. The first, HST
J141820+52361 (the ``Dewdrop''; z_lens=0.5798, lenses two distinct extended
sources into two pairs of arcs z_source=0.while), 9818 the second, HST
J141833+52435 (the ``Anchor''; z_lens=0.4625), produces a single pair of arcs
(source redshift not yet known). All three definite lenses are fit well by
simple singular isothermal ellipsoid models including external shear. Using the
three-dimensional line-of-sight (LOS) information on galaxies from the DEEP2
data, we calculate the convergence and shear contributions, assuming singular
isothermal sphere halos truncated at 200 h^-1 kpc. These are also compared
against three-dimensional local-density estimates. We find that even strong
lenses in demonstrably underdense local environments may be considerably
affected by LOS contributions, which in turn, may be underestimates of the
effect of large scale structure.
","[{""version"":""v1"",""created"":""Wed, 12 Jul 2006 19:51:52 GMT""},{""version"":""v2"",""created"":""Wed, 12 Jul 2006 22:24:09 GMT""}]","2009-11-11"
"astro-ph/0607240","Prasenjit Saha","P. Saha, J. Coles, A.V. Maccio' & L.L.R. Williams","The Hubble time inferred from 10 time-delay lenses","To appear in ApJ Lett","Astrophys.J.650:L17-L20,2006","10.1086/507583",,"astro-ph",,"  We present a simultaneous analysis of 10 galaxy lenses having time-delay
measurements. For each lens we derive a detailed free-form mass map, with
uncertainties, and with the additional requirement of a shared value of the
Hubble parameter across all the lenses. We test the prior involved in the lens
reconstruction against a galaxy-formation simulation. Assuming a concordance
cosmology, we obtain 1/H_0 = 13.5 (+2.5/-1.3) Gyr
","[{""version"":""v1"",""created"":""Wed, 12 Jul 2006 17:01:57 GMT""}]","2009-11-11"
"astro-ph/0607244","Alexander Friedland","Alexander Friedland, Andrei Gruzinov","Neutrino signatures of supernova turbulence","5 pages, 1 figure",,,"LA-UR-06-2202","astro-ph hep-ph",,"  Convection that develops behind the shock front during the first second of a
core-collapse supernova explosion is believed to play a crucial role in the
explosion mechanism. We demonstrate that the resulting turbulent density
fluctuations may be directly observable in the neutrino signal starting at t>~
3-4 s after the onset of the explosion. The effect comes from the modulation of
the MSW flavor transformations by the turbulent density fluctuations. We derive
a simple and general criterion for neutrino flavor depolarization in a
Kolmogorov-type turbulence and apply it to the turbulence seen in modern
numerical simulations. The turbulence casts a ""shadow"", by making other
features, such as the shock front, unobservable in the density range covered by
the turbulence.
","[{""version"":""v1"",""created"":""Wed, 12 Jul 2006 19:16:59 GMT""}]","2007-05-23"
"astro-ph/0607261","Anwesh Mazumdar","Anwesh Mazumdar, Maryline Briquet, Maarten Desmet, Conny Aerts","An asteroseismic study of the beta Cephei star beta Canis Majoris","Accepted for publication in A&A",,"10.1051/0004-6361:20064980",,"astro-ph",,"  We present the results of a detailed analysis of 452 ground-based
high-resolution high S/N spectroscopic measurements spread over 4.5 years for
beta Canis Majoris with the aim to determine the pulsational characteristics of
this star, and to use them to derive seismic constraints on the stellar
parameters. We determine pulsation frequencies in the SiIII 4553 Angstrom line
with Fourier methods. We identify the m-value of the modes by taking into
account the photometric identifications of the degrees l. To this end we use
the moment method together with the amplitude and phase variations across the
line profile. The frequencies of the identified modes are used for a seismic
interpretation of the structure of the star. We confirm the presence of the
three pulsation frequencies already detected in previous photometric datasets:
f_1 = 3.9793 c/d (46.057 microHz), f_2 = 3.9995 c/d (46.291 microHz) and f_3 =
4.1832 c/d (48.417 microHz). For the two modes with the highest amplitudes we
unambiguously identify (l_1,m_1) = (2,2) and (l_2,m_2) = (0,0). We cannot
conclude anything for the third mode identification, except that m_3 > 0. We
also deduce an equatorial rotational velocity of 31 +/- 5 Km/s for the star. We
show that the mode f_1 must be close to an avoided crossing. Constraints on the
mass (13.5 +/- 0.5 Msun), age (12.4 +/- 0.7 Myr) and core overshoot (0.20 +/-
0.05 H_P) of beta CMa are obtained from seismic modelling using f_1 and f_2.
","[{""version"":""v1"",""created"":""Wed, 12 Jul 2006 16:12:42 GMT""}]","2009-11-11"
"astro-ph/0607262","Loris P. L. Colombo","L.P.L. Colombo and M. Gervasi","Constraints on Quintessence From Using Cosmological Data","12 pages, 4 figures, submitted to JCAP","JCAP0610:001,2006","10.1088/1475-7516/2006/10/001",,"astro-ph",,"  Recent data, including the three--year WMAP data, the full 2dF galaxy power
spectrum and the first--year data of the Supernova Legacy Survey, are used to
constrain model parameters in quintessence cosmologies. In particular, we
discuss the inverse power--law (RP) and SUGRA potentials and compare parameter
constraints with those for LCDM. Both potentials fit current observations with
a goodness of fit comparable or better than LCDM. The constraints on the energy
scale Lambda_DE appearing in both potential expressions are however different.
For RP, only energy scales around the cosmological constant limit are allowed,
making the allowed models quite similar to LCDM. For SUGRA, Lambda_DE values
approximately up to Electroweak energy scale are still allowed, while other
parameter intervals are slightly but significantly displaced. In particular a
value of the primeval spectral index n_s = 1 is still allowed at the 95% c.l.,
and this can have an impact on constraints on possible inflationary potentials.
","[{""version"":""v1"",""created"":""Wed, 12 Jul 2006 17:18:47 GMT""}]","2009-11-11"
"astro-ph/0607263","Jose Alfonso Lopez Aguerri","J. A. L. Aguerri, N. Castro-Rodriguez, N. Napolitano, M. Arnaboldi &
  O. Gerhard","Diffuse Light in Hickson Compact Groups: The Dynamically Young System
  HCG 44","9 pages, 4 figures, accepted for publication at A&A",,"10.1051/0004-6361:20065783",,"astro-ph",,"  Compact groups are associations of a few galaxies in which the environment
plays an important role in galaxy evolution. The low group velocity dispersion
favors tidal interactions and mergers, which may bring stars from galaxies to
the diffuse intragroup light. Numerical simulations of galaxy clusters in
hierarchical cosmologies show that the amount of the diffuse light increases
with the dynamical evolution of the cluster. We search for diffuse light in the
galaxy group HCG 44 in order to determine its luminosity and luminosity
fraction. Combining with literature data, we aim to constrain the dynamical
status of Hickson compact groups. We use Intra Group planetary nebulae (IGPNe)
as tracers of diffuse light. These are detected by the so-called on band-off
band technique. We found 12 emission line objects in HCG 44, none of them
associated with the galaxies of the group. 6/12 emission line objects are
consistent with being IGPNe in HCG 44, but are also consistent with being
Ly$\alpha$ background galaxies. Thus we derive an upper limit to the diffuse
light fraction in HCG 44 of 4.7%. We find a correlation between the fraction of
elliptical galaxies and the amount of diffuse light in Hickson compact groups.
Those with large fraction of diffuse light are those with large fractions in
number and luminosity of E/S0 galaxies. We propose an evolutionary sequence for
Hickson compact groups in which the amount of diffuse light increases with the
dynamical evolution of the group.
","[{""version"":""v1"",""created"":""Wed, 12 Jul 2006 17:22:13 GMT""}]","2009-11-11"
"astro-ph/0607264","Thierry Morel","T. Morel (KU Leuven), K. Butler (USM), C. Aerts, C. Neiner, M. Briquet
  (KU Leuven)","Abundance analysis of prime B-type targets for asteroseismology I.
  Nitrogen excess in slowly-rotating beta Cephei stars","Accepted for publication in A&A, 21 pages, 7 figures",,"10.1051/0004-6361:20065171",,"astro-ph",,"  We present the results of a detailed NLTE abundance study of nine beta Cephei
stars, all of them being prime targets for theoretical modelling: gamma Peg,
delta Cet, nu Eri, beta CMa, xi1 CMa, V836 Cen, V2052 Oph, beta Cep and DD (12)
Lac. The following chemical elements are considered: He, C, N, O, Mg, Al, Si, S
and Fe. Our abundance analysis is based on a large number of time-resolved,
high-resolution optical spectra covering in most cases the entire oscillation
cycle of the stars. Nitrogen is found to be enhanced by up to 0.6 dex in four
stars, three of which have severe constraints on their equatorial rotational
velocity, \Omega R, from seismic or line-profile variation studies: beta Cep
(\Omega R~26 km/s), V2052 Oph (\Omega R~56 km/s), delta Cet (\Omega R < 28
km/s) and xi1 CMa (\Omega R sin i < 10 km/s). The existence of core-processed
material at the surface of such largely unevolved, slowly-rotating objects is
not predicted by current evolutionary models including rotation. We draw
attention to the fact that three stars in this subsample have a detected
magnetic field and briefly discuss recent theoretical work pointing to the
occurrence of diffusion effects in beta Cephei stars possibly capable of
altering the nitrogen surface abundance. On the other hand, the abundances of
all the other chemical elements considered are, within the errors,
indistinguishable from the values found for OB dwarfs in the solar
neighbourhood. Despite the mild nitrogen excess observed in some objects, we
thus find no evidence for a significantly higher photospheric metal content in
the studied beta Cephei stars compared to non-pulsating B-type stars of similar
characteristics.
","[{""version"":""v1"",""created"":""Wed, 12 Jul 2006 17:45:40 GMT""}]","2009-11-11"
"astro-ph/0607265","Joannah L. Hinz","J. L. Hinz, K. Misselt, M. J. Rieke, G. H. Rieke, P. S. Smith, M.
  Blaylock, and K. D. Gordon (U. Arizona)","Extended Emission by Dust in the Dwarf Galaxy UGC 10445","11 pages, 5 pages, accepted to ApJ, color high res figures available
  upon request","Astrophys.J.651:874-881,2006","10.1086/507622",,"astro-ph",,"  We present Spitzer Space Telescope images of the isolated dwarf galaxy UGC
10445. The galaxy is detected at all photometric bands (3.6-160um) as well as
in the Multiband Imaging Photometer for Spitzer (MIPS) spectral energy
distribution mode (55-95um). We derive a star formation rate of 0.25 M_sun/yr
based on H-alpha and infrared flux densities. There is over 10^6 solar masses
of cold dust (T~18K) in the galaxy, represented by 160um emission, that extends
to a larger radius than the ultraviolet (UV), optical and near-infrared light.
Such extended emission has been seen previously only in dwarf galaxies in
cluster environments. We suggest the source of heating for this dust is UV
light originating in star forming complexes. To produce the large quantity of
dust requires a higher rate of star formation in the past than is observed
currently.
","[{""version"":""v1"",""created"":""Wed, 12 Jul 2006 18:06:20 GMT""}]","2008-11-26"
"astro-ph/0607266","Darragh O'Donoghue","D. O'Donoghue, D.A.H. Buckley, L.A. Balona, D. Bester, L. Botha, J.
  Brink, D.B. Carter, P.A. Charles, A. Christians, F. Ebrahim, R. Emmerich, W.
  Esterhuyse, G.P. Evans, C. Fourie, P. Fourie, H. Gajjar, M. Gordon, C.
  Gumede, M. de Kock, A. Koeslag, W.P. Koorts, H. Kriel, F. Marang, J.G.
  Meiring, J.W. Menzies, P. Menzies, D. Metcalfe, B. Meyer, L. Nel, J.
  O'Connor, F. Osman, C. du Plessis, H. Rall, A. Riddick, E. Romero-Colmenero,
  S.B. Potter, C. Sass, H. Schalekamp, N. Sessions, S. Siyengo, V. Sopela, H.
  Steyn, J. Stoffels, J. Stoltz, G. Swart, A. Swat, J. Swiegers, T. Tiheli, P.
  Vaisanen, W. Whittaker, F. van Wyk","First science with SALT: peering at the accreting polar caps of the
  eclipsing polar SDSS J015543.40+002807.2","14 pages, 7 figures","Mon.Not.Roy.Astron.Soc.372:151-162,2006","10.1111/j.1365-2966.2006.10834.x",,"astro-ph",,"  We describe briefly the properties of the recently completed Southern African
Large Telescope (SALT), along with its first light imager SALTICAM. Using this
instrument, we present 4.3 hr of high speed unfiltered photometric observations
of the eclipsing polar SDSSJ015543.40+002807.2 with time resolution as short as
112 ms, the highest quality observations of this kind of any polar to date. The
system was observed during its high luminosity state. Two accreting poles are
clearly seen in the eclipse light curve. The binary system parameters have been
constrained: the white dwarf mass is at the low end of the range expected for
cataclysmic variables. Correlations between the positions of the accretion
regions on or near the surface of the white dwarf and the binary system
parameters were established. The sizes of the accretion regions and their
relative movement from eclipse to eclipse were estimated: they are typically
4-7 deg depending on the mass of the white dwarf. The potential of these
observations will only fully be realised when low state data of the same kind
are obtained and the contact phases of the eclipse of the white dwarf are
measured.
","[{""version"":""v1"",""created"":""Wed, 12 Jul 2006 19:28:34 GMT""}]","2009-11-11"
"astro-ph/0607267","Jeff Wagg F.","J. Wagg (1,2) D.J. Wilner (1) R. Neri (3) D. Downes (3) T. Wiklind (4)
  ((1) Cfa, (2) Inaoe, (3) Iram, (4) Stsci)","Atomic Carbon in APM 08279+5255 at z=3.91","Accepted for publication in the Astrophysical Journal","Astrophys.J.651:46-50,2006","10.1086/507677",,"astro-ph",,"  We present a detection of [CI] line emission in the lensed quasar APM
08279+5255 at z=3.91 using the IRAM Plateau de Bure interferometer. The [CI]
line velocity and width are similar to the values of previously detected high-J
CO and HCN lines in this source, suggesting that the emission from all of these
species arises from the same region. The apparent luminosity of the [CI] line
is L'(CI) = (3.1 +/- 0.4)x10^10 K km/s pc^2, which implies a neutral carbon
mass, M(CI) = (4.4+/-0.6)/m x10^7 M_sun, where m is the lensing magnification
factor. The [CI] line luminosity is consistent with the large molecular gas
mass inferred from the nuclear CO line luminosity ~10^11 /m M_sun. We also
present an upper limit on the H2O line luminosity in APM 08279+5255 of, L'(H2O)
< 1.8x10^10 K km/s pc^2 (3-sigma).
","[{""version"":""v1"",""created"":""Wed, 12 Jul 2006 20:21:36 GMT""}]","2008-11-26"
"astro-ph/0607268","W. K. M. Rice","W.K.M. Rice, G. Lodato, J.E. Pringle, P.J. Armitage, I.A. Bonnell","Planetesimal formation via fragmentation in self-gravitating
  protoplanetary discs","5 pages, Accepted for publication in MNRAS","Mon.Not.Roy.Astron.Soc.Lett. 372 (2006) L9-L13","10.1111/j.1745-3933.2006.00215.x",,"astro-ph",,"  An unsolved issue in the standard core accretion model for gaseous planet
formation is how kilometre-sized planetesimals form from, initially,
micron-sized dust grains. Solid growth beyond metre sizes can be difficult both
because the sticking efficiency becomes very small, and because these particles
should rapidly migrate into the central star. We consider here how metre-sized
particles evolve in self-gravitating accretion discs using simulations in which
the gravitational influence of the solid particles is also included.
Metre-sized particles become strongly concentrated in the spiral structures
present in the disc and, if the solid to gas density ratio is sufficiently
high, can fragment due to their own self-gravity to form planetesimals
directly. This result suggests that planetesimal formation may occur very early
in the star formation process while discs are still massive enough to be
self-gravitating. The dependence of this process on the surface density of the
solids is also consistent with the observation that extrasolar planets are
preferentially found around high metallicity stars.
","[{""version"":""v1"",""created"":""Wed, 12 Jul 2006 20:01:04 GMT""}]","2009-11-11"
"astro-ph/0607270","Kirpal Nandra","K. Nandra (Imperial), A. Georgakakis (Imperial), C.N.A. Willmer
  (Steward), M.C. Cooper (UCB), D.J. Croton (UCB), M. Davis (UCB), S.M. Faber
  (UCSC), D.C. Koo (UCSC), E.S. Laird (UCSC), J.A. Newman (LBNL)","AEGIS: The color-magnitude relation for X-ray selected AGN","5 pages, 2 figures, accepted for publication in AEGIS ApJ Letters
  special edition",,"10.1086/517918",,"astro-ph",,"  We discuss the relationship between rest-frame color and optical luminosity
for X-ray sources in the range 0.6<z<1.4 selected from the Chandra survey of
the Extended Groth Strip (EGS). These objects are almost exclusively active
galactic nuclei (AGN). While there are a few luminous QSOs, most are relatively
weak or obscured AGN whose optical colors should be dominated by host galaxy
light. The vast majority of AGN hosts at z~1 are luminous and red, with very
few objects fainter than M_{B}=-20.5 or bluer than U-B=0.6. This places the AGN
in a distinct region of color-magnitude space, on the ``red sequence'' or at
the top of the ``blue cloud'', with many in between these two modes in galaxy
color. A key stage in the evolution of massive galaxies is when star formation
is quenched, resulting in a migration from the blue cloud to the red sequence.
Our results are consistent with scenarios in which AGN either cause or maintain
this quenching. The large numbers of red sequence AGN imply that strong,
ongoing star formation is not a necessary ingredient for AGN activity, as black
hole accretion appears often to persist after star formation has been
terminated.
","[{""version"":""v1"",""created"":""Wed, 12 Jul 2006 20:03:23 GMT""}]","2009-11-11"
"astro-ph/0607271","Ian Smail","R.J. Ivison, S.C. Chapman, S.M. Faber, Ian Smail, A.D. Biggs, C.J.
  Conselice, G. Wilson, S. Salim, J.-S. Huang, S.P. Wilner","AEGIS20: a radio survey of the Extended Groth Strip","In press at ApJ Letters in the AEGIS Special Issue. Error in L(1.4)
  fixed. Catalogue available at http://www.roe.ac.uk/~rji/aegis20",,"10.1086/517917",,"astro-ph",,"  We describe AEGIS20 - a radio survey of the Extended Groth Strip (EGS)
conducted with the Very Large Array (VLA) at 1.4GHz. The resulting catalog
contains 1,123 emitters and is sensitive to ultraluminous starbursts to z<=1.3,
well matched to the redshift range of the DEEP2 spectroscopic survey in this
region. We use stacking techniques to explore the uJy-level emission from a
variety of galaxy populations selected via conventional criteria - Lyman-break
galaxies (LBGs), distant red galaxies (DRGs), UV-selected galaxies and
extremely red objects (EROs) - determining their properties as a function of
color, magnitude and redshift and their extinction-free contributions to the
history of star formation. We confirm the familiar pattern that the
star-formation-rate (SFR) density, SFRD, rises by at least ~5x from z=0-1,
although we note highly discrepant UV- and radio-based SFR estimates. Our
radio-based SFRs become more difficult to interpret at z>1 where correcting for
contamination by radio-loud active galactic nuclei (AGN) comes at the price of
rejecting luminous starbursts. Whilst stacking radio images is a useful
technique, accurate radio-based SFRs for z>>1 galaxies require precise
redshifts and extraordinarily high-fidelity radio data to identify and remove
accretion-related emission.
","[{""version"":""v1"",""created"":""Wed, 12 Jul 2006 20:04:13 GMT""},{""version"":""v2"",""created"":""Fri, 29 Sep 2006 10:18:24 GMT""}]","2009-11-11"
"astro-ph/0607272","Lihwai Lin","Lihwai Lin (1,2), David C. Koo (2), Benjamin J. Weiner (3), Tzihong
  Chiueh (1), Alison L. Coil (4), Jennifer Lotz (5), Christopher J. Conselice
  (6), S. P. Willner (7), H. A. Smith (7), Puragra Guhathakurta (2), J.-S.
  Huang (7), Emeric Le Floc'h (4), Kai G. Noeske (2), Christopher N. A. Willmer
  (4), Michael C. Cooper (8), and Andrew C. Phillips (2) ((1) National Taiwan
  University, (2) UCO/LICK; UC Santa Cruz, (3) U Maryland, (4) Steward
  Observatory, (5) NOAO, (6) U Nottingham, (7) CfA, (8) UC Berkeley)","AEGIS: Enhancement of Dust-enshrouded Star Formation in Close Galaxy
  Pairs and Merging Galaxies up to z ~ 1","12 pages, 2 figures, 1 table, minor changes to match the proof
  version, accepted for publication in the ApJL AEGIS Special Issue","Astrophys.J.660:L51-L54,2007","10.1086/517919",,"astro-ph",,"  Using data from the DEEP2 Galaxy Redshift Survey and HST/ACS imaging in the
Extended Groth Strip, we select nearly 100 interacting galaxy systems including
kinematic close pairs and morphologically identified merging galaxies. Spitzer
MIPS 24 micron fluxes of these systems reflect the current dusty star formation
activity, and at a fixed stellar mass (M_{*}) the median infrared luminosity
(L_{IR}) among merging galaxies and close pairs of blue galaxies is twice (1.9
+/- 0.4) that of control pairs drawn from isolated blue galaxies. Enhancement
declines with galaxy separation, being strongest in close pairs and mergers and
weaker in wide pairs compared to the control sample. At z ~ 0.9, 7.1% +/- 4.3%
of massive interacting galaxies (M_{*} > 2*10^{10} M_{solar}) are found to be
ULIRGs, compared to 2.6% +/- 0.7% in the control sample. The large spread of IR
luminosity to stellar mass ratio among interacting galaxies suggests that this
enhancement may depend on the merger stage as well as other as yet unidentified
factors (e.g., galaxy structure, mass ratio, orbital characteristics, presence
of AGN or bar). The contribution of interacting systems to the total IR
luminosity density is moderate (<= 36 %).
","[{""version"":""v1"",""created"":""Thu, 13 Jul 2006 03:05:10 GMT""},{""version"":""v2"",""created"":""Sat, 14 Apr 2007 08:18:04 GMT""}]","2009-11-11"
"astro-ph/0607273","H\'ector Juli\'an Mart\'inez","Hector J. Martinez, Ana L. O'Mill & Diego G. Lambas","The evolution of the bi-modal colour distribution of galaxies in SDSS
  groups","7 pages, 6 figures, submited to MNRAS after minor revision","Mon.Not.Roy.Astron.Soc.372:253-258,2006","10.1111/j.1365-2966.2006.10849.x",,"astro-ph",,"  We analyse $u-r$ colour distributions for several samples of galaxies in
groups drawn from the Fourth Data Release of the Sloan Digital Sky Survey. For
all luminosity ranges and environments considered the colour distributions are
well described by the sum of two Gaussian functions. We find that the fraction
of galaxies in the red sequence is an increasing function of group virial mass.
We also study the evolution of the galaxy colour distributions at low redshift,
$z\le0.18$ in the field and in groups for galaxies brighter than
$M_r-5\log(h)=-20$, finding significant evidence of recent evolution in the
population of galaxies in groups. The fraction of red galaxies monotonically
increases with decreasing redshift, this effect implies a much stronger
evolution of galaxies in groups than in the field.
","[{""version"":""v1"",""created"":""Wed, 12 Jul 2006 20:34:51 GMT""}]","2009-11-11"
"astro-ph/0607274","Antonis Georgakakis","A. Georgakakis, K. Nandra, E. S. Laird, M. C. Cooper, B. F. Gerke, J.
  A. Newman, D. J. Croton, M. Davis, S. M. Faber, A. L. Coil","All-wavelength Extended Groth strip International Survey: the
  environment of X-ray sources at z~1","accepted by ApJL",,,,"astro-ph",,"  We explore the environment of z~1 AGN using a sample of 53 spectroscopically
identified X-ray sources in the All-wavelength Extended Groth strip
International Survey. We quantify the local density in the vicinity of an X-ray
source by measuring the projected surface density of spectroscopically
identified optical galaxies within a radius defined by the 3rd nearest
neighbour. Our main result is that X-ray selected AGN at z~1 avoid underdense
regions at the 99.89% confidence level. Moreover, although we find that the
overall population shares the same (rich) environment with optical galaxies of
similar U-B and M_B, there is also tentative evidence (96%) that AGN with blue
colors (U-B<1) reside in denser environments compared to optical galaxies. We
argue that the results above are a consequence of the whereabouts of massive
galaxies, capable of hosting supermassive black holes at their centers, with
available cold gas reservoirs, the fuel for AGN activity. At z~1 an increasing
fraction of such systems are found in dense regions.
","[{""version"":""v1"",""created"":""Wed, 12 Jul 2006 20:53:14 GMT""}]","2007-05-23"
