"hep-ex/0612022","Stephen Dye","John Learned, Steve Dye, Sandip Pakvasa, Robert Svoboda","Determination of Neutrino Mass Hierarchy and Theta_13 with a Remote
  Detector of Reactor Antineutrinos","6 pages, 7 figures, note added to original paper submitted 12
  December 2006","Phys.Rev.D78:071302,2008","10.1103/PhysRevD.78.071302",,"hep-ex hep-ph","http://arxiv.org/licenses/nonexclusive-distrib/1.0/","  We describe a method for determining the hierarchy of the neutrino mass
spectrum and theta_13 through remote detection of antineutrinos from a nuclear
reactor. This method utilizing a single, 10-kt scintillating liquid detector at
a distance of 50-64 kilometers from the reactor complex measures mass-squared
differences involving nu_3 with a one (ten) year exposure provided
sin2(2theta_13)>0.05 (0.02). Our technique applies the Fourier transform to the
event rate as a function of neutrino flight distance over energy. Sweeping over
a relevant range of delta-m2 resolves separate spectral peaks for delta-m2_31
and delta-m2_32. For normal (inverted) hierarchy the absolute value of
delta-m2_31 is greater (lesser) than the absolute value of delta-m2_32. This
robust method requires a detector energy resolution of 3.5% divided by the
square root of the scintillation energy.
","[{""version"":""v1"",""created"":""Tue, 12 Dec 2006 01:27:23 GMT""},{""version"":""v2"",""created"":""Sat, 30 Aug 2008 03:23:14 GMT""}]","2008-11-26"
"hep-ex/0612023","Chuanlei Liu","ZEUS Collaboration: S. Chekanov, et al","Measurement of K0S, Lambda, Antilambda production at HERA","40 pages, 20 figures, 1 table, minor revisions, accepted by European
  Physical Journal C","Eur.Phys.J.C51:1-23,2007","10.1140/epjc/s10052-007-0299-2","DESY-06-226","hep-ex",,"  The production of the neutral strange hadrons $K^{0}_{S}$, $\Lambda$ and
$\bar{\Lambda}$ has been measured in $ep$ collisions at HERA using the ZEUS
detector. Cross sections, baryon-to-meson ratios, relative yields of strange
and charged light hadrons, $\Lambda$ ($\bar{\Lambda}$) asymmetry and
polarization have been measured in three kinematic regions: $Q^2 > 25 \gev^2$;
$5 < Q^2 < 25 \gev^2$; and in photoproduction ($Q^2 \simeq 0$). In
photoproduction the presence of two hadronic jets, each with at least $5 \gev$
transverse energy, was required. The measurements agree in general with Monte
Carlo models and are consistent with measurements made at $e^+ e^-$ colliders,
except for an enhancement of baryon relative to meson production in
photoproduction.
","[{""version"":""v1"",""created"":""Tue, 12 Dec 2006 15:58:59 GMT""},{""version"":""v2"",""created"":""Fri, 23 Mar 2007 05:33:50 GMT""}]","2012-08-03"
"hep-ex/0612024","Mauro Villa","The HERA-B Collaboration, I. Abt, et al","Bottom production cross section from double muonic decays of b-hadrons
  in 920 GeV proton-nucleus collision","10 pages, 5 figures","Phys.Lett.B650:103-110,2007","10.1016/j.physletb.2007.04.022","DESY 06-214","hep-ex",,"  The b-bbar production cross section in 920 GeV proton-nucleus fixed target
collisions is measured by observing double muonic decays of b-flavored hadrons
in the kinematic region $-0.3<\xF(\mu)<0.15$.
  A total number of $76\pm12$ b-bbar events is obtained with a likelihood fit
of the signal and background simulated events to the data.
  The resulting cross section is $\sigbb = 16.2 \pm 2.5_{stat} \pm 2.8_{sys}
\nbpn$, or, when combined with a previous Hera-B measurement of similar
precision, $\sigbb = 15.4 \pm 1.7_{stat} \pm 1.2_{sys}^{uncorr.} \pm
1.9_{sys}^{corr.} \nbpn$, which is consistent with recent NLO calculations.
","[{""version"":""v1"",""created"":""Tue, 12 Dec 2006 14:13:34 GMT""}]","2011-02-08"
"hep-lat/0612012","Roland Hoffmann","Thomas DeGrand and Roland Hoffmann","QCD with one compact spatial dimension","13 pages, 9 figures, JHEP style","JHEP 0702:022,2007","10.1088/1126-6708/2007/02/022","COLO-HEP-521","hep-lat hep-th",,"  The realization of global symmetries can depend on the geometry of the
underlying space. In particular, compactification can lead to spontaneous
breaking of such symmetries. Four-dimensional QCD with fundamental
representation fermions embedded in a space with one compact spatial dimension
has a critical length, at which the theory undergoes a phase transition and
develops a ground state that is no longer charge conjugation invariant. We show
this behavior with simulations of three color, four flavor QCD. We use unrooted
staggered fermion at two values of the lattice spacing and several quark
masses. We discuss the dependence of the transition on the dynamical fermion
mass as well as its connection to the finite temperature and chiral phase
transitions.
","[{""version"":""v1"",""created"":""Mon, 11 Dec 2006 20:54:30 GMT""}]","2010-10-27"
"hep-ph/0612107","Ian-Woo Kim","Kang-Sin Choi, Ian-Woo Kim and Jihn E. Kim","String compactification, QCD axion and axion-photon-photon coupling","33 pages, 2 figures, JHEP format, some errors in the superpotential
  couplings are corrected and the following discussions are changed
  correspondingly","JHEP 0703:116,2007","10.1088/1126-6708/2007/03/116","SNUTP 06-012","hep-ph",,"  It is pointed out that there exist a few problems to be overcome toward an
observable sub-eV QCD axion in superstring compactification. We give a general
expression for the axion decay constant. For a large domain wall number
$N_{DW}$, the axion decay constant can be substantially lowered from a generic
value of a scalar singlet VEV. The Yukawa coupling structure in the recent
$Z_{12-I}$ model is studied completely, including the needed nonrenormalizable
terms toward realistic quark and lepton masses. In this model we find an
approximate global symmetry and vacuum so that a QCD axion results but its
decay constant is at the GUT scale. The axion-photon-photon coupling is
calculated for a realistic vacuum satisfying the quark and lepton mass matrix
conditions. It is the first time calculation of $c_{a\gamma\gamma}$ in
realistic string compactifications: $c_{a\gamma\gamma}={5/3}-1.93\simeq -0.26$.
","[{""version"":""v1"",""created"":""Mon, 11 Dec 2006 16:22:43 GMT""},{""version"":""v2"",""created"":""Mon, 18 Dec 2006 08:34:11 GMT""},{""version"":""v3"",""created"":""Sat, 13 Jan 2007 09:50:00 GMT""}]","2010-10-27"
"hep-ph/0612114","Yingchuan Li","Xiangdong Ji, Yingchuan Li, Yue Zhang","Atmospheric Neutrino Mixing and b-s Transitions: Testing Lopsided SO(10)
  Flavor Structure in B physics","6 pages, 4 figures","Phys.Rev.D75:055016,2007","10.1103/PhysRevD.75.055016",,"hep-ph",,"  We point out that the correlation between the large atmospheric neutrino
mixing and the $b \to s$ transition, if exists, comes from the lopsided flavor
structure in SO(10) grand unification theory. We suggest testing the
correlation by studying the deviation of $S_{\phi K_S}$ and $S_{\eta' K_S}$
from the standard model predictions along with the constraints from $\Delta
M_{B_S}$ and $b\to s \gamma$ in a realistic SO(10) model with lopsided flavor
structure. We find a specific correlation between $S_{\phi K_S}$ and $S_{\eta'
K_S}$ that is intrinsic to the lopsided structure and discuss how to confirm or
rule out this flavor pattern by the more accurate measurements of these CP
violation quantities in B decay.
","[{""version"":""v1"",""created"":""Mon, 11 Dec 2006 19:45:16 GMT""},{""version"":""v2"",""created"":""Sun, 4 Mar 2007 20:35:16 GMT""}]","2008-11-26"
"hep-ph/0612132","Walter Grimus","W. Grimus, H. Kuhbock","A renormalizable SO(10) GUT scenario with spontaneous CP violation","16 pages, two eps figures","Eur.Phys.J.C51:721-729,2007","10.1140/epjc/s10052-007-0324-5","UWThPh-2006-29","hep-ph",,"  We consider fermion masses and mixings in a renormalizable SUSY SO(10) GUT
with Yukawa couplings of scalar fields in the representation 10 + 120 + 126
bar. We investigate a scenario defined by the following assumptions: i) A
single large scale in the theory, the GUT scale. ii) Small neutrino masses
generated by the type I seesaw mechanism with negligible type II contributions.
iii) A suitable form of spontaneous CP breaking which induces hermitian mass
matrices for all fermion mass terms of the Dirac type. Our assumptions define
an 18-parameter scenario for the fermion mass matrices for 18 experimentally
known observables. Performing a numerical analysis, we find excellent fits to
all observables in the case of both the normal and inverted neutrino mass
spectrum.
","[{""version"":""v1"",""created"":""Mon, 11 Dec 2006 16:46:43 GMT""}]","2008-11-26"
"hep-ph/0612133","Ulrich Ellwanger","Ulrich Ellwanger, Cyril Hugonie","The upper bound on the lightest Higgs mass in the NMSSM revisited","13 pages, 2 figures, improved figures with a numerical bug corrected,
  additional discussions of the large tan(beta) regime and the dependence of
  the upper bound on lambda","Mod.Phys.Lett.A22:1581-1590,2007","10.1142/S0217732307023870","LPT Orsay 06-77, LPTA Montpellier 06-62","hep-ph",,"  We update the upper bound on the lightest CP even Higgs mass in the NMSSM,
which is given as a function of tan(beta) and lambda. We include the available
one and two loop corrections to the NMSSM Higgs masses, and constraints from
the absence of Landau singularities below the GUT scale as well as from the
stability of the NMSSM Higgs potential. For m_top varying between 171.4 and 178
GeV, squark masses of 1 TeV and maximal mixing the upper bound is assumed near
tan(beta) ~ 2 and varies between 139.9 and 141.4 GeV.
","[{""version"":""v1"",""created"":""Mon, 11 Dec 2006 17:19:54 GMT""},{""version"":""v2"",""created"":""Fri, 22 Dec 2006 15:54:37 GMT""},{""version"":""v3"",""created"":""Fri, 23 Mar 2007 13:45:31 GMT""},{""version"":""v4"",""created"":""Tue, 3 Apr 2007 14:09:12 GMT""}]","2008-11-26"
"hep-ph/0612134","Ulrich Ellwanger","Ulrich Ellwanger, Cyril Hugonie","NMSPEC: A Fortran code for the sparticle and Higgs masses in the NMSSM
  with GUT scale boundary conditions","21 pages, 3 figures","Comput.Phys.Commun.177:399-407,2007","10.1016/j.cpc.2007.05.001","LPT Orsay 06-79, LPTA Montpellier 06-6","hep-ph",,"  NMSPEC is a Fortran code that computes the sparticle and Higgs masses, as
well as Higgs decay widths and couplings in the NMSSM, with soft SUSY breaking
terms specified at MGUT. Exceptions are the soft singlet mass m_s^2 and the
singlet self coupling kappa, that are both determined in terms of the other
parameters through the minimization equations of the Higgs potential. We
present a first analysis of the NMSSM parameter space with universal SUSY
breaking terms at MGUT -- except for m_s and A_kappa -- that passes present
experimental constraints on sparticle and Higgs masses. We discuss in some
detail a region in parameter space where a SM-like Higgs boson decays
dominantly into two CP odd singlet-like Higgs states.
","[{""version"":""v1"",""created"":""Mon, 11 Dec 2006 17:14:26 GMT""}]","2008-11-26"
"hep-ph/0612135","Joseph Kapusta","Xiao-Bing Zhang, J. I. Kapusta","Formation of Gapless Phases of $K^0$ Condensed Color-Flavor Locked
  Superconducting Quark Matter","29 pages, 3 figures, 4 tables","Phys.Rev.D75:054028,2007","10.1103/PhysRevD.75.054028",,"hep-ph nucl-th",,"  Electric and color neutral solutions, and the critical conditions for the
formation of gapless color superconductors, are investigated in $K^0$ condensed
color-flavor locked quark matter for nonzero strange quark mass. We show that
as the strange quark mass increases, gapless modes for up-strange quark pairing
occur first, followed by down-strange quark pairing. The behavior of the gaps,
the dispersion relations, and the thermodynamic potential are all found as
functions of the strange quark mass on the basis of a Nambu Jona-Lasinio type
model. To a high degree of accuracy, they are presented as relatively simple
elementary functions. This allows for easy computation for any reasonable range
of baryon chemical potential and strange quark mass.
","[{""version"":""v1"",""created"":""Mon, 11 Dec 2006 17:29:54 GMT""}]","2008-11-26"
"hep-ph/0612136","Samina S. Masood","Samina S. Masood and Mahnaz Q. Haseeb","Second Order Corrections to QED Coupling at Low Temperature","8 latex pages and 1 figure (to appear in IJMP)","Int.J.Mod.Phys.A23:4709-4719,2008","10.1142/S0217751X08041712",,"hep-ph","http://arxiv.org/licenses/nonexclusive-distrib/1.0/","  We calculate the second order corrections to vacuum polarization tensor of
photons at low temperatures, i.e; T $\le 10^{10}$ K ($T << m_e$). The thermal
contributions to the QED coupling constant are evaluated at temperatures below
the electron mass that is $T< m_e$ . Renormalization of QED at these
temperatures has explicitly been checked. The electromagnetic properties of
such a thermal medium are modified. Parameters like electric permittivity and
magnetic permeability of such a medium are no more constant and become
functions of temperature.
","[{""version"":""v1"",""created"":""Mon, 11 Dec 2006 19:16:41 GMT""},{""version"":""v2"",""created"":""Tue, 29 Jul 2008 15:39:23 GMT""}]","2009-09-29"
"hep-ph/0612137","Dan Hooper","Dan Hooper and Gabrijela Zaharijas","Distinguishing Supersymmetry From Universal Extra Dimensions or Little
  Higgs Models With Dark Matter Experiments","23 pages, 7 figures, references added in version 2","Phys.Rev.D75:035010,2007","10.1103/PhysRevD.75.035010","FERMILAB-PUB-06-456-A","hep-ph astro-ph",,"  There are compelling reasons to think that new physics will appear at or
below the TeV-scale. It is not known what form this new physics will take,
however. Although The Large Hadron collider is very likely to discover new
particles associated with the TeV-scale, it may be difficult for it to
determine the nature of those particles, whether superpartners, Kaluza-Klein
modes or other states. In this article, we consider how direct and indirect
dark matter detection experiments may provide information complementary to
hadron colliders, which can be used to discriminate between supersymmetry,
models with universal extra dimensions, and Little Higgs theories. We find
that, in many scenarios, dark matter experiments can be effectively used to
distinguish between these possibilities.
","[{""version"":""v1"",""created"":""Mon, 11 Dec 2006 21:04:50 GMT""},{""version"":""v2"",""created"":""Mon, 18 Dec 2006 18:53:36 GMT""}]","2008-11-26"
"hep-ph/0612138","Yoav Achiman","Yoav Achiman","A Scenario for Spontaneous CP Violation in SUSY SO(10)","11 pages, based on conference talks, minor changes references added",,,"TAUP 2843/06","hep-ph",,"  A scenario is suggested for spontaneous CP violation in non-SUSY and SUSY
SU(10). The idea is to have a scalar potential which generates spontaneously a
phase, at the high scale, in the VEV that gives a mass to the RH neutrinos. The
case of the minimal renormalizable SUSY SO(10) is discussed in detail. The high
scale CP breaking induces a phase in the CKM matrix as well. It is also pointed
out that, in these models, the scales of Baryogenesis, Seesaw, Spontaneous CP
violation and Spontaneous U(1)_QP breaking are all of the same order of
magnitude.
","[{""version"":""v1"",""created"":""Mon, 11 Dec 2006 21:13:38 GMT""},{""version"":""v2"",""created"":""Sun, 21 Jan 2007 21:21:41 GMT""}]","2007-05-23"
"hep-ph/0612140","Claudio Coriano","Claudio Coriano and Nikos Irges","Windows over a New Low Energy Axion","17 pages, 8 Figs, replaced with revised final version, to appear on
  Phys.Lett. B","Phys.Lett.B651:298-305,2007","10.1016/j.physletb.2007.06.022",,"hep-ph",,"  We outline some general features of possible extensions of the Standard Model
that include anomalous U(1) gauge symmetries, a certain number of axions and
their mixings with the CP-odd Higgs sector. As previously shown, after the
mixing one of the axions becomes a physical pseudoscalar (the axi-Higgs) that
can take the role of a modified QCD axion. It can be driven to be very light by
the same non-perturbative effects that are held responsible for the solution of
the strong CP-problem. At the same time the axi-Higgs has a sizeable gauge
interaction, which is not allowed to the Peccei-Quinn axion, possibly
explaining the PVLAS results. We point out that the Wess-Zumino term, typical
of these models, can be both interpreted as an anomaly inflow from higher
dimensional theories (second window) but also as a result of partial decoupling
of an extra Higgs sector (and of a fermion) that leaves behind an effective
anomalous abelian theory (first window) in a broken St\""{u}ckelberg phase. The
possibility that the axi-Higgs can be heavy, of the order of the Higgs mass or
larger, however, can't be excluded. The potentialities for the discovery of
this particle and of anomaly effects in the neutral current sector at the LHC
are briefly discussed in the context of a superstring inspired model (second
window), but with results that remain valid also if any of the two
possibilities is realized in Nature.
","[{""version"":""v1"",""created"":""Tue, 12 Dec 2006 11:39:14 GMT""},{""version"":""v2"",""created"":""Sat, 23 Jun 2007 09:47:08 GMT""}]","2008-11-26"
"hep-ph/0612141","Jihn E. Kim","Jihn E. Kim","Axions: Past, Present, and Future","15 pages with 6 figures. Talk at IDM 2006",,"10.1142/9789812770288_0049","SNUTP 06-013","hep-ph",,"  The current status of axion physics is presented. There still exists the
axion window 10^9 GeV < F_a < 10^{12} GeV. The recent CAST solar axion search
experiment on the axion-photon-photon coupling strength has to be improved by a
factor of 100 to reach down to the region of superstring axions. The calculable
theta and m_u=0 cases for strong CP solutions, and axino cosmology in SUSY
extension of axion are also commented.
","[{""version"":""v1"",""created"":""Tue, 12 Dec 2006 02:16:13 GMT""}]","2016-11-09"
"hep-ph/0612142","Chuan Hung Chen","Chuan-Hung Chen, Chao-Qiang Geng","Implications of the HyperCP Data on $B$ and $\tau$ decays","12+1 pages, references added, version to appear in Phys. Lett. B","Phys.Lett.B645:189-196,2007","10.1016/j.physletb.2006.12.021",,"hep-ph hep-ex",,"  If the HyperCP three events for the decay of $\Sigma^+\to p\mu^+\mu^-$ are
explained by a new pseudoscalar (axial-vector) boson $X_{P(A)}$ with a mass of
214.3 MeV, we study the constraints on the couplings between $X_{P(A)}$ and
fermions from the experimental data in $K$ and $B$ processes. Some implications
of the new particle on flavor changing $B$ and $\tau$ decays are given.
Explicitly, we show that the decay branching ratios of $B_{s}\to\phi
X_{P(A)}\to \phi\mu^{+}\mu^{-}$, $B_{d}\to K_{0}^{*}(1430){P(A)}\to
K_{0}^{*}(1430)\mu^{+}\mu^{-}$ and $\tau\to\mu X_{P(A)}\to\mu\mu^{+}\mu^{-}$
can be as large as $2.7 (2.8)\times 10^{-6}$, $7.4 (7.5)\times 10^{-7}$ and
$1.7 (0.14)\times 10^{-7}$, respectively.
","[{""version"":""v1"",""created"":""Tue, 12 Dec 2006 03:09:39 GMT""},{""version"":""v2"",""created"":""Mon, 8 Jan 2007 12:28:45 GMT""}]","2008-11-26"
"hep-ph/0612143","Singh N.Nimai","Amal Kr. Sarma, H. Zeen Devi and N. Nimai Singh","Type-II seesaw mass models and baryon asymmetry","16 pages, no figure, accepted in Nuclear Physics B","Nucl.Phys.B765:142-153,2007","10.1016/j.nuclphysb.2006.12.002",,"hep-ph",,"  We compute and also compare the contributions of canonical and noncanonical
mass terms towards baryon asymmetry by considering type-II seesaw mass models
of neutrinos: Degenerare(3 varieties), Normal hierarchical and Inverted
hierarchical(2 varieties). We have shown that for particular choices of
parameter '$\gamma$'(the so-called discriminator) for different neutrino mass
models, the baryon asymmetry is largely dominated by canonical term. Within
such type-II seesaw scenario, we find normal hierarchical mass model as the
most favourable choice of nature.
","[{""version"":""v1"",""created"":""Tue, 12 Dec 2006 08:01:54 GMT""}]","2008-11-26"
"hep-ph/0612144","Mustafa Savci","T. M. Aliev, M. Savci","Scalar form factor of the nucleon and nucleon--scalar meson coupling
  constant in QCD","20 pages, 12 figures, LaTeX formatted","Phys.Rev.D75:045006,2007","10.1103/PhysRevD.75.045006","metu-phys-hep-06-17","hep-ph",,"  Scalar form factor of the nucleon is calculated in the framework of light
cone QCD sum rules, using the most general form of the baryon current. Using
the result on scalar form factor of the nucleon, the nucleon-scalar ""sigma"" and
""a_0"" meson coupling constants are estimated. Our results on these couplings
are in good agreement with the prediction of the external field QCD sum rules
method.
","[{""version"":""v1"",""created"":""Tue, 12 Dec 2006 09:21:20 GMT""},{""version"":""v2"",""created"":""Mon, 15 Jan 2007 12:02:57 GMT""}]","2008-11-26"
"hep-ph/0612145","Mathias Garny","Mathias Garny","B-L-symmetric Baryogenesis with Leptonic Quintessence","6 pages, 4 figures, based on a talk at IRGAC 2006 (Barcelona, July
  11-15 2006), accepted by Journal of Physics A","J.Phys.A40:7005-7010,2007","10.1088/1751-8113/40/25/S53",,"hep-ph astro-ph",,"  We discuss a toy model where baryogenesis and cosmic acceleration are driven
by a leptonic quintessence field coupled to the standard model sector via a
massive mediating scalar field. It does not require the introduction of
B-L-violating interactions below the inflationary scale. Instead, a
B-L-asymmetry is stored in the quintessence field, which compensates for the
corresponding observed baryon asymmetry.
","[{""version"":""v1"",""created"":""Tue, 12 Dec 2006 10:13:26 GMT""}]","2008-11-26"
"hep-ph/0612146","Ailin Zhang","Ailin Zhang, Tao Huang and T. G. Steele","Diquark and light four-quark states","7 pages, 4 eps figures, RevTex, two figures and some references
  added, published version in PRD","Phys.Rev.D76:036004,2007","10.1103/PhysRevD.76.036004",,"hep-ph hep-ex",,"  Four-quark states with different internal clusters are discussed within the
constituent quark model. It is pointed out that the diquark concept is not
meaningful in the construction of a tetraquark interpolating current in the QCD
sum rule approach, and hence existing sum-rule studies of four-quark states are
incomplete. An updated QCD sum-rule determination of the properties of diquark
clusters is then used as input for the constituent quark model to obtain the
masses of light $0^{++}$ tetraquark states ({\it i.e.\} a bound state of two
diquark clusters). The results support the identification of $\sigma(600)$,
$f_0(980)$ and $a_0(980)$ as the $0^{++}$ light tetraquark states, and seem to
be inconsistent with the tetraquark state interpretation of the new BES
observations of the near-threshold $p\bar p$ enhancements, X(1835) and X(1812),
with the possible exception that X(1576) may be an ""exotic"" first orbital
excitation of $f_0(980)$ or $a_0(980)$.
","[{""version"":""v1"",""created"":""Tue, 12 Dec 2006 11:30:08 GMT""},{""version"":""v2"",""created"":""Fri, 19 Jan 2007 01:58:59 GMT""},{""version"":""v3"",""created"":""Thu, 12 Jul 2007 00:12:16 GMT""}]","2008-11-26"
"hep-ph/0612149","Sven-Olaf Moch","A. Mitov and S. Moch","The singular behavior of massive QCD amplitudes","version to appear in JHEP (sec. 3 with expanded discussion and
  appendix with added results)","JHEP 0705:001,2007","10.1088/1126-6708/2007/05/001","DESY 06-216","hep-ph",,"  We discuss the structure of infrared singularities in on-shell QCD amplitudes
with massive partons and present a general factorization formula in the limit
of small parton masses. The factorization formula gives rise to an all-order
exponentiation of both, the soft poles in dimensional regularization and the
large collinear logarithms of the parton masses. Moreover, it provides a
universal relation between any on-shell amplitude with massive external partons
and its corresponding massless amplitude. For the form factor of a heavy quark
we present explicit results including the fixed-order expansion up to three
loops in the small mass limit. For general scattering processes we show how our
constructive method applies to the computation of all singularities as well as
the constant (mass-independent) terms of a generic massive n-parton QCD
amplitude up to the next-to-next-to-leading order corrections.
","[{""version"":""v1"",""created"":""Tue, 12 Dec 2006 12:47:08 GMT""},{""version"":""v2"",""created"":""Tue, 1 May 2007 10:01:44 GMT""}]","2010-10-27"
"hep-ph/0612150","Maxim V. Polyakov","Moskov Amarian, Dmitri Diakonov, Maxim V. Polyakov","To see the exotic Theta^+ baryon from interference","9 pages","Phys.Rev.D78:074003,2008","10.1103/PhysRevD.78.074003",,"hep-ph hep-ex nucl-ex",,"  Since all couplings of the exotic $\Theta^+$ baryon to normal hadrons seem to
be small it is hard to reveal it in standard resonance searching. We suggest to
look for the $\Theta^+$ production in interference with a known resonance
yielding the same final state but having a high production rate. The
interference process is linear in the $\Theta^+$ couplings whereas the
non-interference process is quadratic. That gives an obvious gain if the
couplings are small. Moreover, employing the peculiar oscillating nature of the
interference processes one can reduce considerably the parasitic background and
determine the $\Theta^+$ resonance parameters.
","[{""version"":""v1"",""created"":""Tue, 12 Dec 2006 13:29:42 GMT""}]","2008-11-26"
