"astro-ph/0612304","Margarita Safonova Dr.","Margarita Safonova and C.S. Stalin","Detection of IMBHs from microlensing in globular clusters","This paper is withdrawn. An updated version with new results will
  soon be available",,"10.1017/S1743921307005844",,"astro-ph","http://arxiv.org/licenses/nonexclusive-distrib/1.0/","  Globular clusters have been alternatively predicted to host intermediate-mass
black holes (IMBHs) or nearly impossible to form and retain them in their
centres. Over the last decade enough theoretical and observational evidence
have accumulated to believe that many galactic globular clusters may host IMBHs
in the centres, just like galaxies do. The well-established correlations for
supermassive black holes and their galaxies do suggest that, in extrapolation,
globular clusters (GCs) follow the same relations. Most of the attempts in
search of the central black holes (BHs) are not direct and present enormous
observational difficulties due to the crowding of stars in the GC cores. Here
we propose a new method of detection of the central BH--the microlensing of the
cluster stars by the central black hole. If the core of the cluster is
resolved, the direct determination of the lensing curve and lensing system
parameters is possible; if unresolved, the differential imaging technique (or
pixel lensing) can be applied. We calculate the optical depth to central BH
microlensing for a selected list of Galactic globular clusters and estimate the
average time duration of the events. We present the observational strategy and
discuss the detectability of the microlensing event using a 2-m class
telescope.
","[{""version"":""v1"",""created"":""Tue, 12 Dec 2006 06:15:39 GMT""},{""version"":""v2"",""created"":""Mon, 11 May 2009 10:10:27 GMT""},{""version"":""v3"",""created"":""Tue, 8 Dec 2009 07:25:54 GMT""}]","2015-06-24"
"astro-ph/0612305","Nick Scoville","N. Scoville, H. Aussel, M. Brusa, P. Capak, C. M. Carollo, M. Elvis,
  M. Giavalisco, L. Guzzo, G. Hasinger, C. Impey, J.-P. Kneib, O. LeFevre, S.
  J. Lilly, B. Mobasher, A. Renzini, R. M. Rich, D. B. Sanders, E. Schinnerer,
  D. Schminovich, P. Shopbell, Y. Taniguchi, N. D. Tyson","The Cosmic Evolution Survey (COSMOS) -- Overview","22 pages, 3 figures",,"10.1086/516585",,"astro-ph",,"  The Cosmic Evolution Survey (COSMOS) is designed to probe the correlated
evolution of galaxies, star formation, active galactic nuclei (AGN) and dark
matter (DM) with large-scale structure (LSS) over the redshift range z $> 0.5 $
to 6. The survey includes multi-wavelength imaging and spectroscopy from X-ray
to radio wavelengths covering a 2 $\sq$\deg area, including HST imaging. Given
the very high sensitivity and resolution of these datasets, COSMOS also
provides unprecedented samples of objects at high redshift with greatly reduced
cosmic variance, compared to earlier surveys. Here we provide a brief overview
of the survey strategy, the characteristics of the major COSMOS datasets, and
summarize the science goals.
","[{""version"":""v1"",""created"":""Tue, 12 Dec 2006 06:21:42 GMT""}]","2009-11-11"
"astro-ph/0612306","Nick Scoville","N. Scoville, A. Benson, A. W. Blain, D. Calzetti, A. Comastri, P.
  Capak, C. Carilli, J. E. Carlstrom, C. M. Carollo, J. Colbert, E. Daddi, R.
  S. Ellis, M. Elvis, S. P. Ewald, M. Fall, A. Franceschini, M. Giavalisco, W.
  Green, R. E. Griffiths, L. Guzzo, G. Hasinger, C. Impey, J-P. Kneib, J. Koda,
  A. Koekemoer, O. Lefevre, S. Lilly, C. T. Liu, H. J. McCracken, R. Massey, Y.
  Mellier, S. Miyazaki, B. Mobasher, J. Mould, C. Norman, A. Refregier, A.
  Renzini, J. Rhodes, M. Rich, D. B. Sanders, D. Schiminovich, E. Schinnerer,
  M. Scodeggio, K. Sheth, P. L. Shopbell, Y. Taniguchi, N. Tyson, C. M. Urry,
  L. Van Waerbeke, P. Vettolani, S. D. M. White, L. Yan, G Zamorani","COSMOS : Hubble Space Telescope Observations","21 pages, 6 figures -- to appear in COSMOS ApJ Suppl. special issue","Astrophys.J.Suppl.172:38-45,2007","10.1086/516580",,"astro-ph",,"  The Cosmic Evolution Survey (COSMOS) was initiated with an extensive
allocation
  (590 orbits in Cycles 12-13) using the Hubble Space Telescope (HST) for high
resolution imaging. Here we review the characteristics of the HST imaging with
the Advanced Camera for Surveys
  (ACS) and parallel observations with NICMOS and WFPC2. A square field
(1.8$\sq$\deg) has been imaged with single-orbit ACS I-F814W exposures with 50%
completeness for sources 0.5\arcsec in diameter at I$_{AB} $ = 26.0 mag. The
ACS imaging is a key part of the COSMOS survey, providing very high sensitivity
and high resolution (0.09\arcsec FWHM, 0.05\arcsec pixels) imaging and
detecting 1.2 million objects to a limiting magnitude of 26.5 (AB). These
images yield resolved morphologies for several hundred thousand galaxies. The
small HST PSF also provides greatly enhanced sensitivity for weak lensing
investigations of the dark matter distribution.
","[{""version"":""v1"",""created"":""Tue, 12 Dec 2006 06:51:41 GMT""},{""version"":""v2"",""created"":""Mon, 19 Feb 2007 03:41:30 GMT""}]","2011-09-29"
"astro-ph/0612307","Pieter Buyle","P. Buyle, E. Van Hese, S. De Rijcke, H. Dejonghe","Radial stability of a family of anisotropic Hernquist models with and
  without a supermassive black hole","16 pages, 12 figures, accepted for publication in MNRAS (some figures
  have a lowered resolution)","Mon.Not.Roy.Astron.Soc.375:1157-1170,2007","10.1111/j.1365-2966.2006.11396.x",,"astro-ph",,"  We present a method to investigate the radial stability of a spherical
anisotropic system that hosts a central supermassive black hole (SBH). Such
systems have never been tested before for stability, although high anisotropies
have been considered in the dynamical models that were used to estimate the
masses of the central putative supermassive black holes. A family of analytical
anisotropic spherical Hernquist models with and without a black hole were
investigated by means of N-body simulations. A clear trend emerges that the
supermassive black hole has a significant effect on the overall stability of
the system, i.e. an SBH with a mass of a few percent of the total mass of the
galaxy can prevent or reduce the bar instabilities in anisotropic systems. Its
mass not only determines the strength of the instability reduction, but also
the time in which this occurs. These effects are most significant for models
with strong radial anisotropies. Furthermore, our analysis shows that unstable
systems with similar SBH but with different anisotropy radii evolve
differently: highly radial systems become oblate, while more isotropic models
tend to form into prolate structures. In addition to this study, we also
present a Monte-Carlo algorithm to generate particles in spherical anisotropic
systems.
","[{""version"":""v1"",""created"":""Tue, 12 Dec 2006 08:45:03 GMT""}]","2008-11-26"
"astro-ph/0612308","Ralf Aurich","R. Aurich, S. Lustig, F. Steiner, and H. Then","CMB Alignment in Multi-Connected Universes",,"Class.Quant.Grav.24:1879-1894,2007","10.1088/0264-9381/24/7/013",,"astro-ph",,"  The low multipoles of the cosmic microwave background (CMB) anisotropy
possess some strange properties like the alignment of the quadrupole and the
octopole, and the extreme planarity or the extreme sphericity of some
multipoles, respectively. In this paper the CMB anisotropy of several
multi-connected space forms is investigated with respect to the maximal angular
momentum dispersion and the Maxwellian multipole vectors in order to settle the
question whether such spaces can explain the low multipole anomalies in the
CMB.
","[{""version"":""v1"",""created"":""Tue, 12 Dec 2006 10:25:22 GMT""}]","2008-11-26"
"astro-ph/0612309","Brent Groves","Brent Groves (Max Planck Institute for Astrophysics)","The Narrow Line Region: Current Models and Future Questions","10 pages, Conference proceedings to appear in ""The Central Engine of
  Active Galactic Nuclei"", ed. L. C. Ho and J.-M. Wang (San Francisco: ASP)",,,,"astro-ph",,"  I present a broad overview of modelling of the Narrow Line Region (NLR) of
active galaxies, and discuss some of the more recent models we currently have
for the emission from the NLR. I show why the emission line ratios from the NLR
are constrained to certain observed values, and describe what physical
parameters we can derive from observations using emission line models. Also
presented are some examples of this, looking at the metallicity and excitation
mechanism of active galaxies. As a final point, the limitations of the current
models are discussed, and how how the combination of modelling and theory can
help us solve some of the questions that still remain within the NLR.
","[{""version"":""v1"",""created"":""Tue, 12 Dec 2006 12:32:14 GMT""}]","2007-05-23"
"astro-ph/0612310","Asmus Boehm","Asmus Boehm, Lutz Wisotzki, the GEMS team","No color-morphology bimodality of AGN host galaxies","4 pages, 3 figures, to appear in the ASP Conference Series
  (proceedings of the ""Cosmic Frontiers"" conference held in Durham, UK, 31st
  July - 4th August 2006)",,,,"astro-ph",,"  It is still a matter of debate whether the properties of galaxies hosting an
Active Galactic Nucleus (AGN) are different from the properties of quiescent
galaxies. We constructed a sample of ~50 AGN at a mean redshift of <z>~0.6 that
lack a detectable optical nucleus. This characteristic allows to study the
properties of the host galaxies with much higher accuracy than in the case of
""normal"" AGN which show a prominent central point source in optical images. A
comparison sample of X-ray faint, quiescent galaxies at intermediate redshifts
shows a clear bimodality in terms of both rest-frame colors and morphological
concentration indicators. In contrast to this, the AGN host galaxies comprise a
large fraction of objects that have early-type morphologies but relatively blue
rest-frame colors, possibly due to recent or ongoing star formation. A fraction
of the ""optically dull"" AGN in our sample show evidence for kpc-scale
absorption; low Supermassive Black Hole accretion rates are more likely in
other cases.
","[{""version"":""v1"",""created"":""Tue, 12 Dec 2006 13:38:18 GMT""}]","2007-05-23"
"astro-ph/0612311","Alexis Finoguenov","G. Hasinger (MPE), N. Cappelluti (MPE), H. Brunner (MPE), M. Brusa
  (MPE), A. Comastri (INAF-OABo), M. Elvis (CfA), A. Finoguenov (MPE), F. Fiore
  (INAF-OAR), A. Franceschini (Uni. Padova) R. Gilli (INAF-OABo), R. E.
  Griffiths (CMU), I. Lehmann (MPE), V. Mainieri (MPE), G. Matt (Uni. Roma
  Tre), I. Matute (MPE; INAF-OAA), T. Miyaji (CMU), S. Molendi (INAF/IASF), S.
  Paltani (ISDC), D. B. Sanders (IfA), N. Scoville (CIT; UH), L. Tresse (LAM),
  C. M. Urry (Yale), P. Vettolani (INAF-IRA), G. Zamorani (INAF-OABo)","The XMM-Newton wide-field survey in the COSMOS field: I. Survey
  description","9 pages, ApJS COSMOS Special Issue, 2007 in press. the
  full-resolution version is available at
  http://www.mpe.mpg.de/XMMCosmos/PAPERS/grh_cosmos.ps.gz",,"10.1086/516576",,"astro-ph",,"  We present the first set of XMM-Newton EPIC observations in the 2 square
degree COSMOS field. The strength of the COSMOS project is the unprecedented
combination of a large solid angle and sensitivity over the whole
multiwavelength spectrum. The XMM-Newton observations are very efficient in
localizing and identifying active galactic nuclei (AGN) and clusters as well as
groups of galaxies. One of the primary goals of the XMM-Newton Cosmos survey is
to study the co-evolution of active galactic nuclei as a function of their
environment in the Cosmic web. Here we present the log of observations, images
and a summary of first research highlights for the first pass of 25 XMM-Newton
pointings across the field. In the existing dataset we have detected 1416 new
X-ray sources in the 0.5-2, 2-4.5 and 4.5-10 keV bands to an equivalent 0.5-2
keV flux limit of 7x10-16 erg cm-2 s-1. The number of sources is expected to
grow to almost 2000 in the final coverage of the survey. From an X-ray color
color analysis we identify a population of heavily obscured, partially leaky or
reflecting absorbers, most of which are likely to be nearby, Compton-thick AGN.
","[{""version"":""v1"",""created"":""Tue, 12 Dec 2006 15:19:20 GMT""}]","2009-11-11"
"astro-ph/0612312","Jorge Casares","Jorge Casares","Observational evidence for stellar-mass black holes","9 pages, invited review to appear in Proceedings of IAU Symposium
  238: ""Black Holes: From Stars to Galaxies -Across the Range of Masses"".
  Prague 14-18 August 2006",,"10.1017/S1743921307004590",,"astro-ph",,"  Radial velocity studies of X-ray binaries provide the most solid evidence for
the existence of stellar-mass black holes. We currently have 20 confirmed
cases, with dynamical masses in excess of 3 Msun. Accurate masses have been
obtained for a subset of systems which gives us a hint at the mass spectrum of
the black hole population. This review summarizes the history of black hole
discoveries and presents the latest results in the field.
","[{""version"":""v1"",""created"":""Tue, 12 Dec 2006 14:23:46 GMT""}]","2015-06-24"
"astro-ph/0612313","Agnieszka Pollo","A. Pollo, L. Guzzo, O. Le Fevre, B. Meneux, and the VVDS team","The VIMOS-VLT Deep Survey: Dependence of Galaxy Clustering on Luminosity","2 pages, 2 figures, to appear in the proceedings of the ""Cosmic
  Frontiers"" conference, Durham, August 2006",,,,"astro-ph",,"  We have investigated the dependence of galaxy clustering on their intrinsic
luminosities at z ~ 1, using the data from the First Epoch VIMOS-VLT Deep
Survey (VVDS). We have measured the projected two-point correlation function of
galaxies, w_p(r_p), for a set of volume-limited samples at an effective
redshift <z>=0.9 and median absolute magnitude -19.6< M_B < -21.3. We find that
the clustering strength is rising around M_B^*, apparently with a sharper turn
than observed at low redshifts. The slope of the correlation function is
observed to steepen significantly from \gamma=1.6^{+0.1}_{-0.1} to
\gamma=2.4^{+0.4}_{-0.2}. This is due to a significant change in the shape of
w_p(r_p), increasingly deviating from a power-law for the most luminous
samples, with a strong upturn at small (< 1-2 h^{-1} Mpc) scales. This trend,
not observed locally, also results in a strong scale dependence of the relative
bias, b/b* and possibly imply a significant change in the way luminous galaxies
trace dark-matter halos at z ~ 1 with respect to z ~ 0.
","[{""version"":""v1"",""created"":""Tue, 12 Dec 2006 14:29:46 GMT""}]","2007-05-23"
"astro-ph/0612314","Eva Schinnerer","E. Schinnerer, V. Smolcic (1), C.L. Carilli (2), M. Bondi, P. Ciliegi
  (3), K. Jahnke (1), N.Z. Scoville (4), H. Aussel (5), F. Bertoldi (6), A.W.
  Blain (4), C.D. Impey (7), A.M. Koekemoer (8), O. Le Fevre (9), C.M. Urry
  (10) ((1) MPIA, (2) NRAO, (3) INAF, (4) CalTech, (5) CEA/Saclay, (6) AIfA,
  (7) Univ. of Arizona, (8) STScI, (9) LAM, (10) Yale)","The VLA-COSMOS Survey: II. Source Catalog of the Large Project","49 pages, 18 figures; accepted for publication in the ApJS, COSMOS
  special issue. The data will be available from the COSMOS archive at
  IPAC/IRSA http://irsa.ipac.caltech.edu/Missions/cosmos.html, more information
  on the VLA-COSMOS survey can be found at http://www.mpia-hd.mpg.de/COSMOS/,
  full version available at http://www.mpia-hd.mpg.de/COSMOS/#paper",,"10.1086/516587",,"astro-ph",,"  The VLA-COSMOS large project is described and its scientific objective is
discussed. We present a catalog of ~ 3,600 radio sources found in the 2deg^2
COSMOS field at 1.4 GHz. The observations in the VLA A and C configuration
resulted in a resolution of 1.5''x1.4'' and a mean rms noise of ~ 10.5(15)
uJy/beam in the central 1(2)deg^2. 80 radio sources are clearly extended
consisting of multiple components, and most of them appear to be double-lobed
radio galaxies. The astrometry of the catalog has been thoroughly tested and
the uncertainty in the relative and absolute astrometry are 130mas and <55mas,
respectively.
","[{""version"":""v1"",""created"":""Tue, 12 Dec 2006 14:39:08 GMT""}]","2009-11-11"
"astro-ph/0612315","Anna Lia Longinotti","A.L.Longinotti, S.Sim, K.Nandra, M.Cappi, P. O'Neill","Relativistic inflow in the Seyfert 1 Mrk 335 revealed through X-ray
  absorption","Conference proceedings to appear in ""The Central Engine of Active
  Galactic Nuclei"", ed. L. C. Ho and J.-M. Wang (San Francisco: ASP)",,,,"astro-ph",,"  The analysis of hard X-ray features in XMM-Newton data of the bright Sy 1
galaxy Mrk 335 is reported here. The presence of a broad, ionised iron K alpha
emission line in the spectrum, first found by Gondoin et al.(2002), is
confirmed. The broad line can be modeled successfully by relativistic accretion
disc reflection models.
  Regardless of the underlying continuum we report, for the first time in this
source, the detection of a narrow absorption feature at the rest frame energy
of ~5.9 keV. If the feature is identified with a resonance absorption line of
iron in a highly ionised medium, the redshift of the line corresponds to an
inflow velocity of ~0.11-0.15 c. Preliminary results from a longer (100ks)
exposure are also presented.
","[{""version"":""v1"",""created"":""Tue, 12 Dec 2006 15:04:54 GMT""}]","2007-05-23"
"astro-ph/0612317","Anna Lia Longinotti","A.L. Longinotti, S. Bianchi, M. Guainazzi, J. Roa-Llamazares, M.
  Santos-Lleo (European Space Astronomy Centre of ESA, Villafranca del
  Castillo, Spain)","Search for narrow energy-shifted lines in XMM-Newton AGN spectra","6 pages,4 figures, contributed talk presented at the Workshop ""The
  multicoloured landscape of compact objects and their explosive origin"",
  Cefalu' (Sicily), 11-24 June 2006, to be published by AIP","AIPConf.Proc.924:795-800,2007","10.1063/1.2774944",,"astro-ph",,"  The detection of X-ray narrow spectral features in the 5-7 keV band is
becoming increasingly more common in AGN observations, thanks to the
capabilities of current X-ray satellites. Such lines, both in emission and in
absorption, are mostly interpreted as arising from Iron atoms. When observed
with some displacement from their rest frame position, these lines carry the
potential to study the motion of circumnuclear gas in AGN, providing a
diagnostic of the effects of the gravitational field of the central black hole.
These narrow features have been often found with marginal statistical
significance. We are carrying on a systematic search for narrow features using
spectra of bright type 1 AGNs available in the XMM-Newton archive. The aim of
this work is to characterise the occurrence of the narrow features phenomenon
on a large sample of objects and to estimate the significance of the features
through Monte Carlo simulations. The project and preliminary results are
presented.
","[{""version"":""v1"",""created"":""Tue, 12 Dec 2006 15:32:28 GMT""}]","2008-11-26"
"cond-mat/0612235","Samanta Piano","Samanta Piano, J.W.A. Robinson, G. Burnell, M.G. Blamire","0-pi oscillations in nanostructured Nb/Fe/Nb Josephson junctions","7 pages, 5 figures, accepted for publication in Eur. Phys. J. B","Eur. Phys. J. B 58, 123 (2007)","10.1140/epjb/e2007-00210-8",,"cond-mat.supr-con cond-mat.mtrl-sci",,"  The physics of the $\pi$ phase shift in ferromagnetic Josephson junctions may
enable a range of applications for spin-electronic devices and quantum
computing. We investigate transitions from ``0'' to ``$\pi$'' states in
Nb/Fe/Nb Josephson junctions by varying the Fe barrier thickness from 0.5 nm to
5.5 nm. From magnetic measurements we estimate for Fe a magnetic dead layer of
about 1.1 nm. By fitting the characteristic voltage oscillations with existing
theoretical models we extrapolate an exchange energy of 256 meV, a Fermi
velocity of $1.98 \times 10^5$ m/s and an electron mean free path of 6.2 nm, in
agreement with other reported values. From the temperature dependence of the
$I_CR_N$ product we show that its decay rate exhibits a nonmonotonic
oscillatory behavior with the Fe barrier thickness.
","[{""version"":""v1"",""created"":""Mon, 11 Dec 2006 17:53:52 GMT""},{""version"":""v2"",""created"":""Tue, 10 Jul 2007 13:11:52 GMT""}]","2008-07-05"
"cond-mat/0612261","Navinder Singh","Navinder Singh","Controllable diffusion of cold atoms in a harmonically driven and tilted
  optical lattice: Decoherence by spontaneous emission","16 pages, 7 figures, revised version","J. Phys. A: Math. Theor. 41 (2008) 255001","10.1088/1751-8113/41/25/255001",,"cond-mat.stat-mech cond-mat.other physics.optics",,"  We have studied some transport properties of cold atoms in an accelerated
optical lattice in the presence of decohering effects due to spontaneous
emission. One new feature added is the effect of an external AC drive. As a
result we obtain a tunable diffusion coefficient and it's nonlinear enhancement
with increasing drive amplitude. We report an interesting maximum diffusion
condition.
","[{""version"":""v1"",""created"":""Mon, 11 Dec 2006 16:03:30 GMT""},{""version"":""v2"",""created"":""Sun, 22 Jul 2007 11:32:42 GMT""},{""version"":""v3"",""created"":""Wed, 7 May 2008 11:12:15 GMT""}]","2009-09-29"
"cond-mat/0612262","Martin Ondr\'a\v{c}ek","M. Ondracek, F. Maca, J. Kudrnovsky, J. Redinger, A. Biedermann, C.
  Fritscher, M. Schmid and P. Varga","Chemical ordering and composition fluctuations at the (001) surface of
  the Fe-Ni Invar alloy","7 pages, 5 figures","Physical Review B 74 (2006), 235437","10.1103/PhysRevB.74.235437",,"cond-mat.mtrl-sci",,"  We report on a study of (001) oriented fcc Fe-Ni alloy surfaces which
combines first-principles calculations and low-temperature STM experiments.
Density functional theory calculations show that Fe-Ni alloy surfaces are
buckled with the Fe atoms slightly shifted outwards and the Ni atoms inwards.
This is consistent with the observation that the atoms in the surface layer can
be chemically distinguished in the STM image: brighter spots (corrugation
maxima with increased apparent height) indicate iron atoms, darker ones nickel
atoms. This chemical contrast reveals a c2x2 chemical order (50% Fe) with
frequent Fe-rich defects on Invar alloy surface. The calculations also indicate
that subsurface composition fluctuations may additionally modulate the apparent
height of the surface atoms. The STM images show that this effect is pronounced
compared to the surfaces of other disordered alloys, which suggests that some
chemical order and corresponding concentration fluctuations exist also in the
subsurface layers of Invar alloy. In addition, detailed electronic structure
calculations allow us to identify the nature of a distinct peak below the Fermi
level observed in the tunneling spectra. This peak corresponds to a surface
resonance band which is particularly pronounced in iron-rich surface regions
and provides a second type of chemical contrast with less spatial resolution
but one that is essentially independent of the subsurface composition.
","[{""version"":""v1"",""created"":""Mon, 11 Dec 2006 16:12:23 GMT""}]","2007-05-23"
"cond-mat/0612263","Andrew John Daley","A. Griessner, A. J. Daley, S. R. Clark, D. Jaksch, and P. Zoller","Dissipative dynamics of atomic Hubbard models coupled to a phonon bath:
  Dark state cooling of atoms within a Bloch band of an optical lattice","18 Pages, 16 Figures, ReVTeX 4","New J. Phys 9, 44 (2007)","10.1088/1367-2630/9/2/044",,"cond-mat.other quant-ph",,"  We analyse a laser assisted sympathetic cooling scheme for atoms within the
lowest Bloch band of an optical lattice. This scheme borrows ideas from
sub-recoil laser cooling, implementing them in a new context in which the atoms
in the lattice are coupled to a BEC reservoir. In this scheme, excitation of
atoms between Bloch bands replaces the internal structure of atoms in normal
laser cooling, and spontaneous emission of photons is replaced by creation of
excitations in the BEC reservoir. We analyse the cooling process for many
bosons and fermions, and obtain possible temperatures corresponding to a small
fraction of the Bloch band width within our model. This system can be seen as a
novel realisation of a many-body open quantum system.
","[{""version"":""v1"",""created"":""Mon, 11 Dec 2006 16:20:29 GMT""}]","2009-01-15"
"cond-mat/0612264","Zhi-Feng Huang","Zhi-Feng Huang and Jorge Vinals","Grain boundary dynamics in stripe phases of non potential systems","8 pages, 8 figures","Phys. Rev. E 75, 056202 (2007)","10.1103/PhysRevE.75.056202",,"cond-mat.soft nlin.PS",,"  We describe numerical solutions of two non potential models of pattern
formation in nonequilibrium systems to address the motion and decay of grain
boundaries separating domains of stripe configurations of different
orientations. We first address wavenumber selection because of the boundary,
and possible decay modes when the periodicity of the stripe phases is different
from the selected wavenumber for a stationary boundary. We discuss several
decay modes including long wavelength undulations of the moving boundary as
well as the formation of localized defects and their subsequent motion. We find
three different regimes as a function of the distance to the stripe phase
threshold and initial wavenumber, and then correlate these findings with domain
morphology during domain coarsening in a large aspect ratio configuration.
","[{""version"":""v1"",""created"":""Mon, 11 Dec 2006 19:02:06 GMT""}]","2009-11-11"
