"math/0612309","Sergei Sergeev","Sergei Sergeev","Universal algorithms for generalized discrete matrix Bellman equations
  with symmetric Toeplitz matrix","11 pages","Tambov Univ. Reports, ser. Natural and Technical Sciences, 16(6,
  part 2), 2011, 1751-1758",,,"math.RA",,"  This paper presents two universal algorithms for generalized Bellman
equations with symmetric Toeplitz matrix. The algorithms are semiring
extensions of two well-known methods solving Toeplitz systems in the ordinary
linear algebra.
","[{""version"":""v1"",""created"":""Tue, 12 Dec 2006 10:32:58 GMT""}]","2014-01-16"
"math/0612310","Gert-Martin Greuel","Gert-Martin Greuel, Christoph Lossen, Eugenii Shustin","Equisingular Families of Projective Curves","39 pages","Global Aspects of Complex Geometry, Springer Verlag (2006),
  171-210",,,"math.AG math.AC",,"  In this survey, we report on progress concerning families of projective
curves with fixed number and fixed (topological or analytic) types of
singularities. We are, in particular, interested in numerical, universal and
asymptotically proper sufficient conditions to guarantee the nonemptyness,
T-smoothness and irreducibility of the variety of all projective curves with
prescribed singularities in a fixed linear system. We also discuss the
analogous problem for hypersurfaces of arbitrary dimension with isolated
singularities, and we close with a section on open problems and conjectures.
","[{""version"":""v1"",""created"":""Tue, 12 Dec 2006 10:43:30 GMT""}]","2007-05-23"
"math/0612311","Lars Winther Christensen","Lars Winther Christensen and Sean Sather-Wagstaff","Descent via Koszul extensions","Updated references and made minor changes. Final version, to appear
  in J. Algebra; 19 pp",,,,"math.AC",,"  Let R be a commutative noetherian local ring with completion R^. We apply
differential graded (DG) algebra techniques to study descent of modules and
complexes from R^ to R' where R' is either the henselization of R or a pointed
\'etale neighborhood of R: We extend a given R^-complex to a DG module over a
Koszul complex; we describe this DG module equationally and apply Artin
approximation to descend it to R.
  This descent result for Koszul extensions has several applications. When R is
excellent, we use it to descend the dualizing complex from R^ to a pointed
\'etale neighborhood of R; this yields a new version of P. Roberts' theorem on
uniform annihilation of homology modules of perfect complexes. As another
application we prove that the Auslander Condition on uniform vanishing of
cohomology ascends to R^ when R is excellent, henselian, and Cohen--Macaulay.
","[{""version"":""v1"",""created"":""Tue, 12 Dec 2006 13:35:43 GMT""},{""version"":""v2"",""created"":""Fri, 20 Apr 2007 16:08:31 GMT""},{""version"":""v3"",""created"":""Fri, 29 Feb 2008 15:42:54 GMT""},{""version"":""v4"",""created"":""Sat, 1 Mar 2008 00:11:13 GMT""}]","2008-03-01"
"math/0612312","Vincent Bansaye","Vincent Bansaye (PMA)","On a model for the storage of files on a hardware II : Evolution of a
  typical data block",,,,,"math.PR",,"  We consider a generalized version in continuous time of the parking problem
of Knuth. Files arrive following a Poisson point process and are stored on a
hardware identified with the real line, at the right of their arrival point. We
study here the evolution of the extremities of the data block straddling 0,
which is empty at time 0 and is equal to $\RRR$ at a deterministic time.
","[{""version"":""v1"",""created"":""Tue, 12 Dec 2006 13:38:02 GMT""}]","2007-05-23"
"math/0612313","Thomas Mueller-Gronbach","J. Creutzig, T. Mueller-Gronbach, K. Ritter","Free-Knot Spline Approximation of Stochastic Processes","23 pages",,,,"math.PR",,"  We study optimal approximation of stochastic processes by polynomial splines
with free knots. The number of free knots is either a priori fixed or may
depend on the particular trajectory. For the $s$-fold integrated Wiener process
as well as for scalar diffusion processes we determine the asymptotic behavior
of the average $L_p$-distance to the splines spaces, as the (expected) number
$k$ of free knots tends to infinity.
","[{""version"":""v1"",""created"":""Tue, 12 Dec 2006 14:03:31 GMT""}]","2007-05-23"
"math/0612315","Jean-Fran\c{c}ois Le Gall","J.F. Le Gall, F. Paulin","Scaling limits of bipartite planar maps are homeomorphic to the 2-sphere","22 pages Second version with minor typographical correction",,,,"math.PR math.CO",,"  We prove that scaling limits of random planar maps which are uniformly
distributed over the set of all rooted 2k-angulations are a.s. homeomorphic to
the two-dimensional sphere. Our methods rely on the study of certain random
geodesic laminations of the disk.
","[{""version"":""v1"",""created"":""Tue, 12 Dec 2006 15:02:38 GMT""},{""version"":""v2"",""created"":""Fri, 15 Dec 2006 10:19:39 GMT""}]","2007-05-23"
"math/0612316","David Hurtubise","Augustin Banyaga and David E. Hurtubise","Morse-Bott homology","53 pages, 4 figures","Trans. Amer. Math. Soc., 362, no. 8, p. 3997-4043, 2010",,,"math.AT math.DS math.GT",,"  We give a new proof of the Morse Homology Theorem by constructing a chain
complex associated to a Morse-Bott-Smale function that reduces to the
Morse-Smale-Witten chain complex when the function is Morse-Smale and to the
chain complex of smooth singular $N$-cube chains when the function is constant.
We show that the homology of the chain complex is independent of the
Morse-Bott-Smale function by using compactified moduli spaces of time dependent
gradient flow lines to prove a Floer-type continuation theorem.
","[{""version"":""v1"",""created"":""Tue, 12 Dec 2006 15:38:16 GMT""},{""version"":""v2"",""created"":""Fri, 12 Oct 2007 00:53:50 GMT""}]","2013-01-04"
"nlin/0612023","Georg Gottwald A.","S. Balasuriya, G.A. Gottwald, J. Hornibrook and S. Lafortune","High Lewis number combustion wavefronts: a perturbative Melnikov
  analysis","accepted for publication by SIAM Journal on Applied Mathematics",,,,"nlin.PS",,"  The wavefronts associated with a one-dimensional combustion model with
Arrhenius kinetics and no heat loss are analyzed within the high Lewis number
perturbative limit. This situation, in which fuel diffusivity is small in
comparison to that of heat, is appropriate for highly dense fluids. A formula
for the wavespeed is established by a non-standard application of Melnikov's
method and slow manifold theory from dynamical systems, and compared to
numerical results. A simple characterization of the wavespeed correction is
obtained: it is proportional to the ratio between the exothermicity parameter
and the Lewis number. The perturbation method developed herein is also
applicable to more general coupled reaction-diffusion equations with strongly
differing diffusivities. The stability of the wavefronts is also tested using a
numerical Evans function method.
","[{""version"":""v1"",""created"":""Mon, 11 Dec 2006 21:47:57 GMT""}]","2007-05-23"
"nlin/0612024","Harold Fellermann","Harold Fellermann, Steen Rasmussen, Hans-Joachim Ziock, Ricard V. Sole","Life cycle of a minimal protocell - a dissipative particle dynamics
  (DPD) study","16 pages, 12 figures, submitted to Journal of Artificial Life",,,,"nlin.AO",,"  Cross-reactions and other systematic issues generated by the coupling of
functional chemical subsystems pose the largest challenge for assembling a
viable protocell in the laboratory. Our current work seeks to identify and
clarify such key issues as we represent and analyze in simulation a full
implementation of a minimal protocell. Using a 3D dissipative particle dynamics
(DPD) simulation method we are able to address the coupled diffusion,
self-assembly, and chemical reaction processes, required to model a full life
cycle of the protocell, the protocell being composed of coupled genetic,
metabolic, and container subsystems. Utilizing this minimal structural and
functional representation of the constituent molecules, their interactions, and
their reactions, we identify and explore the nature of the many linked
processes for the full protocellular system.
","[{""version"":""v1"",""created"":""Tue, 12 Dec 2006 01:43:47 GMT""}]","2007-05-23"
"nlin/0612025","Andrey Tsiganov","A. V. Tsiganov","A family of the Poisson brackets compatible with the Sklyanin bracket","16 pages, LaTeX with Amsfonts; corrected typos",,"10.1088/1751-8113/40/18/008",,"nlin.SI",,"  We introduce a family of compatible Poisson brackets on the space of $2\times
2$ polynomial matrices, which contains the Sklyanin bracket, and use it to
derive a multi-Hamiltonian structure for a set of integrable systems that
includes $XXX$ Heisenberg magnet, the open and periodic Toda lattices, the
discrete self-trapping model and the Goryachev-Chaplygin gyrostat.
","[{""version"":""v1"",""created"":""Tue, 12 Dec 2006 05:09:07 GMT""},{""version"":""v2"",""created"":""Sat, 10 Mar 2007 17:45:12 GMT""}]","2015-06-26"
"nlin/0612026","Bruno. Cessac","Bruno Cessac and Jacques-Alexandre Sepulchre","Linear response, susceptibility and resonances in chaotic toy models","36 pages, 11 Figures, to appear in Physica D","Physica D, Volume 225, Issue 1, Pages 13-28, (2007)","10.1016/j.physd.2006.09.034",,"nlin.CD cond-mat.stat-mech math.DS",,"  We consider simple examples illustrating some new features of the linear
response theory developed by Ruelle for dissipative and chaotic systems [{\em
J. of Stat. Phys.} {\bf 95} (1999) 393]. In this theory the concepts of linear
response, susceptibility and resonance, which are familiar to physicists, have
been revisited due to the dynamical contraction of the whole phase space onto
attractors. In particular the standard framework of the
""fluctuation-dissipation"" theorem breaks down and new resonances can show up
oustside the powerspectrum. In previous papers we proposed and used new
numerical methods to demonstrate the presence of the new resonances predicted
by Ruelle in a model of chaotic neural network. In this article we deal with
simpler models which can be worked out analytically in order to gain more
insights into the genesis of the ``stable'' resonances and their consequences
on the linear response of the system. We consider a class of 2-dimensional
time-discrete maps describing simple rotator models with a contracting radial
dynamics onto the unit circle and a chaotic angular dynamics $\theta_{t+1} = 2
\theta_t (\mod 2\pi)$. A generalisation of this system to a network of
interconnected rotators is also analysed and related with our previous studies
\cite{CS1,CS2}. These models permit us to classify the different types of
resonances in the susceptibility and to discuss in particular the relation
between the relaxation time of the system to equilibrium with the {\em mixing}
time given by the decay of the correlation functions. Also it enables one to
propose some general mechanisms responsible for the creation of stable
resonances with arbitrary frequencies, widths, and dependency on the pair of
perturbed/observed variables.
","[{""version"":""v1"",""created"":""Tue, 12 Dec 2006 08:05:46 GMT""}]","2009-11-11"
"nlin/0612027","Dmitry Levko","Dmitry Levko (Institute of Physics National Ukrainian Academy of
  Sciences)","The method of solving of nonlinear Schr\""odinger equation","2 pages",,,,"nlin.SI",,"  The method of solving of nonlinear Schr\""odinger equation is considered. Some
examples of its applications are demonstrated.
","[{""version"":""v1"",""created"":""Tue, 12 Dec 2006 13:10:02 GMT""}]","2007-05-23"
"nlin/0612028","Victor M. Perez-Garcia","Victor M. Perez-Garcia","Nonlinear Supression of Tunneling and Strong Localization in
  Bose-Einstein Condensates with Spatially Inhomogeneous Interactions",,,,,"nlin.PS",,"  We study the properties of the ground state of Bose-Einstein condensates with
spatially inhomogeneous interactions and show that the atom density experiences
a strong localization at the spatial region where the scattering length is
close to zero while tunneling to regions with positive values of the scattering
length is strongly supressed by the nonlinear interactions.
","[{""version"":""v1"",""created"":""Tue, 12 Dec 2006 14:15:42 GMT""},{""version"":""v2"",""created"":""Wed, 3 Jan 2007 15:03:27 GMT""}]","2007-05-23"
"nucl-ex/0612016","Heinz A. Clement","T. Skorodko, M.Bashkanov, C. Bargholtz, D. Bogoslawsky, H. Calen, F.
  Cappellaro, H. Clement, L. Demiroers, E. Doroshkevich, D. Duniec, C. Ekstrom,
  K. Fransson, L. Geren, L. Gustafsson. B. Hoistad, G. Ivanov, l M. Jacewicz,
  E. Jiganov, T. Johansson, M. Kaskulov, O. Khakimova, S. Keleta, I. Koch, F.
  Kren, S. Kullander, A. Kupsc, A. Kuznetsov, K. Lindberg, P. Marciniewski, B.
  Martemyanov, R. Meier,, B. Morosov, W. Oelert,, C. Pauly, H. Pettersson, Y.
  Petukhov, A. Povtorejko, A. Pricking, R. J. M. Y. Ruber, K. Schonning, W.
  Scobel, B. Shwartz, V. Sopov, J. Stepaniak, P.-E. Tegner, P.
  Thorngren-Engholm, V. Tikhomirov, A. Turowiecki, G. J. Wagner, M. Wolke, A.
  Yamamoto, J. Zabierowski, I. Zartova, J. Zlomanczuk","Two-Pion Production in Nucleon-Nucleon Collisions and the ABC-Effect -
  Approaching a Puzzleby exclusive and Kinematically complete Measurements",,"Proc. CRIMEA06 Int. Conf. ""New Trends in Heigh Energy Physics"",
  Yalta, Crimea 2006",,,"nucl-ex",,"  The ABC effect - a puzzling low-mass enhancement in the $\pi\pi$ invariant
mass spectrum - is known from inclusive measurements of two-pion production in
nuclear collisions, where it always showed up, if the participating nucleons
fused to a bound nuclear system in the final state. The first exclusive
measurements on the ABC effect have been carried out very recently at
CELSIUS-WASA for the fusion reactions leading to d, $^3$He and $^4$He nuclei in
the final state. The data analyzed so far for the fusion processes to d and
$^3$He reveal this effect to be a $\sigma$ channel phenomenon associated with
the formation of a strongly attractive $\Delta\Delta$ system. The data for the
strictly isospin-selective double-pionic fusion to $^4$He, where we expect the
largest effect, are currently still analyzed. All inclusive data on this system
are well described by our model, too. This case also constitutes the heaviest
nuclear system, where exclusive measurements of double-pionic fusion can be
carried out with present-day instruments. Surprisingly, the $pp \to
pp\pi^0\pi^0$ reaction in the $\Delta\Delta$ region is observed to also show a
ABC-like low-$\pi\pi$ mass enhancement, a phenomenon, which deserves special
attention.
","[{""version"":""v1"",""created"":""Mon, 11 Dec 2006 16:33:16 GMT""}]","2007-05-23"
"nucl-th/0612048","John W. Norbury","John W. Norbury, Lawrence W. Townsend and Ryan B. Norman","Threshold meson production and cosmic ray transport","9 pages, 1 figure","J.Phys.G34:115-122,2007","10.1088/0954-3899/34/1/007",,"nucl-th astro-ph physics.space-ph",,"  An interesting accident of nature is that the peak of the cosmic ray
spectrum, for both protons and heavier nuclei, occurs near the pion production
threshold. The Boltzmann transport equation contains a term which is the cosmic
ray flux multiplied by the cross section. Therefore when considering pion and
kaon production from proton-proton reactions, small cross sections at low
energy can be as important as larger cross sections at higher energy. This is
also true for subthreshold kaon production in nuclear collisions, but not for
subthreshold pion production.
","[{""version"":""v1"",""created"":""Mon, 11 Dec 2006 17:28:09 GMT""}]","2008-11-26"
"nucl-th/0612049","Olena Linnyk","O. Linnyk, E. L. Bratkovskaya, W. Cassing, H. Stoecker","Charmonium dynamics in nucleus-nucleus collisions at SPS and FAIR
  energies","22 pages, 10 figures. v2: comments added according to referee
  suggestions; references updated; Nucl. Phys. A, in press","Nucl.Phys.A786:183-200,2007","10.1016/j.nuclphysa.2007.01.090",,"nucl-th hep-ph",,"  Charmonium production and suppression in In+In and Pb+Pb reactions at SPS
energies is investigated with the HSD transport approach within the 'hadronic
comover model' as well as the 'QGP threshold scenario'. The results of the
transport calculations for J/Psi suppression and the Psi prime to J/Psi ratio
are compared with the recent data of the NA50 and NA60 Collaborations. We find
that the comover absorption model - with a single parameter |M_0|^2 for the
matrix element squared for charmonium-meson dissociation - performs best with
respect to all data sets. The 'threshold scenario' - within different
assumptions for the melting energy densities - yields a reasonable suppression
for J/Psi but fails in reproducing the Psi prime to J/Psi ratio for Pb+Pb at
158 A GeV. Predictions for Au+Au reactions are presented for a bombarding
energy of 25 A GeV in the different scenarios which will allow for a clear
distinction between the models from the experimental side at the future FAIR
facility.
","[{""version"":""v1"",""created"":""Mon, 11 Dec 2006 17:48:51 GMT""},{""version"":""v2"",""created"":""Tue, 23 Jan 2007 15:21:37 GMT""}]","2008-11-26"
"nucl-th/0612050","Xiao-Ming Xu","Ru Peng, Xiao-Ming Xu, Dai-Cui Zhou","Baryonic Effect on chi_cJ Suppression in Au+Au Collisions at RHIC
  Energies","10 pages, 3 figures, Latex, a discussion added to the reference","Chin.Phys.Lett.21:1031-1034,2004","10.1088/0256-307X/21/6/014",,"nucl-th",,"  We predict that initially produced chi_cJ mesons at low transverse momentum
in the central rapidity region are almost dissociated by nucleons and
antinucleons in hadronic matter produced in central Au+Au collisions at RHIC
energies sqrt {s_{NN}}= 130 and 200 GeV. In calculations the nucleon and
antinucleon distributions in hadronic matter are results of evolution from
their freeze-out distributions which well fit the experimental p_T spectra of
proton and antiproton. Any measured chi_cJ mesons at low p_T are generated from
deconfined matter and give an explicit proof of regeneration mechanism
(recombination mechanism).
","[{""version"":""v1"",""created"":""Tue, 12 Dec 2006 09:38:14 GMT""}]","2010-01-15"
"nucl-th/0612051","Joan Soto","Jorge Mondejar, Joan Soto","The nucleon-nucleon potential beyond the static approximation","20 pages. Misprints corrected, explanations and references added.
  Journal version. Corrected misprints in formulas 30,31 and 32 in Journal
  version","Eur.Phys.J.A32:77-85,2007","10.1140/epja/i2006-10357-4","UB-ECM-PF 06/28","nucl-th hep-lat hep-ph",,"  We point out that, due to the use of static nucleon propagators in Heavy
Baryon Chiral Perturbation Theory, the current calculations of the
nucleon-nucleon potential miss certain contributions starting at two loops.
These contributions give rise to contact interactions, which are both
parametrically and numerically more important than the so called NNLO
potentials. They show a peculiar dependence on the light quark masses, which
should be taken into account when performing chiral extrapolations of lattice
data. However, they do not appear to have an impact on phenomenology since they
can be absorbed into redefinitions of unknown parameters which are usually
fitted to data.
","[{""version"":""v1"",""created"":""Tue, 12 Dec 2006 11:39:40 GMT""},{""version"":""v2"",""created"":""Thu, 10 May 2007 16:49:19 GMT""},{""version"":""v3"",""created"":""Wed, 12 Sep 2007 14:47:23 GMT""}]","2008-11-26"
"physics/0612084","Josep Perello","Zoltan Eisler, Josep Perello, Jaume Masoliver","Volatility: a hidden Markov process in financial time series","17 pages, 9 colored figures","Physical Review E 76 (2007) 056105.","10.1103/PhysRevE.76.056105",,"physics.soc-ph physics.data-an q-fin.ST",,"  The volatility characterizes the amplitude of price return fluctuations. It
is a central magnitude in finance closely related to the risk of holding a
certain asset. Despite its popularity on trading floors, the volatility is
unobservable and only the price is known. Diffusion theory has many common
points with the research on volatility, the key of the analogy being that
volatility is the time-dependent diffusion coefficient of the random walk for
the price return. We present a formal procedure to extract volatility from
price data, by assuming that it is described by a hidden Markov process which
together with the price form a two-dimensional diffusion process. We derive a
maximum likelihood estimate valid for a wide class of two-dimensional diffusion
processes. The choice of the exponential Ornstein-Uhlenbeck (expOU) stochastic
volatility model performs remarkably well in inferring the hidden state of
volatility. The formalism is applied to the Dow Jones index. The main results
are: (i) the distribution of estimated volatility is lognormal, which is
consistent with the expOU model; (ii) the estimated volatility is related to
trading volume by a power law of the form $\sigma \propto V^{0.55}$; and (iii)
future returns are proportional to the current volatility which suggests some
degree of predictability for the size of future returns.
","[{""version"":""v1"",""created"":""Mon, 11 Dec 2006 16:08:54 GMT""},{""version"":""v2"",""created"":""Tue, 12 Dec 2006 09:21:27 GMT""},{""version"":""v3"",""created"":""Fri, 27 Jul 2007 08:30:23 GMT""}]","2008-12-02"
"physics/0612096","J. Zheng-Johansson X.","J. X. Zheng-Johansson","A Theory of Gravity and General Relativity based on Quantum
  Electromagnetism","This edition: updated references and text of arxiv:physics/0612096v2.
  arxiv:physics/0612096v2: presentation at Int Conf Integrable Systems and
  Quantum Symmetries ISQS25, Prague, 2017, 12 pages. arxiv:physics/0612096v1:
  Dielectric theory of the vacuum, 10 pages, 2 figures",,,,"physics.gen-ph","http://arxiv.org/licenses/nonexclusive-distrib/1.0/","  Based on first principles solutions in a unified framework of quantum
mechanics and electromagnetism we predict the presence of a universal
attractive depolarisation radiation (DR) Lorentz force ($F$) between quantum
entities, each being either an IED matter particle or light quantum, in a
vacuuonic dielectric vacuum. Given two quantum entities $i=1,2$ of either kind,
of characteristic frequencies $\nu_i^0$, masses $m_i^0=h\nu_i^0 / c^2$ and
separated at a distance r^0, the solution is $F=- G m_1^0 m_2^0/ (r^0)^2$,
where $G= \chi_0^2 e^4/12 \pi^2 \epsilon_0^2 \rho_\lambda$, $\chi_0$ is the
susceptibility and $\rho_\lambda$ is the reduced linear mass density of the
dielectric vacuum. This force $F$ is accurate at the weak $F$ limit and
resembles in all respects Newton's gravity; hence $G$ is the gravitational
constant. The DR wave fields and hence the gravity is propagated in the
dielectric vacuum at the speed of light $c$; these can not be shielded by
matter. A test particle $\mu$ of mass $m^0$ at $r^0$ apart from a large mass
$M$ is therefore gravitated by all of the building particles of M directly, by
a total gravitational potential $V = -G M m^0/ r^0$. For a finite $V$ and hence
a total Hamiltonian $H= m^0 c^2 +V$, solution for the eigenvalue equation of
$\mu$ presents a red-shift in the eigen frequency $\nu= \nu^0 (1- GM/r^0 c^2)$
and accordingly other wave variables. The quantum solutions combined with the
wave nature of the gravity further lead to dilated gravito optical distance
$r=r^0/(1- GM/r^0 c^2) $ and time $t=t^0/(1- GM/r^0 c^2) $, and modified
Newton's gravity and Einstein's mass energy relation. Applications of these
give predictions of the general relativistic effects manifested in the four
classical test experiments of Einstein's general relativity (GR), in direct
agreement with the experiments and the predictions given based on GR.
","[{""version"":""v1"",""created"":""Mon, 11 Dec 2006 17:35:28 GMT""},{""version"":""v2"",""created"":""Thu, 28 Sep 2017 22:44:01 GMT""},{""version"":""v3"",""created"":""Sat, 11 Nov 2017 04:18:33 GMT""},{""version"":""v4"",""created"":""Mon, 27 Aug 2018 00:30:38 GMT""}]","2018-08-28"
"physics/0612097","Jose Castro","T. C. Killian, T. Pattard, T. Pohl and J. M. Rost","Ultracold Neutral Plasmas","89 pages, 54 images",,"10.1126/science.1130556","KL-06-01","physics.atom-ph physics.plasm-ph",,"  Ultracold neutral plasmas, formed by photoionizing laser-cooled atoms near
the ionization threshold, have electron temperatures in the 1-1000 kelvin range
and ion temperatures from tens of millikelvin to a few kelvin. They represent a
new frontier in the study of neutral plasmas, which traditionally deals with
much hotter systems, but they also blur the boundaries of plasma, atomic,
condensed matter, and low temperature physics. Modelling these plasmas
challenges computational techniques and theories of non-equilibrium systems, so
the field has attracted great interest from the theoretical and computational
physics communities. By varying laser intensities and wavelengths it is
possible to accurately set the initial plasma density and energy, and
charged-particle-detection and optical diagnostics allow precise measurements
for comparison with theoretical predictions. Recent experiments using optical
probes demonstrated that ions in the plasma equilibrate in a strongly coupled
fluid phase. Strongly coupled plasmas, in which the electrical interaction
energy between charged particles exceeds the average kinetic energy, reverse
the traditional energy hierarchy underlying basic plasma concepts such as Debye
screening and hydrodynamics. Equilibration in this regime is of particular
interest because it involves the establishment of spatial correlations between
particles, and it connects to the physics of the interiors of gas-giant planets
and inertial confinement fusion devices.
","[{""version"":""v1"",""created"":""Mon, 11 Dec 2006 17:08:51 GMT""}]","2009-11-13"
