"physics/0612238","Jorge S. Diaz","Edmund S. Wyndham, Mario Favre, Ra\'ul Aliaga Rossel, Hern\'an Chuaqui
  and Ian Mitchell, Jorge S. D\'iaz and Alvaro Pernas","Transient Hollow Cathode Effects and Z pinch Formation in a High Current
  Capillary Discharge with a Metal Plasma","3 pages, 3 figures. Presented at 15th International Conference on
  High-Power Particle Beams (BEAMS-2004), St. Petersburg, Russia, 18-23 Jul
  2004",,,,"physics.plasm-ph",,"  The results from a series of experiments are presented whose purpose is to
explore different schemes which may lead to the formation of pure metal plasmas
in a capillary discharge with parameters appropriate for X ray lasing. The
experiments were performed in ceramic wall capillary discharges at currents of
up to 120 kA, with an available ID of between 3 and 8 mm and with lengths from
60 to 100 mm. Initial plasma conditions in the capillary exploit transient
hollow cathode effects in a preionizing discharge. A laser focussed onto the
back surface of the cathode initiates both beam activity in the capillary
volume and plasma injection. To promote metal ablation into the pinch channel
of elements other than the ceramic wall material, a number of graded ring
schemes have been tried. The plasma is observed axially using both time and
energy resolved soft X-ray pin hole images as well as from time resolved soft
X-ray spectra. By varying the rate of rise of the current of the main
discharge, and the preionizing conditions the diameter and the stability of the
Z-pinch column are seen to be affected. The ratio of the species from the
ablated wall material to the plasma formed from the graded ring structure is
found to depend both on the capillary dimensions as well as the other operating
conditions.
","[{""version"":""v1"",""created"":""Tue, 26 Dec 2006 04:10:58 GMT""}]","2007-05-23"
"q-bio/0612046","Lior Pachter","Lior Pachter","An introduction to reconstructing ancestral genomes","Expanded lecture notes from the AMS short course on modeling and
  simulation of biological networks held in San Antonio, TX January 2006. To
  appear in the Proceedings of Symposia in Applied Mathematics, AMS Short
  Course Subseries",,,,"q-bio.GN q-bio.QM",,"  Recent advances in high-throughput genomics technologies have resulted in the
sequencing of large numbers of (near) complete genomes. These genome sequences
are being mined for important functional elements, such as genes. They are also
being compared and contrasted in order to identify other functional sequences,
such as those involved in the regulation of genes. In cases where DNA sequences
from different organisms can be determined to have originated from a common
ancestor, it is natural to try to infer the an- cestral sequences. The
reconstruction of ancestral genomes can lead to insights about genome
evolution, and the origins and diversity of function. There are a number of
interesting foundational questions associated with reconstructing ancestral
genomes: Which statistical models for evolution should be used for making
inferences about ancestral sequences? How should extant genomes be compared in
order to facilitate ancestral reconstruction? Which portions of ancestral
genomes can be reconstructed reliably, and what are the limits of ancestral
reconstruction? We discuss recent progress on some of these questions, offer
some of our own opinions, and highlight interesting mathematics, statistics,
and computer science problems.
","[{""version"":""v1"",""created"":""Mon, 25 Dec 2006 21:20:34 GMT""}]","2007-05-23"
"q-bio/0612047","Daniel Silvestre","Daniel A. M. M. Silvestre and Jose F. Fontanari","Preservation of information in a prebiotic package model","9 pages, 8 figures, accepted version, to be published in PRE",,"10.1103/PhysRevE.75.051909",,"q-bio.PE",,"  The coexistence between different informational molecules has been the
preferred mode to circumvent the limitation posed by imperfect replication on
the amount of information stored by each of these molecules. Here we reexamine
a classic package model in which distinct information carriers or templates are
forced to coexist within vesicles, which in turn can proliferate freely through
binary division. The combined dynamics of vesicles and templates is described
by a multitype branching process which allows us to write equations for the
average number of the different types of vesicles as well as for their
extinction probabilities. The threshold phenomenon associated to the extinction
of the vesicle population is studied quantitatively using finite-size scaling
techniques. We conclude that the resultant coexistence is too frail in the
presence of parasites and so confinement of templates in vesicles without an
explicit mechanism of cooperation does not resolve the information crisis of
prebiotic evolution.
","[{""version"":""v1"",""created"":""Tue, 26 Dec 2006 02:30:00 GMT""},{""version"":""v2"",""created"":""Thu, 19 Apr 2007 12:21:24 GMT""}]","2009-11-13"
"q-bio/0612048","Peng Chen","Peng Chen, Bing Wang, Hau-San Wong, De-Shuang Huang","Locating the Long-range Contact Centers with B-factors and Hydrophobic
  Cores","The paper has been withdrawn by author",,,,"q-bio.BM",,"  TThe paper had many errors.
","[{""version"":""v1"",""created"":""Tue, 26 Dec 2006 09:37:25 GMT""},{""version"":""v2"",""created"":""Mon, 19 May 2008 13:37:51 GMT""}]","2008-05-19"
"quant-ph/0612208","Mahn-Soo Choi","Taeseung Choi, Mahn-Soo Choi","Quantum Key Distribution Using Quantum Faraday Rotators","7 pages, 7 EPS figures","J. Phys.: Condens. Matt. 20, 275242 (2008)","10.1088/0953-8984/20/27/275242",,"quant-ph",,"  We propose a new quantum key distribution (QKD) protocol based on the fully
quantum mechanical states of the Faraday rotators. The protocol is
unconditionally secure against collective attacks for multi-photon source up to
two photons on a noisy environment. It is also robust against impersonation
attacks. The protocol may be implemented experimentally with the current
spintronics technology on semiconductors.
","[{""version"":""v1"",""created"":""Tue, 26 Dec 2006 00:29:35 GMT""},{""version"":""v2"",""created"":""Sun, 26 Aug 2007 03:37:27 GMT""}]","2008-09-24"
