"gr-qc/0612158","Jia-Chen Hua","Jia-Chen Hua (1), Yong-Chang Huang (2, 3) ((1) Department of Physics,
  New Mexico State University, Las Cruces, New Mexico, U.S.A., (2) Institute of
  Theoretical Physics, Beijing University of Technology, Beijing, P. R. China,
  (3) CCAST (World Lab.), Beijing, P. R. China)","Characteristics of Quantum Radiation of Slowly Varying Nonstationary
  Kerr-Newman Black Holes","This paper has been withdrawn. Paper was revised and will appear in
  International Journal of Modern Physics A","Int.J.Mod.Phys.A24:1889-1899,2009","10.1142/S0217751X09043274",,"gr-qc","http://arxiv.org/licenses/nonexclusive-distrib/1.0/","  Quantum radiative characteristics of slowly varying nonstationary Kerr-Newman
black holes are investigated by using the method of generalized tortoise
coordinate transformation. It is shown that the temperature and the shape of
the event horizon of this kind of black holes depend on the time and the angle.
Further, we reveal a relationship that is ignored before between thermal
radiation and non-thermal radiation, which is that the chemical potential in
thermal radiation spectrum is equal to the highest energy of the negative
energy state of particles in non-thermal radiation for slowly varying
nonstationary Kerr-Newman black holes. Also, we show that the deduced general
results can be degenerated to the known conclusion of stationary Kerr-Newman
black holes.
","[{""version"":""v1"",""created"":""Mon, 25 Dec 2006 17:13:05 GMT""},{""version"":""v2"",""created"":""Tue, 10 Apr 2007 00:03:56 GMT""},{""version"":""v3"",""created"":""Tue, 8 May 2007 09:48:00 GMT""},{""version"":""v4"",""created"":""Sat, 19 May 2007 04:00:41 GMT""},{""version"":""v5"",""created"":""Fri, 1 Jun 2007 14:07:29 GMT""},{""version"":""v6"",""created"":""Thu, 20 Sep 2007 10:47:53 GMT""},{""version"":""v7"",""created"":""Wed, 24 Sep 2008 04:56:10 GMT""}]","2009-04-21"
"gr-qc/0612161","Anil Zengino\u{g}lu C","Anil Zenginoglu, Sascha Husa","Hyperboloidal foliations with scri-fixing in spherical symmetry","3 pages, 1 figure; uses World Scientific style; submitted to the
  Proceedings of the Eleventh Marcel Grossmann Meeting, July 23-29, 2006,
  Berlin",,,"AEI-2006-101","gr-qc",,"  We study in spherical symmetry the conformal compactification for
hyperboloidal foliations with nonvanishing constant mean curvature. The
conformal factor and the coordinates are chosen such that null infinity is at a
fixed radial coordinate location.
","[{""version"":""v1"",""created"":""Mon, 25 Dec 2006 16:27:08 GMT""}]","2007-05-23"
"gr-qc/0612164","Sergei Winitzki","Sergei Winitzki","Predictions in eternal inflation","Invited review for a LNP volume on inflationary cosmology. Figures
  included. Cosmetic changes, references reformatted according to ""apsrev""
  Bibtex style to avoid citation ordering problems. Revtex style used","Lect.NotesPhys.738:157-191,2008","10.1007/978-3-540-74353-8_5",,"gr-qc astro-ph hep-th",,"  In generic models of cosmological inflation, quantum fluctuations strongly
influence the spacetime metric and produce infinitely many regions where the
end of inflation (reheating) is delayed until arbitrarily late times. The
geometry of the resulting spacetime is highly inhomogeneous on scales of many
Hubble sizes. The recently developed string-theoretic picture of the
""landscape"" presents a similar structure, where an infinite number of de
Sitter, flat, and anti-de Sitter universes are nucleated via quantum tunneling.
Since observers on the Earth have no information about their location within
the eternally inflating universe, the main question in this context is to
obtain statistical predictions for quantities observed at a random location. I
describe the problems arising within this statistical framework, such as the
need for a volume cutoff and the dependence of cutoff schemes on time slicing
and on the initial conditions. After reviewing different approaches and
mathematical techniques developed in the past two decades for studying these
issues, I discuss the existing proposals for extracting predictions and give
examples of their applications.
","[{""version"":""v1"",""created"":""Tue, 26 Dec 2006 05:01:30 GMT""},{""version"":""v2"",""created"":""Tue, 2 Jan 2007 21:00:04 GMT""},{""version"":""v3"",""created"":""Tue, 2 Jan 2007 22:58:12 GMT""}]","2008-11-26"
"gr-qc/0612165","Pankaj S. Joshi","Pankaj S. Joshi","The structure of non-spacelike curves from a spacetime singularity","4 pages, revtex",,,,"gr-qc",,"  We investigate here the causal structure of spacetime in the vicinity of a
spacetime singularity. The particle and energy emission from such ultra-dense
regions forming in gravitational collapse of a massive matter cloud is governed
by the nature of non-spacelike paths near the same. These trajectories are
examined to show that if a null geodesic comes out from the singularity, then
there exist families of future-directed non-spacelike curves which also
necessarily escape from the naked singularity. The existence of such families
is crucial to the physical visibility of the singularity. We do not assume any
underlying symmetries for the spacetime, and earlier considerations on the
nature of causal trajectories emerging from a naked singularity are generalized
and clarified.
","[{""version"":""v1"",""created"":""Tue, 26 Dec 2006 06:39:52 GMT""}]","2007-05-23"
"gr-qc/0612167","Sabine Hossenfelder","S. Hossenfelder","Deformed Special Relativity in Position Space","replaced with published version. due to page limits this version is
  significantly shorter than the 1st","Phys.Lett.B649:310-316,2007","10.1016/j.physletb.2007.04.019",,"gr-qc hep-th",,"  We investigate how deformations of special relativity in momentum space can
be extended to position space in a consistent way, such that the dimensionless
contraction between wave-vector and coordinate-vector remains invariant. By
using a parametrization in terms of an energy dependent speed of light, and an
energy dependent Planck's constant, we are able to formulate simple
requirements that completely determine the active transformations in position
space. These deviate from the standard transformations for large velocities of
the observed object. Some examples are discussed, and it is shown how the
relativistic mass gain of a massive particle is affected. We finally study the
construction of passive Lorentz-transformations.
","[{""version"":""v1"",""created"":""Tue, 26 Dec 2006 11:47:23 GMT""},{""version"":""v2"",""created"":""Fri, 25 May 2007 02:28:15 GMT""}]","2008-11-26"
"hep-ex/0612063","Dmitry Naumov","Nomad Collaboration","Search for the exotic $\Theta^+$ resonance in the NOMAD experiment","Accepted to European Physics Journal C","Eur.Phys.J.C49:499-510,2007","10.1140/epjc/s10052-006-0080-y",,"hep-ex",,"  A search for exotic Theta baryon via Theta -> proton +Ks decay mode in the
NOMAD muon neutrino DIS data is reported. The special background generation
procedure was developed. The proton identification criteria are tuned to
maximize the sensitivity to the Theta signal as a function of xF which allows
to study the Theta production mechanism. We do not observe any evidence for the
Theta state in the NOMAD data. We provide an upper limit on Theta production
rate at 90% CL as 2.13 per 1000 of neutrino interactions.
","[{""version"":""v1"",""created"":""Tue, 26 Dec 2006 09:12:05 GMT""}]","2012-08-27"
"hep-th/0612266","Makoto Kobayashi","Makoto Kobayashi","Electric Dipole Moment of Magnetic Monopole","10 pages, PTPTeX.cls, typos corrected, some phrases improved",,"10.1143/PTP.117.479","KEK-TH-1130","hep-th",,"  The electric dipole moment of magnetic monopoles with spin is studied in the
N=2 supersymmetric gauge theory. The dipole moments of the electric charge
distributions, as well as the dipole moments due to the magnetic currents, are
calculated. The contribution of charge distribution of the fermion to the
gyroelectric ratio is expressed by using zeta(3).
","[{""version"":""v1"",""created"":""Tue, 26 Dec 2006 05:22:14 GMT""},{""version"":""v2"",""created"":""Wed, 7 Mar 2007 07:27:52 GMT""}]","2015-06-26"
"hep-th/0612267","Shin Sasaki","Katsushi Ito, Yoshishige Kobayashi, Shin Sasaki","Deformation of N=4 Super Yang-Mills Theory in Graviphoton Background","22 pages, no figures, LaTeX","JHEP 0704:011,2007","10.1088/1126-6708/2007/04/011","TIT/HEP-564, YITP-06-65","hep-th",,"  We study deformation of N=4 super Yang-Mills theory from type IIB
superstrings with D3-branes in the constant R-R background. We compute disk
amplitudes with one graviphoton vertex operator and investigate the zero-slope
limit of the amplitudes. We obtain the effective action deformed by the
graviphoton background, which contains the one defined in non(anti)commutative
N=1 superspace as special case. The bosonic part of the Lagrangian gives the
Chern-Simons term coupled with the R-R potential. We study the vacuum
configuration of the deformed Lagrangian and find the fuzzy sphere
configuration for scalar fields.
","[{""version"":""v1"",""created"":""Tue, 26 Dec 2006 05:56:56 GMT""}]","2010-10-27"
"hep-th/0612268","Anastasia Doikou","Anastasia Doikou","A note on the boundary spin $s$ XXZ chain","12 pages, Latex","Phys.Lett.A366:556-562,2007","10.1016/j.physleta.2007.02.080",,"hep-th cond-mat.stat-mech nlin.SI",,"  The open spin $s$ XXZ model with non-diagonal boundaries is considered.
Within the algebraic Bethe ansatz framework and in the spirit of earlier works
we derive suitable reference states. The derivation of the reference state is
the crucial point in this investigation, and it involves the solution of sets
of difference equations. For the spin $s$ representation, expressed in terms of
difference operators, the pseudo-vacuum is identified in terms of
$q$-hypergeometric series. Having specified such states we then build the Bethe
states and also identify the spectrum of the model for generic values of the
anisotropy parameter $q$.
","[{""version"":""v1"",""created"":""Tue, 26 Dec 2006 10:28:50 GMT""}]","2008-11-26"
"hep-th/0612270","Pietro Menotti","Pietro Menotti","Non invariant zeta-function regularization in quantum Liouville theory","10 pages, LaTex","Phys.Lett.B650:432-439,2007","10.1016/j.physletb.2007.05.053","IFUP-TH/2006-41","hep-th",,"  We consider two possible zeta-function regularization schemes of quantum
Liouville theory. One refers to the Laplace-Beltrami operator covariant under
conformal transformations, the other to the naive non invariant operator. The
first produces an invariant regularization which however does not give rise to
a theory invariant under the full conformal group. The other is equivalent to
the regularization proposed by Zamolodchikov and Zamolodchikov and gives rise
to a theory invariant under the full conformal group.
","[{""version"":""v1"",""created"":""Tue, 26 Dec 2006 15:10:38 GMT""}]","2008-11-26"
"math-ph/0612078","Oleksii Pliukhin Mr","Roman Cherniha and Olexii Pliukhin","New conditional symmetries and exact solutions of nonlinear
  reaction-diffusion-convection equations. I","18 pages. submitted",,"10.1088/1751-8113/40/33/009",,"math-ph math.MP",,"  A complete description of Q-conditional symmetries for two classes of
reaction-diffusion-convection equations with power diffusivities is derived. It
is shown that all the known results for reaction-diffusion equations with power
diffusivities follow as particular cases from those obtained here but not vise
versa.
","[{""version"":""v1"",""created"":""Tue, 26 Dec 2006 13:13:23 GMT""}]","2009-11-11"
"math-ph/0612079","Vladimir Ivashchuk","I. S. Goncharenko, V. D. Ivashchuk and V. N. Melnikov","Fluxbrane and S-brane solutions with polynomials related to rank-2 Lie
  algebras","5 pages, Latex, journal version","Grav.Cosmol.13:262-266,2007",,"ICGA-PFUR-12/12-06","math-ph gr-qc hep-th math.DG math.MP",,"  Composite fluxbrane and S-brane solutions for a wide class of intersection
rules are considered. These solutions are defined on a product manifold R_{*} x
M_1 x ... x M_n which contains n Ricci-flat spaces M_1, ..., M_n with
1-dimensional factor spaces R_{*} and M_1. They are determined up to a set of
functions obeying non-linear differential equations equivalent to Toda-type
equations with certain boundary conditions imposed. Exact solutions
corresponding to configurations with two branes and intersections related to
simple Lie algebras C_2 and G_2 are obtained. In these cases, the functions
H_s(z), s =1,2, are polynomials of degrees (3, 4) and (6, 10), respectively, in
agreement with a conjecture put forward previously in Ref., \cite{Iflux}. The
S-brane solutions under consideration, for special choices of the parameters,
may describe an accelerating expansion of our 3-dimensional space and a small
enough variation of the effective gravitational constant.
","[{""version"":""v1"",""created"":""Tue, 26 Dec 2006 15:14:15 GMT""},{""version"":""v2"",""created"":""Wed, 12 Dec 2007 20:11:25 GMT""}]","2008-11-26"
"math/0612756","Alexander G. Smirnov","A.G. Smirnov","On kernel theorems for (LF)-spaces","8 pages",,,,"math.FA math-ph math.MP",,"  A convenient technique for proving kernel theorems for (LF)-spaces (countable
inductive limits of Frechet spaces)is developed. The proposed approach is based
on introducing a suitable modification of the functor of the completed
inductive topological tensor product. Using such modified tensor products makes
it possible to prove kernel theorems without assuming the completeness of the
considered (LF)-spaces. The general construction is applied to proving kernel
theorems for a class of spaces of entire analytic functions arising in nonlocal
quantum field theory.
","[{""version"":""v1"",""created"":""Mon, 25 Dec 2006 19:11:08 GMT""}]","2007-05-23"
"math/0612757","Vladimir Oliker","Vladimir Oliker","A Minkowski-style theorem for focal functions of compact convex
  reflectors","15 pages",,,,"math.DG",,"  This paper continues the study of a class of compact convex hypersurfaces in
Euclidean space $R^{n+1}, ~n \geq 1$, which are boundaries of compact convex
bodies obtained by taking the intersection of (solid) confocal paraboloids of
revolution. Such hypersurfaces are called reflectors. In $R^3$ reflectors arise
naturally in geometrical optics and are used in design of light reflectors and
reflector antennas. They are also important in rendering problems in computer
graphics.
  The notion of a focal function for reflectors plays a central role similar to
that of the Minkowski support function for convex bodies. In this paper the
basic question of when a given function is a focal function of a convex
reflector is answered by establishing necessary and sufficient conditions. In
addition, some smoothness properties of reflectors and of the associated
directrix hypersurfaces are also etablished.
","[{""version"":""v1"",""created"":""Tue, 26 Dec 2006 01:15:50 GMT""}]","2007-05-23"
"math/0612758","Michael Ruzhansky","Michael Ruzhansky and James Smith","Global time estimates for solutions to equations of dissipative type","Journees ""Equations aux Derivees Partielles""","Journees ""Equations aux Derivees Partielles"", Exp. No. XII, 29
  pp., Ecole Polytech., Palaiseau, 2005",,,"math.AP math.FA",,"  Global time estimates of Lp-Lq norms of solutions to general strictly
hyperbolic partial differential equations are considered. The case of special
interest in this paper are equations exhibiting the dissipative behaviour.
Results are applied to discuss time decay estimates for Fokker-Planck equations
and for wave type equations with negative mass.
","[{""version"":""v1"",""created"":""Tue, 26 Dec 2006 01:54:18 GMT""}]","2007-05-23"
"math/0612759","Leshun Xu","Leshun Xu and Yong Li","Symmetric orbits arising from Figure-Eight for N-body problem","25 pages, 39 figures",,,,"math.DS",,"  In this paper, we first describe how we can arrange any bodies on
Figure-Eight without collision in a dense subset of $[0,T]$ after showing that
the self-intersections of Figure-Eight will not happen in this subset. Then it
is reasonable for us to consider the existence of generalized solutions and
non-collision solutions with Mixed-symmetries or with Double-Eight constraints,
arising from Figure-Eight, for N-body problem. All of the orbits we found
numerically in Section \ref{se7} have not been obtained by other authors as far
as we know. To prove the existence of these new periodic solutions, the
variational approach and critical point theory are applied to the classical
N-body equations. And along the line used in this paper, one can construct
other symmetric constraints on N-body problems and prove the existence of
periodic solutions for them.
","[{""version"":""v1"",""created"":""Tue, 26 Dec 2006 02:42:04 GMT""}]","2007-05-23"
"math/0612760","Linfan Mao l.f.m","Linfan Mao","Geometrical Theory on Combinatorial Manifolds","37 pages with 2 figures",,,,"math.GM",,"  For an integer $m\geq 1$, a combinatorial manifold $\widetilde{M}$ is defined
to be a geometrical object $\widetilde{M}$ such that for $\forall
p\in\widetilde{M}$, there is a local chart $(U_p,\phi_p)$ enable $\phi_p:U_p\to
B^{n_{i_1}}\bigcup B^{n_{i_2}}\bigcup...\bigcup B^{n_{i_{s(p)}}}$ with
$B^{n_{i_1}}\bigcap B^{n_{i_2}}\bigcap...\bigcap
B^{n_{i_{s(p)}}}\not=\emptyset$, where $B^{n_{i_j}}$ is an $n_{i_j}$-ball for
integers $1\leq j\leq s(p)\leq m$. Topological and differential structures such
as those of $d$-pathwise connected, homotopy classes, fundamental $d$-groups in
topology and tangent vector fields, tensor fields, connections, {\it Minkowski}
norms in differential geometry on these finitely combinatorial manifolds are
introduced. Some classical results are generalized to finitely combinatorial
manifolds. Euler-Poincare characteristic is discussed and geometrical
inclusions in Smarandache geometries for various geometries are also presented
by the geometrical theory on finitely combinatorial manifolds in this paper.
","[{""version"":""v1"",""created"":""Tue, 26 Dec 2006 03:04:24 GMT""}]","2009-09-29"
"math/0612762","Andrew Putman","Andrew Putman","A note on the connectivity of certain complexes associated to surfaces","15 pages, 2 figures, minor revisions; to appear in L'Enseignement
  Mathematique","Enseign. Math. (2) 54 (2008), 287-301","10.5169/seals-109940",,"math.GT math.GR",,"  This note is devoted to a trick which yields almost trivial proofs that
certain complexes associated to topological surfaces are connected or simply
connected. Applications include new proofs that the complexes of curves,
separating curves, nonseparating curves, pants, and cut systems are all
connected for genus $g \gg 0$. We also prove that two new complexes are
connected : one involves curves which split a genus $2g$ surface into two genus
$g$ pieces, and the other involves curves which are homologous to a fixed
curve. The connectivity of the latter complex can be interpreted as saying the
``homology'' relation on the surface is (for $g \geq 3$) generated by
``embedded/disjoint homologies''. We finally prove that the complex of
separating curves is simply connected for $g \geq 4$.
","[{""version"":""v1"",""created"":""Tue, 26 Dec 2006 04:18:34 GMT""},{""version"":""v2"",""created"":""Wed, 28 Nov 2007 01:39:06 GMT""}]","2020-06-08"
"math/0612763","Vladimir Danilov","V.G. Danilov and D. Mitrovic","Delta shock wave formation in the case of triangular hyperbolic system
  of conservation laws","22 pages, Latex",,,,"math.AP",,"  We describe $\delta$ shock wave arising from continuous initial data in the
case of triangular conservation law system arising from ""generalized
pressureless gas dynamics model"". We use the weak asymptotic method.
","[{""version"":""v1"",""created"":""Tue, 26 Dec 2006 09:41:27 GMT""}]","2007-05-23"
"math/0612764","Gregory Chechkin","Youcef Amirat, Gregory A. Chechkin, Rustem R. Gadyl'shin","Asymptotics of Eigenvalues and Eigenfunctions for the Laplace Operator
  in a Domain with Oscillating Boundary. Multiple Eigenvalue Case",,,"10.1134/S0965542506010118",,"math.AP",,"  We study the asymptotic behavior of the solutions of a spectral problem for
the Laplacian in a domain with rapidly oscillating boundary. We consider the
case where the eigenvalue of the limit problem is multiple. We construct the
leading terms of the asymptotic expansions for the eigenelements and verify the
asymptotics.
","[{""version"":""v1"",""created"":""Tue, 26 Dec 2006 10:10:02 GMT""}]","2009-11-11"
"math/0612765","Shamgar Gurevich","Shamgar Gurevich (IAS) and Ronny Hadani (Austin)","Bounds on certain Higher-Dimensional Exponential Sums via the
  Self-Reducibility of the Weil Representation",,,,,"math.RT math-ph math.MP nlin.CD quant-ph","http://arxiv.org/licenses/nonexclusive-distrib/1.0/","  We describe a new method to bound certain higher-dimensional exponential sums
which are associated with tori in symplectic groups over finite fields. Our
method is based on the self-reducibility property of the Weil representation.
As a result, we obtain a sharp form of the Hecke quantum unique ergodicity
theorem for generic linear symplectomorphisms of the 2N-dimensional torus.
","[{""version"":""v1"",""created"":""Tue, 26 Dec 2006 11:09:42 GMT""},{""version"":""v2"",""created"":""Mon, 8 Feb 2010 00:24:26 GMT""}]","2010-02-08"
"math/0612766","Pablo Mira","Jose A. Galvez, Antonio Martinez, Pablo Mira","The Bonnet problem for surfaces in homogeneous 3-manifolds",,,,,"math.DG",,"  We solve the Bonnet problem for surfaces in the homogeneous 3-manifolds with
a 4-dimensional isometry group. More specifically, we show that a simply
connected real analytic surface in H^2xR or S^2xR is uniquely determined
pointwise by its metric and its principal curvatures if and only if it is not a
minimal or a properly helicoidal surface. In the remaining three types of
homogeneous 3-manifolds, we show that except for constant mean curvature
surfaces and helicoidal surfaces, all simply connected real analytic surfaces
are pointwise determined by their metric and principal curvatures.
","[{""version"":""v1"",""created"":""Tue, 26 Dec 2006 11:10:42 GMT""}]","2007-05-23"
"math/0612767","Sanjay Parui","Sanjay Parui and Rudra P. Sarkar","Beurling's Theorem and $L^p-L^q$ Morgan's Theorem for Step Two Nilpotent
  Lie Groups","20 pages",,,,"math.RT math.FA",,"  We prove Beurling's theorem and $L^p-L^q$ Morgan's theorem for step two
nilpotent Lie groups
","[{""version"":""v1"",""created"":""Tue, 26 Dec 2006 11:19:42 GMT""},{""version"":""v2"",""created"":""Sat, 20 Jan 2007 11:51:05 GMT""},{""version"":""v3"",""created"":""Thu, 30 Aug 2007 10:44:38 GMT""}]","2007-08-30"
"math/0612768","Upendra Kulkarni","Henning Haahr Andersen and Upendra Kulkarni","Sum formulas for reductive algebraic groups","24 pages",,,"University of Aarhus, Mathematics preprint no. 12, 2006","math.RT",,"  Let $V$ be a Weyl module either for a reductive algebraic group $G$ or for
the corresponding quantum group $U_q$. If $G$ is defined over a field of
positive characteristic $p$, respectively if $q$ is a primitive $l$'th root of
unity (in an arbitrary field) then $V$ has a Jantzen filtration. The sum of the
positive terms in this filtration satisfies a well known sum formula. If $T$
denotes a tilting module either for $G$ or $U_q$ then we can similarly filter
the space $\Hom_G(V,T)$, respectively $\Hom_{U_q}(V,T)$ and there is a sum
formula for the positive terms here as well. We give an easy and unified proof
of these two (equivalent) sum formulas. Our approach is based on an Euler type
identity which we show holds without any restrictions on $p$ or $l$. In
particular, we get rid of previous such restrictions in the tilting module
case.
","[{""version"":""v1"",""created"":""Tue, 26 Dec 2006 12:47:09 GMT""}]","2007-05-23"
"nucl-th/0612104","Alexander Kobushkin","Dmitry Borisyuk, Alexander Kobushkin","Two-photon exchange at low Q^2","5 pages, 4 figures","Phys.Rev.C75:038202,2007","10.1103/PhysRevC.75.038202",,"nucl-th hep-ex hep-ph nucl-ex",,"  We study two-photon exchange for elastic electron-proton scattering at low
Q^2. Compact approximate formulae for the amplitudes are obtained. Numerical
calculations are done for Q^2 < 0.1 GeV^2 with several realistic form factor
parameterizations, yielding similar results. They indicate that the corrections
to magnetic form factor can visibly affect cross-section and proton radii. For
low-Q^2 electron-neutron scattering two-photon exchange corrections are shown
to be negligibly small.
","[{""version"":""v1"",""created"":""Tue, 26 Dec 2006 14:51:07 GMT""}]","2008-11-26"
