"math-ph/0602010","J. M. Maillard","S. Boukraa, S. Hassani, J.-M. Maillard, B. M. McCoy, J.-A. Weil, N.
  Zenine","Painleve versus Fuchs","18 pages, Dedicated to the centenary of the publication of the
  Painleve VI equation in the Comptes Rendus de l'Academie des Sciences de
  Paris by Richard Fuchs in 1905","J.Phys.A39:12245-12264,2006","10.1088/0305-4470/39/39/S16",,"math-ph cond-mat.stat-mech hep-th math.MP nlin.SI",,"  The sigma form of the Painlev{\'e} VI equation contains four arbitrary
parameters and generically the solutions can be said to be genuinely
``nonlinear'' because they do not satisfy linear differential equations of
finite order. However, when there are certain restrictions on the four
parameters there exist one parameter families of solutions which do satisfy
(Fuchsian) differential equations of finite order. We here study this phenomena
of Fuchsian solutions to the Painlev{\'e} equation with a focus on the
particular PVI equation which is satisfied by the diagonal correlation function
C(N,N) of the Ising model. We obtain Fuchsian equations of order $N+1$ for
C(N,N) and show that the equation for C(N,N) is equivalent to the $N^{th}$
symmetric power of the equation for the elliptic integral $E$.
  We show that these Fuchsian equations correspond to rational algebraic curves
with an additional Riccati structure and we show that the Malmquist Hamiltonian
$p,q$ variables are rational functions in complete elliptic integrals. Fuchsian
equations for off diagonal correlations $C(N,M)$ are given which extend our
considerations to discrete generalizations of Painlev{\'e}.
","[{""version"":""v1"",""created"":""Fri, 3 Feb 2006 10:03:10 GMT""},{""version"":""v2"",""created"":""Sat, 11 Mar 2006 13:57:15 GMT""},{""version"":""v3"",""created"":""Thu, 8 Jun 2006 09:11:42 GMT""}]","2011-07-19"
"math-ph/0602011","Elisa Ercolessi","E. Ercolessi, A. Ibort, G. Marmo and G. Morandi","Alternative linear structures associated with regular Lagrangians. Weyl
  quantization and the Von Neumann uniqueness theorem","24 pages, 2 eps figures, iop latex",,,,"math-ph math.MP",,"  We discuss how the existence of a regular Lagrangian description on the
tangent bundle $TQ$ of some configuration space $Q$ allows for the construction
of a linear structure on $TQ$ that can be considered as ""adapted"" to the given
dynamical system. The fact then that many dynamical systems admit alternative
Lagrangian descriptions opens the possibility to use the Weyl scheme to
quantize the system in different non equivalent ways, ""evading"", so to speak,
the von Neumann uniqueness theorem.
","[{""version"":""v1"",""created"":""Fri, 3 Feb 2006 15:43:22 GMT""}]","2007-05-23"
"math/0602039","Geir Helleloid","Geir T. Helleloid and Ursula Martin","The Automorphism Group of a Finite p-Group is Almost Always a p-Group","38 pages, to appear in the Journal of Algebra; improved references,
  changes in terminology","Journal of Algebra 312(2007) 294-329","10.1016/j.jalgebra.2007.01.008",,"math.GR math.CO",,"  Many common finite p-groups admit automorphisms of order coprime to p, and
when p is odd, it is reasonably difficult to find finite p-groups whose
automorphism group is a p-group. Yet the goal of this paper is to prove that
the automorphism group of a finite p-group is almost always a p-group. The
asymptotics in our theorem involve fixing any two of the following parameters
and letting the third go to infinity: the lower p-length, the number of
generators, and p. The proof of this theorem depends on a variety of topics:
counting subgroups of a p-group; analyzing the lower p-series of a free group
via its connection with the free Lie algebra; counting submodules of a module
via Hall polynomials; and using numerical estimates on Gaussian coefficients.
","[{""version"":""v1"",""created"":""Thu, 2 Feb 2006 16:58:21 GMT""},{""version"":""v2"",""created"":""Fri, 12 May 2006 05:54:55 GMT""},{""version"":""v3"",""created"":""Sat, 13 May 2006 01:49:44 GMT""},{""version"":""v4"",""created"":""Wed, 5 Jul 2006 02:46:27 GMT""},{""version"":""v5"",""created"":""Mon, 9 Oct 2006 18:55:06 GMT""}]","2013-05-09"
"math/0602046","Donald Yau","Donald Yau","Deformation of dual Leibniz algebra morphisms","10 pages. To appear in Communications in Algebra","Communications in Algebra 35 (2007), 1369-1378","10.1080/00927870601115872",,"math.QA math.RA",,"  An algebraic deformation theory of morphisms of dual Leibniz algebras is
obtained.
","[{""version"":""v1"",""created"":""Thu, 2 Feb 2006 16:03:24 GMT""}]","2007-06-13"
"math/0602047","Aaron Lauda","Aaron D. Lauda, Hendryk Pfeiffer","State sum construction of two-dimensional open-closed Topological
  Quantum Field Theories","33 pages; LaTeX2e with xypic and pstricks macros; v2: typos corrected","J.KnotTheor.Ramifications16:1121-1163,2007","10.1142/S0218216507005725","AEI-2005-163; DAMTP-2005-81","math.QA hep-th",,"  We present a state sum construction of two-dimensional extended Topological
Quantum Field Theories (TQFTs), so-called open-closed TQFTs, which generalizes
the state sum of Fukuma--Hosono--Kawai from triangulations of conventional
two-dimensional cobordisms to those of open-closed cobordisms, i.e. smooth
compact oriented 2-manifolds with corners that have a particular global
structure. This construction reveals the topological interpretation of the
associative algebra on which the state sum is based, as the vector space that
the TQFT assigns to the unit interval. Extending the notion of a
two-dimensional TQFT from cobordisms to suitable manifolds with corners
therefore makes the relationship between the global description of the TQFT in
terms of a functor into the category of vector spaces and the local description
in terms of a state sum fully transparent. We also illustrate the state sum
construction of an open-closed TQFT with a finite set of D-branes using the
example of the groupoid algebra of a finite groupoid.
","[{""version"":""v1"",""created"":""Thu, 2 Feb 2006 16:50:50 GMT""},{""version"":""v2"",""created"":""Tue, 8 Aug 2006 14:46:07 GMT""}]","2010-06-07"
"math/0602048","Parthasarathi","Arijit Dey and R Parthasarathi","On Harder-Narasimhan reductions for Higgs principal bundles",,"Proc.Indian Acad. Sci. (Math.Sci.) Vol. 115, No. 2, May 2005, pp.
  127-146",,,"math.AG",,"  The existence and uniqueness of H-N reduction for the Higgs principal bundles
over nonsingular projective variety is shown. We also extend the notion of H-N
reduction for (\Gamma, G)-bundles and ramified G-bundles over a smooth curve.
","[{""version"":""v1"",""created"":""Thu, 2 Feb 2006 17:01:22 GMT""}]","2007-05-23"
"math/0602049","Christopher Wood","M. Benyounes, E. Loubeau, C. M. Wood","Harmonic sections of Riemannian vector bundles, and metrics of
  Cheeger-Gromoll type","25 pages",,,,"math.DG",,"  We study harmonic sections of a Riemannian vector bundle whose total space is
equipped with a 2-parameter family of metrics which includes both the Sasaki
and Cheeger-Gromoll metrics. This enables the theory of harmonic unit sections
to be extended to bundles with non-zero Euler class.
","[{""version"":""v1"",""created"":""Thu, 2 Feb 2006 17:41:39 GMT""}]","2007-05-23"
"math/0602050","Yaozhong Hu","Yaozhong Hu and David Nualart","Rough Path Analysis Via Fractional Calculus",,,,,"math.PR math.DS",,"  Using fractional calculus we define integrals of the form $%
\int_{a}^{b}f(x_{t})dy_{t}$, where $x$ and $y$ are vector-valued H\""{o}lder
continuous functions of order $\displaystyle \beta \in (\frac13, \frac12)$ and
$f$ is a continuously differentiable function such that $f'$ is
$\lambda$-H\""oldr continuous for some $\lambda>\frac1\beta-2$. Under some
further smooth conditions on $f$ the integral is a continuous functional of
$x$, $y$, and the tensor product $x\otimes y$ with respect to the H\""{o}lder
norms. We derive some estimates for these integrals and we solve differential
equations driven by the function $y$. We discuss some applications to
stochastic integrals and stochastic differential equations.
","[{""version"":""v1"",""created"":""Thu, 2 Feb 2006 18:01:34 GMT""}]","2007-05-23"
"math/0602051","Daniel Azagra","D. Azagra, J. Ferrera, F. Lopez-Mesas, Y. Rangel","Smooth Approximation of Lipschitz functions on Riemannian manifolds","10 pages",,,,"math.DG math.FA",,"  We show that for every Lipschitz function $f$ defined on a separable
Riemannian manifold $M$ (possibly of infinite dimension), for every continuous
$\epsilon:M\to (0,+\infty)$, and for every positive number $r>0$, there exists
a $C^\infty$ smooth Lipschitz function $g:M\to\mathbb{R}$ such that
$|f(p)-g(p)|\leq\epsilon(p)$ for every $p\in M$ and
$\textrm{Lip}(g)\leq\textrm{Lip}(f)+r$. Consequently, every separable
Riemannian manifold is uniformly bumpable. We also present some applications of
this result, such as a general version for separable Riemannian manifolds of
Deville-Godefroy-Zizler's smooth variational principle.
","[{""version"":""v1"",""created"":""Thu, 2 Feb 2006 18:42:27 GMT""}]","2007-05-23"
"math/0602052","Seth Sullivant","Seth Sullivant","Toric fiber products","19 pages",,,,"math.AC",,"  We introduce and study the toric fiber product of two ideals in polynomial
rings that are homogeneous with respect to the same multigrading. Under the
assumption that the set of degrees of the variables form a linearly independent
set, we can explicitly describe generating sets and Groebner bases for these
ideals. This allows us to unify and generalize some results in algebraic
statistics.
","[{""version"":""v1"",""created"":""Thu, 2 Feb 2006 19:16:26 GMT""}]","2007-05-23"
"math/0602053","Noson S. Yanofsky","Noson S. Yanofsky","Towards a Definition of an Algorithm","38 pages. Fixed typos. Added Refs","Journal of Logic and Computation 2010;",,,"math.LO cs.LO math.CT","http://arxiv.org/licenses/nonexclusive-distrib/1.0/","  We define an algorithm to be the set of programs that implement or express
that algorithm. The set of all programs is partitioned into equivalence
classes. Two programs are equivalent if they are essentially the same program.
The set of equivalence classes forms the category of algorithms. Although the
set of programs does not even form a category, the set of algorithms form a
category with extra structure. The conditions we give that describe when two
programs are essentially the same turn out to be coherence relations that
enrich the category of algorithms with extra structure. Universal properties of
the category of algorithms are proved.
","[{""version"":""v1"",""created"":""Thu, 2 Feb 2006 20:54:04 GMT""},{""version"":""v2"",""created"":""Sun, 25 Feb 2007 02:07:05 GMT""},{""version"":""v3"",""created"":""Thu, 10 Jun 2010 20:24:18 GMT""}]","2010-06-14"
"math/0602054","Huaizhong Zhao","Qi Zhang, Huaizhong Zhao","Stationary Solutions of SPDEs and Infinite Horizon BDSDEs",,"Journal of Functional Analysis,Vol. 252 (2007), 171-219","10.1016/j.jfa.2007.06.019",,"math.PR math.DS","http://arxiv.org/licenses/nonexclusive-distrib/1.0/","  In this paper we study the existence of stationary solutions for stochastic
partial differential equations. We establish a new connection between
$L_{\rho}^2({\mathbb{R}^{d}};{\mathbb{R}^{1}}) \otimes
L_{\rho}^2({\mathbb{R}^{d}};{\mathbb{R}^{d}})$ valued solutions of backward
doubly stochastic differential equations (BDSDEs) on infinite horizon and the
stationary solutions of the SPDEs. Moreover, we prove the existence and
uniqueness of the solutions of BDSDEs on both finite and infinite horizons, so
obtain the solutions of initial value problems and the stationary solutions
(independent of any initial value) of SPDEs. The connection of the weak
solutions of SPDEs and BDSDEs has independent interests in the areas of both
SPDEs and BSDEs.
","[{""version"":""v1"",""created"":""Thu, 2 Feb 2006 22:34:21 GMT""},{""version"":""v2"",""created"":""Thu, 13 Nov 2008 18:35:32 GMT""}]","2008-11-13"
"math/0602055","Takashi Hashimoto","Takashi Hashimoto","A central element in the universal enveloping algebra of type D_n via
  minor summation formula of Pfaffians","version 1.1(corrected typos and added a reference), 17 pages, no
  figures",,,,"math.RT",,"  It is known that the universal enveloping algebra of the orthogonal Lie
algebra of size even has a central element expressed in terms of Pfaffian of a
certain matrix alternating along the anti-diagonal (which we call
anti-alternating for short) whose entries are in the univerasal enveloping
algebra. In this paper, we establish minor summation formulae of Pfaffian for
the noncommutative anti-alternating matrix, as well as for commutative
anti-alternating matrix. As an application, we show that the eigenvalues on the
highest weight modules of the central element given by the Pfaffian can be
easily computed.
","[{""version"":""v1"",""created"":""Fri, 3 Feb 2006 02:18:02 GMT""},{""version"":""v2"",""created"":""Mon, 3 Apr 2006 05:52:42 GMT""}]","2007-05-23"
"math/0602056","Jae-Hyun Yang","Jae-Hyun Yang","The Method of Orbits for Real Lie Groups","74 pages","Kyungpook Math. J. (2002), 199-274",,,"math.RT math.NT",,"  In this paper, we outline a developement of the theory of orbit method for
representations of real Lie groups. In particular, we study the orbit method
for representations of the Heisenberg group and the Jacobi group.
","[{""version"":""v1"",""created"":""Fri, 3 Feb 2006 10:51:44 GMT""}]","2007-05-23"
"math/0602057","Georgi Vodev","Georgi Vodev","Dispersive estimates of solutions to the Schrodinger equation in
  dimensions $n\ge 4$","24 pages",,,,"math.AP math-ph math.MP",,"  We prove dispersive estimates for solutions to the Schrodinger equation with
a real-valued potential $V\in L^\infty({\bf R}^n)$, $n\ge 4$, satisfying
$V(x)=O(|x|^{-(n+2)/2-\epsilon})$, $|x|>1$, $\epsilon>0$.
","[{""version"":""v1"",""created"":""Fri, 3 Feb 2006 11:15:04 GMT""}]","2007-05-23"
"math/0602058","Georgi Vodev","Georgi Vodev","Dispersive estimates of solutions to the wave equation with a potential
  in dimensions $n\ge 4$","24 pages",,,,"math.AP math-ph math.MP",,"  We prove dispersive estimates for solutions to the wave equation with a
real-valued potential $V\in L^\infty({\bf R}^n)$, $n\ge 4$, satisfying
$V(x)=O(|x|^{-(n+1)/2-\epsilon})$, $|x|>1$, $\epsilon>0$.
","[{""version"":""v1"",""created"":""Fri, 3 Feb 2006 12:56:58 GMT""}]","2007-05-23"
"math/0602059","Pavel Chebotarev","Rafig Agaev and Pavel Chebotarev","The Matrix of Maximum Out Forests of a Digraph and Its Applications","27 pages, 3 figures","Automation and Remote Control 61 (2000) 1424--1450",,,"math.CO cs.DS math.AG",,"  We study the maximum out forests of a (weighted) digraph and the matrix of
maximum out forests. A maximum out forest of a digraph G is a spanning subgraph
of G that consists of disjoint diverging trees and has the maximum possible
number of arcs. If a digraph contains any out arborescences, then maximum out
forests coincide with them. We provide a new proof to the Markov chain tree
theorem saying that the matrix of Ces`aro limiting probabilities of an
arbitrary stationary finite Markov chain coincides with the normalized matrix
of maximum out forests of the weighted digraph that corresponds to the Markov
chain. We discuss the applications of the matrix of maximum out forests and its
transposition, the matrix of limiting accessibilities of a digraph, to the
problems of preference aggregation, measuring the vertex proximity, and
uncovering the structure of a digraph.
","[{""version"":""v1"",""created"":""Fri, 3 Feb 2006 13:28:50 GMT""},{""version"":""v2"",""created"":""Sat, 4 Feb 2006 10:44:31 GMT""}]","2007-05-23"
"math/0602060","G. Griffith Elder","G. Griffith Elder","The Galois structure of ambiguous ideals in cyclic extensions of degree
  8","This article has appeared in the Lect. Notes Pure Appl. Math. without
  references. The article is being posted here, with permission, to remedy that
  problem","Noncommutative algebra and geometry, Lect. Notes Pure Appl. Math.,
  vol. 243, Chapman & Hall/CRC, Boca Raton, FL, 2006, pp. 63--89",,,"math.NT",,"  In cyclic, degree 8 extensions of algebraic number fields $N/K$, ambiguous
ideals in N are canonical $\mathbb{Z}[C_8]$-modules. Their
$\mathbb{Z}[C_8]$-structure is determined here. It is described in terms of
indecomposable modules and determined by ramification invariants. Although
infinitely many indecomposable $\mathbb{Z}[C_8]$-modules are available
(classification by Yakovlev), only 23 appear.
","[{""version"":""v1"",""created"":""Fri, 3 Feb 2006 14:18:24 GMT""}]","2007-05-23"
"math/0602061","Pavel Chebotarev","Rafig Agaev and Pavel Chebotarev","Spanning Forests of a Digraph and Their Applications","24 pages","Automation and Remote Control 62 (2001) No.3 443-466","10.1023/A:1002862312617",,"math.CO cs.DM math.RA",,"  We study spanning diverging forests of a digraph and related matrices. It is
shown that the normalized matrix of out forests of a digraph coincides with the
transition matrix in a specific observation model for Markov chains related to
the digraph. Expression are given for the Moore-Penrose generalized inverse and
the group inverse of the Kirchhoff (Laplacian) matrix. These expressions
involve the matrix of maximum out forest of the digraph. Every matrix of out
forests with a fixed number of arcs and the normalized matrix of out forests
are represented as polynomials in the Kirchhoff matrix; with the help of these
identities new proofs are given for the matrix-forest theorem and some other
statements. A connection is specified between the forest dimension of a digraph
and the degree of an annihilating polynomial for the Kirchhoff (Laplacian)
matrix. Some accessibility measures for digraph vertices are considered. These
are based on the enumeration of spanning forests.
","[{""version"":""v1"",""created"":""Fri, 3 Feb 2006 14:50:56 GMT""}]","2007-05-23"
"math/0602062","Simon Hochgerner","Simon Hochgerner","Spinning particles in a Yang-Mills field","22 pages",,,,"math.SG math-ph math.MP",,"  Suppose that a Lie group $G$ acts properly on a configuration manifold $Q$.
We study the symplectic quotient of $T^*Q$ with respect to the cotangent lifted
$G$-action at an arbitrary coadjoint orbit level $\mathcal{O}$. In particular,
if $Q=Q_{(H)}$ is of single orbit type we show that the symplectic quotient of
$T^*Q$ at $\mathcal{O}$ can be constructed through a minimal coupling procedure
involving the smaller cotangent bundle $T^*Q_H$, the symplectic quotient of
$\mathcal{O}$ at 0 with respect to the $H$-action, and the diagonal Hamiltonian
$N(H)/H$-action on these symplectic spaces. A prescribed connection on $Q_H\to
Q_H/(N(H)/H)$ then yields a computationally effective way of explicitly
realizing the symplectic structure on each stratum of the symplectic quotient
of $T^*Q$. In an example this result is combined with the projection method to
produce a stratified Hamiltonian system with very well hidden symmetries.
","[{""version"":""v1"",""created"":""Fri, 3 Feb 2006 15:41:07 GMT""}]","2007-05-23"
"math/0602063","Stefan Felsner","Stefan Felsner and Sarah Kappes","Orthogonal surfaces",,,,,"math.CO",,"  Orthogonal surfaces are nice mathematical objects which have interesting
connections to various fields, e.g., integer programming, monomial ideals and
order dimension. While orthogonal surfaces in one or two dimensions are rather
trivial already the three dimensional case has a rich structure with
connections to Schnyder woods, planar graphs and 3-polytopes.
  Our objective is to detect more of the structure of orthogonal surfaces in
four and higher dimensions. In particular we are driven by the question which
non-generic orthogonal surfaces have a polytopal structure.
  We study characteristic points and the cp-orders of orthogonal surfaces,
i.e., the dominance orders on the characteristic points. In the generic case
these orders are (almost) face lattices of polytopes. Examples show that in
general cp-orders can lack key properties of face lattices. We investigate
extra requirements which may help to have cp-orders which are face lattices.
  Finally, we turn the focus and ask for the realizability of polytopes on
orthogonal surfaces. There are criteria which prevent large classes of
simplicial polytopes from being realizable. On the other hand we identify some
families of polytopes which can be realized on orthogonal surfaces.
","[{""version"":""v1"",""created"":""Fri, 3 Feb 2006 15:25:00 GMT""}]","2007-05-23"
"nlin/0602004","Andrey Gorbach","Andrey V. Gorbach, Sergey Denisov, and Sergej Flach","Optical ratchets with discrete cavity solitons","3 pages, 4 figures, submitted to Optics Letters",,"10.1364/OL.31.001702",,"nlin.PS cond-mat.other physics.optics",,"  We propose a setup to observe soliton ratchet effects using discrete cavity
solitons in a one-dimensional array of coupled waveguide optical resonators.
The net motion of solitons can be generated by an adiabatic shaking of the
holding beam with zero average inclination angle. The resulting soliton
velocity can be controlled by different parameters of the holding beam.
","[{""version"":""v1"",""created"":""Fri, 3 Feb 2006 09:50:14 GMT""}]","2009-11-11"
"nlin/0602005","Andrea Bistagnino","A. Bistagnino, G. Boffetta, A. Celani, A. Mazzino, A. Puliafito and M.
  Vergassola","Nonlinear dynamics of the viscoelastic Kolmogorov flow","26 pages, 17 figures, submitted to The Journal of Fluid Mechanics",,"10.1017/S0022112007007859",,"nlin.CD",,"  The weakly nonlinear regime of a viscoelastic Navier--Stokes fluid is
investigated. For the purely hydrodynamic case, it is known that large-scale
perturbations tend to the minima of a Ginzburg-Landau free-energy functional
with a double-well (fourth-order) potential. The dynamics of the relaxation
process is ruled by a one-dimensional Cahn--Hilliard equation that dictates the
hyperbolic tangent profiles of kink-antikink structures and their mutual
interactions. For the viscoelastic case, we found that the dynamics still
admits a formulation in terms of a Ginzburg--Landau free-energy functional. For
sufficiently small elasticities, the phenomenology is very similar to the
purely hydrodynamic case: the free-energy functional is still a fourth-order
potential and slightly perturbed kink-antikink structures hold. For
sufficiently large elasticities, a critical point sets in: the fourth-order
term changes sign and the next-order nonlinearity must be taken into account.
Despite the double-well structure of the potential, the one-dimensional nature
of the problem makes the dynamics sensitive to the details of the potential. We
analysed the interactions among these generalized kink-antikink structures,
demonstrating their role in a new, elastic instability. Finally, consequences
for the problem of polymer drag reduction are presented.
","[{""version"":""v1"",""created"":""Fri, 3 Feb 2006 09:51:14 GMT""}]","2015-06-26"
"nlin/0602006","Stanislav Derevyanko","S.A. Derevyanko, G. Falkovich, K. Turitsyn, and S. Turitsyn","Explosive growth of inhomogeneities in the distribution of droplets in a
  turbulent air","Replacing with extended detailed version",,,,"nlin.CD",,"  We study how the spatial distribution of inertial particles evolves with time
in a random flow. We describe an explosive appearance of caustics and show how
they influence an exponential growth of clusters due to smooth parts of the
flow, leading in particular to an exponential growth of the average distance
between particles.
","[{""version"":""v1"",""created"":""Fri, 3 Feb 2006 13:43:48 GMT""},{""version"":""v2"",""created"":""Sun, 23 Apr 2006 14:07:27 GMT""}]","2007-05-23"
"nlin/0602007","Andrew Hone N.W.","A.N.W. Hone","Singularity confinement for maps with the Laurent property","13 pages; typos corrected; comments & references added; reformulation
  of theorem",,"10.1016/j.physleta.2006.09.078","UKC/IMS/06/04","nlin.SI",,"  The singularity confinement test is very useful for isolating integrable
cases of discrete-time dynamical systems, but it does not provide a sufficient
criterion for integrability. Quite recently a new property of the bilinear
equations appearing in discrete soliton theory has been noticed: the iterates
of such equations are Laurent polynomials in the initial data. A large class of
non-integrable mappings of the plane are presented which both possess this
Laurent property and have confined singularities.
","[{""version"":""v1"",""created"":""Fri, 3 Feb 2006 13:35:59 GMT""},{""version"":""v2"",""created"":""Tue, 7 Feb 2006 16:27:14 GMT""},{""version"":""v3"",""created"":""Wed, 29 Mar 2006 15:18:59 GMT""},{""version"":""v4"",""created"":""Thu, 30 Mar 2006 11:00:40 GMT""}]","2009-11-11"
"nucl-ex/0602001","Olaf N. Hartmann","O.N. Hartmann","Tracking in Antiproton Annihilation Experiments","1 tar.gz file containing 5 pages paper, 3 figures in 5 files;
  proceedings of the TIME05 workshop","Nucl.Instrum.Meth. A566 (2006) 66-69","10.1016/j.nima.2006.05.132","LNF - 06/3","nucl-ex",,"  A major ingredient of the planned new accelerator complex FAIR, to be
constructed at the GSI, Darmstadt, Germany, is the availability of antiproton
beams with high quality and intensity. Among the experiments which will make
use of this opportunity is PANDA, a dedicated experiment to study antiproton
annihilations on nucleons and nuclei. This article gives an overview on the
foreseen techniques to perform charged particle tracking in the high rate
environment of this experiment.
","[{""version"":""v1"",""created"":""Thu, 2 Feb 2006 16:33:52 GMT""}]","2009-11-11"
