"astro-ph/0602264","Stepan Moskaliuk","S.S. Moskaliuk, A.V. Nesteruk and I.I. Sokolov","Density Perturbation in the Universe with Nontrivial Topology of
  Space-Time","9 pages, Latex, no figures","Hadronic J. 18 (1995) 392-401",,,"astro-ph",,"  A space spectrum of density perturbation In the Universe with nontrivial
topology of space-time is shown to become discrete.
","[{""version"":""v1"",""created"":""Sun, 12 Feb 2006 17:47:37 GMT""}]","2007-05-23"
"astro-ph/0602265","Volker Ossenkopf","V. Ossenkopf, A. Esquivel, A. Lazarian, J. Stutzki","Interstellar cloud structure: The statistics of centroid velocities","Accepted for publication in Astronomy & Astrophysics",,"10.1051/0004-6361:20052754",,"astro-ph",,"  The investigation of the statistical properties of maps of line centroids has
been used for almost 50 years, but there is still no general agreement on their
interpretation. We try to quantify which properties of underlying turbulent
velocity fields can be derived from centroid velocity maps, and we test
conditions under which the scaling behaviour of the centroid velocities matches
the scaling of the three-dimensional velocity field. Using fractal cloud models
we study systematically the relation between three-dimensional density and
velocity fields and the statistical properties of the produced line centroid
maps. We put special attention to cases with large density fluctuations
resembling supersonic interstellar turbulence. Starting from the Delta-variance
analysis we derive a new tool to compute the scaling behaviour of the
three-dimensional velocity field from observed intensity and centroid velocity
maps. We provide two criteria to decide whether the information from the
centroid velocities directly reflects the properties of the underlying velocity
field. Applying these criteria allows to understand the different results found
so far in the literature on the interpretation of the statistics of velocity
centroids. A new iteration scheme can be used to derive the three-dimensional
velocity scaling from centroid velocity maps for arbitrary density and velocity
fields, but it requires an accurate knowledge of the average density of the
considered interstellar cloud.
","[{""version"":""v1"",""created"":""Sun, 12 Feb 2006 18:24:04 GMT""}]","2009-11-11"
"astro-ph/0602266","Joao Magueijo","Jacob Bekenstein and Joao Magueijo","MOND habitats within the solar system",,"Phys.Rev. D73 (2006) 103513","10.1103/PhysRevD.73.103513",,"astro-ph gr-qc hep-th",,"  MOdified Newtonian Dynamics (MOND) is an interesting alternative to dark
matter in extragalactic systems. We here examine the possibility that mild or
even strong MOND behavior may become evident well inside the solar system, in
particular near saddle points of the total gravitational potential. Whereas in
Newtonian theory tidal stresses are finite at saddle points, they are expected
to diverge in MOND, and to remain distinctly large inside a sizeable oblate
ellipsoid around the saddle point. We work out the MOND effects using the
nonrelativistic limit of the T$e$V$e$S theory, both in the perturbative nearly
Newtonian regime and in the deep MOND regime. While strong MOND behavior would
be a spectacular ``backyard'' vindication of the theory, pinpointing the
MOND-bubbles in the setting of the realistic solar system may be difficult.
Space missions, such as the LISA Pathfinder, equipped with sensitive
accelerometers, may be able to explore the larger perturbative region.
","[{""version"":""v1"",""created"":""Sun, 12 Feb 2006 20:46:43 GMT""}]","2009-11-11"
"astro-ph/0602267","David L. Band","David L. Band (GSFC/Umbc)","Post-Launch Analysis of Swift's Gamma-Ray Burst Detection Sensitivity","20 pages, 8 figures, Ap. J. in press",,"10.1086/503326",,"astro-ph",,"  The dependence of Swift's detection sensitivity on a burst's temporal and
spectral properties shapes the detected burst population. Using simplified
models of the detector hardware and the burst trigger system I find that Swift
is more sensitive to long, soft bursts than CGRO's BATSE, a reference detector
because of the large burst database it accumulated. Thus Swift has increased
sensitivity in the parameter space region into which time dilation and spectral
redshifting shift high redshift bursts.
","[{""version"":""v1"",""created"":""Sun, 12 Feb 2006 22:20:49 GMT""}]","2009-11-11"
"astro-ph/0602268","Elena Pian","Elena Pian, Luigi Foschini, Volker Beckmann, et al","INTEGRAL observations of the blazar 3C454.3 in outburst","5 pages, 3 eps figures, in press in A&A Letters",,"10.1051/0004-6361:200600017",,"astro-ph",,"  In Spring 2005, the blazar 3C454.3 underwent a dramatic outburst at all
wavelengths from mm to X-rays. This prompted INTEGRAL observations,
accomplished in 15-18 May 2005. The source was detected by the INTEGRAL
instruments from 3 to 200 keV in a bright state (~5 x 10E-10 cgs), at least a
factor of 2-3 higher than previously observed. This is one of the brightest
blazar detections achieved by INTEGRAL. During the 2.5 days of INTEGRAL
monitoring, we detected a ~20% decrease in the hard X-rays (20-40 keV),
indicating that we have sampled the decaying part of the flare. The decrease is
less apparent in the soft X-rays (5-15 keV). The simultaneous optical
variations are weakly correlated with those at soft X-rays, and not clearly
correlated with those at hard X-rays. The spectral energy distribution exhibits
two components, as typically seen in blazars, which can be modeled with
synchrotron radiation and inverse Compton scattering occurring in a region
external to the broad line region.
","[{""version"":""v1"",""created"":""Mon, 13 Feb 2006 01:38:51 GMT""},{""version"":""v2"",""created"":""Tue, 14 Feb 2006 00:14:55 GMT""},{""version"":""v3"",""created"":""Wed, 15 Feb 2006 20:52:29 GMT""}]","2009-11-11"
"astro-ph/0602269","D. Anish Roshi","D. Anish Roshi (RRI, India), C. G. De Pree (Agnes Scott College, USA),
  W. M. Goss (NRAO, USA), K. R. Anantharamaiah (RRI, India)","VLA Observations of Carbon 91$\alpha$ Recombination Line Emission in W49
  North","accepted for publication in ApJ, 12 pages, 2 figs, 3 tables",,,,"astro-ph",,"  We have detected C91$\alpha$ (8.5891 GHz) emission toward 4 ultra-compact
\HII regions (\UCHII s; W49G, J, L & C) in the W49 North massive star forming
region with the Very Large Array (VLA) at 3\arcsec resolution. No carbon line
emission was detected toward \UCHII s W49F, A, O, S and Q at this frequency to
a 3$\sigma$ level of 2 mJy. We also observed the same region in the C75$\alpha$
line (15.3 GHz) with no detection at a 3$\sigma$ level of 6 mJy with a
1\arcsec.7 beam. Detection of line emission toward these sources add supporting
data to the earlier result of \nocite{retal05a}Roshi et al (2005a) that many
\UCHII s have an associated photo-dissociation region (PDR). Similarity of the
LSR velocities of carbon recombination lines and H$_2$CO absorption toward
\UCHII s in W49 North suggests that the PDRs reside in the dense interface zone
surrounding these \HII regions. Combining the observed carbon line parameters
at 8.6 GHz with the upper limits on line emission at 15.3 GHz, we obtain
constraints on the physical properties of the PDRs associated with W49G and J.
The upper limit on the number density of hydrogen molecule obtained from carbon
line models is $\sim$ $5 \times 10^6$ \cmthree.
","[{""version"":""v1"",""created"":""Mon, 13 Feb 2006 04:58:15 GMT""}]","2007-05-23"
"astro-ph/0602270","D. Anish Roshi","K. Jeeva Priya and D. Anish Roshi (RRI, Banglore, India)","An Experimental setup to develop RFI mitigation techniques for radio
  astronomy","To appear in the proceedings of the XXVIIth general assembly of URSI
  (2005), Delhi; 4 pages, 5 figures",,,,"astro-ph",,"  Increasing levels of Radio Frequency Interference (RFI) are a problem for
research in radio astronomy. Various techniques to suppress RFI and extract
astronomical signals from data affected by interference are being tried out.
However, extracting weak astronomical signals in the spectral region affected
by RFI remains a technological challenge. In this paper, we describe the
construction of an experimental setup at the Raman Research Institute (RRI),
Bangalore, India for research in RFI mitigation. We also present some results
of tests done on the data collected using this setup. The experimental setup
makes use of the 1.42 GHz receiver system of the 10.4 m telescope at RRI. A new
reference antenna, its receiver system and a backend for recording digitized
voltage together with the 1.42 GHz receiver system form the experimental setup.
We present the results of the characterization of the experimental setup. An
off-line adaptive filter was successfully implemented and tested using the data
obtained with the experimental setup.
","[{""version"":""v1"",""created"":""Mon, 13 Feb 2006 05:24:32 GMT""}]","2007-05-23"
"astro-ph/0602271","Galina Korotkova Gennadievna","I.D.Karachentsev, V.E.Karachentseva, W.K.Huchtmeier","Disturbed isolated galaxies: indicators of a dark galaxy population?","5 pages, 1 figure. Astronomy and Astrophysics, accepted",,"10.1051/0004-6361:20054497",,"astro-ph",,"  We report the results of our search for disturbed (interacting) objects among
very isolated galaxies. The inspections of 1050 northern isolated galaxies from
KIG and 500 nearby, very isolated galaxies situated in the Local Supercluster
yielded five and four strongly disturbed galaxies, respectively. We suggest
that the existence of ""dark"" galaxies explains the observed signs of
interaction. This assumption leads to a cosmic abundance of dark galaxies (with
the typical masses for luminous galaxies) that is less than ~1/20 the
population of visible galaxies.
","[{""version"":""v1"",""created"":""Mon, 13 Feb 2006 08:03:04 GMT""}]","2009-11-11"
"astro-ph/0602272","Weimin Yuan","W. Yuan (1), A.C. Fabian (2), M.A. Worsley (2) R.G. McMahon (2) ((1)
  YNAO/NAOC, (2) IoA, Cambridge)","X-ray spectral properties of high-redshift radio-loud quasars beyond
  redshift 4--first results","9 pages; accepted for publication in MNRAS","Mon.Not.Roy.Astron.Soc.368:985,2006","10.1111/j.1365-2966.2006.10175.x",,"astro-ph",,"  (abridged) We firstly present the results of X-ray spectroscopic observations
with XMM-Newton for four high-redshift radio-loud quasars at z>4. These
observations more than double the number of z>4 radio-loud quasars having X-ray
spectroscopic data to seven, which compose a significant subset of a
flux-limited sample of z>4 radio-loud quasars. Based on this subset we show
some preliminary results on the overall X-ray spectral properties of the
sample. Soft X-ray spectral flattening, which is thought to arise from
intrinsic X-ray absorption, was found in about half of the sample. We give a
preliminary distribution of the absorption column density NH. For those with
detected X-ray absorption, the derived NH values fall into a very narrow range
(around a few times 10^(22)cm^(-2) for `cold' absorption), suggesting a
possible common origin of the absorber. Compared to lower-redshift samples at
z<2, there is an extension, or a systematic shift, toward higher values in the
intrinsic NH distribution at z>4, and an increase of the fraction of radio-loud
quasars showing X-ray absorption toward high redshifts. These results indicate
a cosmic evolution effect, which seems to be the strongest at redshifts around
2. The rest frame 1-50keV continua have photon indices with a mean of 1.64 and
a standard deviation of 0.11. Variability appears to be common on timescales
from a few months to years in the quasar rest-frame, sometimes in both fluxes
and spectral slopes.
","[{""version"":""v1"",""created"":""Mon, 13 Feb 2006 07:06:48 GMT""}]","2009-09-17"
"astro-ph/0602273","Bhuwan Joshi","Bhuwan Joshi (1), Anita Joshi (1) ((1) ARIES, Nainital, India)","Intermediate-term periodicities in soft X-ray flare index during solar
  cycles 21, 22 and 23","9 pages, Appeared in the Solar Physics","Solar Phys. 226 (2005) 153-161","10.1007/s11207-005-5716-9",,"astro-ph",,"  We have analyzed the intermediate term periodicities in soft X-ray flare
index ($FI_{SXR}$) during solar cycles 21, 22 and 23. Power spectral analysis
of daily $FI_{SXR}$ reveals a significant period of 161 days in cycle 21 which
is absent during cycle 22 and 23. We have found that in cycle 22 periodicities
of 74 and 83 days are in operation. A 123 day periodicity has been found to be
statistically significant during the part of the current solar cycle 23. The
existence of these periodicities has been discussed in the light of earlier
results.
","[{""version"":""v1"",""created"":""Mon, 13 Feb 2006 07:46:31 GMT""},{""version"":""v2"",""created"":""Tue, 26 Sep 2006 14:43:30 GMT""}]","2007-05-23"
"astro-ph/0602274","Chizuru Akizuki","C.Akizuki and J.Fukue","Self-Similar Solutions for ADAF with Toroidal Magnetic Fields","5pages, 2figures, PASJ 58 (2006) in press",,"10.1093/pasj/58.2.469",,"astro-ph",,"  We examined the effect of toroidal magnetic fields on a viscous gaseous disk
around a central object under an advection dominated stage. We found
self-similar solutions for radial infall velocity, rotation velocity, sound
speed, with additional parameter $\beta$ [$=c_{\rm A}^2/(2c_{\rm s}^2)$], where
$c_{\rm A}$ is the Alfv\'en speed and $c_{\rm s}$ is the isothermal sound
speed. Compared with the non-magnetic case, in general the disk becomes thick
due to the magnetic pressure, and the radial infall velocity and rotation
velocity become fast. In a particular case, where the magnetic field is
dominant, on the other hand, the disk becomes to be magnetically supported, and
the nature of the disk is significantly different from that of the weakly
magnetized case.
","[{""version"":""v1"",""created"":""Mon, 13 Feb 2006 07:59:15 GMT""}]","2015-06-24"
"astro-ph/0602275","Phil Arras","Phil Arras, Omer Blaes and Neal J. Turner","Quasi-Periodic Oscillations from Magnetorotational Turbulence","4 pages, 2 figures. submitted to apj","Astrophys.J. 645 (2006) L65-L68","10.1086/505966",,"astro-ph",,"  Quasi-periodic oscillations (QPOs) in the X-ray lightcurves of accreting
neutron star and black hole binaries have been widely interpreted as being due
to standing wave modes in accretion disks. These disks are thought to be highly
turbulent due to the magnetorotational instability (MRI). We study wave
excitation by MRI turbulence in the shearing box geometry. We demonstrate that
axisymmetric sound waves and radial epicyclic motions driven by MRI turbulence
give rise to narrow, distinct peaks in the temporal power spectrum. Inertial
waves, on the other hand, do not give rise to distinct peaks which rise
significantly above the continuum noise spectrum set by MRI turbulence, even
when the fluid motions are projected onto the eigenfunctions of the modes. This
is a serious problem for QPO models based on inertial waves.
","[{""version"":""v1"",""created"":""Mon, 13 Feb 2006 08:10:28 GMT""}]","2009-11-11"
"astro-ph/0602276","Tristan Brunier","T. Brunier and F. Bernardeau","The shape of high order correlation functions in CMB anisotropy maps","31 pages, 17 figures, submitted to Phys. Rev. D","Phys.Rev.D73:083524,2006","10.1103/PhysRevD.73.083524","SPhT-T06/004","astro-ph",,"  We present a phenomenological investigation of non-Gaussian effects that
could be seen on CMB temperature maps. Explicit expressions for the temperature
correlation functions are given for different types of primordial mode
couplings. We argue that a simplified description of the radial transfer
function for the temperature anisotropies allows to get insights into the
general properties of the bi and tri-spectra. The accuracy of these results is
explored together with the use of the small scale approximation to get explicit
expressions of high order spectra. The bi-spectrum is found to have alternate
signs for the successive acoustic peaks. Sign patterns for the trispectra are
more complicated and depend specifically on the type of metric couplings. Local
primordial couplings are found to give patterns that are different from those
expected from weak lensing effects.
","[{""version"":""v1"",""created"":""Mon, 13 Feb 2006 10:00:20 GMT""}]","2011-01-20"
"astro-ph/0602277","Ivan Anicin","Ivan V. Anicin","Do the Solitary Cooled-Down Neutron Stars Spontaneously Disintegrate?","7 pages",,,,"astro-ph",,"  We discuss the possibility for a cooled down and otherwise stable solitary
neutron star to make a spontaneous transition to its potential black hole
ground state. This fundamental process would mimic a precursorless explosion in
which the emitted radiations consisting of the statistical mass spectrum of
high-energy neutron-rich nuclei, gamma rays and (anti) neutrinos, would carry
away some mass of the star, leaving behind the core of the star in the form of
a black hole.
","[{""version"":""v1"",""created"":""Mon, 13 Feb 2006 08:38:46 GMT""}]","2007-05-23"
"astro-ph/0602278","Hilmar W. Duerbeck","Ronald A. Downes (STScI), Ronald F. Webbink (Dept. Astr. U Illinois),
  Michael M. Shara (Am. Museum Nat. Hist.), Hans Ritter (MPI Astrophysik),
  Ulrich Kolb (Dept. Phys. Astr., The Open University), Hilmar W. Duerbeck (VU
  Brussel)","A Catalog and Atlas of Cataclysmic Variables: The Final Edition","8 pages, including 6 tables","The Journal of Astronomical Data 11, 2 (2005)",,,"astro-ph",,"  The Catalog and Atlas of Cataclysmic Variables has been a staple of the CV
community for over 10 years. The catalog has grown from 751 CVs in 1993 to 1600
CVs at present. The catalog became a ``living'' edition in 2001, and its
contents have been continually updated since that time. Effective 27 January
2006, the catalog will transition to an archival site, with no further updates
to its contents. While it is antipicated that the site will remain active, we
present the complete contents of the site as a precaution against a loss of the
on-line data.
","[{""version"":""v1"",""created"":""Mon, 13 Feb 2006 10:05:11 GMT""}]","2007-05-23"
"astro-ph/0602279","Patrick Eggenberger","P. Eggenberger, F. Carrier","Modeling beta Virginis using seismological data","11 pages, 12 figures, accepted for publication in A&A",,"10.1051/0004-6361:20052882",,"astro-ph",,"  This paper presents the modeling of the F9 V star beta Virginis based on
seismological measurements. Using the Geneva evolution code including rotation
and atomic diffusion, we find that two distinct solutions reproduce all
existing asteroseismic and non-asteroseismic observational constraints well: a
main-sequence model with a mass of 1.28 +- 0.03 Msun and an age t = 3.24 +-
0.20 Gyr, or a model in the post-main sequence phase of evolution with a lower
mass of 1.21 +- 0.02 Msun and an age t = 4.01 +- 0.30 Gyr. The small spacings
and the ratio between small and large spacings are sensitive to the differences
in the structure of the central layers between these two solutions and are also
sensitive to the structural changes due to the rotational mixing. They can
therefore be used to unambiguously determine the evolutionary state of beta Vir
and to study the effects of rotation on the inner structure of the star.
Unfortunately, existing asteroseismic data do not enable such precise
determination. We also show that the scatter in frequencies introduced by the
rotational splittings can account for the larger dispersion of the observed
large spacings for the non-radial modes than for the radial modes.
","[{""version"":""v1"",""created"":""Mon, 13 Feb 2006 10:10:23 GMT""}]","2009-11-11"
"astro-ph/0602280","George F. R. Ellis","George F. R. Ellis","Issues in the Philosophy of Cosmology","To appear in the Handbook in Philosophy of Physics, Ed J Butterfield
  and J Earman (Elsevier, 2006). Small imporvements plus crucial change in
  Thesis B2",,,,"astro-ph",,"  After a survey of the present state of cosmological theory and observations,
this article discusses a series of major themes underlying the relation of
philosophy to cosmology. These are: A: The uniqueness of the universe; B: The
large scale of the universe in space and time; C: The unbound energies in the
early universe; D: Explaining the universe -- the question of origins; E: The
universe as the background for existence; F: The explicit philosophical basis;
G: The Anthropic question: fine tuning for life; H: The possible existence of
multiverses; I: The natures of existence. Each of these themes is explored and
related to a series of Theses that set out the major issues confronting
cosmology in relation to philosophy.
","[{""version"":""v1"",""created"":""Mon, 13 Feb 2006 10:47:21 GMT""},{""version"":""v2"",""created"":""Wed, 29 Mar 2006 14:23:05 GMT""}]","2007-05-23"
"astro-ph/0602281","Adam Szmagli\'nski","A. Szmaglinski, W. Wojcik and M. Kutschera","Properties of localized protons in neutron star matter for realistic
  nuclear models","6 pages, 3 figures, Presented at the XXIX Mazurian Lakes Conference
  on Physics, Piaski, Poland, August 30 - Septenber 6, 2005","Acta Phys.Polon.B37:277,2006",,,"astro-ph",,"  We study the localization of protons in the core of neutron stars for ten
realistic nuclear models that share a common behaviour of nuclear symmetry
energy which saturates and eventually decreases at high densities. This results
in the low proton fraction of beta-stable neutron star matter. Protons form a
small admixture in the neutron star core, which is localized at sufficiently
high densities. For every model we calculate the density $n_{loc}$ above which
the localization effect is present. Our results indicate that localization
occurs at densities above $0.5-1.0 fm^{-3}$. The phase with localized protons
occupies a spherical shell or a core region inside neutron stars which contains
significant fraction of all nucleons. Proton localization is of great
importance for astrophysical properties of neutron stars as it strongly affects
transport coefficients of neutron star matter and can produce spontaneous
magnetization in neutron stars.
","[{""version"":""v1"",""created"":""Mon, 13 Feb 2006 13:18:34 GMT""}]","2011-03-17"
"astro-ph/0602282","Gusakov Michael","M.E. Gusakov (1,2), N. Andersson (2) ((1) Ioffe Institute, (2)
  University of Southampton)","Temperature-dependent pulsations of superfluid neutron stars","29 pages, 1 table, 4 figures","Mon.Not.Roy.Astron.Soc.372:1776-1790,2006","10.1111/j.1365-2966.2006.10982.x",,"astro-ph",,"  We examine radial oscillations of superfluid neutron stars at finite internal
temperatures. For this purpose we generalize the description of relativistic
superfluid hydrodynamics to the case of superfluid mixtures. We show that in a
neutron star at hydrostatic and beta-equilibrium the red-shifted temperature
gradient is smoothed out by neutron superfluidity (but not by proton
superfluidity). We calculate radial oscillation modes of neutron stars assuming
""frozen"" nuclear composition in the pulsating matter. The resulting pulsation
frequencies show a strong temperature dependence in the temperature range
(0.1-1) T_cn, where T_cn is the critical temperature of neutron superfluidity.
Combining our results with thermal evolution, we obtain a significant evolution
of the pulsation spectrum, associated with highly efficient Cooper pairing
neutrino emission, for 20 years after superfluidity onset.
","[{""version"":""v1"",""created"":""Mon, 13 Feb 2006 14:02:33 GMT""},{""version"":""v2"",""created"":""Wed, 1 Nov 2006 15:14:40 GMT""}]","2008-11-26"
"astro-ph/0602283","Mattia Negrello","M. Negrello, M. Magliocchetti, G. De Zotti","The large scale clustering of radio sources","9 pages, 8 figures. Accepted for publication on MNRAS","Mon.Not.Roy.Astron.Soc.368:935-942,2006","10.1111/j.1365-2966.2006.10171.x",,"astro-ph",,"  The observed two-point angular correlation function, w(theta), of mJy radio
sources exhibits the puzzling feature of a power-law behaviour up to very large
(almost 10 degrees) angular scales which cannot be accounted for in the
standard hierarchical clustering scenario for any realistic redshift
distribution of such sources. After having discarded the possibility that the
signal can be explained by a high density local source population, we find no
alternatives to assuming that - at variance with all the other extragalactic
populations studied so far, and in particular with optically selected quasars -
radio sources responsible for the large-scale clustering signal were
increasingly less clustered with increasing look-back time, up to at least z=1.
The data are accurately accounted for in terms of a bias function which
decreases with increasing redshift, mirroring the evolution with cosmic time of
the characteristic halo mass, M_{star}, entering the non linear regime. In the
framework of the `concordance cosmology', the effective halo mass controlling
the bias parameter is found to decrease from about 10^{15} M_{sun}/h at z=0 to
the value appropriate for optically selected quasars, 10^{13} M_{sun}/h, at
z=1.5. This suggests that, in the redshift range probed by the data, the
clustering evolution of radio sources is ruled by the growth of large-scale
structure, and that they are associated with the densest environments
virializing at any cosmic epoch. The data provide only loose constraints on
radio source clustering at z>1 so we cannot rule out the possibility that at
these redshifts the clustering evolution of radio sources enters a different
regime, perhaps similar to that found for optically selected quasars. The
dependence of w(theta) on cosmological parameters is also discussed.
","[{""version"":""v1"",""created"":""Mon, 13 Feb 2006 14:56:41 GMT""}]","2009-11-11"
