"cond-mat/0602308","Reza Ejtehadi","M. Babadi, R. Everaers, and M.R. Ejtehadi","Coarse-grained Interaction Potentials for Anisotropic Molecules","8 pages, 4 tables and 6 figures. To appear in J. Chem. Phys","J. Chem. Phys. 124, 174708 (2006)","10.1063/1.2179075",,"cond-mat.soft cond-mat.mtrl-sci physics.chem-ph q-bio.BM",,"  We have proposed an efficient parameterization method for a recent variant of
the Gay-Berne potential for dissimilar and biaxial particles and demonstrated
it for a set of small organic molecules. Compared to the previously proposed
coarse-grained models, the new potential exhibits a superior performance in
close contact and large distant interactions. The repercussions of thermal
vibrations and elasticity has been studied through a statistical method. The
study justifies that the potential of mean force is representable with the same
functional form, extending the application of this coarse-grained description
to a broader range of molecules. Moreover, the advantage of employing
coarse-grained models over truncated atomistic summations with large distance
cutoffs has been briefly studied.
","[{""version"":""v1"",""created"":""Mon, 13 Feb 2006 13:32:35 GMT""}]","2007-05-23"
"cond-mat/0602309","Igor Aleiner","I.L. Aleiner, K.B.Efetov","Supersymmetric low-energy theory and renormalization group for a clean
  Fermi gas with a repulsion in arbitrary dimensions",,"Phys. Rev. B, 74, 075102 (2006)","10.1103/PhysRevB.74.075102",,"cond-mat.str-el",,"  We suggest a new method of calculations for a clean Fermi gas with a
repulsion in any dimension. This method is based on writing equations for
quasiclassical Green functions and reducing them to equations for collective
spin and charge excitations. The spin excitations interact with each other and
this leads to non-trivial physics. Writing the solution of the equations and
the partition function in terms of a functional integral over supervectors and
averaging over fluctuating fields we come to an effective field theory
describing the spin excitations. In some respects, the theory is similar to
bosonization but also includes the ``ghost'' excitations which prevents
overcounting of the degrees of freedom. Expansion in the interaction reveals
logarithmic in temperature corrections. This enables us to suggest a
renormalization group scheme and derive renormalization group equations.
Solving these equations and using their solutions for calculating thermodynamic
quantities we obtain explicit expression for the specific heat containing only
an effective amplitude of the backward scattering. This amplitude has a
complicated dependence on the logarithm of temperature, which leads to a
non-trivial temperature dependence of the specific heat.
","[{""version"":""v1"",""created"":""Mon, 13 Feb 2006 13:37:36 GMT""}]","2009-11-11"
"cond-mat/0602310","Satoshi Ejima","S. Ejima, F. H. L. Essler, F. Gebhard","Thermodynamics of the one-dimensional half-filled Hubbard model in the
  spin-disordered regime","15 pages, 3 figures","J.Phys.A39:4845-4857,2006","10.1088/0305-4470/39/18/005",,"cond-mat.str-el",,"  We analyze the Thermodynamic Bethe Ansatz equations of the one-dimensional
half-filled Hubbard model in the ""spin-disordered regime"", which is
characterized by the temperature being much larger than the magnetic energy
scale but small compared to the Mott-Hubbard gap. In this regime the
thermodynamics of the Hubbard model can be thought of in terms of gapped
charged excitations with an effective dispersion and spin degrees of freedom
that only contribute entropically. In particular, the internal energy and the
effective dispersion become essentially independent of temperature. An
interpretation of this regime in terms of a putative interacting-electron
system at zero temperature leads to a metal-insulator transition at a finite
interaction strength above which the gap opens linearly. We relate these
observations to studies of the Mott-Hubbard transition in the limit of infinite
dimensions.
","[{""version"":""v1"",""created"":""Mon, 13 Feb 2006 14:03:57 GMT""},{""version"":""v2"",""created"":""Mon, 24 Apr 2006 23:15:41 GMT""}]","2009-11-11"
"cs/0602044","Prasanta K. Panigrahi","Siddharth Arora, Jayadev Acharya, Amit Verma, Prasanta K. Panigrahi","Multilevel Thresholding for Image Segmentation through a Fast
  Statistical Recursive Algorithm","9 pages, 3 figures",,,,"cs.CV",,"  A novel algorithm is proposed for segmenting an image into multiple levels
using its mean and variance. Starting from the extreme pixel values at both
ends of the histogram plot, the algorithm is applied recursively on sub-ranges
computed from the previous step, so as to find a threshold level and a new
sub-range for the next step, until no significant improvement in image quality
can be achieved. The method makes use of the fact that a number of
distributions tend towards Dirac delta function, peaking at the mean, in the
limiting condition of vanishing variance. The procedure naturally provides for
variable size segmentation with bigger blocks near the extreme pixel values and
finer divisions around the mean or other chosen value for better visualization.
Experiments on a variety of images show that the new algorithm effectively
segments the image in computationally very less time.
","[{""version"":""v1"",""created"":""Sun, 12 Feb 2006 18:22:41 GMT""}]","2007-05-23"
"cs/0602045","Russ Abbott","Russ Abbott","Emergence Explained","67 pages. Earlier versions presented at Lake ArrowHead conference on
  human complex systems (2005), GECCO 2005 workshop on Biological Applications
  of Genetic and Evolutionary Computation, and Symposium on Understanding
  Complex Systems (2005)",,,,"cs.MA cs.DC cs.GL",,"  Emergence (macro-level effects from micro-level causes) is at the heart of
the conflict between reductionism and functionalism. How can there be
autonomous higher level laws of nature (the functionalist claim) if everything
can be reduced to the fundamental forces of physics (the reductionist
position)? We cut through this debate by applying a computer science lens to
the way we view nature. We conclude (a) that what functionalism calls the
special sciences (sciences other than physics) do indeed study autonomous laws
and furthermore that those laws pertain to real higher level entities but (b)
that interactions among such higher-level entities is epiphenomenal in that
they can always be reduced to primitive physical forces. In other words,
epiphenomena, which we will identify with emergent phenomena, do real
higher-level work. The proposed perspective provides a framework for
understanding many thorny issues including the nature of entities, stigmergy,
the evolution of complexity, phase transitions, supervenience, and downward
entailment. We also discuss some practical considerations pertaining to systems
of systems and the limitations of modeling.
","[{""version"":""v1"",""created"":""Sun, 12 Feb 2006 22:11:14 GMT""}]","2007-05-23"
"cs/0602046","Martin Wainwright","Emin Martinian, Martin J. Wainwright","Analysis of LDGM and compound codes for lossy compression and binning","5 pages; to appear in Workshop on Information Theory and its
  Applications, February 2006, San Diego",,,,"cs.IT math.IT",,"  Recent work has suggested that low-density generator matrix (LDGM) codes are
likely to be effective for lossy source coding problems. We derive rigorous
upper bounds on the effective rate-distortion function of LDGM codes for the
binary symmetric source, showing that they quickly approach the rate-distortion
function as the degree increases. We also compare and contrast the standard
LDGM construction with a compound LDPC/LDGM construction introduced in our
previous work, which provably saturates the rate-distortion bound with finite
degrees. Moreover, this compound construction can be used to generate nested
codes that are simultaneously good as source and channel codes, and are hence
well-suited to source/channel coding with side information. The sparse and
high-girth graphical structure of our constructions render them well-suited to
message-passing encoding.
","[{""version"":""v1"",""created"":""Mon, 13 Feb 2006 03:07:28 GMT""}]","2007-07-13"
"gr-qc/0602042","Farook Rahaman","F. Rahaman, B.C.Bhui and M. Kalam","Non static local string in higher dimensional gravity","6 pages","Int.J.Theor.Phys. 44 (2005) 1413-1418",,,"gr-qc",,"  We analyze the space-time structure of local gauge string with a
phenomenological energy momentum tensor, as prescribed by Vilenkin in an
arbitrary number of space-time dimensions with a non-zero cosmological constant
>. A set of solutions of full non-linear Einstein's equations for the interior
region of such a string are presented.
","[{""version"":""v1"",""created"":""Mon, 13 Feb 2006 07:56:56 GMT""}]","2007-05-23"
"gr-qc/0602043","Farook Rahaman","F. Rahaman, P.Ghosh, M.Kalam and K. Gayen","Higher dimensional global monopole with cosmological term","9 pages","Mod.Phys.Lett.A20:1627-1634,2005","10.1142/S0217732305013940",,"gr-qc",,"  We investigate the space-time of a global monopole in a five dimensional
space-time in presence of the cosmological term. Also the gravitational
properties of the monopole solution are discussed.
","[{""version"":""v1"",""created"":""Mon, 13 Feb 2006 08:17:15 GMT""}]","2009-09-01"
"gr-qc/0602044","Archana Pai","Sabrina D'Antonio, Archana Pai, Pia Astone","Validating delta-filters for resonant bar detectors of improved
  bandwidth foreseeing the future coincidence with interferometers","7 pages, presented in Amaldi6, accepted for publication in Journal of
  Physics: Conference Series","J.Phys.Conf.Ser. 32 (2006) 192-197","10.1088/1742-6596/32/1/029",,"gr-qc",,"  The classical delta filters used in the current resonant bar experiments for
detecting GW bursts are viable when the bandwidth of resonant bars is few Hz.
In that case, the incoming GW burst is likely to be viewed as an impulsive
signal in a very narrow frequency window. After making improvements in the
read-out with new transducers and high sensitivity dc-SQUID, the
Explorer-Nautilus have improved the bandwidth ($\sim 20$ Hz) at the sensitivity
level of $10^{-20}/\sqrt{Hz}$. Thus, it is necessary to reassess this
assumption of delta-like signals while building filters in the resonant bars as
the filtered output crucially depends on the shape of the waveform. This is
presented with an example of GW signals -- stellar quasi-normal modes, by
estimating the loss in SNR and the error in the timing, when the GW signal is
filtered with the delta filter as compared to the optimal filter.
","[{""version"":""v1"",""created"":""Mon, 13 Feb 2006 09:59:18 GMT""}]","2009-11-11"
"gr-qc/0602045","Gustav Holzegel","Gustav Holzegel","A Note on the Instability of Lorentzian Taub-NUT-Space","13 pages, no figures","Class.Quant.Grav. 23 (2006) 3951-3962","10.1088/0264-9381/23/11/017","DAMTP-2006-16","gr-qc hep-th",,"  I show that there are no SU(2)-invariant (time-dependent) tensorial
perturbations of Lorentzian Taub-NUT space. It follows that the spacetime is
unstable at the linear level against generic perturbations. I speculate that
this fact is responsible for so far unsuccessful attempts to define a sensible
thermodynamics for NUT-charged spacetimes.
","[{""version"":""v1"",""created"":""Mon, 13 Feb 2006 14:28:16 GMT""}]","2009-11-11"
"hep-ex/0602029","Michael Kordosky","Michael Kordosky","Ramifications of intranuclear re-scattering in MINOS","6 pages, 5 figures, To be published in Nucl.Phys.Proc.Suppl.--
  Proceedings of the IV International Workshop on Neutrino-Nucleus Interactions
  in the Few-GeV Region, 26-29, September, 2005",,"10.1016/j.nuclphysbps.2006.08.040",,"hep-ex",,"  MINOS will measure the composition of a neutrino beam at two locations, 735km
apart, in an effort confirm the (atmospheric) neutrino oscillation hypothesis
and measure the associated mixing parameters. Oscillations will be manifested
as a difference in the rate and energy spectrum of muon neutrino CC
interactions measured in the two detectors. Because most interactions observed
in MINOS are inelastic, the neutrino energy is reconstructed as the sum of the
energy carried by the muon and that seen in the hadronic shower emanating from
the struck nucleus. The latter is sensitive to uncertainties in the
hadronisation process, chief among them those due to intranuclear re-scattering
(i.e., final state interactions). We discuss the simulation of intranuclear
re-scattering currently used by MINOS and its effect on quantities observable
in the experiment.
","[{""version"":""v1"",""created"":""Mon, 13 Feb 2006 13:20:49 GMT""}]","2009-11-11"
"hep-lat/0602016","Leonardo Cosmai","Paolo Cea and Leonardo Cosmai","Probing the QCD Vacuum Using External Fields","12 pages, 5 figures, Contributed to Sense of Beauty in Physics:
  Miniconference in Honor of Adriano Di Giacomo on his 70th Birthday, Pisa,
  Italy, 26-27 Jan 2006",,,,"hep-lat",,"  The QCD vacuum can be studied using external fields. We report here results
respectively obtained probing the lattice QCD vacuum by means of an abelian
monopole field and of an abelian chromomagnetic field
","[{""version"":""v1"",""created"":""Mon, 13 Feb 2006 10:34:08 GMT""}]","2007-05-23"
"hep-ph/0602105","Gabriel Karl","G.Karl and V.A.Novikov","Quadrupolar contact terms and Hyperfine Structure","19 pages; two sentences deleted from first version","Phys.Rev.C74:024001,2006; Erratum-ibid.C77:039901,2008","10.1103/PhysRevC.74.024001 10.1103/PhysRevC.77.039901",,"hep-ph",,"  In the interaction of two electric quadrupoles, there is at short distances a
contact term proportional to the second derivative of a delta function. This
contact term contributes to the hyperfine splitting of bound states of two
particles with spin one or higher-for example the bound states of Omega minus
and a nucleus of spin one.The contact hyperfine splitting occurs in states with
orbital angular momentum one(p-wave), in contrast to the Fermi contact
interaction which is in s-states.We find that these contact splittings will be
observable with Omega minus atoms and help measure the quadrupole moment and
charge radius of the hyperon.
","[{""version"":""v1"",""created"":""Mon, 13 Feb 2006 15:19:20 GMT""},{""version"":""v2"",""created"":""Thu, 6 Apr 2006 15:26:07 GMT""}]","2014-11-18"
"hep-ph/0602106","Jinn-Ouk Gong","Jinn-Ouk Gong","Modular thermal inflation without slow-roll approximation","(v1) 13 pages, 1 table, no figure; (v2) 14 pages, 1 table, no figure,
  References added; (v3) A new subsection (3.2.3) added, one reference added,
  to appear in Physics Letters B","Phys.Lett.B637:149-155,2006","10.1016/j.physletb.2006.04.036","KAIST-TH/2006-03","hep-ph astro-ph",,"  We study an inflationary scenario where thermal inflation is followed by
fast-roll inflation. This is a rather generic possibility based on the
effective potentials of spontaneous symmetry breaking in the context of
particle physics models. We show that a large enough expansion could be
achieved to solve cosmological problems. However, the power spectrum of
primordial density perturbations from the quantum fluctuations in the inflaton
field is not scale invariant and thus inconsistent with observations. Using the
curvaton mechanism instead, we can obtain a nearly scale invariant spectrum,
provided that the inflationary energy scale is sufficiently low to have long
enough fast-roll inflation to dilute the perturbations produced by the inflaton
fluctuations.
","[{""version"":""v1"",""created"":""Mon, 13 Feb 2006 03:06:23 GMT""},{""version"":""v2"",""created"":""Thu, 9 Mar 2006 11:46:03 GMT""},{""version"":""v3"",""created"":""Fri, 21 Apr 2006 08:09:49 GMT""}]","2008-11-26"
"hep-ph/0602107","Tatsumi Aoyama","T. Aoyama, M. Hayakawa, T. Kinoshita, M. Nio","Automated Calculation Scheme for alpha^n Contributions of QED to Lepton
  g-2","5 pages, Talk presented at the 7th International Symposium on
  Radiative Corrections (RADCOR 2005), Shonan Village, Japan, October 2-7, 2005",,"10.1016/j.nuclphysbps.2006.03.040",,"hep-ph",,"  This article reports an automated approach to the evaluation of higher-order
terms of QED perturbation to anomalous magnetic moments of charged leptons by
numerical means. We apply this approach to tenth-order correction due to a
particular subcollection of Feynman diagrams, which have no virtual lepton
loops. This set of diagrams is distinctive in that it grows factorially in
number as the order increases, and also each of the diagrams holds quite a
large number of subtraction terms to be treated along renormalization
procedure. Thus some automated scheme has long been required to evaluate
correctly this class of diagrams. We developed a fast algorithm and an
implementation which automates necessary steps to generate from the
representation of each Feynman diagram the FORTRAN codes for numerical
integration. Currently those diagrams of tenth order are being evaluated.
","[{""version"":""v1"",""created"":""Mon, 13 Feb 2006 07:59:32 GMT""}]","2009-11-11"
"hep-ph/0602108","Omar Benhar","Omar Benhar","Final state interactions in the electroweak nuclear response","Invited talk at NUINT05. To be published in Nucl. Phys. B Proceedings
  Supplement",,"10.1016/j.nuclphysbps.2006.08.034",,"hep-ph nucl-th",,"  I review the description of the electroweak nuclear response at large
momentum transfer within nonrelativistic many-body theory. Special
consideration is given to the effects of final state interactions, which are
known to be large in both inclusive and semi-inclusive processes. The results
of theoretical calculations of electron-nucleus scattering observables are
compared to the data, and the generalization to charged current
neutrino-nucleus interactions is discussed.
","[{""version"":""v1"",""created"":""Mon, 13 Feb 2006 09:07:54 GMT""}]","2009-11-11"
"hep-ph/0602109","Seong Youl Choi","S.Y. Choi and Y.G. Kim","Heavy Higgs Resonances for the Neutralino Relic Density in the Higgs
  Decoupling Limit of the CP--noninvariant Minimal Supersymmetric Standard
  Model","10 pages, 2 figures","Phys.Lett. B637 (2006) 27-31","10.1016/j.physletb.2006.04.029","DESY 06-011, KAIST-TH 2006/02","hep-ph",,"  The lightest neutralino is a compelling candidate to account for cold dark
matter in the universe in supersymmetric theories with $R$--parity. In the
CP-invariant theory, the neutralino relic density can be found in accord with
recent WMAP data if neutralino annihilation in the early universe occurs via
the s-channel $A$ funnel. In contrast, in the CP-noninvariant theory two heavy
neutral Higgs bosons can contribute to the Higgs funnel mechanism significantly
due to a CP-violating {\it complex} mixing between two heavy states, in
particular, when they are almost degenerate. With a simple analytic and
numerical analysis, we demonstrate that the CP-violating Higgs mixing can
modify the profile of the neutralino relic density {\it considerably} in the
heavy Higgs funnel with the neutralino mass close to half of the heavy Higgs
masses.
","[{""version"":""v1"",""created"":""Mon, 13 Feb 2006 10:25:53 GMT""}]","2010-04-05"
"hep-ph/0602110","Vladimir Galkin","D. Ebert, R. N. Faustov, V. O. Galkin","Relativistic treatment of the decay constants of light and heavy mesons","9 pages, 1 figure, minor changes, version published in Phys.Lett.B","Phys.Lett. B635 (2006) 93-99","10.1016/j.physletb.2006.02.042","HU-EP-06/04","hep-ph",,"  Novel relativistic expressions are used to calculate the weak decay constants
of pseudoscalar and vector mesons within the constituent quark model. Meson
wave functions satisfy the quasipotential equation with the complete
relativistic potential. New contributions, coming from the negative-energy
quark states, are substantial for the light mesons, significantly decrease the
values of their decay constants and, thus, bring them into agreement with
experiment. For heavy-light mesons these contribution are much less pronounced,
but permit to reduce uncertainties of the predicted decay constants. Their
values agree with the results of lattice calculations and experimental data.
","[{""version"":""v1"",""created"":""Mon, 13 Feb 2006 12:44:15 GMT""},{""version"":""v2"",""created"":""Thu, 13 Apr 2006 10:58:17 GMT""}]","2009-11-11"
"hep-ph/0602111","Benjamin Labonne","Benjamin Labonne, Emmanuel Nezri, Jean Orloff","The Suppression of Neutralino Annihilation into Zh","10 pages, 5 figures 10 pages, 5 figures","Eur.Phys.J.C47:805-814,2006","10.1140/epjc/s2006-02594-6",,"hep-ph",,"  The Indirect Detection of neutralino Dark Matter is most promising through
annihilation channels producing a hard energy spectrum for the detected
particles, such as the neutralino annihilation into $Zh$. A cancellation
however makes this particular annihilation channel generically subdominant in
the huge parameter space of supersymmetric models. This cancellation requires
non-trivial relations between neutralino mixings and masses, which we derive
from gauge independence and unitarity of the MSSM. To show how the cancellation
overshoots leaving only a subdominant result, we use a perturbative expansion
in powers of the electroweak/supersymmetry breaking ratio $m_{Z}/m_{\chi}$.
","[{""version"":""v1"",""created"":""Mon, 13 Feb 2006 14:52:19 GMT""},{""version"":""v2"",""created"":""Tue, 14 Feb 2006 10:45:50 GMT""},{""version"":""v3"",""created"":""Wed, 24 May 2006 08:37:18 GMT""},{""version"":""v4"",""created"":""Tue, 10 Oct 2006 12:05:06 GMT""},{""version"":""v5"",""created"":""Tue, 14 Nov 2006 08:13:17 GMT""}]","2009-01-07"
"hep-th/0602118","Paul Davis","Paul Davis","A Killing tensor for higher dimensional Kerr-AdS black holes with NUT
  charge","LaTeX, 14 pages. v2: Typo corrected and equation added. v3: Reference
  added, introduction expanded, published version","Class.Quant.Grav.23:3607-3618,2006","10.1088/0264-9381/23/10/023",,"hep-th gr-qc math-ph math.MP",,"  In this paper, we study the recently discovered family of higher dimensional
Kerr-AdS black holes with an extra NUT-like parameter. We show that the inverse
metric is additively separable after multiplication by a simple function. This
allows us to separate the Hamilton-Jacobi equation, showing that geodesic
motion is integrable on this background. The separation of the Hamilton-Jacobi
equation is intimately linked to the existence of an irreducible Killing
tensor, which provides an extra constant of motion. We also demonstrate that
the Klein-Gordon equation for this background is separable.
","[{""version"":""v1"",""created"":""Mon, 13 Feb 2006 10:11:38 GMT""},{""version"":""v2"",""created"":""Tue, 21 Feb 2006 11:58:45 GMT""},{""version"":""v3"",""created"":""Mon, 1 May 2006 08:54:17 GMT""}]","2009-11-11"
"hep-th/0602121","John Collins","John C. Collins","Renormalization: general theory","9 pages, 4 figures. Contribution to the Encyclopedia of Mathematical
  Physics (Elsevier)",,,,"hep-th hep-ph",,"  I review the theory of renormalization, as applied to weak-coupling
perturbation theory in quantum field theories.
","[{""version"":""v1"",""created"":""Sun, 12 Feb 2006 22:29:01 GMT""}]","2007-05-23"
"hep-th/0602122","Vladimir Mangazeev","Vladimir V Bazhanov, Vladimir V Mangazeev","The eight-vertex model and Painleve VI","9 pages, LaTeX, submitted to the special issue on Painleve VI,
  Journal of Physics A","J.Phys.A39:12235-12243,2006; J.Phys.A39:12235-12244,2006","10.1088/0305-4470/39/39/S15",,"hep-th math-ph math.MP",,"  In this letter we establish a connection of Picard-type elliptic solutions of
Painleve VI equation with the special solutions of the non-stationary Lame
equation. The latter appeared in the study of the ground state properties of
Baxter's solvable eight-vertex lattice model at a particular point,
$\eta=\pi/3$, of the disordered regime.
","[{""version"":""v1"",""created"":""Mon, 13 Feb 2006 03:42:06 GMT""}]","2009-11-11"
"hep-th/0602123","Nobuhiro Uekusa","Nobuhito Maru, Norisuke Sakai and Nobuhiro Uekusa","Supersymmetry Breaking by Constant Boundary Superpotentials in Warped
  Space","24 pages, 9 figures; Section 5 is replaced by the new analysis of the
  radius stabilization, small modifications made","Phys.Rev.D74:045017,2006","10.1103/PhysRevD.74.045017","ROME1/1423/06, TIT/HEP-549","hep-th hep-ph",,"  Supersymmetry breaking by constant (field independent) superpotentials
localized at boundaries is studied in a supersymmetric warped space model. We
calculate the Kaluza-Klein mass spectrum of the hypermultiplet. We take into
account of the radion and the compensator supermultiplets, as well as the bulk
mass $c$ for the hypermultiplet. The mass splitting is similar to that of the
Scherk-Schwarz supersymmetry breaking (in flat space) for large $|c|$, and has
an interesting dependence on the bulk mass parameter $c$. We show that the
radius is stabilized by the presence of the constant boundary superpotentials.
","[{""version"":""v1"",""created"":""Mon, 13 Feb 2006 07:48:52 GMT""},{""version"":""v2"",""created"":""Thu, 16 Feb 2006 05:44:02 GMT""},{""version"":""v3"",""created"":""Mon, 27 Feb 2006 04:23:21 GMT""},{""version"":""v4"",""created"":""Fri, 17 Mar 2006 04:42:11 GMT""},{""version"":""v5"",""created"":""Tue, 11 Jul 2006 09:32:49 GMT""}]","2008-11-26"
