"astro-ph/0602284","Ignacio de la Calle","I. de la Calle Perez (1) and S. D. Biller (1) ((1) University of
  Oxford)","Extending the Sensitivity of Air Cerenkov Telescopes","Refereed Version Accepted for publication in Astroparticle Physics","Astropart.Phys.26:69-90,2006","10.1016/j.astropartphys.2006.05.002",,"astro-ph",,"  Over the last decade, the Imaging Air Cerenkov technique has proven itself to
be an extremely powerful means to study very energetic gamma-radiation from a
number of astrophysical sources in a regime which is not practically accessible
to satellite-based instruments. The further development of this approach in
recent years has generally concentrated on increasing the density of camera
pixels, increasing the mirror area and using multiple telescopes. Here we
present a practical method to substantially improve the sensitivity of
Atmospheric Cerenkov Telescopes using wide-field cameras with a relatively
course density of photomultiplier tubes. The 2-telescope design considered here
is predicted to be more than ~3 times more sensitive than existing/planned
arrays in the regime above 300 GeV for continuously emitting sources; up to ~10
times more sensitive for hour-scale emission (relevant for episodic sources,
such as AGN); significantly more sensitive in the regime above 10 TeV; and
possessing a sky coverage which is roughly an order of magnitude larger than
existing instruments. It should be possible to extend this approach for even
further improvement in sensitivity and sky coverage.
","[{""version"":""v1"",""created"":""Mon, 13 Feb 2006 15:27:53 GMT""},{""version"":""v2"",""created"":""Sun, 7 May 2006 19:54:35 GMT""}]","2010-11-24"
"astro-ph/0602285","David H. Lyth","D. H. Lyth","Non-gaussianity and cosmic uncertainty in curvaton-type models","21 pages, wmap year three data considered","JCAP0606:015,2006","10.1088/1475-7516/2006/06/015",,"astro-ph hep-ph hep-th",,"  In curvaton-type models, observable non-gaussianity of the curvature
perturbation would come from a contribution of the form $(\delta\sigma)^2$,
where $\delta\sigma$ is gaussian. I analyse this situation allowing
$\delta\sigma$ to be scale-dependent. The actual curvaton model is considered
in more detail than before, including its cosmic uncertainty and anthropic
status. The status of curvaton-type models after WMAP year three data is
considered.
","[{""version"":""v1"",""created"":""Mon, 13 Feb 2006 15:29:28 GMT""},{""version"":""v2"",""created"":""Tue, 14 Mar 2006 14:52:38 GMT""},{""version"":""v3"",""created"":""Mon, 20 Mar 2006 18:46:44 GMT""}]","2009-11-11"
"cond-mat/0602278","Anton Burkov","A.A. Burkov, Eugene Demler","Vortex-Peierls States in Optical Lattices","4 pages, 4 figures. Published version","Physical Review Letters 96, 180406 (2006)","10.1103/PhysRevLett.96.180406",,"cond-mat.str-el cond-mat.supr-con",,"  We show that vortices, induced in cold atom superfluids in optical lattices,
may order in a novel vortex-Peierls ground state. In such a state vortices do
not form a simple lattice but arrange themselves in clusters, within which the
vortices are partially delocalized, tunneling between classically degenerate
configurations. We demonstrate that this exotic quantum many-body state is
selected by an order-from-disorder mechanism for a special combination of the
vortex filling and lattice geometry that has a macroscopic number of
classically degenerate ground states.
","[{""version"":""v1"",""created"":""Sun, 12 Feb 2006 22:26:27 GMT""},{""version"":""v2"",""created"":""Wed, 15 Feb 2006 20:12:54 GMT""},{""version"":""v3"",""created"":""Wed, 10 May 2006 20:57:41 GMT""}]","2009-11-11"
"cond-mat/0602288","Mark Dykman","M. Marthaler and M. I. Dykman","Switching via quantum activation: A parametrically modulated oscillator","15 pages, 10 figures, typos corrected","Phys. Rev. A 73, 042108 (2006)","10.1103/PhysRevA.73.042108",,"cond-mat.stat-mech cond-mat.mes-hall quant-ph",,"  We study switching between period-two states of an underdamped quantum
oscillator modulated at nearly twice its natural frequency. For all
temperatures and parameter values switching occurs via quantum activation: it
is determined by diffusion over oscillator quasienergy, provided the relaxation
rate exceeds the rate of interstate tunneling. The diffusion has quantum origin
and accompanies relaxation to the stable state. We find the semiclassical
distribution over quasienergy. For T=0, where the system has detailed balance,
this distribution differs from the distribution for $T\to 0$; the T=0
distribution is also destroyed by small dephasing of the oscillator. The
characteristic quantum activation energy of switching displays a typical
dependence on temperature and scaling behavior near the bifurcation point where
period doubling occurs.
","[{""version"":""v1"",""created"":""Sun, 12 Feb 2006 16:50:06 GMT""},{""version"":""v2"",""created"":""Fri, 27 Jul 2007 17:00:54 GMT""}]","2009-11-11"
"cond-mat/0602289","Jemal Guven","Jemal Guven","Laplace pressure as a surface stress in fluid vesicles","18 pages",,"10.1088/0305-4470/39/14/019",,"cond-mat.stat-mech cond-mat.soft math-ph math.MP",,"  Consider a surface, enclosing a fixed volume, described by a free-energy
depending only on the local geometry; for example, the Canham-Helfrich energy
quadratic in the mean curvature describes a fluid membrane. The stress at any
point on the surface is determined completely by geometry. In equilibrium, its
divergence is proportional to the Laplace pressure, normal to the surface,
maintaining the constraint on the volume. It is shown that this source itself
can be expressed as the divergence of a position-dependent surface stress. As a
consequence, the equilibrium can be described in terms of a conserved
`effective' surface stress. Various non-trivial geometrical consequences of
this identification are explored. In a cylindrical geometry, the cross-section
can be viewed as a closed planar Euler elastic curve. With respect to an
appropriate centre the effective stress itself vanishes; this provides a
remarkably simple relationship between the curvature and the position along the
loop. In two or higher dimensions, it is shown that the only geometry
consistent with the vanishing of the effective stress is spherical. It is
argued that the appropriate generalization of the loop result will involve
`null' stresses.
","[{""version"":""v1"",""created"":""Sun, 12 Feb 2006 20:51:40 GMT""}]","2009-11-11"
"cond-mat/0602290","Cynthia J. Olson Reichhardt","C.J. Olson Reichhardt and C. Reichhardt","Ratchet Cellular Automata for Colloids in Dynamic Traps","7 pages, 5 postscript figures","Europhys. Lett. 74, 792 (2006)","10.1209/epl/i2006-10043-7",,"cond-mat.soft",,"  We numerically investigate the transport of kinks in a ratchet cellular
automata geometry for colloids interacting with dynamical traps. We find that
thermal effects can enhance the transport efficiency in agreement with recent
experiments. At high temperatures we observe the creation and annihilation of
thermally induced kinks that degrade the signal transmission. We consider both
the deterministic and stochastic cases and show how the trap geometry can be
adjusted to switch between these two cases. The operation of the dynamical trap
geometry can be achieved with the adjustment of fewer parameters than ratchet
cellular automata constructed using static traps.
","[{""version"":""v1"",""created"":""Mon, 13 Feb 2006 02:33:18 GMT""}]","2009-11-11"
"cond-mat/0602291","Shinji Watanabe","Shinji Watanabe, Masatoshi Imada and Kazumasa Miyake","Superconductivity emerging near quantum critical point of valence
  transition","9 pages, 4 figures","J. Phys. Soc. Jpn. 75 (2006) 043710","10.1143/JPSJ.75.043710",,"cond-mat.str-el cond-mat.supr-con",,"  The nature of the quantum valence transition is studied in the
one-dimensional periodic Anderson model with Coulomb repulsion between f and
conduction electrons by the density-matrix renormalization group method. It is
found that the first-order valence transition emerges with the quantum critical
point and the crossover from the Kondo to the mixed-valence states is strongly
stabilized by quantum fluctuation and electron correlation. It is found that
the superconducting correlation is developed in the Kondo regime near the sharp
valence increase. The origin of the superconductivity is ascribed to the
development of the coherent motion of electrons with enhanced valence
fluctuation, which results in the enhancement of the charge velocity, but not
of the charge compressibility. Statements on the valence transition in
connection with Ce metal and Ce compounds are given.
","[{""version"":""v1"",""created"":""Mon, 13 Feb 2006 05:25:09 GMT""},{""version"":""v2"",""created"":""Tue, 11 Jul 2006 08:17:31 GMT""}]","2007-05-23"
"cond-mat/0602292","Ernest Epshtein","G. M. Shmelev, T. A. Gorshenina, E. M. Epshtein","Nonequilibrium phase transitions in a quasi-two-dimensional superlattice
  with parabolic miniband","9 pages, 6 figures",,,,"cond-mat.mes-hall cond-mat.mtrl-sci",,"  Distribution function and current density in a one-dimensional superlattice
with parabolic miniband are calculated. The current dependence on the
temperature coincides with experimental data. Generalization is carried out to
quasi-two-dimensional superlattice with paraboloidal miniband. For a sample
opened in Y direction with dc current in X direction, a novel nonequilibrium
phase transition is found, namely, appearing a spontaneous transverse electric
field under temperature rising.
","[{""version"":""v1"",""created"":""Mon, 13 Feb 2006 05:35:16 GMT""}]","2009-09-29"
"cond-mat/0602293","Tiezheng Qian","Tiezheng Qian, Xiao-Ping Wang, Ping Sheng","A variational approach to the moving contact line hydrodynamics","44 pages, 8 figures","J. Fluid Mech. 564, 333 - 360 (2006).","10.1017/S0022112006001935",,"cond-mat.soft cond-mat.stat-mech",,"  In immiscible two-phase flows, contact line denotes the intersection of the
fluid-fluid interface with the solid wall. When one fluid displaces the other,
the contact line moves along the wall. A classical problem in continuum
hydrodynamics is the incompatibility between the moving contact line and the
no-slip boundary condition, as the latter leads to a non-integrable
singularity. The recently discovered generalized Navier boundary condition
(GNBC) offers an alternative to the no-slip boundary condition which can
resolve the moving contact line conundrum. We present a variational derivation
of the GNBC through the principle of minimum energy dissipation (entropy
production), as formulated by Onsager for small perturbations away from the
equilibrium. Through numerical implementation of a continuum hydrodynamic
model, it is demonstrated that the GNBC can quantitatively reproduce the moving
contact line slip velocity profiles obtained from molecular dynamics
simulations. In particular, the transition from complete slip at the moving
contact line to near-zero slip far away is shown to be governed by a power-law
partial slip regime, extending to mesoscopic length scales. The sharp
(fluid-fluid) interface limit of the hydrodynamic model, together with some
general implications of slip versus no-slip, are discussed.
","[{""version"":""v1"",""created"":""Mon, 13 Feb 2006 07:17:50 GMT""}]","2009-11-11"
"cond-mat/0602294","Jiangping Hu","Fang Chen, Jiangping Hu, Steven Kivelson, Stuart Brown","A Magnetic Model of the Tetragonal-Orthorhombic Transition in the
  Cuprates","10 pages, 4 figures","Phys. Rev. B 74, 094508 (2006)","10.1103/PhysRevB.74.094508",,"cond-mat.str-el cond-mat.stat-mech",,"  It is shown that a quasi two dimensional (layered) Heisenberg antiferromagnet
with fully frustrated interplane couplings ({\it e.g.} on a body-centered
tetragonal lattice) generically exhibits two thermal phase transitions with
lowering temperature -- an upper transition at $T_{TO}$ (``order from disorder
without order'') in which the lattice point-group symmetry is spontaneously
broken, and a lower N\'{e}el transition at $T_{N}$ at which spin-rotation
symmetry is broken. Although this is the same sequence of transitions observed
in La$_2$CuO$_4$, in the Heisenberg model (without additional lattice degrees
of freedom) $(T_{TO}-T_N) /T_N$ is much smaller than is observed. The model may
apply to the bilayer cuprate La$_2$CaCuO$_6$, in which the transitions are
nearly coincident.
","[{""version"":""v1"",""created"":""Mon, 13 Feb 2006 07:19:13 GMT""},{""version"":""v2"",""created"":""Thu, 9 Mar 2006 05:32:03 GMT""}]","2009-11-11"
"cond-mat/0602295","Sang Hoon Lee","Sang Hoon Lee, Hawoong Jeong","Effects of substrate network topologies on competition dynamics","8 pages, 8 figures","Phys. Rev. E 74, 026118 (2006)","10.1103/PhysRevE.74.026118",,"cond-mat.dis-nn physics.soc-ph",,"  We study a competition dynamics, based on the minority game, endowed with
various substrate network structures. We observe the effects of the network
topologies by investigating the volatility of the system and the structure of
follower networks. The topology of substrate structures significantly
influences the system efficiency represented by the volatility and such
substrate networks are shown to amplify the herding effect and cause
inefficiency in most cases. The follower networks emerging from the leadership
structure show a power-law incoming degree distribution. This study shows the
emergence of scale-free structures of leadership in the minority game and the
effects of the interaction among players on the networked version of the game.
","[{""version"":""v1"",""created"":""Mon, 13 Feb 2006 08:07:07 GMT""},{""version"":""v2"",""created"":""Wed, 23 Aug 2006 23:46:19 GMT""}]","2007-05-23"
"cond-mat/0602296","Shin-ichi Fujimori","Shin-ichi Fujimori, Atsushi Fujimori, Kenya Shimada, Takamasa
  Narimura, Kenichi Kobayashi, Hirofumi Namatame, Masaki Taniguchi, Hisatomo
  Harima, Hiroaki Shishido, Shugo Ikeda, Dai Aoki, Yoshifumi Tokiwa, Yoshinori
  Haga, and Yoshichika~\=Onuki","Direct observation of quasi-particle band in CeIrIn$_5$: Angle-resolved
  photoemission spectroscopy study","5 pages, 3 figures","Phys. Rev. B 73, 224517 (2006)","10.1103/PhysRevB.73.224517",,"cond-mat.str-el",,"  We have performed a high-resolution angle resolved Ce 4$d-4f$ resonant
photoemission experiment on the heavy fermion superconductor CeIrIn$_5$. We
have observed a quasi-particle band which has an energy dispersion of $\sim 30$
meV in the Ce 4$f$ on-resonance spectra. The result suggests that although the
4$f$ spectra are dominated by the localized/correlated character, the small
itinerant component is responsible for the superconductivity in this compound.
","[{""version"":""v1"",""created"":""Mon, 13 Feb 2006 09:19:53 GMT""}]","2009-11-11"
"cond-mat/0602298","Lo\""ic Bervas","M. Viret, M. Gabureac, F. Ott, C. Fermon, C. Barreteau, R.
  Guirado-Lopez","Giant Anisotropic Magneto-Resistance in ferromagnetic atomic contacts","latex AAMR.tex, 6 files, 5 figures, 4 pages
  (http://www-drecam.cea.fr/spec/articles/S06/011)",,"10.1140/epjb/e2006-00201-3","SPEC-S06/011","cond-mat.mes-hall",,"  Magneto-resistance is a physical effect of great fundamental and industrial
interest since it is the basis for the magnetic field sensors used in computer
read-heads and Magnetic Random Access Memories. As device dimensions are
reduced, some important physical length scales for magnetism and electrical
transport will soon be attained. Ultimately, there is a strong need to know if
the physical phenomena responsible for magneto-resistance still hold at the
atomic scale. Here, we show that the anisotropy of magneto-resistance is
greatly enhanced in atomic size constrictions. We explain this physical effect
by a change in the electronic density of states in the junction when the
magnetization is rotated, as supported by our ab-initio calculations. This
stems from the ""spin-orbit coupling"" mechanism linking the shape of the
orbitals with the spin direction. This sensitively affects the conductance of
atomic contacts which is determined by the overlap of the valence orbitals.
","[{""version"":""v1"",""created"":""Mon, 13 Feb 2006 10:36:00 GMT""}]","2009-11-11"
"cond-mat/0602299","Vyacheslav Yukalov","V.I. Yukalov and E.P. Yukalova","Entanglement production with multimode Bose-Einstein condensates in
  optical lattices","Latex file, 16 pages, 7 figures","Laser Phys. 16 (2006) 354-359","10.1134/S1054660X06020265",,"cond-mat.mes-hall cond-mat.stat-mech quant-ph",,"  Deep optical lattices are considered, in each site of which there are many
Bose-condensed atoms. By the resonant modulation of trapping potentials it is
possible to transfer a macroscopic portion of atoms to the collective nonlinear
states corresponding to topological coherent modes. Entanglement can be
generated between these modes. By varying the resonant modulating field it is
possible to effectively regulate entanglement production in this multimode
multitrap system of Bose condensates.
","[{""version"":""v1"",""created"":""Mon, 13 Feb 2006 10:10:34 GMT""}]","2009-11-11"
"cond-mat/0602300","Rudolf A. Roemer","Alexander Croy, Rudolf A. Roemer and Michael Schreiber","Localization of electronic states in amorphous materials: recursive
  Green's function method and the metal-insulator transition at E<>0","24 LaTeX pages in Springer Lecture Notes format (sv* files enclosed),
  13 figures, paper will appear as a chapter in ""Lecture Notes in Computational
  Science and Engineering"" (Springer, Berlin)","Localization of Electronic States in Amorphous Materials:
  Recursive Green's Function Method and the Metal-Insulator Transition at E <>
  0. In Parallel Algorithms and Cluster Computing (Vol. 52, pp. 203-226).
  Springer Berlin Heidelberg (2006)","10.1007/3-540-33541-2_11","CSC-119","cond-mat.dis-nn cond-mat.mes-hall",,"  In this paper we will investigate whether the scaling assumptions made in
previous studies for the transition at energies outside the band centre can be
reconfirmed in numerical calculations, and in particular whether the
conductivity sigma follows a power law close to the critical energy E_c. For
this purpose we will use the recursive Green's function method to calculate the
four-terminal conductance of a disordered system for fixed disorder strength at
temperature T=0. Applying the finite-size scaling analysis we will compute the
critical exponent and determine the mobility edge, i.e. the MIT outside the
band centre.
","[{""version"":""v1"",""created"":""Mon, 13 Feb 2006 10:43:54 GMT""}]","2020-05-04"
"cond-mat/0602301","Istvan Kezsmarki","I. Kezsmarki, G. Mihaly, R. Gaal, N. Barisic, A. Akrap, H. Berger, L.
  Forro, C.C. Homes, L. Mihaly","Separation of orbital contributions to the optical conductivity of
  BaVS$_3$","5 pages, 4 figures. submitted to PRL","Physical Review Letters 96, 186402 (2006)","10.1103/PhysRevLett.96.186402",,"cond-mat.str-el cond-mat.mtrl-sci",,"  The correlation-driven metal-insulator transition (MIT) of BaVS$_3$ was
studied by polarized infrared spectroscopy. In the metallic state two types of
electrons coexist at the Fermi energy: The quasi 1D metallic transport of
$A_{1g}$ electrons is superimposed on the isotropic hopping conduction of
localized $E_g$ electrons. The ""bad-metal"" character and the weak anisotropy
are the consequences of the large effective mass $m_{eff}\approx7m_e$ and
scattering rate $\Gamma\geq160$ meV of the quasi-particles in the $A_{1g}$
band. There is a pseudo-gap above $T_{MI}=69$ K, and in the insulating phase
the gap follows the BCS-like temperature dependence of the structural order
parameter with $\Delta_{ch}\approx42$ meV in the ground state. The MIT is
described in terms of a weakly coupled two-band model.
","[{""version"":""v1"",""created"":""Mon, 13 Feb 2006 11:40:38 GMT""}]","2014-01-15"
"cond-mat/0602302","Gurami Gogadze","G.A. Gogadze","The theory of the reentrant effect in susceptibility of cylindrical
  mesoscopic samples",,,"10.1063/1.2215369",,"cond-mat.supr-con",,"  A theory has been developed to explain the anomalous behavior of the magnetic
susceptibility of a normal metal-superconductor ($NS$) structure in weak
magnetic fields at millikelvin temperatures. The effect was discovered
experimentally by A.C. Mota et al \cite{10}. In cylindrical superconducting
samples covered with a thin normal pure metal layer, the susceptibility
exhibited a reentrant effect: it started to increase unexpectedly when the
temperature lowered below 100 mK. The effect was observed in mesoscopic $NS$
structures when the $N$ and $S$ metals were in good electric contact. The
theory proposed is essentially based on the properties of the Andreev levels in
the normal metal. When the magnetic field (or temperature) changes, each of the
Andreev levels coincides from time to time with the chemical potential of the
metal. As a result, the state of the $NS$ structure experiences strong
degeneracy, and the quasiparticle density of states exhibits resonance spikes.
This generates a large paramagnetic contribution to the susceptibility, which
adds up to the diamagnetic contribution thus leading to the reentrant effect.
The explanation proposed was obtained within the model of free electrons. The
theory provides a good description for experimental results [10].
","[{""version"":""v1"",""created"":""Mon, 13 Feb 2006 11:42:53 GMT""}]","2015-06-25"
"cond-mat/0602303","Akio Tsukada","A. Tsukada, H. Yamamoto, M. Naito","Doping of Ce in T-La2CuO4: Rigorous test for electron-hole symmetry for
  high-Tc superconductivity","21 pages, 11 figures, submitted to Phys. Rev. B",,"10.1103/PhysRevB.74.174515",,"cond-mat.supr-con",,"  We report that Ce doping was achieved in La2CuO4 with the K2NiF4 (T)
structure for the first time by molecular beam epitaxy. A synthesis temperature
of as low as ~ 630C and an appropriate substrate choice, i.e., (001)LaSrGaO4 (a
\~ 3.843 A), enebled us to incorporate Ce into K2NiF4 lattice and to obtain
Ce-doped T-La2-xCexCuO4 up to x ~ 0.06. The doping of Ce makes T-La2CuO4 more
insulating, which is in sharp contrast to Sr (or Ba) doping in T-La2CuO4, which
make the compound metallic and superconducting. The observed smooth increase in
resistivity from the hole-doped side (T-La2-xSrxCuO4) to the electron-doped
side (T-La2-xCexCuO4) indicates that the electron-hole symmetry is broken in
the T-phase materials.
","[{""version"":""v1"",""created"":""Mon, 13 Feb 2006 12:06:28 GMT""}]","2009-11-11"
"cond-mat/0602304","Christophe Berthod","C. Berthod, T. Giamarchi, S. Biermann, and A. Georges","Breakup of the Fermi surface near the Mott transition in low-dimensional
  systems","REVTeX 4, 5 pages, 4 EPS figures. References added; problem with
  figure 4 fixed; typos corrected","Phys. Rev. Lett. 97, 136401 (2006)","10.1103/PhysRevLett.97.136401",,"cond-mat.str-el",,"  We investigate the Mott transition in weakly-coupled one-dimensional (1d)
fermionic chains. Using a generalization of Dynamic Mean Field Theory, we show
that the Mott gap is suppressed at some critical hopping $t_{\perp}^{c2}$. The
transition from the 1d insulator to a 2d metal proceeds through an intermediate
phase where the Fermi surface is broken into electron and hole pockets. The
quasiparticle spectral weight is strongly anisotropic along the Fermi surface,
both in the intermediate and metallic phases. We argue that such pockets would
look like `arcs' in photoemission experiments.
","[{""version"":""v1"",""created"":""Mon, 13 Feb 2006 12:35:42 GMT""},{""version"":""v2"",""created"":""Mon, 20 Feb 2006 10:24:38 GMT""}]","2007-05-23"
"cond-mat/0602306","Pablo D. Esquinazi","A. Talyzin, A. Dzwilewski, L. Dubrovinsky, A. Setzer and P. Esquinazi","Magnetic properties of polymerized C$_{60}$ with Fe","5 Figures, 4 pages",,"10.1140/epjb/e2007-00041-7",,"cond-mat.mtrl-sci cond-mat.str-el",,"  We provide evidence that high-pressure high-temperature (2.5 GPa and 1040 K)
treatment of mixtures of iron with fullerene powders leads to the complete
transformation of iron into iron carbide Fe$_3$C. The comparison of the
magnetic properties (Curie temperature and magnetic moment) of the here studied
samples and those for the ferromagnetic polymer Rh-C$_{60}$ indicates that the
main ferromagnetic signal reported in those samples is due to Fe$_3$C and not
related to the ferromagnetism of carbon as originally interpreted. Taking into
account the results obtained in this study the original paper on ``Magnetic
carbon"" (Nature {\bf 413}, 716 (2001)) was recently retracted.
","[{""version"":""v1"",""created"":""Mon, 13 Feb 2006 15:29:38 GMT""},{""version"":""v2"",""created"":""Mon, 3 Apr 2006 11:30:31 GMT""},{""version"":""v3"",""created"":""Wed, 29 Nov 2006 10:47:31 GMT""}]","2015-06-25"
"cond-mat/0602307","Bouchaud Jean-Philippe","Alexei Andreanov, Giulio Biroli, Jean-Philippe Bouchaud, Alexandre
  Lefevre (SPhT & SPEC, Saclay)","Field theories and exact stochastic equations for interacting particle
  systems","4 pages, no figures",,"10.1103/PhysRevE.74.030101",,"cond-mat.stat-mech",,"  We present a new approach to the dynamics of interacting particles with
reaction and diffusion. Starting from the underlying discrete stochastic jump
process we derive a general field theory describing the dynamics of the density
field, which we relate to an exact stochastic equation on the density field. We
show how our field theory maps onto the original Doi-Peliti formalism, allowing
us to clarify further the issue of the 'imaginary' Langevin noise that appears
in the context of reaction/diffusion processes. Our procedure applies to a wide
class of problems and is related to large deviation functional techniques
developed recently to describe fluctuations of non-equilibrium systems in the
hydrodynamic limit.
","[{""version"":""v1"",""created"":""Mon, 13 Feb 2006 13:08:06 GMT""}]","2009-11-11"
