"math-ph/0604028","Hartmut Wachter","Hartmut Wachter","Analysis on q-deformed quantum spaces","Latex, 94 pages, 4 figures",,"10.1142/S0217751X07034155",,"math-ph math.MP",,"  A q-deformed version of classical analysis is given to quantum spaces of
physical importance, i.e. Manin plane, q-deformed Euclidean space in three or
four dimensions, and q-deformed Minkowski space. The subject is presented in a
rather complete and selfcontained way. All relevant notions are introduced and
explained in detail. The different possibilities to realize the objects of
q-deformed analysis are discussed and their elementary properties are studied.
In this manner attention is focused on star products, q-deformed tensor
products, q-deformed translations, q-deformed partial derivatives, dual
pairings, q-deformed exponentials, and q-deformed integration. The main concern
of this work is to show that these objects fit together in a consistent
framework, which is suitable to formulate physical theories on quantum spaces.
","[{""version"":""v1"",""created"":""Thu, 13 Apr 2006 09:54:07 GMT""}]","2009-11-11"
"math-ph/0604029","Jan Felipe van Diejen","J.F. van Diejen","Diagonalization of an Integrable Discretization of the Repulsive Delta
  Bose Gas on the Circle","25 pages, LaTeX","Commun. Math. Phys. 267 (2006), 451-476.","10.1007/s00220-006-0076-3",,"math-ph math.MP math.SP",,"  We introduce an integrable lattice discretization of the quantum system of n
bosonic particles on a ring interacting pairwise via repulsive delta
potentials. The corresponding (finite-dimensional) spectral problem of the
integrable lattice model is solved by means of the Bethe Ansatz method. The
resulting eigenfunctions turn out to be given by specializations of the
Hall-Littlewood polynomials. In the continuum limit the solution of the
repulsive delta Bose gas due to Lieb and Liniger is recovered, including the
orthogonality of the Bethe wave functions first proved by Dorlas (extending
previous work of C.N. Yang and C.P. Yang).
","[{""version"":""v1"",""created"":""Thu, 13 Apr 2006 14:55:31 GMT""}]","2007-05-23"
"math/0604285","Jawad Y. Abuhlail","Jawad A. Abuhlail","Fully Coprime Comodules and Fully Coprime Corings","31 Pages","Applied Categorical Structures (Special Issue 2006)",,,"math.RA math.CT",,"  Prime objects were defined as generalization of simple objects in the
categories of rings (modules). In this paper we introduce and investigate what
turns out to be a suitable generalization of simple corings (simple comodules),
namely fully coprime corings (fully coprime comodules). Moreover, we consider
several primeness notions in the category of comodules of a given coring and
investigate their relations with the fully coprimeness and the simplicity of
these comodules. These notions are applied then to study primeness and
coprimeness properties of a given coring, considered as an object in its
category of right (left) comodules.
","[{""version"":""v1"",""created"":""Wed, 12 Apr 2006 16:04:17 GMT""},{""version"":""v2"",""created"":""Sat, 7 Oct 2006 23:21:20 GMT""}]","2007-05-23"
"math/0604286","Slawomir Rybicki","J. Fura, A. Ratajczak & S. Rybicki","Existence and continuation of periodic solutions of Newtonian systems","31 pages","Journal of Differential Equations 218(1) (2005), 216-252",,,"math.CA",,"  In this article we study the existence and the continuation of periodic
solutions of autonomous Newtonian systems. To prove the results we apply the
infinite-dimensional version of the degree for SO(2)-equivariant gradient
operators. Using the results due to Rabier we show that the Leray-Schauder
degree is not applicable in the proofs of our theorems, because it vanishes.
","[{""version"":""v1"",""created"":""Wed, 12 Apr 2006 16:07:01 GMT""}]","2007-05-23"
"math/0604287","Luis Narv\'aez-Macarro","F.J. Calderon-Moreno, L. Narvaez-Macarro","Algebraic computation of some intersection D-modules","18 pages",,,,"math.AG",,"  Let $X$ be a complex analytic manifold, $D\subset X$ a locally
quasi-homogeneous free divisor, $E$ an integrable logarithmic connection with
respect to $D$ and $L$ the local system of the horizontal sections of $E$ on
$X-D$. In this paper we give an algebraic description in terms of $E$ of the
regular holonomic D-module whose de Rham complex is the intersection complex
associated with $L$. As an application, we perform some effective computations
in the case of quasi-homogeneous plane curves.
","[{""version"":""v1"",""created"":""Wed, 12 Apr 2006 16:30:38 GMT""}]","2007-05-23"
"math/0604288","Slawomir Rybicki","W. Radzki & S. Rybicki","Degenerate bifurcation points of periodic solutions of autonomous
  Hamiltonian systems","18 pages","Journal of Differential Equations 202(2) (2004), 284-305",,,"math.CA",,"  We study connected branches of non-constant {$2\pi$-pe}riodic solutions of
the Hamilton equation \begin{displaymath} \dot{x}(t)=\lambda J\nabla H(x(t)),
\end{displaymath} where $\lambda\in\halfline,$ $H\in C^2(\R^n\times\R^n,\R)$
and $ \displaystyle \nabla^2H(x_0)= [ \begin{array}{cc} A&0 0&B \end{array} ] $
for $x_0\in\nabla H^{-1}(0).$ The Hessian $\nabla^2H(x_0)$ can be singular. We
formulate sufficient conditions for the existence of such branches bifurcating
from given $(x_0,\lambda_0).$ As a consequence we prove theorems concerning the
existence of connected branches of arbitrary periodic nonstationary
trajectories of the Hamiltonian system $\dot{x}(t)=J\nabla H(x(t))$ emanating
from $x_0.$ We describe also minimal periods of trajectories near $x_0.$
","[{""version"":""v1"",""created"":""Wed, 12 Apr 2006 16:39:53 GMT""}]","2007-05-23"
"math/0604289","Andre Henriques","Andre Henriques","A Periodicity Theorem for the Octahedron Recurrence","22 pages, (a few pictures added, section 3 has been reorganized)",,,,"math.CO",,"  We investigate a variant of the octahedron recurrence which lives in a
3-dimensional lattice contained in [0,n] x [0,m] x R. Generalizing results of
David Speyer math.CO/0402452, we give an explicit non-recursive formula for the
values of this recurrence in terms of perfect matchings. We then use it to
prove that the octahedron recurrence is periodic of period n+m. This result is
reminiscent of Fomin and Zelevinsky's theorem about the periodicity of
Y-systems.
","[{""version"":""v1"",""created"":""Wed, 12 Apr 2006 17:48:17 GMT""},{""version"":""v2"",""created"":""Thu, 26 Oct 2006 13:47:17 GMT""}]","2007-05-23"
"math/0604290","Eric Katz","Eric Katz","Tropical Invariants from the Secondary Fan","The paper has been withdrawn by the author due to an error in the
  proof of Prop 8.17 which can best be called an abuse of homological algebra.
  Much thanks to Jihyeon Jessie Yang for spotting the error. Section 9 (the
  geometric interpretation) and section 10 (counterexample regarding the
  tropical Severi variety) are to the best of the author's knowledge, still
  correct","Adv. Geom. 9 (2009), no. 2, 153--180",,,"math.AG math.CO",,"  In this paper, we consider weighted counts of tropical plane curves of
particular combinatorial type through a certain number of generic points. We
give a criterion, derived from tropical intersection theory on the secondary
fan, for a weighted count to give a number invariant of the position of the
points. By computing a certain intersection multiplicity, we show how
Mikhalkin's approach to computing Gromov-Witten invariants fits into our
approach. This begins to address a question raised by Dickenstein, Feichtner,
and Sturmfels. We also give a geometric interpretation of the numbers we
produce involving Chow quotients, and provide a counterexample showing that the
tropical Severi variety is not always supported on the secondary fan.
  This paper is a revision of the preprint, ""The Tropical Degree of Cones in
the Secondary Fan.""
","[{""version"":""v1"",""created"":""Wed, 12 Apr 2006 17:42:25 GMT""},{""version"":""v2"",""created"":""Fri, 19 Oct 2007 21:48:36 GMT""},{""version"":""v3"",""created"":""Fri, 15 Jun 2012 19:41:19 GMT""}]","2012-06-18"
"math/0604291","Gerassimos Barbatis","G. Barbatis","Best constants for higher-order Rellich inequalities in $L^p(\Omega)$","Slightly revised. To appear in Math. Z. 19 pages",,,,"math.AP math.SP",,"  We obtain a series improvement to higher-order $L^p$-Rellich inequalities on
a Riemannian manifold $M$. The improvement is shown to be sharp as each new
term of the series is added.
","[{""version"":""v1"",""created"":""Wed, 12 Apr 2006 17:57:58 GMT""},{""version"":""v2"",""created"":""Mon, 14 Aug 2006 17:56:32 GMT""}]","2007-05-23"
"math/0604292","Bruce E. Sagan","Bruce E. Sagan (Michigan State University)","Pattern Avoidance in Set Partitions","15 pages, see related papers at http://www.math.msu.edu/~sagan",,,,"math.CO",,"  The study of patterns in permutations in a very active area of current
research. Klazar defined and studied an analogous notion of pattern for set
partitions. We continue this work, finding exact formulas for the number of set
partitions which avoid certain specific patterns. In particular, we enumerate
and characterize those partitions avoiding any partition of a 3-element set.
This allows us to conclude that the corresponding sequences are P-recursive.
Finally, we define a second notion of pattern in a set partition, based on its
restricted growth function. Related results are obtained for this new
definition.
","[{""version"":""v1"",""created"":""Wed, 12 Apr 2006 17:58:32 GMT""}]","2007-05-23"
"math/0604293","Peter M\""orters","Klaus Fleischmann, Peter Morters and Vitali Wachtel","Moderate deviations for random walk in random scenery","30 pages + title page",,,,"math.PR",,"  We investigate random walks in independent, identically distributed random
sceneries under the assumption that the scenery variables satisfy Cramer's
condition. We prove moderate deviation principles in dimensions two and larger,
covering all those regimes where rate and speed do not depend on the actual
distribution of the scenery. In the case of dimension four and larger we even
obtain precise asymptotics for the annealed probability of a moderate
deviation, extending a classical central limit theorem of Kesten and Spitzer.
In dimension three and larger, an important ingredient in the proofs are new
concentration inequalities for self-intersection local times of random walks,
which are of independent interest, whilst in dimension two we use a recent
moderate deviation result for self-intersection local times, which is due to
Bass, Chen and Rosen.
","[{""version"":""v1"",""created"":""Wed, 12 Apr 2006 18:18:20 GMT""},{""version"":""v2"",""created"":""Wed, 11 Oct 2006 09:19:49 GMT""}]","2007-05-23"
"math/0604294","Thomas Strohmer","Karlheinz Grochenig and Thomas Strohmer","Pseudodifferential Operators on Locally Compact Abelian Groups and
  Sjoestrand's Symbol Class",,,,,"math.FA math.AP",,"  We investigate pseudodifferential operators on arbitrary locally compact
abelian groups. As symbol classes for the Kohn-Nirenberg calculus we introduce
a version of Sjoestrand's class. Pseudodifferential operators with such symbols
form a Banach algebra that is closed under inversion. Since ""hard analysis""
techniques are not available on locally compact abelian groups, a new
time-frequency approach is used with the emphasis on modulation spaces, Gabor
frames, and Banach algebras of matrices. Sjoestrand's original results are thus
understood as a phenomenon of abstract harmonic analysis rather than ""hard
analysis"" and are proved in their natural context and generality.
","[{""version"":""v1"",""created"":""Wed, 12 Apr 2006 18:20:27 GMT""}]","2007-05-23"
"math/0604295","Ramon Van Handel","Pavel Chigansky, Ramon van Handel","Model robustness of finite state nonlinear filtering over the infinite
  time horizon","Published at http://dx.doi.org/10.1214/105051606000000871 in the
  Annals of Applied Probability (http://www.imstat.org/aap/) by the Institute
  of Mathematical Statistics (http://www.imstat.org)","Annals of Applied Probability 2007, Vol. 17, No. 2, 688-715","10.1214/105051606000000871","IMS-AAP-AAP415","math.PR",,"  We investigate the robustness of nonlinear filtering for continuous time
finite state Markov chains, observed in white noise, with respect to
misspecification of the model parameters. It is shown that the distance between
the optimal filter and that with incorrect model parameters converges to zero
uniformly over the infinite time interval as the misspecified model converges
to the true model, provided the signal obeys a mixing condition. The filtering
error is controlled through the exponential decay of the derivative of the
nonlinear filter with respect to its initial condition. We allow simultaneously
for misspecification of the initial condition, of the transition rates of the
signal, and of the observation function. The first two cases are treated by
relatively elementary means, while the latter case requires the use of
Skorokhod integrals and tools of anticipative stochastic calculus.
","[{""version"":""v1"",""created"":""Wed, 12 Apr 2006 18:37:21 GMT""},{""version"":""v2"",""created"":""Thu, 1 Jun 2006 17:20:35 GMT""},{""version"":""v3"",""created"":""Wed, 4 Apr 2007 06:13:42 GMT""}]","2007-05-23"
"math/0604296","Jonathan Block","Jonathan Block","Duality and equivalence of module categories in noncommutative geometry
  II: Mukai duality for holomorphic noncommutative tori",,,,,"math.QA math.DG",,"  This is the second in a series of papers intended to set up a framework to
study categories of modules in the context of non-commutative geometries. In
\cite{mem} we introduced the basic DG category $\Pc_{\A^\bullet}$, the perfect
category of $\A^\bullet$, which corresponded to the category of coherent
sheaves on a complex manifold. In this paper we enlarge this category to
include objects which correspond to quasi-coherent sheaves. We then apply this
framework to proving an equivalence of categories between derived categories on
the noncommutative complex torus and on a holomorphic gerbe on the dual complex
torus.
","[{""version"":""v1"",""created"":""Wed, 12 Apr 2006 19:34:39 GMT""}]","2007-05-23"
"math/0604297","Ravi Vakil","Ian P. Goulden, David M. Jackson, and Ravi Vakil","A short proof of the lambda_g-conjecture without Gromov-Witten theory:
  Hurwitz theory and the moduli of curves",,,,,"math.AG math.CO",,"  We give a short and direct proof of the $\lambda_g$-Conjecture. The approach
is through the Ekedahl-Lando-Shapiro-Vainshtein theorem, which establishes the
``polynomiality'' of Hurwitz numbers, from which we pick off the lowest degree
terms. The proof is independent of Gromov-Witten theory.
  We briefly describe the philosophy behind our general approach to
intersection numbers and how it may be extended to other intersection number
conjectures.
","[{""version"":""v1"",""created"":""Wed, 12 Apr 2006 20:07:43 GMT""}]","2007-05-23"
"math/0604298","Phillip E. Parker","Phillip E. Parker","Pseudoriemannian Nilpotent Lie Groups","19 pages + title page",,,,"math.DG",,"  This is a survey article with a limited list of references (as required by
the publisher) which appears in the Encyclopedia of Mathematical Physics, eds.
J.-P. Francoise, G.L. Naber and Tsou S.T. Oxford: Elsevier, 2006. vol.4,
pp.94--104.
","[{""version"":""v1"",""created"":""Wed, 12 Apr 2006 21:02:20 GMT""}]","2007-05-23"
"math/0604299","Apostolos Giannopoulos","Apostolos Giannopoulos, Alain Pajor, Grigoris Paouris","A note on subgaussian estimates for linear functionals on convex bodies","10 pages",,,,"math.FA math.MG",,"  We give an alternative proof of a recent result of Klartag on the existence
of almost subgaussian linear functionals on convex bodies. If $K$ is a convex
body in ${\mathbb R}^n$ with volume one and center of mass at the origin, there
exists $x\neq 0$ such that $$|\{y\in K: |< y,x> |\gr t\|<\cdot,
x>\|_1\}|\ls\exp (-ct^2/\log^2(t+1))$$ for all $t\gr 1$, where $c>0$ is an
absolute constant. The proof is based on the study of the $L_q$--centroid
bodies of $K$. Analogous results hold true for general log-concave measures.
","[{""version"":""v1"",""created"":""Wed, 12 Apr 2006 21:08:44 GMT""}]","2007-05-23"
"math/0604300","Rieuwert Blok","Rieuwert J. Blok and Corneliu Hoffman","A Quasi Curtis-Tits-Phan theorem for the symplectic group","34 pages",,,,"math.GR math.CO",,"  We obtain the symplectic group as an amalgam of low rank subgroups akin to
Levi components. We do this by having the group act flag-transitively on a new
type of geometry and applying Tits' lemma. This provides a new way of
recognizing the symplectic groups from a small collection of small subgroups.
The geometry consists of all subspaces of maximal rank in a vector space of
maximal rank with respect to a symplectic form. The main result holds for
fields of size at least 3. We analyze the geometry over the field of size 2 and
describe its simply connected cover if different from the geometry.
","[{""version"":""v1"",""created"":""Wed, 12 Apr 2006 21:10:43 GMT""}]","2007-05-23"
"math/0604301","Adam Van Tuyl","Huy Tai Ha and Adam Van Tuyl","Resolutions of square-free monomial ideals via facet ideals: a survey","26 pages; revised final version to appear in Contemporary Math;
  updated references",,,,"math.AC math.CO",,"  We survey some recent results on the minimal graded free resolution of a
square-free monomial ideal. The theme uniting these results is the
point-of-view that the generators of a monomial ideal correspond to the maximal
faces (the facets) of a simplicial complex \Delta.
","[{""version"":""v1"",""created"":""Wed, 12 Apr 2006 22:02:38 GMT""},{""version"":""v2"",""created"":""Mon, 28 May 2007 18:26:00 GMT""}]","2007-06-13"
"math/0604303","Misha Verbitsky","Misha Verbitsky","Quaternionic Dolbeault complex and vanishing theorems on hyperkahler
  manifolds","30 pages, version 2 - misprints corrected, some arguments improved","Compos. Math. 143 (2007), no. 6, 1576--1592",,,"math.AG math.DG",,"  Let (M,I,J,K) be a hyperkahler manifold of real dimension 4n, and L a
non-trivial holomorphic line bundle on (M,I). Using the quaternionic Dolbeault
complex, we prove the following vanishing theorem for holomorphic cohomology of
L. If the Chern class c_1(L) lies in the closure $\hat K$ of the dual Kahler
cone, then $H^i(L)=0$ for i>n. If c_1(L) lies in the opposite cone $-\hat K$,
then $H^i(L)=0$ for i<n. Finally, if $c_1(L)$ is neither in $\hat K$ nor in
$-\hat K$, then $H^i(L)=0$ for $i\neq n$.
","[{""version"":""v1"",""created"":""Thu, 13 Apr 2006 02:24:33 GMT""},{""version"":""v2"",""created"":""Sat, 16 Sep 2006 22:20:28 GMT""}]","2008-03-14"
"math/0604304","Mihai Staic","Mihai D. Staic","From 3-algebras to $\Delta$-Groups","18 pages",,,,"math.GT math.AT",,"  We introduce $\Delta$-groups and show how they fit in the context of lattice
field theory. To a manifold $M$ we associate a $\Delta$-group $\Gamma(M)$. We
define the symmetric cohomology $HS^n(G,A)$ of a group $G$ with coefficients in
a $G$-module $A$. The $\Delta$-group $\Gamma(M)$ is determined by the action of
$\pi_1(M)$ on $\pi_2(M)$ and an element of $HS^3(\pi_1(M),\pi_2(M))$.
","[{""version"":""v1"",""created"":""Thu, 13 Apr 2006 02:56:49 GMT""}]","2007-05-23"
"math/0604305","Marc Atlan","Marc Atlan (PMA), Boris Leblanc","Time-Changed Bessel Processes and Credit Risk",,,,,"math.PR",,"  The Constant Elasticity of Variance (CEV) model is mathematically presented
and then used in a Credit-Equity hybrid framework. Next, we propose extensions
to the CEV model with default: firstly by adding a stochastic volatility
diffusion uncorrelated from the stock price process, then by more generally
time changing Bessel processes and finally by correlating stochastic volatility
moves to the stock ones. Properties about strict local and true martingales in
this study are discussed. Analytical formulas are provided and Fourier and
Laplace transform techniques can then be used to compute option prices and
probabilities of default.
","[{""version"":""v1"",""created"":""Thu, 13 Apr 2006 05:15:16 GMT""}]","2007-05-23"
"math/0604306","Nobuhiro Honda","Nobuhiro Honda","On a construction of the twistor spaces of Joyce metrics, II","11 pages, 4 figures in color",,,,"math.DG math.AG",,"  We explicitly construct the twistor spaces of Joyce metrics with torus action
that are not treated in Part I (math.DG/0603242). This finishes a construction
of all the twistor spaces of Joyce metrics on the connected sum of four complex
projective planes.
","[{""version"":""v1"",""created"":""Thu, 13 Apr 2006 06:53:11 GMT""}]","2007-05-23"
"math/0604307","Metod Saniga","Metod Saniga (ASTRINSTSAV), Michel Planat (FEMTO-ST)","On the Fine Structure of the Projective Line Over GF(2) x GF(2) x GF(2)","8 pages, 2 figures","Chaos, Solitons and Fractals 37 (2008) 337-345","10.1016/j.chaos.2006.09.056",,"math.AG quant-ph",,"  The paper gives a succinct appraisal of the properties of the projective line
defined over the direct product ring $R\_{\triangle} \equiv$
GF(2)$\otimesGF(2)\otimes$GF(2). The ring is remarkable in that except for
unity, all the remaining seven elements are zero-divisors, the non-trivial ones
forming two distinct sets of three; elementary ('slim') and composite ('fat').
Due to this fact, the line in question is endowed with a very intricate
structure. It contains twenty-seven points, every point has eighteen neighbour
points, the neighbourhoods of two distant points share twelve points and those
of three pairwise distant points have six points in common -- namely those with
coordinates having both the entries `fat' zero-divisors. Algebraically, the
points of the line can be partitioned into three groups: a) the group
comprising three distinguished points of the ordinary projective line of order
two (the 'nucleus'), b) the group composed of twelve points whose coordinates
feature both the unit(y) and a zero-divisor (the 'inner shell') and c) the
group of twelve points whose coordinates have both the entries zero-divisors
(the 'outer shell'). The points of the last two groups can further be split
into two subgroups of six points each; while in the former case there is a
perfect symmetry between the two subsets, in the latter case the subgroups have
a different footing, reflecting the existence of the two kinds of a
zero-divisor. The structure of the two shells, the way how they are
interconnected and their link with the nucleus are all fully revealed and
illustrated in terms of the neighbour/distant relation. Possible applications
of this finite ring geometry are also mentioned.
","[{""version"":""v1"",""created"":""Thu, 13 Apr 2006 08:18:05 GMT""},{""version"":""v2"",""created"":""Tue, 6 Jun 2006 08:05:45 GMT""}]","2008-03-04"
"math/0604308","Claudia Pinzari","Claudia Pinzari","Embedding ergodic actions of compact quantum groups on C*-algebras into
  quotient spaces","31 pages, Latex; The assumptions of Prop. 2.5 of the published
  version are strengthened, leading to the equivalence between closed coideals
  and Wang's notion of Woronowicz C*-ideal for nuclear C*algebras and leaving
  the equivalence problem open in the general case",,,,"math.OA math.FA","http://arxiv.org/licenses/nonexclusive-distrib/1.0/","  The notion of compact quantum subgroup is revisited and an alternative
definition is given. Induced representations are considered and a Frobenius
reciprocity theorem is obtained. A relationship between ergodic actions of
compact quantum groups on C*-algebras and topological transitivity is
investigated. A sufficient condition for embedding such actions in quantum
quotient spaces is obtained.
","[{""version"":""v1"",""created"":""Thu, 13 Apr 2006 09:22:50 GMT""},{""version"":""v2"",""created"":""Sat, 21 Sep 2013 14:31:08 GMT""}]","2013-09-24"
"math/0604309","Tobias H. Jaeger","Paul Glendinning, Tobias Jaeger and Gerhard Keller","How chaotic are strange nonchaotic attractors","19 pages, 2 figures",,"10.1088/0951-7715/19/9/001",,"math.DS",,"  We show that the classic example of quasiperiodically forced maps with
strange nonchaotic attractors described by Grebogi et al and Herman in the
mid-1980s have some chaotic properties. More precisely, we show that these
systems exhibit sensitive dependence on initial conditions, both on the whole
phase space and restricted to the attractor. The results also remain valid in
more general classes of quasiperiodically forced systems. Further, we include
an elementary proof of a classic result by Glasner and Weiss on sensitive
dependence, and we clarify the structure of the attractor in an example with
two-dimensional fibers also introduced by Grebogi et al.
","[{""version"":""v1"",""created"":""Thu, 13 Apr 2006 10:04:05 GMT""}]","2009-11-11"
"math/0604310","Lorenzo Brandolese","Lorenzo Brandolese (ICJ), Fran\c{c}ois Vigneron (CMLS)","On the localization of the magnetic and the velocity fields in the
  equations of magnetohydrodynamics","Proceedings of the Royal Society of Edinburgh. Section A. Mathematics
  (to appear) (0000) --xx--","Proceedings of the Royal Society of Edinburgh. Section A.
  Mathematics 2007, 137 (2006) 475--495",,,"math.AP",,"  We study the behavior at infinity, with respect to the space variable, of
solutions to the magnetohydrodynamics equations in ${\bf R}^d$. We prove that
if the initial magnetic field decays sufficiently fast, then the plasma flow
behaves as a solution of the free nonstationnary Navier--Stokes equations when
$|x|\to +\infty$, and that the magnetic field will govern the decay of the
plasma, if it is poorly localized at the beginning of the evolution. Our main
tools are boundedness criteria for convolution operators in weighted spaces.
","[{""version"":""v1"",""created"":""Thu, 13 Apr 2006 11:21:23 GMT""}]","2009-07-17"
