"astro-ph/0604250","Daniel Stark P.","D.P. Stark (Caltech), A.J. Bunker (Exeter), R.S. Ellis (Caltech), L.P.
  Eyles (Exeter) & M. Lacy (SSC)","A New Measurement of the Stellar Mass Density at z~5: Implications for
  the Sources of Cosmic Reionization","Accepted for Publication in ApJ, 39 pages","Astrophys.J.659:84-97,2007","10.1086/511325",,"astro-ph",,"  We present a new measurement of the integrated stellar mass per comoving
volume at redshift 5 determined via spectral energy fitting drawn from a sample
of 214 photometrically-selected galaxies with z'<26.5 in the southern GOODS
field. Following procedures introduced by Eyles et al. (2005), we estimate
stellar masses for various sub-samples for which reliable and unconfused
Spitzer IRAC detections are available. A spectroscopic sample of 14 of the most
luminous sources with <z>=4.92 provides a firm lower limit to the stellar mass
density of 1e6 Msun/Mpc^3. Several galaxies in this sub-sample have masses of
order 10^11 Msun implying significant earlier activity occurred in massive
systems. We then consider a larger sample whose photometric redshifts in the
publicly-available GOODS-MUSIC catalog lie in the range 4.4 <z 5.6. Before
adopting the GOODS-MUSIC photometric redshifts, we check the accuracy of their
photometry and explore the possibility of contamination by low-z galaxies and
low-mass stars. After excising probable stellar contaminants and using the z'-J
color to exclude any remaining foreground red galaxies, we conclude that 196
sources are likely to be at z~5. The implied mass density from the unconfused
IRAC fraction of this sample, scaled to the total available, is 6e6 Msun/Mpc^3.
We discuss the uncertainties as well as the likelihood that we have
underestimated the true mass density. Including fainter and quiescent sources
the total integrated density could be as high as 1e7 Msun/Mpc^3. Using the
currently available (but highly uncertain) rate of decline in the star
formationhistory over 5 <z< 10, a better fit is obtained for the assembled mass
at z~5 if we admit significant dust extinction at early times or extend the
luminosity function to very faint limits. [abridged]
","[{""version"":""v1"",""created"":""Wed, 12 Apr 2006 19:41:03 GMT""},{""version"":""v2"",""created"":""Mon, 13 Nov 2006 18:22:49 GMT""}]","2011-02-11"
"astro-ph/0604276","Ivana Damjanov","I. Damjanov, D. Fadda, F. Marleau, P. Appleton, P. Choi, M. Lacy, L.
  Storrie-Lombardi, L. Yan (Spitzer Science Center, CalTech)","Mapping Global Star Formation in the Interacting Galaxy Pair ARP 32","4 pages, 3 figures, to be published in the Proceedings of the Spitzer
  Science Center 2005 Conference: Infrared Diagnostics of Galaxy Evolution
  (14-16 November 2005, Pasadena, CA)",,,,"astro-ph",,"  A multi-wavelength set of photometric data including UV (GALEX), optical,
near-IR, infrared (Spitzer) and radio (VLA 20cm) images and spectroscopic
observations are used to map the dust-obscured and unobscured star formation in
the galaxy pair ARP 32. The system consists of an actively star-forming galaxy
and another one with depressed star formation. The most active galaxy has
disrupted morphology and different sites of star formation. Spectroscopic data
show hints of nuclear activity in its core, intense star formation in limited
regions of the galaxy as well as an underlying population of stars witnessing a
past episode of star formation. Current star formation rates are estimated from
UV and bolometric IR luminosities.
","[{""version"":""v1"",""created"":""Wed, 12 Apr 2006 16:03:07 GMT""}]","2007-05-23"
"astro-ph/0604277","Bonnard Teegarden","B. J. Teegarden and K. Watanabe","A Comprehensive Search for Gamma-Ray Lines in the First Year of Data
  from the INTEGRAL Spectrometer","Accepted for publication in ApJ","Astrophys.J.646:965-981,2006","10.1086/504967",,"astro-ph",,"  We have carried out an extensive search for gamma-ray lines in the first year
of public data from the Spectrometer (SPI) on the INTEGRAL mission. INTEGRAL
has spent a large fraction of its observing time in the Galactic Plane with
particular concentration in the Galactic Center (GC) region (~ 3 Msec in the
first year). Hence the most sensitive search regions are in the Galactic Plane
and Center. The phase space of the search spans the energy range 20-8000 keV
and line widths from 0-1000 keV (FWHM). It includes both diffuse and point-like
emission. We have searched for variable emission on time scales down to ~ 1000
sec. Diffuse emission has been searched for on a range of different spatial
scales from ~ 20 deg (the approximate field-of-view of the spectrometer) up to
the entire Galactic Plane. Our search procedures were verified by the recovery
of the known gamma-ray lines at 511 keV and 1809 keV at the appropriate
intensities and significances. We find no evidence for any previously unknown
gamma-ray lines. The upper limits range from a few x 10^-5 cm^-2 s^-1 to a few
x 10^-2 cm^-2 s^-1 depending on line width, energy and exposure; regions of
strong instrumental background lines were excluded from the search. Comparison
is made between our results and various prior predictions of astrophysical
lines.
","[{""version"":""v1"",""created"":""Wed, 12 Apr 2006 17:44:35 GMT""}]","2008-11-26"
"astro-ph/0604278","Joachim Wambsganss","Joachim Wambsganss","Gravitational Microlensing","93 pages, 51 figures; to appear (April 2006) in: Kochanek, C.S.,
  Schneider, P., Wambsganss, J.: ""Gravitational Lensing: Strong, Weak & Micro"",
  Proceedings of the 33rd Saas-Fee Advanced Course; G. Meylan, P. Jetzer, P.
  North, eds. (Springer-Verlag, Heidelberg); pp. 457",,"10.1007/978-3-540-30310-7_4",,"astro-ph",,"  This review forms the microlensing part of the 33rd Saas-Fee Advanced Course
""Gravitational Lensing: Strong, Weak & Micro'', which was held in April 2003 in
Les Diablerets. It contains an introduction to the lensing effects of single
and binary stars and it summarizes the state-of-the-art of microlensing
observations and prospects at the time of the meeting. Stellar microlensing as
well as quasar microlensing are covered.
","[{""version"":""v1"",""created"":""Wed, 12 Apr 2006 18:23:40 GMT""}]","2009-11-11"
"astro-ph/0604279","Amir Hajian","Tuhin Ghosh, Amir Hajian, Tarun Souradeep","Unveiling Hidden Patterns in CMB Anisotropy Maps","Matches version accepted to Phys Rev D. Results unchanged. Paper
  shortened, sharpened, typos fixed. See earlier version for a review of CMB
  anisotropy patterns in Bianchi universe models","Phys.Rev.D75:083007,2007","10.1103/PhysRevD.75.083007",,"astro-ph gr-qc hep-th",,"  Bianchi VII_h models have been recently proposed to explain potential
anomalies in the CMB anisotropy as observed by WMAP. We investigate the
violation of statistical isotropy due to an embedded Bianchi VII_h templates in
the CMB anisotropy maps to determine whether the existence of a hidden Bianchi
template in the WMAP data is consistent with the previous null detection of the
bipolar power spectrum in the WMAP first year maps. We argue that although
correcting the WMAP maps for the Bianchi template may explain some features in
the WMAP data it may cause other anomalies such as preferred directions leading
to detectable levels of violation of statistical isotropy in the Bianchi
corrected maps. We compute the bipolar power spectrum for the low density
Bianchi VII_h models embedded in the background CMB anisotropy maps with the
power spectrum that have been shown in recent literature to best fit the first
year WMAP data. By examining statistical isotropy of these maps, we put a limit
of {\sigma/H}_0 < 2.77E-10 (99% CL) on the shear parameter in Bianchi VII_h
models.
","[{""version"":""v1"",""created"":""Thu, 13 Apr 2006 14:12:49 GMT""},{""version"":""v2"",""created"":""Wed, 4 Apr 2007 19:11:22 GMT""}]","2008-11-26"
"astro-ph/0604280","Eric Linder","Eric V. Linder","Biased Cosmology: Pivots, Parameters, and Figures of Merit","9 pages, 6 figures; minor changes (cooler Fig. 1) to match
  Astroparticle Physics version","Astropart.Phys. 26 (2006) 102-110","10.1016/j.astropartphys.2006.05.004",,"astro-ph",,"  In the quest for precision cosmology, one must ensure that the cosmology is
accurate as well. We discuss figures of merit for determining from observations
whether the dark energy is a cosmological constant or dynamical, with special
attention to the best determined equation of state value, at the ``pivot'' or
decorrelation redshift. We show this is not necessarily the best lever on
testing consistency with the cosmological constant, and moreover is subject to
bias. The standard parametrization of w(a)=w_0+w_a(1-a) by contrast is quite
robust, as tested by extensions to higher order parametrizations and modified
gravity. Combination of complementary probes gives strong immunization against
inaccurate, but precise, cosmology.
","[{""version"":""v1"",""created"":""Wed, 12 Apr 2006 20:00:14 GMT""},{""version"":""v2"",""created"":""Mon, 19 Jun 2006 23:26:25 GMT""}]","2009-11-11"
"astro-ph/0604282","Mark C. Neyrinck","Mark C. Neyrinck, Istv\'an Szapudi (IfA, Hawaii), Christopher D. Rimes
  (JILA, Colorado)","Information content in the halo-model dark-matter power spectrum","5 pages, 4 figures, accepted to MNRAS letters. Minor changes to match
  accepted version","Mon.Not.Roy.Astron.Soc.Lett. 370 (2006) L66-L70","10.1111/j.1745-3933.2006.00190.x",,"astro-ph",,"  Using the halo model, we investigate the cosmological Fisher information in
the non-linear dark-matter power spectrum about the initial amplitude of linear
power. We find that there is little information on `translinear' scales (where
the one- and two-halo terms are both significant) beyond what is on linear
scales, but that additional information is present on small scales, where the
one-halo term dominates. This behavior agrees with the surprising results that
Rimes & Hamilton (2005, 2006) found using N-body simulations. We argue that the
translinear plateau in cumulative information arises largely from fluctuations
in the numbers of large haloes in a finite volume. This implies that more
information could be extracted on non-linear scales if the masses of the
largest haloes in a survey are known.
","[{""version"":""v1"",""created"":""Thu, 13 Apr 2006 02:36:50 GMT""},{""version"":""v2"",""created"":""Fri, 14 Apr 2006 23:14:25 GMT""},{""version"":""v3"",""created"":""Thu, 11 May 2006 20:45:18 GMT""}]","2007-05-23"
"astro-ph/0604283","Markus Sch\""oller","S. Hubrig, M. Briquet, M. Schoeller, P. De Cat, G. Mathys, C. Aerts","Discovery of magnetic fields in the beta Cephei star xi^1 CMa and in
  several Slowly Pulsating B stars","5 pages, 2 figures, 2 tables, accepted as a letter to MNRAS",,"10.1111/j.1745-3933.2006.00175.x",,"astro-ph",,"  We present the results of a magnetic survey of a sample of eight beta Cephei
stars and 26 Slowly Pulsating B stars with FORS1 at the VLT. A weak mean
longitudinal magnetic field of the order of a few hundred Gauss is detected in
the beta Cephei star xi^1 CMa and in 13 SPB stars. The star xi^1 CMa becomes
the third magnetic star among the beta Cephei stars. Before our study, the star
zeta Cas was the only known magnetic SPB star. All magnetic SPB stars for which
we gathered several magnetic field measurements show a field that varies in
time. We do not find a relation between the evolution of the magnetic field
with stellar age in our small sample. Our observations imply that beta Cephei
stars and SPBs can no longer be considered as classes of non-magnetic
pulsators, but the effect of the fields on the oscillation properties remains
to be studied.
","[{""version"":""v1"",""created"":""Wed, 12 Apr 2006 21:44:04 GMT""}]","2009-11-11"
"astro-ph/0604284","Jose Fernandez","Jose Miguel Fernandez, Dante Minniti, Grzegorz Pietrzynski, Wolfgang
  Gieren, Maria Teresa Ruiz, Manuela Zoccali, Andrzej Udalski, Thomas Szeifert","Millimagnitude Optical Photometry for the Transiting Planetary Candidate
  OGLE-TR-109","24 pages (including figures) submitteed to ApJ, Accepted. 1
  replacement (updated references)","Astrophys.J.647:587-593,2006","10.1086/500921",,"astro-ph",,"  We present precise V-band photometry for the low-amplitude transit candidate
star OGLE-TR-109. This is an extreme case among the transiting candidates found
by the OGLE group because of the early spectral type of the star (F0V), of the
low transit amplitude (A_I=0.008 mag), and of the very short period (P=0.58909
days) of the orbiting companion. Using difference image photometry, we are able
to achieve millimagnitude errors in the individual data points. One transit of
this star is well defined in our light curve. This confirms the OGLE detection
and rules out the possibility of a false positive. The measurement of this
transit allows to refine the transit amplitude (A_V=0.006 +/- 0.001 mag), and
the ephemerides for this interesting system, as well as the radius of the
possible orbiting companion (R_P=0.90 +/- 0.09 ~R_J), and the inclination of
the orbit (i=77 +/- 5 deg). Two other transits observed at lower S/N confirm
the period of this system measured by OGLE. There is no evidence for a blend of
the F-type main sequence star with a redder eclipsing binary, or for secondary
transits in the present observations. The absence of ellipsoidal modulation in
the light curve of the primary rules out a low mass star companion or brown
dwarf with M>14 +/- 8 M_J. The remaining possibilities for OGLE-TR-109 are a
blend between the F-type star and a binary with a bluer primary star, or a new
transiting extrasolar planet.
","[{""version"":""v1"",""created"":""Wed, 12 Apr 2006 22:52:59 GMT""},{""version"":""v2"",""created"":""Fri, 14 Apr 2006 14:04:43 GMT""}]","2008-11-26"
"astro-ph/0604285","Christopher Stubbs","Christopher W. Stubbs and John L. Tonry","Toward 1% Photometry: End-to-end Calibration of Astronomical Telescopes
  and Detectors","25 pages, no figures. To be published in ApJ","Astrophys.J.646:1436-1444,2006","10.1086/505138",,"astro-ph",,"  We review the systematic uncertainties that have plagued attempts to obtain
high precision and high accuracy from ground-based photometric measurements
using CCDs. We identify two main challenges in breaking through the 1%
precision barrier: 1) fully characterizing atmospheric transmission, along the
instrument's line of sight, and 2) properly identifying, measuring and removing
instrumental artifacts. We discuss approximations and limitations inherent in
the present methodology, and we estimate their contributions to systematic
photometric uncertainties. We propose an alternative conceptual scheme for the
relative calibration of astronomical apparatus: the availability of calibrated
detectors whose relative spectral sensitivity is known to better than one part
in $10^3$ opens up the possibility of in situ relative throughput measurements,
normalized to a precision calibrated detector, using a stable but uncalibrated
narrowband light source. An implementation scheme is outlined, which exploits
the availability of tunable lasers to map out the relative wavelength response
of an imaging system, using a flatfield screen and a calibrated reference
photodiode. The merits and limitations of this scheme are discussed. In tandem
with careful measurements of atmospheric transmission, this approach could
potentially lead to reliable ground-based photometry with fractional
uncertainties below the percent level.
","[{""version"":""v1"",""created"":""Wed, 12 Apr 2006 22:59:56 GMT""}]","2008-11-26"
"astro-ph/0604286","Joannah L. Hinz","Joannah L. Hinz and George H. Rieke (University of Arizona)","Dynamical Masses in Luminous Infrared Galaxies","14 pages, 2 figures, accepted to ApJ","Astrophys.J.646:872-880,2006","10.1086/505071",,"astro-ph",,"  We have studied the dynamics and masses of a sample of ten nearby luminous
and ultraluminous infrared galaxies (LIRGS and ULIRGs), using 2.3 micron CO
absorption line spectroscopy and near-infrared H- and Ks-band imaging. By
combining velocity dispersions derived from the spectroscopy, disk
scale-lengths obtained from the imaging, and a set of likely model density
profiles, we calculate dynamical masses for each LIRG. For the majority of the
sample, it is difficult to reconcile our mass estimates with the large amounts
of gas derived from millimeter observations and from a standard conversion
between CO emission and H_2 mass. Our results imply that LIRGs do not have huge
amounts of molecular gas (10^10-10^11 Msolar) at their centers, and support
previous indications that the standard conversion of CO to H_2 probably
overestimates the gas masses and cannot be used in these environments. This in
turn suggests much more modest levels of extinction in the near-infrared for
LIRGs than previously predicted (A_V~10-20 versus A_V~100-1000). The lower gas
mass estimates indicated by our observations imply that the star formation
efficiency in these systems is very high and is triggered by cloud-cloud
collisions, shocks, and winds rather than by gravitational instabilities in
circumnuclear gas disks.
","[{""version"":""v1"",""created"":""Wed, 12 Apr 2006 23:02:40 GMT""}]","2008-11-26"
"astro-ph/0604288","R. N. Manchester","R N Manchester","The Parkes Pulsar Timing Array","10 pages, in press ChJAA",,,,"astro-ph",,"  Given sufficient sensitivity, pulsar timing observations can make a direct
detection of gravitational waves passing over the Earth. Pulsar timing is most
sensitive to gravitational waves with frequencies in the nanoHertz region, with
the most likely astronomical sources being binary super-massive black holes in
galaxy cores. The Parkes Pulsar Timing Array project uses the Parkes 64-m radio
telescope to make precision timing observations of a sample of about 20
millisecond pulsars with a principal goal of making a direct detection of
gravitational waves. Observations commenced about one year ago and so far
sub-microsecond timing residuals have been achieved for more than half of these
pulsars. New receiver and software systems are being developed with the aim of
reducing these residuals to the level believed necessary for a positive
detection of gravitational waves.
","[{""version"":""v1"",""created"":""Thu, 13 Apr 2006 01:07:47 GMT""}]","2007-05-23"
"astro-ph/0604289","Gillian Wilson","Gillian Wilson (1), Adam Muzzin (2), Mark Lacy (1), Howard Yee (2),
  Jason Surace (1), Carol Lonsdale (3), Henk Hoekstra (4), Subhabrata Majumdar
  (2), David Gilbank (2) & Mike Gladders (5) ((1) Spitzer Science Center, (2)
  U.Toronto, (3) IPAC, (4) U.Vic (5) Carnegie Obs.)","Clusters of Galaxies at 1 < z < 2 : The Spitzer Adaptation of the
  Red-Sequence Cluster Survey","6 pages, 4 figures, uses asp2004 style file. To appear in the
  proceedings of ""The Spitzer Science Center 2005 Conference: Infrared
  Diagnostics of Galaxy Evolution"", held in Pasadena, November 2005",,,,"astro-ph",,"  As the densest galaxy environments in the universe, clusters are vital to our
understanding of the role that environment plays in galaxy formation and
evolution. Unfortunately, the evolution of high-redshift cluster galaxies is
poorly understood because of the ``cluster desert'' that exists at 1 < z < 2.
The SpARCS collaboration is currently carrying out a 1-passband (z') imaging
survey which, when combined with the pre-existing 50 square degree 3.6 micron
Spitzer SWIRE Legacy Survey data, will efficiently detect hundreds of clusters
in the cluster desert using an infrared application of the well-proven cluster
red-sequence technique. We have already tested this 1-color (z' - [3.6])
approach using a 6 square degree ``pilot patch'' and shown it to be extremely
successful at detecting clusters at 1 < z < 2. The clusters discovered in this
project will be the first large sample of ``nascent'' galaxy clusters which
connect the star-forming proto-cluster regions at z > 2 to the quiescent
population at z < 1. The existing seven-passband Spitzer data (3.6, 4.5, 5.8,
8.0, 24, 70, 160 micron) will allow us to make the first measurements of the
evolution of the cluster red-sequence, IR luminosity function, and the mid-IR
dust-obscured star-formation rate for 1 < z < 2 clusters.
","[{""version"":""v1"",""created"":""Thu, 13 Apr 2006 01:13:38 GMT""}]","2007-05-23"
"astro-ph/0604290","Bin Tian","B. Tian, L. Deng, Z. Han, X. B. Zhang","The blue stragglers formed via mass transfer in old open clusters","11 pages, 6 figures, A&A accepted",,"10.1051/0004-6361:20064879",,"astro-ph",,"  In this paper, we present the simulations for the primordial blue stragglers
in the old open cluster M67 based on detailed modelling of the evolutionary
processes. The principal aim is to discuss the contribution of mass transfer
between the components of close binaries to the blue straggler population in
M67. First, we followed the evolution of a binary of 1.4M$_\odot$+0.9M$_\odot$.
The synthetic evolutionary track of the binary system revealed that a
primordial blue straggler had a long lifetime in the observed blue straggler
region of color-magnitude diagram. Second, a grid of models for close binary
systems experiencing mass exchange were computed from 1Gyr to 6Gyr in order to
account for primordial blue-straggler formation in a time sequence. Based on
such a grid, Monte-Carlo simulations were applied for the old open cluster M67.
Adopting appropriate orbital parameters, 4 primordial blue stragglers were
predicted by our simulations. This was consistent with the observational fact
that only a few blue stragglers in M67 were binaries with short orbital
periods. An upper boundary of the primordial blue stragglers in the
color-magnitude diagram (CMD) was defined and could be used to distinguish blue
stragglers that were not formed via mass exchange. Using the grid of binary
models, the orbital periods of the primordial BSs could be predicted. Compared
with the observations, it is clear that the mechanism discussed in this work
alone cannot fully predict the blue straggler population in M67. There must be
several other processes also involved in the formation of the observed blue
stragglers in M67.
","[{""version"":""v1"",""created"":""Thu, 13 Apr 2006 01:50:19 GMT""},{""version"":""v2"",""created"":""Tue, 9 May 2006 02:18:57 GMT""}]","2009-11-11"
"astro-ph/0604291","Gaku Kiuchi","Gaku Kiuchi, Kouji Ohta, Masayuki Akiyama, Kentaro Aoki and Yoshihiro
  Ueda","Host Galaxies of Hard X-ray Selected Type-2 Active Galactic Nuclei at
  Intermediate Redshifts","21 pages, 8 figures, ApJ accepted","Astrophys.J.647:892-900,2006; Erratum-ibid.653:1583,2006","10.1086/505108",,"astro-ph",,"  We study properties of the host galaxies of 15 hard X-ray selected type-2
active galactic nuclei (AGNs) at intermediate redshifts (0.05$<z<$0.6) detected
in $ASCA$ surveys. The absorption corrected hard X-ray luminosities $L_{\rm
2-10 keV}$ range from 10$^{42}$ erg s$^{-1}$ to $10^{45}$ erg s$^{-1}$. We took
the $R$-band image of these AGNs with the University of Hawaii 2.2 m telescope.
Thanks to the intrinsic obscuration of nuclear light, we can decompose the
galaxies with a spheroid component and a disk component. The resulting spheroid
luminosities correlate with $L_{\rm 2-10 keV}$; higher (lower) X-ray luminosity
AGNs tend to reside in luminous (less luminous) spheroids. It is also found
that the hosts of luminous AGNs show a large spheroid-to-disk luminosity ratio
($\sim$1), while those of less luminous AGNs spread between 0 and 1. The
correlation between $L_{\rm 2-10keV}$ and spheroid luminosity indicates that
the relation between mass of a supermassive black hole (SMBH) and spheroid
luminosity (BS-relation) at the intermediate redshifts. The BS-relation agrees
with that in the local universe if the Eddington ratio of 0.24 is adopted,
which is a mean value determined from our $ASCA$ type-1 AGN sample at similar
redshifts through the broad-line width and continuum luminosity. The present
study demonstrates the effectiveness of using type-2 AGNs at high redshifts to
study their host properties.
","[{""version"":""v1"",""created"":""Thu, 13 Apr 2006 06:39:26 GMT""},{""version"":""v2"",""created"":""Wed, 3 May 2006 06:46:09 GMT""}]","2008-11-26"
"astro-ph/0604292","Chun-Hsien Wu","Chun-Hsien Wu, Kin-Wang Ng, Wolung Lee, Da-Shin Lee, and Yeo-Yie
  Charng","Quantum noise and large-scale cosmic microwave background anisotropy","11 pages, revised version to appear in JCAP","JCAP 0702:006,2007","10.1088/1475-7516/2007/02/006",,"astro-ph gr-qc hep-ph",,"  We propose a new source for the cosmological density perturbation which is
passive fluctuations of the inflaton driven dynamically by a colored quantum
noise as a result of its coupling to other massive quantum fields. The created
fluctuations grow with time during inflation before horizon-crossing. However,
the larger-scale modes cross out the horizon earlier, thus resulting in a
suppression of their density perturbation as compared with those on small
scales. By using current observed CMB data to constrain the parameters
introudced, we find that a significant contribution from the noise-driven
perturbation to the density perturbation is still allowed. It in turn gives
rise to a suppression of the large-scale CMB anisotropy that may be relevant to
the observed low quadrupole in the WMAP CMB anisotropy data. We also briefly
discuss the implications to the energy scale of inflation and the spectral
index and non-Gaussianity of the density perturbation.
","[{""version"":""v1"",""created"":""Thu, 13 Apr 2006 07:23:51 GMT""},{""version"":""v2"",""created"":""Thu, 6 Jul 2006 13:35:34 GMT""},{""version"":""v3"",""created"":""Thu, 25 Jan 2007 08:02:27 GMT""}]","2010-10-27"
