"math/0604406","Almar Kaid","Holger Brenner and Almar Kaid","Syzygy Bundles on P^2 and the Weak Lefschetz Property","To appear in Illinois Journal of Mathematics",,,,"math.AG",,"  Let K be an algebraically closed field of characteristic zero and let
I=(f_1,...,f_n) be a homogeneous R_+-primary ideal in R:=K[X,Y,Z]. If the
corresponding syzygy bundle Syz(f_1,...,f_n) on the projective plane is
semistable, we show that the Artinian algebra R/I has the Weak Lefschetz
property if and only if the syzygy bundle has a special generic splitting type.
As a corollary we get the result of Harima et alt., that every Artinian
complete intersection (n=3) has the Weak Lefschetz property. Furthermore, we
show that an almost complete intersection (n=4) does not necessarily have the
Weak Lefschetz property, answering negatively a question of Migliore and
Miro-Roig. We prove that an almost complete intersection has the Weak Lefschetz
property if the corresponding syzygy bundle is not semistable.
","[{""version"":""v1"",""created"":""Tue, 18 Apr 2006 17:39:37 GMT""},{""version"":""v2"",""created"":""Thu, 23 Nov 2006 23:23:49 GMT""}]","2007-05-23"
"math/0604407","Victor J. W. Guo","Victor J. W. Guo, Frederic Jouhet, Jiang Zeng","New Finite Rogers-Ramanujan Identities","19 pages. to appear in Ramanujan J","Ramanujan J. 19 (2009), 247--266","10.1007/s11139-009-9182-0",,"math.CO","http://arxiv.org/licenses/nonexclusive-distrib/1.0/","  We present two general finite extensions for each of the two Rogers-Ramanujan
identities. Of these one can be derived directly from Watson's transformation
formula by specialization or through Bailey's method, the second similar
formula can be proved either by using the first formula and the q-Gosper
algorithm, or through the so-called Bailey lattice.
","[{""version"":""v1"",""created"":""Tue, 18 Apr 2006 19:06:27 GMT""},{""version"":""v2"",""created"":""Sun, 17 Dec 2006 02:48:57 GMT""},{""version"":""v3"",""created"":""Thu, 11 Jan 2007 00:12:42 GMT""},{""version"":""v4"",""created"":""Thu, 2 Jul 2009 01:37:05 GMT""}]","2011-03-25"
"math/0604408","Ben Weinkove","Ben Weinkove","The Calabi-Yau equation on almost-Kahler four-manifolds","33 pages. Final version. Minor modifications. To appear in J.
  Differential Geom","J. Differential Geom. 76 (2007), no. 2, 317-349",,,"math.DG math.SG",,"  Let (M, \omega) be a compact symplectic 4-manifold with a compatible almost
complex structure J. The problem of finding a J-compatible symplectic form with
prescribed volume form is an almost-K\""ahler analogue of Yau's theorem and is
connected to a programme in symplectic topology proposed by Donaldson. We call
the corresponding equation for the symplectic form the Calabi-Yau equation.
Solutions are unique in their cohomology class. It is shown in this paper that
a solution to this equation exists if the Nijenhuis tensor is small in a
certain sense. Without this assumption, it is shown that the problem of
existence can be reduced to obtaining a C^0 bound on a scalar potential
function.
","[{""version"":""v1"",""created"":""Tue, 18 Apr 2006 20:48:16 GMT""},{""version"":""v2"",""created"":""Mon, 26 Mar 2007 20:51:53 GMT""}]","2018-12-14"
"math/0604409","David J. Saltman","David J. Saltman","Cyclic Algebras over $p$-adic curves",,,,,"math.AG math.RA",,"  In this paper we study division algebras over the function fields of curves
over $\Q_p$. The first and main tool is to view these fields as function fields
over nonsingular $S$ which are projective of relative dimension 1 over the $p$
adic ring $\Z_p$. A previous paper showed such division algebras had index
bounded by $n^2$ assuming the exponent was $n$ and $n$ was prime to $p$. In
this paper we consider algebras of degree (and hence exponent) $q \not= p$ and
show these algebras are cyclic. We also find a geometric criterion for a Brauer
class to have index $q$.
","[{""version"":""v1"",""created"":""Tue, 18 Apr 2006 21:49:36 GMT""}]","2007-05-23"
"math/0604410","Aleks Jakulin","Wray Buntine and Aleks Jakulin","Discrete Component Analysis",,"Lecture Notes in Computer Science. Subspace, Latent Structure and
  Feature Selection: Statistical and Optimization Perspectives Workshop, SLSFS
  2005, Bohinj, Slovenia, February 23-25, 2005, Revised Selected Papers","10.1007/11752790_1",,"math.ST stat.TH",,"  This article presents a unified theory for analysis of components in discrete
data, and compares the methods with techniques such as independent component
analysis, non-negative matrix factorisation and latent Dirichlet allocation.
The main families of algorithms discussed are a variational approximation,
Gibbs sampling, and Rao-Blackwellised Gibbs sampling. Applications are
presented for voting records from the United States Senate for 2003, and for
the Reuters-21578 newswire collection.
","[{""version"":""v1"",""created"":""Tue, 18 Apr 2006 22:19:17 GMT""}]","2007-06-13"
"math/0604411","Dragomir Saric","A. Epstein, V. Markovic, D. Saric","Extremal maps of the universal hyperbolic solenoid","LaTeX, 15 pages",,,"Stony Brook IMS #2006/02","math.DS",,"  We show that the set of points in the Teichmuller space of the universal
hyperbolic solenoid which do not have a Teichmuller extremal representative is
generic (that is, its complement is the set of the first kind in the sense of
Baire). This is in sharp contrast with the Teichmuller space of a Riemann
surface where at least an open, dense subset has Teichmuller extremal
representatives. In addition, we provide a sufficient criteria for the
existence of Teichmuller extremal representatives in the given homotopy class.
These results indicate that there is an interesting theory of extremal (and
uniquely extremal) quasiconformal mappings on hyperbolic solenoids.
","[{""version"":""v1"",""created"":""Tue, 18 Apr 2006 22:54:59 GMT""}]","2007-05-23"
"math/0604413","Everett W. Howe","Everett W. Howe","Supersingular genus-two curves over fields of characteristic three","20 pages, LaTeX","pp. 49-69 in: Computational Arithmetic Geometry (K. E. Lauter and
  K. A. Ribet, eds.), Contemporary Mathematics 463, American Mathematical
  Society, Providence, RI, 2008",,,"math.NT math.AG",,"  Let C be a supersingular genus-2 curve over an algebraically closed field of
characteristic 3. We show that if C is not isomorphic to the curve y^2 = x^5 +
1 then up to isomorphism there are exactly 20 degree-3 maps phi from C to the
elliptic curve E with j-invariant 0. We study the coarse moduli space of
triples (C,E,phi), paying particular attention to questions of rationality. The
results we obtain allow us to determine, for every finite field k of
characteristic 3, the polynomials that occur as Weil polynomials of
supersingular genus-2 curves over k.
","[{""version"":""v1"",""created"":""Wed, 19 Apr 2006 06:47:42 GMT""}]","2010-01-23"
"math/0604414","Dominic Verity","Dominic Verity","Weak complicial sets, a simplicial weak omega-category theory. Part I:
  basic homotopy theory","65 pages, further updates to the material on quasi-categories, minor
  corrections",,,,"math.CT math.AT",,"  This paper develops the foundations of a simplicial theory of weak
omega-categories, which builds upon the insights originally expounded by Ross
Street in his 1987 paper on oriented simplices. The resulting theory of weak
complicial sets provides a common generalisation of the theories of (strict)
omega-categories, Kan complexes and Joyal's quasi-categories. We generalise a
number of results due to the current author with regard to complicial sets and
strict omega-categories to provide an armoury of well behaved technical
devices, such as joins and Gray tensor products, which will be used to study
these the weak omega-category theory of these structures in a series of
companion papers. In particular, we establish their basic homotopy theory by
constructing a Quillen model structure on the category of stratified simplicial
sets whose fibrant objects are the weak complicial sets. As a simple corollary
of this work we provide an independent construction of Joyal's model structure
on simplicial sets for which the fibrant objects are the quasi-categories.
","[{""version"":""v1"",""created"":""Wed, 19 Apr 2006 07:28:38 GMT""},{""version"":""v2"",""created"":""Fri, 26 May 2006 09:02:34 GMT""},{""version"":""v3"",""created"":""Wed, 12 Jul 2006 08:30:21 GMT""}]","2007-05-23"
"math/0604415","Stefano Montaldo","Stefano Montaldo and Irene I. Onnis","A note on surfaces in $\h^2\times\r$","11 pages, 5 figures",,,,"math.DG",,"  In this article we consider surfaces in the product space $\h^2\times \r$ of
the hyperbolic plane $\h^2$ with the real line. The main results are: a
description of some geometric properties of minimal graphs; new examples of
complete minimal graphs; the classification of umbilical surfaces.
","[{""version"":""v1"",""created"":""Wed, 19 Apr 2006 07:39:04 GMT""},{""version"":""v2"",""created"":""Thu, 20 Apr 2006 14:33:53 GMT""}]","2007-05-23"
"math/0604416","Dominic Verity","Dominic Verity","Weak complicial sets, a simplicial weak omega-category theory. Part II:
  nerves of complicial Gray-categories","27 pages","Categories in Algebra, Geometry and Mathematical Physics, volume
  431, Contemporary Mathematics, 2007",,,"math.CT math.AT",,"  This paper continues the development of a simplicial theory of weak
omega-categories, by studying categories which are enriched in weak complicial
sets. These complicial Gray-categories generalise both the Kan complex enriched
categories of homotopy theory and the Gray-categories of weak 3-category
theory. We derive a simplicial nerve construction, which is closely related to
Cordier and Porter's homotopy coherent nerve, and show that this faithfully
represents complicial Gray-categories as weak complicial sets. The category of
weak complicial sets may itself be canonically enriched to a complicial
Gray-category whose homsets are higher generalisations of the bicategory of
homomorphisms, strong transformations and modifications. By applying our nerve
construction to this structure, we demonstrate that the totality of all (small)
weak complicial sets and their structural morphisms at higher dimensions form a
richly structured (large) weak complicial set.
","[{""version"":""v1"",""created"":""Wed, 19 Apr 2006 07:48:29 GMT""}]","2009-09-29"
"math/0604417","Yuzo Maruyama","Yuzo Maruyama and Akimichi Takemura","Admissibility and minimaxity of generalized Bayes estimators for
  spherically symmetric family","25pages","Journal of Multivariate Analysis, 99 (2008), 50-73","10.1016/j.jmva.2007.01.002",,"math.ST stat.TH",,"  We give a sufficient condition for admissibility of generalized Bayes
estimators of the location vector of spherically symmetric distribution under
squared error loss. Compared to the known results for the multivariate normal
case, our sufficient condition is very tight and is close to being a necessary
condition. In particular we establish the admissibility of generalized Bayes
estimators with respect to the harmonic prior and priors with slightly heavier
tail than the harmonic prior. We use the theory of regularly varying functions
to construct a sequence of smooth proper priors approaching an improper prior
fast enough for establishing the admissibility. We also discuss conditions of
minimaxity of the generalized Bayes estimator with respect to the harmonic
prior.
","[{""version"":""v1"",""created"":""Wed, 19 Apr 2006 08:56:16 GMT""}]","2007-10-29"
"math/0604418","Carlos D'Andrea","Carlos D'Andrea, Hoon Hong, Teresa Krick, Agnes Szanto","An Elementary Proof of Sylvester's Double Sums for Subresultants","9 pages, no figures, simpler proof of the main results thanks to
  useful comments made by the referees. To appear in Journal of Symbolic
  Computation",,,,"math.AC math.AG",,"  In 1853 Sylvester stated and proved an elegant formula that expresses the
polynomial subresultants in terms of the roots of the input polynomials.
Sylvester's formula was also recently proved by Lascoux and Pragacz by using
multi-Schur functions and divided differences. In this paper, we provide an
elementary proof that uses only basic properties of matrix multiplication and
Vandermonde determinants.
","[{""version"":""v1"",""created"":""Wed, 19 Apr 2006 09:14:20 GMT""},{""version"":""v2"",""created"":""Thu, 14 Sep 2006 11:32:43 GMT""}]","2007-05-23"
"math/0604419","Antonio Ca\~nete","Antonio Ca\~nete","Stable and isoperimetric regions in rotationally symmetric tori with
  decreasing Gauss curvature","23 pages, 6 figures",,,,"math.DG",,"  In this work we classify the stable regions (second order minima of perimeter
under an area constraint) in tori of revolution with piecewise continuous
decreasing Gauss curvature from the longest parallel and with a horizontal
symmetry. Some applications to isoperimetric problems are also given.
","[{""version"":""v1"",""created"":""Wed, 19 Apr 2006 10:19:47 GMT""}]","2007-05-23"
"math/0604420","Alejandro Melle Hernandez","J. Fernandez de Bobadilla, I. Luengo, A. Melle-Hernandez, and A.
  Nemethi","Classification of rational unicuspidal projective curves whose
  singularities have one Puiseux pair","To appear in Real and Complex Singularities (Luminy, 2004)",,,,"math.AG",,"  It is a very old and interesting open problem to characterize those
collections of embedded topological types of local plane curve singularities
which may appear as singularities of a projective plane curve C of degree d.
The goal of the present article is to give a complete (topological)
classification of those cases when C is rational and it has a unique
singularity which is locally irreducible (i.e. C is unicuspidal) with one
Puiseux pair.
","[{""version"":""v1"",""created"":""Wed, 19 Apr 2006 10:48:13 GMT""}]","2007-05-23"
"math/0604421","Alejandro Melle Hernandez","J. Fernandez de Bobadilla, I. Luengo, A. Melle-Hernandez and A.
  Nemethi","On rational cuspidal curves, open surfaces and local singularities",,,,,"math.AG",,"  Let $C$ be an irreducible projective plane curve in the complex projective
space ${\mathbb{P}}^2$. The classification of such curves, up to the action of
the automorphism group $PGL(3,{\mathbb{C}})$ on ${\mathbb{P}}^2$, is a very
difficult open problem with many interesting connections. The main goal is to
determine, for a given $d$, whether there exists a projective plane curve of
degree $d$ having a fixed number of singularities of given topological type. In
this note we are mainly interested in the case when $C$ is a rational curve.
The aim of this article is to present some of the old conjectures and related
problems, and to complete them with some results and new conjectures from the
recent work of the authors.
","[{""version"":""v1"",""created"":""Wed, 19 Apr 2006 10:56:22 GMT""}]","2007-05-23"
"math/0604422","Pedja Rajkovic M","Predrag Rajkovic, Marko D. Petkovic, Paul Barry","The Hankel Transform of the Sum of Consecutive Generalized Catalan
  Numbers",,,,,"math.CO math.NT",,"  We discuss the properties of the Hankel transformation of a sequence whose
elements are the sums of consecutive generalized Catalan numbers and find their
values in the closed form.
","[{""version"":""v1"",""created"":""Wed, 19 Apr 2006 11:06:01 GMT""}]","2007-05-23"
"math/0604423","Joost Vercruysse","Joost Vercruysse","Equivalences between categories of modules and categories of comodules","19 pages, some corrections and additions to version 1",,,,"math.RA math.QA",,"  We show the close connection between appearingly different Galois theories
for comodules introduced recently in [J. G\'omez-Torrecillas and J. Vercruysse,
Comatrix corings and Galois Comodules over firm rings, arXiv:math.RA/0509106.]
and [R. Wisbauer, On Galois comodules (2004), to appear in Comm. Algebra.].
Furthermore we study equivalences between categories of comodules over a coring
and modules over a firm ring. We show that these equivalences are related to
Galois theory for comodules.
","[{""version"":""v1"",""created"":""Wed, 19 Apr 2006 12:46:58 GMT""},{""version"":""v2"",""created"":""Wed, 2 Aug 2006 16:55:10 GMT""}]","2007-05-23"
"math/0604424","Ling Lei Miss","Ling Lei","Identification of Parameters through the Approximate Periodic Solutions
  of a Parabolic System","26 pages",,,,"math.OC",,"  This work is concerned with the identification problem for what we call the
perturbation term or error term in a parabolic partial differential equation,
through its approximate periodic solutions. The observation is made over a
subregion of the physical domain. The existence and uniqueness problem of the
approximate periodic solutions is studied in the first part of the paper. A
solution to the identification problem is given in the second part of the
paper. The main ingredients to be used include the classical Garlerkin method
and the more recently developed Carleman estimates for a parabolic system.
","[{""version"":""v1"",""created"":""Wed, 19 Apr 2006 13:01:26 GMT""}]","2007-05-23"
"math/0604425","Michael Stoll","Michael Stoll (International University Bremen)","On the number of rational squares at fixed distance from a fifth power","10 pages","Acta Arith. 125, 79-88 (2006)","10.4064/aa125-1-7",,"math.NT",,"  The main result of this note is that there are at most seven rational points
(including the one at infinity) on the curve C_A with the affine equation y^2 =
x^5 + A (where A is a tenth power free integer) when the Mordell-Weil rank of
the Jacobian of C_A is one. This bound is attained for A = 18^2.
","[{""version"":""v1"",""created"":""Wed, 19 Apr 2006 13:38:02 GMT""}]","2015-06-26"
"math/0604426","Francesco Caravenna","Francesco Caravenna, Giambattista Giacomin and Lorenzo Zambotti","Infinite volume limits of polymer chains with periodic charges","27 pages, 2 figures",,,,"math.PR math-ph math.MP",,"  The aim of this paper is twofold:
  - To give an elementary and self-contained proof of an explicit formula for
the free energy for a general class of polymer chains interacting with an
environment through periodic potentials. This generalizes a result in
[Bolthausen and Giacomin, AAP 2005] in which the formula is derived by using
the Donsker-Varadhan Large Deviations theory for Markov chains. We exploit
instead tools from renewal theory.
  - To identify the infinite volume limits of the system. In particular, in the
different regimes we encounter transient, null recurrent and positive recurrent
processes (which correspond to delocalized, critical and localized behaviors of
the trajectories). This is done by exploiting the sharp estimates on the
partition function of the system obtained by the renewal theory approach.
  The precise characterization of the infinite volume limits of the system
exposes a non-uniqueness problem. We will however explain in detail how this
(at first) surprising phenomenon is instead due to the presence of a
first-order phase transition.
","[{""version"":""v1"",""created"":""Wed, 19 Apr 2006 14:10:53 GMT""}]","2007-05-23"
"math/0604427","Bjoern Grohmann","Bjoern Grohmann","On the Zeros of Fermat Quotients and Mirimanoff Polynomials","8 pages",,,,"math.NT",,"  In this article an upper bound for the first consecutive zeros of the Fermat
quotient is given in terms of the zeros of a Mirimanoff polynomial. This bound
is obtained by investigating a relation between these polynomials and the
factor system of Gauss sums of a certain number field.
","[{""version"":""v1"",""created"":""Wed, 19 Apr 2006 14:15:45 GMT""}]","2007-05-23"
"math/0604428","David Nadler","David Nadler","Morse theory and tilting sheaves","Dedicated to R. MacPherson on the occasion of his 60th birthday",,,,"math.RT math.AG",,"  We give a geometric construction of tilting perverse sheaves using stratified
Morse theory, torus actions, and nearby cycles.
","[{""version"":""v1"",""created"":""Wed, 19 Apr 2006 15:19:49 GMT""}]","2007-05-23"
"nlin/0604038","Michal Marvan","Michal Marvan, Alexandre M. Vinogradov, Valery A. Yumaguzhin","Differential invariants of generic hyperbolic Monge--Amp\`ere equations","25 pages",,,,"nlin.SI",,"  In this paper basic differential invariants of generic hyperbolic
Monge--Amp\`ere equations with respect to contact transformations are
constructed and the equivalence problem for these equations is solved.
","[{""version"":""v1"",""created"":""Wed, 19 Apr 2006 10:33:49 GMT""}]","2007-05-23"
"nlin/0604039","Chidambaram Senthil Kumar","R. Radha, C. Senthil Kumar, M. Lakshmanan, X. Y. Tang and S. Y. Lou","Periodic and Localized Solutions of the Long Wave-Short Wave Resonance
  Interaction Equation","13 pages, 6 figures","J. Phys. A: Math. Gen. 38 (2005) 9649-9663","10.1088/0305-4470/38/44/003",,"nlin.SI",,"  In this paper, we investigate the (2+1) dimensional long wave-short wave
resonance interaction (LSRI) equation and show that it possess the Painlev\'e
property. We then solve the LSRI equation using Painlev\'e truncation approach
through which we are able to construct solution in terms of three arbitrary
functions. Utilizing the arbitrary functions present in the solution, we have
generated a wide class of elliptic function periodic wave solutions and
exponentially localized solutions such as dromions, multidromions, instantons,
multi-instantons and bounded solitary wave solutions.
","[{""version"":""v1"",""created"":""Wed, 19 Apr 2006 13:34:39 GMT""}]","2009-11-11"
"nlin/0604040","Paolo Lorenzoni","Laura Fontanelli, Paolo Lorenzoni, Marco Pedroni","A 3-component extension of the Camassa-Holm hierarchy","15 pages; minor changes; to appear in Letters in Mathematical Physics",,"10.1007/s11005-006-0109-z",,"nlin.SI",,"  We introduce a bi-Hamiltonian hierarchy on the loop-algebra of sl(2) endowed
with a suitable Poisson pair. It gives rise to the usual CH hierarchy by means
of a bi-Hamiltonian reduction, and its first nontrivial flow provides a
3-component extension of the CH equation.
","[{""version"":""v1"",""created"":""Wed, 19 Apr 2006 15:18:17 GMT""},{""version"":""v2"",""created"":""Mon, 4 Sep 2006 14:19:57 GMT""}]","2009-11-11"
"nucl-th/0604041","Alberto Accardi","Alberto Accardi","Formation time scaling and hadronization in cold nuclear matter","6 pages, 5 figures. Extended discussions. Low- and high formation
  time cuts analyzed, 1 plot added. To appear in Phys.Lett.B","Phys.Lett.B649:384-389,2007","10.1016/j.physletb.2006.10.072",,"nucl-th hep-ph nucl-ex",,"  I propose a scaling analysis of the hadron multiplicity ratio measured in
Deep Inelastic Scattering on nuclear targets as a tool to distinguish energy
loss and nuclear absorption effects on hadron suppression in cold nuclear
matter. The proposed scaling variable is a function of the hadron fractional
energy and of the virtual photon energy. Its functional form, which depends on
a parameter \lambda, can be fixed by general theoretical considerations and
encompasses both energy loss and absorption models. The parameter \lambda is
fitted to HERMES experimental data and shown to favor prehadron nuclear
absorption as leading mechanism for hadron suppression as opposed to quark
energy loss.
","[{""version"":""v1"",""created"":""Tue, 18 Apr 2006 18:06:38 GMT""},{""version"":""v2"",""created"":""Wed, 19 Apr 2006 15:49:36 GMT""},{""version"":""v3"",""created"":""Wed, 4 Oct 2006 20:19:39 GMT""}]","2008-11-26"
"nucl-th/0604044","Carlos Bertulani","C.A. Bertulani","Probing nuclear skins and halos with elastic electron scattering","27 pages, 9 figures, accepted for publication in J. Phys. G","J.Phys.G34:315-334,2007","10.1088/0954-3899/34/2/011",,"nucl-th",,"  I investigate the elastic electron scattering off nuclei far from the
stability line. The effects of the neutron and proton skins and halos on the
differential cross sections are explored. Examples are given for the charge
distribution in Sn isotopes and its relation to the neutron skin. The neutron
halo in $^{11}$Li and the proton halo in $^{8}$B are also investigated.
Particular interest is paid to the inverse scattering problem and its
dependence on the experimental precision. These studies are of particular
interest for the upcoming electron ion colliders at the GSI and RIKEN
facilities.
","[{""version"":""v1"",""created"":""Wed, 19 Apr 2006 04:15:23 GMT""},{""version"":""v2"",""created"":""Thu, 15 Jun 2006 17:21:24 GMT""},{""version"":""v3"",""created"":""Wed, 22 Nov 2006 18:10:35 GMT""}]","2008-11-26"
