"math-ph/0611061","Roman Popovych","Roman O. Popovych, Michael Kunzinger, Homayoon Eshraghi","Admissible Transformations and Normalized Classes of Nonlinear
  Schroedinger Equations","42 pages, extended version, the group classification of
  (1+2)-dimensional cubic Schroedinger equations with potentials was added","Acta Appl. Math. 109 (2010), 315-359","10.1007/s10440-008-9321-4",,"math-ph cond-mat.other math.AP math.MP","http://arxiv.org/licenses/nonexclusive-distrib/1.0/","  The theory of group classification of differential equations is analyzed,
substantially extended and enhanced based on the new notions of conditional
equivalence group and normalized class of differential equations. Effective new
techniques are proposed. Using these, we exhaustively describe admissible point
transformations in classes of nonlinear (1+1)-dimensional Schroedinger
equations, in particular, in the class of nonlinear (1+1)-dimensional
Schroedinger equations with modular nonlinearities and potentials and some
subclasses thereof. We then carry out a complete group classification in this
class, representing it as a union of disjoint normalized subclasses and
applying a combination of algebraic and compatibility methods. Moreover, we
introduce the complete classification of (1+2)-dimensional cubic Schroedinger
equations with potentials. The proposed approach can be applied to studying
symmetry properties of a wide range of differential equations.
","[{""version"":""v1"",""created"":""Thu, 23 Nov 2006 14:46:28 GMT""},{""version"":""v2"",""created"":""Fri, 10 Aug 2007 17:41:01 GMT""},{""version"":""v3"",""created"":""Thu, 17 Jul 2008 10:22:41 GMT""},{""version"":""v4"",""created"":""Fri, 10 Oct 2008 15:03:04 GMT""}]","2010-11-03"
"math/0611658","Dimiter Vassilev","Stefan Ivanov, Ivan Minchev, Dimiter Vassilev","Quaternionic contact Einstein structures and the quaternionic contact
  Yamabe problem","51 pages, LaTeX 2e, 10pt, corrected Theorem 4.9 and Proposition 8.1",,,"ICTP Preprint: IC/2006/117","math.DG math.AP","http://creativecommons.org/licenses/publicdomain/","  A partial solution of the quaternionic contact Yamabe problem on the
quaternionic sphere is given. It is shown that the torsion of the Biquard
connection vanishes exactly when the trace-free part of the horizontal Ricci
tensor of the Biquard connection is zero and this occurs precisely on
3-Sasakian manifolods. All conformal deformations sending the standard flat
torsion-free quaternionic contact structure on the quaternionic Heisenberg
group to a quaternionic contact structure with vanishing torsion of the Biquard
connection are explicitly described. A '3-Hamiltonian form' of infinitesimal
conformal automorphisms of quaternionic contact structures is presented.
","[{""version"":""v1"",""created"":""Wed, 22 Nov 2006 17:19:00 GMT""},{""version"":""v2"",""created"":""Mon, 4 Dec 2006 03:32:57 GMT""},{""version"":""v3"",""created"":""Sun, 11 Mar 2007 18:19:17 GMT""},{""version"":""v4"",""created"":""Sat, 17 Mar 2007 16:16:26 GMT""},{""version"":""v5"",""created"":""Wed, 15 Sep 2010 12:42:27 GMT""}]","2016-02-29"
"math/0611698","David Callan","David Callan","A bijection on Dyck paths and its cycle structure","17 pages. Uses PSTricks for tree diagrams and Krattenthaler's LaTeX
  code for lattice path diagrams. No external (.eps) figures",,,,"math.CO",,"  The known bijections on Dyck paths are either involutions or have notoriously
intractable cycle structure. Here we present a size-preserving bijection on
Dyck paths whose cycle structure is amenable to complete analysis. In
particular, each cycle has length a power of 2. A new manifestation of the
Catalan numbers as labeled forests crops up enroute as does the Pascal matrix
mod 2. We use the bijection to show the equivalence of two known manifestations
of the Motzkin numbers. Finally, we consider some statistics on the new Catalan
manifestation.
","[{""version"":""v1"",""created"":""Wed, 22 Nov 2006 17:05:19 GMT""}]","2007-05-23"
"math/0611699","Roberto Callejas-Bedregal","R. Callejas-Bedregal, K. Houston and M. A. S. Ruas","Topological Triviality of Families of Singular Surfaces","19 pages",,,,"math.CV math.AG",,"  We study the topological triviality of families of singular surfaces in
${\mathbb C}^3$ parametrized by $\mathcal A$-finitely determined map germs. We
prove that the constancy of the Milnor number of the double point locus
characterizes the topological triviality of the family.
","[{""version"":""v1"",""created"":""Wed, 22 Nov 2006 16:17:50 GMT""}]","2007-05-23"
"math/0611700","Jean-Louis Colliot-Th\'el\`ene","M. Borovoi, J-L. Colliot-Th\'el\`ene and A.N. Skorobogatov","The elementary obstruction and homogeneous spaces","To appear in Duke Mathematical Journal. An appendix on the
  Brauer-Manin obstruction for homogeneous spaces has been added","Duke Math. J. 141 (2008), 321-364",,,"math.NT math.AG",,"  Let $k$ be a field of characteristic zero and ${\bar k}$ an algebraic closure
of $k$. For a geometrically integral variety $X$ over $k$, we write ${\bar
k}(X)$ for the function field of ${\bar X}=X\times_k{\bar k}$. If $X$ has a
smooth $k$-point, the natural embedding of multiplicative groups ${\bar
k}^*\hookrightarrow {\bar k}(X)^* $ admits a Galois-equivariant retraction.
  In the first part of the paper, over local and then over global fields,
equivalent conditions to the existence of such a retraction are given. They are
expressed in terms of the Brauer group of $X$.
  In the second part of the paper, we restrict attention to varieties which are
homogeneous spaces of connected but otherwise arbitrary algebraic groups, with
connected geometric stabilizers. For $k$ local or global, for such a variety
$X$, in many situations but not all, the existence of a Galois-equivariant
retraction to ${\bar k}^*\hookrightarrow {\bar k}(X)^* $ ensures the existence
of a $k$-rational point on $X$. For homogeneous spaces of linear algebraic
groups, the technique also handles the case where $k$ is the function field of
a complex surface.
","[{""version"":""v1"",""created"":""Wed, 22 Nov 2006 16:19:15 GMT""},{""version"":""v2"",""created"":""Mon, 21 Jan 2008 16:23:49 GMT""}]","2021-03-08"
"math/0611701","Eduardo J. Dubuc","Eduardo J. Dubuc and Luis Espa\~nol","Topological functors as familiarly-fibrations","16 pages",,,,"math.CT",,"  In this paper we develop the theory of topological categories over a base
category, that is, a theory of topological functors. Our notion of topological
functor is similar to (but not the same) the existing notions in the literature
(see Borceux ""Handbook of categorical algebra 2, 7.3""), and it aims at the same
examples. In our sense, a (pre) topological functor is a functor that creates
cartesian families. A topological functor is, in particular, a fibration, and
our emphasis is put in this fact.
","[{""version"":""v1"",""created"":""Wed, 22 Nov 2006 16:22:28 GMT""}]","2007-05-23"
"math/0611702","Antonio Azzollini","Antonio Azzollini","A multiplicity result for a semilinear Maxwell type equation","32 pages",,,,"math.AP",,"  In this paper we look for solutions of a semilinear Maxwell type equation, in
even dimension, greater than four. These solutions are critical points of a
functional which is strongly degenerate because of the presence of the exterior
derivative. We prove that, assuming a suitable convexity condition on the
nonlinearity, the equation possesses infinitely many finite energy solutions.
","[{""version"":""v1"",""created"":""Wed, 22 Nov 2006 17:52:23 GMT""},{""version"":""v2"",""created"":""Wed, 22 Nov 2006 21:56:34 GMT""}]","2007-05-23"
"math/0611703","Ruiming Zhang Dr.","Ruiming Zhang","Remarks on Ramanujan Function $A_{q}(z)$","8 pages",,,,"math.CA math.CV",,"  In this short notes we will derive an inequality for scaled $q^{-1}$-Hermite
orthogonal polynomials of Ismail and Masson, an inequality for scaled
Stieltjes-Wigert, two inequalities for Ramanujan function and two definite
integrals for Ramanujan function.
","[{""version"":""v1"",""created"":""Wed, 22 Nov 2006 16:43:51 GMT""},{""version"":""v2"",""created"":""Sat, 25 Nov 2006 09:16:13 GMT""},{""version"":""v3"",""created"":""Wed, 29 Nov 2006 01:28:04 GMT""}]","2007-05-23"
"math/0611704","Vicen\c{t}iu Pa\c{s}ol","Vicentiu Pasol","A Modular Symbol with Values in Cusp Forms",,,,,"math.NT",,"  In [B-G1] and [B-G2], Borisov and Gunnells constructed for each level (N > 1)
and for each weight (k > 1) a modular symbol with values in $Sk(\Gamma_1(N))$
using products of Eisenstein series. In this paper we generalize this result by
producing a modular symbol (for GL2(Q)!!!) with values in locally constant
distributions on M2(Q) taking values in the space of cuspidal power series in
two variables (see Definition 5). We can recover the above cited result by
restricting to a principal open invariant for the action of $\Gamma_1(N)$ and
to the homogeneous degree $k-2$ part of the power series. We should also
mention that Colmez [Col] constructs similar distributions (zEis(k; j)). The
modification in the definition of such distributions allow us to observe
further relations among these distributions (Manin Relations) which in turn
makes possible the existence of our construction. In the last section we
exhibit some instances of these relations for the full modular group.
","[{""version"":""v1"",""created"":""Wed, 22 Nov 2006 16:47:18 GMT""}]","2007-05-23"
"math/0611705","Nikolay Tzvetkov","Jean-Marc Bouclet and Nikolay Tzvetkov","On global Strichartz estimates for non trapping metrics","19 pages, an explanation on the semiclassical local energy decay
  added",,,,"math.AP",,"  We prove global Strichartz estimates (with spectral cutoff on the low
frequencies) for non trapping metric perturbations of the Schroedinger
equation, posed on the Euclidean space.
","[{""version"":""v1"",""created"":""Wed, 22 Nov 2006 17:28:56 GMT""},{""version"":""v2"",""created"":""Wed, 29 Nov 2006 15:34:08 GMT""}]","2007-05-23"
"math/0611706","Shui Feng","Shui Feng","Large deviations for Dirichlet processes and Poisson-Dirichlet
  distributions with two parameters","22 pages",,,,"math.PR",,"  Large deviation principles are established for the two-parameter
Poisson-Dirichlet distribution and two-parameter Dirichlet process when
parameter $\theta$ approaches infinity. The motivation for these results is to
understand the differences in terms of large deviations between the
two-parameter models and their one-parameter counterparts. New insight is
obtained about the role of the second parameter $\alpha$ through a comparison
with the corresponding results for the one-parameter Poisson-Dirichlet
distribution and Dirichlet process.
","[{""version"":""v1"",""created"":""Wed, 22 Nov 2006 19:21:17 GMT""}]","2007-05-23"
"math/0611707","Brendan Guilfoyle","Brendan Guilfoyle and Wilhelm Klingenberg","On area-stationary surfaces in certain neutral Kaehler 4-manifolds","8 pages, AMS-LATEX, no figures","Beitraege Algebra Geom. 49 (2008) 481-490.",,,"math.DG",,"  We study surfaces in TN that are area-stationary with respect to a neutral
Kaehler metric constructed on TN from a riemannian metric g on N. We show that
holomorphic curves in TN are area-stationary, while lagrangian surfaces that
are area-stationary are also holomorphic and hence totally null. However, in
general, area stationary surfaces are not holomorphic. We prove this by
constructing counter-examples. In the case where g is rotationally symmetric,
we find all area stationary surfaces that arise as graphs of sections of the
bundle TN$\to$N and that are rotationally symmetric. When (N,g) is the round
2-sphere, TN can be identified with the space of oriented affine lines in
${\Bbb{R}}^3$, and we exhibit a two parameter family of area-stationary tori
that are neither holomorphic nor lagrangian.
","[{""version"":""v1"",""created"":""Wed, 22 Nov 2006 19:30:53 GMT""}]","2008-11-19"
"math/0611708","Michael Stolz","Beno\^it Collins, Michael Stolz","Borel theorems for random matrices from the classical compact symmetric
  spaces","Published in at http://dx.doi.org/10.1214/07-AOP341 the Annals of
  Probability (http://www.imstat.org/aop/) by the Institute of Mathematical
  Statistics (http://www.imstat.org)","Annals of Probability 2008, Vol. 36, No. 3, 876-895","10.1214/07-AOP341","IMS-AOP-AOP341","math.PR",,"  We study random vectors of the form $(\operatorname
{Tr}(A^{(1)}V),...,\operatorname {Tr}(A^{(r)}V))$, where $V$ is a uniformly
distributed element of a matrix version of a classical compact symmetric space,
and the $A^{(\nu)}$ are deterministic parameter matrices. We show that for
increasing matrix sizes these random vectors converge to a joint Gaussian
limit, and compute its covariances. This generalizes previous work of Diaconis
et al. for Haar distributed matrices from the classical compact groups. The
proof uses integration formulas, due to Collins and \'{S}niady, for polynomial
functions on the classical compact groups.
","[{""version"":""v1"",""created"":""Wed, 22 Nov 2006 20:31:06 GMT""},{""version"":""v2"",""created"":""Thu, 12 Jun 2008 09:48:27 GMT""}]","2016-08-16"
"math/0611709","Laurent Bartholdi","Laurent Bartholdi","On amenability of group algebras, II: graded algebras","12 pages, 1 pdf figure",,,,"math.GR math.RA",,"  This paper continues math.GR/0608302's study of amenability of affine
algebras (based on the notion of almost-invariant finite-dimensional subspace),
and applies it to graded algebras associated with finitely generated groups.
  Due to a mistake in Lemma 4.3, the main statements of the present paper
should not be considered as proven. The results in Sections 2 and 3 are
nevertheless valid.
","[{""version"":""v1"",""created"":""Wed, 22 Nov 2006 20:54:29 GMT""},{""version"":""v2"",""created"":""Wed, 22 Nov 2006 21:18:19 GMT""},{""version"":""v3"",""created"":""Sun, 24 Dec 2006 21:08:00 GMT""},{""version"":""v4"",""created"":""Tue, 1 Apr 2008 21:43:54 GMT""}]","2008-04-02"
"math/0611710","Joerg Zintl","Joerg Zintl","Moduli stacks of permutation classes of pointed stable curves","21 pages",,,,"math.AG",,"  The notion of $m/\Gamma$-pointed stable curves is introduced. It should be
viewed as a generalization of the notion of m-pointed stable curves of a given
genus, where the labels of the marked points are only determined up to the
action of a group of permutations $\Gamma$. The classical moduli spaces and
moduli stacks are generalized to this wider setting. Finally, an explicit
construction of the new moduli stack of $m/\Gamma$-pointed stable curves as a
quotient stack is given.
","[{""version"":""v1"",""created"":""Wed, 22 Nov 2006 21:31:54 GMT""}]","2007-05-23"
"math/0611711","Diana White","Diana White","Gorenstein projective dimension with respect to a semidualizing module","Final version, to appear in Journal of Commutative Algebra",,,,"math.AC math.RA","http://arxiv.org/licenses/nonexclusive-distrib/1.0/","  We introduce and investigate the notion of $\gc$-projective modules over
(possibly non-noetherian) commutative rings, where $C$ is a semidualizing
module. This extends Holm and J{\o}rgensen's notion of $C$-Gorenstein
projective modules to the non-noetherian setting and generalizes projective and
Gorenstein projective modules within this setting. We then study the resulting
modules of finite $\gc$-projective dimension, showing in particular that they
admit $\gc$-projective approximations, a generalization of the maximal
Cohen-Macaulay approximations of Auslander and Buchweitz. Over a local
(noetherian) ring, we provide necessary and sufficient conditions for a
$G_C$-approximation to be minimal.
","[{""version"":""v1"",""created"":""Wed, 22 Nov 2006 22:27:22 GMT""},{""version"":""v2"",""created"":""Fri, 2 Jan 2009 21:56:34 GMT""}]","2009-01-02"
"math/0611712","Vladimir Vershinin","V. V. Vershinin","Braids, their properties and generalizations",,"Published in the Handbook of Algebra, Vol. 4. Edited by
  M.Hazewinkel. North-Holland, Amsterdam, 2006, pp. 427-465",,,"math.GR math.GT",,"  In the paper we give a survey on braid groups and subjects connected with
them. We start with the initial definition, then we give several
interpretations as well as several presentations of these groups. Burau
presentation for the pure braid group and the Markov normal form are given
next. Garside normal form and his solution of the conjugacy problem are
presented as well as more recent results on the ordering and on the linearity
of braid groups. Next topics are the generalizations of braids, their
homological properties and connections with the other mathematical fields, like
knot theory (via Alexander and Markov theorems) and homotopy groups of spheres.
","[{""version"":""v1"",""created"":""Wed, 22 Nov 2006 22:58:12 GMT""}]","2012-02-21"
"math/0611713","Gabriel Indurskis","Gabriel Indurskis (Champlain College St-Lambert)","Culler-Shalen seminorms of fillings of the Whitehead link exterior","34 pages, 3 figures",,,,"math.GT","http://arxiv.org/licenses/nonexclusive-distrib/1.0/","  We determine the total Culler-Shalen seminorms for the 3-manifolds
W_{p/q}:=W(p/q,-) obtained by Dehn filling with slope p/q on one boundary
component of the Whitehead link exterior W when p is odd. As part of the proof,
we use an explicit parametrization of the eigenvalue variety of W to find a
one-variable polynomial whose roots characterize characters of p-reps of
\pi_{1}(W_{p/q}), i.e. representations with values in SL_2(C) which are
parabolic on the peripheral subgroup.
","[{""version"":""v1"",""created"":""Thu, 23 Nov 2006 01:10:24 GMT""},{""version"":""v2"",""created"":""Tue, 17 Mar 2020 05:45:47 GMT""}]","2020-03-18"
"math/0611714","Misha Verbitsky","Ruxandra Moraru, Misha Verbitsky","Stable bundles on hypercomplex surfaces","17 pages. Version 3.0: reference added","Cent. Eur. J. Math. 8 (2010), no. 2, 327--337",,,"math.DG math.AG","http://arxiv.org/licenses/nonexclusive-distrib/1.0/","  A hypercomplex manifold is a manifold equipped with three complex structures
I, J, K satisfying the quaternionic relations. Let M be a 4-dimensional compact
smooth manifold equipped with a hypercomplex structure, and E be a vector
bundle on M. We show that the moduli space of anti-self-dual connections on E
is also hypercomplex, and admits a strong HKT metric. We also study manifolds
with (4,4)-supersymmetry, that is, Riemannian manifolds equipped with a pair of
strong HKT-structures that have opposite torsion. In the language of Hitchin's
and Gualtieri's generalized complex geometry, (4,4)-manifolds are called
``generalized hyperkaehler manifolds''. We show that the moduli space of
anti-self-dual connections on M is a (4,4)-manifold if M is equipped with a
(4,4)-structure.
","[{""version"":""v1"",""created"":""Thu, 23 Nov 2006 02:31:27 GMT""},{""version"":""v2"",""created"":""Tue, 2 Jan 2007 03:44:20 GMT""},{""version"":""v3"",""created"":""Sun, 2 Aug 2009 03:42:50 GMT""}]","2010-08-03"
"math/0611715","Heinrich Massold","Heinrich Massold","Diophantine Approximation on projective Varieties I: Algebraic distance
  and metric B\'ezout Theorem","53 pages, One major error (proof of old Proposition 4.16.3)
  corrected, Calculus slightly simplified",,,,"math.NT math.AG","http://arxiv.org/licenses/nonexclusive-distrib/1.0/","  For two properly intersecting effective cycles in projective space X,Y, and
their intersection product Z, the metric Bezout Theorem relates the degrees,
heights of X,Y, and Z, as well as their distances and algebraic distances to a
given point theta. Applications of this Theorem are in the area of Diophantine
Approximation, giving estimates for approximation properties of Z with respect
to $\theta$ against the ones of X, and Y.
","[{""version"":""v1"",""created"":""Thu, 23 Nov 2006 07:43:12 GMT""},{""version"":""v2"",""created"":""Sun, 26 Nov 2006 19:05:15 GMT""},{""version"":""v3"",""created"":""Tue, 26 Jan 2016 11:03:26 GMT""}]","2016-01-27"
"math/0611716","Michael Huber","Michael Huber","The Classification of Flag-transitive Steiner 4-Designs","26 pages; to appear in: ""Journal of Algebraic Combinatorics""",,"10.1007/s10801-006-0053-0",,"math.CO math.GR",,"  Among the properties of homogeneity of incidence structures flag-transitivity
obviously is a particularly important and natural one. Consequently, in the
last decades also flag-transitive Steiner tdesigns (i.e. flag-transitive
t-(v,k,1) designs) have been investigated, whereas only by the use of the
classification of the finite simple groups has it been possible in recent years
to essentially characterize all flag-transitive Steiner 2-designs. However,
despite the finite simple group classification, for Steiner t-designs with
parameters t > 2 such characterizations have remained challenging open problems
for about 40 years (cf. [11, p. 147] and [12, p. 273], but presumably dating
back to around 1965). The object of the present paper is to give a complete
classification of all flag-transitive Steiner 4-designs. Our result relies on
the classification of the finite doubly transitive permutation groups and is a
continuation of the author's work [20, 21] on the classification of all
flag-transitive Steiner 3-designs.
","[{""version"":""v1"",""created"":""Thu, 23 Nov 2006 11:47:54 GMT""}]","2018-07-03"
"math/0611717","Andrei Vesnin","V. Vershinin, A. Vesnin","Yamada Polynomial and Khovanov Cohomology","12 pages","Proceedings of the International Conference, ""Intelligence of Low
  Dimensional Topology 2006"". World Scientific Publishing Co. in the Knots and
  Everything Book Series. 2007. 337-346",,,"math.GT math.CO",,"  For any graph G we define bigraded cohomology groups whose graded Euler
characteristic is a multiple of the Yamada polynomial of G.
","[{""version"":""v1"",""created"":""Thu, 23 Nov 2006 12:01:06 GMT""},{""version"":""v2"",""created"":""Thu, 30 Nov 2006 22:46:31 GMT""},{""version"":""v3"",""created"":""Thu, 7 Dec 2006 16:12:29 GMT""}]","2012-02-20"
"math/0611718","Sigmund Selberg","Sigmund Selberg and Achenef Tesfahun","Low regularity well-posedness of the Dirac-Klein-Gordon equations in one
  space dimension",,,,,"math.AP",,"  We extend recent results of S. Machihara and H. Pecher on low regularity
well-posedness of the Dirac-Klein-Gordon (DKG) system in one dimension. Our
proof, like that of Pecher, relies on the null structure of DKG, recently
completed by D'Ancona, Foschi and Selberg, but we show that in 1d the argument
can be simplified by modifying the choice of projections for the Dirac
operator. We also show that the result is best possible up to endpoint cases,
if one iterates in Bourgain-Klainerman-Machedon spaces.
","[{""version"":""v1"",""created"":""Thu, 23 Nov 2006 12:04:14 GMT""}]","2007-05-23"
"math/0611719","Sigmund Selberg","Sigmund Selberg","Global well-posedness below the charge norm for the Dirac-Klein-Gordon
  system in one space dimension",,,,,"math.AP",,"  We prove global well-posedness below the charge norm (i.e., the $L^2$ norm of
the Dirac spinor) for the Dirac-Klein-Gordon system of equations (DKG) in one
space dimension. Adapting a method due to Bourgain, we split off the high
frequency part of the initial data for the spinor, and exploit nonlinear
smoothing effects to control the evolution of the high frequency part. To prove
the nonlinear smoothing we rely on the null structure of the DKG system, and
bilinear estimates in Bourgain-Klainerman-Machedon spaces.
","[{""version"":""v1"",""created"":""Thu, 23 Nov 2006 12:15:20 GMT""}]","2007-05-23"
"math/0611720","Daniela Bertacchi","Daniela Bertacchi, Gustavo Posta, Fabio Zucca","Ecological equilibrium for restrained branching random walks","Published in at http://dx.doi.org/10.1214/105051607000000203 the
  Annals of Applied Probability (http://www.imstat.org/aap/) by the Institute
  of Mathematical Statistics (http://www.imstat.org)","Annals of Applied Probability 2007, Vol. 17, No. 4, 1117-1137","10.1214/105051607000000203","IMS-AAP-AAP433","math.PR",,"  We study a generalized branching random walk where particles breed at a rate
which depends on the number of neighboring particles. Under general assumptions
on the breeding rates we prove the existence of a phase where the population
survives without exploding. We construct a nontrivial invariant measure for
this case.
","[{""version"":""v1"",""created"":""Thu, 23 Nov 2006 12:32:59 GMT""},{""version"":""v2"",""created"":""Fri, 19 Oct 2007 07:22:51 GMT""}]","2009-09-29"
"math/0611721","Claudio Landim","J. Beltr\'an, C. Landim","A lattice gas model for the incompressible Navier-Stokes equation",,,,,"math.PR math-ph math.MP",,"  We recover the Navier-Stokes equation as the incompressible limit of a
stochastic lattice gas in which particles are allowed to jump over a mesoscopic
scale. The result holds in any dimension assuming the existence of a smooth
solution of the Navier-Stokes equation in a fixed time interval. The proof does
not use non-gradient methods or the multi-scale analysis due to the long range
jumps.
","[{""version"":""v1"",""created"":""Thu, 23 Nov 2006 12:40:11 GMT""}]","2007-05-23"
"math/0611723","Bakhrom Omirov Abdazovich","J.R. G\'omez, R.M. Navarro, B. A. Omirov","On Nilpotent Leibniz Superalgebras","24 pages",,,,"math.RA math.AG",,"  The aim of this work is to present the first problems that appear in the
study of nilpotent Leibniz superalgebras. These superalgebras and so the
problems, will be considered as a natural generalization of nilpotent Leibniz
algebras and Lie superalgebras.
","[{""version"":""v1"",""created"":""Thu, 23 Nov 2006 13:22:17 GMT""}]","2016-08-16"
