"astro-ph/0609645","Vladimir Karas","V. Karas","Theoretical aspects of relativistic spectral features","To appear in Astronomische Nachrichten in the proceedings of the
  XMM-Newton workshop ""Variable and Broad Iron Lines around Black Holes"" (26-28
  June 2006, Madrid), eds. A. C. Fabian and N. Schartel","Astron.Nachr.327:961-968,2006","10.1002/asna.200610672",,"astro-ph",,"  The inner parts of black-hole accretion discs shine in X-rays which can be
monitored and the observed spectra can be used to trace strong gravitational
fields in the place of emission and along paths of light rays. This paper
summarizes several aspects of how the spectral features are influenced by
relativistic effects. We focus our attention onto variable and broad emission
lines, origin of which can be attributed to the presence of orbiting patterns
-- spots and spiral waves in the disc. We point out that the observed spectrum
can determine parameters of the central black hole provided the intrinsic local
emissivity is constrained by theoretical models.
","[{""version"":""v1"",""created"":""Sat, 23 Sep 2006 16:16:25 GMT""}]","2011-05-10"
"astro-ph/0609646","Keigo Enya","K. Enya, S. Tanaka, L. Abe, T. Nakagawa","Laboratory Experiment of Checkerboard Pupil Mask Coronagraph","6 pages, 6 figures",,"10.1051/0004-6361:20066351",,"astro-ph",,"  We present the results of the first laboratory experiment of checkerboard
shaped pupil binary mask coronagraphs using visible light, in the context of
the R&D activities for future mid-infrared space missions such as the 3.5 m
SPICA telescope. The primary aim of this work is to demonstrate the
coronagraphic performance of checkerboard masks down to a $10^{-6}$
peak-to-peak contrast, which is required to detect self-luminous extra-solar
planets in the mid-infrared region. Two masks, consisting of aluminum films on
a glass substrates, were manufactured using nano-fabrication techniques with
electron beam lithography: one mask was optimized for a pupil with a 30%
central obstruction and the other was for a pupil without obstruction. The
theoretical contrast for both masks was $10^{-7}$ and no adaptive optics system
was employed. For both masks, the observed point spread functions were quite
consistent with the theoretical ones. The average contrast measured within the
dark regions was $2.7 {\times} 10^{-7}$ and $1.1 {\times} 10^{-7}$. The
coronagraphic performance significantly outperformed the $10^{-6}$ requirement
and almost reached the theoretical limit determined by the mask designs. We
discuss the potential application of checkerboard masks for mid-infrared
coronagraphy, and conclude that binary masks are promising for future
high-contrast space telescopes.
","[{""version"":""v1"",""created"":""Sat, 23 Sep 2006 17:03:53 GMT""}]","2009-11-11"
"astro-ph/0609647","Luis Julian Goicoechea","L. J. Goicoechea, A. Ullan (Univ. Cantabria, Spain), J. E. Ovaldsen
  (Univ. Oslo, Norway), E. Koptelova (Moscow Univ., Russia), V. N. Shalyapin
  (NAS, Ukraine) and R. Gil-Merino (Univ. Sydney, Australia)","Gravitationally Lensed QSOs: Optical Monitoring with the EOCA and the
  Liverpool Telescope (LT)","To appear in ""Highlights of Spanish Astrophysics IV"" (Springer, eds.
  F. Figueras, J.M. Girart, M. Hernanz, C. Jordi). Proceedings of the VII
  Scientific Meeting of the Spanish Astronomical Society (SEA), held in
  Barcelona, September 12-15, 2006",,,,"astro-ph",,"  The aim of this contribution is to present the two first phases of the
optical monitoring programme of the Gravitational Lenses group at the
Universidad de Cantabria (GLUC, http://grupos.unican.es/glendama/). In an
initial stage (2003 March-June), the Estacion de Observacion de Calar Alto
(EOCA) was used to obtain VR frames of SBS 0909+532 and QSO 0957+561. These
observations in 2003 led to accurate fluxes of the two components of both
double QSOs, which are being compared and complemented with data from other
1-1.5 m telescopes located in the North Hemisphere: Fred Lawrence Whipple
Observatory (USA), Maidanak Observatory (Uzbekistan) and Wise Observatory
(Israel). On the other hand, the GLUC started the second phase of its
monitoring programme in 2005 January. In this second phase, they are using the
2 m fully robotic Liverpool Telescope (LT). The key idea is the two-band
photometric follow-up of four lensed QSOs with different main lensing galaxies:
SBS 0909+532 (elliptical), QSO 0957+561 (giant cD), B1600+434 (edge-on spiral)
and QSO 2237+0305 (face-on spiral). Thus, the light rays associated with the
components of the four gravitational mirages cross different galaxy
environments, and the corresponding light curves could unveil the content of
these environments. While SBS 0909+532 and QSO 0957+561 are the targets for the
two first years with the LT (2005-2006), the rest of targets (B1600+434 and QSO
2237+0305) will be monitored starting from 2007.
","[{""version"":""v1"",""created"":""Sat, 23 Sep 2006 17:11:42 GMT""}]","2007-05-23"
"astro-ph/0609648","Kelle Cruz","Kelle L. Cruz, I. Neill Reid, J. Davy Kirkpatrick, Adam J. Burgasser,
  James Liebert, Adam R. Solomon, Sarah J. Schmidt, Peter R. Allen, Suzanne L.
  Hawley, and Kevin R. Covey","Meeting the Cool Neighbors. IX. The Luminosity Function of M7-L8
  Ultracool Dwarfs in the Field","Accepted to AJ","Astron.J.133:439-467,2007","10.1086/510132",,"astro-ph",,"  We present a 20-pc, volume-limited sample of M7-L8 dwarfs created through
spectroscopic follow-up of sources selected from the Two Micron All Sky Survey
(2MASS) Second Incremental Release Point Source Catalog. In this paper, we
present optical spectroscopy of 198 candidate nearby ultracool dwarfs,
including 12 late-M and L dwarfs likely to be within 20 pc of the Sun and 94
more distant late-type dwarfs. We have also identified five ultracool dwarfs
with spectral signatures of low-gravity. Combining these data with previous
results, we define a sample of 99 ultracool dwarfs in 91 systems within 20 pc.
These are used to estimate the J- and K-band luminosity functions for dwarfs
with optical spectral types between M7 and L8 (10.5<M_J<15, 9.5<M_K<13). We
find a space density of 4.9 x 10^-3 pc^-3 for late-M dwarfs (M7-M9.5) and a
lower limit of 3.8 x 10^-3 pc^-3 for L dwarfs.
","[{""version"":""v1"",""created"":""Sat, 23 Sep 2006 21:16:57 GMT""}]","2008-11-26"
"astro-ph/0609649","Epele Luis","Luis N. Epele, Huner Fanchiotti, Carlos A. Garc\'ia Canal, Amalio F.
  Pacheco, Jaime Sa\~nudo","Venus Atmosphere Profile from a Maximum Entropy Principle","6 pages, 3 figures","Nonlin.Proc.Geophys.14:641,2007","10.5194/npg-14-641-2007",,"astro-ph",,"  The variational method with constraints recently developed by Verkley and
Gerkema to describe maximum-entropy atmospheric profiles is generalized to
ideal gases but with temperature-dependent specific heats. In so doing, an
extended and non standard potential temperature is introduced that is well
suited for tackling the problem under consideration. This new formalism is
successfully applied to the atmosphere of Venus. Three well defined regions
emerge in this atmosphere up to a height of $100 km$ from the surface: the
lowest one up to about $35 km$ is adiabatic, a transition layer located at the
height of the cloud deck and finally a third region which is practically
isothermal.
","[{""version"":""v1"",""created"":""Sun, 24 Sep 2006 04:09:08 GMT""}]","2016-08-15"
"astro-ph/0609651","Matthias Liebendoerfer","M. Liebendoerfer, U.-L. Pen, C. Thompson","Efficient approximations of neutrino physics for three-dimensional
  simulations of stellar core collapse","5 pages, 4 figures, in Proceedings of ""Nuclei in the Cosmos IX,
  Geneva, Jun 25-30"", associated movies are displayed at
  http://www.physik.unibas.ch/~liebend/display","PoSNIC-IX:132,2006",,,"astro-ph",,"  Neutrino transport in spherically symmetric models of stellar core collapse
and bounce has achieved a technically complete level, rewarded by the agreement
among independent groups that a multi-dimensional treatment of the
fluid-instabilities in the post-bounce phase is indispensable to model
supernova explosions. While much effort is required to develop a reliable
neutrino transport technique in axisymmetry, we explore neutrino physics
approximations and parameterizations for an efficient three-dimensional
simulation of the fluid-instabilities in the shock-heated matter that
accumulates between the accretion shock and the protoneutron star. We
demonstrate the reliability of a simple parameterization scheme in the collapse
phase and extend our 3D magneto-hydrodynamical collapse simulations to a
preliminary postbounce evolution. The growth of magnetic fields is
investigated.
","[{""version"":""v1"",""created"":""Sun, 24 Sep 2006 07:54:05 GMT""}]","2008-11-26"
"cond-mat/0609608","Ignacio Urrutia","Ignacio Urrutia","Two hard spheres in a spherical pore: Exact analytic results in two and
  three dimensions","def printed version","Journal of Statistical Physics 131, 597 (2008)","10.1007/s10955-088-9513-3",,"cond-mat.stat-mech",,"  The partition function and the one- and two-body distribution functions are
evaluated for two hard spheres with different sizes constrained into a
spherical pore. The equivalent problem for hard disks is addressed too. We
establish a relation valid for any dimension between these partition functions,
second virial coefficient for inhomogeneous systems in a spherical pore, and
third virial coefficients for polydisperse hard spheres mixtures. Using the
established relation we were able to evaluate the cluster integral $b_{2}(V)$
related with the second virial coefficient for the Hard Disc system into a
circular pore. Finally, we analyse the behaviour of the obtained expressions
near the maximum density.
","[{""version"":""v1"",""created"":""Sat, 23 Sep 2006 17:43:27 GMT""},{""version"":""v2"",""created"":""Thu, 19 Oct 2006 19:12:18 GMT""},{""version"":""v3"",""created"":""Mon, 28 Apr 2008 18:22:53 GMT""}]","2010-05-07"
"cond-mat/0609609","Yang Liu","Yang Liu and Karin A. Dahmen","Random Field Ising Model In and Out of Equilibrium","4 pages, 2 figures. submitted to Phys. Rev. Lett","2009 EPL 86 56003","10.1209/0295-5075/86/56003",,"cond-mat.stat-mech cond-mat.dis-nn",,"  We present numerical studies of zero-temperature Gaussian random-field Ising
model (zt-GRFIM) in both equilibrium and non-equilibrium. We compare the
no-passing rule, mean-field exponents and universal quantities in 3D (avalanche
critical exponents, fractal dimensions, scaling functions and anisotropy
measures) for the equilibrium and non-equilibrium disorder-induced phase
transitions. We show compelling evidence that the two transitions belong to the
same universality class.
","[{""version"":""v1"",""created"":""Sat, 23 Sep 2006 19:51:58 GMT""},{""version"":""v2"",""created"":""Wed, 27 Dec 2006 19:23:48 GMT""}]","2013-01-01"
"cond-mat/0609610","Christoph Bruder","W. Belzig, C. Bruder, Yu.V. Nazarov","Overscreening Diamagnetism in Cylindrical Superconductor-Normal
  Metal-Heterostructures",,"J. Low Temp. Phys. 147, 441 (2007)","10.1007/s10909-007-9326-9",,"cond-mat.supr-con",,"  We study the linear diamagnetic response of a superconducting cylinder coated
by a normal-metal layer due to the proximity effect using the clean limit
quasiclassical Eilenberger equations. We compare the results for the
susceptibility with those for a planar geometry. Interestingly, for $R\sim d$
the cylinder exhibits a stronger overscreening of the magnetic field, i.e., at
the interface to the superconductor it can be less than (-1/2) of the applied
field. Even for $R\gg d$, the diamagnetism can be increased as compared to the
planar case, viz. the magnetic susceptibility $4\pi\chi$ becomes smaller than
-3/4. This behaviour can be explained by an intriguing spatial oscillation of
the magnetic field in the normal layer.
","[{""version"":""v1"",""created"":""Sat, 23 Sep 2006 20:21:46 GMT""}]","2015-06-25"
"cond-mat/0609611","Guihua Chen","Guihua Chen, Zhibing Li, Jie Peng, Chunshan He, Weiliang Wang, Shaozhi
  Deng, Ningsheng Xu, Chongyu Wang, Shanying Wang, Xiao Zheng, GuanHua Chen,
  Tao Yu","Atomic decoration for improving the efficiency of field electron
  emission of carbon nanotubes","8 pages, 9 figures, LaTeX; content changed, typos corrected,
  references added",,,,"cond-mat.mtrl-sci cond-mat.other",,"  The field electron emission from the single-walled carbon nanotubes with
their open ends terminated by -BH, -NH, and -O has been simulated. The
apex-vacuum barrier and the emission current have been calculated. It has been
found that -BH and -NH suppress the apex-vacuum barrier significantly and lead
to higher emission current in contrast to the -O terminated structure in the
same applied field. The calculated binding energy implies that the carbon
nanotubes terminated with -BH and -NH are more stable than those saturated by
oxygen atoms or by hydrogen atoms.
","[{""version"":""v1"",""created"":""Sun, 24 Sep 2006 04:26:06 GMT""},{""version"":""v2"",""created"":""Fri, 9 Feb 2007 14:36:24 GMT""}]","2007-05-23"
"cond-mat/0609612","Motohiko Ezawa","Motohiko Ezawa","Supersymmetry and Correlated Electrons in Graphene Quantum Hall Effect","5 pages, 2 figures","Physica E 40, 269 (2007)","10.1016/j.physe.2007.06.038",,"cond-mat.mes-hall cond-mat.str-el",,"  We present a supersymmetric description of the quantum Hall effect (QHE) in
graphene. The noninteracting system is supersymmetric separately at the
so-called K and K' points of the Brillouin zone corners. Its essential
consequence is that the energy levels and the Landau levels are different
objects in graphene QHE. Each energy level has a four-fold degeneracy within
the noninteracting theory. With the Coulomb interaction included, an excitonic
gap opens in the zero-energy state, while each nonzero energy level splits into
two levels since up-spin and down-spin electrons come from different Landau
levels. We argue the emergence of the plateaux at $\nu =\pm (4n-2)$ for small
magnetic field $B$ and at $\nu =0$, $\pm 1$, $\pm 2n$ for large $B$ with $n$
natural numbers.
","[{""version"":""v1"",""created"":""Sun, 24 Sep 2006 03:05:47 GMT""}]","2007-12-15"
"cond-mat/0609613","Satish Malik","R. N. Parmar, J. H. Markna, and D. G. Kuberkar, Ravi Kumar, D. S.
  Rana, Vivas C. Bagve and S. K. Malik","Swift-heavy-ion-irradiation-induced enhancement in electrical
  conductivity of chemical solution deposited La0.7Ba0.3MnO3 thin films","To appear in 'Applied Physics Letters'",,"10.1063/1.2359291",,"cond-mat.mtrl-sci",,"  Epitaxial thin films of La0.7Ba0.3MnO3 manganite, deposited using Chemical
Solution Deposition technique, were irradiated by 200 MeV Ag+15 ions with a
maximum ion dose up to 1x10^12 ions/cm2. Temperature- and magnetic
field-dependent resistivity measurements on all the films (before and after
irradiation) reveal a sustained decrease in resistivity with increasing ion
dose. A maximum dose of 1x10^12 ions/cm2 suppresses resistivity by factors of 3
and 10, at 330 K [insulator-metal (I-M) transition] and at 10 K, respectively.
On the other hand, with increasing ion dose, the magnetoresistance (MR)
enhances in the vicinity of I-M transition but decreases at low temperatures.
These results, corroborated by surface morphology of films, suggest that the
origin of such properties lies in the irradiation induced improved
crystallinity and epitaxial orientation, enhanced connectivity between grains,
and conglomeration of grains which result in better conductivity at grain
boundaries.
","[{""version"":""v1"",""created"":""Sun, 24 Sep 2006 06:14:21 GMT""}]","2009-11-11"
"cond-mat/0609614","Jiansong Gao","Jiansong Gao (1), Benjamin A. Mazin (1), Peter K. Day (2), Jonas
  Zmuidzinas (1), Henry G. LeDuc (2) ((1) California Institute of Technology,
  (2) Jet Propulsion Laboratory)","Noise Properties of Superconducting Coplanar Waveguide Microwave
  Resonators","4 pages, 3 figures, accepted for publication in Applied Physics
  Letters",,"10.1063/1.2711770",,"cond-mat.supr-con",,"  We have measured noise in thin-film superconducting coplanar waveguide
resonators. This noise appears entirely as phase noise, equivalent to a jitter
of the resonance frequency. In contrast, amplitude fluctuations are not
observed at the sensitivity of our measurement. The ratio between the noise
power in the phase and amplitude directions is large, in excess of 30 dB. These
results have important implications for resonant readouts of various devices
such as detectors, amplifiers, and qubits. We suggest that the phase noise is
due to two-level systems in dielectric materials.
","[{""version"":""v1"",""created"":""Sun, 24 Sep 2006 07:42:17 GMT""},{""version"":""v2"",""created"":""Fri, 2 Feb 2007 23:34:19 GMT""}]","2015-06-25"
"cond-mat/0609615","Hiromi Kashiwaya","H. Kashiwaya, T. Matsumoto, H. Shibata, S. Kashiwaya, H. Eisaki, Y.
  Yoshida, S. Kawabata, and Y. Tanaka","Switching Dynamics of Bi$_{2}$Sr$_{2}$CaCu$_{2}$O$_{8+\delta}$ Intrinsic
  Josephson junctions: Macroscopic Quantum Tunneling and Self-Heating Effect","10pages, 7figures, will be published for Journal of the Physical
  Society of Japan (JPSJ)","J. Phys. Soc. Jpn. 77, 104708 (2008)","10.1143/JPSJ.77.104708",,"cond-mat.supr-con","http://arxiv.org/licenses/nonexclusive-distrib/1.0/","  The switching dynamics of current-biased
Bi$_{2}$Sr$_{2}$CaCu$_{2}$O$_{8+\delta}$ intrinsic Josephson junctions (IJJs)
was studied to clarify the effect of d-wave superconductivity and the stack
structure on the switching properties. High quality IJJs were fabricated, and
then the temperature dependence of the switching probability distribution was
measured for the first and second switchings. Although the standard deviation
of the distribution detected for both switchings showed similar saturation
characteristics with decreasing temperature, the temperature at saturation was
about 13 times higher for the second switching than for the first switching.
The properties of the first switching can be explained in terms of a
conventional underdamped JJ, that is, macroscopic quantum tunneling below the
crossover temperature, and thermal activation with quality factor of 70$\pm$20
above the crossover temperature. In contrast, the relatively higher effective
temperature for the second switching evaluated from the switching probability
distribution suggests a dominant thermal activation process under the influence
of the self-heating effect even at sufficiently low temperature.
","[{""version"":""v1"",""created"":""Sun, 24 Sep 2006 14:44:40 GMT""},{""version"":""v2"",""created"":""Wed, 23 Jul 2008 13:08:07 GMT""}]","2008-11-07"
"cs/0609131","Ran Ren","Ran Ren, Madan mohan Manokar, Yaogang Shi, Baoyu Zheng","A Fast Block Matching Algorithm for Video Motion Estimation Based on
  Particle Swarm Optimization and Motion Prejudgment","10 pages, 12 figures, submitted to ACM Symposium of Applied
  Computing(SAC)",,,,"cs.MM",,"  In this paper, we propose a fast 2-D block-based motion estimation algorithm
called Particle Swarm Optimization - Zero-motion Prejudgment(PSO-ZMP) which
consists of three sequential routines: 1)Zero-motion prejudgment. The routine
aims at finding static macroblocks(MB) which do not need to perform remaining
search thus reduces the computational cost; 2)Predictive image coding and 3)PSO
matching routine. Simulation results obtained show that the proposed PSO-ZMP
algorithm achieves over 10 times of computation less than Diamond Search(DS)
and 5 times less than the recent proposed Adaptive Rood Pattern
Searching(ARPS). Meanwhile the PSNR performances using PSO-ZMP are very close
to that using DS and ARPS in some less-motioned sequences. While in some
sequences containing dense and complex motion contents, the PSNR performances
of PSO-ZMP are several dB lower than that using DS and ARPS but in an
acceptable degree.
","[{""version"":""v1"",""created"":""Sun, 24 Sep 2006 09:55:57 GMT""}]","2007-05-23"
"gr-qc/0609108","John Stachel","John Stachel","Prolegomena to any future Quantum Gravity","26 pages",,,,"gr-qc",,"  I shall discuss some ""conditions of possibility"" of a quantum theory of
gravity, stressing the need for solutions to some of fundamental problems
confronting any attempt to apply some method of quantization to the field
equations of general relativity.
","[{""version"":""v1"",""created"":""Sat, 23 Sep 2006 22:25:45 GMT""}]","2007-05-23"
"gr-qc/0609109","Amber Stuver","Amber L. Stuver and Lee Samuel Finn","GravEn: Software for the simulation of gravitational wave detector
  network response","10 Pages, 3 Figures, Presented at the 10th Gravitational Wave Data
  Analysis Workshop (GWDAW-10), 14-17 December 2005 at the University of Texas,
  Brownsville","Class.Quant.Grav. 23 (2006) S799-S807","10.1088/0264-9381/23/19/S18","LIGO-P060038-00-Z","gr-qc",,"  Physically motivated gravitational wave signals are needed in order to study
the behaviour and efficacy of different data analysis methods seeking their
detection. GravEn, short for Gravitational-wave Engine, is a MATLAB software
package that simulates the sampled response of a gravitational wave detector to
incident gravitational waves. Incident waves can be specified in a data file or
chosen from among a group of pre-programmed types commonly used for
establishing the detection efficiency of analysis methods used for LIGO data
analysis. Every aspect of a desired signal can be specified, such as start time
of the simulation (including inter-sample start times), wave amplitude, source
orientation to line of sight, location of the source in the sky, etc. Supported
interferometric detectors include LIGO, GEO, Virgo and TAMA.
","[{""version"":""v1"",""created"":""Sun, 24 Sep 2006 03:06:43 GMT""}]","2007-05-23"
"gr-qc/0609110","Amber Stuver","Amber L. Stuver and Lee Samuel Finn","A First Comparison of SLOPE and Other LIGO Burst Event Trigger
  Generators","10 Pages, 5 Figures, Presented at the 10th Gravitational Wave Data
  Analysis Workshop (GWDAW-10), 14-17 December 2005 at the University of Texas,
  Brownsville","Class.Quant.Grav. 23 (2006) S733-S740","10.1088/0264-9381/23/19/S12","LIGO-P060037-00-Z","gr-qc",,"  A number of different methods have been proposed to identify unanticipated
burst sources of gravitational waves in data arising from LIGO and other
gravitational wave detectors. When confronted with such a wide variety of
methods one is moved to ask if they are all necessary, i.e. given detector data
that is assumed to have no gravitational wave signals present, do they
generally identify the same events with the same efficiency, or do they each
'see' different things in the detector? Here we consider three different
methods, which have been used within the LIGO Scientific Collaboration as part
of its search for unanticipated gravitational wave bursts. We find that each of
these three different methods developed for identifying candidate gravitational
wave burst sources are, in fact, attuned to significantly different features in
detector data, suggesting that they may provide largely independent lists of
candidate gravitational wave burst events.
","[{""version"":""v1"",""created"":""Sun, 24 Sep 2006 03:13:19 GMT""}]","2007-05-23"
"hep-ex/0609042","Wan-Ting Chen","W.T.Chen, et al. (for the Belle Collaboration)","A study of gamma gamma -> Ks Ks production at energies of 2.4-4.0GeV at
  Belle","15 pages, 5 figures, published in PLB 651, 15 (2007)","Phys.Lett.B651:15-21,2007","10.1016/j.physletb.2007.05.059","BELLE-CONF-0660, Belle preprint 2007-20, KEK Preprint 2007-7","hep-ex",,"  $K^0_SK^0_S$ production in two-photon collisions has been studied using a
397.6 fb$^{-1}$ data sample collected with the Belle detector at the KEKB
$e^+e^-$ collider. For the first time the cross sections are measured in the
two-photon center-of-mass energy range between 2.4 GeV and 4.0 GeV and angular
range $|\cos\theta^*|<0.6$. Combining the results with measurements of
$\gamma\gamma\to K^+K^-$ from Belle, we observe that the cross section ratio
$\sigma(K^0_SK^0_S)/\sigma(K^+K^-)$ decreases from ~0.13 to ~0.01 with
increasing energy. Signals for the $\chi_{c0}$ and $\chi_{c2}$ charmonium
states are also observed.
","[{""version"":""v1"",""created"":""Sun, 24 Sep 2006 06:29:36 GMT""},{""version"":""v2"",""created"":""Mon, 16 Apr 2007 13:51:58 GMT""},{""version"":""v3"",""created"":""Thu, 12 Jul 2007 08:15:01 GMT""}]","2019-08-14"
"math-ph/0609064","Gil Schieber","E. Isasi (CPT), Gil Schieber (CBPF, LPTP)","From modular invariants to graphs: the modular splitting method","28 pages, 7 figures. Version 2: updated references. Typos corrected.
  su(2) example has been removed to shorten the paper. Dual annular matrices
  for the rejected exceptional su(3) diagram are determined","J.Phys.A40:6513-6538,2007","10.1088/1751-8113/40/24/016",,"math-ph hep-th math.MP math.QA",,"  We start with a given modular invariant M of a two dimensional su(n)_k
conformal field theory (CFT) and present a general method for solving the
Ocneanu modular splitting equation and then determine, in a step-by-step
explicit construction, 1) the generalized partition functions corresponding to
the introduction of boundary conditions and defect lines; 2) the quantum
symmetries of the higher ADE graph G associated to the initial modular
invariant M. Notice that one does not suppose here that the graph G is already
known, since it appears as a by-product of the calculations. We analyze several
su(3)_k exceptional cases at levels 5 and 9.
","[{""version"":""v1"",""created"":""Sun, 24 Sep 2006 08:24:06 GMT""},{""version"":""v2"",""created"":""Fri, 1 Jun 2007 09:43:07 GMT""}]","2008-11-26"
