"astro-ph/0605336","C. P. Dullemond","C.P. Dullemond, A. Natta and L. Testi","Accretion in protoplanetary disks: the imprint of core properties","Accepted for publication in Astrophysical Journal Letters","Astrophys.J. 645 (2006) L69-L72","10.1086/505744",,"astro-ph",,"  In this Letter we present a theoretical scenario to explain the steep
correlation between disk accretion rates and stellar masses observed in
pre-main sequence stars. We show that the correlations and spread observed in
the two best studied regions, rho-Ophiuchus and Taurus, can be reproduced by a
simple model of single star formation from a rotating collapsing core and the
viscous evolution of the circumstellar disk. In this model, the rate of
rotation of the parent core sets the value of the `centrifugal radius' within
which the infalling matter is loaded onto the surface of the disk. As a
consequence, the disk accretion rate measured long after the dispersal of the
parental core bears the imprint of the initial conditions of star formation.
The observed trend results naturally if, at the onset of the collapse, cores of
all masses rotate with the same distribution of angular velocities, measured in
units of the break-up rotation rate.
","[{""version"":""v1"",""created"":""Sat, 13 May 2006 11:20:49 GMT""}]","2009-11-11"
"cond-mat/0605316","Zohar Nussinov","Zohar Nussinov, Gerardo Ortiz","Symmetry and Topological Order","10 pages, 2 figures. Minimal changes relative to published version-
  most notably the above shortened title (which was too late to change upon
  request in the galley proofs). An elaborate description of all of the results
  in this article appeared in subsequent works, principally in
  arXiv:cond-mat/0702377 which was published in the Annals of Physics 324, 977-
  1057 (2009)","Proceedings of the National Academy of Sciences, vol. 106, issue
  40, pp. 16944-16949 (2009)","10.1073/pnas.0803726105",,"cond-mat.str-el cond-mat.stat-mech hep-th math-ph math.MP quant-ph","http://arxiv.org/licenses/nonexclusive-distrib/1.0/","  We prove sufficient conditions for Topological Quantum Order at both zero and
finite temperatures. The crux of the proof hinges on the existence of
low-dimensional Gauge-Like Symmetries (that notably extend and differ from
standard local gauge symmetries) and their associated defects, thus providing a
unifying framework based on a symmetry principle. These symmetries may be
actual invariances of the system, or may emerge in the low-energy sector.
Prominent examples of Topological Quantum Order display Gauge-Like Symmetries.
New systems exhibiting such symmetries include Hamiltonians depicting
orbital-dependent spin exchange and Jahn-Teller effects in transition metal
orbital compounds, short-range frustrated Klein spin models, and p+ip
superconducting arrays. We analyze the physical consequences of Gauge-Like
Symmetries (including topological terms and charges), discuss associated
braiding, and show the insufficiency of the energy spectrum, topological
entanglement entropy, maximal string correlators, and fractionalization in
establishing Topological Quantum Order. General symmetry considerations
illustrate that not withstanding spectral gaps, thermal fluctuations may impose
restrictions on certain suggested quantum computing schemes and lead to
""thermal fragility"". Our results allow us to go beyond standard topological
field theories and engineer systems with Topological Quantum Order.
","[{""version"":""v1"",""created"":""Fri, 12 May 2006 17:22:54 GMT""},{""version"":""v2"",""created"":""Fri, 30 Mar 2007 04:00:57 GMT""},{""version"":""v3"",""created"":""Wed, 22 Oct 2014 16:16:03 GMT""}]","2014-10-24"
"cond-mat/0605339","Dor Ben-Amotz","Dor Ben-Amotz and J. M. Honig","The Rectified Second Law of Thermodynamics","24 pages, no figures",,,,"cond-mat.stat-mech",,"  Equilibrium thermodynamics is combined with Jarzynski's irreversible work
theorem to quantify the excess entropy produced by irreversible processes. The
resulting rectified form of the second law parallels the first law, in the
sense that it facilitates the experimental measurement of excess entropy
changes resulting from irreversible work and heat exchanges, just as the first
law quantifies energy changes produced by either reversible or irreversible
work and heat exchanges. The general form of the rectified second law is
further applied to a sub-class of quasi-static irreverisble (QSI) processes,
for which all the thermodynamic functions of both the system and surroundings
remain continuously well-defined, thus facilitating excess entropy measurements
by integrating exact differential functions along QSI paths. The results are
illustrated by calculating the mechanical and thermal excess entropy produced
by the irreversible unfolding of an RNA molecule.
","[{""version"":""v1"",""created"":""Fri, 12 May 2006 19:49:05 GMT""},{""version"":""v2"",""created"":""Mon, 29 May 2006 15:29:45 GMT""}]","2007-05-23"
"cond-mat/0605345","Michael Karbach","Mitsuhiro Arikawa, Michael Karbach, Gerhard Muller, and Klaus Wiele","Spinon excitations in the XX chain: spectra, transition rates,
  observability","19 pages, 10 figures",,"10.1088/0305-4470/39/34/002",,"cond-mat.str-el",,"  The exact one-to-one mapping between (spinless) Jordan-Wigner lattice
fermions and (spin-1/2) spinons is established for all eigenstates of the
one-dimensional s = 1=2 XX model on a lattice with an even or odd number N of
lattice sites and periodic boundary conditions. Exact product formulas for the
transition rates derived via Bethe ansatz are used to calculate asymptotic
expressions of the 2-spinon and 4-spinon parts (for large even N) as well as of
the 1-spinon and 3-spinon parts (for large odd N) of the dynamic spin structure
factors. The observability of these spectral contributions is assessed for
finite and infinite N.
","[{""version"":""v1"",""created"":""Fri, 12 May 2006 16:53:23 GMT""}]","2009-11-11"
"cond-mat/0605346","I. L. Landau","I. L. Landau, R. Khasanov, K. Togano, H. Keller","Temperature dependences of the upper critical field and the
  Ginzburg-Landau parameter of Li2Pd3B from magnetization measurements","5 pages, 6 figures. Minor changes have been made",,"10.1016/j.physc.2006.11.007",,"cond-mat.supr-con",,"  We present temperature dependences of the upper critical magnetic field and
the Ginzburg-Landau parameter for a ternary boride superconductor Li_2Pd_3B
obtained from magnetization measurements. A specially developed scaling
approach was used for the data analysis. The resulting H_c2(T) curve turns out
to be surprisingly close to predictions of the BCS theory. The magnetic field
penetration depth, evaluated in this work, is in excellent agreement with
recent muon-spin-rotation experiments. We consider this agreement as an
important proof of the validity of our approach.
","[{""version"":""v1"",""created"":""Fri, 12 May 2006 16:47:15 GMT""},{""version"":""v2"",""created"":""Wed, 2 Aug 2006 13:53:37 GMT""},{""version"":""v3"",""created"":""Wed, 18 Oct 2006 17:54:46 GMT""}]","2015-06-25"
"cond-mat/0605347","Andres Santos","Alexandr Malijevsky, Santos B. Yuste, and Andres Santos","How `sticky' are short-range square-well fluids?","14 pages, including 3 tables and 14 figures; v2: typo in Eq. (5.1)
  corrected, Fig. 14 redone, to be published in JCP","J. Chem. Phys. 125, 074507 (2006)","10.1063/1.2244549",,"cond-mat.stat-mech cond-mat.soft physics.chem-ph",,"  The aim of this work is to investigate to what extent the structural
properties of a short-range square-well (SW) fluid of range $\lambda$ at a
given packing fraction and reduced temperature can be represented by those of a
sticky-hard-sphere (SHS) fluid at the same packing fraction and an effective
stickiness parameter $\tau$. Such an equivalence cannot hold for the radial
distribution function since this function has a delta singularity at contact in
the SHS case, while it has a jump discontinuity at $r=\lambda$ in the SW case.
Therefore, the equivalence is explored with the cavity function $y(r)$.
Optimization of the agreement between $y_{\sw}$ and $y_{\shs}$ to first order
in density suggests the choice for $\tau$. We have performed Monte Carlo (MC)
simulations of the SW fluid for $\lambda=1.05$, 1.02, and 1.01 at several
densities and temperatures $T^*$ such that $\tau=0.13$, 0.2, and 0.5. The
resulting cavity functions have been compared with MC data of SHS fluids
obtained by Miller and Frenkel [J. Phys: Cond. Matter 16, S4901 (2004)].
Although, at given values of $\eta$ and $\tau$, some local discrepancies
between $y_{\sw}$ and $y_{\shs}$ exist (especially for $\lambda=1.05$), the SW
data converge smoothly toward the SHS values as $\lambda-1$ decreases. The
approximate mapping $y_{\sw}\to y_{\shs}$ is exploited to estimate the internal
energy and structure factor of the SW fluid from those of the SHS fluid. Taking
for $y_{\shs}$ the solution of the Percus--Yevick equation as well as the
rational-function approximation, the radial distribution function $g(r)$ of the
SW fluid is theoretically estimated and a good agreement with our MC
simulations is found. Finally, a similar study is carried out for short-range
SW fluid mixtures.
","[{""version"":""v1"",""created"":""Fri, 12 May 2006 17:10:53 GMT""},{""version"":""v2"",""created"":""Mon, 10 Jul 2006 14:33:19 GMT""}]","2007-05-23"
"cond-mat/0605348","Vladimir Miransky","V.P. Gusynin, V.A. Miransky, S.G. Sharapov, and I.A. Shovkovy","Excitonic gap, phase transition, and quantum Hall effect in graphene","Revtex4, 10 pages, 4 figures, text essentially extended, one figure
  and references added; v3: to match PRB version","Phys.Rev.B74:195429,2006","10.1103/PHYSREVB.74.195429","UWO-TH-06/8","cond-mat.str-el cond-mat.mes-hall hep-ph",,"  We suggest that physics underlying the recently observed removal of
sublattice and spin degeneracies in graphene in a strong magnetic field
describes a phase transition connected with the generation of an excitonic gap.
The experimental form of the Hall conductivity is reproduced and the main
characteristics of the dynamics are described. Predictions of the behavior of
the gap as a function of temperature and a gate voltage are made.
","[{""version"":""v1"",""created"":""Fri, 12 May 2006 18:59:16 GMT""},{""version"":""v2"",""created"":""Wed, 23 Aug 2006 14:48:36 GMT""},{""version"":""v3"",""created"":""Thu, 23 Nov 2006 17:59:10 GMT""}]","2008-11-26"
"cond-mat/0605349","Yuri Zuev","Y. L. Zuev, I. Hetel and T. R. Lemberger","Search for Cooper-pair Fluctuations in Severely Underdoped YBCO Films","3 pages, 2 figures",,"10.1103/PhysRevB.74.012502",,"cond-mat.supr-con",,"  The preformed-pairs theory of pseudogap physics in high-$T_C$ superconductors
predicts a nonanalytic $T$-dependence for the $ab$-plane superfluid fraction,
$\rho_S$, at low temperatures in underdoped cuprates. We report high-precision
measurements of $\rho_S(T)$ on severely underdoped YBa$_2$Cu$_3$O$_{6+x}$ and
Y$_{0.8}$Ca$_{0.2}$Ba$_2$Cu$_3$O$_{6+x}$ films. At low $T$, $\rho_S$ looks more
like $1 - T^2$ than $1 - T^{3/2}$, in disagreement with theory.
","[{""version"":""v1"",""created"":""Fri, 12 May 2006 19:53:06 GMT""}]","2009-11-11"
"cond-mat/0605350","Evgeni Burovski","Evgeni Burovski, Nikolay Prokof'ev, Boris Svistunov and Matthias
  Troyer","The Fermi-Hubbard model at unitarity","v2: minor corrections, fig 7 replaced","New J.Phys.8:153,2006","10.1088/13=",,"cond-mat.supr-con cond-mat.stat-mech",,"  We simulate the dilute attractive Fermi-Hubbard model in the unitarity regime
using a diagrammatic determinant Monte Carlo algorithm with worm-type updates.
We obtain the dependence of the critical temperature on the filling factor
$\nu$ and, by extrapolating to $\nu \to 0$, determine the universal critical
temperature of the continuum unitary Fermi gas in units of Fermi energy:
$T_c/\epsilon_F=0.152(7)$. We also determine the thermodynamic functions and
show how the Monte Carlo results can be used for accurate thermometry of a
trapped unitary gas.
","[{""version"":""v1"",""created"":""Fri, 12 May 2006 20:41:41 GMT""},{""version"":""v2"",""created"":""Tue, 6 Jun 2006 15:53:22 GMT""}]","2009-04-08"
"cond-mat/0605352","M Zahid Hasan","D. Qian, L. Wray, D. Hsieh, D. Wu, L.J. Luo, N.L. Wang, A. Fedorov,
  R.J. Cava, L. Viciu, M.Z. Hasan","Quasiparticle coherence and the nature of the metal-insulator phase
  transition in Na$_x$CoO$_2$","4+ pages, 5 figures","Phys. Rev. Lett. 96, 046407 (2006)","10.1103/PhysRevLett.96.046407",,"cond-mat.str-el cond-mat.supr-con",,"  Layered cobaltates embody novel realizations of correlated quantum matter on
a spin-1/2 triangular lattice. We report a high-resolution systematic
photoemission study of the insulating cobaltates (Na1/2CoO2 and K1/2CoO2).
Observation of single-particle gap opening and band-folding provides direct
evidence of anisotropic particle-hole instability on the Fermi surface due to
its unique topology. Kinematic overlap of the measured Fermi surface is
observed with the $\sqrt{3}$x$\sqrt{3}$ cobalt charge-order Brillouin zone near
x=1/3 but not at x=1/2 where insulating transition is actually observed. Unlike
conventional density-waves, charge-stripes or band insulators, the on-set of
the gap depends on the quasiparticle's quantum coherence which is found to
occur well below the disorder-order symmetry breaking temperature of the
crystal (the first known example of its kind).
","[{""version"":""v1"",""created"":""Sat, 13 May 2006 04:50:22 GMT""}]","2009-11-11"
"cond-mat/0605353","M. Ebrahim Fouladvand","MirFaez Miri, Zeinab Sadjadi and M. Ebrahim Fouladvand","Persistent random walk on a site-disordered one-dimensional lattice:
  Photon subdiffusion","Revtex, 3 eps figures","Phys. Rev. E 73, 031115 (2006)","10.1103/PhysRevE.73.031115",,"cond-mat.stat-mech",,"  We study the persistent random walk of photons on a one-dimensional lattice
of random transmittances. Transmittances at different sites are assumed
independent, distributed according to a given probability density $f(t)$.
Depending on the behavior of $f(t)$ near $t=0$, diffusive and subdiffusive
transports are predicted by the disorder expansion of the mean
square-displacement and the effective medium approximation. Monte Carlo
simulations confirm the anomalous diffusion of photons. To observe photon
subdiffusion experimentally, we suggest a dielectric film stack for realization
of a distribution $f(t)$.
","[{""version"":""v1"",""created"":""Sat, 13 May 2006 07:12:36 GMT""}]","2007-05-23"
"cond-mat/0605354","Vadim Loktev","Yu.V. Skrypnyk and V.M. Loktev","Impurity effects in a two--dimensional system with Dirac spectrum","4 pages, 1 figure",,"10.1103/PhysRevB.73.241402",,"cond-mat.dis-nn",,"  It is demonstrated that in a two--band 2D system the resonance state is
manifested close to the energy of the Dirac point in the electron spectrum for
the sufficiently large impurity perturbation. With increasing the impurity
concentration, the electron spectrum undergoes the rearrangement, which is
characterized by the opening of the broad quasi--gap in the vicinity of the
nodal point. If the critical concentration for the spectrum rearrangement is
not reached, the domain of localized states remains exponentially small
compared to the bandwidth.
","[{""version"":""v1"",""created"":""Sat, 13 May 2006 10:17:36 GMT""}]","2009-11-11"
"cond-mat/0605361","Yongjin Jiang","Yongjin Jiang and Liangbin Hu","Scattering wave function approach to multi-terminal mesoscopic system
  with spin-orbit coupling",,,,,"cond-mat.mes-hall",,"  In this paper,we present a detailed formulation to solve the scattering wave
function for a multi-terminal mesoscopic system with spin-orbit coupling. In
addition to terminal currents, all local quantities can be calculated
explicitly by taking proper ensemble average in the Landauer-Buttiker's spirit
using the scattering wave functions. Based on this formulation, we derive some
rigorous results for equilibrium state. Furthermore, some new symmetry
relations are found for the typical two terminal structure in which a
semiconductor bar with Rashba or/and Dresselhaus SO coupling is sandwiched
symmetrically between two leads. These symmetry property can provide accuracy
tests for experimental measurements and numerical calculations.
","[{""version"":""v1"",""created"":""Sat, 13 May 2006 14:35:02 GMT""}]","2007-05-23"
"cs/0605056","Rajkumar Buyya","Chee Shin Yeo, Marcos Dias de Assuncao, Jia Yu, Anthony Sulistio,
  Srikumar Venugopal, Martin Placek, and Rajkumar Buyya","Utility Computing and Global Grids","23 pages",,,"Technical Report, GRIDS-TR-2006-7, Grid Computing and Distributed
  Systems Laboratory, The University of Melbourne, Australia, April 13, 2006","cs.DC",,"  This chapter focuses on the use of Grid technologies to achieve utility
computing. An overview of how Grids can support utility computing is first
presented through the architecture of Utility Grids. Then, utility-based
resource allocation is described in detail at each level of the architecture.
Finally, some industrial solutions for utility computing are discussed.
","[{""version"":""v1"",""created"":""Fri, 12 May 2006 20:36:45 GMT""}]","2007-05-23"
"gr-qc/0605078","Matteo Carrera","Matteo Carrera and Domenico Giulini","On Doppler tracking in cosmological spacetimes","10 pages, 1 figure. Journal version","Class.Quant.Grav. 23 (2006) 7483-7492","10.1088/0264-9381/23/24/019","Freiburg THEP-06/06","gr-qc astro-ph physics.space-ph",,"  We give a rigorous derivation of the general-relativistic formula for the
two-way Doppler tracking of a spacecraft in Friedmann-Lemaitre-Robertson-Walker
and in McVittie spacetimes. The leading order corrections of the so-determined
acceleration to the Newtonian acceleration are due to special-relativistic
effects and cosmological expansion. The latter, although linear in the Hubble
constant, is negligible in typical applications within the Solar System.
","[{""version"":""v1"",""created"":""Fri, 12 May 2006 19:45:38 GMT""},{""version"":""v2"",""created"":""Fri, 21 Jul 2006 16:18:18 GMT""},{""version"":""v3"",""created"":""Mon, 20 Nov 2006 14:54:31 GMT""}]","2007-05-23"
"gr-qc/0605079","P Ajith","P. Ajith, M. Hewitson, J. R. Smith and K. A. Strain","Robust vetoes for gravitational-wave burst triggers using known
  instrumental couplings","14 Pages, 8 Figures, To appear in Class. Quantum Grav","Class.Quant.Grav.23:5825-5837,2006","10.1088/0264-9381/23/20/005","AEI-2006-030","gr-qc",,"  The search for signatures of transient, unmodelled gravitational-wave (GW)
bursts in the data of ground-based interferometric detectors typically uses
`excess-power' search methods. One of the most challenging problems in the
burst-data-analysis is to distinguish between actual GW bursts and spurious
noise transients that trigger the detection algorithms. In this paper, we
present a unique and robust strategy to `veto' the instrumental glitches. This
method makes use of the phenomenological understanding of the coupling of
different detector sub-systems to the main detector output. The main idea
behind this method is that the noise at the detector output (channel H) can be
projected into two orthogonal directions in the Fourier space -- along, and
orthogonal to, the direction in which the noise in an instrumental channel X
would couple into H. If a noise transient in the detector output originates
from channel X, it leaves the statistics of the noise-component of H orthogonal
to X unchanged, which can be verified by a statistical hypothesis testing. This
strategy is demonstrated by doing software injections in simulated Gaussian
noise. We also formulate a less-rigorous, but computationally inexpensive
alternative to the above method. Here, the parameters of the triggers in
channel X are compared to the parameters of the triggers in channel H to see
whether a trigger in channel H can be `explained' by a trigger in channel X and
the measured transfer function.
","[{""version"":""v1"",""created"":""Fri, 12 May 2006 17:30:24 GMT""},{""version"":""v2"",""created"":""Wed, 16 Aug 2006 16:54:20 GMT""}]","2009-11-11"
"gr-qc/0605080","Timothy Sumner","M. B. Gerrard and T. J. Sumner","The effect of a fifth large-scale space-time dimension on orbital
  dynamics","15 pages, 9 figures Updated to include Pioneer Anomaly - 1 additional
  figure",,,,"gr-qc",,"  A model based on simple assumptions about 4-dimensional space-time being
closed and isotropic, and embedded in a 5th large-scale dimension, r,
representing the radius of curvature of space-time, has been used in an
application of Newton's Second Law to describe a system with angular momentum.
It has been found that the equations of MOND used to explain the rotation
curves of galaxies appear as a limit within this derivation and that there is a
universal acceleration constant, ao, with a value, again consistent with that
used by MOND. This approach does not require modification of Newtonian
dynamics, only its extension into a fifth large-scale dimension. The transition
from the classical Newtonian dynamics to the MOND regime emerges naturally and
without the introduction of arbitrary fitting functions, if this 5-dimensional
model is adopted. The paper also includes the derivation of an effect in
5-dimensional orbital dynamics which is in reasonable agreement with the
observed Pioneer Anomaly.
","[{""version"":""v1"",""created"":""Fri, 12 May 2006 17:25:09 GMT""},{""version"":""v2"",""created"":""Wed, 10 Oct 2007 12:29:31 GMT""}]","2007-10-10"
"gr-qc/0605081","Bela Lukacs","Nora Fay and B. Lukacs","On a Possible Indicator of Homogeneity of the Universe",,,,,"gr-qc",,"  A new method is described for recognising internal non-randomness in deep
galaxy surveys.
","[{""version"":""v1"",""created"":""Fri, 12 May 2006 19:34:27 GMT""}]","2007-05-23"
"gr-qc/0605082","Roman Konoplya","R. A. Konoplya, A. Zhidenko","Perturbations and quasi-normal modes of black holes in Einstein-Aether
  theory","6 pages, 3 figures, RevTex, to be published in Phys. Lett. B","Phys.Lett. B644 (2007) 186-191","10.1016/j.physletb.2006.11.036",,"gr-qc",,"  We develop a new method for calculation of quasi-normal modes of black holes,
when the effective potential, which governs black hole perturbations, is known
only numerically in some region near the black hole. This method can be applied
to perturbations of a wide class of numerical black hole solutions. We apply it
to the black holes in the Einstein-Aether theory, a theory where general
relativity is coupled to a unit time-like vector field, in order to observe
local Lorentz symmetry violation. We found that in the non-reduced
Einstein-Aether theory, real oscillation frequency and damping rate of
quasi-normal modes are larger than those of Schwarzschild black holes in the
Einstein theory.
","[{""version"":""v1"",""created"":""Fri, 12 May 2006 22:22:19 GMT""},{""version"":""v2"",""created"":""Sun, 9 Jul 2006 13:02:00 GMT""},{""version"":""v3"",""created"":""Tue, 29 Aug 2006 21:40:30 GMT""},{""version"":""v4"",""created"":""Wed, 25 Oct 2006 14:21:54 GMT""},{""version"":""v5"",""created"":""Sun, 19 Nov 2006 18:43:06 GMT""}]","2009-11-11"
"gr-qc/0605083","Sabine Hossenfelder","S. Hossenfelder","Cosmological Consequences of Anti-gravitation","are welcome",,,,"gr-qc",,"  The dynamics of a universe with an anti-gravitating contribution to the
matter content is examined. The modified Friedmann equations are derived, and
it is shown that anti-gravitating radiation is the slowest component to dilute
when the universe expands. Assuming an interaction between both kinds of matter
which becomes important at Planckian densities, it is found that the universe
undergoes a periodic cycle of contraction and expansion. Furthermore, the
possibility of energy loss in our universe through separation of both types of
matter is discussed.
","[{""version"":""v1"",""created"":""Fri, 12 May 2006 21:10:15 GMT""}]","2007-05-23"
"hep-ex/0605038","Diego Tonelli","Diego Tonelli (for the CDF Collaboration)","CDF Hot Topics","write-up for the proceedings of the ""Flavor Physics & CP Violation
  Conference, Vancouver, 2006"". 9 pages, 10 figures, to be published in the
  Electronic Conference Proceedings Archive","ECONF C060409:001,2006",,"fpcp06_112","hep-ex",,"  After an introduction on the peculiarities of flavor-physics measurements at
a hadron collider, and on the upgraded Collider Detector at Fermilab (CDF II),
I show recent results on two-body B0 and B0s decays into charged,
pseudo-scalar, charmless mesons or into muons, to illustrate how the flavor
physics program at CDF is competitive with (in B0 decays) and complementary (in
B0s decays) to B-factories. Results shown include the new measurement of the
CP-violating asymmetry in B0-->K+pi- decays, the first measurement of the
time-evolution of B0s-->K+K- decays, and the world best limits on the decay
rates of rare B0/B0s-->mu+mu- modes.
","[{""version"":""v1"",""created"":""Fri, 12 May 2006 16:18:19 GMT""}]","2019-08-14"
