"hep-ex/0605039","Brant M. Johnson","PHENIX Collaboration, S.S. Adler, et al","Jet Properties from Dihadron Correlations in p+p Collisions at
  sqrt(s)=200 GeV","330 authors, 27 pages, 31 figures, 12 tables. Submitted to Physical
  Review D. Plain text data tables for the points plotted in figures for this
  and previous PHENIX publications are (or will be) publicly available at
  http://www.phenix.bnl.gov/papers.html","Phys.Rev.D74:072002,2006","10.1103/PhysRevD.74.072002",,"hep-ex",,"  The properties of jets produced in p+p collisions at sqrt(s)=200 GeV are
measured using the method of two particle correlations. The trigger particle is
a leading particle from a large transverse momentum jet while the associated
particle comes from either the same jet or the away-side jet. Analysis of the
angular width of the near-side peak in the correlation function determines the
jet fragmentation transverse momentum j_T . The extracted value, sqrt(<j_T^2>)=
585 +/- 6(stat) +/- 15(sys) MeV/c, is constant with respect to the trigger
particle transverse momentum, and comparable to the previous lower sqrt(s)
measurements. The width of the away-side peak is shown to be a convolution of
j_T with the fragmentation variable, z, and the partonic transverse momentum,
k_T . The <z> is determined through a combined analysis of the measured pi^0
inclusive and associated spectra using jet fragmentation functions measured in
e^+e^-. collisions. The final extracted values of k_T are then determined to
also be independent of the trigger particle transverse momentum, over the range
measured, with value of sqrt(<k_T^2>) = 2.68 +/- 0.07(stat) +/- 0.34(sys)
GeV/c.
","[{""version"":""v1"",""created"":""Fri, 12 May 2006 20:43:15 GMT""}]","2008-11-26"
"hep-ex/0605040","David M. Asner","David M. Asner","On the Case for a Super Tau-Charm Factory","15 pages, Contributed to the International Workshop on Discoveries in
  Flavour Physics at e+e- Colliders (DIF 06), Frascati, Italy, 28 Feb - 3 Mar,
  2006","FrascatiPhys.Ser.41:377-392,2006",,,"hep-ex",,"  Design studies for a Super Flavor Factory (SFF), an asymmetric energy e+e-
collider utilizing International Linear Collider (ILC) techniques and
technology, are in progress. The capablity to run at center-of-mass energies
near 3.770 GeV could be included in the initial design. This report discusses
the physics that can be probed with luminosity of 10^{35} 1/cm^2 1/s near
tau-charm threshold.
","[{""version"":""v1"",""created"":""Sat, 13 May 2006 04:12:50 GMT""},{""version"":""v2"",""created"":""Sat, 20 May 2006 14:15:48 GMT""}]","2008-11-26"
"hep-ph/0605139","Antonio Faccia","L. Calibbi, A. Faccia, A. Masiero, S. K. Vempati","Lepton Flavour Violation from SUSY--GUTs: Where do we stand for MEG,
  PRISM/PRIME and a Super Flavour factory","revtex4, 21 pages 14 figures; v2: some figures changed, small changes
  in the text and references added","Phys.Rev.D74:116002,2006","10.1103/PhysRevD.74.116002","DFPD-06/TH-07, CPHT-RR022.0506","hep-ph",,"  We analyse the complementarity between Lepton Flavour Violation (LFV) and LHC
experiments in probing the Supersymmetric (SUSY) Grand Unified Theories (GUT)
when neutrinos got a mass via the see--saw mechanism. Our analysis is performed
in an SO(10) framework, where at least one neutrino Yukawa coupling is
necessarily as large as the top Yukawa coupling. Our study thoroughly takes
into account the whole RG running, including the GUT and the right handed
neutrino mass scales, as well as the running of the observable neutrino
spectrum. We find that the upcoming (MEG, SuperKEKB) and future (PRISM/PRIME,
Super Flavour factory) LFV experiments will be able to test such SUSY framework
for SUSY masses to be explored at the LHC and, in some cases, even beyond the
LHC sensitivity reach.
","[{""version"":""v1"",""created"":""Fri, 12 May 2006 17:21:24 GMT""},{""version"":""v2"",""created"":""Tue, 29 Aug 2006 13:43:39 GMT""}]","2008-11-26"
"hep-ph/0605151","Tetsuo Shindou","S. T. Petcov and T. Shindou","Charged Lepton Decays L_i to L_j + gamma, Leptogenesis CP-Violating
  Parameters and Majorana Phases","27 pages, 5 figures, version to be published in Physical Review D","Phys.Rev.D74:073006,2006","10.1103/PhysRevD.74.073006","SISSA 26/2006/EP","hep-ph",,"  We analyse the dependence of the rates of the LFV charged lepton decays mu to
e + gamma, tau to e + gamma, tau to mu + gamma (l_i to l_j + gamma) and their
ratios, predicted in the class of SUSY theories with see-saw mechanism of
nu-mass generation and soft SUSY breaking with universal boundary conditions at
the GUT scale, on the Majorana CP-violation phases in the PMNS neutrino mixing
matrix and the ``leptogenesis'' CP-violating (CPV) parameters. The case of
quasi-degenerate in mass heavy Majorana neutrinos is considered. The analysis
is performed for normal hierarchical (NH), inverted hierarchical (IH) and
quasi-degenerate (QD) light neutrino mass spectra. We show, in particular, that
for NH and IH nu-mass spectrum and negligible lightest neutrino mass, all three
l_i to l_j + gamma decay branching ratios, BR(l_i to l_j + gamma), depend on
one Majorana phase, one leptogenesis CPV parameter and on the 3-neutrino
oscillation parameters; if the CHOOZ mixing angle theta_13 is sufficiently
large, they depend on the Dirac CPV phase in the PMNS matrix. The ``double
ratios'' R(21/31) sim BR(mu to e + gamma)/BR(tau to e + gamma) and R(21/32) sim
BR(mu to e + gamma)/BR(tau to mu + gamma) are determined by these parameters.
The same Majorana phase enters into the NH and IH expressions for the effective
Majorana mass in neutrinoless double beta decay, <m>.
","[{""version"":""v1"",""created"":""Fri, 12 May 2006 17:47:21 GMT""},{""version"":""v2"",""created"":""Wed, 7 Jun 2006 16:24:18 GMT""},{""version"":""v3"",""created"":""Wed, 27 Sep 2006 12:29:48 GMT""}]","2008-11-26"
"hep-ph/0605152","Stephen Godfrey","Stephen Godfrey (Carleton University)","The XYZ's of c\bar{c}: Hints of Exotic New Mesons","Invited talk at ""Flavour Physics and CP Violation Conference,""
  Vancouver, 2006, 7 pages. To be published Electronic Conference Proceedings
  Archive","ECONF C060409:015,2006",,"FPCP06_221","hep-ph hep-ex",,"  I discuss the nature of the new charm and charmonium like states observed in
the last few years and measurements that can test these assignments. In
particular it appears that the X(3943) is the eta_c''(3^1S_0) which can be
tested by looking for it in gamma gamma to D\bar{D}^*, the Y(3943) is the
chi_{c1}'(2^3P_1) which can be tested by looking for it in D\bar{D} and
D\bar{D}^*, the Z(3930) is the chi_{c2}'(2^3P_2) which can be confirmed by
looking for it in D\bar{D}^*. If the X(3872) is confirmed to have J^{PC}=1^{++}
it is almost certainly a multiquark state while if its J^{PC} is found to be
2^{-+} is is likely the 1^1D_2 state. The Y(4260) appears to be an extra 1^{--}
which is most easily explained as a charmonium hybrid. This can be tested by
looking the DD_1 final state.
","[{""version"":""v1"",""created"":""Fri, 12 May 2006 18:58:09 GMT""}]","2011-03-23"
"hep-ph/0605154","Sebastian Sapeta","S.Sapeta","DGLAP improved saturation model with heavy flavours","4 pages, 2 figures; Talk presented at the 41th Rencontres de Moriond
  on QCD and High Energy Hadronic Interactions, La Thuile, Italy, March 18-25,
  2006",,,,"hep-ph",,"  The DGLAP improved saturation model of Bartels, Golec and Kowalski is
supplemented by the contribution from the heavy quarks: charm and beauty. It is
shown to give good description of both the total proton structure function F2
and, as a prediction, the heavy quarks contribution F2c and F2b. The reasonable
agreement for the longitudinal and diffractive structure functions is also
found.
","[{""version"":""v1"",""created"":""Sat, 13 May 2006 10:17:07 GMT""}]","2007-05-23"
"hep-ph/0605155","Adrian Palcu","Adrian Palcu","Implementing Canonical Seesaw Mechanism in a 3-3-1 Gauge Model without
  Exotic Electric Charges","7 pages, no figures","Mod.Phys.Lett. A21 (2006) 2591-2598","10.1142/S0217732306021566",,"hep-ph",,"  We prove that - even at a low TeV scale - the canonical seesaw mechanism can
be naturally implemented in the exact solution of a particular 3-3-1 gauge
model, since a very small alteration $\epsilon$ in the parameter matrix of the
Higgs sector is taken into account. Therefore, this new parameter can act as an
appropriate mass source for neutrinos, while - due to the main parameter $a$ -
all the previously achieved results in the exact solution of the model are
recovered. Moreover, this mathematical artifice does separate the boson mass
spectrum from the neutrino mass issue, hence giving more flexibility in tuning
the model. Possible phenomenological results and their implications - such as
dark matter plausible candidates that can occur - are also briefly discussed.
","[{""version"":""v1"",""created"":""Sat, 13 May 2006 10:36:32 GMT""}]","2009-08-01"
"hep-th/0605128","Fu-Wen Shu","Fu-Wen Shu, You-Gen Shen","Perturbative Calculation of Quasinormal Modes of $d$--Dimensional Black
  Holes","49 pages, 5 figures","JHEP0608:087,2006","10.1088/1126-6708/2006/08/087",,"hep-th",,"  We study analytically quasinormal modes in a wide variety of black hole
spacetimes, including $d$--dimensional asymptotically flat spacetimes and
non-asymptotically flat spacetimes (particular attention has been paid to the
four dimensional case). We extend the analytical calculation to include
first-order corrections to analytical expressions for quasinormal mode
frequencies by making use of a monodromy technique. All possible type
perturbations are included in this paper. The calculation performed in this
paper show that systematic expansions for uncharged black holes include
different corrections with the ones for charged black holes. This difference
makes them have a different $n$--dependence relation in the first-order
correction formulae. The method applied above in calculating the first-order
corrections of quasinormal mode frequencies seems to be unavailable for black
holes with small charge. This result supports the Neitzke's prediction. On what
concerns quantum gravity we confirm the view that the $\ln3$ in $d=4$
Schwarzschild seems to be nothing but some numerical coincidences.
","[{""version"":""v1"",""created"":""Fri, 12 May 2006 16:08:18 GMT""},{""version"":""v2"",""created"":""Wed, 24 May 2006 01:57:12 GMT""},{""version"":""v3"",""created"":""Wed, 20 Sep 2006 11:51:07 GMT""}]","2009-11-11"
"hep-th/0605130","Thomas Heinzl","Thomas Heinzl and Oliver Schroeder","Large orders in strong-field QED","26 pages, 6 figures","J.Phys.A39:11623-11646,2006","10.1088/0305-4470/39/37/018",,"hep-th hep-ph",,"  We address the issue of large-order expansions in strong-field QED. Our
approach is based on the one-loop effective action encoded in the associated
photon polarisation tensor. We concentrate on the simple case of crossed fields
aiming at possible applications of high-power lasers to measure vacuum
birefringence. A simple next-to-leading order derivative expansion reveals that
the indices of refraction increase with frequency. This signals normal
dispersion in the small-frequency regime where the derivative expansion makes
sense. To gain information beyond that regime we determine the factorial growth
of the derivative expansion coefficients evaluating the first 80 orders by
means of computer algebra. From this we can infer a nonperturbative imaginary
part for the indices of refraction indicating absorption (pair production) as
soon as energy and intensity become (super)critical. These results compare
favourably with an analytic evaluation of the polarisation tensor asymptotics.
Kramers-Kronig relations finally allow for a nonperturbative definition of the
real parts as well and show that absorption goes hand in hand with anomalous
dispersion for sufficiently large frequencies and fields.
","[{""version"":""v1"",""created"":""Fri, 12 May 2006 16:55:14 GMT""}]","2009-11-11"
"hep-th/0605132","Andrei Barvinsky","A.O.Barvinsky and A.Yu.Kamenshchik","Cosmological Landscape From Nothing: Some Like It Hot","Final version, to appear in JCAP","JCAP 0609 (2006) 014","10.1088/1475-7516/2006/09/014",,"hep-th",,"  We suggest a novel picture of the quantum Universe -- its creation is
described by the {\em density matrix} defined by the Euclidean path integral.
This yields an ensemble of universes -- a cosmological landscape -- in a mixed
state which is shown to be dynamically more preferable than the pure quantum
state of the Hartle-Hawking type. The latter is dynamically suppressed by the
infinitely large positive action of its instanton, generated by the conformal
anomaly of quantum fields within the cosmological bootstrap (the
self-consistent back reaction of hot matter). This bootstrap suggests a
solution to the problem of boundedness of the on-shell cosmological action and
eliminates the infrared catastrophe of small cosmological constant in Euclidean
quantum gravity. The cosmological landscape turns out to be limited to a
bounded range of the cosmological constant $\Lambda_{\rm min}\leq \Lambda \leq
\Lambda_{\rm max}$. The domain $\Lambda<\Lambda_{\rm min}$ is ruled out by the
back reaction effect which we analyze by solving effective Euclidean equations
of motion. The upper cutoff is enforced by the quantum effects of vacuum energy
and the conformal anomaly mediated by a special ghost-avoidance renormalization
of the effective action. They establish a new quantum scale $\Lambda_{\rm max}$
which is determined by the coefficient of the topological Gauss-Bonnet term in
the conformal anomaly. This scale is realized as the upper bound -- the
limiting point of an infinite sequence of garland-type instantons which
constitute the full cosmological landscape. The dependence of the cosmological
constant range on particle phenomenology suggests a possible dynamical
selection mechanism for the landscape of string vacua.
","[{""version"":""v1"",""created"":""Fri, 12 May 2006 20:38:13 GMT""},{""version"":""v2"",""created"":""Tue, 18 Jul 2006 17:57:40 GMT""},{""version"":""v3"",""created"":""Wed, 13 Sep 2006 17:19:13 GMT""}]","2009-11-11"
"hep-th/0605133","Andjelo Samsarov","Stjepan Meljanac, Marko Stojic","New realizations of Lie algebra kappa-deformed Euclidean space","30 pages, Latex, accepted for publication in Eur.Phys.J.C, some typos
  corrected","Eur.Phys.J.C47:531-539,2006","10.1140/epjc/s2006-02584-8",,"hep-th",,"  We study Lie algebra $\kappa$-deformed Euclidean space with undeformed
rotation algebra $SO_a(n)$ and commuting vectorlike derivatives. Infinitely
many realizations in terms of commuting coordinates are constructed and a
corresponding star product is found for each of them. The $\kappa$-deformed
noncommutative space of the Lie algebra type with undeformed Poincar{\'e}
algebra and with the corresponding deformed coalgebra is constructed in a
unified way.
","[{""version"":""v1"",""created"":""Sat, 13 May 2006 11:50:06 GMT""},{""version"":""v2"",""created"":""Wed, 19 Dec 2007 17:22:55 GMT""}]","2009-01-07"
"math-ph/0605042","Peter Hislop","Jean V. Bellissard, Peter D. Hislop","Smoothness of Correlations in the Anderson Model at Strong Disorder",,,"10.1007/s00023-006-0297-1",,"math-ph math.MP",,"  We study the higher-order correlation functions of covariant families of
observables associated with random Schr\""odinger operators on the lattice in
the strong disorder regime. We prove that if the distribution of the random
variables has a density analytic in a strip about the real axis, then these
correlation functions are analytic functions of the energy outside of the
planes corresponding to coincident energies. In particular, this implies the
analyticity of the density of states, and of the current-current correlation
function outside of the diagonal. Consequently, this proves that the
current-current correlation function has an analytic density outside of the
diagonal at strong disorder.
","[{""version"":""v1"",""created"":""Fri, 12 May 2006 18:01:52 GMT""}]","2009-11-11"
"math-ph/0605043","Marco Bertola","M. Bertola, M. Y. Mo","Commuting difference operators, spinor bundles and the asymptotics of
  orthogonal polynomials with respect to varying complex weights","70 pages, 20 figures, minor corrections, added figure. v3: changes
  suggested by referee. Several typos corrected, improved presentation and some
  added comments and references",,,"CRM-3217 (2006)","math-ph math.MP",,"  The paper has three parts. In the first part we apply the theory of commuting
pairs of (pseudo) difference operators to the (formal) asymptotics of
orthogonal polynomials: using purely geometrical arguments we show
heuristically that the asymptotics, for large degrees, of orthogonal polynomial
with respect to varying weights is intimately related to certain spinor bundles
on a hyperelliptic algebraic curve reproducing formulae appearing in the works
of Deift et al. on the subject.
  In the second part we show that given an arbitrary nodal hyperelliptic curve
satisfying certain conditions of admissibility we can reconstruct a sequence of
polynomials orthogonal with respect to semiclassical complex varying weights
supported on several curves in the complex plane. The strong asymptotics of
these polynomials will be shown to be given by the spinors introduced in the
first part using a Riemann-Hilbert analysis.
  In the third part we use Strebel theory of quadratic differentials and the
procedure of welding to reconstruct arbitrary admissible hyperelliptic curves.
As a result we can obtain orthogonal polynomials whose zeroes may become dense
on a collection of Jordan arcs forming an arbitrary forest of trivalent
loop-free trees.
","[{""version"":""v1"",""created"":""Sat, 13 May 2006 00:16:29 GMT""},{""version"":""v2"",""created"":""Mon, 19 Jun 2006 11:02:15 GMT""},{""version"":""v3"",""created"":""Tue, 11 Dec 2007 06:36:07 GMT""}]","2009-12-05"
"math/0605333","Vadim Schechtman","O.Ogievetsky, V.Schechtman","Une intersection de quadriques li\'ee \`a la suite de Sturm","The title is slightly changed and a reference added","Algebra, Arithmetic, and Geometry, Progress in Mathematics 270
  (Birkhauser 2009) 637-659",,,"math.RA",,"  We introduce an algebra given by quadratic relations in an algebra of
polynomials in an infinite number of variables. Using this algebra, we prove
some explicit formulas for the Sturm sequence of a polynomial.
","[{""version"":""v1"",""created"":""Fri, 12 May 2006 17:33:43 GMT""},{""version"":""v2"",""created"":""Wed, 24 May 2006 11:09:17 GMT""},{""version"":""v3"",""created"":""Thu, 14 Sep 2006 13:53:55 GMT""}]","2011-05-19"
"math/0605343","Daniele Arcara","D. Arcara, F. Sato","Recursive formula for psi^g - lambda_1 psi^{g-1} + ... + (-1)^g lambda_g
  in \Mbar_{g,1}","5 pages",,,,"math.AG",,"  Mumford proved that psi^g - lambda_1 psi^{g-1} + ... + (-1)^g lambda_g = 0 in
the Chow ring of M_{g,1} [Mum83]. We find an explicit recursive formula for
psi^g - lambda_1 psi^{g-1} + ... + (-1)^g lambda_g in the tautological ring of
\Mbar_{g,1} as a combination of classes supported on boundary strata.
","[{""version"":""v1"",""created"":""Fri, 12 May 2006 16:18:25 GMT""}]","2007-05-23"
"math/0605344","Peter A. Linnell","Peter A. Linnell, Akbar H. Rhemtulla and Dale P. O. Rolfsen","Invariant group orderings and Galois conjugates","v2: 9 pages, minor changes, to appear in J. Algebra",,,,"math.GR",,"  This paper investigates conditions under which a given automorphism of a
residually torsion-free nilpotent group respects some ordering of the group.
For free groups and surface groups, this has relevance to ordering the
fundamental groups of three-dimensional manifolds which fibre over the circle.
","[{""version"":""v1"",""created"":""Fri, 12 May 2006 16:30:05 GMT""},{""version"":""v2"",""created"":""Tue, 4 Mar 2008 20:51:51 GMT""}]","2008-03-04"
"math/0605345","Jan Draisma","Jan Draisma","A tropical approach to secant dimensions","23 pages; several nice pictures; corrected a problem with
  VoronoiPartition; filled in a gap in the proof of Theorem 4.2","J. Pure Appl. Algebra 212(2):349--363, 2008",,,"math.AG math.CO",,"  Tropical geometry yields good lower bounds, in terms of certain
combinatorial-polyhedral optimisation problems, on the dimensions of secant
varieties. In particular, it gives an attractive pictorial proof of the theorem
of Hirschowitz that all Veronese embeddings of the projective plane except for
the quadratic one and the quartic one are non-defective; this proof might be
generalisable to cover all Veronese embeddings, whose secant dimensions are
known from the ground-breaking but difficult work of Alexander and Hirschowitz.
Also, the non-defectiveness of certain Segre embeddings is proved, which cannot
be proved with the rook covering argument already known in the literature.
Short self-contained introductions to secant varieties and the required
tropical geometry are included.
","[{""version"":""v1"",""created"":""Fri, 12 May 2006 17:02:31 GMT""},{""version"":""v2"",""created"":""Tue, 23 May 2006 14:40:22 GMT""},{""version"":""v3"",""created"":""Tue, 5 Sep 2006 12:53:54 GMT""}]","2017-10-10"
"math/0605346","Gerard van der Geer","Gerard van der Geer","Siegel Modular Forms","56 pages; minor revision",,,,"math.AG math.NT",,"  Lectures on Siegel modular forms given in Nordfjordeid. Besides a survey on
Siegel modular forms it presents the joint work with Carel Faber on
vector-valued Siegel modular forms of genus 2 and it gives evidence for a
conjecture of Harder on congruences between g=1 and g=2 forms.
","[{""version"":""v1"",""created"":""Fri, 12 May 2006 18:54:56 GMT""},{""version"":""v2"",""created"":""Mon, 21 May 2007 08:15:39 GMT""}]","2007-05-23"
"math/0605347","Juan B. Gil","Juan B. Gil and Michael D. Weiner","On cyclic numbers and an extension of Midy's theorem","6 pages, aimed at undergraduate students",,,,"math.NT math.GM",,"  In this note we consider fractions of the form 1/m and their floating-point
representation in various arithmetic bases. For instance, what is 1/7 in base
2005? And, what about 1/4? We give a simple algorithm to answer these
questions. In addition, we discuss an extension of Midy's theorem whose proof
relies on elementary modular arithmetic.
","[{""version"":""v1"",""created"":""Fri, 12 May 2006 19:14:54 GMT""}]","2007-05-23"
"math/0605348","Juan B. Gil","Juan B. Gil, Michael D. Weiner, and Catalin Zara","Complete Padovan sequences in finite fields","12 pages. To appear in The Fibonnaci Quarterly","Fibonacci Quart. 45 (2007), no. 1, 64-75",,,"math.NT math.CO",,"  Given a prime $p\ge 5$, and given $1<\kappa<p-1$, we call a sequence
$(a_n)_{n}$ in $\mathbb{F}_p$ a $\Phi_{\kappa}$-sequence if it is periodic with
period $p-1$, and if it satisfies the linear recurrence
$a_n+a_{n+1}=a_{n+\kappa}$ with $a_0=1$. Such a sequence is said to be a
complete $\Phi_{\kappa}$-sequence if in addition
$\{a_0,a_1,...,a_{p-2}\}=\{1,...,p-1\}$. For instance, every primitive root $b$
mod $p$ generates a complete $\Phi_{\kappa}$-sequence $a_n=b^n$ for some
(unique) $\kappa$. A natural question is whether every complete
$\Phi_{\kappa}$-sequence is necessarily defined by a primitive root. For
$\kappa=2$ the answer is known to be positive. In this paper we reexamine that
case and investigate the case $\kappa=3$ together with the associated cases
$\kappa=p-2$ and $\kappa=p-3$.
","[{""version"":""v1"",""created"":""Fri, 12 May 2006 19:37:58 GMT""}]","2014-06-20"
"math/0605349","Andrew Raich","Andrew Raich","Pointwise Estimates for Relative Fundamental Solutions of Heat Equations
  in $\mathbb{R}\times\mathbb{C}$","25 pages","Math. Z., 256:193-220, 2007",,,"math.CV math.AP",,"  Let $p:C\to R$ be a subharmonic, nonharmonic polynomial and $\tau\in R$ a
parameter. Define $\bar Z_{\tau p} = \partial_{\bar z} + \tau p_{\bar z} =
e^{-\tau p} p_{\bar z} e^{\tau p}$, a closed, densely defined operator on
$L^2(C)$. If $\Box_{\tau p} = \bar Z_{\tau p}\bar Z^*_{\tau p}$ and
$\tilde\Box_{\tau p} = \bar Z^*_{\tau p}\bar Z_{\tau p}$, we solve the heat
equations $\partial_s u + \Box_{\tau p} u=0$, $u(0,z)=f(z)$ and $\partial_s
\tilde u + \tilde\Box_{\tau p} \tilde u=0$, $\tilde u(0,z) = \tilde f(z)$. We
write the solutions via heat semigroups and show that the solutions can be
written as integrals against distributional kernels. We prove that the kernels
are $C^\infty$ off of the diagonal $\{(s,z,w) : s=0 \text{and} z=w\}$ and find
pointwise bounds for the kernels and their derivatives.
","[{""version"":""v1"",""created"":""Fri, 12 May 2006 19:56:05 GMT""}]","2007-12-11"
"math/0605350","Felix Schlenk","Yuli Rudyak and Felix Schlenk","Minimal atlases of closed symplectic manifolds","43 pages, 21 figures",,,,"math.SG math.GT",,"  We study the number of Darboux charts needed to cover a closed connected
symplectic manifold $(M,\omega)$, and effectively estimate this number from
below and from above in terms of the Lusternik--Schnirelmann category of $M$
and the Gromov width of $(M,\omega)$.
","[{""version"":""v1"",""created"":""Sat, 13 May 2006 09:10:02 GMT""}]","2007-05-23"
