"math/0605351","Yuri G. Zarhin","Alexei Skorobogatov, Yuri Zarhin","A finiteness theorem for the Brauer group of abelian varieties and K3
  surfaces","20 pages Final version; to appear in the Journal of Algebraic
  Geometry",,,,"math.NT math.AG",,"  Let $k$ be a field that is finitely generated over the field of rational
numbers and $Br(k)$ the Brauer group of $k$. Let $X$ be an absolutely
irreducible smooth projective variety over $k$, let $Br(X)$ be the
cohomological Brauer-Grothendieck group of $X$ and $Br_0(X)$ the image of
$Br(k)$ in $Br(X)$. We write $Br_1(X)$ for the subgroup of elements in $Br(X)$
that become trivial after replacing $k$ by its algebraic closure.
  We prove that $Br(X)/Br_0(X)$ is finite if $X$ is a $K3$ surface. When $X$ is
(a principal homogeneous space of) an abelian variety over $k$ then we prove
that $Br(X)/Br_1(X)$ is finite.
","[{""version"":""v1"",""created"":""Sat, 13 May 2006 15:42:51 GMT""},{""version"":""v2"",""created"":""Tue, 12 Sep 2006 15:48:32 GMT""},{""version"":""v3"",""created"":""Mon, 27 Nov 2006 14:41:34 GMT""},{""version"":""v4"",""created"":""Mon, 5 Nov 2007 13:38:07 GMT""}]","2007-11-05"
"nlin/0605029","Ricardo Lopez-Ruiz","Ricardo Lopez-Ruiz and Daniele Fournier-Prunaret","Three Logistic Models for the Ecological and Economic Interactions:
  Symbiosis, Predator-Prey and Competition","12 pages, 3 tables, (figures not supplied)",,,,"nlin.AO cs.MA math.DS",,"  If one isolated species (corporation) is supposed to evolve following the
logistic mapping, then we are tempted to think that the dynamics of two species
(corporations) can be expressed by a coupled system of two discrete logistic
equations. As three basic relationships between two species are present in
Nature, namely symbiosis, predator-prey and competition, three different models
are obtained. Each model is a cubic two-dimensional discrete logistic-type
equation with its own dynamical properties: stationary regime, periodicity,
quasi-periodicity and chaos. We also propose that these models could be useful
for thinking in the different interactions happening in the economic world, as
for instance for the competition and the collaboration between corporations.
Furthermore, these models could be considered as the basic ingredients to
construct more complex interactions in the ecological and economic networks.
","[{""version"":""v1"",""created"":""Fri, 12 May 2006 17:57:52 GMT""}]","2007-05-23"
"nucl-ex/0605012","Constantin Loizides","Constantin Loizides (Massachusetts Institute of Technology) (for the
  PHOBOS collaboration)","Scaling Features of Selected Observables at RHIC","4 pages, 3 figures. Prepared for the Proceedings of the XLIst
  Recontres de Moriond conference, QCD and High Energy Hadronic Interactions,
  March 12-19 2005, La Thuile, Italy",,,,"nucl-ex",,"  We discuss several observables measured by PHOBOS that show common scaling
features in Cu+Cu and Au+Au collisions at RHIC energies. In particular, we
examine the centrality and energy dependence of the charged particle
multiplicity, as well as the centrality dependence of the elliptic flow at
mid-rapidity. The discrepancy between Cu+Cu and Au+Au of the final state
azimuthal asymmetry (elliptic flow), relative to the initial state geometry of
the collision, can be resolved by accounting for fluctuations in the
description of the initial geometry.
","[{""version"":""v1"",""created"":""Fri, 12 May 2006 16:41:50 GMT""}]","2019-08-14"
"physics/0605099","Prashant Singh","Prashant","Quantum Semiotics: A Sign Language for Quantum Mechanics","14 pages, 3 figures",,,,"physics.gen-ph",,"  The article is taken out for change of contents with immediate effect.
","[{""version"":""v1"",""created"":""Fri, 12 May 2006 18:08:39 GMT""},{""version"":""v2"",""created"":""Thu, 11 Jan 2007 16:29:49 GMT""}]","2007-05-23"
"physics/0605105","Troost Jan","Constantin Bachas and Jan Troost","Superstring theories","12 pages, 5 figures, contribution to the Encyclopedia of Mathematical
  Physics",,,,"physics.pop-ph",,"  We briefly review superstring theories, highlighting the important concepts,
developments, and open problems of the subject.
","[{""version"":""v1"",""created"":""Fri, 12 May 2006 17:19:45 GMT""}]","2007-05-23"
"physics/0605107","Dr A. N. Mitra","A. N. Mitra","Duality : A Bridge Between Physics And Philosophy?","9 pages on dvi, LaTex file, also 2 figures as PS files",,,,"physics.gen-ph",,"  A generalized view of Duality is offered as a bridge between physical
sciences and the more abstract philosophical dimensions bordering on mysticism.
To that end several examples of duality are first cited from from conventional
physics sectors to illustrate the obvious powers of this principle. These
include items from reciprocity in Newtonian mechanics to the problem of
measurement duality that characterizes quantum mechanics. It is also noted that
the latter has acquired a renewed interest in recent times, consequent on the
emergence of new experimental techniques for testing the actual laboratory
outcomes of traditional gedanken experiments, hitherto taken for granted.
Against this background, the Duality principle is sought to be extended to the
mystical domain, with convincing examples from various human level experiences.
","[{""version"":""v1"",""created"":""Fri, 12 May 2006 17:43:47 GMT""}]","2007-05-23"
"physics/0605110","Ralph B. Fiorito","R.B.Fiorito, A.G.Shkvarunets, T.Watanabe, V.Yakimenko and D.Snyder","Interference of diffraction and transition radiation and its application
  as a beam divergence diagnostic","40 pages 18 Figures. accepted for publication in PRSTAB",,"10.1103/PhysRevSTAB.9.052802",,"physics.acc-ph",,"  We have observed the interference of optical diffraction radiation (ODR) and
optical transition radiation (OTR) produced by the interaction of a
relativistic electron beam with a micromesh foil and a mirror. The production
of forward directed ODR from electrons passing through the holes and wires of
the mesh and their separate interactions with backward OTR from the mirror are
analyzed with the help of a simulation code. By careful choice of the micromesh
properties, mesh-mirror spacing, observation wavelength and filter band pass,
the interference of the ODR produced from the unperturbed electrons passing
through the open spaces of the mesh and OTR from the mirror are observable
above a broad incoherent background from interaction of the heavily scattered
electrons passing through the mesh wires. These interferences (ODTRI) are
sensitive to the beam divergence and can be used to directly diagnose this
parameter. We compare experimental divergence values obtained using ODTRI,
conventional OTRI, for the case when front foil scattering is negligible, and
computed values obtained from transport code calculations and multiple screen
beam size measurements. We obtain good agreement in all cases.
","[{""version"":""v1"",""created"":""Fri, 12 May 2006 21:44:52 GMT""}]","2009-11-11"
"physics/0605111","Jan M. Rost","Cenap Ates, Thomas Pohl, Thomas Pattard, Jan M. Rost","Antiblockade in Rydberg excitation of an ultracold lattice gas","4 pages, 6 figures",,"10.1103/PhysRevLett.98.023002",,"physics.atom-ph",,"  It is shown that the two-step excitation scheme typically used to create an
ultracold Rydberg gas can be described with an effective two-level rate
equation, greatly reducing the complexity of the optical Bloch equations. This
allows us to solve the many-body problem of interacting cold atoms with a Monte
Carlo technique. Our results reproduce the Rydberg blockade effect. However, we
demonstrate that an Autler-Townes double peak structure in the two-step
excitation scheme, which occurs for moderate pulse lengths as used in the
experiment, can give rise to an antiblockade effect. It is observable in a
lattice gas with regularly spaced atoms. Since the antiblockade effect is
robust against a large number of lattice defects it should be experimentally
realizable with an optical lattice created by CO$_{2}$ lasers.
","[{""version"":""v1"",""created"":""Fri, 12 May 2006 21:50:34 GMT""}]","2015-06-26"
"physics/0605112","Baruch Meerson","Omri Gat, Baruch Meerson, and Arkady Vilenkin","Self-similar relaxation dynamics of a fluid wedge in a Hele-Shaw cell","4 pages, 4 figures, to appear in Phys. Rev. E (Rapid Communications)",,"10.1103/PhysRevE.73.065302",,"physics.flu-dyn nlin.PS",,"  Let the interface between two immiscible fluids in a Hele-Shaw cell have, at
t=0, a wedge shape. As a wedge is scale-free, the fluid relaxation dynamics are
self-similar. We find the dynamic exponent of this self-similar flow and show
that the interface shape is given by the solution of an unusual inverse problem
of potential theory. We solve this inverse problem analytically for an almost
flat wedge, and numerically otherwise. The wedge solution is useful for
analysis of pinch-off singularities.
","[{""version"":""v1"",""created"":""Sat, 13 May 2006 09:41:01 GMT""}]","2009-11-11"
"quant-ph/0605112","Arnau Riera","A. Riera and J. I. Latorre","Area law and vacuum reordering in harmonic networks","15 pages, 6 figures; typos corrected","Phys.Rev.A74:052326,2006","10.1103/PhysRevA.74.052326",,"quant-ph cond-mat.other hep-th",,"  We review a number of ideas related to area law scaling of the geometric
entropy from the point of view of condensed matter, quantum field theory and
quantum information. An explicit computation in arbitrary dimensions of the
geometric entropy of the ground state of a discretized scalar free field theory
shows the expected area law result. In this case, area law scaling is a
manifestation of a deeper reordering of the vacuum produced by majorization
relations. Furthermore, the explicit control on all the eigenvalues of the
reduced density matrix allows for a verification of entropy loss along the
renormalization group trajectory driven by the mass term. A further result of
our computation shows that single-copy entanglement also obeys area law
scaling, majorization relations and decreases along renormalization group
flows.
","[{""version"":""v1"",""created"":""Fri, 12 May 2006 19:46:37 GMT""},{""version"":""v2"",""created"":""Mon, 29 May 2006 09:11:16 GMT""},{""version"":""v3"",""created"":""Mon, 26 Jun 2006 10:47:30 GMT""}]","2008-11-26"
"quant-ph/0605113","Andrei Klimov B.","A.B. Klimov, C. Munoz, J.L. Romero","Geometric approach to the discrete Wigner function","25 p. Extended version de short course given in School on Quantum
  Optics and Quantum Information, November 21-25, 2005, Las trancas, Chillan,
  Chile",,,,"quant-ph",,"  We analyze the Wigner function constructed on the basis of the discrete
rotation and displacement operators labeled with elements of the underlying
finite field. We separately discuss the case of odd and even characteristics
and analyze the algebraic origin of the non uniqueness of the representation of
the Wigner function. Explicit expressions for the Wigner kernel are given in
both cases.
","[{""version"":""v1"",""created"":""Sat, 13 May 2006 00:00:01 GMT""}]","2007-05-23"
"quant-ph/0605114","Mark Kasevich","Ruquan Wang, Mingchang Liu, Francesco Minardi and Mark Kasevich","Reaching 7Li BEC with a Mini-Trap","7 pages, 10 figures",,,,"quant-ph",,"  A novel mm-scale Ioffe-Pritchard trap is used to achieve Bose-Einstein
condensation in 7Li. The trap employs free-standing copper coils integrated
onto a direct-bond copper surface electrode structure. The trap achieves a
radial magnetic gradient of 420 G/cm, an axial oscillation frequency of 50 Hz
and a trap depth of 66 G with a 100 A drive current and 7 W total power
dissipation.
","[{""version"":""v1"",""created"":""Sat, 13 May 2006 01:00:03 GMT""}]","2007-05-23"
"quant-ph/0605116","Roald Ekholdt","Roald Ekholdt","An interpretation of quantum mechanics based on a waveguide analogy","12 pages",,,,"quant-ph physics.hist-ph",,"  Based on an observation that the basic mode of a common microwave waveguide
is a solution to the Klein-Gordon equation, quantum mechanics is modeled as the
wave-function propagated inside a waveguide. The guide width is determined by
the rest-energy and the potential energy. Moreover, a geometrical optics model
of the propagation illustrates how the width as a function of distance
determines the velocity and accelerations of the particle. The model entails
the disappearance of action-at-a-distance problem, and that interactions are
conveyed via the potential, i.e. by photons.
","[{""version"":""v1"",""created"":""Sat, 13 May 2006 06:59:36 GMT""}]","2007-05-23"
"quant-ph/0605117","Paola Campanale","P. Campanale, D. Picca","The one-way CNOT simulation","7 pages, 2 figures",,"10.1134/S1054660X06110107",,"quant-ph",,"  In this paper we present the complete simulation of the quantum logic CNOT
gate in the one-way model, that consists entirely of one-qubit measurements on
a particular class of entangled states.
","[{""version"":""v1"",""created"":""Sat, 13 May 2006 09:20:21 GMT""}]","2009-11-13"
"quant-ph/0605118","Giovanni Di Giuseppe","A. Cere', M. Lucamarini, G. Di Giuseppe and P. Tombesi","Experimental Test of Two-way Quantum Key Distribution in Presence of
  Controlled Noise","4 pages, 3 figures","Phys. Rev. Lett. 96, 200501 (2006)","10.1103/PhysRevLett.96.200501",,"quant-ph",,"  We describe the experimental test of a quantum key distribution performed
with a two-way protocol without using entanglement. An individual incoherent
eavesdropping is simulated and induces a variable amount of noise on the
communication channel. This allows a direct verification of the agreement
between theory and practice.
","[{""version"":""v1"",""created"":""Sat, 13 May 2006 12:08:09 GMT""}]","2009-09-14"
