"cond-mat/0605462","Georgina Wilkins G. M. H.","Georgina M. H. Wilkins, Peter D. Olmsted","Vorticity Banding During the Lamellar-to-Onion Transition in a Lyotropic
  Surfactant Solution in Shear Flow","10 pages, 10 figures",,"10.1140/epje/i2006-10053-9",,"cond-mat.soft",,"  We report on the rheology of a lamellar lyotropic surfactant solution
(SDS/dodecane/pentanol/water), and identify a discontinuous transition between
two shear thinning regimes which correspond to the low stress lamellar phase
and the more viscous shear induced multi-lamellar vesicle, or ``onion'' phase.
We study in detail the flow curve, stress as a function of shear rate, during
the transition region, and present evidence that the region consists of a shear
banded phase where the material has macroscopically separated into bands of
lamellae and onions stacked in the vorticity direction. We infer very slow and
irregular transformations from lamellae to onions as the stress is increased
through the two phase region, and identify distinct events consistent with the
nucleation of small fractions of onions that coexist with sheared lamellae.
","[{""version"":""v1"",""created"":""Thu, 18 May 2006 13:55:05 GMT""}]","2009-11-11"
"cond-mat/0605463","Florian Merkt","F.S. Merkt, A. Erbe and P. Leiderer","Capped colloids as light-mills in optical traps","8 pages, 4 figures, video unavailable",,"10.1088/1367-2630/8/9/216",,"cond-mat.soft",,"  Custom-designed colloidal particles in an optical tweezers act as light-mills
in a fluid. In particular, aqueous suspensions of capped colloids, in which
half of the surface is covered with metal layers, are investigated. Due to
their asymmetry, the capped colloids can act as rotators when exposed to
intense laser fields. Particles of 4.7 micrometer in diameter are observed
rotating around the focus of a laser beam. For low intensities, particles
become trapped close to the spot of highest laser intensity. Above a threshold
value of about 4 mW in total beam intensity, the particles move away from the
center of the focus and start to rotate at frequencies of about 1 Hz. The
balance of forces due to light pressure and hydrodynamic forces gives a
constant rotation rate. The speed of the spinning particle increases linearly
with laser power to above 2 Hz until the particles are ejected from the focus
for intensities higher than 7 mW. Magnetic caps introduce further possibilities
to tune the rotation rates.
","[{""version"":""v1"",""created"":""Thu, 18 May 2006 14:03:24 GMT""}]","2009-11-11"
"cond-mat/0605464","Ute Loew","A. Sindermann, U. L\""ow, J. Zittartz","Ground state properties of two spin models with exactly known ground
  states on the square lattice","to appear in IJMPC 17, 12 pages, 7 figures",,"10.1142/S0129183106009709",,"cond-mat.stat-mech cond-mat.str-el",,"  We introduce a new two-dimensional model with diagonal four spin exchange and
an exactly knownground-state. Using variational ansaetze and exact
diagonalisation we calculate upper and lower bounds for the critical coupling
of the model. Both for this model and for the Shastry-Sutherland model we study
periodic systems up to system size 6x6.
","[{""version"":""v1"",""created"":""Thu, 18 May 2006 14:09:57 GMT""}]","2009-11-11"
"cond-mat/0605465","Axel Braun","A. Braun and T. Aspelmeier","The m-component spin glass on a Bethe lattice","9 pages, 7 figures",,"10.1103/PhysRevB.74.144205",,"cond-mat.dis-nn",,"  We study the m-component vector spin glass in the limit m to infinity on a
Bethe lattice. The cavity method allows for a solution of the model in a
self-consistent field approximation and for a perturbative solution of the full
problem near the phase transition. The low temperature phase of the model is
analyzed numerically and a generalized Bose-Einstein condensation is found, as
in the fully connected model. Scaling relations between four distinct
zero-temperature exponents are found.
","[{""version"":""v1"",""created"":""Thu, 18 May 2006 14:36:10 GMT""}]","2009-11-11"
"cs/0605075","Sebastien de la Kethulle de Ryhove","Sebastien de la Kethulle de Ryhove, Ninoslav Marina, and Geir E. Oien","On the Capacity and Mutual Information of Memoryless Noncoherent
  Rayleigh-Fading Channels","20 pages, 3 figures. Submitted to IEEE Transactions on Information
  Theory",,,,"cs.IT math.IT",,"  The memoryless noncoherent single-input single-output (SISO) Rayleigh-fading
channel is considered. Closed-form expressions for the mutual information
between the output and the input of this channel when the input magnitude
distribution is discrete and restricted to having two mass points are derived,
and it is subsequently shown how these expressions can be used to obtain
closed-form expressions for the capacity of this channel for signal to noise
ratio (SNR) values of up to approximately 0 dB, and a tight capacity lower
bound for SNR values between 0 dB and 10 dB. The expressions for the channel
capacity and its lower bound are given as functions of a parameter which can be
obtained via numerical root-finding algorithms.
","[{""version"":""v1"",""created"":""Wed, 17 May 2006 16:22:09 GMT""}]","2007-07-16"
"cs/0605076","J. F. J. Laros","J. F. J. Laros","Numeration-automatic sequences","25 pages, 22 figures",,,,"cs.CL cs.DM",,"  We present a base class of automata that induce a numeration system and we
give an algorithm to give the n-th word in the language of the automaton when
the expansion of n in the induced numeration system is feeded to the automaton.
Furthermore we give some algorithms for reverse reading of this expansion and a
way to combine automata to other automata having the same properties.
","[{""version"":""v1"",""created"":""Wed, 17 May 2006 17:12:25 GMT""}]","2007-05-23"
"cs/0605077","Taesup Moon","Taesup Moon, Tsachy Weissman","Universal Filtering via Hidden Markov Modeling","29 pages",,,,"cs.IT math.IT",,"  The problem of discrete universal filtering, in which the components of a
discrete signal emitted by an unknown source and corrupted by a known DMC are
to be causally estimated, is considered. A family of filters are derived, and
are shown to be universally asymptotically optimal in the sense of achieving
the optimum filtering performance when the clean signal is stationary, ergodic,
and satisfies an additional mild positivity condition. Our schemes are
comprised of approximating the noisy signal using a hidden Markov process (HMP)
via maximum-likelihood (ML) estimation, followed by the use of the forward
recursions for HMP state estimation. It is shown that as the data length
increases, and as the number of states in the HMP approximation increases, our
family of filters attain the performance of the optimal distribution-dependent
filter.
","[{""version"":""v1"",""created"":""Wed, 17 May 2006 18:00:10 GMT""}]","2007-07-13"
"cs/0605078","Christoph D\""urr","Philippe Baptiste, Peter Brucker, Marek Chrobak, Christoph Durr,
  Svetlana A. Kravchenko, Francis Sourd","The Complexity of Mean Flow Time Scheduling Problems with Release Times","Subsumes and replaces cs.DS/0412094 and ""Complexity of mean flow time
  scheduling problems with release dates"" by P.B, S.K",,,,"cs.DS",,"  We study the problem of preemptive scheduling n jobs with given release times
on m identical parallel machines. The objective is to minimize the average flow
time. We show that when all jobs have equal processing times then the problem
can be solved in polynomial time using linear programming. Our algorithm can
also be applied to the open-shop problem with release times and unit processing
times. For the general case (when processing times are arbitrary), we show that
the problem is unary NP-hard.
","[{""version"":""v1"",""created"":""Wed, 17 May 2006 22:07:17 GMT""}]","2007-05-23"
"cs/0605079","Amos Lapidoth","Amos Lapidoth, Shlomo Shamai, Michele Wigger","On the Capacity of Fading MIMO Broadcast Channels with Imperfect
  Transmitter Side-Information","Extended version of a paper of the same title that appeared in the
  Proceedings of the 43rd Annual Allerton Conference on Communication, Control,
  and Computing, Sept. 28-30, 2005",,,,"cs.IT math.IT",,"  A fading broadcast channel is considered where the transmitter employs two
antennas and each of the two receivers employs a single receive antenna. It is
demonstrated that even if the realization of the fading is precisely known to
the receivers, the high signal-to-noise (SNR) throughput is greatly reduced if,
rather than knowing the fading realization \emph{precisely}, the trasmitter
only knows the fading realization \emph{approximately}. The results are general
and are not limited to memoryless Gaussian fading.
","[{""version"":""v1"",""created"":""Wed, 17 May 2006 22:29:44 GMT""}]","2007-07-13"
"cs/0605080","Mohamed Ali Kaafar","Mohamed Ali Dali Kaafar (INRIA Sophia Antipolis / INRIA
  Rh\^one-Alpes), Thierry Turletti (INRIA Sophia Antipolis / INRIA
  Rh\^one-Alpes), Walid Dabbous (INRIA Sophia Antipolis / INRIA Rh\^one-Alpes)","A Locating-First Approach for Scalable Overlay Multicast",,"Dans IEEE IWQoS 2006",,,"cs.NI",,"  Recent proposals in multicast overlay construction have demonstrated the
importance of exploiting underlying network topology. However, these
topology-aware proposals often rely on incremental and periodic refinements to
improve the system performance. These approaches are therefore neither
scalable, as they induce high communication cost due to refinement overhead,
nor efficient because long convergence time is necessary to obtain a stabilized
structure. In this paper, we propose a highly scalable locating algorithm that
gradually directs newcomers to their a set of their closest nodes without
inducing high overhead. On the basis of this locating process, we build a
robust and scalable topology-aware clustered hierarchical overlay scheme,
called LCC. We conducted both simulations and PlanetLab experiments to evaluate
the performance of LCC. Results show that the locating process entails modest
resources in terms of time and bandwidth. Moreover, LCC demonstrates promising
performance to support large scale multicast applications.
","[{""version"":""v1"",""created"":""Thu, 18 May 2006 15:40:04 GMT""}]","2016-08-16"
"cs/0605081","Marc Daumas","Marc Daumas (LP2A, LIRMM), Guillaume Da Gra\c{c}a (LP2A), David Defour
  (LP2A)","Caract\'{e}ristiques arithm\'{e}tiques des processeurs graphiques",,,,,"cs.MS",,"  Les unit\'{e}s graphiques (Graphic Processing Units- GPU) sont d\'{e}sormais
des processeurs puissants et flexibles. Les derni\`{e}res g\'{e}n\'{e}rations
de GPU contiennent des unit\'{e}s programmables de traitement des sommets
(vertex shader) et des pixels (pixel shader) supportant des op\'{e}rations en
virgule flottante sur 8, 16 ou 32 bits. La repr\'{e}sentation flottante sur 32
bits correspond \`{a} la simple pr\'{e}cision de la norme IEEE sur
l'arithm\'{e}tique en virgule flottante (IEEE-754). Les GPU sont bien
adapt\'{e}s aux applications avec un fort parall\'{e}lisme de donn\'{e}es.
Cependant ils ne sont que peu utilis\'{e}s en dehors des calculs graphiques
(General Purpose computation on GPU -- GPGPU). Une des raisons de cet \'{e}tat
de faits est la pauvret\'{e} des documentations techniques fournies par les
fabricants (ATI et Nvidia), particuli\`{e}rement en ce qui concerne
l'implantation des diff\'{e}rents op\'{e}rateurs arithm\'{e}tiques
embarqu\'{e}s dans les diff\'{e}rentes unit\'{e}s de traitement. Or ces
informations sont essentielles pour estimer et contr\^{o}ler les erreurs
d'arrondi ou pour mettre en oeuvre des techniques de r\'{e}duction ou de
compensation afin de travailler en pr\'{e}cision double, quadruple ou
arbitrairement \'{e}tendue. Nous proposons dans cet article un ensemble de
programmes qui permettent de d\'{e}couvrir les caract\'{e}ristiques principales
des GPU en ce qui concerne l'arithm\'{e}tique \`{a} virgule flottante. Nous
donnons les r\'{e}sultats obtenus sur deux cartes graphiques r\'{e}centes: la
Nvidia 7800GTX et l'ATI RX1800XL.
","[{""version"":""v1"",""created"":""Thu, 18 May 2006 15:49:04 GMT""}]","2007-05-23"
"gr-qc/0605100","Leonid Grishchuk P","D. Baskaran, L. P. Grishchuk, and A. G. Polnarev","Imprints of Relic Gravitational Waves in Cosmic Microwave Background
  Radiation","61 pages including 15 figures, v.2: additional references and
  clarifications, to be published in Phys. Rev. D","Phys.Rev. D74 (2006) 083008","10.1103/PhysRevD.74.083008",,"gr-qc astro-ph hep-th",,"  A strong variable gravitational field of the very early Universe inevitably
generates relic gravitational waves by amplifying their zero-point quantum
oscillations. We begin our discussion by contrasting the concepts of relic
gravitational waves and inflationary `tensor modes'. We explain and summarize
the properties of relic gravitational waves that are needed to derive their
effects on CMB temperature and polarization anisotropies. The radiation field
is characterized by four invariants I, V, E, B. We reduce the radiative
transfer equations to a single integral equation of Voltairre type and solve it
analytically and numerically. We formulate the correlation functions
C^{XX'}_{\ell} for X, X'= T, E, B and derive their amplitudes, shapes and
oscillatory features. Although all of our main conclusions are supported by
exact numerical calculations, we obtain them, in effect, analytically by
developing and using accurate approximations. We show that the TE correlation
at lower \ell's must be negative (i.e. an anticorrelation), if it is caused by
gravitational waves, and positive if it is caused by density perturbations.
This difference in TE correlation may be a signature more valuable
observationally than the lack or presence of the BB correlation, since the TE
signal is about 100 times stronger than the expected BB signal. We discuss the
detection by WMAP of the TE anticorrelation at \ell \approx 30 and show that
such an anticorrelation is possible only in the presence of a significant
amount of relic gravitational waves (within the framework of all other common
assumptions). We propose models containing considerable amounts of relic
gravitational waves that are consistent with the measured TT, TE and EE
correlations.
","[{""version"":""v1"",""created"":""Wed, 17 May 2006 16:19:47 GMT""},{""version"":""v2"",""created"":""Mon, 25 Sep 2006 10:01:12 GMT""}]","2009-11-11"
"gr-qc/0605101","Emanuele Berti","Emanuele Berti, Vitor Cardoso","Supermassive black holes or boson stars? Hair counting with
  gravitational wave detectors","8 pages. This essay received an honorable mention in the Gravity
  Research Foundation Essay Competition, 2006","Int.J.Mod.Phys.D15:2209-2216,2006","10.1142/S0218271806009637",,"gr-qc astro-ph",,"  The evidence for supermassive Kerr black holes in galactic centers is strong
and growing, but only the detection of gravitational waves will convincingly
rule out other possibilities to explain the observations. The Kerr spacetime is
completely specified by the first two multipole moments: mass and angular
momentum. This is usually referred to as the ``no-hair theorem'', but it is
really a ``two-hair'' theorem. If general relativity is the correct theory of
gravity, the most plausible alternative to a supermassive Kerr black hole is a
rotating boson star. Numerical calculations indicate that the spacetime of
rotating boson stars is determined by the first three multipole moments
(``three-hair theorem''). LISA could accurately measure the oscillation
frequencies of these supermassive objects. We propose to use these measurements
to ``count their hair'', unambiguously determining their nature and properties.
","[{""version"":""v1"",""created"":""Wed, 17 May 2006 18:03:54 GMT""}]","2008-11-26"
"gr-qc/0605102","Matthew Anderson","Matthew Anderson, Eric Hirschmann, Steven L. Liebling, David Neilsen","Relativistic MHD with Adaptive Mesh Refinement","24 pages, 14 figures, 3 tables","Class.Quant.Grav. 23 (2006) 6503-6524","10.1088/0264-9381/23/22/025",,"gr-qc",,"  This paper presents a new computer code to solve the general relativistic
magnetohydrodynamics (GRMHD) equations using distributed parallel adaptive mesh
refinement (AMR). The fluid equations are solved using a finite difference
Convex ENO method (CENO) in 3+1 dimensions, and the AMR is Berger-Oliger.
Hyperbolic divergence cleaning is used to control the $\nabla\cdot {\bf B}=0$
constraint. We present results from three flat space tests, and examine the
accretion of a fluid onto a Schwarzschild black hole, reproducing the Michel
solution. The AMR simulations substantially improve performance while
reproducing the resolution equivalent unigrid simulation results. Finally, we
discuss strong scaling results for parallel unigrid and AMR runs.
","[{""version"":""v1"",""created"":""Wed, 17 May 2006 21:50:01 GMT""},{""version"":""v2"",""created"":""Wed, 11 Oct 2006 20:18:32 GMT""}]","2009-11-11"
"gr-qc/0605103","Philip Tillman Mr.","P. Tillman","Explicit Constructions of the Fedosov star on some Lorentzian
  Space-Times","This paper has been withdrawn",,,,"gr-qc",,"  This paper has been withdrawn by the author due to the fact that the results
were found to be done previously.
","[{""version"":""v1"",""created"":""Wed, 17 May 2006 22:08:13 GMT""},{""version"":""v2"",""created"":""Sat, 5 Aug 2006 21:42:57 GMT""}]","2007-05-23"
"gr-qc/0605104","Uri Jacob","Uri Jacob and Tsvi Piran","Embedding the Reissner-Nordstrom spacetime in Euclidean and Minkowski
  spaces","13 pages, 10 figures","Class.Quant.Grav. 23 (2006) 4035-4045","10.1088/0264-9381/23/12/003",,"gr-qc",,"  We examine embedding diagrams of hypersurfaces in the Reissner-Nordstrom
black hole spacetime. These embedding diagrams serve as useful tools to
visualize the geometry of the hypersurfaces and of the whole spacetime in
general.
","[{""version"":""v1"",""created"":""Thu, 18 May 2006 14:53:31 GMT""}]","2009-11-11"
"hep-ex/0605079","Christophe Delaere","ALEPH collaboration","Search for Higgs bosons decaying to WW in e+e- collisions at LEP","29 pages, 10 figures, Submitted to The European Physical Journal C","Eur.Phys.J.C49:439-455,2007","10.1140/epjc/s10052-006-0158-6",,"hep-ex",,"  A search for Higgs bosons produced in association with a fermion pair, and
decaying to WW, is performed with the data collected by the ALEPH detector at
centre-of-mass energies ranging from 191 to 209 GeV. The data correspond to an
integrated luminosity of 453.2 pb^-1. Thirteen exclusive selections are
developed according to the different final state topologies. No statistically
significant evidence for a Higgs boson decaying into a WW pair has been found.
An upper limit is derived, as a function of the Higgs boson mass, on the
product of the e+e- -> Hff cross section and the H -> WW branching ratio. The
data on the search for H -> WW are combined with previously published ALEPH
results on the search for H -> gamma gamma, to significantly extend the limits
on the mass of a fermiophobic Higgs boson.
","[{""version"":""v1"",""created"":""Wed, 17 May 2006 16:25:51 GMT""}]","2012-08-27"
"hep-ex/0605083","Brian Mohr","Brian Mohr (for the CDF Collaboration)","Measurement of the Top Quark Mass with a Matrix Element Method in the
  Lepton Plus Jets Channel at CDF","Proceedings for the 41st Rencontres de Moriond, EWK, March 11 - 28,
  2006. 4 pages, 1 figure",,,,"hep-ex",,"  We present a measurement of the mass of the top quark from ppbar collisions
at 1.96 TeV observed with the Collider Detector at Fermilab (CDF) at the
Fermilab Tevatron Run II. The events have the decay signature of ppbar to ttbar
in the lepton plus jets channel in which at least one jet is identified as
coming from a secondary vertex and therefore a b-hadron. The largest systematic
uncertainty, the jet energy scale (JES), is convoluted with the statistical
error using an in-situ measurement of the hadronic W boson mass. We calculate a
likelihood for each event using leading-order ttbar and W+jets cross-sections
and parameterized parton showering. The final measured top quark mass and JES
systematic is extracted from a joint likelihood of the product of individual
event likelihoods. From 118 events observed in 680 pb-1 of data, we measure a
top quark mass of 174.09 +- 2.54 (stat+JES) +- 1.35 (syst) GeV/c2.
","[{""version"":""v1"",""created"":""Wed, 17 May 2006 16:00:24 GMT""}]","2007-05-23"
"hep-ex/0605084","Koji Terashi","Koji Terashi (for the CDF Collaboration, D0 Collaboration)","New Diffraction Results from the Tevatron","4 pages, To be submitted to the proceedings of the 41st Rencontres de
  Moriond - QCD and High Energy Hadronic Interactions, La Thuile, Italy, 18-25
  March 2006",,,,"hep-ex",,"  We present new results from studies on diffractive dijet production and
exclusive production of dijet and diphoton obtained by the CDF Collaboration in
proton-antiproton collisions at the Fermilab Tevatron.
","[{""version"":""v1"",""created"":""Wed, 17 May 2006 22:11:45 GMT""}]","2019-08-15"
"hep-ex/0605085","Ralf Seidl","Ralf Seidl","Spin dependent fragmentatation functions at Belle","Prepared for the 41st Recontres de Moriond, QCD and high energy
  hadronic interactions, La Thuile, Italy, March 18-25 2006",,,,"hep-ex",,"  Spin dependent fragmentation functions are an important tool to understand
the spin structure of the nucleon. The Collins fragmentation function for
example describes the fragmentation of a transversely polarized quark into a
hadron via the creation of additional transverse momentum relative to the
quark's momentum. The Belle experiment has measured the resulting azimuthal
asymmetries in a data sample of 29 fb-1 and found significant nonzero results.
","[{""version"":""v1"",""created"":""Wed, 17 May 2006 22:34:45 GMT""}]","2007-05-23"
"hep-ex/0605086","Stephen J. Gowdy","S. J. Gowdy (the BaBar Collaboration)","Quarkonium and Charm Hadrons : New Results on Spectroscopy in BaBar","4 pages (5 here), to appear in Proceedings of the XLIst Rencontres de
  Moriond, QCD and Hadronic Interactions, La Thuile, Italy, 18-25 March 2006",,,"SLAC-PUB-11869","hep-ex",,"  We report on recent results in spectroscopy from BaBar. This includes the
discovery of a new $\Lambda_c$ baryon, detailed studies of the
$D^*_{sJ}(2317)^+$, $D_{sJ}(2460)^+$, X(3872) and Y(4260) particles and the
first measurement of hadronic non-$B\bar{B}$ decays of the $\Upsilon(4S)$
meson.
","[{""version"":""v1"",""created"":""Thu, 18 May 2006 13:28:48 GMT""}]","2007-05-23"
"hep-ex/0605087","Jenny List","J. List","Physics at the International Linear Collider","proceedings for a talk presented at Moriond QCD / Cosmology 2006",,,,"hep-ex",,"  The International Linear Collider (ILC) is the next large project in
accelerator based particle physics. It is complementary to the LHC in many
aspects. Measurements from both machines together will finally shed light onto
the known deficiencies of the Standard Model of particle physics and allow to
unveil a possible underlying more fundamental theory. Here, the possibilities
of the ILC will be discussed with special emphasis on the Higgs sector and on
topics with a strong connection to cosmological questions like extra dimensions
or dark matter candidates.
","[{""version"":""v1"",""created"":""Thu, 18 May 2006 12:28:37 GMT""}]","2007-05-23"
"hep-lat/0605015","Tereza Mendes","W. G. Wanzeller, G. Krein, T. Mendes","Dynamic Critical Behavior of Percolation Observables in the 2d Ising
  Model","3 pages, 1 figure","AIP Conference Proceedings -- December 2, 2004 -- Volume 739,
  Issue 1, pp. 608-610","10.1063/1.1843669",,"hep-lat",,"  We present preliminary results of our numerical study of the critical
dynamics of percolation observables for the two-dimensional Ising model. We
consider the (Monte-Carlo) short-time evolution of the system obtained with a
local heat-bath method and with the global Swendsen-Wang algorithm. In both
cases, we find qualitatively different dynamic behaviors for the magnetization
and Omega, the order parameter of the percolation transition. This may have
implications for the recent attempts to describe the dynamics of the QCD phase
transition using cluster observables.
","[{""version"":""v1"",""created"":""Wed, 17 May 2006 19:57:04 GMT""}]","2009-11-11"
