"math/0605506","Marc Hallin","Marc Hallin, Catherine Vermandele, Bas Werker","Serial and nonserial sign-and-rank statistics: asymptotic representation
  and asymptotic normality","Published at http://dx.doi.org/10.1214/009053605000000769 in the
  Annals of Statistics (http://www.imstat.org/aos/) by the Institute of
  Mathematical Statistics (http://www.imstat.org)","Annals of Statistics 2006, Vol. 34, No. 1, 254-289","10.1214/009053605000000769","IMS-AOS-AOS0074","math.ST stat.TH",,"  The classical theory of rank-based inference is entirely based either on
ordinary ranks, which do not allow for considering location (intercept)
parameters, or on signed ranks, which require an assumption of symmetry. If the
median, in the absence of a symmetry assumption, is considered as a location
parameter, the maximal invariance property of ordinary ranks is lost to the
ranks and the signs. This new maximal invariant thus suggests a new class of
statistics, based on ordinary ranks and signs. An asymptotic representation
theory \`{a} la H\'{a}jek is developed here for such statistics, both in the
nonserial and in the serial case. The corresponding asymptotic normality
results clearly show how the signs add a separate contribution to the
asymptotic variance, hence, potentially, to asymptotic efficiency. As shown by
Hallin and Werker [Bernoulli 9 (2003) 137--165], conditioning in an appropriate
way on the maximal invariant potentially even leads to semiparametrically
efficient inference. Applications to semiparametric inference in regression and
time series models with median restrictions are treated in detail in an
upcoming companion paper.
","[{""version"":""v1"",""created"":""Thu, 18 May 2006 10:17:50 GMT""}]","2007-06-13"
"math/0605507","Giovanni Morando","Giovanni Morando","An existence theorem for tempered solutions of D-modules on complex
  curves","36 pages","Publ. Res. Inst. Math. Sci., vol. 43, n.3, 625--659, 2007.",,,"math.AG math.CV",,"  Let X be a complex curve, $X_{sa}$ the subanalytic site associated to X, M a
holonomic $D_X$-module. Let $O^t$ be the sheaf on $X_{sa}$ of tempered
holomorphic functions, Sol(M) (resp. $Sol^t$(M)) the complex of holomorphic
(resp. tempered holomorphic) solutions of M. We prove that the natural morphism
from $H^1 Sol^t$(M) to $H^1$Sol(M) is an isomorphism of sheaves on $X_{sa}$. As
a consequence, we prove that $Sol^t$(M) is R-constructible in the sense of
sheaves on $X_{sa}$. Such a result is conjectured by M. Kashiwara and P.
Schapira in Ast\'erisque 284 in any dimension.
","[{""version"":""v1"",""created"":""Thu, 18 May 2006 10:36:21 GMT""}]","2008-04-04"
"math/0605508","Rade T. Zivaljevic","Rade T. Zivaljevic","Groupoids in combinatorics -- applications of a theory of local
  symmetries",,,,,"math.CO math.AT",,"  An objective of the theory of combinatorial groupoids is to introduce
concepts like ""holonomy"", ""parallel transport"", ""bundles"", ""combinatorial
curvature"" etc. in the context of simplicial (polyhedral) complexes, posets,
graphs, polytopes, arrangements and other combinatorial objects. In this paper
we give an exposition of some of the currently most active research themes in
this area, offer a unified point of view, and provide a list of prospective
applications in other fields together with a collection of related open
problems.
","[{""version"":""v1"",""created"":""Thu, 18 May 2006 12:41:33 GMT""}]","2007-05-23"
"math/0605509","Lenny Taelman","Lenny Taelman","Complete Reducibility of t-Motives","This paper has been withdrawn",,,,"math.NT",,"  This paper has been withdrawn. Counterexamples to the announced theorem can
be made by observing that the natural map Ext(M,N)--> Ext(Lie(N),Lie(M)) is
surjective and that the extension of two pure motives of the same weight is
again pure. The proof contains a crucial mistake in the analysis of the
``glueing'' of trivialisations.
","[{""version"":""v1"",""created"":""Thu, 18 May 2006 12:58:49 GMT""},{""version"":""v2"",""created"":""Thu, 13 Jul 2006 09:29:04 GMT""}]","2007-05-23"
"math/0605510","Steeve Zozor","S. Zozor, C. Vignat","On classes of non-Gaussian asymptotic minimizers in entropic uncertainty
  principles",,"Physica A, 375(2): 499-517, march 2007","10.1016/j.physa.2006.09.019",,"math.PR",,"  In this paper we revisit the Bialynicki-Birula & Mycielski uncertainty
principle and its cases of equality. This Shannon entropic version of the
well-known Heisenberg uncertainty principle can be used when dealing with
variables that admit no variance. In this paper, we extend this uncertainty
principle to Renyi entropies. We recall that in both Shannon and Renyi cases,
and for a given dimension n, the only case of equality occurs for Gaussian
random vectors. We show that as n grows, however, the bound is also
asymptotically attained in the cases of n-dimensional Student-t and Student-r
distributions. A complete analytical study is performed in a special case of a
Student-t distribution. We also show numerically that this effect exists for
the particular case of a n-dimensional Cauchy variable, whatever the Renyi
entropy considered, extending the results of Abe and illustrating the
analytical asymptotic study of the student-t case. In the Student-r case, we
show numerically that the same behavior occurs for uniformly distributed
vectors. These particular cases and other ones investigated in this paper are
interesting since they show that this asymptotic behavior cannot be considered
as a ""Gaussianization"" of the vector when the dimension increases.
","[{""version"":""v1"",""created"":""Thu, 18 May 2006 13:04:27 GMT""}]","2014-06-23"
"math/0605511","Yong Zhou","Jianqing Fan, Huazhen Lin, Yong Zhou","Local partial-likelihood estimation for lifetime data","Published at http://dx.doi.org/10.1214/009053605000000796 in the
  Annals of Statistics (http://www.imstat.org/aos/) by the Institute of
  Mathematical Statistics (http://www.imstat.org)","Annals of Statistics 2006, Vol. 34, No. 1, 290-325","10.1214/009053605000000796","IMS-AOS-AOS0099","math.ST stat.TH",,"  This paper considers a proportional hazards model, which allows one to
examine the extent to which covariates interact nonlinearly with an exposure
variable, for analysis of lifetime data. A local partial-likelihood technique
is proposed to estimate nonlinear interactions. Asymptotic normality of the
proposed estimator is established. The baseline hazard function, the bias and
the variance of the local likelihood estimator are consistently estimated. In
addition, a one-step local partial-likelihood estimator is presented to
facilitate the computation of the proposed procedure and is demonstrated to be
as efficient as the fully iterated local partial-likelihood estimator.
Furthermore, a penalized local likelihood estimator is proposed to select
important risk variables in the model. Numerical examples are used to
illustrate the effectiveness of the proposed procedures.
","[{""version"":""v1"",""created"":""Thu, 18 May 2006 14:45:41 GMT""}]","2007-06-13"
"math/0605512","Michel Enock","Michel Enock","Continuous fields of C*-algebras and Lesieur's Quantum Groupoids","This paper had been withdrawn, and is now again available with some
  minor corrections",,,,"math.OA",,"  In two articles ([L2], [L3]), Franck Lesieur had introduced a notion of
quantum groupoid, in the setting of von Neumann algebras, using intensively the
notion of pseudo-multiplicative unitary, which had been introduced in a
previous article of the author, in collaboration with Jean-Michel Vallin [EV].
We are here studying the analog of Lesieur's construction in a C*-framework,
when the basis of the quantum groupoid is central; in this case, the C*
structure obtained can be described using the tools of continuous fields of
C*-algebras. This allows us to re-use as quantum groupoids some examples
introduced by Etienne Blanchard.
","[{""version"":""v1"",""created"":""Thu, 18 May 2006 14:51:51 GMT""},{""version"":""v2"",""created"":""Thu, 21 Sep 2006 15:42:28 GMT""},{""version"":""v3"",""created"":""Mon, 2 Oct 2006 12:11:31 GMT""}]","2007-05-23"
"math/0605513","David L. Donoho","Ery Arias-Castro, David L. Donoho, Xiaoming Huo","Adaptive multiscale detection of filamentary structures in a background
  of uniform random points","Published at http://dx.doi.org/10.1214/009053605000000787 in the
  Annals of Statistics (http://www.imstat.org/aos/) by the Institute of
  Mathematical Statistics (http://www.imstat.org)","Annals of Statistics 2006, Vol. 34, No. 1, 326-349","10.1214/009053605000000787","IMS-AOS-AOS0097","math.ST stat.TH",,"  We are given a set of $n$ points that might be uniformly distributed in the
unit square $[0,1]^2$. We wish to test whether the set, although mostly
consisting of uniformly scattered points, also contains a small fraction of
points sampled from some (a priori unknown) curve with $C^{\alpha}$-norm
bounded by $\beta$. An asymptotic detection threshold exists in this problem;
for a constant $T_-(\alpha,\beta)>0$, if the number of points sampled from the
curve is smaller than $T_-(\alpha,\beta)n^{1/(1+\alpha)}$, reliable detection
is not possible for large $n$. We describe a multiscale significant-runs
algorithm that can reliably detect concentration of data near a smooth curve,
without knowing the smoothness information $\alpha$ or $\beta$ in advance,
provided that the number of points on the curve exceeds
$T_*(\alpha,\beta)n^{1/(1+\alpha)}$. This algorithm therefore has an optimal
detection threshold, up to a factor $T_*/T_-$. At the heart of our approach is
an analysis of the data by counting membership in multiscale multianisotropic
strips. The strips will have area $2/n$ and exhibit a variety of lengths,
orientations and anisotropies. The strips are partitioned into anisotropy
classes; each class is organized as a directed graph whose vertices all are
strips of the same anisotropy and whose edges link such strips to their ``good
continuations.'' The point-cloud data are reduced to counts that measure
membership in strips. Each anisotropy graph is reduced to a subgraph that
consist of strips with significant counts. The algorithm rejects $\mathbf{H}_0$
whenever some such subgraph contains a path that connects many consecutive
significant counts.
","[{""version"":""v1"",""created"":""Thu, 18 May 2006 15:01:06 GMT""}]","2007-06-13"
"math/0605514","Cheritat","Xavier Buff and Arnaud Cheritat","Quadratic Julia Sets with Positive Area","57 pages. In this update, we added lots of figures and detailed the
  proofs, especially in the section called ""the control of the post critical
  set""",,,,"math.DS",,"  We prove the existence of quadratic polynomials having a Julia set with
positive Lebesgue measure in three cases: the presence of a Cremer fixed point,
the presence of a Siegel disk, the presence of infinitely many (satellite)
renormalizations.
","[{""version"":""v1"",""created"":""Thu, 18 May 2006 15:25:52 GMT""},{""version"":""v2"",""created"":""Tue, 5 Feb 2008 15:10:53 GMT""}]","2008-02-05"
"math/0605515","Etienne Blanchard","Etienne Blanchard","Deformations of infinite projections",,,,,"math.OA",,"  Let $A=(A_x)$ be a (semi-)continuous field of $C^*$-algebras over a compact
Hausdorff space $X$ and let $p=(p_x)$ be a projection in $A$ such that each
$p_x\in A_x$ is properly infinite ($x\in X$). Then $p$ is properly infinite if
the field $A$ is upper semi-continuous. However, $p$ can be finite if the field
is lower semi-continuous.
","[{""version"":""v1"",""created"":""Thu, 18 May 2006 15:19:41 GMT""},{""version"":""v2"",""created"":""Mon, 7 Aug 2006 14:51:18 GMT""},{""version"":""v3"",""created"":""Tue, 8 Aug 2006 08:07:04 GMT""}]","2007-05-23"
"math/0605516","J. M. Speight","J.M. Speight and M. Svensson","On the Strong Coupling Limit of the Faddeev-Hopf Model","21 pages, 0 figures","Commun.Math.Phys.272:751-773,2007","10.1007/s00220-007-0240-4",,"math.DG hep-th",,"  The variational calculus for the Faddeev-Hopf model on a general Riemannian
domain, with general Kaehler target space, is studied in the strong coupling
limit. In this limit, the model has key similarities with pure Yang-Mills
theory, namely conformal invariance in dimension 4 and an infinite dimensional
symmetry group. The first and second variation formulae are calculated and
several examples of stable solutions are obtained. In particular, it is proved
that all immersive solutions are stable. Topological lower energy bounds are
found in dimensions 2 and 4. An explicit description of the spectral behaviour
of the Hopf map S^3 -> S^2 is given, and a conjecture of Ward concerning the
stability of this map in the full Faddeev-Hopf model is proved.
","[{""version"":""v1"",""created"":""Thu, 18 May 2006 15:24:12 GMT""}]","2008-11-26"
"nlin/0605037","Vassili Demergis","Vassili Demergis, Alexander Glasser, Marshal Miller, Thomas M.
  Antonsen Jr., Edward Ott, Steven M. Anlage","Delayed Feedback and Chaos on the Driven Diode-Terminated Transmission
  Line","9 pages, 8 figures",,,,"nlin.CD cond-mat.other",,"  A simple model of a distributed, non-linear circuit that produces chaos at
GHz frequencies is introduced and tested experimentally. The model circuit is a
driven diode-terminated transmission line with the transmission line impedance
mismatched to that of the source. Experiments were performed with sinusoidal
driving frequencies of 10 MHz to 1.2 GHz, driving powers of -30 to +50 dBm and
transmission line delay times from 3 to 20 ns. Diode reverse recovery times
ranged from 4 to 100 ns. As a result of many experiments, it was found that
chaotic behavior was strongly dependent on the unbiased, small-signal reactance
of the system as seen by the driving source, and influenced by an applied DC
voltage-bias across the diode. In the experiments that showed period-doubling
and / or chaos, the reverse recovery times of the diodes were on the order of
both the driving period and the delay time of the circuits. Comparisons between
theory and experiment are in general agreement. Chaos produced with a driving
frequency of 1.105 GHz has been observed experimentally.
","[{""version"":""v1"",""created"":""Thu, 18 May 2006 15:21:10 GMT""}]","2007-05-23"
"nucl-ex/0605021","Thomas A. Trainor","J. Adams, et al (STAR Collaboration)","The energy dependence of $p_t$ angular correlations inferred from
  mean-$p_{t}$ fluctuation scale dependence in heavy ion collisions at the SPS
  and RHIC","10 pages, 4 figures","J.Phys.G34:451-466,2007","10.1088/0954-3899/34/3/004",,"nucl-ex",,"  We present the first study of the energy dependence of $p_t$ angular
correlations inferred from event-wise mean transverse momentum $<p_{t} >$
fluctuations in heavy ion collisions. We compare our large-acceptance
measurements at CM energies $\sqrt{s_{NN}} =$ 19.6, 62.4, 130 and 200 GeV to
SPS measurements at 12.3 and 17.3 GeV. $p_t$ angular correlation structure
suggests that the principal source of $p_t$ correlations and fluctuations is
minijets (minimum-bias parton fragments). We observe a dramatic increase in
correlations and fluctuations from SPS to RHIC energies, increasing linearly
with $\ln \sqrt{s_{NN}}$ from the onset of observable jet-related $<p_{t}>$
fluctuations near 10 GeV.
","[{""version"":""v1"",""created"":""Wed, 17 May 2006 17:55:22 GMT""},{""version"":""v2"",""created"":""Wed, 20 Sep 2006 17:08:20 GMT""},{""version"":""v3"",""created"":""Thu, 7 Dec 2006 01:42:10 GMT""}]","2014-11-18"
"nucl-ex/0605022","Denis Artemenkov","T.V. Shchedrina, V. Bradnova, M.M. Chernyavsky, S.P. Kharlamov, A.D.
  Kovalenko, M. Haiduc, A.I. Malakhov, G.I. Orlova, P.A. Rukoyatkin, V.V.
  Rusakova, S. Vokal, A. Vokalova, P.I. Zarubin, and I.G. Zarubina","Peripheral interactions of relativistic $^{14}$N nuclei with emulsion
  nuclei","10 pages, 7 figures, 2 tables, conference: Conference on Physics of
  Fundamental Interactions, Moscow, Russia, 5-9 Dec 2005 (Author's translation)","Phys.Atom.Nucl.70:1230-1234,2007","10.1134/S1063778807070149",,"nucl-ex",,"  The results of investigations of the dissociation of a $^{14}$N nucleus of
momentum 2.86~A~GeV/c in photo-emulsion are presented. The main characteristics
of these reactions, that is the cross sections for various fragmentation
channels, are given.
  The fragmentation was analyzed by means of an invariant approach. The
momentum and correlation characteristics of $\alpha$ particles for the
$^{14}$N$\to3\alpha$+X channel in the laboratory system and the rest systems of
3$\alpha$ particles were considered.
  The results obtained for the $^{14}$N nucleus are compared with similar data
for the $^{12}$C and $^{16}$O nuclei.
","[{""version"":""v1"",""created"":""Thu, 18 May 2006 12:40:16 GMT""}]","2008-11-26"
"nucl-th/0605037","Rudolph C. Hwa","Rudolph C. Hwa and C. B. Yang","Forward Production With Large p/\pi Ratio and Without Jet Structure at
  Any p_T","17 page including 7 figs in eps. This revised version will be
  published in Phys. Rev. C",,"10.1103/PhysRevC.76.014901",,"nucl-th",,"  Particle production in the forward region of heavy-ion collisions is shown to
be due to parton recombination without shower partons. The regeneration of soft
partons due to momentum degradation through the nuclear medium is considered.
The degree of degradation is determined by fitting the $\bar p/p$ ratio. The
data at $\sqrt s=62.4$ GeV and $\eta=3.2$ from BRAHMS on the $p_T$ distribution
of average charged particles are well reproduced. Large proton-to-pion ratio is
predicted. The particles produced at any $p_T$ should have no associated
particles above background to manifest any jet structure.
","[{""version"":""v1"",""created"":""Wed, 17 May 2006 17:45:51 GMT""},{""version"":""v2"",""created"":""Thu, 24 Aug 2006 18:55:35 GMT""},{""version"":""v3"",""created"":""Mon, 26 Feb 2007 21:50:46 GMT""},{""version"":""v4"",""created"":""Tue, 29 May 2007 21:49:27 GMT""}]","2009-11-11"
"nucl-th/0605038","Chunbin Yang","L.L.Zhu and C.B. Yang","Particle distribution and nuclear stopping in Au-Au collisions at
  $\sqrt{s_{NN}}$=200 GeV","5 pages in RevTeX, 3 eps figures","Mod.Phys.Lett.A22:1105-1112,2007","10.1142/S0217732307021895",,"nucl-th",,"  The transverse momentum distribution of produced charged particles is
investigated for gold-gold collisions at $\sqrt{s_{NN}}=200$ GeV. A simple
parameterization is suggested for the particle distribution based on the
nuclear stopping effect. The model can fit very well both the transverse
momentum distributions at different pseudo-rapidities and the pseudo-rapidity
distributions at different centralities. The ratio of rapidity distributions
for peripheral and central collisions is calculated and compared with the data.
","[{""version"":""v1"",""created"":""Thu, 18 May 2006 07:16:50 GMT""}]","2008-11-26"
"nucl-th/0605039","Uzhinsky Vladimir Dr.Sc.","A. Galoyan, J. Ritman, V. Uzhinsky","Web-page on UrQMD Model Validation","20 pages, 1 figure",,,,"nucl-th hep-ph nucl-ex",,"  A WEB-page containing materials of comparing experimental data and UrQMD
model calculations has been designed. The page provides its user with a variety
of tasks solved with the help of the model, accuracy and/or quality of
experimental data description, and so on. The page can be useful for new
experimental data analysis, or new experimental research planning.
  The UrQMD model is cited in more than 272 publications. Only 44 of them
present original calculations. Their main results on the model are presented on
the page.
","[{""version"":""v1"",""created"":""Thu, 18 May 2006 08:28:11 GMT""}]","2007-05-23"
"nucl-th/0605040","Norbert Kaiser","N. Kaiser","Electromagnetic corrections to the dominant two-pion exchange
  nucleon-nucleon potential","7 pages, 1 figure, to be published in Physical Review C (2006): Brief
  Reports","Phys.Rev.C73:064003,2006","10.1103/PhysRevC.73.064003",,"nucl-th",,"  We calculate at two-loop order in chiral perturbation theory the
electromagnetic corrections to the dominant two-pion exchange nucleon-nucleon
interaction that is generated by the isoscalar $\pi N$ contact-vertex
proportional to the large low-energy constant $c_3$. We find that the
respective $2\pi\gamma$-exchange potential contains sizeable isospin-breaking
components which amount to about -1% of the strongly attractive isoscalar
central $2\pi$-exchange potential. The typical value of these novel
charge-independence and charge-symmetry breaking central potentials is $0.3
$MeV at a nucleon distance of $r= m_\pi^{-1} = 1.4 $fm. Our analytical result
for this presumably dominant $2\pi\gamma$-exchange interaction is in a form
such that it can be easily implemented into phase-shift analyses and few-body
calculations.
","[{""version"":""v1"",""created"":""Thu, 18 May 2006 12:57:21 GMT""},{""version"":""v2"",""created"":""Fri, 19 May 2006 09:44:03 GMT""}]","2008-11-26"
"nucl-th/0605041","Gerhard Burau","E. Santini, G. Burau, Amand Faessler, C. Fuchs (Institute for
  Theoretical Physics, University of Tuebingen, Germany)","Medium effects on phi decays to dilepton and kaon-antikaon pairs in
  relativistic heavy ion reactions","6 pages with 2 figures, accepted for publication in Eur. Phys. J. A","Eur.Phys.J. A28 (2006) 187-192","10.1140/epja/i2006-10048-2",,"nucl-th nucl-ex",,"  We consider the role of rescattering of secondary kaons on the dilepton
branching ratio of the phi meson. In-medium mass modifications and broadening
of kaons and phi mesons are taken into account. We find in the framework of a
Bjorken scenario for the time evolution of the expanding fireball that the phi
yield from dimuons is moderately or at least only slightly enhanced compared to
that from kaon-antikaon pairs. The relation to experimental yields measured by
the NA49, NA50 and CERES Collaborations at CERN SPS and the PHENIX
Collaboration at RHIC is discussed.
","[{""version"":""v1"",""created"":""Thu, 18 May 2006 13:03:42 GMT""}]","2009-11-11"
"nucl-th/0605042","Francesca Gulminelli","F. Gulminelli (LPCC), P. Chomaz (GANIL), C. Ducoin (LPCC, Ganil), P.
  Napolitani (GANIL), K. Hasnaoui (GANIL)","From multifragmentation to supernovae and neutron stars","To be published in Acta Phys. Hung. A","AIPConf.Proc.884:318-326,2007","10.1063/1.2710599",,"nucl-th",,"  The thermodynamics properties of globally neutral dense stellar matter are
analyzed both in terms of mean field instabilities and structures beyond the
mean field. The mean field response to finite wavelenght fluctuations is
calculated with the realistic Sly230a effective interaction. A Monte Carlo
simulation of a schematic lattice Hamiltonian shows the importance of
calculations beyond the mean field to calculate the phase diagram of stellar
matter. The analogies and differences respect to the thermodynamics of nuclear
matter and finite nuclei are stressed.
","[{""version"":""v1"",""created"":""Thu, 18 May 2006 13:41:54 GMT""}]","2008-11-26"
"physics/0605142","Sergey Plis","S.M. Plis, D.M. Schmidt, S.C. Jun, D.M. Ranken","A generalized spatiotemporal covariance model for stationary background
  in analysis of MEG data","4 pages, EMBS 2006 conference",,,"LAUR-062619","physics.med-ph physics.data-an",,"  Using a noise covariance model based on a single Kronecker product of spatial
and temporal covariance in the spatiotemporal analysis of MEG data was
demonstrated to provide improvement in the results over that of the commonly
used diagonal noise covariance model. In this paper we present a model that is
a generalization of all of the above models. It describes models based on a
single Kronecker product of spatial and temporal covariance as well as more
complicated multi-pair models together with any intermediate form expressed as
a sum of Kronecker products of spatial component matrices of reduced rank and
their corresponding temporal covariance matrices. The model provides a
framework for controlling the tradeoff between the described complexity of the
background and computational demand for the analysis using this model. Ways to
estimate the value of the parameter controlling this tradeoff are also
discussed
","[{""version"":""v1"",""created"":""Wed, 17 May 2006 17:47:23 GMT""}]","2007-05-23"
"physics/0605144","Eyal Feigenbaum","Eyal Feigenbaum and Meir Orenstein (Technion, Israel institue of
  technology)","Plasmon-Soliton","12 pages, 2 figures","Opt. Lett. 32, 674 (2007)","10.1364/OL.32.000674",,"physics.optics",,"  Formation of a novel hybrid-vector spatial plasmon-soliton in a Kerr slab
embedded in-between metal plates is predicted and analyzed with a modified
NLSE, encompassing hybrid vector field characteristics. Assisted by the
transverse plasmonic effect, the self trapping dimension of the plasmon-soliton
was substantially compressed (compared to the dielectrically cladded slab case)
when reducing the slab width. The practical limitation of the Plasmon-soliton
size reduction is determined by available nonlinear materials and metal loss.
For the extreme reported values of nonlinear index change, we predict soliton
with a cross section of 300nm x 30nm (average dimension of 100nm).
","[{""version"":""v1"",""created"":""Wed, 17 May 2006 17:50:31 GMT""},{""version"":""v2"",""created"":""Tue, 15 Apr 2008 13:41:13 GMT""}]","2009-11-11"
