"cond-mat/0605624","Yonatan Dubi","Yonatan Dubi","Pair correlations and the survival of superconductivity in and around a
  super-conducting impurity","Accepted for publication in Phys.Rev.B",,"10.1103/PhysRevB.75.094510",,"cond-mat.mes-hall cond-mat.supr-con",,"  The problem of the survival of superconductivity in a small super-conducting
grain placed in a metal substrate is addressed. For this aim the pair
correlations and super-conducting gap around and inside a negative-U impurity
in one and two dimensions is calculated, in a discrete tight-binding model and
a continuous model. Using the Hartree-Fock-Gorkov mean-field decomposition, it
is found that pairing inside the gap occurs when the system has a degeneracy
between successive number of electron pairs, and is highly sensitive to the
chemical potential. For finite pairing in the island, pair correlations in the
normal part may either decay exponentially or be long-ranged, depending on the
strength of interaction. In addition, it is shown analytically that there is a
minimal island size under-which pairing vanishes, and that it scales as a
power-law, rather then exponentially as in isolated grains.
  These results are interpreted in terms of screening of the negative-U
impurity by the electron gas.
","[{""version"":""v1"",""created"":""Thu, 25 May 2006 11:03:17 GMT""},{""version"":""v2"",""created"":""Thu, 15 Feb 2007 21:36:42 GMT""}]","2015-06-25"
"cond-mat/0605625","Nicolas Dupuis","N. Dupuis","Comment on ``Universal Spin-Flip Transition in Itinerant
  Antiferromagnets""","1 page, 2 figures","Phys. Rev. Lett. 96, 209701 (2006)","10.1103/PhysRevLett.96.209701",,"cond-mat.str-el",,"  In a recent paper [Phys. Rev. Lett. 91, 117201 (2003)], it is argued that an
itinerant antiferromagnet in an external magnetic field undergoes a spin-flip
transition, in marked contrast with the behavior of a localized
antiferromagnet: for a weak magnetic field, the magnetization is parallel to
the field, and flips to the perpendicular configuration at a critical value of
the field. In this Comment we show that these conclusions are incorrect. The
canted state (not considered in the Letter) is the antiferromagnetic ground
state of the system up to a critical value of the field where the normal state
is restored, in qualitative agreement with the behavior of the magnetization in
a localized antiferromagnet.
","[{""version"":""v1"",""created"":""Thu, 25 May 2006 11:14:27 GMT""}]","2007-05-23"
"cond-mat/0605626","Valentin Ryzhov","V.V. Brazhkin","High-Pressure Synthesized Materials: a Chest of Treasure and Hints","32 pages",,"10.1080/08957950701546956",,"cond-mat.mtrl-sci",,"  The present review covers the production of new materials under high
pressures. A primary limitation on the use of pressures higher than 1 GPa is a
small volume and mass of a produced material. Therefore, despite an extremely
wide range of new high-pressure synthesized substances with unique properties,
synthesis on an commercial scale is applied up to now only to obtain superhard
materials, this real treasure of today's industry. At the same time,
high-pressure experiments often give material scientists a hint at what new
intriguing substances can exist in principle. This is true for new superhard,
semiconducting, magnetic, superconducting and optical materials already
synthesized under pressure, and as well as for a large number of hypothetic new
polymers from low-Z elements. Many of new materials, including the above
polymers, may exist in the metastable form at normal pressure at sufficiently
high temperatures.
","[{""version"":""v1"",""created"":""Thu, 25 May 2006 11:29:08 GMT""}]","2015-06-25"
"cond-mat/0605627","Lode Pollet","Massimo Boninsegni, Anatoly Kuklov, Lode Pollet, Nikolay Prokof'ev,
  Boris Svistunov, Matthias Troyer","The fate of vacancy-induced supersolidity in 4He","4 pages,4 figures. Replaced with published version","Phys. Rev. Lett. 97, 080401 (2006)","10.1103/PhysRevLett.97.080401",,"cond-mat.other",,"  The supersolid state of matter, exhibiting non-dissipative flow in solids,
has been elusive for thirty five years. The recent discovery of a non-classical
moment of inertia in solid 4He by Kim and Chan provided the first experimental
evidence, although the interpretation in terms of supersolidity of the ideal
crystal phase remains subject to debate. Using quantum Monte Carlo methods we
investigate the long-standing question of vacancy-induced superflow and find
that vacancies in a 4He crystal phase separate instead of forming a supersolid.
On the other hand, non-equilibrium vacancies relaxing on defects of
poly-crystalline samples could provide an explanation for the experimental
observations.
","[{""version"":""v1"",""created"":""Thu, 25 May 2006 12:14:32 GMT""},{""version"":""v2"",""created"":""Sat, 26 Aug 2006 14:13:13 GMT""}]","2007-05-23"
"cond-mat/0605628","Alaa Abd El-Hady","A. Abd El-Hady and A. Y. Abul-Magd","Level statistics for two-dimensional oscillators","13 pages, 8 figures",,,,"cond-mat.stat-mech nlin.CD",,"  We consider the level statistics of two-dimensional harmonic oscillators with
incommensurable frequencies, which are known to have picket-fence type spectra.
We propose a parametric representation for the level-spacing distribution and
level-number variance, and study the variation of the parameters with the
frequency ratio and the size of the spectra. By introducing an anharmonic
perturbation, we observe a gradual transition to the Poisson statistics. We
describe the level spectra in transition from harmonic to Poissonian statistics
as a superposition of two independent sequences, one for each of the two
extreme statistics. We show that this transition provides a suitable
description for the evolution of the spectrum of a disordered chain with
increasing long range correlations between the lattice sites.
","[{""version"":""v1"",""created"":""Thu, 25 May 2006 12:11:30 GMT""}]","2007-05-23"
"cond-mat/0605629","Valeriy Demidov Dr","J.Bruening, V.V.Demidov, V.A.Geyler, A.V.Popov","Spectrum structure for a three-dimensional periodic array of quantum
  dots in a uniform magnetic field","10 pages, 5 figures",,,,"cond-mat.mes-hall",,"  By means of the operator extension theory, we construct an explicitly
solvable model of a simple-cubic three-dimensional regimented array of quantum
dots in the presence of a uniform magnetic field. The spectral properties of
the model are studied. It is proved that for each magnetic flux the band is the
image of the spectrum of the tight-binding operator under an analytical
transformation. In the case of rational magnetic flux the spectrum is described
analytically. The flux-energy and angle-energy diagrams are obtained
numerically.
","[{""version"":""v1"",""created"":""Thu, 25 May 2006 13:47:10 GMT""}]","2007-05-23"
"cond-mat/0605630","Christoph Groth","C. W. Groth, B. Michaelis, and C. W. J. Beenakker","Counting statistics of coherent population trapping in quantum dots","4 pages, 2 figures","Phys. Rev. B 74, 125315 (2006)","10.1103/PhysRevB.74.125315",,"cond-mat.mes-hall",,"  Destructive interference of single-electron tunneling between three quantum
dots can trap an electron in a coherent superposition of charge on two of the
dots. Coupling to external charges causes decoherence of this superposition,
and in the presence of a large bias voltage each decoherence event transfers a
certain number of electrons through the device. We calculate the counting
statistics of the transferred charges, finding a crossover from sub-Poissonian
to super-Poissonian statistics with increasing ratio of tunnel and decoherence
rates.
","[{""version"":""v1"",""created"":""Thu, 25 May 2006 14:15:23 GMT""},{""version"":""v2"",""created"":""Fri, 25 May 2007 14:13:18 GMT""}]","2007-06-13"
"cond-mat/0605631","Mikhail Zverev","M.V.Zverev, V.A.Khodel, J.W.Clark","Nodes of the Gap Function and Anomalies in Thermodynamic Properties of
  Superfluid $^3$He","17 pages, 4 figures","J. Low Temp. Phys. 147, 645 (2007)","10.1007/s10909-007-9346-5",,"cond-mat.supr-con",,"  Departures of thermodynamic properties of three-dimensional superfluid $^3$He
from the predictions of BCS theory are analyzed. Attention is focused on
deviations of the ratios $\Delta(T=0)/T_c$ and $[C_s(T_c)-C_n(T_c)]/C_n(T_c)$
from their BCS values, where $\Delta(T=0)$ is the pairing gap at zero
temperature, $T_c$ is the critical temperature, and $C_s$ and $C_n$ are the
superfluid and normal specific heats. We attribute these deviations to the
momentum dependence of the gap function $\Delta(p)$, which becomes well
pronounced when this function has a pair of nodes lying on either side of the
Fermi surface. We demonstrate that such a situation arises if the P-wave
pairing interaction $V(p_1,p_2)$, evaluated at the Fermi surface, has a sign
opposite to that anticipated in BCS theory. Taking account of the momentum
structure of the gap function, we derive a closed relation between the two
ratios that contains no adjustable parameters and agrees with the experimental
data. Some important features of the effective pairing interaction are inferred
from the analysis.
","[{""version"":""v1"",""created"":""Thu, 25 May 2006 14:43:05 GMT""}]","2009-11-11"
"cond-mat/0605632","Malay Bandyopadhyay","Malay Bandyopadhyay and Sushanta Dattagupta","Landau-Drude Diamagnetism: Fluctuation, Dissipation and Decoherence","8 pages and 5 figures",,"10.1088/0953-8984/18/44/004",,"cond-mat.stat-mech",,"  Starting from a quantum Langevin equation (QLE) of a charged particle coupled
to a heat bath in the presence of an external magnetic field, we present a
fully dynamical calculation of the susceptibility tensor. We further evaluate
the position autocorrelation function by using the Gibbs ensemble approach.
This quantity is shown to be related to the imaginary part of the dynamical
susceptibility, thereby validating the fluctuation-dissipation theorem in the
context of dissipative diamagnetism. Finally we present an overview of
coherence-to-decoherence transition in the realm of dissipative diamagnetism at
zero temperature. The analysis underscores the importance of the details of the
relevant physical quantity, as far as coherence to decoherence transition is
concerned.
","[{""version"":""v1"",""created"":""Thu, 25 May 2006 15:45:49 GMT""}]","2009-11-11"
"cs/0605104","Blake Hegerle","Blake Hegerle","Parsing Transformative LR(1) Languages","68 pages, 4 figures. Numerous stylistic and grammatical fixes; new
  material in Sections 2.2 and 4.2",,,,"cs.PL",,"  We consider, as a means of making programming languages more flexible and
powerful, a parsing algorithm in which the parser may freely modify the grammar
while parsing. We are particularly interested in a modification of the
canonical LR(1) parsing algorithm in which, after the reduction of certain
productions, we examine the source sentence seen so far to determine the
grammar to use to continue parsing. A naive modification of the canonical LR(1)
parsing algorithm along these lines cannot be guaranteed to halt; as a result,
we develop a test which examines the grammar as it changes, stopping the parse
if the grammar changes in a way that would invalidate earlier assumptions made
by the parser. With this test in hand, we can develop our parsing algorithm and
prove that it is correct. That being done, we turn to earlier, related work;
the idea of programming languages which can be extended to include new
syntactic constructs has existed almost as long as the idea of high-level
programming languages. Early efforts to construct such a programming language
were hampered by an immature theory of formal languages. More recent efforts to
construct transformative languages relied either on an inefficient chain of
source-to-source translators; or they have a defect, present in our naive
parsing algorithm, in that they cannot be known to halt. The present algorithm
does not have these undesirable properties, and as such, it should prove a
useful foundation for a new kind of programming language.
","[{""version"":""v1"",""created"":""Wed, 24 May 2006 19:09:39 GMT""},{""version"":""v2"",""created"":""Wed, 26 Jul 2006 14:39:56 GMT""}]","2007-05-23"
"cs/0605110","Marko Antonio Rodriguez","Marko A. Rodriguez, Johan Bollen, Herbert Van de Sompel","Mapping the Bid Behavior of Conference Referees",,"Journal of Informetrics, volume 1, number 1, pp. 62-82, ISSN:
  1751-1577, January 2007","10.1016/j.joi.2006.09.006","LA-UR-06-0749","cs.DL cs.CY",,"  The peer-review process, in its present form, has been repeatedly criticized.
Of the many critiques ranging from publication delays to referee bias, this
paper will focus specifically on the issue of how submitted manuscripts are
distributed to qualified referees. Unqualified referees, without the proper
knowledge of a manuscript's domain, may reject a perfectly valid study or
potentially more damaging, unknowingly accept a faulty or fraudulent result. In
this paper, referee competence is analyzed with respect to referee bid data
collected from the 2005 Joint Conference on Digital Libraries (JCDL). The
analysis of the referee bid behavior provides a validation of the intuition
that referees are bidding on conference submissions with regards to the subject
domain of the submission. Unfortunately, this relationship is not strong and
therefore suggests that there exists other factors beyond subject domain that
may be influencing referees to bid for particular submissions.
","[{""version"":""v1"",""created"":""Wed, 24 May 2006 16:45:08 GMT""}]","2021-08-23"
"cs/0605111","Jon Phipps","Diane I. Hillmann (1), Stuart A. Sutton (2), Jon Phipps (1), Ryan
  Laundry (2) ((1) Cornell University, (2) University of Washington)","A Metadata Registry from Vocabularies UP: The NSDL Registry Project","Submitted to Dublin Core 2006 Conference (DC2006)",,,,"cs.DL",,"  The NSDL Metadata Registry is designed to provide humans and machines with
the means to discover, create, access and manage metadata schemes, schemas,
application profiles, crosswalks and concept mappings. This paper describes the
general goals and architecture of the NSDL Metadata Registry as well as issues
encountered during the first year of the project's implementation.
","[{""version"":""v1"",""created"":""Wed, 24 May 2006 16:51:43 GMT""}]","2007-05-23"
"cs/0605112","Marko Antonio Rodriguez","Marko A. Rodriguez, Johan Bollen","An Algorithm to Determine Peer-Reviewers","Rodriguez, M.A., Bollen, J., ""An Algorithm to Determine
  Peer-Reviewers"", Conference on Information and Knowledge Management, in
  press, ACM, LA-UR-06-2261, October 2008; ISBN:978-1-59593-991-3","Conference on Information and Knowledge Management (CIKM), ACM,
  pages 319-328, (October 2008)","10.1145/1458082.1458127","LA-UR-06-2261","cs.DL cs.AI cs.DS","http://arxiv.org/licenses/nonexclusive-distrib/1.0/","  The peer-review process is the most widely accepted certification mechanism
for officially accepting the written results of researchers within the
scientific community. An essential component of peer-review is the
identification of competent referees to review a submitted manuscript. This
article presents an algorithm to automatically determine the most appropriate
reviewers for a manuscript by way of a co-authorship network data structure and
a relative-rank particle-swarm algorithm. This approach is novel in that it is
not limited to a pre-selected set of referees, is computationally efficient,
requires no human-intervention, and, in some instances, can automatically
identify conflict of interest situations. A useful application of this
algorithm would be to open commentary peer-review systems because it provides a
weighting for each referee with respects to their expertise in the domain of a
manuscript. The algorithm is validated using referee bid data from the 2005
Joint Conference on Digital Libraries.
","[{""version"":""v1"",""created"":""Wed, 24 May 2006 17:06:32 GMT""},{""version"":""v2"",""created"":""Tue, 15 Jul 2008 22:24:28 GMT""}]","2008-12-02"
"cs/0605113","Johan Bollen","Johan Bollen and Herbert Van de Sompel","An Architecture for the Aggregation and Analysis of Scholarly Usage Data","to be published in Proceedings of the Joint Conference on Digital
  Libraries, 2006",,,,"cs.DL",,"  Although recording of usage data is common in scholarly information services,
its exploitation for the creation of value-added services remains limited due
to concerns regarding, among others, user privacy, data validity, and the lack
of accepted standards for the representation, sharing and aggregation of usage
data. This paper presents a technical, standards-based architecture for sharing
usage information, which we have designed and implemented. In this
architecture, OpenURL-compliant linking servers aggregate usage information of
a specific user community as it navigates the distributed information
environment that it has access to. This usage information is made OAI-PMH
harvestable so that usage information exposed by many linking servers can be
aggregated to facilitate the creation of value-added services with a reach
beyond that of a single community or a single information service. This paper
also discusses issues that were encountered when implementing the proposed
approach, and it presents preliminary results obtained from analyzing a usage
data set containing about 3,500,000 requests aggregated by a federation of
linking servers at the California State University system over a 20 month
period.
","[{""version"":""v1"",""created"":""Wed, 24 May 2006 18:06:49 GMT""}]","2007-05-23"
"cs/0605114","Abhishek Parakh","Abhishek Parakh","Oblivious Transfer using Elliptic Curves","10 pages","Cryptologia, Volume 31, Issue 2 April 2007, pages 125 - 132",,,"cs.CR",,"  This paper proposes an algorithm for oblivious transfer using elliptic
curves. Also, we present its application to chosen one-out-of-two oblivious
transfer.
","[{""version"":""v1"",""created"":""Wed, 24 May 2006 17:58:59 GMT""}]","2007-06-13"
"cs/0605115","Nick Jones","Nick S. Jones, Lluis Masanes","Key Distillation and the Secret-Bit Fraction","12 pages","IEEE Trans. Inf. Theory, Vol. 54, No. 2, pp 680-691 (2008)","10.1109/TIT.2007.913264",,"cs.CR cs.IT math.IT quant-ph",,"  We consider distillation of secret bits from partially secret noisy
correlations P_ABE, shared between two honest parties and an eavesdropper. The
most studied distillation scenario consists of joint operations on a large
number of copies of the distribution (P_ABE)^N, assisted with public
communication. Here we consider distillation with only one copy of the
distribution, and instead of rates, the 'quality' of the distilled secret bits
is optimized, where the 'quality' is quantified by the secret-bit fraction of
the result. The secret-bit fraction of a binary distribution is the proportion
which constitutes a secret bit between Alice and Bob. With local operations and
public communication the maximal extractable secret-bit fraction from a
distribution P_ABE is found, and is denoted by Lambda[P_ABE]. This quantity is
shown to be nonincreasing under local operations and public communication, and
nondecreasing under eavesdropper's local operations: it is a secrecy monotone.
It is shown that if Lambda[P_ABE]>1/2 then P_ABE is distillable, thus providing
a sufficient condition for distillability. A simple expression for
Lambda[P_ABE] is found when the eavesdropper is decoupled, and when the honest
parties' information is binary and the local operations are reversible.
Intriguingly, for general distributions the (optimal) operation requires local
degradation of the data.
","[{""version"":""v1"",""created"":""Wed, 24 May 2006 18:56:15 GMT""},{""version"":""v2"",""created"":""Mon, 12 May 2008 14:21:30 GMT""}]","2008-05-12"
"cs/0605116","Nan Liu","Nan Liu and Sennur Ulukus","Optimal Distortion-Power Tradeoffs in Gaussian Sensor Networks","5 pages, 0 figure, To appear in ISIT 2006",,,,"cs.IT math.IT",,"  We investigate the optimal performance of dense sensor networks by studying
the joint source-channel coding problem. The overall goal of the sensor network
is to take measurements from an underlying random process, code and transmit
those measurement samples to a collector node in a cooperative multiple access
channel with imperfect feedback, and reconstruct the entire random process at
the collector node. We provide lower and upper bounds for the minimum
achievable expected distortion when the underlying random process is Gaussian.
In the case where the random process satisfies some general conditions, we
evaluate the lower and upper bounds explicitly and show that they are of the
same order for a wide range of sum power constraints. Thus, for these random
processes, under these sum power constraints, we determine the achievability
scheme that is order-optimal, and express the minimum achievable expected
distortion as a function of the sum power constraint.
","[{""version"":""v1"",""created"":""Wed, 24 May 2006 20:58:55 GMT""}]","2007-07-13"
"cs/0605117","Seijoon Shim","Seijoon Shim, Chan-Byoung Chae, and Robert W. Heath Jr","A Lattice-Based MIMO Broadcast Precoder for Multi-Stream Transmission","30 pages, 9 figures, submitted to IEEE Trans. on Communications and
  partly submitted to the Globecomm 2006",,,,"cs.IT math.IT",,"  Precoding with block diagonalization is an attractive scheme for approaching
sum capacity in multiuser multiple input multiple output (MIMO) broadcast
channels. This method requires either global channel state information at every
receiver or an additional training phase, which demands additional system
planning. In this paper we propose a lattice based multi-user precoder that
uses block diagonalization combined with pre-equalization and perturbation for
the multiuser MIMO broadcast channel. An achievable sum rate of the proposed
scheme is derived and used to show that the proposed technique approaches the
achievable sum rate of block diagonalization with water-filling but does not
require the additional information at the receiver. Monte Carlo simulations
with equal power allocation show that the proposed method provides better bit
error rate and diversity performance than block diagonalization with a
zero-forcing receiver. Additionally, the proposed method shows similar
performance to the maximum likelihood receiver but with much lower receiver
complexity.
","[{""version"":""v1"",""created"":""Thu, 25 May 2006 02:32:54 GMT""}]","2007-07-13"
"cs/0605118","Deepak Sridhara","Christine A. Kelley, Deepak Sridhara, and Joachim Rosenthal","Pseudocodeword weights for non-binary LDPC codes","5 pages, 3 figures. To appear in Proceedings of the 2006 IEEE
  International Symposium on Information Theory, July 9-14, 2006, Seattle, USA",,"10.1109/ISIT.2006.262072",,"cs.IT math.IT",,"  Pseudocodewords of q-ary LDPC codes are examined and the weight of a
pseudocodeword on the q-ary symmetric channel is defined. The weight definition
of a pseudocodeword on the AWGN channel is also extended to two-dimensional
q-ary modulation such as q-PAM and q-PSK. The tree-based lower bounds on the
minimum pseudocodeword weight are shown to also hold for q-ary LDPC codes on
these channels.
","[{""version"":""v1"",""created"":""Wed, 24 May 2006 22:03:41 GMT""}]","2016-11-17"
"cs/0605119","Victor Kryssanov","V.V. Kryssanov, H. Tamaki, and K. Ueda","An Internet-enabled technology to support Evolutionary Design","23 pages, 3 figures. Preprint completed in 2000","Journal of Engineering Manufacture. 2001, Vol.215, No.B5, 647-655",,,"cs.CE cs.AI cs.AR cs.MA cs.NI",,"  This paper discusses the systematic use of product feedback information to
support life-cycle design approaches and provides guidelines for developing a
design at both the product and the system levels. Design activities are
surveyed in the light of the product life cycle, and the design information
flow is interpreted from a semiotic perspective. The natural evolution of a
design is considered, the notion of design expectations is introduced, and the
importance of evaluation of these expectations in dynamic environments is
argued. Possible strategies for reconciliation of the expectations and
environmental factors are described. An Internet-enabled technology is proposed
to monitor product functionality, usage, and operational environment and supply
the designer with relevant information. A pilot study of assessing design
expectations of a refrigerator is outlined, and conclusions are drawn.
","[{""version"":""v1"",""created"":""Thu, 25 May 2006 04:39:11 GMT""}]","2007-05-23"
