"astro-ph/0605684","Brian Murray","Brian M. Murray and Yun Soo Myung","Gauss-Bonnet braneworld and WMAP three year results","14 pages, 7 figures, 2 tables, and version to appear in PLB","Phys.Lett. B642 (2006) 426-431","10.1016/j.physletb.2006.09.068",,"astro-ph gr-qc",,"  We compare predictions for the spectral index and tensor-scalar ratio in
models of patch inflation with the WMAP three year data. There are three cases
of these models of inflation, which arise in the Gauss-Bonnet braneworld
scenario: Gauss-Bonnet (GB), Randall-Sundrum (RS), and 4D general relativity
(GR). We consider the large-field potential $V \propto \phi^p$ in both
commutative and noncommutative spacetimes, and find that in the cases of the GB
and GR patch cosmologies, the quadratic potential is observationally favored,
while the quartic potential is ruled out in most patches. Strong noncommutative
inflation is excluded in all cases because it leads to a blue-tilted scalar
spectral index.
","[{""version"":""v1"",""created"":""Sat, 27 May 2006 18:53:26 GMT""},{""version"":""v2"",""created"":""Thu, 12 Oct 2006 00:59:39 GMT""}]","2010-04-05"
"astro-ph/0605685","M\'ario Monteiro","M.K.J.P.F.G. Monteiro, Y. Lebreton, J. Montalban, J.
  Christensen-Dalsgaard, M. Castro, S. Degl'Innocenti, A. Moya, I. W. Roxburgh,
  R. Scuflaire, A. Baglin, M. S. Cunha, P. Eggenberger, J. Fernandes, M. J.
  Goupil, A. Hui-Bon-Hoa, M. Marconi, J. P. Marques, E. Michel, A. Miglio, P.
  Morel, B. Pichon, P. G. Prada Moroni, J. Provost, A. Ruoppo, J.-C. Suarez, M.
  Suran, T. C. Teixeira","Report on the CoRoT Evolution and Seismic Tools Activity","To appear in: ""The CoRoT Book"", (Eds) F. Favata, A. Baglin & J.
  Lochard, ESA Publications Division, ESA SP","ESA Spec.Publ. 1306 (2006) 363",,,"astro-ph",,"  We present the work undertaken by the Evolution and Seismic Tools Activity
(ESTA) team of the CoRoT Seismology Working Group. We have focused on two main
tasks: Task 1 - now finished - has aimed at testing, comparing and optimising
seven stellar evolution codes which will be used to model the internal
structure and evolution of the CoRoT target stars. Task 2, still underway, aims
at testing, comparing and optimising different seismic codes used to calculate
the oscillations of models for different types of stars. The results already
obtained are quite satisfactory, showing minor differences between the
different numerical tools provided the same assumptions on the physical
parameters are made. This work gives us confidence on the numerical tools that
will be available to interpret the future CoRoT seismic data.
","[{""version"":""v1"",""created"":""Sat, 27 May 2006 19:56:38 GMT""}]","2007-05-23"
"astro-ph/0605686","Moshe Elitzur","Moshe Elitzur and Isaac Shlosman","The AGN Obscuring Torus -- End of the ""Doughnut"" Paradigm?","ApJ Letters, to be published","Astrophys.J.648:L101-L104,2006","10.1086/508158",,"astro-ph",,"  Unified schemes of active galactic nuclei (AGN) require an obscuring dusty
torus around the central engine. The compact sizes (only a few pc) determined
in recent high-resolution observations require that the obscuring matter be
clumpy and located inside the region where the black-hole gravity dominates
over the galactic bulge. This location is in line with the scenario depicting
the torus as the region of the clumpy wind coming off the accretion disk in
which the clouds are dusty and optically thick. We study here the outflow
scenario within the framework of hydromagnetic disk winds, incorporating the
cloud properties determined from detailed modeling of the IR emission from
clumpy tori. We find that torus clouds were likely detected in recent water
maser observations of NGC 3079. In the wind scenario, the AGN main dynamic
channel for release of accreted mass seems to be switching at low luminosities
from torus outflow to radio jets. The torus disappears when the bolometric
luminosity decreases below about \E{42} erg/sec because the accretion onto the
central black hole can no longer sustain the required cloud outflow rate. This
disappearance seems to have been observed in both LINERs and radio galaxies.
With further luminosity decrease, suppression of cloud outflow spreads radially
inward from the disk's dusty, molecular region into its atomic, ionized zone,
resulting in disappearance of the broad emission line region at lower
luminosities, yet to be determined.
","[{""version"":""v1"",""created"":""Sun, 28 May 2006 07:31:52 GMT""},{""version"":""v2"",""created"":""Fri, 4 Aug 2006 16:10:42 GMT""}]","2011-02-11"
"astro-ph/0605687","Liang Gao","liang Gao, Simon D. M. White","Asymmetries in the inner regions of LCDM haloes","9 pages, 6 figures. MNRAS in press. Minor changes in text","Mon.Not.Roy.Astron.Soc.373:65-72,2006","10.1111/j.1365-2966.2006.11048.x",,"astro-ph",,"  Many galaxies display warps, lopsided images, asymmetric rotation curves or
other features which suggest that their immediate dynamical environment is
neither static nor in equilibrium. In Cold Dark Matter (CDM) theories, such
non-equilibrium features are expected in the inner regions of many dark haloes
as a result of recent hierarchical growth. We used the excellent statistics
provided by the very large Millennium Simulation to study (i) how the
distribution of position and velocity asymmetries predicted for halo cores by
the concordance LCDM cosmogony depends on halo mass, and (ii) how much of the
dark matter in the inner core has been added at relatively recent times.
Asymmetries are typically larger in more massive haloes. Thus 20% of cluster
halos have density centre separated from barycentre by more than 20% of the
virial radius, while only 7% of Milky Way halos have such large asymmetries.
About 40% of all cluster halos have a mean core velocity which differs from the
barycentre velocity by more than a quarter of the characteristic halo circular
velocity, whereas only 10% of Milky Way halos have such large velocity offsets.
About 25% of all cluster haloes have acquired more than a quarter of the mass
currently in their inner 10kpc through mergers since z=1. The corresponding
percentage of Milky Way haloes is 15%. These numbers seem quite compatible with
the levels of asymmetry seen in the observable regions of galaxies, but
quantitative comparison requires more detailed modelling of the observable
components.
","[{""version"":""v1"",""created"":""Sun, 28 May 2006 09:22:40 GMT""},{""version"":""v2"",""created"":""Wed, 20 Sep 2006 15:43:23 GMT""}]","2008-11-26"
"astro-ph/0605688","M. D. Maia","M. D. Maia, A. J. S. Capistrano, D.Mulller","Velocity Curves for Stars in Disk Galaxies: A case for Nearly Newtonian
  Dynamics","Submitted version, with corrected language and typos, simplified
  explanations and added references. 6 pages, 3 figures, revtex4",,,,"astro-ph gr-qc",,"  The dark matter constraint imposed by the recent WMAP experiment on
gravitational theories is analyzed. Using the non-linearity of the vacuum
Einstein's equations, it is shown that when the slow motion condition is
applied to the geodesic equations, the resulting nearly Newtonian gravitational
field describes nearly flat velocity curves for rotating stars in the vicinity
of thin disk galaxies.
","[{""version"":""v1"",""created"":""Sun, 28 May 2006 14:29:33 GMT""},{""version"":""v2"",""created"":""Fri, 16 Jun 2006 19:57:04 GMT""}]","2007-05-23"
"cond-mat/0605678","Jukka Pekola","M. Meschke, W. Guichard, J.P. Pekola","Single-mode heat conduction by photons","5 pages, 3 figures",,"10.1038/nature05276",,"cond-mat.mes-hall",,"  Electrical conductance is quantized in units of $\sigma_{\rm Q}=2e^2/h$ in
ballistic one-dimensional conductors. Similarly, thermal conductance at
temperature $T$ is expected to be limited by the quantum of thermal conductance
of one mode, $G_{\rm Q} = \frac{\pi k_{\rm B}^2}{6\hbar}T$, when physical
dimensions are small in comparison to characteristic wavelength of the
carriers. The relation between $\sigma_{\rm Q}$ and $G_{\rm Q}$ obeys the
Wiedemann-Franz law for ballistic electrons (apart from factor 2 in
$\sigma_{\rm Q}$ due to spin degeneracy), but somewhat amazingly the same
expression of $G_{\rm Q}$ is expected to hold also for phonons and photons, or
any other particles with arbitrary exclusion statistics. The single-mode heat
conductance is particularly relevant in nano-structures, e.g., when studying
heat conduction by phonons in dielectric materials, or cooling of electrons in
metals at very low temperatures. Here we show, based on our experimental
results, that at low temperatures heat is transferred by photon radiation, in
our case along a superconducting line, when electron-phonon as well as normal
electronic heat conduction are frozen out. Thermal conductance is limited by
$G_{\rm Q}$, approaching this value towards low temperatures. Our observation
has implications on, e.g., performance and design of ultra-sensitive bolometers
and electronic micro-refrigerators, whose operation is largely dependent on
weak thermal coupling between the device and its environment.
","[{""version"":""v1"",""created"":""Sun, 28 May 2006 08:33:28 GMT""}]","2009-11-11"
"cond-mat/0605684","Qijin Chen","Chih-Chun Chien, Qijin Chen, Yan He, and K. Levin","Finite temperature effects in trapped Fermi gases with population
  imbalance",,"Phys. Rev. A 74, 021602(R) 2006","10.1103/PhysRevA.74.021602",,"cond-mat.str-el cond-mat.quant-gas cond-mat.supr-con",,"  We study the finite temperature $T$ behavior of trapped Fermi gases as they
undergo BCS-Bose Einstein condensation (BEC) crossover, in the presence of a
population imbalance. Our results, in qualitative agreement with recent
experiments, show how the superfluid phase transition is directly reflected in
the particle density profiles. We demonstrate that at $ T \neq 0$ and in the
near-BEC and unitary regimes, the polarization is excluded from the superfluid
core. Nevertheless a substantial polarization fraction is carried by a normal
region of the trap having strong pair correlations, which we associate with
noncondensed pairs or the ``pseudogap phase''.
","[{""version"":""v1"",""created"":""Sun, 28 May 2006 10:36:44 GMT""}]","2011-09-13"
"cond-mat/0605685","Sahel Ashhab","S. Ashhab, Shigemasa Matsuo, Noriyuki Hatakenaka, Franco Nori","Generalized switchable coupling for superconducting qubits using double
  resonance","7 pages, 4 figures","Phys. Rev. B 74, 184504 (2006)","10.1103/PhysRevB.74.184504",,"cond-mat.supr-con",,"  We propose a method for switchable coupling between superconducting qubits
using double resonance. The inter-qubit coupling is achieved by applying
near-resonant oscillating fields to the two qubits. The deviation from
resonance relaxes the criterion of strong driving fields while still allowing
for a fully entangling two-qubit gate. This method avoids some of the
shortcomings of previous proposals for switchable coupling. We discuss the
possible application of our proposal to a pair of inductively coupled flux
qubits, and we consider the extension to phase qubits.
","[{""version"":""v1"",""created"":""Sun, 28 May 2006 11:33:24 GMT""},{""version"":""v2"",""created"":""Tue, 7 Nov 2006 02:16:19 GMT""}]","2007-05-23"
"cond-mat/0605686","David G. Grier","Yael Roichman, George Zaslavsky and David G. Grier","Weak chaos and fractional dynamics in an optically driven colloidal ring","4 pages, 5 figures",,,,"cond-mat.soft cond-mat.stat-mech",,"  Three colloidal spheres driven around a ring-like optical trap known as an
optical vortex have been predicted to undergo periodic collective motion due to
their hydrodynamic coupling. In fact, the quenched disorder in the
optically-implemented potential energy landscape drives a transition to
instability evolving into microscopic weak chaos with fractional dynamics. As a
result, the relation between the space-time selfsimilarity of the system's
collective transport properties and its microscopic weak chaos dynamics is
revealed.
","[{""version"":""v1"",""created"":""Sun, 28 May 2006 12:45:09 GMT""}]","2007-05-23"
"gr-qc/0605141","John W. Moffat","J. W. Moffat","Time Delay Predictions in a Modified Gravity Theory","5 pages, LaTex file, no figures. Corrections to Table 1","Class.Quant.Grav. 23 (2006) 6767-6772","10.1088/0264-9381/23/23/009",,"gr-qc",,"  The time delay effect for planets and spacecraft is obtained from a fully
relativistic modified gravity theory including a fifth force skew symmetric
field by fitting to the Pioneer 10/11 anomalous acceleration data. A possible
detection of the predicted time delay corrections to general relativity for the
outer planets and future spacecraft missions is considered. The time delay
correction to GR predicted by the modified gravity is consistent with the
observational limit of the Doppler tracking measurement reported by the Cassini
spacecraft on its way to Saturn, and the correction increases to a value that
could be measured for a spacecraft approaching Neptune and Pluto.
","[{""version"":""v1"",""created"":""Sat, 27 May 2006 16:12:11 GMT""},{""version"":""v2"",""created"":""Thu, 1 Jun 2006 14:17:31 GMT""}]","2009-11-11"
"gr-qc/0605142","Richard T. Hammond","Richard T Hammond","Geometrical Origin of the Cosmological Term","7 pages","Int.J.Mod.Phys.D15:2159-2164,2006","10.1142/S0218271806009789",,"gr-qc",,"  Nonmetricity derived from a scalar field is shown to exist as a cosmic field,
without direct coupling to matter. It leads to a variable cosmological term, a
term that dominates the expansion in the early universe but dies away at later
time.
","[{""version"":""v1"",""created"":""Sat, 27 May 2006 20:53:16 GMT""}]","2008-11-26"
"hep-ex/0605111","Christophe Clement","Christophe Clement","Tevatron Top Results","Proceedings of Flavor Physics & CP Violation Conference, Vancouver,
  2006","ECONF C060409:030,2006",,"fpcp06_341","hep-ex",,"  I present the latest results from the CDF and D0 collaborations on top quark
production (single top and top quark pair production) at the Tevatron
proton-antiproton collider at sqrt(s) =1.96 TeV, measurements of the top quark
decay properties such as the branching ratio B(t -> Wb), the W helicity in t ->
Wb decays, and measurements of fundamental parameters such as the top quark
charge and mass.
","[{""version"":""v1"",""created"":""Sun, 28 May 2006 10:32:55 GMT""}]","2014-11-17"
"hep-ex/0605112","Tomas Lastovicka","Tomas Lastovicka","B physics prospects at LHCb","Proceedings - XLIst Rencontres de Moriond, QCD and high energy
  hadronic interactions",,,,"hep-ex",,"  The LHCb experiment at LHC is a single-arm spectrometer designed to pursue an
extensive study of B physics and CP violation. In this contribution the physics
which will be performed by LHCb is reviewed.
","[{""version"":""v1"",""created"":""Sun, 28 May 2006 13:21:37 GMT""}]","2007-05-23"
"hep-ph/0605304","Magno Machado","V.P. Goncalves, M.V.T. Machado","Dipole model for double meson production in two-photon interactions at
  high energies","20 pages, 8 figures, 1 table. Version to be published in European
  Physical Jornal C","Eur.Phys.J.C49:675-684,2007","10.1140/epjc/s10052-006-0146-x",,"hep-ph",,"  In this work the double vector meson production in two-photon interactions at
high energies is investigated considering saturation physics. We extend the
color dipole picture for this process and study the energy and virtuality
dependence of the forward differential cross section. Comparison with previous
results is presented and the contribution of the different photon polarizations
is estimated.
","[{""version"":""v1"",""created"":""Sat, 27 May 2006 19:26:13 GMT""},{""version"":""v2"",""created"":""Sat, 14 Oct 2006 00:53:24 GMT""}]","2008-11-26"
"hep-ph/0605305","Sebastian Mendizabal","M. Loewe, S. Mendizabal, J. C. Rojas","Skyrmions, Hadrons and isospin chemical potential","10 pages, 5 figures","Phys.Lett. B638 (2006) 464-467","10.1016/j.physletb.2006.06.011",,"hep-ph hep-th",,"  Using the Hamiltonian formulation, in terms of collective variables, we
explore the evolution of different skyrmionic parameters as function of the
isospin chemical potential ($\mu$), such as the energy density, the charge
density, the isoscalar radius and the isoscalar magnetic radius. We found that
the radii start to grow very fast for $\mu \gtrsim 140$ MeV, suggesting the
occurrence of a phase transition.
","[{""version"":""v1"",""created"":""Sat, 27 May 2006 22:46:15 GMT""}]","2009-11-11"
"hep-ph/0605306","Frank Daniel Steffen","Frank Daniel Steffen","Gravitino Dark Matter and Cosmological Constraints","51 pages, 20 figures, revised version matches published version
  (results unchanged, JHEP style used, figures replaced with new high-quality
  figures, typos corrected, references added)","JCAP 0609:001,2006","10.1088/1475-7516/2006/09/001","MPP-2006-66","hep-ph astro-ph",,"  The gravitino is a promising candidate for cold dark matter. We study
cosmological constraints on scenarios in which the gravitino is the lightest
supersymmetric particle and a charged slepton the next-to-lightest
supersymmetric particle (NLSP). We obtain new results for the hadronic
nucleosynthesis bounds by computing the 4-body decay of the NLSP slepton into
the gravitino, the associated lepton, and a quark-antiquark pair. The bounds
from the observed dark matter density are refined by taking into account
gravitinos from both late NLSP decays and thermal scattering in the early
Universe. We examine the present free-streaming velocity of gravitino dark
matter and the limits from observations and simulations of cosmic structures.
Assuming that the NLSP sleptons freeze out with a thermal abundance before
their decay, we derive new bounds on the slepton and gravitino masses. The
implications of the constraints for cosmology and collider phenomenology are
discussed and the potential insights from future experiments are outlined. We
propose a set of benchmark scenarios with gravitino dark matter and long-lived
charged NLSP sleptons and describe prospects for the Large Hadron Collider and
the International Linear Collider.
","[{""version"":""v1"",""created"":""Sat, 27 May 2006 23:30:08 GMT""},{""version"":""v2"",""created"":""Tue, 12 Sep 2006 16:01:53 GMT""}]","2011-05-05"
"hep-ph/0605308","Keiichi Kimura","Keiichi Kimura, Akira Takamura, Tadashi Yoshikawa","Measuring the Leptonic CP Phase in $\nu_{\mu} \to \nu_{\mu}$
  Oscillations","7 pages, 8 figures, version to appear in PLB",,"10.1016/j.physletb.2006.10.005",,"hep-ph",,"  In $\nu_{\mu} \to \nu_{\mu}$ oscillations, we find that the effect of the CP
phase $\delta$ becomes large in the region $E<2$ GeV and $L>2000$ km. In this
region, the change of the probability in this channel reaches about 0.4 due to
the CP phase effect beyond our expectation in the case of large 1-3 mixing
angle. Furthermore, the CP phase effect have almost same sign over the region
$E>0.5$ GeV so that one may find the signal of CP violation by measuring the
total rate only. As an example, we use an experimental setup and demonstrate
that the allowed region is limited to one by combined analysis of $\nu_e$ and
$\nu_{\mu}$ events although there remain three allowed regions by the analysis
of $\nu_e$ events alone.
","[{""version"":""v1"",""created"":""Sun, 28 May 2006 08:49:29 GMT""},{""version"":""v2"",""created"":""Tue, 21 Nov 2006 06:51:18 GMT""}]","2009-11-11"
"hep-ph/0605309","Kirill Tuchin","Kirill Tuchin","Heavy quark production in Color Glass Condensate","Based on talk presented at the International Conference on
  Strangeness in Quark Matter, University of California, Los Angeles, Mach 30,
  2006","J.Phys. G32 (2006) S325-S332","10.1088/0954-3899/32/12/S40",,"hep-ph",,"  We discuss heavy quark production in High Parton Density QCD in
quasi-classical approximation and including low-$x$ quantum evolution. We also
consider an alternative approach based on the effect of pair production in
external fields.
","[{""version"":""v1"",""created"":""Sun, 28 May 2006 14:48:48 GMT""}]","2009-11-11"
"hep-th/0605269","Michael Faux","C.F. Doran, M.G. Faux, S.J. Gates, Jr., T. Hubsch, K.M. Iga, G.D.
  Landweber","Adinkras and the Dynamics of Superspace Prepotentials","42 pages, 31 figures in color",,,"UMDEPP 06-011","hep-th",,"  We demonstrate a method for describing one-dimensional N-extended
supermultiplets and building supersymmetric actions in terms of unconstrained
prepotential superfields, explicitly working with the Scalar supermultiplet.
The method uses intuitive manipulations of Adinkras and GR(d,N) algebras, a
variant of Clifford algebras. In the process we clarify the relationship
between Adinkras, GR(d,N) algebras, and superspace.
","[{""version"":""v1"",""created"":""Sun, 28 May 2006 12:21:42 GMT""},{""version"":""v2"",""created"":""Mon, 29 May 2006 23:57:56 GMT""}]","2012-08-27"
"hep-th/0605271","Stoytcho Yazadjiev","Stoytcho S. Yazadjiev","Dilaton black holes with squashed horizons and their thermodynamics","12 pages,LaTex; v2 references added; v3 typos corrected; PRD","Phys.Rev.D74:024022,2006","10.1103/PhysRevD.74.024022",,"hep-th gr-qc",,"  New charged solutions describing black holes with squashed horizons in 5D
dilaton gravity are presented. The black hole spacetimes are asymptotically
locally flat and have a spacial infinity $R\times S^1\hookrightarrow S^2$. The
solutions are analyzed and their thermodynamics is discussed by using the
counterterm method.
","[{""version"":""v1"",""created"":""Sun, 28 May 2006 09:01:52 GMT""},{""version"":""v2"",""created"":""Sun, 4 Jun 2006 08:54:58 GMT""},{""version"":""v3"",""created"":""Tue, 1 Aug 2006 08:00:15 GMT""}]","2008-11-26"
"hep-th/0605272","Yael Shadmi","Yael Shadmi (Technion)","The radion potential and supersymmetry breaking in detuned RS","5 pages. Talk presented at the XLIst Rencontres de Moriond,
  Electroweak Interactions and Unified Theories, La Thuile, Italy, 11-18 March
  2006",,,,"hep-th",,"  We study radiative corrections to the radion potential in the supersymmetric
``detuned RS model'', with supersymmetry broken by boundary conditions.
Classically, the radion is stabilized in this model, and the 4d theory is
AdS_4. With a few bulk hypermultiplets, the one-loop correction to the
cosmological constant is positive. For small warping, this correction can
(almost) cancel the classical result. The loop expansion is still reliable in
this limit. The graviphoton zero-mode, which controls supersymmetry breaking,
is a modulus of the classical theory, but is stabilized at one-loop. Both
unbroken supersymmetry and maximal supersymmetry breaking are stable
ground-states of the quantum theory.
","[{""version"":""v1"",""created"":""Sun, 28 May 2006 13:05:59 GMT""}]","2007-05-23"
"math/0605698","Ganna Kudryavtseva","Ganna Kudryavtseva","On conjugacy in regular epigroups","15 pages, 1 figure",,,,"math.GR",,"  Let $S$ be a semigroup. The elements $a,b\in S$ are called primarily
conjugate if $a=xy$ and $b=yx$ for certain $x,y\in S$. The relation of
conjugacy is defined as the transitive closure of the relation of primary
conjugacy. In the case when $S$ is a monoid, denote by $G$ the group of units
of $S$. Then the relation of $G$-conjugacy is defined by $a\sim_G b \iff
a=g^{-1}bg$ for certain $g\in G$. We establish the structure of conjugacy
classes for regular epigroups (i.e. semigroups such that some power of each
element lies in a subgroup). As a corollary we obtain a criterion of conjugacy
in terms of $G$-conjugacy for factorizable inverse epigroups. We show that our
general conjugacy criteria easily lead to known and new conjugacy criteria for
some specific semigroups, among which are the full transformation semigroup and
the full inverse symmetric semigroup over a finite set, the linear analogues of
these semigroups and the semigroup of finitary partial automatic
transformations over a finite alphabet.
","[{""version"":""v1"",""created"":""Sat, 27 May 2006 17:00:23 GMT""}]","2007-05-23"
"math/0605699","Saeid Rezakhah","S. Shemehsavar, S. Rezakhah","On the Average Number of Sharp Crossings of Certain Gaussian Random
  Polynomials","11 pages",,,,"math.PR math.ST stat.TH",,"  Let $Q_n(x)=\sum_{i=0}^{n} A_{i}x^{i}$ be a random algebraic polynomial where
the coefficients $A_0,A_1,... $ form a sequence of centered Gaussian random
variables. Moreover, assume that the increments $\Delta_j=A_j-A_{j-1}$,
$j=0,1,2,...$ are independent, assuming $A_{-1}=0$. The coefficients can be
considered as $n$ consecutive observations of a Brownian motion. We obtain the
asymptotic behaviour of the expected number of u-sharp crossings of polynomial
$Q_n(x)$ . We refer to u-sharp crossings as those zero up-crossings with slope
greater than $u$, or those down-crossings with slope smaller than $-u$. We
consider the cases where $u$ is unbounded and is increasing with $n$, where
$u=o(n^{5/4})$, and $u=o(n^{3/2})$ separately.
","[{""version"":""v1"",""created"":""Sat, 27 May 2006 18:56:15 GMT""}]","2007-06-13"
"math/0605701","Q\""endrim Gashi","Q\""endrim R. Gashi","Vanishing Results for Toric Varieties Associated to $GL_n$ and $G_2$",,,,,"math.AG",,"  Toric varieties associated with root systems appeared very naturally in the
theory of group compactifications. Here they are considered in a very different
context.
  We prove the vanishing of higher cohomology groups for certain line bundles
on toric varieties associated to $GL_n$ and $G_2$. This can be considered of
general interest and it improves the previously known results for these
varieties. We also show how these results give a simple proof of a converse to
Mazur's inequality for $GL_n$ and $G_2$ respectively. It is known that the
latter imply the non-emptiness of some affine Deligne-Lusztig varieties.
","[{""version"":""v1"",""created"":""Sat, 27 May 2006 21:34:50 GMT""},{""version"":""v2"",""created"":""Fri, 26 Oct 2007 22:35:11 GMT""}]","2011-11-09"
