"math/0605702","Jinhyun Park","Jinhyun Park (Purdue University, West Lafayette, IN)","Regulators on additive higher Chow groups","17 pages; 2 figures; v2) introduction revised; typos corrected; some
  notations changed to be more coherent; some remarks corrected; v3) further
  typos corrected. compactified. a version of this paper to appear in Amer. J.
  Math",,,,"math.AG math.KT",,"  As an attempt to understand motives over $k[x]/(x^m)$, we define the cubical
additive higher Chow groups with modulus for all dimensions extending the works
of S. Bloch, H. Esnault and K. R\""ulling on 0-dimensional cycles. We give an
explicit construction of regulator maps on the groups of 1-cycles with an aid
of the residue theory of A. Parshin and V. Lomadze.
","[{""version"":""v1"",""created"":""Sat, 27 May 2006 22:39:11 GMT""},{""version"":""v2"",""created"":""Tue, 23 Jan 2007 03:03:28 GMT""},{""version"":""v3"",""created"":""Wed, 28 May 2008 18:24:20 GMT""}]","2008-05-28"
"math/0605703","Taekyun Kim","T. Kim","p-adic l-functions and sums of powers","10 pages",,,,"math.NT",,"  The purpose of this paper is to give the explicit formulae of p-adic
l-functions and sums of powers which are related to Euler numbers.
","[{""version"":""v1"",""created"":""Sat, 27 May 2006 23:06:04 GMT""}]","2007-05-23"
"math/0605704","Travis Schedler","Victor Ginzburg and Travis Schedler","Moyal quantization and stable homology of necklace Lie algebras","Includes updated version of math.QA/0503405; second version contains
  minor corrections",,,,"math.QA",,"  We compute the stable homology of necklace Lie algebras associated with
quivers and give a construction of stable homology classes from certain
$A_\infty$-categories. Our construction is a generalization of the construction
of homology classes of moduli spaces of curves due to M. Kontsevich.
  In the second part of the paper we produce a Moyal-type quantization of the
symmetric algebra of a necklace Lie algebra. The resulting quantized algebra
has natural representations in the usual Moyal quantization of polynomial
algebras.
","[{""version"":""v1"",""created"":""Sun, 28 May 2006 04:17:57 GMT""},{""version"":""v2"",""created"":""Tue, 5 Sep 2006 19:00:50 GMT""}]","2007-05-23"
"math/0605705","Mehdi Hassani","Mehdi Hassani, Mahmoud Momeni-Pour","Euler Type Generalization of Wilson's Theorem","a short research note with 2 pages",,,,"math.NT math.AC",,"  In this short note, we introduce an Euler analogue of Wilson's theorem;
$a_1a_2... a_{\phi(n)}\equiv (-1)^{\phi(n)+1}~({\rm mod}~n)$ say, where ${\rm
gcd}(a_i,n)=1$.
","[{""version"":""v1"",""created"":""Sun, 28 May 2006 06:53:13 GMT""}]","2007-05-23"
"math/0605706","Rasul Shafikov","Stefan Nemirovski and Rasul Shafikov","Note on the paper of Fu and Wong on strictly pseudoconvex domains with
  K\""ahler--Einstein Bergman metrics",,"Russian Mathematical Surveys , 2006, 61 (4), 780-782","10.1070/RM2006v061n04ABEH004349",,"math.CV math.DG",,"  It is shown that the Ramadanov conjecture implies the Cheng conjecture. In
particular it follows that the Cheng conjecture holds in dimension two.
","[{""version"":""v1"",""created"":""Sun, 28 May 2006 11:35:53 GMT""}]","2007-05-23"
"math/0605707","Seth Chaiken","Seth Chaiken","Ported Tutte Functions of Extensors and Oriented Matroids","46 pages, 3 figures corrections, additions and improved discussions
  of references. Editorial and spelling corrections; more acknowledgements",,,,"math.CO math.RA",,"  The Tutte equations are ported (or set-pointed) when the equations F(N) = g_e
F(N/e) + r_e F(N\e) are omitted for elements e in a distinguished set called
ports. Solutions F can distinguish different orientations of the same matroid.
A ported extensor with ground set is a decomposible element in the exterior
algebra over a vector space with a given basis, called the ground set,
containing a distinguished subset called ports. These can represent ported
matroids and have analogous dualization, deletion and contraction operations. A
ported extensor function is defined using dualization, port element renaming,
exterior multiplication, and contraction of non-ports. We prove that this
function satisfies a sign-corrected variant of the Tutte equations over
exterior algebra. For non-ported unimodular, i.e., regular matroids, our
function reduces to the basis generating function and for graphs the Laplacian
(or Kirchhoff) determinant. In general, the function value, as an extensor,
signifies the space of solutions to Kirchhoff's and Ohm's electricity equations
after projection to the variables associated to the ports. Combinatorial
interpretation of various determinants (the Plucker coordinates) generalize the
matrix tree theorem and forest enumeration expressions for electrical
resistance. The corank-nullity polynomial, basis expansions with activities,
and a geometric lattice expansion generalize to ported Tutte functions of
oriented matroids. The ported Tutte functions are parametrized, which raises
the problem of how to generalize known characterizations of parameterized
non-ported Tutte functions.
","[{""version"":""v1"",""created"":""Sun, 28 May 2006 15:40:50 GMT""},{""version"":""v2"",""created"":""Wed, 2 Aug 2006 16:56:28 GMT""}]","2007-05-23"
"nlin/0605050","Mohamad Ali Jafarizadeh","M. A. Jafarizadeh, S.Behnia, E.Faizi and S. Ahadpour","Generic N-coupled maps in Bose-Mesner algebra perspective","31 pages",,,,"nlin.CD",,"  By choosing a dynamical system with d different couplings, one can rearrange
a system based on the graph with given vertex dependent on the dynamical system
elements. The relation between the dynamical elements (coupling) is replaced by
a relation between the vertexes. Based on the E_0 transverse projection
operator. We addressed synchronization problem of an array of the linearly
coupled map lattices of identical discrete time systems.
  The synchronization rate is determined by the second largest eigenvalue of
the transition probability matrix. Algebraic properties of the Bose-Mesner
algebra with an associated scheme with definite spectrum has been used in order
to study the stability of the coupled map lattice. Associated schemes play a
key role and may lead to analytical methods in studying the stability of the
dynamical systems. The relation between the coupling parameters and the chaotic
region is presented. It is shown that the feasible region is analytically
determined by the number of couplings (i.e, by increasing the number of coupled
maps the feasible region is restricted). It is very easy to apply our criteria
to the system being studied and they encompass a wide range of coupling schemes
including most of the popularly used ones in the literature.
","[{""version"":""v1"",""created"":""Sun, 28 May 2006 09:08:38 GMT""}]","2016-09-08"
"q-bio/0605045","Muhittin Mungan","Duygu Balcan, Alkan Kabakcioglu, Muhittin Mungan and Ayse Erzan","Spontaneous Self-Assembly of Transcription Factor Based Gene Regulation
  Networks","10 pages, 10 figures. For higher resolution figures contact mmungan
  at boun edu tr","PLoSONE vol. 2, e501 (2007)","10.1371/journal.pone.0000501",,"q-bio.MN",,"  We model the transcription factor based regulation network of yeast using a
content-based network model that mimicks the recognition of binding motifs on
the regulatory regions of the genes. We are thereby able to faithfully
reproduce many of the topological features of the gene regulatory network of
yeast once the parameters of the yeast genome, in particular the distribution
of information coded by the ""binding sequences"" within the promoter regions is
provided as input. The length distribution for the promoter regions is fixed by
comparing the k-core analysis of the model network with that of yeast. Our
results strongly point to the possibility that the observed topological
features are generic to networks formed via sequence-matching between random
strings obeying certain length distributions.
","[{""version"":""v1"",""created"":""Sat, 27 May 2006 16:41:10 GMT""}]","2007-11-11"
