"astro-ph/0606247","Vinay Kashyap","Taeyoung Park, Vinay L. Kashyap, Aneta Siemiginowska, David A. van
  Dyk, Andreas Zezas, Craig Heinke, Bradford J. Wargelin","Bayesian Estimation of Hardness Ratios: Modeling and Computations","43 pages, 10 figures, 3 tables; submitted to ApJ","Astrophys.J. 652:610-628, 2006","10.1086/507406",,"astro-ph",,"  A commonly used measure to summarize the nature of a photon spectrum is the
so-called Hardness Ratio, which compares the number of counts observed in
different passbands. The hardness ratio is especially useful to distinguish
between and categorize weak sources as a proxy for detailed spectral fitting.
However, in this regime classical methods of error propagation fail, and the
estimates of spectral hardness become unreliable. Here we develop a rigorous
statistical treatment of hardness ratios that properly deals with detected
photons as independent Poisson random variables and correctly deals with the
non-Gaussian nature of the error propagation. The method is Bayesian in nature,
and thus can be generalized to carry out a multitude of
source-population--based analyses. We verify our method with simulation
studies, and compare it with the classical method. We apply this method to real
world examples, such as the identification of candidate quiescent Low-mass
X-ray binaries in globular clusters, and tracking the time evolution of a flare
on a low-mass star.
","[{""version"":""v1"",""created"":""Sat, 10 Jun 2006 22:12:25 GMT""}]","2016-04-26"
"astro-ph/0606248","Guo-Chin Liu","Guo-Chin Liu, Seokcheon Lee and Kin-Wang Ng","Effect on cosmic microwave background polarization of coupling of
  quintessence to pseudoscalar formed from the electromagnetic field and its
  dual","9 pages, 5 eps figures. references updated, version accepted by PRL","Phys.Rev.Lett. 97 (2006) 161303","10.1103/PhysRevLett.97.161303",,"astro-ph",,"  We present the full set of power spectra of cosmic microwave background (CMB)
temperature and polarization anisotropies due to the coupling between
quintessence and pseudoscalar of electromagnetism. This coupling induces the
rotation of the polarization plane of CMB photons, thus resulting in
non-vanishing B mode and parity-violating TB and EB modes. Using the 2003
flight of BOOMERANG (B03) data, we give the most stringent constraint on the
coupling strength. In some cases, the rotation-induced B mode can confuse the
hunting for the gravitational lensing induced B mode.
","[{""version"":""v1"",""created"":""Sun, 11 Jun 2006 10:27:36 GMT""},{""version"":""v2"",""created"":""Fri, 16 Jun 2006 04:37:08 GMT""},{""version"":""v3"",""created"":""Wed, 11 Oct 2006 06:18:17 GMT""}]","2009-11-11"
"astro-ph/0606249","Grigoris Panotopoulos","G. Panotopoulos","Cosmological constraints on a dark energy model with a non-linear scalar
  field","references added, submitted to JCAP",,,,"astro-ph",,"  In the present work we study a dark energy model in which a non-linear scalar
field (tachyon) with a Born-Infeld type of action is responsible for the
observed cosmic acceleration. The potential of the tachyon is well-motivated
since it comes from open string theory and the model is subjected to various
cosmological constraints with data coming from supernovae as well as from
microwave background radiation. Our analysis shows that in the particular model
under study the tachyon can be an excellent candidate for dark energy in the
universe, as the model agrees with a series of observational data and for a
wide range of the parameters of the model.
","[{""version"":""v1"",""created"":""Sun, 11 Jun 2006 13:46:24 GMT""},{""version"":""v2"",""created"":""Fri, 16 Jun 2006 17:02:41 GMT""}]","2007-05-23"
"astro-ph/0606250","Benoit Neichel","B. Neichel (1 and 2), J-M. Conan (2), T. Fusco (2), E. Gendron (1), M.
  Puech (1), G. Rousset (1 and 2), F. Hammer (1) ((1) Observatoire de Paris,
  (2) ONERA)","ELTs Adaptive Optics for Multi-Objects 3D Spectroscopy : Key Parameters
  and Design Rules","15 pges, 14 figures, presented at SPIE Astronomical Telescopes and
  Instrumentation, 24 - 31 May 2006, Orlando, Florida USA",,"10.1117/12.671415",,"astro-ph",,"  In the last few years, new Adaptive Optics [AO] techniques have emerged to
answer new astronomical challenges: Ground-Layer AO [GLAO] and Multi-Conjugate
AO [MCAO] to access a wider Field of View [FoV], Multi-Object AO [MOAO] for the
simultaneous observation of several faint galaxies, eXtreme AO [XAO] for the
detection of faint companions. In this paper, we focus our study to one of
these applications : high red-shift galaxy observations using MOAO techniques
in the framework of Extremely Large Telescopes [ELTs]. We present the
high-level specifications of a dedicated instrument. We choose to describe the
scientific requirements with the following criteria : 40% of Ensquared Energy
[EE] in H band (1.65um) and in an aperture size from 25 to 150 mas. Considering
these specifications we investigate different AO solutions thanks to Fourier
based simulations. Sky Coverage [SC] is computed for Natural and Laser Guide
Stars [NGS, LGS] systems. We show that specifications are met for NGS-based
systems at the cost of an extremely low SC. For the LGS approach, the option of
low order correction with a faint NGS is discussed. We demonstrate that, this
last solution allows the scientific requirements to be met together with a
quasi full SC.
","[{""version"":""v1"",""created"":""Sun, 11 Jun 2006 14:45:03 GMT""}]","2009-11-11"
"astro-ph/0606251","Ehud Behar","Ehud Behar, Raanan Nordon, Eyal Ben-Bassat, and Noam Soker (Technion)","A hot transient outflow from eta Carinae","replaced with version of Feb. 27, 2007",,,,"astro-ph",,"  eta Carinae is a stellar binary system with a period of 5.54 years. It
harbors one of the brightest and most massive stars in our galaxy. This paper
presents spectroscopic evidence for a fast (up to 2,000 km/s) X-ray outflow of
ionized gas launched from eta Carinae just before what is believed to be the
binary periastron (point of smallest binary separation). The appearance of this
high-velocity component, just as the irregular flares in the X-ray light curve,
can not be explained by the simple continuous binary wind interaction, adding
to the intrigue of the eta Carinae system.
","[{""version"":""v1"",""created"":""Sun, 11 Jun 2006 15:25:53 GMT""},{""version"":""v2"",""created"":""Tue, 27 Feb 2007 17:25:47 GMT""}]","2007-05-23"
"cond-mat/0606264","Maxim Cheremisin V","M.V.Cheremisin, G.G.Samsonidze","Current instability and single-mode THz generation in ungated
  two-dimensional electron gas","3 pages, 2 figures","Solid-State Electr., vol. 52(iss.2), p.338, 2008","10.1016/j.sse.2007.09.002",,"cond-mat.str-el cond-mat.mes-hall",,"  We analyze the current instability of the steady state with a direct current
for an ungated two-dimensional(2D) electron layer for arbitrary current and the
carrier scattering strength. We demonstrate the possibility of single-mode
generator operating in terahertz frequency range.
","[{""version"":""v1"",""created"":""Sat, 10 Jun 2006 16:36:25 GMT""}]","2015-06-25"
"cond-mat/0606265","Sara Bergkvist","Sara Bergkvist, Ian McCulloch, Anders Rosengren","Spinful bosons in an optical lattice","Minor revisions and clarifications",,"10.1103/PhysRevA.74.053419",,"cond-mat.other",,"  We analyze the behavior of cold spin-1 particles with antiferromagnetic
interactions in a one-dimensional optical lattice using density matrix
renormalization group calculations. Correlation functions and the dimerization
are shown and we also present results for the energy gap between ground state
and the spin excited states. We confirm the anticipated phase diagram, with
Mott-insulating regions of alternating dimerized S=1 chains for odd particle
density versus on-site singlets for even density. We find no evidence for any
additional ordered phases in the physically accessible region, however for
sufficiently large spin interaction, on-site singlet pairs dominate leading,
for odd density, to a breakdown of the Mott insulator or, for even density, a
real-space singlet superfluid.
","[{""version"":""v1"",""created"":""Sat, 10 Jun 2006 19:45:04 GMT""},{""version"":""v2"",""created"":""Wed, 4 Oct 2006 18:20:11 GMT""}]","2009-11-11"
"cond-mat/0606266","Boris Glavin","B.A.Glavin, V.A.Kochelap, T.L.Linnik, A.J.Kent, N.M.Stanton, and
  M.Henini","Resonance-like piezoelectric electron-phonon interaction in layered
  structures","6 pages, 7 figures",,"10.1103/PhysRevB.74.165317",,"cond-mat.mes-hall cond-mat.mtrl-sci",,"  We show that mismatch of the piezoelectric parameters between layers of
multiple-quantum well structures leads to modification of the electron-phonon
interaction. In particular, short-wavelength phonons propagating perpendicular
to the layers with wavevector close to $2\pi n/d$, where $d$ is the period of
the structure, induce a strong smoothly-varying component of the
piezo-potential. As a result, they interact efficiently with 2D electrons. It
is shown, that this property leads to emission of collimated
quasi-monochromatic beams of high-frequency acoustic phonons from hot electrons
in multiple-quantum well structures. We argue that this effect is responsible
for the recently reported monochromatic transverse phonon emission from
optically excited GaAs/AlAs superlattices, and provide additional experimental
evidences of this.
","[{""version"":""v1"",""created"":""Sat, 10 Jun 2006 21:14:43 GMT""}]","2009-11-11"
"cond-mat/0606267","Laurent Chevillard","L. Chevillard, C. Meneveau","Lagrangian dynamics and statistical geometric structure of turbulence","5 pages, 5 figures, final version, published","Physical Review Letters 97, 174501 (2006)","10.1103/PhysRevLett.97.174501",,"cond-mat.stat-mech",,"  The local statistical and geometric structure of three-dimensional turbulent
flow can be described by properties of the velocity gradient tensor. A
stochastic model is developed for the Lagrangian time evolution of this tensor,
in which the exact nonlinear self-stretching term accounts for the development
of well-known non-Gaussian statistics and geometric alignment trends. The
non-local pressure and viscous effects are accounted for by a closure that
models the material deformation history of fluid elements. The resulting
stochastic system reproduces many statistical and geometric trends observed in
numerical and experimental 3D turbulent flows, including anomalous relative
scaling.
","[{""version"":""v1"",""created"":""Sat, 10 Jun 2006 22:33:31 GMT""},{""version"":""v2"",""created"":""Tue, 13 Jun 2006 00:25:42 GMT""},{""version"":""v3"",""created"":""Thu, 26 Oct 2006 01:18:10 GMT""}]","2007-05-23"
"cond-mat/0606268","Jordi Mur-Petit","Jordi Mur-Petit","Many-body studies on atomic quantum systems","PhD thesis with 216 pages and 48 figures; uses pdflatex. Some figures
  have been submitted at low resolution to fit arXiv's memory limitations. The
  ""complete"" version can be downloaded from http://hdl.handle.net/10803/1587","ISBN-10: 84-689-8827-8 (2006)",,,"cond-mat.other",,"  This thesis presents a set of studies on atomic systems where quantum effects
are particularly relevant. These studies have been developed by applying a
variety of tools from many-body physics.
  First of all, we have studied the prospects for the existence of a superfluid
transition in an ultracold gas of fermionic atoms, by generalizing the BCS
theory of superconductivity to the case when the two species that pair have
different densities and the ground state may spontaneously break one or more
symmetries.
  In a second part, we have studied the dynamics of a Bose-Einstein condensate
whose spin degree of freedom is free to evolve inside a quasi-onedimensional
optical trap. We have used a mean-field formulation to address both the zero
temperature case and the finite temperature one.
  Finally, we have performed a careful study of the ground state and the line
tension of two-dimensional systems of helium-4. First, we have used Monte Carlo
techniques, then with a Density Functional built on-purpose.
  Comments are welcome!
  KEYWORDS: Cold gases, Pairing, Spinor condensate, Helium, Two dimensions
","[{""version"":""v1"",""created"":""Sun, 11 Jun 2006 00:18:12 GMT""}]","2023-04-03"
"cs/0606047","Giorgos Kollias","Giorgos Kollias, Efstratios Gallopoulos, Daniel B. Szyld","Asynchronous iterative computations with Web information retrieval
  structures: The PageRank case","8 pages to appear at ParCo2005 Conference Proceedings",,,"TR HPCLAB-SCG 5/08-05","cs.DC",,"  There are several ideas being used today for Web information retrieval, and
specifically in Web search engines. The PageRank algorithm is one of those that
introduce a content-neutral ranking function over Web pages. This ranking is
applied to the set of pages returned by the Google search engine in response to
posting a search query. PageRank is based in part on two simple common sense
concepts: (i)A page is important if many important pages include links to it.
(ii)A page containing many links has reduced impact on the importance of the
pages it links to. In this paper we focus on asynchronous iterative schemes to
compute PageRank over large sets of Web pages. The elimination of the
synchronizing phases is expected to be advantageous on heterogeneous platforms.
The motivation for a possible move to such large scale distributed platforms
lies in the size of matrices representing Web structure. In orders of
magnitude: $10^{10}$ pages with $10^{11}$ nonzero elements and $10^{12}$ bytes
just to store a small percentage of the Web (the already crawled); distributed
memory machines are necessary for such computations. The present research is
part of our general objective, to explore the potential of asynchronous
computational models as an underlying framework for very large scale
computations over the Grid. The area of ``internet algorithmics'' appears to
offer many occasions for computations of unprecedent dimensionality that would
be good candidates for this framework.
","[{""version"":""v1"",""created"":""Sun, 11 Jun 2006 09:36:26 GMT""}]","2007-05-23"
"gr-qc/0606046","Kourosh Nozari","Kourosh Nozari and A. S. Sefiedgar","On the Existence of the Logarithmic Correction Term in Black Hole
  Entropy-Area Relation","9 Pages, No Figures","Gen.Rel.Grav.39:501-509,2007","10.1007/s10714-007-0397-3",,"gr-qc",,"  In this paper we consider a model universe with large extra dimensions to
obtain a modified black hole entropy-area relation. We use the generalized
uncertainty principle to find a relation between the number of spacetime
dimensions and the presence or vanishing of logarithmic prefactor in the black
hole entropy-area relation. Our calculations are restricted to the
microcanonical ensembles and we show that in the modified entropy-area
relation, the microcanonical logarithmic prefactor appears only when spacetime
has an even number of dimensions.
","[{""version"":""v1"",""created"":""Sun, 11 Jun 2006 09:03:25 GMT""}]","2008-11-26"
"hep-ph/0606128","Sannino Francesco","F. Sannino (Bohr Institute)","Dynamical Breaking of the Electroweak Theory","Proceedings for the conference Rencontres de Moriond, Electroweak
  Interactions and Unified Theories, 11-18 march 2006 & IFAE 2006, Pavia, 19-21
  Aprile 2006 & CAQCD06 Minneapolis, 11-14 May",,,,"hep-ph",,"  Dynamical breaking of the electroweak theory, i.e. technicolor, is an
intriguing extension of the Standard Model. Recently new models have been
proposed featuring walking dynamics for a very low number of techniflavors.
These technicolor extensions are not ruled out by current precision
measurements. Here I first motivate the idea of dynamical electroweak symmetry
breaking and then summarize some of the properties of the recent models and
their possible cosmological implications.
","[{""version"":""v1"",""created"":""Sat, 10 Jun 2006 16:39:30 GMT""}]","2007-05-23"
"hep-ph/0606129","Ryuichiro Kitano","Ryuichiro Kitano","Dynamical GUT breaking and mu-term driven supersymmetry breaking","23 pages, 1 figure; version to appear in PRD","Phys.Rev.D74:115002,2006","10.1103/PhysRevD.74.115002","SLAC-PUB-11897","hep-ph",,"  Models for dynamical breaking of supersymmetric grand unified theories are
presented. The doublet-triplet splitting problem is absent since the Higgs
doublet superfields can be identified with the massless mesons of the strong
gauge group whereas there are no massless states corresponding to the colored
Higgs fields. Various strong gauge groups SU(Nc), Sp(Nc) and SO(Nc) are
examined. In a model with SO(9) strong gauge group, adding the mu-term for the
Higgs fields triggers to break supersymmetry in a meta-stable vacuum. The
pattern of the supersymmetry breaking parameters is predicted to be the
gauge-mediation type with modifications in the Higgs sector.
","[{""version"":""v1"",""created"":""Sun, 11 Jun 2006 01:12:43 GMT""},{""version"":""v2"",""created"":""Tue, 20 Jun 2006 21:41:40 GMT""},{""version"":""v3"",""created"":""Fri, 23 Jun 2006 21:46:23 GMT""},{""version"":""v4"",""created"":""Thu, 9 Nov 2006 22:48:27 GMT""}]","2008-11-26"
"hep-ph/0606131","Yuri Markov Adolfovich","Yu.A. Markov, M.A. Markova","Nonlinear dynamics of soft fermion excitations in hot QCD plasma II:
  Soft-quark - hard-particle scattering and energy losses","85 pages, 15 figures, added new appendix A, section 10 is removed,
  mistakes, and typing errors are corrected. Version to appear in Nucl. Phys. A","Nucl.Phys.A784:443-514,2007","10.1016/j.nuclphysa.2006.12.001",,"hep-ph",,"  In general line with our first work [Yu.A. Markov, M.A. Markova, Nucl. Phys.
A 770 (2006) 162] within the framework of semiclassical approximation a general
theory for the scattering processes of soft (anti)quark excitations off hard
thermal particles in hot QCD-medium is thoroughly considered. The dynamical
equations describing evolution for the usual classical color charge $Q^a(t)$
and Grassmann color charges $\theta^i(t), \theta^{\dagger i}(t)$ of hard
particle taking into account the soft fermion degree of freedom of the system
are suggested. On the basis of these equations and the Blaizot-Iancu equations
iterative procedure of calculation of effective currents and sources generating
the scattering processes under consideration is defined and their form up to
third order in powers of free soft quark field, soft gluon one, and initial
values of the color charges of hard particle is explicitly calculated. With use
of the generalized Tsytovich principle a connection between matrix elements of
the scattering processes and the effective currents and sources is established.
In the context of the effective theory suggested for soft and hard fermion
excitations new mechanisms of energy losses of high-energy parton propagating
through QCD-medium are considered.
","[{""version"":""v1"",""created"":""Sun, 11 Jun 2006 11:03:06 GMT""},{""version"":""v2"",""created"":""Tue, 26 Dec 2006 06:47:57 GMT""}]","2008-11-26"
"hep-th/0606099","Gustavo Lozano","G.S.Lozano, D.Marques and F.A.Schaposnik","Vortex solutions in the noncommutative torus","18 pages, 5 figures","JHEP 0609:044,2006","10.1088/1126-6708/2006/09/044",,"hep-th",,"  Vortex configurations in the two-dimensional torus are considered in
noncommutative space. We analyze the BPS equations of the Abelian Higgs model.
Numerical solutions are constructed for the self-dual and anti-self dual cases
by extending an algorithm originally developed for ordinary commutative space.
We work within the Fock space approach to noncommutative theories and the
Moyal-Weyl connection is used in the final stage to express the solutions in
configuration space.
","[{""version"":""v1"",""created"":""Sun, 11 Jun 2006 14:33:38 GMT""}]","2010-02-03"
"math/0606241","Yan Soibelman","Maxim Kontsevich and Yan Soibelman","Notes on A-infinity algebras, A-infinity categories and non-commutative
  geometry. I",,,,,"math.RA hep-th math.AG math.AT math.CT math.KT math.SG",,"  We develop geometric approach to A-infinity algebras and A-infinity
categories based on the notion of formal scheme in the category of graded
vector spaces. Geometric approach clarifies several questions, e.g. the notion
of homological unit or A-infinity structure on A-infinity functors. We discuss
Hochschild complexes of A-infinity algebras from geometric point of view. The
paper contains homological versions of the notions of properness and smoothness
of projective varieties as well as the non-commutative version of Hodge-to-de
Rham degeneration conjecture. We also discuss a generalization of Deligne's
conjecture which includes both Hochschild chains and cochains. We conclude the
paper with the description of an action of the PROP of singular chains of the
topological PROP of 2-dimensional surfaces on the Hochschild chain complex of
an A-infinity algebra with the scalar product (this action is more or less
equivalent to the structure of 2-dimensional Topological Field Theory
associated with an ""abstract"" Calabi-Yau manifold).
","[{""version"":""v1"",""created"":""Sun, 11 Jun 2006 10:34:11 GMT""},{""version"":""v2"",""created"":""Mon, 14 Aug 2006 12:58:45 GMT""}]","2007-05-23"
"math/0606244","Elisenda Feliu","Elisenda Feliu","On uniqueness of characteristic classes","22 pages; revised version",,,,"math.KT math.AG","http://arxiv.org/licenses/nonexclusive-distrib/1.0/","  We give an axiomatic characterization of maps from algebraic K-theory. The
results apply to a class of maps from algebraic K-theory to any suitable
cohomology theory or to algebraic K-theory, which includes all group morphisms.
In particular, we obtain comparison theorems for the Chern character and Chern
classes and for the Lambda and Adams operations on higher algebraic K-theory.
We show that the Adams operations defined by Grayson agree with the ones
defined by Gillet and Soule.
","[{""version"":""v1"",""created"":""Sat, 10 Jun 2006 17:25:44 GMT""},{""version"":""v2"",""created"":""Thu, 24 Jul 2008 12:58:46 GMT""}]","2008-07-24"
"math/0606245","Luis Fernando Mello","Luis Fernando Mello","Orthogonal Asymptotic Lines on Surfaces Immersed in $\mathbf R ^4$","19 pages",,,,"math.DS math.DG",,"  In this paper we study some properties of surfaces immersed in $\mathbf R ^4$
whose asymptotic lines are orthogonal. We also analyze necessary and sufficient
conditions for the hypersphericity of surfaces in $\mathbf R ^4$.
","[{""version"":""v1"",""created"":""Sat, 10 Jun 2006 18:06:19 GMT""}]","2007-05-23"
"math/0606246","Edward Swartz","Isabella Novik, Ed Swartz","Face ring multiplicity via CM-connectivity sequences","18 pages",,,,"math.AC math.CO",,"  The multiplicity conjecture of Herzog, Huneke, and Srinivasan is verified for
the face rings of the following classes of simplicial complexes: matroid
complexes, complexes of dimension one and two, and Gorenstein complexes of
dimension at most four. The lower bound part of this conjecture is also
established for the face rings of all doubly Cohen-Macaulay complexes whose
1-skeleton's connectivity does not exceed the codimension plus one as well as
for all (d-1)-dimensional d-Cohen-Macaulay complexes. The main ingredient of
the proofs is a new interpretation of the minimal shifts in the resolution of
the face ring via the Cohen-Macaulay connectivity of the skeletons of the
complex.
","[{""version"":""v1"",""created"":""Sat, 10 Jun 2006 18:13:11 GMT""}]","2007-05-23"
"math/0606247","Nicholas Gill","Nick Gill","Nilpotent Singer Groups","6 pages",,,,"math.GR math.CO",,"  Let $N$ be a nilpotent group normal in a group $G$. Suppose that $G$ acts
transitively upon the points of a finite non-Desarguesian projective plane
$\mathcal{P}$. We prove that, if $\mathcal{P}$ has square order, then $N$ must
act semi-regularly on $\mathcal{P}$.
  In addition we prove that if a finite non-Desarguesian projective plane
$\mathcal{P}$ admits more than one nilpotent group which is regular on the
points of $\mathcal{P}$ then $\mathcal{P}$ has non-square order and the
automorphism group of $\mathcal{P}$ has odd order.
","[{""version"":""v1"",""created"":""Sat, 10 Jun 2006 19:31:06 GMT""}]","2007-05-23"
"math/0606248","Tien-Cuong Dinh","Tien-Cuong Dinh and Nessim Sibony","Pull-back of currents by holomorphic maps","16 pages",,,,"math.CV math.DS",,"  We define the pull-back operator, associated to a meromorphic transform, on
several types of currents. We also give a simple proof to a version of a
classical theorem on the extension of currents.
","[{""version"":""v1"",""created"":""Sat, 10 Jun 2006 20:00:32 GMT""}]","2007-05-23"
"math/0606249","Vadim Kostrykin","Vadim Kostrykin and Konstantin A. Makarov","On Krein's Example",,,,,"math.SP",,"  In his 1953 paper [Matem.~Sbornik \textbf{33} (1953), 597 -- 626] Mark Krein
presented an example of a symmetric rank one perturbation of a self-adjoint
operator such that for all values of the spectral parameter in the interior of
the spectrum, the difference of the corresponding spectral projections is not
trace class. In the present note it is shown that in the case in question this
difference has simple Lebesgue spectrum filling in the interval $[-1,1]$ and,
therefore, the pair of the spectral projections is generic in the sense of
Halmos but not Fredholm.
","[{""version"":""v1"",""created"":""Sat, 10 Jun 2006 21:04:35 GMT""}]","2007-05-23"
