"math/0606250","Henrik Russell","Henrik Russell","Generalized Albanese and its dual","updated and shortened version","J. Math. Kyoto Univ. 48-4 (2008), 907-949",,,"math.AG","http://arxiv.org/licenses/nonexclusive-distrib/1.0/","  We consider categories of rational maps to algebraic groups and study
existence and construction of universal objects for such categories, using the
duality theory of Laumon 1-motives. In particular, we obtain functorial
descriptions of the Albanese of a singular projective variety X over an
algebraically closed field of characteristic zero, which is the universal
regular quotient of a relative Chow group of points on X, and of its dual.
","[{""version"":""v1"",""created"":""Sat, 10 Jun 2006 23:29:59 GMT""},{""version"":""v2"",""created"":""Wed, 7 Feb 2007 02:56:18 GMT""},{""version"":""v3"",""created"":""Mon, 25 May 2009 12:51:33 GMT""}]","2009-05-25"
"math/0606251","Thotsaporn Thanatipanonda","Thotsaporn Thanatipanonda","How to Beat Capablanca",,,,,"math.CO",,"  This paper shows the fastest way to force a win with rook and king against
king on an m*n board. In the classical case, this gives a faster win than what
Capablanca suggested in his book 'Chess Fundamentals'.
","[{""version"":""v1"",""created"":""Sun, 11 Jun 2006 01:06:50 GMT""}]","2009-09-29"
"math/0606252","Matthew Baker","Matthew Baker","Uniform structures and Berkovich spaces","16 pages",,,,"math.NT math.AG math.GN",,"  A uniform space is a topological space together with some additional
structure which allows one to make sense of uniform properties such as
completeness or uniform convergence. Motivated by previous work of J.
Rivera-Letelier, we give a new construction of the Berkovich analytic space
associated to an affinoid algebra as the completion of a canonical uniform
structure on the associated rigid-analytic space.
","[{""version"":""v1"",""created"":""Sun, 11 Jun 2006 01:20:55 GMT""}]","2007-05-23"
"math/0606253","Matthew Baker","Matthew Baker","Uncountable sets and an infinite real number game","7 pages",,,,"math.HO math.GN",,"  We give a short proof of the well-known fact that the unit interval [0,1] is
uncountable by means of a simple infinite game. We also show using this game
that a (non-empty) perfect subset of [0,1] must be uncountable.
","[{""version"":""v1"",""created"":""Sun, 11 Jun 2006 01:29:42 GMT""}]","2007-05-23"
"math/0606254","Terence C. Tao","Terence Tao","A pseudoconformal compactification of the nonlinear Schr\""odinger
  equation and applications","17 pages, no figures, to appear, New York J. Math. This is the final
  version",,,,"math.AP","http://arxiv.org/licenses/nonexclusive-distrib/1.0/","  We interpret the lens transformation (a variant of the pseudoconformal
transformation) as a pseudoconformal compactification of spacetime, which
converts the nonlinear Schr\""odinger equation (NLS) without potential with a
nonlinear Schr\""odinger equation with attractive harmonic potential. We then
discuss how several existing results about NLS can be placed in this
compactified setting, thus offering a new perspective to view this theory.
","[{""version"":""v1"",""created"":""Sun, 11 Jun 2006 13:59:13 GMT""},{""version"":""v2"",""created"":""Wed, 12 Jul 2006 17:00:58 GMT""},{""version"":""v3"",""created"":""Fri, 8 Sep 2006 22:23:21 GMT""},{""version"":""v4"",""created"":""Sat, 13 Jun 2009 19:23:03 GMT""}]","2009-06-13"
"math/0606255","Alexander Stoimenow","A. Stoimenow","Non-triviality of the Jones polynomial and the crossing numbers of
  amphicheiral knots","92 pages, 10 figures; rev 3 Jul 07: full existence proof in section
  10 of the odd crossing number amphicheiral knots; minor stylistic
  improvements in other sections",,,,"math.GT",,"  Using an involved study of the Jones polynomial, we determine, as our main
result, the crossing numbers of (prime) amphicheiral knots. As further
applications, we show that several classes of links, including semiadequate
links and Whitehead doubles of semiadequate knots, have non-trivial Jones
polynomial. We also prove that there are infinitely many positive knots with no
positive minimal crossing diagrams. Some relations to the twist number of a
link, Mahler measure and the hyperbolic volume are given, for example explicit
upper bounds on the volume for Montesinos and 3-braid links in terms of their
Jones polynomial.
","[{""version"":""v1"",""created"":""Sun, 11 Jun 2006 14:08:29 GMT""},{""version"":""v2"",""created"":""Tue, 3 Jul 2007 04:31:48 GMT""}]","2007-07-03"
"math/0606256","Anders Karlsson","T. Gelander, A. Karlsson, G.A. Margulis","Superrigidity, generalized harmonic maps and uniformly convex spaces","22 pages Final version to appear in GAFA",,,,"math.GR math.RT",,"  We prove several superrigidity results for isometric actions on metric spaces
satisfying some convexity properties. First, we extend some recent theorems of
N. Monod on uniform and certain non-uniform irreducible lattices in products of
locally compact groups. Second, we include the proof of an unpublished result
on commensurability superrigidity due to Margulis. The proofs rely on certain
notions of harmonic maps and the study of their existence, uniqueness, and
continuity.
","[{""version"":""v1"",""created"":""Sun, 11 Jun 2006 14:39:21 GMT""},{""version"":""v2"",""created"":""Tue, 20 Feb 2007 14:21:07 GMT""},{""version"":""v3"",""created"":""Thu, 5 Jul 2007 14:10:50 GMT""}]","2007-07-05"
"nlin/0606028","Fausto Montoya","A. Orue, G. Alvarez, G. Pastor, M. Romera, F. Montoya and Shujun Li","A New Lorenz System Parameter Determination Method and Applications","21 pages, 14 figures, preprint submitted to Chaos Solitons and
  Fractals",,,,"nlin.CD",,"  This paper describes how to determine the parameter values of the chaotic
Lorenz system from one of its variables waveform. The geometrical properties of
the system are used firstly to reduce the parameter search space. Then, a
synchronization-based approach, with the help of the same geometrical
properties as coincidence criteria, is implemented to determine the parameter
values with the wanted accuracy. The method is not affected by a moderate
amount of noise in the waveform. As way of example of its effectiveness, the
method is applied to figure out directly from the ciphertext the secret keys of
two-channel chaotic cryptosystems using the variable $z$ as a synchronization
signal, based on the ultimate state projective chaos synchronization.
","[{""version"":""v1"",""created"":""Sun, 11 Jun 2006 11:37:45 GMT""}]","2007-05-23"
"nlin/0606029","Fausto Montoya","A. B. Orue, G. Alvarez, M. Romera, G. Pastor, F. Montoya and Shujun Li","Lorenz System Parameter Determination and Application to Break the
  Security of Two-channel Chaotic Cryptosystems","5 pages, 5 figures Preprint submitted to IEEE T. Cas II, revision of
  authors name spelling",,"10.1016/j.physleta.2008.06.066",,"nlin.CD",,"  This paper describes how to determine the parameter values of the chaotic
Lorenz system used in a two-channel cryptosystem. The geometrical properties of
the Lorenz system are used firstly to reduce the parameter search space, then
the parameters are exactly determined, directly from the ciphertext, through
the minimization of the average jamming noise power created by the encryption
process.
","[{""version"":""v1"",""created"":""Sun, 11 Jun 2006 15:40:05 GMT""},{""version"":""v2"",""created"":""Sun, 5 Aug 2007 17:52:13 GMT""}]","2016-11-17"
"physics/0606093","Miron Amusia","M. Ya. Amusia (Racah Institute of Physics, The Hebrew University,
  Jerusalem, Israel; Ioffe Physical-Technical Institute, St.-Petersburg,
  Russia)L. V. Chernysheva (Ioffe Physical-Technical Institute, St.-Petersburg,
  Russia)","Non-dipole angular anisotropy parameters of semi-filled shell atoms","15 pages, 8 figures","J. Phys. B: At. Mol. Opt. Phys., 39 (2006) 4627-4636,","10.1088/0953-4075/39/22/007",,"physics.atom-ph",,"  We present the results of calculations of outer shell non-dipole angular
anisotropy parameters for semi-filled shell atoms in the Hartree-Fock (HF)
one-electron approximation and with account of inter-electron correlations in
the frame of the Spin Polarized Random Phase Approximation with Exchange (SP
RPAE). We demonstrate for the first time that this characteristic of
photoionization process is essentially sensitive to the fact whether the
photoelectron has the same or opposite spin orientation to that of the
semi-filled shell.
","[{""version"":""v1"",""created"":""Sat, 10 Jun 2006 20:11:33 GMT""},{""version"":""v2"",""created"":""Thu, 14 Sep 2006 14:14:42 GMT""}]","2009-11-11"
"q-bio/0606011","Jose del Carmen Rodriguez Santamaria","Jose Rodriguez","Simulation in Biology","40 pages. Introductory course to simulation",,,,"q-bio.PE q-bio.QM",,"  An invitation to simulation is made into a realizable challenge: the reader
is taken from scratch to games with words, to mathematical models, to
statistical analysis, to simulation of evolution. No special requirements are
needed: we work with the inbuilt Visual Basic language that is attached to
Microsoft(R) Excel and Word. The Tex source must be downloaded to copy the code
that must be run.
","[{""version"":""v1"",""created"":""Sat, 10 Jun 2006 21:12:38 GMT""}]","2007-05-23"
"quant-ph/0606093","Bas Janssens","Bas Janssens","Unifying Decoherence and the Heisenberg Principle","17 pages, 7 figures","Lett. Math. Phys (2017) 107:1557-1579","10.1007/s11005-017-0953-z",,"quant-ph",,"  We exhibit three inequalities involving quantum measurement, all of which are
sharp and state independent. The first inequality bounds the performance of
joint measurement. The second quantifies the trade-off between the measurement
quality and the disturbance caused on the measured system. Finally, the third
inequality provides a sharp lower bound on the amount of decoherence in terms
of the measurement quality. This gives a unified discription of both the
Heisenberg principle and the collapse of the wave function.
","[{""version"":""v1"",""created"":""Sat, 10 Jun 2006 18:55:14 GMT""}]","2021-08-18"
"quant-ph/0606094","Todd Brun","Hari Krovi and Todd A. Brun (USC)","Quantum walks with infinite hitting times","28 pages, 3 figures in EPS format","Phys. Rev. A 74, 042334 (2006)","10.1103/PhysRevA.74.042334",,"quant-ph",,"  Hitting times are the average time it takes a walk to reach a given final
vertex from a given starting vertex. The hitting time for a classical random
walk on a connected graph will always be finite. We show that, by contrast,
quantum walks can have infinite hitting times for some initial states. We seek
criteria to determine if a given walk on a graph will have infinite hitting
times, and find a sufficient condition, which for discrete time quantum walks
is that the degeneracy of the evolution operator be greater than the degree of
the graph. The set of initial states which give an infinite hitting time form a
subspace. The phenomenon of infinite hitting times is in general a consequence
of the symmetry of the graph and its automorphism group. Using the irreducible
representations of the automorphism group, we derive conditions such that
quantum walks defined on this graph must have infinite hitting times for some
initial states. In the case of the discrete walk, if this condition is
satisfied the walk will have infinite hitting times for any choice of a coin
operator, and we give a class of graphs with infinite hitting times for any
choice of coin. Hitting times are not very well-defined for continuous time
quantum walks, but we show that the idea of infinite hitting-time walks
naturally extends to the continuous time case as well.
","[{""version"":""v1"",""created"":""Sat, 10 Jun 2006 23:51:35 GMT""}]","2009-11-13"
