"hep-th/0606109","Michael R. Douglas","Michael R. Douglas (Rutgers and IHES) and Washington Taylor (MIT and
  Stanford)","The landscape of intersecting brane models","59 pages, 8 figures; v2, v3: references added, minor corrections","JHEP 0701:031,2007","10.1088/1126-6708/2007/01/031","MIT-CTP-3748, SU-ITP-06/15, RU-NHETC-06-04, NSF-KITP-06-75","hep-th",,"  We develop tools for analyzing the space of intersecting brane models. We
apply these tools to a particular T^6/Z_2^2 orientifold which has been used for
model building. We prove that there are a finite number of intersecting brane
models on this orientifold which satisfy the Diophantine equations coming from
supersymmetry. We give estimates for numbers of models with specific gauge
groups, which we confirm numerically. We analyze the distributions and
correlations of intersection numbers which characterize the numbers of
generations of chiral fermions, and show that intersection numbers are roughly
independent, with a characteristic distribution which is peaked around 0 and in
which integers with fewer divisors are mildly suppressed. As an application,
the number of models containing a gauge group SU(3) x SU(2) x U(1) or SU(4) x
SU(2) x SU(2) and 3 generations of appropriate types of chiral matter is
estimated to be order O (10), in accord with previous explicit constructions.
As another application of the methods developed in the paper, we construct a
new pair of 3-generation SU(4) x SU(2) x SU(2) Pati-Salam models using
intersecting branes. We conclude with a description of how this analysis can be
generalized to a broader class of Calabi-Yau orientifolds, and a discussion of
how the numbers of IBM's are related to numbers of stabilized vacua.
","[{""version"":""v1"",""created"":""Mon, 12 Jun 2006 19:47:21 GMT""},{""version"":""v2"",""created"":""Thu, 20 Jul 2006 18:05:51 GMT""},{""version"":""v3"",""created"":""Thu, 7 Dec 2006 01:54:48 GMT""}]","2010-10-27"
"hep-th/0606110","Jorge Russo","R. Iengo and J. Russo","Black hole formation from collisions of cosmic fundamental strings","22 pages, 4 figures. Added comments","JHEP0608:079,2006","10.1088/1126-6708/2006/08/079",,"hep-th astro-ph hep-ph",,"  We develop the general formalism for joining, splitting and interconnection
of closed and open strings. As an application, we study examples of fundamental
cosmic string collisions leading to gravitational collapse. We find that the
interconnection of two strings of equal and opposite maximal angular momentum
and arbitrarily large mass generically leads to the formation of black holes,
provided their relative velocity is small enough.
","[{""version"":""v1"",""created"":""Tue, 13 Jun 2006 14:42:52 GMT""},{""version"":""v2"",""created"":""Tue, 27 Jun 2006 12:46:44 GMT""}]","2009-11-11"
"math-ph/0606034","Paolo Amore Dr","Paolo Amore, Nestor Sanchez","Development of accurate solutions for a classical oscillator","11 pages, 2 figures","Journal of Sound and Vibration 300 (2007) 345-351","10.1016/j.jsv.2006.08.022",,"math-ph math.MP",,"  We present a method to obtain arbitrarily accurate solutions for conservative
classical oscillators. The method that we propose here works both for small and
large nonlinearities and provides simple analytical approximations. A
comparison with the standard Lindstedt-Poincar\'e method is presented, from
which the advantages of our method are clear.
","[{""version"":""v1"",""created"":""Mon, 12 Jun 2006 16:14:49 GMT""}]","2015-06-26"
"math/0606263","Yuval Z. Flicker","Yuval Z. Flicker, Dmitrii Zinoviev","Twisted character of a small representation of GL(4)","Accepted for publication by the International Journal of Number
  Theory",,,,"math.NT math.AG math.RT",,"  We compute by a purely local method the (elliptic) twisted by
transpose-inverse character \chi_{\pi_Y} of the representation
\pi_Y=I_{(3,1)}(1_3x\chi_Y) of G=GL(4,F), where F is a p-adic field, p not 2,
and Y is an unramified quadratic extension of F; \chi_Y is the nontrivial
character of F^\x/N_{Y/F}Y^x. The representation \pi_Y is normalizedly induced
from \pmatrix m_3&\ast 0&m_1\endpmatrix \mapsto\chi_Y(m_1), m_i in GL(i,F), on
the maximal parabolic subgroup of type (3,1). We show that the twisted
character \chi_{\pi_Y} of \pi_Y is an unstable function: its value at a twisted
regular elliptic conjugacy class with norm in C_Y=``GL(2,Y)/F^x'' is minus its
value at the other class within the twisted stable conjugacy class. It is zero
at the classes without norm in C_Y. Moreover \pi_Y is the endoscopic lift of
the trivial representation of C_Y. We deal only with unramified Y/F, as
globally this case occurs almost everywhere. Naturally this computation plays a
role in the theory of lifting of C_Y and GSp(2) to GL(4) using the trace
formula.
  Our work extends -- to the context of nontrivial central characters -- the
work of math.NT/0606262, where representations of PGL(4,F) are studied. In
math.NT/0606262 a 4-dimensional analogue of the model of the small
representation of PGL(3,F) introduced with Kazhdan in a 3-dimensional case is
developed, and the local method of computation introduced by us in the
3-dimensional case is extended. As in math.NT/0606262 we use here the
classification of twisted (stable) regular conjugacy classes in GL(4,F).
","[{""version"":""v1"",""created"":""Mon, 12 Jun 2006 16:06:17 GMT""}]","2007-05-23"
"math/0606266","Yuval Z. Flicker","Yuval Z. Flicker","Characters, genericity, and multiplicity one for U(3)","15 pages","Journal d'Analyse Mathematique 94 (2004), 1-15",,,"math.NT math.AG math.RT",,"  Publications on automorphic representations of the group U(3) assumed the
validity of multiplicity one theorem since I claimed it in 1982. But the
argument, published 1988, was based on a misinterpretation of a claim of
Gelbart and Piatetski-Shapiro, SLN 1041 (1984), Prop. 2.4(i): ``L^2_{0,1} has
multiplicity 1'', as meaning that each irreducible in the space L^2_{0,1} of
generic cusp forms has multiplicity one in the space L^2_0 of cusp forms. The
statement meant in SLN 1041, ``each irreducible in L^2_{0,1} has multiplicity 1
in L^2_{0,1}'' is too weak to be useful for nongeneric representations, as the
present article points out. To remedy the situation, we detail in this paper
the local method we sketched in the paper of 1988.
  Let \psi be a generic character of the unipotent radical U of a Borel
subgroup of a quasisplit p-adic group G. The number (0 or 1) of \psi-Whittaker
models on an admissible irreducible representation \pi of G was expressed by
Rodier in terms of the limit of values of the trace of \pi at certain measures
concentrated near the origin. An analogous statement holds in the twisted case.
This article proves this twisted analogue for an involution when G=U(3) and p
is not 2, and uses it to provide a local proof of the multiplicity one theorem
for U(3). This asserts that each discrete spectrum automorphic representation
(with induced components at the dyadic places) of the quasisplit unitary group
U(3) associated with a quadratic extension E/F of number fields occurs in the
discrete spectrum with multiplicity one.
","[{""version"":""v1"",""created"":""Mon, 12 Jun 2006 16:19:06 GMT""}]","2007-05-23"
"math/0606270","Boaz Tsaban","Petr Simon and Boaz Tsaban","On the Pytkeev property in spaces of continuous functions",,"Proceedings of the American Mathematical Society 136 (2008),
  1125-1135","10.1090/S0002-9939-07-09070-3",,"math.GN math.CO math.LO","http://arxiv.org/licenses/nonexclusive-distrib/1.0/","  Answering a question of Sakai, we show that the minimal cardinality of a set
of reals X such that C_p(X) does not have the Pytkeev property is equal to the
pseudo-intersection number p. Our approach leads to a natural characterization
of the Pytkeev property of C_p(X) by means of a covering property of X, and to
a similar result for the Reznicenko property of C_p(X).
","[{""version"":""v1"",""created"":""Mon, 12 Jun 2006 19:55:27 GMT""},{""version"":""v2"",""created"":""Tue, 1 Aug 2006 15:36:45 GMT""},{""version"":""v3"",""created"":""Thu, 16 Nov 2006 20:09:08 GMT""},{""version"":""v4"",""created"":""Sun, 20 May 2007 13:44:13 GMT""},{""version"":""v5"",""created"":""Thu, 4 Nov 2010 19:19:49 GMT""}]","2010-11-05"
"math/0606279","Dmitri Piontkovski","Dmitri Piontkovski","Coherent algebras and noncommutative projective lines","10 pages. In this version, Prop. 1.5 extended, few comments added etc",,,,"math.RA math.AG math.QA",,"  A well-known conjecture says that every one-relator group is coherent. We
state and partly prove an analogous statement for graded associative algebras.
In particular, we show that every Gorenstein algebra $A$ of global dimension 2
is graded coherent.
  This allows us to define a noncommutative analogue of the projective line
$\PP^1$ as a noncommutative scheme based on the coherent noncommutative
spectrum $\cohp A$ of such an algebra $A$, that is, the category of coherent
$A$-modules modulo the torsion ones. This category is always abelian Ext-finite
hereditary with Serre duality, like the category of coherent sheaves on
$\PP^1$. In this way, we obtain a sequence $\PP^1_n $ ($n\ge 2$) of pairwise
non-isomorphic noncommutative schemes which generalize the scheme $\PP^1 =
\PP^1_2$.
","[{""version"":""v1"",""created"":""Mon, 12 Jun 2006 17:04:15 GMT""},{""version"":""v2"",""created"":""Fri, 9 Nov 2007 17:39:49 GMT""}]","2009-09-29"
"math/0606283","Ying Zhang","Ying Zhang","An elementary proof of uniqueness of Markoff numbers which are prime
  powers","14 pages, 3 figures. Version 2: thoroughly rewritten, title changed",,,,"math.NT",,"  We present a very elementary proof of the uniqueness of Markoff numbers which
are prime powers or twice prime powers, in the sense that it uses neither
algebraic number theory nor hyperbolic geometry.
","[{""version"":""v1"",""created"":""Mon, 12 Jun 2006 19:07:19 GMT""},{""version"":""v2"",""created"":""Thu, 1 Feb 2007 17:50:54 GMT""}]","2007-05-23"
"math/0606284","Jennifer Taback","Jennifer Taback and Peter Wong","A note on twisted conjugacy and generalized Baumslag-Solitar groups","8 pages",,,,"math.GR math.GT",,"  A generalized Baumslag-Solitar group is the fundamental group of a graph of
groups all of whose vertex and edge groups are infinite cyclic. Levitt proves
that any generalized Baumslag-Solitar group has property R-infinity, that is,
any automorphism has an infinite number of twisted conjugacy classes. We show
that any group quasi-isometric to a generalized Baumslag-Solitar group also has
property R-infinity. This extends work of the authors proving that any group
quasi-isometric to a solvable Baumslag-Solitar BS(1,n) group has property
R-infinity, and relies on the classification of generalized Baumslag-Solitar
groups given by Whyte.
","[{""version"":""v1"",""created"":""Mon, 12 Jun 2006 19:53:44 GMT""},{""version"":""v2"",""created"":""Sun, 18 May 2008 19:07:58 GMT""},{""version"":""v3"",""created"":""Fri, 30 May 2008 16:07:15 GMT""}]","2008-05-30"
"math/0606285","Boaz Tsaban","Boaz Tsaban","A new selection principle","Final version","Topology Proceedings 31 (2007), 319--329",,,"math.GN math.CO math.LO","http://arxiv.org/licenses/nonexclusive-distrib/1.0/","  Motivated by a recent result of Sakai, we define a new selection operator for
covers of topological spaces, inducing new selection hypotheses. We initiate a
systematic study of the new hypotheses. Some intriguing problems remain open.
","[{""version"":""v1"",""created"":""Mon, 12 Jun 2006 19:48:33 GMT""},{""version"":""v2"",""created"":""Wed, 28 Jun 2006 15:59:08 GMT""},{""version"":""v3"",""created"":""Tue, 1 Aug 2006 15:38:43 GMT""},{""version"":""v4"",""created"":""Mon, 29 Jan 2007 19:15:36 GMT""},{""version"":""v5"",""created"":""Sun, 20 May 2007 13:47:23 GMT""},{""version"":""v6"",""created"":""Sun, 31 Oct 2010 20:43:42 GMT""}]","2010-11-02"
"math/0606286","Christian Remling","Christian Remling","Discrete and embedded eigenvalues for one-dimensional Schr""odinger
  operators",,,"10.1007/s00220-006-0185-z",,"math.SP math-ph math.MP",,"  I present an example of a discrete Schr""odinger operator that shows that it
is possible to have embedded singular spectrum and, at the same time, discrete
eigenvalues that approach the edges of the essential spectrum (much) faster
than exponentially. This settles a conjecture of Simon (in the negative). The
potential is of von Neumann-Wigner type, with careful navigation around a
previously identified borderline situation.
","[{""version"":""v1"",""created"":""Mon, 12 Jun 2006 21:40:30 GMT""}]","2015-06-26"
"math/0606287","Sergey Zlobin Alekseevich","Sergey Zlobin","Generalizations of Guillera-Sondow's double integral formulas","v2: typos corrected; v3: minor corrections/changes to wording",,,,"math.NT math.CA",,"  We evaluate certain multidimensional integrals in terms of the Lerch
transcendent function $\Phi$, generalizing Guillera-Sondow's formulas. As an
application, we get new representations of classical constants like Euler's
constant $\gamma$ and $\ln(4/\pi)$.
","[{""version"":""v1"",""created"":""Tue, 13 Jun 2006 04:44:02 GMT""},{""version"":""v2"",""created"":""Wed, 12 Jul 2006 20:23:10 GMT""},{""version"":""v3"",""created"":""Sat, 19 Aug 2006 13:36:15 GMT""}]","2007-05-23"
"math/0606288","Natasa Sesum","Panagiota Daskalopoulos, Natasa Sesum","Type II extinction profile of maximal solutions to the Ricci flow in
  $\R^2$",,,,,"math.AP math.DG",,"  We consider the initial value problem $u_t = \Delta \log u$,
  $u(x,0) = u_0(x)\ge 0$ in $\R^2$, corresponding to the Ricci flow, namely
conformal evolution of the metric $u (dx_1^2 + dx_2^2)$ by Ricci curvature. It
is well known that the maximal (complete) solution $u$ vanishes identically
after time $T= \frac 1{4\pi} \int_{\R^2} u_0 $. Assuming that $u_0$ is
compactly supported we describe precisely the Type II vanishing behavior of $u$
at time $T$: we show the existence of an inner region with exponentially fast
vanishing profile, which is, up to proper scaling, a {\em soliton cigar
solution}, and the existence of an outer region of persistence of a logarithmic
cusp. This is the only Type II singularity which has been shown to exist, so
far, in the Ricci Flow in any dimension. It recovers rigorously formal
asymptotics derived by J.R. King \cite{K}.
","[{""version"":""v1"",""created"":""Mon, 12 Jun 2006 20:48:01 GMT""}]","2007-05-23"
"math/0606289","Carlo G. Madonna","C.G.Madonna, Viacheslav V.Nikulin","On correspondences of a K3 surface with itself. IV","14 pages; Var2: Exposition polished","Some results obtained here are part of:: C.G.Madonna and
  V.V.Nikulin, Explicit correspondences of a K3 surface with itself, Izvestiya:
  Mathematics 72 (2008), no. 3",,,"math.AG math-ph math.MP",,"  Let $X$ be a K3 surface with a polarization $H$ of the degree $H^2=2rs$,
$r,s\ge 1$, and the isotropic Mukai vector $v=(r,H,s)$ is primitive. The moduli
space of sheaves over $X$ with the isotropic Mukai vector $(r,H,s)$ is again a
K3 surface, $Y$. In \cite{Nik2} the second author gave necessary and sufficient
conditions in terms of Picard lattice $N(X)$ of $X$ when $Y$ is isomorphic to
$X$ (some important particular cases were also considered in math.AG/0206158,
math.AG/0304415 and math.AG/0307355).
  Here we show that these conditions imply existence of an isomorphism between
$Y$ and $X$ which is a composition of some universal geometric isomorphisms
between moduli of sheaves over $X$, and geometric Tyurin's isomorphsim between
moduli of sheaves over $X$ and $X$ itself. It follows that for a general K3
surface $X$ with $\rho(X)=\text{rk\}N(X)\le 2$ and $Y\cong X$, there exists an
isomorphism $Y\cong X$ which is a composition of the geometric universal and
the Tyurin's isomorphisms.
  This generalizes our recent results math.AG/0605362 and math.AG/0606239 to a
general case.
","[{""version"":""v1"",""created"":""Mon, 12 Jun 2006 23:25:32 GMT""},{""version"":""v2"",""created"":""Mon, 19 Jun 2006 22:35:48 GMT""}]","2008-06-22"
"math/0606290","Marko Nedeljkov","Marko Nedeljkov","Singular shock waves in interactions",,,,,"math.AP",,"  n a number of papers it was shown that there are one-dimensional systems such
that they contain solutions with, so called, overcompressive singular shock
waves besides the usual elementary waves (shock and rarefaction ones as well as
contact discontinuities). One can see their definition for a general 2 $\times$
2 system with fluxes linear in one of dependent variables in \cite{Ned1}. This
paper is devoted to examining their interactions with themselves and elementary
waves. After a discussion of systems given in a general form, a complete
analysis will be given for the ion-acoustic system.
","[{""version"":""v1"",""created"":""Tue, 13 Jun 2006 00:41:15 GMT""}]","2007-05-23"
"math/0606291","Zhihong Xia","Zhihong Xia","Homoclinic Points For Area-Preserving Surface Diffeomorphisms",,,,,"math.DS",,"  We show a $C^r$ connecting lemma for area-preserving surface diffeomorphisms
and for periodic Hamiltonian on surfaces. We prove that for a generic $C^r$,
$r=1, 2, ...$, $\infty$, area-preserving diffeomorphism on a compact orientable
surface, homotopic to identity, every hyperbolic periodic point has a
transversal homoclinic point. We also show that for a $C^r$, $r=1, 2, ...$,
$\infty$ generic time periodic Hamiltonian vector field in a compact orientable
surface, every hyperbolic periodic trajectory has a transversal homoclinic
point. The proof explores the special properties of diffeomorphisms that are
generated by Hamiltonian flows.
","[{""version"":""v1"",""created"":""Tue, 13 Jun 2006 03:27:32 GMT""}]","2007-05-23"
"math/0606292","Jir\^o Akahori","Jir\^o Akahori","A Discrete It\^o Calculus Approach to He's Framework for Multi-Factor
  Discrete Markets","15pages",,,,"math.PR",,"  In the present paper, a discrete version of It\^o's formula for a class of
multi-dimensional random walk is introduced and applied to the study of a
discrete-time complete market model which we call He's framework. The formula
unifies continuous-time and discrete-time settings and by regarding the latter
as the finite difference scheme of the former, the order of convergence is
obtained. The result shows that He's framework cannot be of order 1 scheme
except for the one dimensional case.
","[{""version"":""v1"",""created"":""Tue, 13 Jun 2006 05:53:10 GMT""}]","2007-05-23"
"math/0606293","Makoto Ozawa","Makoto Ozawa","A property of diagrams of the trivial knot","11 pages, 15 figures",,,,"math.GT",,"  In this paper, we give a necessary condition for a diagram to represent the
trivial knot.
","[{""version"":""v1"",""created"":""Tue, 13 Jun 2006 05:45:19 GMT""},{""version"":""v2"",""created"":""Wed, 4 Apr 2007 02:52:23 GMT""}]","2007-05-23"
"math/0606294","Volker Mayer","Volker Mayer and Mariusz Urbanski","Geometric Thermodynamical Formalism and Real Analyticity for Meromorphic
  Functions of Finite Order","32 pages",,,,"math.DS",,"  Working with well chosen Riemannian metrics and employing Nevanlinna's
theory, we make the thermodynamical formalism work for a wide class of
hyperbolic meromorphic functions of finite order (including in particular
exponential family, elliptic functions, cosine, tangent and the cosine--root
family and also compositions of these functions with arbitrary polynomials). In
particular, the existence of conformal (Gibbs) measures is established and then
the existence of probability invariant measures equivalent to conformal
measures is proven. As a geometric consequence of the developed thermodynamic
formalism, a version of Bowen's formula expressing the Hausdorff dimension of
the radial Julia set as the zero of the pressure function and, moreover, the
real analyticity of this dimension, is proved.
","[{""version"":""v1"",""created"":""Tue, 13 Jun 2006 06:38:57 GMT""},{""version"":""v2"",""created"":""Tue, 9 Jan 2007 15:29:47 GMT""}]","2007-05-23"
"math/0606297","Jeffrey Steif","Johan Jonasson, Jeffrey E. Steif","Dynamical models for circle covering: Brownian motion and Poisson
  updating","Published in at http://dx.doi.org/10.1214/07-AOP340 the Annals of
  Probability (http://www.imstat.org/aop/) by the Institute of Mathematical
  Statistics (http://www.imstat.org)","Annals of Probability 2008, Vol. 36, No. 2, 739-764","10.1214/07-AOP340","IMS-AOP-AOP340","math.PR",,"  We consider two dynamical variants of Dvoretzky's classical problem of random
interval coverings of the unit circle, the latter having been completely solved
by L. Shepp. In the first model, the centers of the intervals perform
independent Brownian motions and in the second model, the positions of the
intervals are updated according to independent Poisson processes where an
interval of length $\ell$ is updated at rate $\ell^{-\alpha}$ where $\alpha
\ge0$ is a parameter. For the model with Brownian motions, a special case of
our results is that if the length of the $n$th interval is $c/n$, then there
are times at which a fixed point is not covered if and only if $c<2$ and there
are times at which the circle is not fully covered if and only if $c<3$. For
the Poisson updating model, we obtain analogous results with $c<\alpha$ and
$c<\alpha+1$ instead. We also compute the Hausdorff dimension of the set of
exceptional times for some of these questions.
","[{""version"":""v1"",""created"":""Tue, 13 Jun 2006 08:25:49 GMT""},{""version"":""v2"",""created"":""Mon, 21 Apr 2008 11:33:55 GMT""}]","2008-04-22"
"math/0606298","Lior Fishman","Lior Fishman","Schmidt's Game on Certain Fractals",,,,,"math.NT","http://arxiv.org/licenses/nonexclusive-distrib/1.0/","  We construct (\alpha ,\beta) and \alpha -winning sets in the sense of
Schmidt's game, played on the support of certain measures (very friendly and
awfully friendly measures) and show how to derive the Hausdorff dimension for
some. In particular we prove that if K is the attractor of an irreducible
finite family of contracting similarity maps of R^N satisfying the open set
condition then for any countable collection of non-singular affine
transformations \Lambda_i:R^N \to R^N, dimK=dimK\cap (\cap
^{\infty}_{i=1}(\Lambda_i(BA))) where BA is the set of badly approximable
vectors in R^N.
","[{""version"":""v1"",""created"":""Tue, 13 Jun 2006 08:59:35 GMT""},{""version"":""v2"",""created"":""Wed, 10 Nov 2010 18:13:56 GMT""}]","2010-11-11"
"math/0606299","Benoit Daniel","Beno\^it Daniel","The Gauss map of minimal surfaces in the Heisenberg group","17 pages, redaction improved.","Int. Math. Res. Not. IMRN 2011 (2011), no. 3, 674-695",,,"math.DG","http://arxiv.org/licenses/nonexclusive-distrib/1.0/","  We study the Gauss map of minimal surfaces in the Heisenberg group
$\mathrm{Nil}_3$ endowed with a left-invariant Riemannian metric. We prove that
the Gauss map of a nowhere vertical minimal surface is harmonic into the
hyperbolic plane $\mathbb{H}^2$. Conversely, any nowhere antiholomorphic
harmonic map into $\mathbb{H}^2$ is the Gauss map of a nowhere vertical minimal
surface. Finally, we study the image of the Gauss map of complete nowhere
vertical minimal surfaces.
","[{""version"":""v1"",""created"":""Tue, 13 Jun 2006 09:30:49 GMT""},{""version"":""v2"",""created"":""Wed, 24 Mar 2010 14:30:42 GMT""}]","2011-03-23"
"math/0606300","Niall MacKay","N. J. MacKay","Lanchester combat models","8 pages, to appear in 'Mathematics Today'",,,,"math.HO",,"  An overview of Lanchester combat models, emphasising their pedagogical
possibilities. After a description of the aimed-fire model and comments on the
literature, we introduce briefly a range of further topics: a discrete
equivalent, the unaimed-fire model, mixed forces, the meaning of a 'unit',
support troops, Bracken's generalization and an asymmetric model.
","[{""version"":""v1"",""created"":""Tue, 13 Jun 2006 10:22:46 GMT""}]","2007-05-23"
"math/0606301","Jean-Christophe Novelli","Jean-Gabriel Luque, Jean-Christophe Novelli, and Jean-Yves Thibon","Period polynomials and Ihara brackets","12 pages, LaTEX","Journal of Lie Theory 17:2 (2007), 229--239",,,"math.CO math.NT",,"  Schneps [J. Lie Theory 16 (2006), 19--37] has found surprising links between
Ihara brackets and even period polynomials. These results can be recovered and
generalized by considering some identities relating Ihara brackets and
classical Lie brackets. The period polynomials generated by this method are
found to be essentially the Kohnen-Zagier polynomials.
","[{""version"":""v1"",""created"":""Tue, 13 Jun 2006 10:29:23 GMT""}]","2013-02-12"
