"cond-mat/0606301","Jacques H.H. Perk Dr.","Helen Au-Yang and Jacques H.H. Perk","Q-Dependent Susceptibilities in Ferromagnetic Quasiperiodic Z-Invariant
  Ising Models","LaTeX2e, 26 pages, 9 figures (27 eps files). v2: Misprints corrected","J. Stat. Phys. 127 (2007) 265-286","10.1007/s10955-006-9213-9",,"cond-mat.stat-mech",,"  We study the q-dependent susceptibility chi(q) of a series of quasiperiodic
Ising models on the square lattice. Several different kinds of aperiodic
sequences of couplings are studied, including the Fibonacci and silver-mean
sequences. Some identities and theorems are generalized and simpler derivations
are presented. We find that the q-dependent susceptibilities are periodic, with
the commensurate peaks of chi(q) located at the same positions as for the
regular Ising models. Hence, incommensurate everywhere-dense peaks can only
occur in cases with mixed ferromagnetic-antiferromagnetic interactions or if
the underlying lattice is aperiodic. For mixed-interaction models the positions
of the peaks depend strongly on the aperiodic sequence chosen.
","[{""version"":""v1"",""created"":""Mon, 12 Jun 2006 22:14:47 GMT""},{""version"":""v2"",""created"":""Fri, 29 Dec 2006 21:44:54 GMT""}]","2011-09-14"
"cond-mat/0606302","Xu Zhiping","Zhiping Xu and Quanshui Zheng","Nanomachines driven by thermal bath",,"Physical Review B 75, 195445 (2007)","10.1103/PhysRevB.75.195445",,"cond-mat.stat-mech cond-mat.mtrl-sci",,"  Multiwalled carbon nanotubes based nanomachines driven by thermal bath are
proposed in this Letter. Atomistic simulation shows that intershell
translational and rotational motion can be activated at sufficiently high
temperature, where the van der Waals potential barrier is accessible by the
thermal fluctuation. The thermal fluctuation is further identified to be
consistent with the equipartition theorem. This model can be used to construct
one dimensional devices driven by thermal bath or nano-channels for molecule
transport.
","[{""version"":""v1"",""created"":""Mon, 12 Jun 2006 22:32:23 GMT""}]","2007-06-01"
"cond-mat/0606303","Arno Godeke","A. Godeke","A Review of the Properties of Nb3Sn and Their Variation with A15
  Composition, Morphology and Strain State","Invited Topical Review for Superconductor, Science and Technology.
  Provisionally scheduled for July 2006",,"10.1088/0953-2048/19/8/R02",,"cond-mat.supr-con cond-mat.mtrl-sci",,"  This article gives an overview of the available literature on simplified,
well defined (quasi-)homogeneous laboratory samples. After more than 50 years
of research on superconductivity in Nb3Sn, a significant amount of results are
available, but these are scattered over a multitude of publications. Two
reviews exist on the basic properties of A15 materials in general, but no
specific review for Nb3Sn is available. This article is intended to provide
such an overview. It starts with a basic description of the Niobium-Tin
intermetallic. After this it maps the influence of Sn content on the the
electron-phonon interaction strength and on the field-temperature phase
boundary. The literature on the influence of Cu, Ti and Ta additions will then
be briefly summarized. This is followed by a review on the effects of grain
size and strain. The article is concluded with a summary of the main results.
","[{""version"":""v1"",""created"":""Tue, 13 Jun 2006 00:11:29 GMT""}]","2009-11-11"
"cond-mat/0606304","Hong Yao","Hong Yao, John A. Robertson, Eun-Ah Kim, and Steven A. Kivelson","Theory of stripes in quasi two dimensional rare-earth tritellurides","Added contents and references, changed title and figures. Accepted to
  PRB","Phys. Rev. B 74, 245126 (2006)","10.1103/PhysRevB.74.245126",,"cond-mat.str-el cond-mat.mtrl-sci",,"  Even though the rare-earth tritellurides are tetragonal materials with a
quasi two dimensional (2D) band structure, they have a ""hidden"" 1D character.
The resultant near-perfect nesting of the Fermi surface leads to the formation
of a charge density wave (CDW) state. We show that for this band structure,
there are two possible ordered phases: A bidirectional ""checkerboard"" state
would occur if the CDW transition temperature were sufficiently low, whereas a
unidirectional ""striped"" state, consistent with what is observed in experiment,
is favored when the transition temperature is higher. This result may also give
some insight into why, in more strongly correlated systems, such as the
cuprates and nickelates, the observed charge ordered states are generally
stripes as opposed to checkerboards.
","[{""version"":""v1"",""created"":""Tue, 13 Jun 2006 00:10:54 GMT""},{""version"":""v2"",""created"":""Fri, 13 Oct 2006 07:08:03 GMT""}]","2015-06-25"
"cond-mat/0606305","Akinobu Yamaguchi","A. Yamaguchi, H. Miyajima, T. Ono, Y. Suzuki, S. Yuasa, A. Tulapurkar,
  and Y. Nakatani","Rectification of radio frequency current in ferromagnetic nanowire","20 Pages, 4 figures, submitted",,"10.1063/1.2737134",,"cond-mat.mtrl-sci",,"  We report the rectification of a constant wave radio frequency (RF) current
by using a single-layer magnetic nanowire; a direct-current voltage is
resonantly generated when the RF current flows through the nanowire. The
mechanism of the rectification is discussed in terms of the spin torque diode
effect reported for magnetic tunnel junction devices and the rectification is
shown to be direct attributable to resonant spin wave excitation by the RF
current.
","[{""version"":""v1"",""created"":""Tue, 13 Jun 2006 01:33:26 GMT""},{""version"":""v2"",""created"":""Mon, 7 May 2007 07:04:29 GMT""}]","2009-11-11"
"cond-mat/0606306","Alexey V. Pan","Alexey V. Pan, Serhiy Pysarenko, and Shi X. Dou","Drastic improvement of surface structure and current-carrying ability in
  YBa2Cu3O7 films by introducing multilayered structure","Accepted to Appl. Phys. Lett. 88, June (2006), in press 4 pages, 3
  figures",,"10.1063/1.2211051",,"cond-mat.supr-con cond-mat.mtrl-sci",,"  Much smoother surfaces and significantly improved superconducting properties
of relatively thick YBa2Cu3O7 (YBCO) films have been achieved by introducing a
multilayered structure with alternating main YBCO and additional NdBCO layers.
The surface of thick (1 microm) multilayers has almost no holes compared to
YBCO films. Critical current density (Jc) have been drastically increased up to
a factor > 3 in 1 microm multilayered structures compared to YBCO films over
entire temperature and applied magnetic filed range. Moreover, Jc values
measured in thick multilayers are even larger than in much thinner YBCO films.
The Jc and surface improvement have been analysed and attributed to growth
conditions and corresponding structural peculiarities.
","[{""version"":""v1"",""created"":""Tue, 13 Jun 2006 02:00:33 GMT""}]","2007-05-23"
"cond-mat/0606307","Daniel Henrique Nogueira Dias","E. V. L. de Mello, D. H. N. Dias and Otton Teixeira da Silveira Filho","Phase Separation and the Phase Diagram in Cuprates Superconductors","9 pages, 9 figures. Submitted to Phys. Rev. B",,"10.1088/0953-8984/19/8/086218",,"cond-mat.supr-con",,"  We show that the main features of the cuprates superconductors phase diagram
can be derived considering the disorder as a key property of these materials.
Our basic point is that the high pseudogap line is an onset of phase separation
which generates compounds made up of regions with distinct doping levels. We
calculate how this continuous temperature dependent phase separation process
occurs in high critical temperature superconductors (HTSC) using the
Cahn-Hilliard approach, originally applied to study alloys. Since the level of
phase separation varies for different cuprates, it is possible that different
systems with average doping level pm exhibit different degrees of charge and
spin segregation. Calculations on inhomogeneous charge distributions in form of
stripes in finite clusters performed by the Bogoliubov-deGennes superconducting
approach yield good agreement to the pseudogap temperature T*(pm), the onset of
local pairing amplitudes with phase locked and concomitantly, how they develop
at low temperatures into the superconducting phase at Tc(pm) by percolation.
","[{""version"":""v1"",""created"":""Tue, 13 Jun 2006 02:16:44 GMT""}]","2009-11-11"
"cond-mat/0606308","Ikuo Ichinose","Ikuo Ichinose","Strong-Coupling Gauge Theory of Nodal Spinons and Antiferromagnetic
  Phase Transitions","15 pages and 6 figures, the version to appear in Mod.Phys.Lett.A","Mod.Phys.Lett.A21:2947-2960,2006","10.1142/S0217732306022213",,"cond-mat.str-el hep-lat",,"  In this paper we shall study a gauge theory of nodal spinons which appears as
a low-energy effective theory for antiferromagnetic (AF) Heisenberg models. In
most of studies on the nodal spinons given so far, the gauge interaction
between spinons was assumed weak and nonperturbative effects like instantons
and vortices were ignored. In the present paper, we shall study strong-coupling
gauge theory of nodal spinons and reveal its nontrivial phase structure. To
this end, we employ recently developed lattice gauge theory techniques for
studying finite-temperature and finite-density gauge theory. At low temperature
and low spinon-density region, an AF long-range order exists. As temperature
and/or density of spinons are increases, a phase transition to nonmagnetic
phase takes place. Order of the phase transition is of second (first) order for
low (high) density region of spinons. At a quantum critical point at vanishing
temperature T=0, abrupt change of spinon density occurs as a function of the
chemical potential. Implications of the results to the heavy-fermion materials
and the high-$T_c$ cuprates are discussed.
","[{""version"":""v1"",""created"":""Tue, 13 Jun 2006 04:16:34 GMT""},{""version"":""v2"",""created"":""Thu, 19 Oct 2006 08:58:34 GMT""}]","2010-11-05"
"cond-mat/0606309","Nicholas J. Curro","N. J. Curro","Hyperfine Interactions in the Heavy Fermion CeMIn_5 Systems","15 pages, 5 figures","New. J. Phys. vol 8, pg 173 (2006)","10.1088/1367-2630/8/9/173","LAUR-06-2713","cond-mat.str-el",,"  The CeMIn_5 heavy fermion compounds have attracted enormous interest since
their discovery six years ago. These materials exhibit a rich spectrum of
unusual correlated electron behavior, and may be an ideal model for the high
temperature superconductors. As many of these systems are either
antiferromagnets, or lie close to an antiferromagnetic phase boundary, it is
crucial to understand the behavior of the dynamic and static magnetism. Since
neutron scattering is difficult in these materials, often the primary source of
information about the magnetic fluctuations is Nuclear Magnetic Resonance
(NMR). Therefore, it is crucial to have a detailed understanding of how the
nuclear moments interact with conduction electrons and the local moments
present in these systems. Here we present a detailed analysis of the hyperfine
coupling based on anisotropic hyperfine coupling tensors between nuclear
moments and local moments. Because the couplings are symmetric with respect to
bond axes rather than crystal lattice directions, the nuclear sites can
experience non-vanishing hyperfine fields even in high symmetry sites.
","[{""version"":""v1"",""created"":""Tue, 13 Jun 2006 04:51:35 GMT""}]","2009-11-11"
"cond-mat/0606310","P. H.-L. Sit","P. H.-L. Sit, Matteo Cococcioni and Nicola Marzari","Realistic, quantitative descriptions of electron-transfer reactions:
  diabatic free-energy surfaces from first-principles molecular dynamics","5 pages, 4 figures, accepted for publication in Phys. Rev. Lett",,"10.1103/PhysRevLett.97.028303",,"cond-mat.mtrl-sci cond-mat.soft",,"  A general approach to calculate the diabatic surfaces for electron-transfer
reactions is presented, based on first-principles molecular dynamics of the
active centers and their surrounding medium. The excitation energy
corresponding to the transfer of an electron at any given ionic configuration
(the Marcus energy gap) is accurately assessed within ground-state
density-functional theory via a novel penalty functional for
oxidation-reduction reactions that appropriately acts on the electronic degrees
of freedom alone. The self-interaction error intrinsic to common
exchange-correlation functionals is also corrected by the same penalty
functional. The diabatic free-energy surfaces are then constructed from
umbrella sampling on large ensembles of configurations. As a paradigmatic case
study, the self-exchange reaction between ferrous and ferric ions in water is
studied in detail.
","[{""version"":""v1"",""created"":""Tue, 13 Jun 2006 05:40:02 GMT""}]","2009-11-11"
"cond-mat/0606311","Igor Lyapilin","I. I. Lyapilin, A. E. Patrakov","Photoconductiviy of 2D Rashba system in the perpendicular AC magnetic
  field","6 pages, 1 figure",,,,"cond-mat.mes-hall",,"  The response of a 2D electron system to a DC measurement electric field has
been investigated in the case when the system is driven out of the equilibrium
by the magnetic ultra-high frequency field that leads to combined transitions
involving the spin-orbit interaction. It has been shown that the method of
non-equilibrium statistical operator in conjunction ith the method of canonical
transformations allows one to build a theory of linear response of a
non-equilibrium 2D electron gas to a weak ""measurement"" DC electric field. The
proposed theory predicts that such perturbation of the electron system with
high (~10^7 cm^2/Vs) mobility leads to a new type of 2D electron gas
conductivity oscillations controlled by the ratio of the radiation frequency to
the cyclotron frequency.
","[{""version"":""v1"",""created"":""Tue, 13 Jun 2006 07:10:53 GMT""}]","2007-05-23"
"cond-mat/0606312","Marco Picco","Marco Picco (LPTHE), Andreas Honecker, Pierre Pujol (Phys-ENS)","Strong disorder fixed points in the two-dimensional random-bond Ising
  model","final version to appear in JSTAT; minor changes","Journal of Statistical Mechanics: Theory and Experiment (2006)
  P09006","10.1088/1742-5468/2006/09/P09006",,"cond-mat.stat-mech cond-mat.dis-nn",,"  The random-bond Ising model on the square lattice has several disordered
critical points, depending on the probability distribution of the bonds. There
are a finite-temperature multicritical point, called Nishimori point, and a
zero-temperature fixed point, for both a binary distribution where the coupling
constants take the values +/- J and a Gaussian disorder distribution. Inclusion
of dilution in the +/- J distribution (J=0 for some bonds) gives rise to
another zero-temperature fixed point which can be identified with percolation
in the non-frustrated case (J >= 0). We study these fixed points using
numerical (transfer matrix) methods. We determine the location, critical
exponents, and central charge of the different fixed points and study the
spin-spin correlation functions. Our main findings are the following: (1) We
confirm that the Nishimori point is universal with respect to the type of
disorder, i.e. we obtain the same central charge and critical exponents for the
+/- J and Gaussian distributions of disorder. (2) The Nishimori point, the
zero-temperature fixed point for the +/- J and Gaussian distributions of
disorder, and the percolation point in the diluted case all belong to mutually
distinct universality classes. (3) The paramagnetic phase is re-entrant below
the Nishimori point, i.e. the zero-temperature fixed points are not located
exactly below the Nishimori point, neither for the +/- J distribution, nor for
the Gaussian distribution.
","[{""version"":""v1"",""created"":""Tue, 13 Jun 2006 07:23:24 GMT""},{""version"":""v2"",""created"":""Fri, 25 Aug 2006 12:45:09 GMT""}]","2007-05-23"
"cond-mat/0606313","Akira Oguri","Akira Oguri, Yunori Nisikawa, Yoshihide Tanaka, Takahide Numata","Kondo screening of a high-spin Nagaoka state in a triangular quantum dot","2pages, 2figures: fig1 is revised to show a narrow dip found in the
  series conductance","J. Magn. & Magn. Mater. 310, 1139 (2007)","10.1016/j.jmmm.2006.10.890",,"cond-mat.mes-hall cond-mat.str-el",,"  We study transport through a triangle triple quantum dot connected to two
noninteracting leads using the numerical renormalization group (NRG). The
triangle has a high-spin ground state of S=1 caused by a Nagaoka
ferromagnetism, when it is isolated and has one extra electron introduced into
a half-filling. The results show that the conduction electrons screen the local
moment via two separate stages with different energy scales. The half of the
S=1 is screened first by one of the channel degrees, and then at very low
temperature the remaining half is fully screened to form a Kondo singlet. The
transport is determined by two phase shifts for quasi-particles with even and
odd parities, and then a two-terminal conductance in the series configuration
is suppressed $g_{\rm series} \simeq 0$, while plateau of a four-terminal
parallel conductance reaches a Unitary limit value $g_{\rm parallel} \simeq
4e^2/h$ of two conducting modes.
","[{""version"":""v1"",""created"":""Tue, 13 Jun 2006 07:57:46 GMT""},{""version"":""v2"",""created"":""Fri, 15 Dec 2006 10:15:59 GMT""}]","2015-06-25"
"cond-mat/0606314","Akihiro Tanaka","Akihiro Tanaka and Xiao Hu","Effective field theory with a $\theta$-vacua structure for 2d spin
  systems","4 pages, 2 figures",,"10.1103/PhysRevB.74.140407",,"cond-mat.str-el",,"  We construct a nonlinear sigma (NL$\sigma$) model description of 2+1d spin
systems, by coupling together antiferromagnetic spin chains via interchain
exchange terms. Our mapping incorporates methods developed recently by
ourselves and by Senthil and Fisher, which aim at describing competition
between antiferromagnetic and valence-bond-solid orders in quantum magnets. The
resulting 2+1d $O$(4) NL$\sigma$ model contains a topological $\theta$-term
whose vacuum angle $\theta$ varies continuously with $\delta$, the
bond-alternation strength of the interchain interaction. This implies that the
$\theta$-vacua structure for this NL$\sigma$ model can be explored by tuning
$\delta$ in a suitable 2d spin system, which is strongly reminiscent of the
situation for 1+1 AF spin chains with bond-alternation.
","[{""version"":""v1"",""created"":""Tue, 13 Jun 2006 08:47:44 GMT""}]","2009-11-11"
"cond-mat/0606315","Politi Paolo","Paolo Politi, Alessandro Torcini","Asymptotic and effective coarsening exponents in surface growth models","6 pages. Several parts and conclusions have been rewritten. (Addendum
  to the article that can be found in
  http://www.arxiv.org/abs/cond-mat/0110058)","Eur. Phys. J. B 53, 401-404 (2006)","10.1140/epjb/e2006-00380-9",,"cond-mat.stat-mech",,"  We consider a class of unstable surface growth models, z_t = -\partial_x J,
developing a mound structure of size lambda and displaying a perpetual
coarsening process, i.e. an endless increase in time of lambda. The coarsening
exponents n, defined by the growth law of the mound size lambda with time,
lambda=t^n, were previously found by numerical integration of the growth
equations [A. Torcini and P. Politi, Eur. Phys. J. B 25, 519 (2002)]. Recent
analytical work now allows to interpret such findings as finite time effective
exponents. The asymptotic exponents are shown to appear at so large time that
cannot be reached by direct integration of the growth equations. The reason for
the appearance of effective exponents is clearly identified.
","[{""version"":""v1"",""created"":""Tue, 13 Jun 2006 08:15:31 GMT""},{""version"":""v2"",""created"":""Mon, 21 Aug 2006 17:04:28 GMT""}]","2007-05-23"
"cond-mat/0606316","Akira Oguri","Akira Oguri","Transport theory for interacting electrons connected to reservoirs","44 pages, 10 figures, text for graduate students","Handbook of Theoretical and Computational Nanotechnology, Edited
  by M. Rieth and W. Schommers (American Scientific Publishers, California,
  2006, ISBN: 1-58883-052-7), Vol. 10, p. 409-435.",,,"cond-mat.mes-hall cond-mat.str-el",,"  We describe microscopic theory for the quantum transport through finite
interacting systems connected to noninteracting leads. It can be applied to
small systems such as quantum dots, quantum wires, atomic chain, molecule, and
so forth. The Keldysh formalism is introduced to study the nonlinear
current-voltage characteristics, and general properties of the nonequilibrium
Green's functions are provided. We apply the formulated to an
out-of-equilibrium Anderson model that has been used widely for the Kondo
effect in quantum dots. In the linear-response regime the Kubo formalism still
has an advantage, because it relates the transport coefficients directly to the
correlation functions defined with respect to the thermal equilibrium, and it
has no ambiguities about a profile of the inner electric field. We introduce a
many-body transmission coefficient, by which the dc conductance can be
expressed in a Landauer-type form, quite generally. We also discuss transport
properties of the Tomonaga-Luttinger liquid, which has also been an active
field of research in this decade.
","[{""version"":""v1"",""created"":""Tue, 13 Jun 2006 08:27:57 GMT""}]","2007-05-23"
"cond-mat/0606317","Matthias Vojta","Hilbert v. L\""ohneysen, Achim Rosch, Matthias Vojta, Peter W\""olfle","Fermi-liquid instabilities at magnetic quantum phase transitions","62 pages, 29 figs, review article for Rev. Mod. Phys; (v2) discussion
  extended, refs added; (v3) shortened; final version as published","Rev. Mod. Phys. 79, 1015 (2007)","10.1103/RevModPhys.79.1015",,"cond-mat.str-el cond-mat.stat-mech",,"  This review discusses instabilities of the Fermi-liquid state of conduction
electrons in metals with particular emphasis on magnetic quantum critical
points. Both the existing theoretical concepts and experimental data on
selected materials are presented; with the aim of assessing the validity of
presently available theory. After briefly recalling the fundamentals of
Fermi-liquid theory, the local Fermi-liquid state in quantum impurity models
and their lattice versions is described. Next, the scaling concepts applicable
to quantum phase transitions are presented. The Hertz-Millis-Moriya theory of
quantum phase transitions is described in detail. The breakdown of the latter
is analyzed in several examples. In the final part experimental data on
heavy-fermion materials and transition-metal alloys are reviewed and confronted
with existing theory.
","[{""version"":""v1"",""created"":""Tue, 13 Jun 2006 09:55:03 GMT""},{""version"":""v2"",""created"":""Tue, 31 Oct 2006 15:22:40 GMT""},{""version"":""v3"",""created"":""Tue, 28 Aug 2007 12:09:00 GMT""}]","2007-08-28"
"cond-mat/0606318","Karen van der Molen","Karen L. van der Molen, Allard P. Mosk and Ad Lagendijk","Intrinsic fluctuations in random lasers","accepted by Phys. Rev. A. submitted; 7 pages, 5 figures","Phys. Rev. A 74, 053808 (2006)","10.1103/PhysRevA.74.053808",,"cond-mat.dis-nn",,"  We present a quantitative experimental and theoretical study of shot-to-shot
intensity fluctuations in the emitted light of a random laser. A model that
clarifies these intrinsic fluctuations is developed. We describe the output
versus input power graphs of the random laser with an effective spontaneous
emission factor (beta factor).
","[{""version"":""v1"",""created"":""Tue, 13 Jun 2006 09:12:23 GMT""},{""version"":""v2"",""created"":""Wed, 4 Oct 2006 14:06:39 GMT""}]","2007-05-23"
"cond-mat/0606319","Dimitri M. Gangardt","D.M. Gangardt, G.V. Shlyapnikov","Off-diagonal correlations of lattice impenetrable bosons in one
  dimension","10 pages. Submitted to the Focus Issue on 'Cold Atoms in Optical
  Lattices' of New Journal of Physics","New Journal of Physics 8, 167 (2006)","10.1088/1367-2630/8/8/167",,"cond-mat.stat-mech",,"  We consider off-diagonal correlation functions of impenetrable bosons on a
lattice. By using the Jordan-Wigner transformation the one-body density matrix
is represented as (Toeplitz) determinant of a matrix of fermionic Green
functions. Using the replica method we calculate exactly the full long-range
asymptotic behaviour of the one-body density matrix. We discuss how subleading
oscillating terms, originating from short-range correlations give rise to
interesting features in the momentum distribution.
","[{""version"":""v1"",""created"":""Tue, 13 Jun 2006 09:26:28 GMT""},{""version"":""v2"",""created"":""Thu, 20 Jul 2006 15:08:42 GMT""}]","2007-05-23"
"cond-mat/0606320","Meik Hellmund","Meik Hellmund and Wolfhard Janke","High-temperature series for the bond-diluted Ising model in 3, 4 and 5
  dimensions","16 pages, 10 figures","Phys. Rev. B74(2006)144201","10.1103/PhysRevB.74.144201",,"cond-mat.stat-mech cond-mat.dis-nn",,"  In order to study the influence of quenched disorder on second-order phase
transitions, high-temperature series expansions of the \sus and the free energy
are obtained for the quenched bond-diluted Ising model in $d = 3$--5
dimensions. They are analysed using different extrapolation methods tailored to
the expected singularity behaviours. In $d = 4$ and 5 dimensions we confirm
that the critical behaviour is governed by the pure fixed point up to dilutions
near the geometric bond percolation threshold. The existence and form of
logarithmic corrections for the pure Ising model in $d = 4$ is confirmed and
our results for the critical behaviour of the diluted system are in agreement
with the type of singularity predicted by renormalization group considerations.
In three dimensions we find large crossover effects between the pure Ising,
percolation and random fixed point. We estimate the critical exponent of the
\sus to be $\gamma =1.305(5)$ at the random fixed point.
","[{""version"":""v1"",""created"":""Tue, 13 Jun 2006 10:12:37 GMT""}]","2009-11-11"
