"astro-ph/0606296","Mikako Matsuura","M. Matsuura, P.R. Wood, G.C. Sloan, A.A. Zijlstra, J.Th. van Loon,
  M.A.T. Groenewegen, J.A.D.L. Blommaert, M.-R.L. Cioni, M.W. Feast, H.J.
  Habing, S. Hony, E. Lagadec, C. Loup, J.W. Menzies, L.B.F.M. Waters, P.A.
  Whitelock","Spitzer observations of acetylene bands in carbon-rich AGB stars in the
  Large Magellanic Cloud","7 pages, accepted by MNRAS","Mon.Not.Roy.Astron.Soc.371:415-420,2006","10.1111/j.1365-2966.2006.10664.x",,"astro-ph",,"  We investigate the molecular bands in carbon-rich AGB stars in the Large
Magellanic Cloud (LMC), using the InfraRed Spectrograph (IRS) on board the
Spitzer Space Telescope (SST) over the 5--38 micron range. All 26
low-resolution spectra show acetylene (C2H2) bands at 7 and 14 micron. The
hydrogen cyanide (HCN) bands at these wavelengths are very weak or absent. This
is consistent with low nitrogen abundances in the LMC. The observed 14 micron
C2H2 band is reasonably reproduced by an excitation temperature of 500 K. There
is no clear dilution of the 14 micron band by circumstellar dust emission. This
14 micron band originates from molecular gas in the circumstellar envelope in
these high mass-loss rate stars, in agreement with previous findings for
Galactic stars. The C2H2,column density, derived from the 13.7 micron band,
shows a gas mass-loss rate in the range 3x10^-6 to 5x10^{-5} Msun yr-1. This is
comparable with the total mass-loss rate of these stars estimated from the
spectral energy distribution. Additionally, we compare the line strengths of
the 13.7 micron C2H2 band of our LMC sample with those of a Galactic sample.
Despite the low metallicity of the LMC, there is no clear difference in the
C2H2 abundance among LMC and Galactic stars. This reflects the effect of the
3rd dredge-up bringing self-produced carbon to the surface, leading to high C/O
ratios at low metallicity.
","[{""version"":""v1"",""created"":""Tue, 13 Jun 2006 07:23:42 GMT""}]","2009-11-11"
"astro-ph/0606297","Michele Cirasuolo Dr","M. Cirasuolo, M. Magliocchetti, G. Gentile, A. Celotti, S. Cristiani,
  L. Danese","On the radio properties of the highest redshift quasars","Accepted for publication in MNRAS, 8 pages, 6 figures","Mon.Not.Roy.Astron.Soc.371:695-702,2006","10.1111/j.1365-2966.2006.10695.x",,"astro-ph",,"  We present deep radio observations of the most distant complete quasar sample
drawn from the Sloan Digital Sky Survey. Combining our new data with those from
literature we obtain a sample which is ~100 per cent complete down to S_1.4GHz
= 60 \mu Jy over the redshift range 3.8 < z < 5. The fraction of radio
detections is relatively high (~43 per cent), similar to what observed locally
in bright optical surveys. Even though the combined radio and optical
properties of quasars remain overall unchanged from z ~ 5 to the local
Universe, there is some evidence for a slight over-abundance of radio-loud
sources at the highest redshifts when compared with the lower-z regime.
  Exploiting the deep radio VLA observations we present the first attempt to
directly derive the radio luminosity function of bright quasars at z ~ 4. The
unique depth -- both in radio and optical -- allows us to thoroughly explore
the population of optically bright FR~II quasars up to z ~ 5 and opens a window
on the behaviour of the brightest FR~I sources. A close investigation of the
space density of radio loud quasars also suggests a differential evolution,
with the more luminous sources showing a less pronounced cut-off at high z when
compared with the less luminous ones.
","[{""version"":""v1"",""created"":""Tue, 13 Jun 2006 14:56:56 GMT""}]","2009-11-11"
"astro-ph/0606298","Huib Intema","H. T. Intema (1), B. P. Venemans (1), J. D. Kurk (1 and 2), M. Ouchi
  (3), T. Kodama (4 and 5), H. J. A. Rottgering (1), G. K. Miley (1), R. A.
  Overzier (1) ((1) Sterrewacht Leiden, (2) INAF, (3) STSCI, (4) NOAJ, (5) ESO)","Large-scale structure of Lyman break galaxies around a radio galaxy
  protocluster at z~4","5 pages, 4 figures. Accepted for publication in A&A. Full resolution
  version available at
  http://www.strw.leidenuniv.nl/~intema/files/AA_2006_4812.zip",,"10.1051/0004-6361:20064812",,"astro-ph",,"  We present broad-band imaging with the Subaru Telescope of a 25'x25' field
surrounding the radio galaxy TN J1338-1942 at redshift z=4.1. The field
contains excesses of Lyman-alpha emitters (LAEs) and Lyman break galaxies
(LBGs) identified with a protocluster surrounding the radio galaxy. Our new
wide-field images provide information about the boundary of the protocluster
and its surroundings. There are 874 candidate LBGs within our field, having
redshifts in the range z=3.5-4.5. An examination of the brightest of these
(with i'< 25.0) shows that the most prominent concentration coincides with the
previously discovered protocluster. The diameter of this galaxy overdensity
corresponds to ~2 Mpc at z=4, consistent with the previous estimation using
LAEs. Several other concentrations of LBGs are observed in the field, some of
which may well be physically connected with the z=4.1 protocluster. The
observed structure in the smoothed LBG distribution can be explained as the
projection of large-scale structure, within the redshift range z=3.5-4.5,
comprising compact overdensities and prominent larger voids. If the 5-8
observed compact overdensities are associated with protoclusters, the observed
protocluster volume density is ~5x10^-6 Mpc^-3, similar to the volume density
of rich clusters in the local Universe.
","[{""version"":""v1"",""created"":""Tue, 13 Jun 2006 12:31:22 GMT""}]","2009-11-11"
"astro-ph/0606299","Leen Decin","L. Decin, S. Hony, A. de Koter, K. Justtanont, A.G.G.M. Tielens,
  L.B.F.M. Waters","Probing the mass-loss history of AGB and red supergiant stars from CO
  rotational line profiles I. Theoretical model -- Mass-loss history unravelled
  in VY CMa","18 pages, 10 figures, accepted for publication in ""Astronomy &
  Astrophysics""",,"10.1051/0004-6361:20065230",,"astro-ph",,"  Context: Mass loss plays a dominant role in the evolution of low mass stars
while they are on the Asymptotic Giant Branch (AGB). The gas and dust ejected
during this phase are a major source in the mass budget of the interstellar
medium. Recent studies have pointed towards the importance of variations in the
mass-loss history of such objects. Aims: By modelling the full line profile of
low excitation CO lines emitted in the circumstellar envelope, we can study the
mass-loss history of AGB stars. Methods: We have developed a non-LTE radiative
transfer code, which calculates the velocity structure and gas kinetic
temperature of the envelope in a self-consistent way. The resulting structure
of the envelope provides the input for the molecular line radiative
calculations which are evaluated in the comoving frame. The code allows for the
implementation of modulations in the mass-loss rate. This code has been
benchmarked against other radiative transfer codes and is shown to perform well
and efficiently. Results: We illustrate the effects of varying mass-loss rates
in case of a superwind phase. The model is applied to the well-studied case of
VY CMa. We show that both the observed integrated line strengths as the
spectral structure present in the observed line profiles, unambiguously
demonstrate that this source underwent a phase of high mass loss (~ 3.2E-4
Msun/yr) some 1000 yr ago. This phase took place for some 100 yr, and was
preceded by a low mass-loss phase (~ 1E-6 Msun/yr) taking some 800 yr. The
current mass-loss rate is estimated to be in the order of 8E-5 Msun/yr.
Conclusions: In this paper, we demonstrate that both the relative strength of
the CO rotational line profiles and the (non)-occurrence of spectral structure
in the profile offer strong diagnostics to pinpoint the mass-loss history.
","[{""version"":""v1"",""created"":""Tue, 13 Jun 2006 09:02:58 GMT""}]","2009-11-11"
"astro-ph/0606300","Wouter Vlemmings","W.H.T. Vlemmings (1), L. Harvey-Smith (2) and R.J. Cohen (1) ((1)
  Jodrell Bank (2) JIVE)","Methanol Maser Polarization in W3(OH)","5 pages, 2 figures, accepted for publication in MNRAS","Mon.Not.Roy.Astron.Soc.Lett. 371 (2006) L26-L30","10.1111/j.1745-3933.2006.00201.x",,"astro-ph",,"  We present the first 6.7 GHz methanol maser linear polarization map of the
extended filamentary maser structure around the compact HII region W3(OH). The
methanol masers show linear polarization up to 8 per cent and the polarization
angles indicate a magnetic field direction along the North-South maser
structure. The polarization angles are consistent with those measured for the
OH masers, taking into account external Faraday rotation toward W3(OH), and
confirm that the OH and methanol masers are found in similar physical
conditions. Additionally we discuss the Zeeman splitting of the 6.7 GHz
methanol transition and present an upper limit of ~22 mG for the magnetic field
strength in the maser region. The upper limit is fully consistent with the
field strengths derived from OH maser Zeeman splitting.
","[{""version"":""v1"",""created"":""Tue, 13 Jun 2006 08:14:16 GMT""}]","2009-11-11"
"astro-ph/0606301","Steen H. Hansen","Steen H. Hansen, Jesper Sommer-Larsen","The density profiles of hot galactic halo gas","5 pages, 2 figures","Astrophys.J.653:L17-L20,2006","10.1086/510450",,"astro-ph",,"  Extended gas haloes around galaxies are a ubiquitous prediction of galaxy
formation scenarios. However, the density profiles of this hot halo gas is
virtually unknown, although various profiles have been suggested on theoretical
grounds. In order to quantitatively address the gas profile, we compare
galaxies from direct cosmological simulations with analytical solutions of the
underlying gas equations. We find remarkable agreement between simulations and
theoretical predictions. We present an expression for this gas profile with a
non-trivial dependence on the total mass profile. This expression is useful
when setting up equilibrium galaxy models for numerical experiments.
","[{""version"":""v1"",""created"":""Tue, 13 Jun 2006 08:19:46 GMT""}]","2009-11-11"
"astro-ph/0606302","Tim van Kempen","T.A. van Kempen, E.F. van Dishoeck, C. Brinch, M.R. Hogerheijde
  (Leiden Observatory)","Searching for Gas-Rich Disks around T Tauri Stars in Lupus","8 pages, with online section, accepted by A&A",,"10.1051/0004-6361:20065174",,"astro-ph",,"  AIMS : To characterize the molecular environment of classical T Tauri stars
in Lupus observed with the Spitzer Space Telescope and to search for gas-rich
disks toward these sources.
  METHODS : Submillimeter observations of 12CO, 13CO and C18O in the J=3-2 and
2-1 lines were obtained with the James Clerk Maxwell Telescope toward a sample
of 21 T Tauri stars with disks in the Lupus molecular clouds. Pointings at the
sources and at selected off-positions are presented in order to disentangle
material associated with disks from ambient cloud material.
  RESULTS : One source, IM Lup (Sz 82), has been found with double-peaked 12CO
and 13CO profiles characteristic of a large rotating gas disk. The inclination
of the disk is found to be ~20 degrees, with an outer radius of 400-700 AU. For
most other sources, including GQ Lup with its substellar companion, the
single-dish 12CO lines are dominated by extended cloud emission with a complex
velocity structure. No evidence for molecular outflows is found. Compact C18O
emission due to dense circumstellar material has been detected toward only two
sources. Future searches for gas-rich disks in Lupus should either use
interferometers or perform very deep single-dish integrations in dense gas
tracers to separate the cloud and disk emission.
","[{""version"":""v1"",""created"":""Tue, 13 Jun 2006 08:54:12 GMT""}]","2009-11-11"
"astro-ph/0606303","Raffaella Morganti","B.H.C. Emonts (1), R. Morganti (1,2), C.N. Tadhunter (3), J. Holt (3),
  T.A. Oosterloo (1,2), J.M. van der Hulst (1), K.A. Wills (3)((1) Kapteyn
  Astronomical Institute, Groningen, (2) Netherlands Foundation for Research in
  Astronomy, (3) Dep. of Physics and Astronomy, Univ. Sheffield)","Timescales of merger, starburst and AGN activity in radio galaxy B2
  0648+27","13 pages, 11 figures. Accepted for publication in A&A. A version with
  full resolution figures is available at
  http://www.astron.nl/~morganti/Papers/B2_0648.pdf",,"10.1051/0004-6361:20054753",,"astro-ph",,"  In this paper we use neutral hydrogen HI and optical spectroscopic
observations to compare the timescales of a merger event, starburst episode and
radio-AGN activity in the radio galaxy B2 0648+27. We detect a large ring-like
structure of HI in emission around the early-type host galaxy of B2 0648+27
(M_HI = 8.5 x 10^9 Msun, diameter = 190 kpc). We interpret this as the result
of a major merger that occurred > 1.5 Gyr ago. From modelling optical long-slit
spectra we find that a young stellar population of 0.3 Gyr, indicative of a
past starburst event, dominates the stellar light throughout the galaxy. The
off-set in time between the merger event and the starburst activity in B2
0648+27 suggests that the starburst was triggered in an advanced stage of the
merger, which can be explained if the gas-rich progenitor galaxies contained a
bulge. Although the exact age of the radio source remains uncertain, there
appears to be a significant time-delay between the merger/starburst event and
the current episode of radio-AGN activity. We also observe an outflow of
emission-line gas in this system, which is likely related to superwinds driven
by the stars that formed during the starburst event. We argue that the radio
galaxy B2 0648+27 is a link in the evolutionary sequence between Ultra-Luminous
Infrared Galaxies (ULIRGs) and genuine early-type galaxies.
","[{""version"":""v1"",""created"":""Tue, 13 Jun 2006 09:17:31 GMT""}]","2009-11-11"
"astro-ph/0606304","Joanna Holt","J. Holt (1), C. N. Tadhunter (1), R. Morganti (2,3), M. Bellamy (1),
  R.M. Gonzalez Delgado (4), A. Tzioumis (5), K.J. Inskip (1) ((1) Sheffield,
  UK; (2) ASTRON, NL; (3) Kapteyn Institute, University of Groningen, NL; (4)
  Instituto de Astrofisica de Andalucia, Granada, Spain; (5) ATNF-CSIRO,
  Australia)","The co-evolution of the obscured quasar PKS1549-79 and its host galaxy:
  evidence for a high accretion rate and warm outflow","21 pages, 12 figures, accepted for publication in MNRAS",,"10.1111/j.1365-2966.2006.10604.x",,"astro-ph",,"  ABRIDGED: We use deep optical, IR and radio observations to explore the
symbiosis between the nuclear activity and galaxy evolution in the southern
compact radio source PKS1549-79 (z=0.1523). The optical imaging observations
reveal the presence of tidal tail features which provide strong evidence that
the host galaxy has undergone a major merger in the recent past. This is
further supported by the detection of a young stellar population which was
formed 50-250Myr ago and makes up 1-30% of the total stellar mass. Despite the
core-jet structure of the radio source we detect HI absorption associated with
both the core and the jet. The luminous, quasar-like AGN (M_V < -23.5) is
highly extinguished (A_v > 4.9) at optical wavelengths and shows many
properties in common with narrow line Seyfert 1 galaxies (NLS1), including
relatively narrow permitted lines (FWHM ~ 1940 km/s), highly blueshifted [OIII]
lines (~680 km/s), and evidence that the putative supermassive black hole is
accreting at a high Eddington ratio. This suggests that accretion at high
Eddington ratio does not prevent the formation of powerful jets. Our
observations lend strong support to the predictions of some recent numerical
simulations of galaxy mergers in which the black hole grows rapidly through
merger-induced accretion following the coalescence of the nuclei of two merging
galaxies; the major growth phase largely hidden by the natal gas and dust.
Although the models predict that AGN-driven outflows will eventually remove the
gas from the bulge of the host galaxy, the visible warm outflow in PKS1549-79
is not currently capable of doing so. ABRIDGED
","[{""version"":""v1"",""created"":""Tue, 13 Jun 2006 09:24:28 GMT""}]","2009-11-11"
"astro-ph/0606305","Richard Wilman","R. J. Wilman, A. C. Edge, A. M. Swinbank (Durham University)","Integral field spectroscopy of H-alpha emission in cooling flow cluster
  cores: disturbing the molecular gas reservoir","15 pages, 16 figures (7 with essential colour), accepted by MNRAS","Mon.Not.Roy.Astron.Soc.371:93-107,2006","10.1111/j.1365-2966.2006.10658.x",,"astro-ph",,"  We present optical integral field spectroscopy of the H-alpha-luminous (>1E42
erg/s) central cluster galaxies in the cores of the cooling flows A1664, A1835,
A2204 and Zw8193. From the [NII]+H-alpha complex we derive 2-D views of the
distribution and kinematics of the emission line gas, and further diagnostics
from the [SII] and [OI] lines. The H-alpha emission shows a variety of
disturbed morphologies with velocity gradients and splittings of several
hundred km/s on scales of 20 kpc or more. Despite the small sample size, there
are some generic features. The most disturbed H-alpha emission appears to be
associated with secondary galaxies within 10-20 kpc (projected) of the central
galaxy and close in velocity to the H-alpha. The global H-alpha kinematics
match those of CO(1-0) emission in single-dish data. The [NII]/H-alpha,
[SII]/H-alpha and [OI]/H-alpha ratios vary little with position, local H-alpha
surface brightness or between clusters. We propose that the H-alpha and CO
emission arise in molecular clouds heated by a starburst which has been
triggered by interaction with a secondary galaxy. Such CO emission is known to
trace massive (>1E10 M_sun) compact (<20 kpc) reservoirs of cool molecular gas,
which an infalling galaxy may disturb, distorting the H-alpha morphology and
initiating widespread star formation. We suggest that cloud-cloud collisions in
the undisturbed molecular gas reservoir might be an important excitation source
for the emission line gas in the cores of lower H-alpha luminosity cluster
cores with less intense star formation (abridged).
","[{""version"":""v1"",""created"":""Tue, 13 Jun 2006 09:36:16 GMT""}]","2009-11-11"
"astro-ph/0606306","Jerome Martin","Philippe Brax & Jerome Martin","The SUGRA Quintessence Model Coupled to the MSSM","33 pages, 7 figures","JCAP0611:008,2006","10.1088/1475-7516/2006/11/008",,"astro-ph gr-qc hep-ph hep-th",,"  We study the cosmological evolution of the universe when quintessence is
modeled within supergravity, supersymmetry is broken in a hidden sector, and we
also include observable matter in a third independent sector. We find that the
presence of hidden sector supersymmetry breaking leads to modifications of the
quintessence potential. We focus on the coupling of the SUGRA quintessence
model to the MSSM and investigate two possibilities. First one can preserve the
form of the SUGRA potential provided the hidden sector dynamics is tuned. The
currently available limits on the violations of the equivalence principle imply
a universal bound on the vacuum expectation value of the quintessence field
now, \kappa ^{1/2}Q\ll 1. On the other hand, the hidden sector fields may be
stabilised leading to a minimum of the quintessence potential where the
quintessence field acquires a mass of the order of the gravitino mass, large
enough to circumvent possible gravitational problems. However, the cosmological
evolution of the quintessence field is affected by the presence of the minimum
of the potential. The quintessence field settles down at the bottom of the
potential very early in the history of the universe. Both at the background and
the perturbation levels, the subsequent effect of the quintessence field is
undistinguishable from a pure cosmological constant
","[{""version"":""v1"",""created"":""Tue, 13 Jun 2006 09:44:30 GMT""},{""version"":""v2"",""created"":""Fri, 22 Sep 2006 13:56:03 GMT""}]","2009-11-11"
"astro-ph/0606307","Lara Sidoli","L. Sidoli (1), S. Mereghetti (1), F. Favata (2), T. Oosterbroek (2),
  A.N. Parmar (2) ((1)-INAF/IASF Milano, Italy; (2) ESA/ESTEC Noordwijk, The
  Netherlands)","Unveiling the nature of the highly absorbed X-ray source SAXJ1748.2-2808
  with XMM-Newton","accepted for publication in A&A",,"10.1051/0004-6361:20065418",,"astro-ph",,"  We report on the results of an EPIC XMM-Newton observation of the faint
source SAXJ1748.2-2808 and the surrounding field. This source was discovered
during the BeppoSAX Galactic center survey performed in 1997-1998. A spatial
analysis resulted in the detection of 31 sources within the EPIC field of view.
SAXJ1748.2-2808 is clearly resolved into 2 sources in EPIC images with the
brighter contributing almost 80% of the 2-10keV flux. Spectral fits to this
main source are consistent with an absorbed power-law with a photon index of
1.4+/-0.5 and absorption equivalent to 14E22cm-2 together with an iron line at
6.6+/-0.2 keV with an equivalent width of ~780eV. The significantly better
statistics of the XMM-Newton observation, compared with BeppoSAX,allows to
exclude a thermal nature for the X-ray emission. A comparison with other
observations of SAXJ1748.2-2808 does not reveal any evidence for spectral or
intensity long-term variability. Based on these properties we propose that the
source is a low-luminosity high-mass X-ray binary located in the Galactic
center region.
","[{""version"":""v1"",""created"":""Tue, 13 Jun 2006 11:30:30 GMT""}]","2009-11-11"
"astro-ph/0606308","Sergei Popov B.","S.B. Popov (1), D. Blaschke (2,3), H. Grigorian (2,4), M.E. Prokhorov
  (1) (1- Sternberg Astronomical Institute; 2- University of Rostock; 3 - JINR
  Dubna; 4 - Yerevan State University)","Neutron star masses: dwarfs, giants and neighbors","4 pages, 1 figure, Ap&SS style, to be published in the proceedings of
  the conference ""Isolated Neutron Stars: from the Interior to the Surface""","Astrophys.SpaceSci.308:381,2007","10.1007/s10509-007-9335-9",,"astro-ph nucl-th",,"  We discuss three topics related to the neutron star (NS) mass spectrum. At
first we discuss the possibility to form low-mass ($ M \stackrel{<}{\sim} 1
M_{\odot}$) and suggest this is possible only due to fragmentation of rapidly
rotating proto-NSs. Such low-mass NSs should have very high spatial velocities
which could allow identification. A critical assessment of this scenario is
given. Secondly, we discuss mass growth due to accretion for NSs in close
binary systems. With the help of numerical population synthesis calculations we
derive the mass spectrum of massive ($M > 1.8 M_{\odot}$) NSs. Finally, we
discuss the role of the mass spectrum in population studies of young cooling
NSs. We formulate a kind of {\it mass constraint} which can be helpful, in our
opinion, in discussing different competive models of the thermal evolution of
NSs.
","[{""version"":""v1"",""created"":""Tue, 13 Jun 2006 11:52:55 GMT""}]","2008-11-26"
"astro-ph/0606309","Paola Marziani","J. W. Sulentic, P. Repetto, G. M. Stirpe, P. Marziani, D.
  Dultzin-Hacyan, M. Calvani","VLT/ISAAC Spectra of the H-beta Region in Intermediate-Redshift Quasars
  II. Black Hole Mass and Eddington Ratio","Accepted for publication in Astronomy & Astrophysics",,"10.1051/0004-6361:20054153",,"astro-ph",,"  We derive black hole masses for a sample of about 300 AGNs in the redshift
range 0 < z < 2.5. We use the same virial velocity measure (FWHM Hbeta broad
component) for all sources which represents a significant improvement over
previous studies. We review methods and caveats for determining AGN black hole
masses via the virial assumption for motions in the gas producing low
ionization broad emission lines. We derive a corrected FWHM measure for the
broad component of H-beta that better estimates the virialized line emitting
component by comparing our FWHM measures with a sample of reverberated sources
with H-beta radial velocity dispersion measures. We also consider the FWHM of
the FeII 4570 blend as a potential alternative velocity estimator. We find a
range of black hole mass between log M ~ 6 - 10, where the black hole mass M is
in solar masses. Estimates using corrected FWHM, as well as FWHM(Fe II)
measures, reduce the number of sources with log M > 9.5 and suggest that
extremely large M values (log M >~ 10) may not be realistic. Derived Eddington
ratio values values show no evidence for a significant population of
super-Eddington radiators especially after correction is made for sources with
extreme orientation to our line of sight. Sources with FWHM(Hbeta broad
component) <~ 4000 km/s show systematically higher Eddington ratio and lower M
values than broader lined AGNs (including almost all radio-loud sources).
","[{""version"":""v1"",""created"":""Tue, 13 Jun 2006 12:08:23 GMT""}]","2009-11-11"
