"astro-ph/0606534","Mohamed Anber","Mohamed M. Anber, Lorenzo Sorbo","N-flationary magnetic fields","13pages, minor corrections, references added, final version to be
  published in JCAP","JCAP0610:018,2006","10.1088/1475-7516/2006/10/018",,"astro-ph hep-ph hep-th",,"  There is increasing interest in the role played by pseudo Nambu-Goldstone
bosons (pNGBs) in the construction of string-inspired models of inflation. In
these models the inflaton is expected to be coupled to gauge fields, and will
lead to the generation of magnetic fields that can be of cosmological interest.
We study the production of such fields mainly focusing on the model of
N-flation, where the collective effect of several pNGBs drives inflation.
Because the produced fields are maximally helical, inverse cascade processes in
the primordial plasma increase significantly their coherence length. We discuss
under what conditions inflation driven by pNGBs can account for the observed
cosmological magnetic fields. A constraint on the parameters of this class of
inflationary scenarios is also derived by requiring that the magnetic field
does not backreact on the inflating background.
","[{""version"":""v1"",""created"":""Thu, 22 Jun 2006 19:48:53 GMT""},{""version"":""v2"",""created"":""Thu, 5 Oct 2006 16:52:34 GMT""}]","2009-11-11"
"astro-ph/0606545","Kenneth Rines","Kenneth Rines (Yale/YCAA), Antonaldo Diaferio (Torino), and Priyamvada
  Natarajan (Yale/YCAA)","The Virial Mass Function of Nearby SDSS Galaxy Clusters","22 pages, 11 figures, ApJ in press, revised figures","Astrophys.J.657:183-196,2007","10.1086/510829",,"astro-ph",,"  We present a new determination of the cluster mass function and velocity
dispersion function in a volume $\sim10^7 h^3$Mpc$^{-3}$ using the Fourth Data
Release of the Sloan Digital Sky Survey (SDSS). We use the caustic technique to
remove foreground and background galaxies. The cluster virial mass function
agrees well with recent estimates from both X-ray observations and cluster
richnesses. The mass function lies between those predicted by the First-Year
and Three-Year WMAP data. We constrain the cosmological parameters $\Omega_m$
and $\sigma_8$ and find good agreement with WMAP and constraints from other
techniques. With the CIRS mass function alone, we estimate
$\Omega_m=0.24^{+0.14}_{-0.09}$ and $\sigma_8=0.92^{+0.24}_{-0.19}$, or
$\sigma_8=0.84\pm$0.03 when holding $\Omega_m=0.3$ fixed. We also use the WMAP
parameters as priors and constrain velocity segregation in clusters. Using the
First and Third-Year results, we infer velocity segregation of
$\sigma_{gxy}/\sigma_{DM}\approx0.94\pm$0.05 or 1.28$\pm$0.06 respectively. We
compare the velocity dispersion function of clusters to that of early-type
galaxies and conclude that clusters comprise the high-velocity end of the
velocity dispersion function of dark matter haloes. The evolution of cluster
abundances provides constraints on dark energy models; the mass function
presented here offers an important low redshift calibration benchmark.
","[{""version"":""v1"",""created"":""Thu, 22 Jun 2006 17:46:10 GMT""},{""version"":""v2"",""created"":""Mon, 30 Oct 2006 15:23:45 GMT""}]","2008-11-26"
"astro-ph/0606562","Cristina Popescu","C. M\""ollenhoff (Landessternwarte, Heidelebrg), C. C. Popescu (MPIK,
  Heidelberg), R. J. Tuffs (MPIK, Heidelberg)","Modelling the spectral energy distribution of galaxies. IV Correcting
  apparent disk scalelengths and central surface brightnesses for the effect of
  dust at optical and near-infrared wavelengths","16 pages, 13 figures and 5 tables; accepted for publication in
  Astronomy & Astrophysics",,"10.1051/0004-6361:20054727",,"astro-ph",,"  We present corrections for the change in the apparent scalelengths, central
surface brightnesses and axis ratios due to the presence of dust in pure disk
galaxies, as a function of inclination, central face-on opacity in the B-band
(tau^f_B) and wavelength. The correction factors were derived from simulated
images of disk galaxies created using geometries for stars and dust which can
reproduce the entire spectral energy distribution from the ultraviolet (UV) to
the Far-infrared (FIR)/submillimeter (submm) and can also account for the
observed surface-brightness distributions in both the optical/Near-infrared and
FIR/submm. We found that dust can significantly affect both the scalelength and
central surface brightness, inducing variations in the apparent to intrinsic
quantities of up to 50 percent in scalelength and up to 1.5 magnitudes in
central surface brightness. We also identified some astrophysical effects for
which, although the absolute effect of dust is non-negligible, the predicted
variation over a likely range in opacity is relatively small, such that an
exact knowledge of opacity is not needed. Thus, for a galaxy at a typical
inclination of 37 degrees and having any tau^f_B>2, the effect of dust is to
increase the scalelength in B relative to that in I by a factor of 1.12 +- 0.02
and to change the B-I central colour by 0.36 +- 0.05 magnitudes. Finally we use
the model to analyse the observed scalelength ratios between B and I for a
sample of disk-dominated spiral galaxies, finding that the tendency for
apparent scalelength to increase with decreasing wavelength is primarily due to
the effects of dust.
","[{""version"":""v1"",""created"":""Thu, 22 Jun 2006 17:09:39 GMT""}]","2009-11-11"
"astro-ph/0606563","Michael Werner","M.Werner, G.Fazio, G.Rieke, T.Roellig, D.Watson","First Fruits of the Spitzer Space Telescope: Galactic and Solar System
  Studies","Review article to appear in slightly different format in Vol.44 of
  Annual Reviews of Astronomy and Astrophysics, 2006","Ann.Rev.Astron.Astrophys.44:269-321,2006","10.1146/annurev.astro.44.051905.092544",,"astro-ph",,"  This article provides a brief overview of the Spitzer Space Telescope and
discusses its initial scientific results on galactic and solar system science.
","[{""version"":""v1"",""created"":""Thu, 22 Jun 2006 18:24:49 GMT""},{""version"":""v2"",""created"":""Thu, 22 Jun 2006 21:15:34 GMT""}]","2011-02-11"
"astro-ph/0606564","Sergey Ostapchenko","T. Bergmann, R. Engel, D. Heck, N. N. Kalmykov, S. Ostapchenko, T.
  Pierog, T. Thouw, K. Werner","One-dimensional Hybrid Approach to Extensive Air Shower Simulation",,"Astropart.Phys.26:420-432,2007","10.1016/j.astropartphys.2006.08.005",,"astro-ph",,"  An efficient scheme for one-dimensional extensive air shower simulation and
its implementation in the program CONEX are presented. Explicit Monte Carlo
simulation of the high-energy part of hadronic and electromagnetic cascades in
the atmosphere is combined with a numeric solution of cascade equations for
smaller energy sub-showers to obtain accurate shower predictions. The developed
scheme allows us to calculate not only observables related to the number of
particles (shower size) but also ionization energy deposit profiles which are
needed for the interpretation of data of experiments employing the fluorescence
light technique. We discuss in detail the basic algorithms developed and
illustrate the power of the method. It is shown that Monte Carlo, numerical,
and hybrid air shower calculations give consistent results which agree very
well with those obtained within the CORSIKA program.
","[{""version"":""v1"",""created"":""Thu, 22 Jun 2006 18:29:32 GMT""}]","2009-07-22"
"astro-ph/0606565","Enwei Liang","Enwei Liang, Bing Zhang, Bin-Bin Zhang, and Z. G. Dai","Thermal Emission from a Hot Cocoon Surrounding the Jet of XRF 060218","11 pages, 4 figures",,,,"astro-ph",,"  It is long speculated that long duration gamma-ray bursts (GRBs) originate
froma relativistic jet emerging from a collapsing massive star progenitor.
Although associations of core-collapsing supernovae with long GRB afterglows
have been identified in a number of systems, including the latest X-ray flash
(XRF) 060218/SN 2006aj connection detected by Swift, direct evidence of a
relativistic jet emerging from a collapsing star is still lacking. Here we
report the detection of a thermal emission component (high-T component)
accompanying the prompt X-ray emission of XRF 060218, with temperature
kT_H=1.21+0.22/-0.24 keV and effective blackbody radius R_H~ 5\times 10^{9} cm.
This high-T component co-exists with another low-T thermal component as
reported by Campana et al. 2006 for at least 2700 seconds, but evolves
independently with respect to the low-T component by tracing the lightcurve of
the non-thermal component. We identify this high-T thermal component as the
emission of a hot cocoon surrounding the relativistic jet, as expected from the
theoretical models.
","[{""version"":""v1"",""created"":""Thu, 22 Jun 2006 18:59:23 GMT""}]","2007-05-23"
"astro-ph/0606566","Michael Kesden","Michael Kesden, Marc Kamionkowski","Galilean Equivalence for Galactic Dark Matter","4 pages, 3 figures, final version published in PRL","Phys.Rev.Lett. 97 (2006) 131303","10.1103/PhysRevLett.97.131303",,"astro-ph",,"  Satellite galaxies are tidally disrupted as they orbit the Milky Way. If dark
matter (DM) experiences a stronger self-attraction than baryons, stars will
preferentially gain rather than lose energy during tidal disruption leading to
an enhancement in the trailing compared to the leading tidal stream. The Sgr
dwarf galaxy is seen to have roughly equal streams, challenging models in which
DM and baryons accelerate differently by more than 10%. Future observations and
a better understanding of DM distribution should allow detection of equivalence
violation at the percent level.
","[{""version"":""v1"",""created"":""Thu, 22 Jun 2006 19:44:58 GMT""},{""version"":""v2"",""created"":""Mon, 2 Oct 2006 13:55:06 GMT""}]","2009-11-11"
"astro-ph/0606567","David Alexander Kann","D. A. Kann, N. Masetti, S. Klose","The prompt optical/near-infrared flare of GRB 050904: the most luminous
  transient ever detected","The Astronomical Journal, in press; revised version, including the
  comments of the referee (one figure added, text restructured, all conclusions
  unchanged), 7 pages, 3 figures","Astron.J.133:1187-1192,2007","10.1086/511066",,"astro-ph",,"  With a redshift of z=6.295, GRB 050904 is the most distant gamma-ray burst
ever discovered. It was an energetic event at all wavelengths and the afterglow
was observed in detail in the near-infrared bands. We gathered all available
optical and NIR afterglow photometry of this GRB to construct a composite NIR
light curve spanning several decades in time and flux density. Transforming the
NIR light curve into the optical, we find that the afterglow of GRB 050904 was
more luminous at early times than any other GRB afterglow in the
pre-\emph{Swift} era, making it at these wavelengths the most luminous
transient ever detected. Given the intrinsic properties of GRB 050904 and its
afterglow, we discuss if this burst is markedly different from other GRBs at
lower redshifts.
","[{""version"":""v1"",""created"":""Thu, 22 Jun 2006 19:54:12 GMT""},{""version"":""v2"",""created"":""Mon, 20 Nov 2006 12:18:43 GMT""}]","2008-11-26"
"astro-ph/0606569","Motoyuki Saijo","Motoyuki Saijo, Eric Gourgoulhon","Viscosity driven instability in rotating relativistic stars","v1: 14 pages with 10 figures, revtex4.cls. Submitted to Physical
  Review D; v2: Minor correction to the central enthalpy and typos, 13 pages
  with 10 figures, revtex4.cls. Physical Review D (2006) in press; v3:
  Published version, 13 pages with 10 figures, revtex4.cls. Physical Review D
  (2006) 084006","Phys.Rev. D74 (2006) 084006","10.1103/PhysRevD.74.084006",,"astro-ph gr-qc",,"  We investigate the viscosity driven instability in rotating relativistic
stars by means of an iterative approach. We focus on polytropic rotating
equilibrium stars and impose an m=2 perturbationin the lapse. We vary both the
stiffness of the equation of state and the compactness of the star to study
those effects on the value of the threshold. For a uniformly rotating star, the
criterion T/W, where T is the rotational kinetic energy and W is the
gravitational binding energy, mainly depends on the compactness of the star and
takes values around 0.13 ~ 0.16, which differ slightly from that of Newtonian
incompressible stars (~ 0.14). For differentially rotating stars, the critical
value of T/W is found to span the range 0.17 - 0.25. This is significantly
larger than the uniformly rotating case with the same compactness of the star.
Finally we discuss a possibility of detecting gravitational waves from
viscosity driven instability with ground-based interferometers.
","[{""version"":""v1"",""created"":""Thu, 22 Jun 2006 20:00:03 GMT""},{""version"":""v2"",""created"":""Sun, 24 Sep 2006 15:02:29 GMT""},{""version"":""v3"",""created"":""Mon, 16 Oct 2006 22:42:13 GMT""}]","2007-05-23"
"astro-ph/0606570","Joshua Simon","Joshua D. Simon (Caltech), Francisco Prada, Jose M. Vilchez (Instituto
  de Astrofisica de Andalucia [CSIC]), Leo Blitz (Berkeley), Brant Robertson
  (Harvard/CfA)","Is There a Fundamental Line for Disk Galaxies?","14 pages, 14 figures (5 in color). Accepted for publication in ApJ","Astrophys.J.649:709-721,2006","10.1086/507117",,"astro-ph",,"  We show that there are strong local correlations between metallicity, surface
brightness, and dynamical mass-to-light ratio within M33, analogous to the
fundamental line of dwarf galaxies identified by Prada & Burkert (2002). Using
near-infrared imaging from 2MASS, the published rotation curve of M33, and
literature measurements of the metallicities of HII regions and supergiant
stars, we demonstrate that these correlations hold for points at radial
distances between 140 pc and 6.2 kpc from the center of the galaxy. At a given
metallicity or surface brightness, M33 has a mass-to-light ratio approximately
four times as large as the Local Group dwarf galaxies; other than this constant
offset, we see broad agreement between the M33 and dwarf galaxy data. We use
analytical arguments to show that at least two of the three fundamental line
correlations are basic properties of disk galaxies that can be derived from
very general assumptions. We investigate the effect of supernova feedback on
the fundamental line with numerical models and conclude that while feedback
clearly controls the scatter in the fundamental line, it is not needed to
create the fundamental line itself, in agreement with our analytical
calculations. We also compare the M33 data with measurements of a simulated
disk galaxy, finding that the simulation reproduces the trends in the data
correctly and matches the fundamental line, although the metallicity of the
simulated galaxy is too high, and the surface brightness is lower than that of
M33.
","[{""version"":""v1"",""created"":""Thu, 22 Jun 2006 20:00:10 GMT""}]","2008-11-26"
"astro-ph/0606571","Marco Hetterscheidt","M. Hetterscheidt, P. Simon, M. Schirmer, H. Hildebrandt, T.
  Schrabback, T. Erben, and P. Schneider","GaBoDS: The Garching-Bonn Deep Survey: VI. Cosmic shear analysis","23 pages, 19 figures, submitted to A&A",,"10.1051/0004-6361:20065885",,"astro-ph",,"  Aims. We present a cosmic shear analysis and data validation of 15 square
degree high-quality R-band data of the Garching-Bonn Deep Survey obtained with
the Wide Field Imager of the MPG/ESO 2.2m telescope. Methods. We measure the
two-point shear correlation functions to calculate the aperture mass
dispersion. Both statistics are used to perform the data quality control.
Combining the cosmic shear signal with a photometric redshift distribution of a
galaxy sub-sample obtained from two square degree of UBVRI-band observations of
the Deep Public Survey we determine constraints for the matter density Omega_m,
the mass power spectrum normalisation sigma_8 and the dark energy density
Omega_Lambda in the magnitude interval R in [21.5,24.5]. In this magnitude
interval the effective number density of source galaxies is n=12.5/sq. arcmin,
and their mean redshift is z_m=0.78. To estimate the posterior likelihood we
employ the Monte Carlo Markov Chain method. Results. Using the aperture mass
dispersion we obtain for the mass power spectrum normalisation sigma_8=0.80 +-
0.10 (1 sigma statistical error) at a fixed matter density Omega_m=0.30
assuming a flat universe with negligible baryon content and marginalising over
the Hubble parameter and the uncertainties in the fitted redshift distribution.
","[{""version"":""v1"",""created"":""Fri, 23 Jun 2006 13:23:02 GMT""}]","2009-11-11"
"astro-ph/0606572","Avi Loeb","Abraham Loeb (Harvard Univ.)","Thermal Evaporation of Gas from X-ray Clusters","5 pages, 1 figure","JCAP 0703:001,2007","10.1088/1475-7516/2007/03/001",,"astro-ph hep-ph",,"  A fraction of the thermal protons in the outer envelope of an X-ray cluster
have velocities that exceed the local escape speed from the cluster
gravitational potential. The Coulomb mean-free-path of these protons is larger
than the virial radius of the cluster at temperatures >2.5 keV. The resulting
leakage of suprathermal particles generates a collisionless shock in
neighboring voids and fills them with heat and magnetic fields. The momentum
flux of suprathermal particles cannot be confined by magnetic tension at the
typical field strength in the periphery of cluster halos (<<1 micro-gauss).
Over a Hubble time, thermal evaporation could drain up to a tenth of the
cluster gas at its virial temperature. The evaporated fraction could increase
dramatically if additional heat is deposited into the gas by cluster mergers,
active galactic nuclei or supernovae. Thermal evaporation is not included in
existing cosmological simulations since they are based on the fluid
approximation. Measurements of the baryon mass fraction in the outer envelopes
of hot clusters (through their Sunyaev-Zel'dovich effect or X-ray emission) can
be used to empirically constrain their evaporation rate.
","[{""version"":""v1"",""created"":""Thu, 22 Jun 2006 20:06:06 GMT""},{""version"":""v2"",""created"":""Mon, 18 Sep 2006 01:13:14 GMT""}]","2010-10-27"
"astro-ph/0606573","Jason X. Prochaska","Jason X. Prochaska (1), John M. O'Meara (2), Stephane Herbert-Fort
  (3), Scott Burles (2), Gabriel E. Prochter (1), and Rebecca A. Bernstein (4)
  ((1) UCO/Lick Observatory; UCSC; (2) MIT, (3) U Arizona, (4) U Michigan)","Super-Solar Super Lyman Limit Systems","6 pages, 2 figures. Submitted to ApJL; Revised June 22, 2006","Astrophys.J.648:L97-L100,2006","10.1086/507867",,"astro-ph",,"  We present abundance measurements for two super Lyman Limit systems (SLLS;
quasar absorption line systems with 10^19 cm^-2 < N_HI < 10^20.3 cm^-2)
selected from a set of metal-strong absorbers in the Sloan Digital Sky Survey
quasar database. After applying estimate corrections for photoionization
effects, we derive gas-phase metallicities of [M/H]=+0.7 +/- 0.2 dex for the
SLLS at z=1.7749 toward SDSS0927+5621 and [M/H]=+0.05 +/- 0.1 dex for the SLLS
at z=1.7678 toward SDSS0953+5230. The former exhibits among the highest gas
metallicity of any astrophysical environment and its total metal surface
density exceeds that of nearly every known damped Lya system. The properties of
these absorbers -- high metallicity and large velocity width (> 300 km/s) --
resemble those of gas observed in absorption in the spectra of bright,
star-forming galaxies at high redshift. We discuss the metal mass density of
the SLLS based on these observations and our ongoing SLLS survey and argue that
a conservative estimate to the total metal budget at z=2 is greater than 15% of
the total, suggesting that the metal-rich LLS may represent the dominant metal
reservoir in the young universe.
","[{""version"":""v1"",""created"":""Thu, 22 Jun 2006 20:58:24 GMT""}]","2011-02-11"
"astro-ph/0606574","Mariusz Dabrowski P.","Mariusz P. Dabrowski","Future state of the Universe","12 pages, 1 figure, a contribution to Pomeranian Workshop in
  Fundamental Cosmology (COSMOFUN'05), Pobierowo, Poland, 1-6 September 2005","Annalen Phys. 15 (2006) 352-363","10.1002/andp.200510193",,"astro-ph gr-qc hep-th",,"  Following the observational evidence for cosmic acceleration which may
exclude a possibility for the universe to recollapse to a second singularity,
we review alternative scenarios of its future evolution. Although the de Sitter
asymptotic state is still an option, some other asymptotic states which allow
new types of singularities such as Big-Rip (due to a phantom matter) and sudden
future singularities are also admissible and are reviewed in detail. The
reality of these singularities which comes from the relation to observational
characteristics of the universe expansion are also revealed and widely
discussed.
","[{""version"":""v1"",""created"":""Thu, 22 Jun 2006 21:37:09 GMT""}]","2009-11-11"
"astro-ph/0606575","Chad Kishimoto","Chad T. Kishimoto and George M. Fuller","Neutrino-Accelerated Hot Hydrogen Burning","14 pages, 6 figures, submitted to ApJ; minor content change","Astrophys.J.656:1104-1108,2007","10.1086/510506",,"astro-ph",,"  We examine the effects of significant electron anti-neutrino fluxes on
hydrogen burning. Specifically, we find that the bottleneck weak nuclear
reactions in the traditional pp-chain and the hot CNO cycle can be accelerated
by anti-neutrino capture, increasing the energy generation rate. We also
discuss how anti-neutrino capture reactions can alter the conditions for break
out into the rp-process. We speculate on the impact of these considerations for
the evolution and dynamics of collapsing very- and super- massive compact
objects.
","[{""version"":""v1"",""created"":""Fri, 23 Jun 2006 00:26:22 GMT""},{""version"":""v2"",""created"":""Sun, 25 Jun 2006 18:16:44 GMT""}]","2008-11-26"
"astro-ph/0606576","Mikako Matsuura","M. Matsuura, O. Chesneau, A.A. Zijlstra, W. Jaffe, L.B.F.M. Waters, J.
  Yates, E. Lagadec, T. Gledhill, S. Etoka, and A.M.S. Richards","The compact circumstellar material around OH 231.8+4.2","Accepted by ApJL High-resolution jpg image is available from
  http://optik2.mtk.nao.ac.jp/~mikako/photo/oh231_fig1.jpg","Astrophys.J.646:L123-L124,2006","10.1086/507073",,"astro-ph",,"  We have observed the bipolar post-AGB candidate OH 231.8+4.2, using the
mid-infrared interferometer MIDI and the infrared camera with the adaptive
optics system NACO on the Very Large Telescope. An unresolved core (<200 mas in
FWHM) is found at the center of the OH 231.8+4.2 in the 3.8 micron image. This
compact source is resolved with the interferometer. We used two 8-meter
telescopes with four different baselines, which cover projected baseline
lengths from 62 to 47 meters, and projected position angles from 112 to 131
degrees that are almost perpendicular to the bipolar outflow. Fringes from 8 to
9 micron and from 12 to 13.5 micron were clearly detected, whilst the strong
silicate self-absorption allows only marginal detection of visibilities between
9 and 12 micron. The fringes from the four baselines consistently show the
presence of a compact circumstellar object with an inner radius of 30-40 mas,
which is equivalent to 40-50 AU at 1.3 kpc. This clearly shows that the
mid-infrared compact source is not the central star (3 AU) but circumstellar
material. The measured size of the circumstellar material is consistent with
the size of such disks calculated by hydrodynamic models, implying the
circumstellar material may have a disk configuration.
","[{""version"":""v1"",""created"":""Fri, 23 Jun 2006 02:48:55 GMT""}]","2009-11-11"
"astro-ph/0606577","Francesca D'Antona","F. D'Antona, P. Ventura, L. Burderi & A. Teodorescu","Modelling the closest double degenerate system RXJ0806.3+1527 and its
  decreasing period","13 pages, 4 figures, accepted for publication on ApJ, main journal","Astrophys.J.653:1429-1434,2006","10.1086/507408",,"astro-ph",,"  In the hypothesis that the 5.4m binary RXJ0806.3+1527 consists of a low mass
helium white dwarf (donor) transferring mass towards its more massive white
dwarf companion (primary), we consider as possible donors white dwarfs which
are the result of common envelope evolution occurring when the helium core mass
of the progenitor giant was still very small (~ 0.2Msun), so that they are
surrounded by a quite massive hydrogen envelope (~1/100Msun or larger), and
live for a very long time supported by proton--proton burning. Mass transfer
from such low mass white dwarfs very probably starts during the hydrogen
burning stage, and the donor structure will remain dominated by the burning
shell until it loses all the hydrogen envelope and begins transferring helium.
We model mass transfer from these low mass white dwarfs, and show that the
radius of the donor decreases while they shed the hydrogen envelope. This
radius behavior, which is due to the fact that the white dwarf is not fully
degenerate, has two important consequences on the evolution of the binary: 1)
the orbital period decreases, with a timescale consistent with the period
decrease of the binary RXJ0806.3+1527; 2) the mass transfer rate is a factor of
about 10 smaller than from a fully degenerate white dwarf, easing the problem
connected with the small X-ray luminosity of this object. The possibility that
such evolution describes the system RXJ0806.3+1527 is also consistent with the
possible presence of hydrogen in the optical spectrum of the star, whose
confirmation would become a test of the model.
","[{""version"":""v1"",""created"":""Fri, 23 Jun 2006 06:18:04 GMT""}]","2008-11-26"
