"math/0606583","Mohamed Boucetta","M. Boucetta","Killing-Poisson tensors on Riemannian manifolds","21 pages, modified version, submitted",,,,"math.SG",,"  We introduce a new class of Poisson structures on a Riemannian manifold. A
Poisson structure in this class will be called a Killing-Poisson structure. The
class of Killing-Poisson structures contains the class of symplectic
structures, the class of Poisson structures studied in{\it (Differential
Geometry and its Applications, {\bf Vol. 20, Issue 3} (2004), 279--291)} and
the class of Poisson structures induced by some infinitesimal Lie algebras
actions on Riemannian manifolds. We show that some classical results on
symplectic manifolds (the integrability of the Lie algebroid structure
associated to a symplectic structure, the non exactness of a symplectic
structure on a compact manifold) remain valid for regular Killing-Poisson
structures.
","[{""version"":""v1"",""created"":""Fri, 23 Jun 2006 09:07:15 GMT""},{""version"":""v2"",""created"":""Sat, 5 Aug 2006 18:20:09 GMT""}]","2007-05-23"
"math/0606584","Markus Heydenreich","Markus Heydenreich, Remco van der Hofstad, Georgi Radulov","Functionals of Brownian bridges arising in the current mismatch in
  D/A-converters","22 pages, 4 figures. Version 2 with Section 3.6 added, and Section 4
  revised. To appear in ""Probability in the Engineering and Informational
  Sciences""",,,"Eurandom Report 2006-016","math.PR","http://arxiv.org/licenses/nonexclusive-distrib/1.0/","  Digital-to-analog converters (DAC) transform signals from the abstract
digital domain to the real analog world. In many applications, DAC's play a
crucial role.
  Due to variability in the production, various errors arise that influence the
performance of the DAC. We focus on the current errors, which describe the
fluctuations in the currents of the various unit current elements in the DAC. A
key performance measure of the DAC is the Integrated Non-linearity (INL), which
we study in this paper.
  There are several DAC architectures. The most widely used architectures are
the thermometer, the binary and the segmented architectures. We study the two
extreme architectures, namely, the thermometer and the binary architectures. We
assume that the current errors are i.i.d. normally distributed, and reformulate
the INL as a functional of a Brownian bridge. We then proceed by investigating
these functionals. For the thermometer case, the functional is the maximal
absolute value of the Brownian bridge, which has been investigated in the
literature. For the binary case, we investigate properties of the functional,
such as its mean, variance and density.
","[{""version"":""v1"",""created"":""Fri, 23 Jun 2006 09:08:17 GMT""},{""version"":""v2"",""created"":""Sun, 10 Aug 2008 12:00:13 GMT""}]","2008-08-10"
"math/0606585","Dragan Marusic","Klavdija Kutnar and Dragan Marusic","Hamiltonicity of Vertex-Transitive Graphs of Order $4p$","17 pages, 9 figures",,,,"math.CO math.GR",,"  It is shown that every connected vertex-transitive graph of order $4p$, where
$p$ is a prime, is hamiltonian with the exception of the Coxeter graph which is
known to possess a Hamilton path.
","[{""version"":""v1"",""created"":""Fri, 23 Jun 2006 09:17:19 GMT""}]","2007-05-23"
"math/0606586","Edwin James Beggs","E.J. Beggs & Tomasz Brzezinski","An explicit formula for a strong connection","LATeX, 8 pages",,,,"math.QA",,"  An explicit formula for a strong connection form in a principal extension by
a coseparable coalgebra is given.
","[{""version"":""v1"",""created"":""Fri, 23 Jun 2006 09:40:31 GMT""}]","2007-05-23"
"math/0606587","Piero D'Ancona","Piero D'Ancona, Damiano Foschi, Sigmund Selberg","Local well-posedness below the charge norm for the Dirac-Klein-Gordon
  system in two space dimensions","26 pages, 4 figures",,,,"math.AP math-ph math.MP",,"  We prove that the Cauchy problem for the Dirac-Klein-Gordon equations in two
space dimensions is locally well-posed in a range of Sobolev spaces of negative
index for the Dirac spinor, and an associated range of spaces of positive index
for the meson field. In particular, we can go below the charge norm, that is,
the $L^2$ norm of the spinor. We hope that this can have implications for the
global existence problem, since the charge is conserved. Our result relies on
the null structure of the system, and bilinear space-time estimates for the
homogeneous wave equation.
","[{""version"":""v1"",""created"":""Fri, 23 Jun 2006 10:07:39 GMT""}]","2007-05-23"
"math/0606588","Mario Annunziato","Mario Annunziato","A finite difference method for piecewise deterministic Markov processes","12 pages, 2 figures, submitted to Elsevier",,,,"math.NA",,"  An extension of non-deterministic processes driven by the random telegraph
signal is introduced in the framework of ""piecewise deterministic Markov
processes"" [Davis], including a broader category of random systems. The
corresponding Liouville-Master Equation is established and the upwind method is
applied to numerical calculation of the distribution function. The convergence
of the numerical solution is proved under an appropriate
Courant-Friedrichs-Lewy condition. The same condition preserve the
non-decreasing property of the calculated distribution function. Some numerical
tests are presented.
","[{""version"":""v1"",""created"":""Fri, 23 Jun 2006 10:08:17 GMT""},{""version"":""v2"",""created"":""Tue, 11 Jul 2006 08:22:15 GMT""},{""version"":""v3"",""created"":""Fri, 14 Jul 2006 16:03:13 GMT""},{""version"":""v4"",""created"":""Mon, 17 Jul 2006 15:34:48 GMT""}]","2007-05-23"
"math/0606589","Juan Jos\'e Moreno-Balc\'azar","M. Alfaro, J.J. Moreno-Balcazar, A. Pena, M.L. Rezola","Sobolev orthogonal polynomials: balance and asymptotics","20 pages. Changed content",,,,"math.CA",,"  Let $\mu_0$ and $\mu_1$ be measures supported on an unbounded interval and
$S_{n,\lambda_n}$ the extremal varying Sobolev polynomial which minimizes
\begin{equation*} < P, P >_{\lambda_n}=\int P^2 d\mu_0 + \lambda_n \int P'^2
d\mu_1, \quad \lambda_n >0 \end{equation*} \noindent in the class of all monic
polynomials of degree $n$. The goal of this paper is twofold. On one hand, we
discuss how to balance both terms of this inner product, that is, how to choose
a sequence $(\lambda_n)$ such that both measures $\mu_0$ and $\mu_1$ play a
role in the asymptotics of $(S_{n, \lambda_n}).$ On the other, we apply such
ideas to the case when both $\mu_0$ and $\mu_1$ are Freud weights. Asymptotics
for the corresponding $S_{n, \lambda_n}$ are computed, illustrating the
accuracy of the choice of $\lambda_n .$
","[{""version"":""v1"",""created"":""Fri, 23 Jun 2006 10:24:10 GMT""},{""version"":""v2"",""created"":""Wed, 2 May 2007 14:50:56 GMT""}]","2007-05-23"
"math/0606590","Frank Hansen","Frank Hansen, Josip Pecaric and Ivan Peric","Jensen's operator inequality and its converses","Minor revision. To appear in Math. Scan","Math. Scand. 100, 61-73 (2007)",,,"math.OA",,"  We give a general formulation of Jensen's operator inequality for unital
fields of positive linear mappings, and we consider different types of converse
inequalities.
","[{""version"":""v1"",""created"":""Fri, 23 Jun 2006 11:19:03 GMT""},{""version"":""v2"",""created"":""Wed, 19 Jul 2006 07:34:39 GMT""},{""version"":""v3"",""created"":""Tue, 19 Dec 2006 14:02:25 GMT""}]","2008-08-11"
"math/0606591","P. J. C. Spreij","Lorenzo Finesso, Angela Grassi, Peter Spreij","Approximation of stationary processes by Hidden Markov Models","The 2nd version mainly has additional references and a new condition
  of Theorem 4.2","Mathematics of Control, Signals and Systems 22(1), 1-22 (2010)","10.1007/s00498-010-0050-7",,"math.OC math.PR",,"  We aim at the construction of a Hidden Markov Model (HMM) of assigned
complexity (number of states of the underlying Markov chain) which best
approximates, in Kullback-Leibler divergence rate, a given stationary process.
We establish, under mild conditions, the existence of the divergence rate
between a stationary process and an HMM. Since in general there is no analytic
expression available for this divergence rate, we approximate it with a
properly defined, and easily computable, divergence between Hankel matrices,
which we use as our approximation criterion. We propose a three-step algorithm,
based on the Nonnegative Matrix Factorization technique, which realizes an HMM
optimal with respect to the defined approximation criterion. A full theoretical
analysis of the algorithm is given in the special case of Markov approximation.
","[{""version"":""v1"",""created"":""Fri, 23 Jun 2006 11:20:43 GMT""},{""version"":""v2"",""created"":""Wed, 6 Feb 2008 16:16:04 GMT""}]","2014-07-03"
"math/0606592","John D. McCarthy","John D. McCarthy and Athanase Papadopoulos","Automorphisms of the complex of domains","58 pages, 6 figures",,,,"math.GT math.GR",,"  In this paper, we study a flag complex which is naturally associated to the
Thurston theory of surface diffeomorphisms for compact connected orientable
surfaces with boundary. The various pieces of the Thurston decomposition of a
surface diffeomorphism, thick domains and annular or thin domains, fit into
this flag complex, which we call the complex of domains. The main result of
this paper is a computation of the group of automorphisms of this complex.
Unlike the complex of curves, introduced by Harvey, for which, for all but a
finite number of exceptional surfaces, by the works of Ivanov, Korkmaz, and
Luo, all automorphisms are geometric (i.e. induced by homeomorphisms), the
complex of domains has nongeometric automorphisms, provided the surface in
question has at least two boundary components. These nongeometric automorphisms
of the complex of domains are associated to certain edges of the complex which
are naturally associated to biperipheral pairs of pants on the surface in
question. We project the complex of domains to a natural subcomplex of the
complex of domains by collapsing each biperipheral edge onto the unique vertex
of that edge which is represented by a regular neighborhood of a biperipheral
curve and, thereby, reduce the computation in question to computing the group
of automorphisms of this subcomplex, which we call the truncated complex of
domains. Finally, we prove that the group of automorphisms of the truncated
complex of domains is the extended mapping class group of the surface in
question and, obtain, thereby, a complete description of the group of
automorphisms of the complex of domains.
","[{""version"":""v1"",""created"":""Fri, 23 Jun 2006 12:59:27 GMT""}]","2007-05-23"
"math/0606593","Hubert Flenner","R.-O. Buchweitz, H. Flenner","Global Hochschild (co-)homology of singular spaces","34 pages",,,,"math.AG math.AC",,"  We introduce Hochschild (co-)homology of morphisms of schemes or analytic
spaces and study its fundamental properties. In analogy with the cotangent
complex we introduce the so called (derived) Hochschild complex of a morphism;
the Hochschild cohomology and homology groups are then the Ext and Tor groups
of that complex. We prove that these objects are well defined, extend the known
cases, and have the expected functorial and homological properties such as
graded commutativity of Hochschild cohomology and existence of the
characteristic homomorphism from Hochschild cohomology to the (graded) centre
of the derived category.
","[{""version"":""v1"",""created"":""Fri, 23 Jun 2006 13:26:17 GMT""}]","2007-05-23"
"math/0606594","Nik Weaver","N. Christopher Phillips and Nik Weaver","The Calkin algebra has outer automorphisms","13 pages",,,,"math.OA math.FA math.LO",,"  Assuming the continuum hypothesis, we show that the Calkin algebra has
2^{aleph_1} outer automorphisms.
","[{""version"":""v1"",""created"":""Fri, 23 Jun 2006 14:37:55 GMT""}]","2007-05-23"
"math/0606595","Nikolai Dokuchaev","Nikolai Dokuchaev","Backward parabolic Ito equations and second fundamental inequality",,,,,"math.PR math.AP","http://arxiv.org/licenses/nonexclusive-distrib/1.0/","  Regularity of solutions is studied for backward stochastic parabolic Ito
equations. An analog of the second energy inequality and the related existence
theorem are obtained for domains with boundary.
","[{""version"":""v1"",""created"":""Fri, 23 Jun 2006 14:49:15 GMT""},{""version"":""v2"",""created"":""Mon, 1 Mar 2010 04:46:57 GMT""},{""version"":""v3"",""created"":""Mon, 26 Jul 2010 07:47:56 GMT""}]","2010-07-27"
"math/0606596","Javier Parcet","Marius Junge, Javier Parcet","Operator space embedding of Lq into Lp","59 pages",,,,"math.OA math.PR",,"  Let 1 \le p < q \le 2 and let M be any von Neumann algebra. We use recent
techniques from free harmonic analysis to construct a completely isomorphic
embedding of Lq(M) (equipped with its natural operator space structure) into
Lp(A) for some sufficiently large von Neumann algebra A. We show that
hyperfiniteness and the QWEP are preserved in our construction.
","[{""version"":""v1"",""created"":""Fri, 23 Jun 2006 14:51:13 GMT""}]","2007-05-23"
"math/0606597","Zenghu Li","Zenghu Li","A limit theorem of discrete Galton-Watson branching processes with
  immigration","7 pages","Journal of Applied Probability 43 (2006), 1: 289-295",,,"math.PR",,"  We provide a simple set of sufficient conditions for the weak convergence of
discrete Galton-Watson branching processes with immigration to continuous time
and continuous state branching processes with immigration.
","[{""version"":""v1"",""created"":""Fri, 23 Jun 2006 14:59:21 GMT""}]","2007-05-23"
"math/0606599","Paolo Baldi","P. Baldi, G. Kerkyacharian, D. Marinucci, D. Picard","Asymptotics for spherical needlets","Published in at http://dx.doi.org/10.1214/08-AOS601 the Annals of
  Statistics (http://www.imstat.org/aos/) by the Institute of Mathematical
  Statistics (http://www.imstat.org)","Annals of Statistics 2009, Vol. 37, No. 3, 1150-1171","10.1214/08-AOS601","IMS-AOS-AOS601","math.ST astro-ph cond-mat.other stat.TH","http://arxiv.org/licenses/nonexclusive-distrib/1.0/","  We investigate invariant random fields on the sphere using a new type of
spherical wavelets, called needlets. These are compactly supported in frequency
and enjoy excellent localization properties in real space, with
quasi-exponentially decaying tails. We show that, for random fields on the
sphere, the needlet coefficients are asymptotically uncorrelated for any fixed
angular distance. This property is used to derive CLT and functional CLT
convergence results for polynomial functionals of the needlet coefficients:
here the asymptotic theory is considered in the high-frequency sense. Our
proposals emerge from strong empirical motivations, especially in connection
with the analysis of cosmological data sets.
","[{""version"":""v1"",""created"":""Fri, 23 Jun 2006 15:08:03 GMT""},{""version"":""v2"",""created"":""Mon, 20 Apr 2009 07:27:55 GMT""}]","2009-09-29"
"math/0606600","Peter Albers","Peter Albers","A note on local Floer homology","15 pages",,,,"math.SG",,"  In general, Lagrangian Floer homology - if well-defined - is not isomorphic
to singular homology. For arbitrary closed Lagrangian submanifolds a local
version of Floer homology is defined in [Flo89, Oh96] which is isomorphic to
singular homology. This construction assumes that the involved Hamiltonian
function $H$ is sufficiently $C^2$-small and the almost complex structure is
sufficiently standard.
  In this note we develop a new construction of local Floer homology which
works for any (compatible) almost complex structure and all Hamiltonian
function with Hofer norm less than the minimal (symplectic) area of a
holomorphic disk or sphere. The example $S^1\subset\C$ shows that this is
sharp. If the Lagrangian submanifold is monotone, the grading of local Floer
homology can be improved to a $\Z$-grading.
","[{""version"":""v1"",""created"":""Fri, 23 Jun 2006 15:16:32 GMT""}]","2007-05-23"
"math/0606601","Nikolai Dokuchaev","Nikolai Dokuchaev","Representation of functionals of Ito processes and their first exit
  times","25 pages",,,,"math.PR math.AP","http://arxiv.org/licenses/nonexclusive-distrib/1.0/","  The representation theorem is obtained for functionals of non-Markov
processes and their first exit times from bounded domains. These functionals
are represented via solutions of backward parabolic Ito equations. As an
example of applications, analogs of forward Kolmogorov equations are derived
for conditional probability density functions of Ito processes being killed on
the boundary. In addition, a maximum principle and a contraction property are
established for SPDEs in bounded domains.
","[{""version"":""v1"",""created"":""Fri, 23 Jun 2006 15:29:17 GMT""},{""version"":""v2"",""created"":""Wed, 28 Jul 2010 07:05:27 GMT""}]","2010-07-29"
"math/0606602","Ciprian Tudor","Ciprian A. Tudor (SAMOS)","Analysis of the Rosenblatt process",,"ESAIM Probability and Statistics 12 (2008) 230-257","10.1051/ps:2007037",,"math.PR",,"  We analyze {\em the Rosenblatt process} which is a selfsimilar process with
stationary increments and which appears as limit in the so-called {\em Non
Central Limit Theorem} (Dobrushin and Major (1979), Taqqu (1979)). This process
is non-Gaussian and it lives in the second Wiener chaos. We give its
representation as a Wiener-It\^o multiple integral with respect to the Brownian
motion on a finite interval and we develop a stochastic calculus with respect
to it by using both pathwise type calculus and Malliavin calculus.
","[{""version"":""v1"",""created"":""Fri, 23 Jun 2006 15:50:05 GMT""}]","2008-08-01"
"nlin/0606056","Vsevolod Adler","V.E. Adler","On a class of third order mappings with two rational invariants","9 pages, 6 figures",,,,"nlin.SI",,"  A novel family of integrable third order maps is presented. Each map
possesses, by construction, a pair of rational invariants and a commuting map
from the same class. The 3-dimensional invariant curve is parametrized, in
general, by an elliptic curve.
","[{""version"":""v1"",""created"":""Fri, 23 Jun 2006 05:43:15 GMT""}]","2007-05-23"
"nlin/0606057","A. V. Kuzmin","A.V. Kuzmin, Marko Robnik","Energy evolution in time-dependent harmonic oscillator with arbitrary
  external forcing","16 pages, 5 figures","Reports on Mathematical Physics, vol. 60, No. 1 (2007) p. 69-84","10.1016/S0034-4877(07)80099-1",,"nlin.SI quant-ph",,"  The classical Hamiltonian system of time-dependent harmonic oscillator driven
by the arbitrary external time-dependent force is considered. Exact analytical
solution of the corresponding equations of motion is constructed in the
framework of the technique (Robnik M, Romanovski V G, J. Phys. A: Math. Gen.
{\bf 33} (2000) 5093) based on WKB approach. Energy evolution for the ensemble
of uniformly distributed w.r.t. the canonical angle initial conditions on the
initial invariant torus is studied. Exact expressions for the energy moments of
arbitrary order taken at arbitrary time moment are analytically derived.
Corresponding characteristic function is analytically constructed in the form
of infinite series and numerically evaluated for certain values of the system
parameters. Energy distribution function is numerically obtained in some
particular cases. In the limit of small initial ensemble's energy the relevant
formula for the energy distribution function is analytically derived.
","[{""version"":""v1"",""created"":""Fri, 23 Jun 2006 09:30:11 GMT""},{""version"":""v2"",""created"":""Sun, 9 Jul 2006 16:42:03 GMT""}]","2015-06-26"
"nucl-ex/0606028","Thomas A. Trainor","J. Adams, et al, (STAR Collaboration)","The multiplicity dependence of inclusive $p_t$ spectra from p-p
  collisions at $\sqrt{s}$ = 200 GeV","17 pages, 10 figures","Phys.Rev.D74:032006,2006","10.1103/PhysRevD.74.032006",,"nucl-ex",,"  We report measurements of transverse momentum $p_t$ spectra for ten event
multiplicity classes of p-p collisions at $\sqrt{s} = 200$ GeV. By analyzing
the multiplicity dependence we find that the spectrum shape can be decomposed
into a part with amplitude proportional to multiplicity and described by a
L\'evy distribution on transverse mass $m_t$, and a part with amplitude
proportional to multiplicity squared and described by a gaussian distribution
on transverse rapidity $y_t$. The functional forms of the two parts are nearly
independent of event multiplicity. The two parts can be identified with the
soft and hard components of a two-component model of p-p collisions. This
analysis then provides the first isolation of the hard component of the $p_t$
spectrum as a distribution of simple form on $y_t$.
","[{""version"":""v1"",""created"":""Fri, 23 Jun 2006 00:01:58 GMT""},{""version"":""v2"",""created"":""Mon, 26 Jun 2006 16:13:51 GMT""}]","2008-11-26"
"nucl-ex/0606029","Fuminori Sakuma","F. Sakuma, J. Chiba, H. En'yo, Y. Fukao, H. Funahashi, H. Hamagaki, M.
  Ieiri, M. Ishino, H. Kanda, M. Kitaguchi, S. Mihara, K. Miwa, T. Miyashita,
  T. Murakami, R. Muto, T. Nakura, M. Naruki, K. Ozawa, O. Sasaki, M. Sekimoto,
  T. Tabaru, K. H. Tanaka, M. Togawa, S. Yamada, S. Yokkaichi, Y. Yoshimura","Nuclear-matter modification of decay widths in the $\phi \to e^{+}e^{-}$
  and $\phi \to K^{+}K^{-}$ channels","5 pages, 4 figures","Phys.Rev.Lett.98:152302,2007","10.1103/PhysRevLett.98.152302",,"nucl-ex",,"  The invariant mass spectra of $\phi \to K^{+}K^{-}$ are measured in 12 GeV
$p+A$ reactions in order to search for the in-medium modification of $\phi$
mesons. The observed $K^{+}K^{-}$ spectra are well reproduced by the
relativistic Breit-Wigner function with a combinatorial background shape in
three $\beta\gamma$ regions between 1.0 and 3.5. The nuclear mass-number
dependence of the yields of the $K^{+}K^{-}$ decay channel is compared to the
simultaneously measured $e^{+}e^{-}$ decay channel for carbon and copper
targets. We parameterize the production yields as $\sigma (A) = \sigma_0 \times
A^\alpha$ and obtain $\alpha_{\phi\to K^+K^-} - \alpha_{\phi\to e^+e^-}$ to be
0.14 $\pm$ 0.12. Limits are obtained for the partial decay widths of $\phi$
mesons in nuclear matter.
","[{""version"":""v1"",""created"":""Fri, 23 Jun 2006 07:57:54 GMT""},{""version"":""v2"",""created"":""Wed, 15 Nov 2006 07:54:39 GMT""},{""version"":""v3"",""created"":""Thu, 18 Jan 2007 17:45:02 GMT""},{""version"":""v4"",""created"":""Sat, 14 Apr 2007 01:37:03 GMT""}]","2008-11-26"
"nucl-ex/0606030","Alexandra Gade","K. L. Yurkewicz, D. Bazin, B. A. Brown, J. Enders, A. Gade, T.
  Glasmacher, P. G. Hansen, V. Maddalena, A. Navin, B. M. Sherrill, J.A.
  Tostevin","One-neutron knockout from $^{57}$Ni","Phys. Rev. C, accepted","Phys.Rev.C74:024304,2006","10.1103/PhysRevC.74.024304",,"nucl-ex",,"  The single-particle structure of $^{57}$Ni and level structure of $^{56}$Ni
were investigated with the \mbox{$^{9}$Be ($^{57}
$Ni,$^{56}$Ni+$\gamma$)$\it{X}$} reaction at 73 MeV/nucleon. An inclusive cross
section of 41.4(12) mb was obtained for the reaction, compared to a theoretical
prediction of 85.4 mb, hence only 48(2)% of the theoretical cross section is
exhausted. This reduction in the observed spectroscopic strength is consistent
with that found for lighter well-bound nuclei. One-neutron removal
spectroscopic factors of 0.58(11) to the ground state and 3.7(2) to all excited
states of $^{56}$Ni were deduced.
","[{""version"":""v1"",""created"":""Fri, 23 Jun 2006 15:15:35 GMT""}]","2008-11-26"
"nucl-th/0606049","Andrey Shirokov","A. M. Shirokov","Projector operators for the no-core shell model","3 pages","Phys.Atom.Nucl.69:1030-1032,2006","10.1134/S1063778806060135",,"nucl-th",,"  Projection operators for the use within ab initio no-core shell model, are
suggested.
","[{""version"":""v1"",""created"":""Fri, 23 Jun 2006 15:42:15 GMT""}]","2010-11-11"
"physics/0606193","Avner Peleg","Avner Peleg, Jerome V. Moloney","Scintillation index for two Gaussian laser beams with different
  wavelengths in weak atmospheric turbulence","26 pages, 7 figures. Submitted to J. Opt. Soc. Am. A",,"10.1364/JOSAA.23.003114",,"physics.optics",,"  We study propagation of two lowest order Gaussian laser beams with different
wavelengths in weak atmospheric turbulence. Using the Rytov approximation and
assuming a slow detector we calculate the longitudinal and radial components of
the scintillation index for a typical free space laser communication setup. We
find the optimal configuration of the two laser beams with respect to the
longitudinal scintillation index. We show that the value of the longitudinal
scintillation for the optimal two-beam configuration is smaller by more than
50% compared with the value for a single lowest order Gaussian beam with the
same total power. Furthermore, the radial scintillation for the optimal
two-beam system is smaller by 35%-40% compared with the radial scintillation in
the single beam case. Further insight into the reduction of intensity
fluctuations is gained by analyzing the self- and cross-intensity contributions
to the scintillation index.
","[{""version"":""v1"",""created"":""Thu, 22 Jun 2006 17:53:10 GMT""}]","2009-11-11"
