"cond-mat/0601134","Matthew B. Stone","M. B. Stone, M. D. Lumsden, R. Jin, B. C. Sales, Y. Qiu, D. Mandrus
  and S. E. Nagler","Temperature dependent bilayer ferromagnetism in Sr3Ru2O7","29 page double space pdf, 12 figures, submitted to Phys. Rev. B",,"10.1103/PhysRevB.73.174426",,"cond-mat.str-el",,"  The Ruthenium based perovskites exhibit a wide variety of interesting
collective phenomena related to magnetism originating from the Ru 4d electrons.
Much remains unknown concerning the nature of magnetic fluctuations and
excitations in these systems. We present results of detailed inelastic neutron
scattering measurements of Sr3Ru2O7 as a function of temperature, probing the
ferromagnetic fluctuations of the bilayer structure. A magnetic response is
clearly visible for a range of temperatures, T = 3.8 K up to T = 100 K, and for
energy transfers between 2 and 14 meV. These measurements indicate that the
ferromagnetic fluctuations manifest in the bilayer structure factor persist to
surprisingly large temperatures. This behavior may be related to the proximity
of the system in zero magnetic field to the metamagnetic/ferromagnetic
transition.
","[{""version"":""v1"",""created"":""Sat, 7 Jan 2006 04:03:52 GMT""}]","2009-11-11"
"cond-mat/0601135","David Reilly","D. J. Reilly, Y. Zhang and L. DiCarlo","Phenomenology of the 0.7 conductance feature","Proceedings of EP2DS-16 (July 2005). Comments welcome.
  reilly@fas.harvard.edu",,"10.1016/j.physe.2006.02.027",,"cond-mat.mes-hall cond-mat.str-el",,"  We describe a phenomenological model for the conductance feature near $0.7
\times 2e^2/h$ that occurs in quantum point contacts. We focus on the
transconductance at finite source-drain bias and contrast our model with the
results expected from a single-particle picture. Good agreement is seen in
comparing the model with experimental data, taken on ultra-low-disorder GaAs
induced electron systems. Although simple, our phenomenology suggests important
boundary conditions for an underlying microscopic theory.
","[{""version"":""v1"",""created"":""Sat, 7 Jan 2006 04:35:04 GMT""}]","2009-11-11"
"cond-mat/0601136","Katsuhiko Higuchi","Masahiko Higuchi and Katsuhiko Higuchi","Density functional scheme for calculating the pair density","5 pages",,"10.1016/j.jmmm.2006.10.412",,"cond-mat.str-el cond-mat.other",,"  The density functional scheme for calculating the pair density is presented
by means of the constrained-search technique. The resultant single-particle
equation takes the form of the modified Hartree-Fock equation which contains
the kinetic contribution of the exchange-correlation energy functional as the
correlation potential. The practical form of the kinetic contribution is also
proposed with the aid of the scaling relations of the kinetic energy
functionals.
","[{""version"":""v1"",""created"":""Sat, 7 Jan 2006 06:01:08 GMT""}]","2015-06-25"
"cond-mat/0601137","Vasyl Bilykh","V.V. Bilykh","Effect of weak magnetic field on polariton-electron scattering in
  semiconductor microcavities","LaTex, 6 pages, 3 figures",,"10.1134/S1063776107050159",,"cond-mat.mes-hall cond-mat.other",,"  We theoretically calculate the polariton linewidth associated with the
polariton-electron scattering in a microcavity in presence of a magnetic field
perpendicular to the microcavity plane. It is shown that the polariton
linewidth oscillates as a function of the magnetic field magnitude and the
polariton-electron scattering rate can be not only decreased but also increased
by the magnetic field. The possible applications of such an effect are
discussed.
","[{""version"":""v1"",""created"":""Sat, 7 Jan 2006 14:24:09 GMT""}]","2009-11-11"
"cs/0601017","Peter Jung","Peter Jung","Weighted Norms of Ambiguity Functions and Wigner Distributions","5 twocolumn pages,2 figures, accepted for 2006 IEEE International
  Symposium on Information Theory, typos corrected, some additional cites,
  legend in Fig.2 corrected",,"10.1109/ISIT.2006.262122",,"cs.IT math.IT quant-ph",,"  In this article new bounds on weighted p-norms of ambiguity functions and
Wigner functions are derived. Such norms occur frequently in several areas of
physics and engineering. In pulse optimization for Weyl--Heisenberg signaling
in wide-sense stationary uncorrelated scattering channels for example it is a
key step to find the optimal waveforms for a given scattering statistics which
is a problem also well known in radar and sonar waveform optimizations. The
same situation arises in quantum information processing and optical
communication when optimizing pure quantum states for communicating in bosonic
quantum channels, i.e. find optimal channel input states maximizing the pure
state channel fidelity. Due to the non-convex nature of this problem the
optimum and the maximizers itself are in general difficult find, numerically
and analytically. Therefore upper bounds on the achievable performance are
important which will be provided by this contribution. Based on a result due to
E. Lieb, the main theorem states a new upper bound which is independent of the
waveforms and becomes tight only for Gaussian weights and waveforms. A
discussion of this particular important case, which tighten recent results on
Gaussian quantum fidelity and coherent states, will be given. Another bound is
presented for the case where scattering is determined only by some arbitrary
region in phase space.
","[{""version"":""v1"",""created"":""Fri, 6 Jan 2006 19:10:57 GMT""},{""version"":""v2"",""created"":""Mon, 16 Jan 2006 09:13:02 GMT""},{""version"":""v3"",""created"":""Fri, 19 May 2006 14:12:38 GMT""},{""version"":""v4"",""created"":""Fri, 7 Jul 2006 09:28:55 GMT""}]","2016-11-17"
"cs/0601019","Antoine Reilles","Antoine Reilles (INRIA Lorraine - LORIA)","Canonical Abstract Syntax Trees",,"Dans Workshop on Rewriting Techniques and Applications (2006)",,,"cs.PL",,"  This paper presents Gom, a language for describing abstract syntax trees and
generating a Java implementation for those trees. Gom includes features
allowing the user to specify and modify the interface of the data structure.
These features provide in particular the capability to maintain the internal
representation of data in canonical form with respect to a rewrite system. This
explicitly guarantees that the client program only manipulates normal forms for
this rewrite system, a feature which is only implicitly used in many
implementations.
","[{""version"":""v1"",""created"":""Fri, 6 Jan 2006 19:50:29 GMT""},{""version"":""v2"",""created"":""Tue, 21 Nov 2006 13:02:37 GMT""}]","2007-05-23"
"cs/0601020","William Yurcik","Ruperto P. Majuca, William Yurcik, Jay P. Kesan","The Evolution of Cyberinsurance","16 pages, 6 tables, 2 figures",,,,"cs.CR cs.CY",,"  Cyberinsurance is a powerful tool to align market incentives toward improving
Internet security. We trace the evolution of cyberinsurance from traditional
insurance policies to early cyber-risk insurance policies to current
comprehensive cyberinsurance products. We find that increasing Internet
security risk in combination with the need for compliance with recent corporate
legislation has contributed significantly to the demand for cyberinsurance.
Cyberinsurance policies have become more comprehensive as insurers better
understand the risk landscape and specific business needs. More specifically,
cyberinsurers are addressing what used to be considered insurmountable problems
(e.g., adverse selection/asymmetric information, moral hazard, etc.) that could
lead to a failure of this market solution. Although some implementation issues
remain, we suggest the future development of cyberinsurance will resolve these
issues as evidenced by insurance solutions in other risk domains.
","[{""version"":""v1"",""created"":""Fri, 6 Jan 2006 20:29:07 GMT""}]","2007-05-23"
"cs/0601021","Alexander Haubold","Alexander Haubold","Lighting Control using Pressure-Sensitive Touchpads",,,,,"cs.HC",,"  We introduce a novel approach to control physical lighting parameters by
means of a pressure-sensitive touchpad. The two-dimensional area of the
touchpad is subdivided into 5 virtual sliders, each controlling the intensity
of a color (red, green, blue, yellow, and white). The physical interaction
methodology is modeled directly after ubiquitous mechanical sliders and dimmers
which tend to be used for intensity/volume control. Our abstraction to a
pressure-sensitive touchpad provides advantages and introduces additional
benefits over such existing devices.
","[{""version"":""v1"",""created"":""Sat, 7 Jan 2006 11:06:23 GMT""}]","2007-05-23"
"gr-qc/0601026","Frank Herrmann","F. Herrmann, I. Hinder, D. Shoemaker and P. Laguna","Unequal Mass Binary Black Hole Plunges and Gravitational Recoil","12 pages, 5 figures, to appear in ""New Frontiers"" special issue of
  CQG",,"10.1088/0264-9381/24/12/S04",,"gr-qc astro-ph",,"  We present results from fully nonlinear simulations of unequal mass binary
black holes plunging from close separations well inside the innermost stable
circular orbit with mass ratios q = M_1/M_2 = {1,0.85,0.78,0.55,0.32}, or
equivalently, with reduced mass parameters $\eta=M_1M_2/(M_1+M_2)^2 = {0.25,
0.248, 0.246, 0.229, 0.183}$. For each case, the initial binary orbital
parameters are chosen from the Cook-Baumgarte equal-mass ISCO configuration. We
show waveforms of the dominant l=2,3 modes and compute estimates of energy and
angular momentum radiated. For the plunges from the close separations
considered, we measure kick velocities from gravitational radiation recoil in
the range 25-82 km/s. Due to the initial close separations our kick velocity
estimates should be understood as a lower bound. The close configurations
considered are also likely to contain significant eccentricities influencing
the recoil velocity.
","[{""version"":""v1"",""created"":""Fri, 6 Jan 2006 18:16:44 GMT""},{""version"":""v2"",""created"":""Thu, 21 Jun 2007 21:28:18 GMT""}]","2009-11-11"
"gr-qc/0601027","Earnest Harrison","Earnest Harrison","An Explicit Isochronal, Isometric Embedding","5 pages, 2 figures",,,,"gr-qc",,"  Certain semi-Riemannian metrics may be decomposed into a Riemannian part and
an isochronal part. We use this idea and an idea of Kasner to construct a
manifold in 6+1 Minkowski space with a well known metric. The full embedding we
display is isochronal which simplifies visualizing the properties of the
manifold.
","[{""version"":""v1"",""created"":""Sat, 7 Jan 2006 13:54:34 GMT""}]","2007-05-23"
"hep-ex/0601014","Zelimir Djurcic","Zelimir Djurcic (for the MiniBooNE Collaboration)","Backgrounds in Neutrino Appearance Signal at MiniBooNE","To appear in Proceedings of PANIC 2005 Conference, October 2005,
  Santa Fe, New Mexico. 4 pages 3 figures","AIPConf.Proc.842:828-830,2006","10.1063/1.2220393",,"hep-ex",,"  The MiniBooNE (Booster Neutrino Experiment) experiment is a precise search
for neutrino oscillations but is crucially sensitive to background processes
that would mimic an oscillation signal. The background sources include
intrinsic $\nu_{e}$ from kaon and muon decays, mis-identified $\pi^{0}$, gammas
from radiative delta decays, and muon neutrino events mis-identified as
electrons. A summary of these backgrounds and the tools to handle them is
presented.
","[{""version"":""v1"",""created"":""Fri, 6 Jan 2006 21:47:10 GMT""}]","2009-11-11"
"hep-lat/0601008","Takumi Doi","Takumi Doi (RIKEN BNL), Toru T. Takahashi (Kyoto U., Yukawa Inst.,
  Kyoto), Hideo Suganuma (Kyoto U.)","Meson-Meson and Meson-Baryon Interactions in Lattice QCD","Talk given at Particles and Nuclei International Conference
  (PANIC05), Santa Fe, NM, USA, 24-28 Oct. 2005. 3 pages, 2 figures",,"10.1063/1.2220239",,"hep-lat",,"  We study the meson-meson and meson-baryon interactions in lattice QCD. The
simulation is performed on 20^3 * 24 lattice at \beta=5.7 using Wilson gauge
action and Wilson fermion at the quenched level. By adopting one static quark
for each hadron as ""heavy-light meson"" and ""heavy-light-light baryon"", we
define the distance $r$ of two hadrons and extract the inter-hadron potential
from the energy difference of the two-particle state and its asymptotic state.
We find that both of the meson-meson and meson-baryon potentials are
nontrivially weak for the whole range of 0.2 fm <= r <= 0.8 fm. The effect of
including/excluding the quark-exchange diagrams is found to be marginal.
","[{""version"":""v1"",""created"":""Fri, 6 Jan 2006 16:43:08 GMT""}]","2009-11-11"
"hep-lat/0601009","H. Panagopoulos","H. Panagopoulos (1), A. Skouroupathis (1) and A. Tsapalis (2) ((1)
  Department of Physics, University of Cyprus, Nicosia, Cyprus, (2) Univ. of
  Athens, Inst. of Accelerating Systems and Applications, Greece)","Free Energy and Plaquette expectation value for gluons on the lattice,
  in three dimensions","12 pages, 3 figures. Expanded introduction and discussion, more
  details in presentation, no changes in results. Accepted in Phys. Rev. D","Phys.Rev. D73 (2006) 054511","10.1103/PhysRevD.73.054511",,"hep-lat",,"  We calculate the perturbative value of the Free Energy in Lattice QCD in
three dimensions, up to three loops. Our calculation is performed using the
Wilson formulation for gluons in SU(N) gauge theories.
  The Free Energy is directly related to the average plaquette. To carry out
the calculation, we compute the coefficients involved in the perturbative
expansion of the Free Energy up to three loops, using an automated set of
procedures developed by us in Mathematica. The dependence on N is shown
explicitly in our results.
  For purposes of comparison, we also present the individual contributions from
every diagram. These have been obtained by means of two independent
calculations, in order to cross check our results.
","[{""version"":""v1"",""created"":""Fri, 6 Jan 2006 17:05:29 GMT""},{""version"":""v2"",""created"":""Fri, 24 Feb 2006 17:26:02 GMT""}]","2009-11-11"
"hep-ph/0601040","Soren Wiesenfeldt","J. Sayre, S. Wiesenfeldt and S. Willenbrock","Minimal Trinification","23 pages, uses axodraw","Phys.Rev. D73 (2006) 035013","10.1103/PhysRevD.73.035013",,"hep-ph",,"  We study the trinified model, SU(3)_C x SU(3)_L x SU(3)_R x Z_3, with the
minimal Higgs sector required for symmetry breaking. There are five Higgs
doublets, and gauge-coupling unification results if all five are at the weak
scale, without supersymmetry. The radiative see-saw mechanism yields sub-eV
neutrino masses, without the need for intermediate scales, additional Higgs
fields, or higher-dimensional operators. The proton lifetime is above the
experimental limits, with the decay modes p -> \bar\nu K^+ and p -> \mu^+ K^0
potentially observable. We also consider supersymmetric versions of the model,
with one or two Higgs doublets at the weak scale. The radiative see-saw
mechanism fails with weak-scale supersymmetry due to the nonrenormalization of
the superpotential, but operates in the split-SUSY scenario.
","[{""version"":""v1"",""created"":""Fri, 6 Jan 2006 16:36:31 GMT""}]","2007-05-23"
"hep-ph/0601042","Simon Turbide","Simon Turbide, Charles Gale, Dinesh K. Srivastava and Rainer J. Fries","High Momentum Dilepton Production from Jets in a Quark Gluon Plasma","20 pages, 12 figures, discussions added","Phys.Rev.C74:014903,2006","10.1103/PhysRevC.74.014903",,"hep-ph",,"  We discuss the emission of high momentum lepton pairs in central Au+Au
collisions at RHIC ($\sqrt{s_{NN}}=$200 GeV) and Pb+Pb collisions at the LHC
($\sqrt{s_{NN}}=$5500 GeV). Yields of dileptons produced through interactions
of jets with thermal partons have been calculated, with next-to-leading order
corrections through hard thermal loops (HTL) resummation. They are compared to
thermal dilepton emission and the Drell-Yan process. A complete leading order
treatment of jet energy loss has been included. Jet-plasma interactions are
found to dominate over thermal dilepton emission for all values of the
invariant mass $M$. Drell-Yan is the dominant source of high momentum lepton
pairs for $M >$ 3 GeV at RHIC, after the background from heavy quark decays is
subtracted. At LHC, the range $M<7$ GeV is dominated by jet-plasma
interactions. Effects from jet energy loss on jet-plasma interactions turn out
to be weak, but non-negligible, reducing the yield of low-mass dileptons by
about 30%.
","[{""version"":""v1"",""created"":""Fri, 6 Jan 2006 20:18:40 GMT""},{""version"":""v2"",""created"":""Wed, 26 Apr 2006 15:51:27 GMT""}]","2008-11-26"
"hep-ph/0601049","Richard D. Ball","Richard D. Ball and Stefano Forte","All Order Running Coupling BFKL Evolution from GLAP (and vice-versa)",,"Nucl.Phys.B742:158-175,2006","10.1016/j.nuclphysb.2006.02.020","Edinburgh 2005/23, IFUM-868-FT","hep-ph",,"  We present a systematic formalism for the derivation of the kernel of the
BFKL equation from that of the GLAP equation and conversely to any given order,
with full inclusion of the running of the coupling. The running coupling is
treated as an operator, reducing the inclusion of running coupling effects and
their factorization to a purely algebraic problem. We show how the GLAP
anomalous dimensions which resum large logs of x can be derived from the
running-coupling BFKL kernel order by order, thereby obtaining a constructive
all-order proof of small x factorization. We check this result by explicitly
calculating the running coupling contributions to GLAP anomalous dimensions up
to next-to-next-to leading order. We finally derive an explicit expression for
BFKL kernels which resum large logs of Q^2 up to next-to-leading order from the
corresponding GLAP kernels, thus making possible a consistent collinear
improvement of the BFKL equation up to the same order.
","[{""version"":""v1"",""created"":""Fri, 6 Jan 2006 17:02:43 GMT""},{""version"":""v2"",""created"":""Sat, 7 Jan 2006 12:56:45 GMT""}]","2010-03-25"
"hep-ph/0601050","Gorazd Cvetic","Gorazd Cvetic and Cristian Valenzuela","An approach for evaluation of observables in analytic versions of QCD","revtex4, 8 pages, two eps-figures; one reference added; no other
  changes; version to appear in J. Phys. G","J.Phys. G32 (2006) L27","10.1088/0954-3899/32/6/L01","USM-TH-179","hep-ph",,"  We present two variants of an approach for evaluation of observables in
analytic QCD models. The approach is motivated by the skeleton expansion in a
certain class of schemes. We then evaluate the Adler function at low energies
in one variant of this approach, in various analytic QCD models for the
coupling parameter, and compare with perturbative QCD predictions and the
experimental results. We introduce two analytic QCD models for the coupling
parameter which reproduce the measured value of the semihadronic tau decay
ratio. Further, we evaluate the Bjorken polarized sum rule at low energies in
both variants of the evaluation approach, using for the coupling parameter the
analytic QCD model of Shirkov and Solovtsov, and compare with values obtained
by the evaluation approach of Milton et al. and Shirkov.
","[{""version"":""v1"",""created"":""Fri, 6 Jan 2006 17:47:01 GMT""},{""version"":""v2"",""created"":""Tue, 31 Jan 2006 16:55:00 GMT""},{""version"":""v3"",""created"":""Mon, 10 Apr 2006 20:52:05 GMT""}]","2009-11-11"
"hep-ph/0601051","Graham Shore","G.M. Shore","Pseudoscalar Meson Decay Constants and Couplings, the Witten-Veneziano
  Formula beyond large N_c, and the Topological Susceptibility","27 pages, 4 figures","Nucl.Phys. B744 (2006) 34-58","10.1016/j.nuclphysb.2006.03.011","SWAT 04-418","hep-ph hep-th",,"  The QCD formulae for the radiative decays $\eta,\eta'\to\c\c$, and the
corresponding Dashen--Gell-Mann--Oakes--Renner relations, differ from
conventional PCAC results due to the gluonic $U(1)_A$ axial anomaly. This
introduces a critical dependence on the gluon topological susceptibility. In
this paper, we revisit our earlier theoretical analysis of radiative
pseudoscalar decays and the DGMOR relations and extract explicit experimental
values for the decay constants. This is our main result. The flavour singlet
DGMOR relation is the generalisation of the Witten-Veneziano formula beyond
large $N_c$, so we are able to give a quantitative assessment of the
realisation of the $1/N_c$ expansion in the $U(1)_A$ sector of QCD.
Applications to other aspects of $\eta'$ physics, including the relation with
the first moment sum rule for the polarised photon structure function $g_1^\c$,
are highlighted. The $U(1)_A$ Goldberger-Treiman relation is extended to
accommodate SU(3) flavour breaking and the implications of a more precise
measurement of the $\eta$ and $\eta'$-nucleon couplings are discussed. A
comparison with the existing literature on pseudoscalar meson decay constants
using large-$N_c$ chiral Lagrangians is also made.
","[{""version"":""v1"",""created"":""Fri, 6 Jan 2006 18:49:07 GMT""}]","2009-11-11"
"hep-ph/0601052","Joseph Schechter","Deirdre Black, Masayasu Harada and Joseph Schechter","Chiral approach to phi radiative decays","26 pages, 10 figures, dedicated to celebration of sixtieth birthday
  of Rafael Sorkin","Phys.Rev. D73 (2006) 054017","10.1103/PhysRevD.73.054017","DPNU-05-19, SU-4252-820","hep-ph",,"  The radiative decays of the phi meson are known to be a good source of
information about the a0(980) and f0(980) scalar mesons. We discuss these
decays starting from a non-linear model Lagrangian which maintains the (broken)
chiral symmetry for the pseudoscalar (P), scalar (S) and vector (V) nonets
involved. The characteristic feature is derivative coupling for the SPP
interaction. In an initial approximation which models all the scalar nonet
radiative processes together with the help of a point like vertex, it is noted
that the derivative coupling prevents the a0 and f0 resonance peaks from
getting washed out (by falling phase space). However, the shapes of the two
final PP mass distributions do not agree well with the experimental ones. For
improving the situation we verify that the inclusion of the charged K meson
loop diagrams in the model does reproduce the experimental spectrum shapes in
the resonance region. The derivative coupling introduces quadratic as well as
logaritmic divergneces in this calculation. Using dimensional regularization we
show that these divergences actually cancel out among the four diagrams, as
expected from gauge invariance. We point out the features which are expected to
be important for further work on this model and for learning more about the
puzzling scalar mesons.
","[{""version"":""v1"",""created"":""Fri, 6 Jan 2006 19:06:28 GMT""}]","2009-11-11"
"hep-ph/0601053","Siew-Phang Ng","Stephen M. Barr, Siew-Phang Ng and Robert J. Scherrer","Classical Cancellation of the Cosmological Constant Re-Considered","18 pages, 1 figure; references added, corrected 2nd last paragraph of
  Sec 2","Phys.Rev.D73:063530,2006","10.1103/PhysRevD.73.063530","BA-05-104","hep-ph astro-ph gr-qc",,"  We revisit a scenario in which the cosmological constant is cancelled by the
potential energy of a slowly evolving scalar field, or ""cosmon"". The cosmon's
evolution is tied to the cosmological constant by a feedback mechanism. This
feedback is achieved by an unconventional coupling of the cosmon field to the
Ricci curvature scalar. The solutions show that the effective cosmological
constant evolves approximately as $t^{-2}$ and remains always of the same order
as the density of ordinary matter and radiation. Newton's constant varies on
cosmological time scales, with $\dot{G}_N/G_N \ll 1/t$. $G_N$ could have been
somewhat different, and possibly smaller, at the time of Big Bang
nucleosynthesis.
","[{""version"":""v1"",""created"":""Fri, 6 Jan 2006 20:56:56 GMT""},{""version"":""v2"",""created"":""Mon, 23 Jan 2006 20:37:29 GMT""}]","2011-05-12"
"hep-ph/0601055","Hiroaki Abuki","H. Abuki and T. Kunihiro","Thermal unpairing transitions affected by neutrality constraints and
  chiral dynamics","3 pages, 3 plots, contributed to the Proceedings of PANIC'05
  (Particles and Nuclei International Conference), Santa Fe, NM, 24-28 October
  2005",,"10.1063/1.2220204",,"hep-ph",,"  We discuss the phase structure of homogeneous quark matter under the charge
neutrality constraints, and present a unified picture of the thermal unpairing
phase transitions for a wide range of the quark density. We supplement our
discussions by developing the Ginzburg-Landau analysis.
","[{""version"":""v1"",""created"":""Sat, 7 Jan 2006 04:04:51 GMT""}]","2009-11-11"
"hep-th/0601031","Marcus Spradlin","Freddy Cachazo, Marcus Spradlin, Anastasia Volovich","Hidden Beauty in Multiloop Amplitudes","21 pages, harvmac; v2: minor changes","JHEP0607:007,2006","10.1088/1126-6708/2006/07/007","MCTP-05-106","hep-th hep-ph",,"  Planar L-loop maximally helicity violating amplitudes in N = 4 supersymmetric
Yang-Mills theory are believed to possess the remarkable property of satisfying
iteration relations in L. We propose a simple new method for studying the
iteration relations for four-particle amplitudes which involves the use of
certain linear differential operators and eliminates the need to fully evaluate
any loop integrals. We carry out this procedure in explicit detail for the
two-loop amplitude and argue that this method can be used to prove the
iteration relations to all loops up to polynomials in logarithms.
","[{""version"":""v1"",""created"":""Fri, 6 Jan 2006 20:48:11 GMT""},{""version"":""v2"",""created"":""Sat, 4 Mar 2006 19:05:24 GMT""}]","2009-11-11"
