"astro-ph/0601142","Charles Dermer","Charles D. Dermer (1) and Armen Atoyan (2) ((1) NRL, (2) University of
  Montreal)","Collapse of Neutron Stars to Black Holes in Binary Systems: A Model for
  Short Gamma Ray Bursts","4 pages, ApJ Letters, in press","Astrophys.J. 643 (2006) L13-L16","10.1086/504895",,"astro-ph",,"  The accretion of ~ 0.1 -- 1 M_o of material by a neutron star through Roche
lobe overflow of its companion or through white-dwarf/neutron-star coalescence
in a low mass binary system could be enough to exceed the critical mass of a
neutron star and trigger its collapse to a black hole, leading to the
production of a short gamma-ray burst (SGRB). In this model, SGRBs would often
be found in early-type galaxies or in globular cluster environments, though
they could also be formed through stellar-wind accretion in high-mass binary
systems of star-forming galaxies. Although the collapse event is likely to be
of short (<< 1 s) duration, afterglow complexity could be produced by neutron
decoupling in the fireball and subsequent accretion of the companion remnant,
for example, the disrupted white-dwarf core.
","[{""version"":""v1"",""created"":""Fri, 6 Jan 2006 23:00:27 GMT""},{""version"":""v2"",""created"":""Thu, 12 Jan 2006 19:20:48 GMT""},{""version"":""v3"",""created"":""Thu, 6 Apr 2006 22:42:12 GMT""}]","2009-11-11"
"astro-ph/0601143","Jun Fukue","Jun Fukue","Radiative Flow in a Luminous Disk","7 pages, 4 figures","Publ.Astron.Soc.Jap. 57 (2005) 841-847","10.1093/pasj/57.5.841",,"astro-ph",,"  Radiatively-driven flow in a luminous disk is examined in the subrelativistic
regime of $(v/c)^1$, taking account of radiation transfer. The flow is assumed
to be vertical, and the gravity and gas pressure are ignored. When internal
heating is dropped, for a given optical depth and radiation pressure at the
flow base (disk ``inside''), where the flow speed is zero, the flow is
analytically solved under the appropriate boundary condition at the flow top
(disk ``surface''), where the optical depth is zero. The loaded mass and
terminal speed of the flow are both determined by the initial conditions; the
mass-loss rate increases as the initial radiation pressure increases, while the
flow terminal speed increases as the initial radiation pressure and the loaded
mass decrease. In particular, when heating is ignored, the radiative flux $F$
is constant, and the radiation pressure $P_0$ at the flow base with optical
depth $\tau_0$ is bound in the range of $2/3 < cP_0/F < 2/3 + \tau_0$. In this
case, in the limit of $cP_0/F = 2/3 + \tau_0$, the loaded mass diverges and the
flow terminal speed becomes zero, while, in the limit of $cP_0/F = 2/3$, the
loaded mass becomes zero and the terminal speed approaches $(3/8)c$, which is
the terminal speed above the luminous flat disk under an approximation of the
order of $(v/c)^1$. We also examine the case where heating exists, and find
that the flow properties are qualitatively similar to the case without heating.
","[{""version"":""v1"",""created"":""Sat, 7 Jan 2006 00:02:52 GMT""}]","2015-06-24"
"astro-ph/0601144","Jun Fukue","Jun Fukue","Radiative Flow in a Luminous Disk II","6 pages, 4 figures; to be appeared in PASJ 58 (2006) No 1",,"10.1093/pasj/58.1.187",,"astro-ph",,"  Radiatively-driven transfer flow perpendicular to a luminous disk is examined
in the subrelativistic regime of $(v/c)^1$, taking into account the gravity of
the central object. The flow is assumed to be vertical, and the gas pressure is
ignored, while internal heating is assumed to be proportional to the gas
density. The basic equations were numerically solved as a function of the
optical depth, and the flow velocity, the height, the radiative flux, and the
radiation pressure were obtained for a given radius, an initial optical depth,
and initial conditions at the flow base (disk ``inside''), whereas the
mass-loss rate was determined as an eigenvalue of the boundary condition at the
flow top (disk ``surface''). For sufficiently luminous cases, the flow
resembles the case without gravity. For less-luminous cases, however, the flow
velocity decreases, and the flow would be impossible due to the existence of
gravity in the case that the radiative flux is sufficiently small. Application
to a supercritical accretion disk with mass loss is briefly discussed.
","[{""version"":""v1"",""created"":""Sat, 7 Jan 2006 00:32:35 GMT""}]","2015-06-24"
"astro-ph/0601145","Michael Way","M.J. Way and A.N. Srivastava (NASA/Ames Research Center)","Novel Methods for Predicting Photometric Redshifts from Broad Band
  Photometry using Virtual Sensors","36 pages, 12 figures, ApJ in Press, modified to reflect published
  version and color figures","Astrophys.J.647:102-115,2006","10.1086/505293",,"astro-ph",,"  We calculate photometric redshifts from the Sloan Digital Sky Survey Main
Galaxy Sample, The Galaxy Evolution Explorer All Sky Survey, and The Two Micron
All Sky Survey using two new training-set methods. We utilize the broad-band
photometry from the three surveys alongside Sloan Digital Sky Survey measures
of photometric quality and galaxy morphology. Our first training-set method
draws from the theory of ensemble learning while the second employs Gaussian
process regression both of which allow for the estimation of redshift along
with a measure of uncertainty in the estimation. The Gaussian process models
the data very effectively with small training samples of approximately 1000
points or less. These two methods are compared to a well known Artificial
Neural Network training-set method and to simple linear and quadratic
regression. Our results show that robust photometric redshift errors as low as
0.02 RMS can regularly be obtained. We also demonstrate the need to provide
confidence bands on the error estimation made by both classes of models. Our
results indicate that variations due to the optimization procedure used for
almost all neural networks, combined with the variations due to the data
sample, can produce models with variations in accuracy that span an order of
magnitude. A key contribution of this paper is to quantify the variability in
the quality of results as a function of model and training sample. We show how
simply choosing the ""best"" model given a data set and model class can produce
misleading results.
","[{""version"":""v1"",""created"":""Sat, 7 Jan 2006 01:38:11 GMT""},{""version"":""v2"",""created"":""Sat, 1 Jul 2006 04:37:26 GMT""},{""version"":""v3"",""created"":""Thu, 6 Jul 2006 00:41:49 GMT""}]","2008-11-26"
"astro-ph/0601146","Daniel Kocevski","Daniel Kocevski, Edison Liang","Quantifying the Luminosity Evolution in Gamma-ray Bursts",,"Astrophys.J. 642 (2006) 371-381","10.1086/500816",,"astro-ph",,"  We estimate the luminosity evolution and formation rate for over 900 GRBs by
using redshift and luminosity data calculated by Band, Norris, $&$ Bonnell
(2004) via the lag-luminosity correlation. By applying maximum likelihood
techniques, we are able to infer the true distribution of the parent GRB
population's luminosity function and density distributions in a way that
accounts for detector selection effects. We find that after accounting for data
truncation, there still exists a significant correlation between the average
luminosity and redshift, indicating that distant GRBs are on average more
luminous than nearby counterparts. This is consistent with previous studies
showing strong source evolution and also recent observations of under luminous
nearby GRBs. We find no evidence for beaming angle evolution in the current
sample of GRBs with known redshift, suggesting that this increase in luminosity
can not be due to an evolution of the collimation of gamma-ray emission. The
resulting luminosity function is well fit with a single power law of index
$L'^{-1.5}$, which is intermediate between the values predicted by the
power-law and Gaussian structured jet models. We also find that the GRB
comoving rate density rises steeply with a broad peak between $1<z<2$ followed
by a steady decline above $z> 3$. This rate density qualitatively matches the
current estimates of the cosmic star formation rate, favoring a short lived
massive star progenitor model, or a binary model with a short delay between the
formation of the compact object and the eventual merger.
","[{""version"":""v1"",""created"":""Sat, 7 Jan 2006 02:11:36 GMT""}]","2009-11-11"
"astro-ph/0601147","Alice C. Quillen","Alice C. Quillen (Rochester), Joss Bland-Hawthorn (AAO), Mairi H.
  Brookes (JPL), Michael W. Werner (JPL), J. D. Smith (Steward Obs), Daniel
  Stern (JPL), Jocelyn Keene (JPL), Charles R. Lawrence (JPL)","Discovery of a 500 pc shell in the nucleus of Centaurus A","submitted to ApJ Letters","Astrophys.J.641:L29-L32,2006","10.1086/503670",,"astro-ph",,"  Spitzer Space Telescope mid-infrared images of the radio galaxy Centaurus A
reveal a shell-like, bipolar, structure 500 pc to the north and south of the
nucleus. This shell is seen in 5.8, 8.0 and 24 micron broad-band images. Such a
remarkable shell has not been previously detected in a radio galaxy and is the
first extragalactic nuclear shell detected at mid-infrared wavelengths. We
estimate that the shell is a few million years old and has a mass of order
million solar masses. A conservative estimate for the mechanical energy in the
wind driven bubble is 10^53 erg. The shell could have created by a small few
thousand solar mass nuclear burst of star formation. Alternatively, the
bolometric luminosity of the active nucleus is sufficiently large that it could
power the shell. Constraints on the shell's velocity are lacking. However, if
the shell is moving at 1000 km/s then the required mechanical energy would be
100 times larger.
","[{""version"":""v1"",""created"":""Sat, 7 Jan 2006 03:36:51 GMT""}]","2015-07-29"
"astro-ph/0601148","Dave Besson","I. Kravchenko, et al","RICE Limits on the Diffuse Ultra-High Energy Neutrino Flux","Submitted to Astropart. Phys","Phys.Rev.D73:082002,2006","10.1103/PhysRevD.73.082002",,"astro-ph",,"  We present new limits on ultra-high energy neutrino fluxes above 100 PeV
based on data collected by the Radio Ice Cherenkov Experiment (RICE) at the
South Pole from 1999-2005. We discuss estimation of backgrounds, calibration
and data analysis algorithms (both on-line and off-line), procedures used for
the dedicated neutrino search, and refinements in our Monte Carlo (MC)
simulation, including recent in situ measurements of the complex ice dielectric
constant. An enlarged data set and a more detailed study of hadronic showers
results in a sensitivity improvement of more than one order of magnitude
compared to our previously published results. Examination of the full RICE data
set yields zero acceptable neutrino candidates, resulting in 95%
confidence-level model dependent limits on the flux
(E_\nu)^2(d\phi/dE_\nu)<10^{-6} GeV/(cm^2s~sr}) in the energy range 10^{17}<
E_\nu< 10^{20} eV. The new RICE results rule out the most intense flux model
projections at 95% confidence level.
","[{""version"":""v1"",""created"":""Sat, 7 Jan 2006 10:51:12 GMT""}]","2008-11-26"
"astro-ph/0601149","Yozo Kawano","Yozo Kawano (Nagoya U.), Masamune Oguri (Princeton U.)","Time Delays for the Giant Quadruple Lensed Quasar SDSS J1004+4112:
  Prospects for Determining the Density Profile of the Lensing Cluster","21 pages, 8 figures, accepted for publication in PASJ","Publ.Astron.Soc.Jap. 58 (2006) 271-282","10.1093/pasj/58.2.271",,"astro-ph",,"  We investigate the dependence of the time delays for the large-separation
gravitationally lensed quasar SDSS J1004+4112 on the inner mass profile of the
lensing cluster. Adopting the mass model whose innermost density profile is
parameterized as \rho \propto r^{-\alpha}, we derive a series of mass models
which can fit observational data and then compute the probability distribution
functions of time delays. We find that larger \alpha has longer time delays,
longer tails at the higher end of the probability distribution, and larger
model uncertainties. The ratios of time delays slightly depend on the slope
\alpha. Among others, time delays between images C and A (or B) have little
dependence on the inner slope, particularly when the time delays are short. The
dependence of time delays on \alpha is well fitted by a linear form, which
reflects well-known degeneracy between the mass profile and time delays. We
perform a Monte-Carlo simulation to illustrate how well the inner slope can be
constrained from measurements of time delays. We find that measurements of more
than one time delays result in reasonably tight constraints on the inner slope
(\sigma_{\alpha} \lesssim 0.25), while only one time delay cannot determine the
inner slope very well. Our result indicates that time delays indeed serve as a
powerful tool to determine the mass profile, despite the complexity of the
lensing cluster.
","[{""version"":""v1"",""created"":""Sat, 7 Jan 2006 10:51:23 GMT""}]","2015-06-24"
"cond-mat/0601109","Timothy Andersen","Timothy D. Andersen and Chjan C. Lim","Statistical Equilibrium of trapped slender vortex filaments - a
  continuum model","13 pages, 5 figures; major revisions in theoretical section; slight
  change of numerical results from L=20 to L=100; typos corrected in
  free-energy section",,,,"cond-mat.stat-mech cond-mat.supr-con",,"  Systems of nearly parallel, slender vortex filaments in which angular
momentum is conserved are an important simplification of the Navier-Stokes
equations where turbulence can be studied in statistical equilibrium. We study
the canonical Gibbs distribution based on the Klein-Majda-Damodaran (KMD) model
and find a divergence in the mean square vortex position from that of the point
vortex model of Onsager at high temperature. We subsequently develop a free
energy equation based on the non-interacting case, with a spherical constraint,
which we approximate using the method of Kac-Berlin, adding a mean field term
for logarithmic interaction. This free energy equation, we use to predict the
Monte Carlo results.
","[{""version"":""v1"",""created"":""Fri, 6 Jan 2006 18:50:58 GMT""},{""version"":""v2"",""created"":""Wed, 22 Feb 2006 00:59:22 GMT""},{""version"":""v3"",""created"":""Sun, 18 Jun 2006 16:28:28 GMT""},{""version"":""v4"",""created"":""Fri, 11 Aug 2006 22:08:47 GMT""},{""version"":""v5"",""created"":""Mon, 25 Sep 2006 22:15:37 GMT""}]","2007-05-23"
"cond-mat/0601123","Marcelo Sepliarsky","M Sepliarsky, M.G.Stachiotti, and R.L. Migoni","Interface effects in ferroelectric PbTiO$_3$ ultrathin films on a
  paraelectric substrate","4 pages",,"10.1103/PhysRevLett.96.137603",,"cond-mat.mtrl-sci",,"  Interface effects on the ferroelectric behavior of PbTiO$_3$ ultrathin films
deposited on SrTiO$_3$ substrate are investigated using an interatomic
potential approach with parameters fitted to first-principles calculations. We
find that the correlation of atomic displacements across the film/substrate
interface is crucial for the stabilization of the ferroelectric state in films
a few unit-cells thick. We show that the minimum film thickness for the
appearance of a spontaneous polarized domain state is not an intrinsic property
of the ferroelectric film but depends on the polarizability of the paraelectric
substrate. We also observe that the substrate displays an induced polarization
with an unusual oscillatory behavior.
","[{""version"":""v1"",""created"":""Fri, 6 Jan 2006 16:02:23 GMT""},{""version"":""v2"",""created"":""Wed, 15 Mar 2006 17:57:17 GMT""}]","2009-11-11"
"cond-mat/0601124","Pavlik Lettinga dr","M. Paul Lettinga, Kyongok Kang, Peter Holmqvist, Arnout Imhof, Didi
  Derks and Jan K. G. Dhont","Nematic-Isotropic Spinodal Decomposition Kinetics of Rod-like Viruses","17 pages, 6 figures, accepted in Phys. Rev. E",,"10.1103/PhysRevE.73.011412",,"cond-mat.soft",,"  We investigate spinodal decomposition kinetics of an initially nematic
dispersion of rod-like viruses (fd virus). Quench experiments are performed
from a flow-stabilized homogeneous nematic state at high shear rate into the
two-phase isotropic-nematic coexistence region at zero shear rate. We present
experimental evidence that spinodal decomposition is driven by orientational
diffusion, in accordance with a very recent theory.
","[{""version"":""v1"",""created"":""Fri, 6 Jan 2006 17:32:08 GMT""}]","2009-11-11"
"cond-mat/0601125","Emmanuel Trizac","R. Agra, F. van Wijland, E. Trizac","On the free energy within the mean-field approximation","pedagogical paper for undergraduate teaching, to appear in Eur. J.
  Physics","European Journal of Physics 27, 407 (2006).","10.1088/0143-0807/27/2/022",,"cond-mat.stat-mech cond-mat.mtrl-sci",,"  We compare two widespread formulations of the mean-field approximation, based
on minimizing an appropriately built mean-field free energy. We use the example
of the antiferromagnetic Ising model to show that one of these formulations
does not guarantee the existence of an underlying variational principle. This
results in a severe failure where straightforward minimization of the
corresponding mean-field free energy leads to incorrect results.
","[{""version"":""v1"",""created"":""Fri, 6 Jan 2006 17:39:06 GMT""}]","2009-11-11"
"cond-mat/0601126","Anton Vorontsov","A. Vorontsov, I. Vekhter","Nodal structure of quasi-2D superconductors probed by magnetic field","5 pages, 3 figures","Phys. Rev. Lett. v.96 p.237001 (2006)","10.1103/PhysRevLett.96.237001",,"cond-mat.supr-con",,"  We consider a quasi two-dimensional superconductor with line nodes in an
in-plane magnetic field, and compute the dependence of the specific heat, $C$,
and the in-plane heat conductivity, $\kappa$, on the angle between the field
and the nodal direction in the vortex state. We use a variation of the
microscopic Brandt-Pesch-Tewordt method that accounts for the scattering of
quasiparticles off vortices, and analyze the signature of the nodes in $C$ and
$\kappa$. At low to moderate fields the specific heat anisotropy changes sign
with increasing temperature. Comparison with measurements of $C$ and $\kappa$
in CeCoIn$_5$ resolves the contradiction between the two in favor of the
$d_{x^2-y^2}$ gap.
","[{""version"":""v1"",""created"":""Fri, 6 Jan 2006 20:35:20 GMT""}]","2007-05-23"
"cond-mat/0601127","Ivan Santamaria-Holek","C. Malaga, F. Mandujano, I. Santamaria-Holek","Mesoscopic constitutive relations for dilute polymer solutions","To be published in Physica A (16 pages, 2 figures)",,"10.1016/j.physa.2005.12.047",,"cond-mat.stat-mech cond-mat.soft",,"  A novel approach to the dynamics of dilute solutions of polymer molecules
under flow conditions is proposed by applying the rules of mesoscopic
nonequilibrium thermodynamics (MNET). The probability density describing the
state of the system is taken to be a function of the position and velocity of
the molecules, and on a local vector parameter accounting for its deformation.
This function obeys a generalized Fokker-Planck equation, obtained by
calculating the entropy production of the system, and identifying the
corresponding probability currents in terms of generalized forces. In simple
form, this coarse-grained description allows one to derive hydrodynamic
equations where molecular deformation and diffusion effects are coupled. A
class of non-linear constitutive relations for the pressure tensor are
obtained. Particular models are considered and compared with experiments.
","[{""version"":""v1"",""created"":""Fri, 6 Jan 2006 20:17:01 GMT""}]","2009-11-11"
"cond-mat/0601128","Daoxin Yao","D. X. Yao, E. W. Carlson, and D. K. Campbell","Magnetic Excitations of Stripes Near a Quantum Critical Point","4+ pages, 5 figures, published version","Phys. Rev. Lett. 97, 017003 (2006)","10.1103/PhysRevLett.97.017003",,"cond-mat.supr-con cond-mat.str-el",,"  We calculate the dynamical spin structure factor of spin waves for weakly
coupled stripes. At low energy, the spin wave cone intensity is strongly peaked
on the inner branches. As energy is increased, there is a saddlepoint followed
by a square-shaped continuum rotated 45 degree from the low energy peaks. This
is reminiscent of recent high energy neutron scattering data on the cuprates.
The similarity at high energy between this semiclassical treatment and quantum
fluctuations in spin ladders may be attributed to the proximity of a quantum
critical point with a small critical exponent $\eta$.
","[{""version"":""v1"",""created"":""Fri, 6 Jan 2006 21:17:20 GMT""},{""version"":""v2"",""created"":""Wed, 22 Mar 2006 22:54:41 GMT""},{""version"":""v3"",""created"":""Sat, 8 Jul 2006 01:45:31 GMT""}]","2007-05-23"
"cond-mat/0601130","Paul Tangney","Paul Tangney","On the theory underlying the Car-Parrinello method and the role of the
  fictitious mass parameter","The following article has been accepted by The Journal of Chemical
  Physics. After it is published, it will be found at http://jcp.aip.org/",,"10.1063/1.2162893",,"cond-mat.stat-mech cond-mat.mtrl-sci",,"  The theory underlying the Car-Parrinello extended-lagrangian approach to {\em
ab initio} molecular dynamics (CPMD) is reviewed and reexamined using 'heavy'
ice as a test system. It is emphasized that the adiabatic decoupling in CPMD is
not a decoupling of electronic orbitals from the ions but only a decoupling of
a subset of the orbital vibrational modes from the rest of the
necessarily-coupled system of orbitals and ions. Recent work (J. Chem. Phys.
{\bf 116}, 14 (2002)) has pointed out that, due to the orbital-ion coupling
that remains once adiabatic-decoupling has been achieved, a large value of the
fictitious mass $\mu$ can lead to systematic errors in the computed forces in
CPMD. These errors are further investigated in the present work with a focus on
those parts of these errors that are not corrected simply by rescaling the
masses of the ions. It is suggested that any comparison of the efficiencies of
Born-Oppenheimer molecular dynamics (BOMD) and CPMD should be performed at a
similar level of accuracy. If accuracy is judged according to the average
magnitude of the systematic errors in the computed forces, the efficiency of
BOMD compares more favorably to that of CPMD than previous comparisons have
suggested.
","[{""version"":""v1"",""created"":""Fri, 6 Jan 2006 21:41:16 GMT""}]","2009-11-11"
"cond-mat/0601131","Bob Cava","A. J. Williams, J. P. Attfield, M. L. Foo and R. J. Cava","Absence of conventional charge ordering in Na0.5CoO2 from a high
  resolution neutron diffraction study","16 pages, 3 figures",,,,"cond-mat.str-el",,"  The structure of Na0.5CoO2, the low temperature insulator that separates the
magnetic and superconducting regions in the NaxCoO2.yH2O phase diagram, is
studied by high resolution powder neutron diffraction at temperatures between
10 and 300 K. Profile analysis confirms that it has an orthorhombic symmetry
structure, space group Pnmm, consisting of layers of edge-sharing CoO6
octahedra in a triangular lattice, with Na ions occupying ordered positions in
one-dimensional chains in the interleaving planes. The oxygen content is found
to be stoichiometric within 1%, indicating that the Na concentration accurately
determines the electronic doping. The Na ordering creates two distinct Co sites
with different numbers of Na neighbours, but the difference in their Co-O bond
distances and the derived bond valence sums is small.
","[{""version"":""v1"",""created"":""Sat, 7 Jan 2006 00:12:30 GMT""}]","2007-05-23"
"cond-mat/0601132","Taro Yamashita","T. Yamashita, S. Takahashi, and S. Maekawa","Controllable pi junction with magnetic nanostructures","4 pages, 3 figures",,"10.1103/PhysRevB.73.144517",,"cond-mat.supr-con cond-mat.mes-hall",,"  We propose a novel Josephson device in which 0 and $\pi$ states are
controlled by an electrical current. In this system, the $\pi$ state appears in
a superconductor/normal metal/superconductor junction due to the non-local spin
accumulation in the normal metal which is induced by spin injection from a
ferromagnetic electrode. Our proposal offers not only new possibilities for
application of superconducting spin-electronic devices but also the in-depth
understanding of the spin-dependent phenomena in magnetic nanostructures.
","[{""version"":""v1"",""created"":""Sat, 7 Jan 2006 02:54:03 GMT""}]","2009-11-11"
"cond-mat/0601133","Katsuaki Sugawara","K. Sugawara, T. Sato, S. Souma, T. Takahashi, M. Arai, and T. Sasaki","Fermi Surface and Anisotropic Spin-Orbit Coupling of Sb(111) studied by
  Angle-Resolved Photoemission Spectroscopy","4 pages, 3 figures. to be published in Phys. Rev. Lett",,"10.1103/PhysRevLett.96.046411",,"cond-mat.other",,"  High-resolution angle-resolved photoemission spectroscopy has been performed
on Sb(111) to elucidate the origin of anomalous electronic properties in
group-V semimetal surfaces. The surface was found to be metallic despite the
semimetallic character of bulk. We clearly observed two surface-derived Fermi
surfaces which are likely spin split, demonstrating that the spin-orbit
interaction plays a dominant role in characterising the surface electronic
states of group-V semimetals. Universality/disimilarity of the electronic
structure in Bi and Sb is discussed in relation to the granular
superconductivity, electron-phonon coupling, and surface charge/spin density
wave.
","[{""version"":""v1"",""created"":""Sat, 7 Jan 2006 09:21:03 GMT""}]","2009-11-11"
