"hep-ex/0601046","Rolf S. Dubitzky","The BABAR Collaboration, B. Aubert, et al","Determinations of |Vub| from Inclusive Semileptonic B Decays with
  Reduced Model Dependence","4 pages, 3 postscript figues, submitted to PRL","Phys.Rev.Lett.96:221801,2006","10.1103/PhysRevLett.96.221801","BABAR-PUB-05/049, SLAC-PUB-11582","hep-ex",,"  We report two novel determinations of |Vub| with reduced model dependence,
based on measurements of the mass distribution of the hadronic system in
semileptonic B decays. Events are selected by fully reconstructing the decay of
one B meson and identifying a charged lepton from the decay of the other B
meson from Y(4S) to BBbar events. In one approach, we combine the inclusive B
to X_u l nu rate, integrated up to a maximum hadronic mass m_X < 1.67GeV, with
a measurement of the inclusive B to X_s gamma photon energy spectrum. We obtain
|Vub| = (4.43 +- 0.38stat +- 0.25syst +- 0.29theo)*10^-3. In another approach
we measure the total B to X_u l nu rate over the full phase space and find
|Vub| = (3.84 +- 0.70stat +- 0.30syst +- 0.10theo)*10^-3.
","[{""version"":""v1"",""created"":""Mon, 30 Jan 2006 18:23:18 GMT""},{""version"":""v2"",""created"":""Thu, 25 May 2006 14:02:14 GMT""}]","2010-03-19"
"hep-ex/0601047","Tim Christiansen","D0 Collaboration, V. Abazov, et al","Search for Pair Production of Second Generation Scalar Leptoquarks in
  ppbar Collisions at sqrt(s)=1.96 TeV","submitted to Phys. Lett. B","Phys.Lett.B636:183-190,2006","10.1016/j.physletb.2006.03.056","FERMILAB-PUB-06/017-E","hep-ex",,"  We report on a search for the pair production of second generation scalar
leptoquarks (LQ_2) in ppbar collisions at the center-of-mass energy sqrt(s) =
1.96 TeV, using data corresponding to an integrated luminosity of 294 +- 19
pb^-1 recorded with the D0 detector. No evidence for a leptoquark signal in the
LQ_2 LQ_2 -> muq muq channel has been observed, and upper bounds on the product
of cross section times branching fraction were set. This yields lower mass
limits of m(LQ_2) > 247 GeV for beta = Br(LQ_2->muq) = 1 and m(LQ_2) > 182 GeV
for beta = 1/2. Combining these limits with previous D0 results, the lower
limits on the mass of a second generation scalar leptoquark are m(LQ_2) > 251
GeV and m(LQ_2) > 204 GeV for beta = 1 and beta = 1/2, respectively.
","[{""version"":""v1"",""created"":""Tue, 31 Jan 2006 13:59:19 GMT""}]","2008-11-26"
"hep-ex/0601048","Collaboration Secretariat Opal","The OPAL Collaboration, G. Abbiendi, et al","Measurement of the Strong Coupling alpha s from Four-Jet Observables in
  e+e- Annihilation","25 pages, 15 figures, Submitted to Euro. Phys. J. C","Eur.Phys.J.C47:295-307,2006","10.1140/epjc/s2006-02581-y","CERN-PH-EP/2005-057","hep-ex",,"  Data from e+e- annihilation into hadrons at centre-of-mass energies between
91 GeV and 209 GeV collected with the OPAL detector at LEP, are used to study
the four-jet rate as a function of the Durham algorithm resolution parameter
ycut. The four-jet rate is compared to next-to-leading order calculations that
include the resummation of large logarithms. The strong coupling measured from
the four-jet rate is alphas(Mz0)=
0.1182+-0.0003(stat.)+-0.0015(exp.)+-0.0011(had.)+-0.0012(scale)+-0.0013(mass)
in agreement with the world average. Next-to-leading order fits to the
D-parameter and thrust minor event-shape observables are also performed for the
first time. We find consistent results, but with significantly larger
theoretical uncertainties.
","[{""version"":""v1"",""created"":""Tue, 31 Jan 2006 14:19:14 GMT""}]","2009-01-07"
"hep-lat/0601036","Randy Lewis","Abdou M. Abdel-Rehim, Randy Lewis, R. M. Woloshyn and Jackson M. S. Wu","Strange quarks in quenched twisted mass lattice QCD","37 pages, 12 figures, accepted for publication","Phys.Rev.D74:014507,2006","10.1103/PhysRevD.74.014507",,"hep-lat",,"  Two twisted doublets, one containing the up and down quarks and the other
containing the strange quark with an SU(2)-flavor partner, are used for studies
in the meson sector. The relevant chiral perturbation theory is presented, and
quenched QCD simulations (where the partner of the strange quark is not active)
are performed. Pseudoscalar meson masses and decay constants are computed; the
vector and scalar mesons are also discussed. A comparison is made to the case
of an untwisted strange quark, and some effects due to quenching,
discretization, and the definition of maximal twist are explored.
","[{""version"":""v1"",""created"":""Mon, 30 Jan 2006 23:19:51 GMT""},{""version"":""v2"",""created"":""Tue, 20 Jun 2006 14:24:11 GMT""}]","2011-02-01"
"hep-ph/0601251","Peter A. Sturrock","P.A. Sturrock and J.D. Scargle","Power-spectrum analysis of Super-Kamiokande solar neutrino data, taking
  into account asymmetry in the error estimates","13 pages, 2 tables, 6 figures",,"10.1007/s11207-006-0143-0",,"hep-ph",,"  The purpose of this article is to carry out a power-spectrum analysis (based
on likelihood methods) of the Super-Kamiokande 5-day dataset that takes account
of the asymmetry in the error estimates. Whereas the likelihood analysis
involves a linear optimization procedure for symmetrical error estimates, it
involves a nonlinear optimization procedure for asymmetrical error estimates.
  We find that for most frequencies there is little difference between the
power spectra derived from analyses of symmetrized error estimates and from
asymmetrical error estimates. However, this proves not to be the case for the
principal peak in the power spectra, which is found at 9.43 yr-1. A likelihood
analysis which allows for a ""floating offset"" and takes account of the start
time and end time of each bin and of the flux estimate and the symmetrized
error estimate leads to a power of 11.24 for this peak. A Monte Carlo analysis
shows that there is a chance of only 1% of finding a peak this big or bigger in
the frequency band 1 - 36 yr-1 (the widest band that avoids artificial peaks).
On the other hand, an analysis that takes account of the error asymmetry leads
to a peak with power 13.24 at that frequency. A Monte Carlo analysis shows that
there is a chance of only 0.1% of finding a peak this big or bigger in that
frequency band 1 - 36 yr-1. From this perspective, power spectrum analysis that
takes account of asymmetry of the error estimates gives evidence for
variability that is significant at the 99.9% level.
  We comment briefly on an apparent discrepancy between power spectrum analyses
of the Super-Kamiokande and SNO solar neutrino experiments.
","[{""version"":""v1"",""created"":""Mon, 30 Jan 2006 18:56:10 GMT""},{""version"":""v2"",""created"":""Tue, 20 Jun 2006 17:36:50 GMT""}]","2009-11-11"
"hep-ph/0601252","Alfredo Valcarce","T. Fernandez-Carames, A. Valcarce, H. Garcilazo, P. Gonzalez","Strange tribaryons","16 pages, 10 figures, 4 tables. Accepted for publication in Phys.
  Rev. C","Phys.Rev.C73:034004,2006","10.1103/PhysRevC.73.034004",,"hep-ph hep-ex nucl-th",,"  We use two-body potentials derived from a constituent quark cluster model to
analyze the bound-state problem of the $\Sigma NN$ system. The observables of
the two-body subsystems, $NN$ and $\Sigma N$, are well reproduced. We do not
find $\Sigma NN$ bound states, but there are two attractive channels with a
resonance close above the three-body threshold. These channels are the
$(I,J)=(1,1/2)$ and $(0,1/2)$, their quantum numbers, widths and energy
ordering consistent with the recently measured strange tribaryons from the
$^{4}{\rm He}(K_{{\rm stopped}}^{-},N)$ reactions in the KEK PS E471
experiment.
","[{""version"":""v1"",""created"":""Mon, 30 Jan 2006 19:11:10 GMT""}]","2008-11-26"
"hep-ph/0601253","Ismail Turan","Gad Eilam (TECHNION), Mariana Frank and Ismail Turan (Concordia
  University)","Single Top Production via Gluon Fusion at CERN LHC","30 pages, 13 figures, 2 tables, typos corrected. Version as in the
  journal","Phys.Rev.D74:035012,2006","10.1103/PhysRevD.74.035012","CUMQ/HEP 139","hep-ph",,"  We calculate the one-loop flavor violating top quark decay t -> cgg in the
Minimal Supersymmetric Standard Model. We discuss the branching ratios obtained
with minimal flavor violation, as well as with soft-supersymmetry induced
general flavor violation. Based on this rate we calculate the cross section for
the single top quark production via gluon fusion, gg -> t cbar, and evaluate
its contribution to the cross section for single top quark production in pp
collisions at the Large Hadron Collider. We calculate all contributions coming
from the standard model and charged Higgs loops, as well as gluino (and
neutralino)-up-type squarks, and chargino-down-type squarks loops. Our
numerical results show that the gluino and the chargino contributions are
largest over the whole parameter range in the unconstrained Minimal
Supersymmetric Standard Model. While in general the gluino contributions
dominate the cross section, this result depends on the supersymmetric flavor
violating parameters in the up and down squark sector, the relative mass of the
gauginos, and whether or not the Grand Unified Theory relationships between
gaugino masses are satisfied. In the most promising scenarios, the pp -> t cbar
+ tbar c + X cross section at the Large Hadron Collider can reach a few
hundreds fb.
","[{""version"":""v1"",""created"":""Mon, 30 Jan 2006 20:09:00 GMT""},{""version"":""v2"",""created"":""Wed, 16 Aug 2006 21:13:44 GMT""},{""version"":""v3"",""created"":""Tue, 21 Nov 2006 05:55:29 GMT""}]","2008-11-26"
"hep-ph/0601254","Thomas Binoth Dr.","T. Binoth, M. Ciccolini, G. Heinrich","Towards LHC phenomenology at the loop level: A new method for one-loop
  amplitudes","5 pages latex, 1 ps fig., 1 eps fig., Conference Proceedings Radcor
  2005",,"10.1016/j.nuclphysbps.2006.03.035","Edinburgh 2006/05, PSI-06-04, ZU-TH 05/06","hep-ph",,"  A precise understanding of LHC phenomenology requires the inclusion of
one-loop corrections for multi-particle final states. In this talk we describe
a semi-numerical method to compute one-loop amplitudes with many external
particles and present first applications.
","[{""version"":""v1"",""created"":""Mon, 30 Jan 2006 20:38:10 GMT""}]","2009-11-11"
"hep-ph/0601255","Stefan Michalski","Stefan Michalski","Chiral and U(1) axial symmetry restoration in linear sigma models with
  two quark flavors","23 pages, 19 figures. RevTex style. Text restructured, references
  added. New results and figures for chiral limit added",,,"DO-TH 06/01","hep-ph nucl-th",,"  We study the restoration of chiral symmetry in linear sigma models with two
quark flavors. The models taken into consideration have a U(2)_L x U(2)_R and
an O(4) internal symmetry. The physical mesons of these models are sigma, pion,
eta and a_0 where the latter two are not present in the O(4) model. Including
two-loop contributions through sunset graphs we calculate the temperature
behavior of the order parameter and the masses for explicit chiral symmetry
breaking and in the chiral limit. Decay threshold effects introduced by the
sunset graphs alter the temperature dependence of the condensate and
consequently that of the masses as well. This correctly reproduces a
second-order phase transition for the O(4) model and for the U(2)_L x U(2)_R
model with an axial U(1) anomaly as expected from universality class arguments.
Chiral symmetry tends to be restored at higher temperatures in the two-loop
approximation than in the Hartree-Fock approximation. To model a restoration of
the axial U(1) symmetry we imply a temperature-dependent anomaly parameter that
sharply drops at about 175 MeV. This triggers the restoration of chiral
symmetry before the full symmetry is restored and lowers the transition
temperatures significantly below 200 MeV.
","[{""version"":""v1"",""created"":""Mon, 30 Jan 2006 20:54:00 GMT""},{""version"":""v2"",""created"":""Mon, 30 Jan 2006 22:25:31 GMT""},{""version"":""v3"",""created"":""Fri, 7 Apr 2006 12:24:15 GMT""}]","2007-05-23"
"hep-ph/0601256","Rudnei O. Ramos","T. Koide, G. Krein and Rudnei O. Ramos","Incorporating Memory Effects in Phase Separation Processes","5 pages, 2 eps figures. Version in press Phys. Lett. B","Phys.Lett. B636 (2006) 96-100","10.1016/j.physletb.2006.03.035",,"hep-ph cond-mat.soft hep-th nucl-th",,"  We consider the modification of the Cahn-Hilliard equation when a time delay
process through a memory function is taken into account. We then study the
process of spinodal decomposition in fast phase transitions associated with a
conserved order parameter. Finite-time memory effects are seen to affect the
dynamics of phase transition at short times and have the effect of delaying, in
a significant way, the process of rapid growth of the order parameter that
follows a quench into the spinodal region. These effects are important in
several systems characterized by fast processes, like nonequilibrium dynamics
in the early universe and in relativistic heavy-ion collisions.
","[{""version"":""v1"",""created"":""Mon, 30 Jan 2006 21:00:04 GMT""},{""version"":""v2"",""created"":""Wed, 15 Mar 2006 21:06:30 GMT""}]","2009-11-11"
"hep-ph/0601257","Sean Fleming","Sean Fleming (University of Arizona)","Soft Collinear Effective Theory","6 Pages, 3 figures. Parallel session overview talk presented at
  PANIC05, Particles and Nuclei International Conference, Santa Fe, NM -
  October 24-28, 2005","AIP Conf.Proc.842:923-928,2006","10.1063/1.2220423",,"hep-ph",,"  In this talk I review soft collinear effective theory. After a discussion of
the formalism and properties of the effective field theory, I turn to
phenomenology. I present results on color-suppressed B to D decays, and on the
Upsilon radiative decay spectrum.
","[{""version"":""v1"",""created"":""Mon, 30 Jan 2006 21:59:12 GMT""}]","2011-07-19"
"hep-ph/0601258","Hisakazu Minakata","Katsuki Hiraide, Hisakazu Minakata, Tsuyoshi Nakaya, Hiroshi Nunokawa,
  Hiroaki Sugiyama, Walter J. C. Teves, Renata Zukanovich Funchal","Resolving theta_{23} Degeneracy by Accelerator and Reactor Neutrino
  Oscillation Experiments","23 pages, 9 figures, version to appear in PRD","Phys.Rev.D73:093008,2006","10.1103/PhysRevD.73.093008","KEK-TH-1070","hep-ph hep-ex",,"  If the lepton mixing angle theta_{23} is not maximal, there arises a problem
of ambiguity in determining theta_{23} due to the existence of two degenerate
solutions, one in the first and the other in the second octant. We discuss an
experimental strategy for resolving the theta_{23} octant degeneracy by
combining reactor measurement of theta_{13} with accelerator nu_{mu}
disappearance and nu_{e} appearance experiments. The robustness of the
theta_{23} degeneracy and the difficulty in lifting it only by accelerator
experiments with conventional nu_{mu} (and nu_{mu}-bar) beam are demonstrated
by analytical and numerical treatments. Our method offers a way to overcome the
difficulty and can resolve the degeneracy between solutions sin^2 theta_{23} =
0.4 and sin^2 theta_{23} = 0.6 if sin^2 (2 theta_{13}) \gsim 0.05 at 95% CL by
assuming the T2K phase II experiment and a reactor measurement with an exposure
of 10 GW.kt.yr. The dependence of the resolving power of the octant degeneracy
on the systematic errors of reactor experiments is also examined.
","[{""version"":""v1"",""created"":""Mon, 30 Jan 2006 23:23:05 GMT""},{""version"":""v2"",""created"":""Thu, 25 May 2006 03:16:30 GMT""}]","2011-09-01"
"hep-ph/0601259","Christian Weiss","M. Strikman, C. Weiss","The black-disk limit in high-energy ep and pp scattering","6 pages, 3 figures. Uses aipproc.cls. Contributed to proceedings of
  PANIC05, Santa Fe, NM, Oct. 24-28, 2005","AIP Conf.Proc.842:210-215,2006","10.1063/1.2220229","JLAB-THY-06-461","hep-ph",,"  We review a recently proposed framework for studying the approach to the
unitarity limit in small-x processes in ep and pp scattering within the DGLAP
approximation. Our formulation is based on the correspondence between the
standard QCD factorization theorems for hard processes and the dipole picture
of small-x scattering in the leading logarithmic approximation. It allows us to
incorporate information about the transverse spatial distribution of gluons in
the proton (GPD) from exclusive vector meson production at HERA. We show that
the interaction of small-size color singlet configurations with the proton
approaches the ""black-disk limit"" (BDL) due to the growth of the DGLAP gluon
density at small x. This new dynamical regime is marginally visible in
diffractive DIS at HERA, and will be fully reached in central pp collisions at
LHC.
","[{""version"":""v1"",""created"":""Tue, 31 Jan 2006 03:28:37 GMT""}]","2014-11-18"
"hep-ph/0601260","Yoshitaka Okumura","Yoshitaka Okumura","Generalized Covariant Derivative on Extra Dimension and Weinberg-Salam
  Model","5 pages",,,,"hep-ph",,"  The generalized covariant derivative on 5-dimen-sional space including
1-dimensional extra compact space is defined, and, by use of it, the
Weinberg-Salam model is reconstructed. The spontaneous breakdown of symmetry
takes place owing to the extra dimension under the settings that the Higgs
field exists in the extra dimensional space depending on the argument $y$ of
this extra space, whereas the gauge and fermion fields do not depend on $y$.
Both Yang-Mills-Higgs and fermion Lagrangians in Weinberg-Salam model are
correctly reproduced.
","[{""version"":""v1"",""created"":""Tue, 31 Jan 2006 03:52:10 GMT""}]","2007-05-23"
"hep-ph/0601261","Hiroshi Yokoya","Hirotaka Shimizu (Hiroshima), George Sterman (Stony Brook), Werner
  Vogelsang (BNL & RBRC), Hiroshi Yokoya (Niigata)","QCD Corrections to Dilepton Production near Partonic Threshold in
  proton-antiproton Scattering","6 pages, 8 figures, to appear in the proceedings of the ""7th
  International Symposium on Radiative Corrections (RADCOR05)"", Shonan Village,
  Japan, 2005","Nucl.Phys.Proc.Suppl.157:197-201,2006","10.1016/j.nuclphysbps.2006.03.048","BNL-NT-06/7, HUPD-0604 RBRC-585, YITP-SB-06-03","hep-ph",,"  We present a recent study of the QCD corrections to dilepton production near
partonic threshold in transversely polarized \bar{p}p scattering. We analyze
the role of the higher-order perturbative QCD corrections in terms of the
available fixed-order contributions as well as of all-order soft-gluon
resummations for the kinematical regime of proposed experiments at GSI-FAIR. We
find that perturbative corrections are large for both unpolarized and polarized
cross sections, but that the spin asymmetries are stable. The role of the far
infrared region of the momentum integral in the resummed exponent and the
effect of the NNLL resummation are briefly discussed.
","[{""version"":""v1"",""created"":""Tue, 31 Jan 2006 05:33:26 GMT""}]","2014-11-18"
"hep-ph/0601262","Jared Kaplan","Jared Kaplan","Dark Matter Generation and Split Supersymmetry","V1: 14 p, 1 fig; V2: 19 p, 1 fig, significant additions, references
  added V3: Matching JHEP","JHEP 0610:065,2006","10.1088/1126-6708/2006/10/065",,"hep-ph",,"  We analyze a simple Split Supersymmetry scenario where fermion masses come
from anomaly mediation, yielding m_s ~ 1000 TeV, m_{3/2} ~ 100 TeV, and m_f ~ 1
TeV. We consider non-thermal dark matter production in the presence of moduli,
and we find that the decay chains of moduli to LSPs and moduli to gravitinos to
LSPs generate dark matter more efficiently than perturbative freeze-out,
allowing for a light, LHC visible spectrum. These decaying moduli can also
weaken cosmological constraints on the axion decay constant. With squark masses
of order 1000 TeV, LHC gluinos will decay millimeters from their primary
vertices, resulting in a striking experimental signature, and the suppression
of Flavor Changing Neutral Currents is almost sufficient to allow arbitrary
mixing in squark mass matrices.
","[{""version"":""v1"",""created"":""Tue, 31 Jan 2006 05:27:16 GMT""},{""version"":""v2"",""created"":""Sat, 22 Jul 2006 23:30:44 GMT""},{""version"":""v3"",""created"":""Thu, 30 Nov 2006 16:55:04 GMT""}]","2010-02-03"
"hep-ph/0601263","Youichi Yamada","Youichi Yamada","Two-loop SUSY QCD correction to the gluino pole mass","5 pages, talk at the 7th International Symposium on Radiative
  Corrections (RADCOR2005), Shonan Village, Japan, Oct. 2-7, 2005",,"10.1016/j.nuclphysbps.2006.03.045","TU-763","hep-ph",,"  We calculate the pole mass of the gluino as a function of the running
parameters in the lagrangian, to O(alpha_s^2) in SUSY QCD. The correction
shifts the pole mass from the running mass by typically 1-2 %. This shift can
be larger than the expected accuracy of the mass determination at future
colliders, and should be taken into account for precision studies of the SUSY
breaking parameters. The effects of other corrections are breifly commented.
","[{""version"":""v1"",""created"":""Tue, 31 Jan 2006 08:04:20 GMT""}]","2009-11-11"
"hep-ph/0601264","Olivier Leitner","O. Leitner (ECT*), Xin-Heng Guo (Beijing Normal University), A.W.
  Thomas (Thomas Jefferson National Accelerator Facility)","Direct CP violation in B \to \rho^0(\omega) PS","5 pages, 1 figure. Talk given at the International Europhysics
  Conference on High Energy Physics, July 21st - 27th 2005, Lisboa, Portugal","PoS HEP2005:261,2006",,,"hep-ph",,"  We calculate the direct CP violating asymmetry parameter, $a_{CP}$, for $B
\to \pi^{+} \pi^{-} \pi$ and $B \to \pi^{+} \pi^{-} K$ decays, in the case
where $\rho^0-\omega$ mixing effects are taken into account. We find that the
direct CP asymmetry for $B^{-} \to \pi^{+} \pi^{-} \pi^{-}$, $\bar{B}^{0} \to
\pi^{+} \pi^{-}\pi^{0}$, $B^{-} \to \pi^{+} \pi^{-} K^{-}$ and $\bar{B}^{0} \to
\pi^{+} \pi^{-}\bar{K}^{0}$, reaches its maximum when the invariant mass
$\pi^{+} \pi^{-}$ is in the vicinity of the $\omega$ meson mass. The inclusion
of $\rho^0-\omega$ mixing provides an opportunity to erase, without ambiguity,
the phase uncertainty mod$(\pi)$ in the determination of the CKM angles
$\alpha$ in case of $b\to u$ and $\gamma$ in case of $b \to s$.
","[{""version"":""v1"",""created"":""Tue, 31 Jan 2006 11:36:50 GMT""}]","2010-02-17"
"hep-ph/0601265","Fabio Correa","F. A. Correa and J. Morales","Order of the chiral phase transtion in the sigma models","8 pages, 1 Postscript figure. Previous versions incomplete and to be
  ignored","Momento 31, 1(2005)",,,"hep-ph",,"  The chiral phase transition at a certain critical temperature is a
restoration mechanism of the chiral symmetry, broken by the nonzero mass of
quarks and mesons. The transition can be studied through several models, among
which are the sigma models. An analysis is made on the linear and nonlinear
sigma models with different approximations, and we show that the transition is
of second order in both cases.
","[{""version"":""v1"",""created"":""Tue, 31 Jan 2006 15:31:47 GMT""},{""version"":""v2"",""created"":""Wed, 1 Feb 2006 08:28:56 GMT""},{""version"":""v3"",""created"":""Fri, 3 Feb 2006 12:27:58 GMT""}]","2008-02-20"
"hep-ph/0601266","Mark Rolinec","P. Huber, J. Kopp, M. Lindner, M. Rolinec and W. Winter","From Double Chooz to Triple Chooz - Neutrino Physics at the Chooz
  Reactor Complex","18 pages, 6 figures","JHEP 0605:072,2006","10.1088/1126-6708/2006/05/072","TUM-HEP-618/06, MADPH-06-1252","hep-ph hep-ex",,"  We discuss the potential of the proposed Double Chooz reactor experiment to
measure the neutrino mixing angle $\sin^2 2\theta_{13}$. We especially consider
systematical uncertainties and their partial cancellation in a near and far
detector operation, and we discuss implications of a delayed near detector
startup. Furthermore, we introduce Triple Chooz, which is a possible upgrade
scenario assuming a second, larger far detector, which could start data taking
in an existing cavern five years after the first far detector. We review the
role of the Chooz reactor experiments in the global context of future neutrino
beam experiments. We find that both Double Chooz and Triple Chooz can play a
leading role in the search for a finite value of $\sin^2 2\theta_{13}$. Double
Chooz could achieve a sensitivity limit of $\sim 2 \cdot 10^{-2}$ at the
90%~confidence level after 5~years while the Triple Chooz setup could give a
sensitivity below $10^{-2}$.
","[{""version"":""v1"",""created"":""Tue, 31 Jan 2006 14:32:28 GMT""}]","2010-02-03"
"hep-ph/0601267","Mustafa Savci","T. M. Aliev, M. Savci","Analysis of the semileptonic (B_c -> B_u* l+ l-) decay from QCD sum
  rules","17 pages, no figures, LaTeX formatted","Eur.Phys.J.C47:413-421,2006","10.1140/epjc/s2006-02579-5","metu-phys-hep-06-01","hep-ph",,"  We analyze the semileptonic (B_c -> B_u* l+ l-) decay in the frame work of
the Standard Model. We calculate the (B_c) to (B_u*) transition form factors in
QCD sum rules. Analytical expressions for the spectral densities and gluon
condensates are presented. The branching ratio of the (B_c -> B_u* l+ l-) decay
is calculated, and it is obtained that this decay can be detectable at
forthcoming LHC machines.
","[{""version"":""v1"",""created"":""Tue, 31 Jan 2006 15:57:14 GMT""},{""version"":""v2"",""created"":""Tue, 21 Mar 2006 08:13:40 GMT""}]","2009-01-07"
"hep-ph/0601268","Vladimir A Smirnov","V.A. Smirnov","Some recent results on evaluating Feynman integrals","5 pages, LaTeX, Conference Proceedings Radcor 2005",,"10.1016/j.nuclphysbps.2006.03.017",,"hep-ph",,"  Some recent results on evaluating Feynman integrals are reviewed. The status
of the method based on Mellin-Barnes representation as a powerful tool to
evaluate individual Feynman integrals is characterized. A new method based on
Groebner bases to solve integration by parts relations in an automatic way is
described.
","[{""version"":""v1"",""created"":""Tue, 31 Jan 2006 15:59:05 GMT""}]","2009-11-11"
