"math/0601740","Juhi Jang","Juhi Jang","Vlasov-Maxwell-Boltzmann diffusive limit","46 pages",,,,"math.AP math-ph math.MP",,"  We study the diffusive expansion for solutions around Maxwellian equilibrium
and in a periodic box to the Vlasov-Maxwell-Boltzmann system, the most
fundamental model for an ensemble of charged particles. Such an expansion
yields a set of dissipative new macroscopic PDE's, the incompressible
Vlasov-Navier-Stokes-Fourier system and its higher order corrections for
describing a charged fluid, where the self-consistent electromagnetic field is
present. The uniform estimate on the remainders is established via a unified
nonlinear energy method and it guarantees the global in time validity of such
an expansion up to any order.
","[{""version"":""v1"",""created"":""Mon, 30 Jan 2006 18:22:25 GMT""}]","2007-05-23"
"math/0601741","Ramon Van Handel","Luc Bouten, Ramon van Handel, Matthew James","An introduction to quantum filtering","41 pages, 1 figure","SIAM J. Control Optim. 46, 2199-2241, 2007",,,"math.OC math-ph math.MP math.PR quant-ph",,"  This paper provides an introduction to quantum filtering theory. An
introduction to quantum probability theory is given, focusing on the spectral
theorem and the conditional expectation as a least squares estimate, and
culminating in the construction of Wiener and Poisson processes on the Fock
space. We describe the quantum It\^o calculus and its use in the modelling of
physical systems. We use both reference probability and innovations methods to
obtain quantum filtering equations for system-probe models from quantum optics.
","[{""version"":""v1"",""created"":""Mon, 30 Jan 2006 19:17:50 GMT""}]","2007-12-24"
"math/0601742","Philippe Soulier","Rohit Deo (IOMS), Clifford M. Hurvich (IOMS), Philippe Soulier
  (MODAL'X), Yi Wang (IOMS)","Propagation of Memory Parameter from Durations to Counts",,"Econometric Theory / Volume25 / Issue03 / June 2009, pp 764-792","10.1017/S0266466608090294",,"math.ST math.PR stat.TH",,"  We establish sufficient conditions on durations that are stationary with
finite variance and memory parameter $d \in [0,1/2)$ to ensure that the
corresponding counting process $N(t)$ satisfies $\textmd{Var} N(t) \sim C
t^{2d+1}$ ($C>0$) as $t \to \infty$, with the same memory parameter $d \in
[0,1/2)$ that was assumed for the durations. Thus, these conditions ensure that
the memory in durations propagates to the same memory parameter in counts and
therefore in realized volatility. We then show that any utoregressive
Conditional Duration ACD(1,1) model with a sufficient number of finite moments
yields short memory in counts, while any Long Memory Stochastic Duration model
with $d>0$ and all finite moments yields long memory in counts, with the same
$d$.
","[{""version"":""v1"",""created"":""Mon, 30 Jan 2006 21:01:56 GMT""}]","2012-09-19"
"math/0601743","Leonid Friedlander","Leonid Friedlander and Victor Guillemin","Determinants of zeroth order operators","11 pages",,,,"math.SP",,"  We show that the Szego regularized determinant of a zeroth order operator
differs from the zeta regularized determinant of the same operator by a local
term. In addition, we compute multiplicative anomalies for the zeta regularized
determinant.
","[{""version"":""v1"",""created"":""Mon, 30 Jan 2006 23:08:19 GMT""}]","2007-05-23"
"math/0601744","Bernd Grave","Bernd Grave","Coarse geometry and asymptotic dimension","Dissertation",,,,"math.MG",,"  We consider asymptotic dimension of coarse spaces. We analyse coarse
structures induced by metrisable compactifications. We calculate asymptotic
dimension of coarse cell complexes. We calculate the asymptotic dimension of
certain negatively curved spaces, e.g. for complete, simply connected manifolds
with bounded, strictly negative sectional curvature.
","[{""version"":""v1"",""created"":""Mon, 30 Jan 2006 23:21:08 GMT""}]","2007-05-23"
"math/0601745","Roy Meshulam","Gil Kalai, Roy Meshulam","Intersections of Leray complexes and regularity of monomial ideals","9 pages",,,,"math.CO math.AC",,"  For a simplicial complex X and a field K, let h_i(X)=\dim \tilde{H}_i(X;K).
It is shown that if X,Y are complexes on the same vertex set, then for all k
h_{k-1}(X\cap Y) \leq \sum_{\sigma \in Y} \sum_{i+j=k} h_{i-1}(X[\sigma])\cdot
h_{j-1}(\lk(Y,\sigma)) . A simplicial complex X is d-Leray over K, if h_i(Y)=0
for all induced subcomplexes Y \subset X and i \geq d. Let L_K(X) denote the
minimal d such that X is d-Leray over K. The above theorem implies that if X,Y
are simplicial complexes on the same vertex set then L_K(X \cap Y) \leq L_K(X)
+L_K(Y). Reformulating this inequality in commutative algebra terms, we obtain
the following result conjectured by Terai: If I,J are square-free monomial
ideals in S=K[x_1,...,x_n], then reg(I+J) \leq reg(I)+reg(J)-1 where reg(I)
denotes the Castelnuovo-Mumford regularity of I.
","[{""version"":""v1"",""created"":""Mon, 30 Jan 2006 23:38:05 GMT""}]","2007-05-23"
"math/0601746","Francisco Santos","Francisco Santos","Geometric bistellar flips. The setting, the context and a construction","30 pages","In ""Proceedings of the International Congress of Mathematicians,
  2006"" (M. Sanz-Sole, J. Soria, J. L. Varona, J. Verdera, eds.), Eur. Math.
  Soc., 2006, Vol III, pp. 931-962",,,"math.CO",,"  We give a self-contained introduction to the theory of secondary polytopes
and geometric bistellar flips in triangulations of polytopes and point sets, as
well as a review of some of the known results and connections to algebraic
geometry, topological combinatorics, and other areas.
  As a new result, we announce the construction of a point set in general
position with a disconnected space of triangulations. This shows, for the first
time, that the poset of strict polyhedral subdivisions of a point set is not
always connected.
","[{""version"":""v1"",""created"":""Mon, 30 Jan 2006 23:42:47 GMT""}]","2007-06-13"
"math/0601747","Francisco Santos","Oswin Aichholzer, David Orden, Francisco Santos, Bettina Speckmann","On the Number of Pseudo-Triangulations of Certain Point Sets","31 pages, 11 figures, 4 tables. Not much technical changes with
  respect to v1, except some proofs and statements are slightly more precise
  and some expositions more clear. This version has been accepted in J. Combin.
  Th. A. The increase in number of pages from v1 is mostly due to formatting
  the paper with ""elsart.cls"" for Elsevier","J. Combin. Theory Ser. A, 115 (2008) 254-278.","10.1016/j.jcta.2007.06.002",,"math.CO",,"  We pose a monotonicity conjecture on the number of pseudo-triangulations of
any planar point set, and check it on two prominent families of point sets,
namely the so-called double circle and double chain. The latter has
asymptotically $12^n n^{\Theta(1)}$ pointed pseudo-triangulations, which lies
significantly above the maximum number of triangulations in a planar point set
known so far.
","[{""version"":""v1"",""created"":""Tue, 31 Jan 2006 00:07:37 GMT""},{""version"":""v2"",""created"":""Thu, 14 Jun 2007 17:42:50 GMT""}]","2009-07-07"
"math/0601748","Stefano Vidussi","B. Doug Park, Mainak Poddar, Stefano Vidussi","Homologous Non-isotopic Symplectic Surfaces of Higher Genus","12 pages, 3 figures. To appear in Trans. Amer. Math. Soc","Trans. Amer. Math. Soc. 359 (2007), no. 6, 2651-2662",,,"math.GT math.SG",,"  We construct an infinite family of homologous, non-isotopic, symplectic
surfaces of any genus greater than one in a certain class of closed, simply
connected, symplectic four-manifolds. Our construction is the first example of
this phenomenon for surfaces of genus greater than one.
","[{""version"":""v1"",""created"":""Tue, 31 Jan 2006 00:25:31 GMT""}]","2018-12-24"
"math/0601749","Yuuki Abe","Yuuki Abe","Inductive Construction of Nilpotent Modules of Quantum Groups at Roots
  of Unity","16 pages",,,,"math.QA math.RT",,"  The purpose of this paper is to prove that we can construct all finite
dimensional irreducible nilpotent modules of type 1 inductively by using
Schnizer homomorphisms for quantum algebra at roots of unity of type A, B, C, D
or G.
","[{""version"":""v1"",""created"":""Tue, 31 Jan 2006 01:12:18 GMT""}]","2007-05-23"
"math/0601750","Ralph L. Cohen","Ralph L. Cohen and Ib Madsen","Surfaces in a background space and the homology of mapping class groups","final version, to be published in the Proceedings of the Seattle
  Summer Institute in Algebraic Geometry, Proc. Symp. Pure Math., AMS",,,,"math.GT math.AT","http://arxiv.org/licenses/nonexclusive-distrib/1.0/","  In this paper we study the topology of the space of Riemann surfaces in a
simply connected space X, S_{g,n} (X, \gamma). This is the space consisting of
triples, (F_{g,n}, \phi, f), where F_{g,n} is a Riemann surface of genus g and
n-boundary components, \phi is a parameterization of the boundary, and f :
F_{g,n} \to X is a continuous map that satisfies a boundary condition \gamma.
We prove three theorems about these spaces. Our main theorem is the
identification of the stable homology type of the space S_{\infty, n}(X;
\gamma), defined to be the limit as the genus g gets large, of the spaces
S_{g,n} (X; \gamma). Our result about this stable topology is a parameterized
version of the theorem of Madsen and Weiss proving a generalization of the
Mumford conjecture on the stable cohomology of mapping class groups. Our second
result describes a stable range in which the homology of S_{g,n} (X; \gamma) is
isomorphic to the stable homology. Finally we prove a stability theorem about
the homology of mapping class groups with certain families of twisted
coefficients. The second and third theorems are generalizations of stability
theorems of Harer and Ivanov.
","[{""version"":""v1"",""created"":""Tue, 31 Jan 2006 04:55:15 GMT""},{""version"":""v2"",""created"":""Sat, 25 Mar 2006 17:50:44 GMT""},{""version"":""v3"",""created"":""Thu, 8 Mar 2007 20:07:00 GMT""},{""version"":""v4"",""created"":""Thu, 4 Sep 2008 19:01:35 GMT""}]","2009-09-29"
"math/0601751","A. Rod Gover","A. Rod Gover and Josef Silhan","The conformal Killing equation on forms -- prolongations and
  applications","37 pages","Differ.Geom.Appl.26:244-266,2008","10.1016/j.difgeo.2007.11.014",,"math.DG math-ph math.MP",,"  We construct a conformally invariant vector bundle connection such that its
equation of parallel transport is a first order system that gives a
prolongation of the conformal Killing equation on differential forms. Parallel
sections of this connection are related bijectively to solutions of the
conformal Killing equation. We construct other conformally invariant
connections, also giving prolongations of the conformal Killing equation, that
bijectively relate solutions of the conformal Killing equation on $k$-forms to
a twisting of the conformal Killing equation on (k - l)-forms for various
integers l. These tools are used to develop a helicity raising and lowering
construction in the general setting and on conformally Einstein manifolds.
","[{""version"":""v1"",""created"":""Tue, 31 Jan 2006 05:10:57 GMT""}]","2008-11-26"
"math/0601752","Alan Weinstein","Alan Weinstein","The Integration Problem for Complex Lie Algebroids","21 pages",,,,"math.DG",,"  A complex Lie algebroid is a complex vector bundle over a smooth (real)
manifold M with a bracket on sections and an anchor to the complexified tangent
bundle of M which satisfy the usual Lie algebroid axioms. A proposal is made
here to integrate analytic complex Lie algebroids by using analytic
continuation to a complexification of M and integration to a holomorphic
groupoid. A collection of diverse examples reveal that the holomorphic stacks
presented by these groupoids tend to coincide with known objects associated to
structures in complex geometry. This suggests that the object integrating a
complex Lie algebroid should be a holomorphic stack.
","[{""version"":""v1"",""created"":""Tue, 31 Jan 2006 06:22:34 GMT""}]","2007-05-23"
"math/0601753","Alexander Movchan","Vladimir Maz'ya, Alexander B. Movchan","Uniform asymptotic formulae for Green's kernels in regularly and
  singularly perturbed domains","9 pages",,,,"math.AP",,"  Asymptotic formulae for Green's kernels $G_\epsilon({\bf x}, {\bf y})$ of
various boundary value problems for the Laplace operator are obtained in
regularly perturbed domains and certain domains with small singular
perturbations of the boundary, as $\epsilon \to 0$. The main new feature of
these asymptotic formulae is their uniformity with respect to the independent
variables ${\bf x}$ and ${\bf y}$.
","[{""version"":""v1"",""created"":""Tue, 31 Jan 2006 08:42:27 GMT""},{""version"":""v2"",""created"":""Sun, 12 Feb 2006 20:26:09 GMT""},{""version"":""v3"",""created"":""Tue, 27 Jun 2006 12:36:43 GMT""}]","2007-05-23"
"math/0601754","Olivier Biquard","Olivier Biquard","Sur les varietes CR de dimension 3 et les twisteurs","Minor corrections. To appear in: Annales de l'Institut Fourier",,,,"math.DG",,"  We prove that any real analytic strictly pseudoconvex CR 3-manifold is the
boundary (at infinity) of a unique selfdual Einstein metric defined in a
neighborhood. The proof uses a new construction of twistor space based on
singular rational curves.
","[{""version"":""v1"",""created"":""Tue, 31 Jan 2006 09:38:26 GMT""},{""version"":""v2"",""created"":""Mon, 16 Oct 2006 12:23:44 GMT""}]","2007-05-23"
"math/0601755","Wieslaw Bajguz","Wieslaw Bajguz","Graph and Union of Graphs Compositions","5 pages",,,,"math.CO cs.DM",,"  Knopfmacher et all [1] was introduced the graph compositions` notion. In this
note we add to these a new construction of tree-like graphs where nodes are
graphs themselves. The first examples of these tree-like compositions, a
corresponding theorem and resulting conclusions are provided.
","[{""version"":""v1"",""created"":""Tue, 31 Jan 2006 09:56:08 GMT""}]","2008-02-10"
"math/0601756","Antonio Montes","Josep M. Brunat, Antonio Montes","A polynomial generalization of the power-compositions determinant","11 pages, see also http://www-ma2.upc.edu/~montes/",,,"MA2-IR-06-00005","math.CO",,"  Let $C(n,p)$ be the set of $p$-compositions of an integer $n$, i.e., the set
of $p$-tuples $\bm{\alpha}=(\alpha_1,...,\alpha_p)$ of nonnegative integers
such that $\alpha_1+...+\alpha_p=n$, and $\mathbf{x}=(x_1,...,x_p)$ a vector of
indeterminates. For $\bm{\alpha}$ and ${\bm{\beta}}$ two $p$-compositions of
$n$, define $(\mathbf{x}+\bm{\alpha})^{\bm{\beta}} =
(x_1+\alpha_1)^{\beta_1}... x_p+\alpha_p)^{\beta_p}$. In this paper we prove an
explicit formula for the determinant $\det_{\bm{\alpha},{\bm{\beta}}\in
C(n,p)}((\mathbf{x}+\bm{\alpha})^{\bm{\beta}})$. In the case $x_1=...=x_p$ the
formula gives a proof of a conjecture by C.~Krattenthaler.
","[{""version"":""v1"",""created"":""Tue, 31 Jan 2006 10:38:36 GMT""}]","2007-05-23"
"math/0601758","Julien Bichon","Teodor Banica, Julien Bichon","Quantum automorphism groups of vertex-transitive graphs of order $\leq
  11$","20 pages, final version","J. Algebraic Combin. 26 (2007), 83-105",,,"math.QA math.CO",,"  We study quantum automorphism groups of vertex-transitive graphs having less
than 11 vertices. With one possible exception, these can be obtained from
cyclic groups ${\mathbb Z}_n$, symmetric groups $S_n$ and quantum symmetric
groups $\mathcal Q_n$, by using various product operations. The exceptional
case is that of the Petersen graph, and we present some questions about it.
","[{""version"":""v1"",""created"":""Tue, 31 Jan 2006 10:39:44 GMT""},{""version"":""v2"",""created"":""Mon, 10 Jul 2006 11:51:48 GMT""},{""version"":""v3"",""created"":""Wed, 22 Nov 2006 08:15:56 GMT""}]","2007-08-30"
"math/0601759","Pablo Su\'arez-Serrato","Pablo Su\'arez-Serrato","Minimal entropy and geometric decompositions in dimension four","38 pages, corrected flat case; Theorem A is now in terms of
  F-structures, improved exposition; new final section collects all results
  needed for the proofs of the main theorems","Algebr. Geom. Topol. 9 (2009) 365-395","10.2140/agt.2009.9.365",,"math.GT math.DG",,"  We show vanishing results about the infimum of the topological entropy of the
geodesic flow of homogeneous smooth four manifolds. We prove that any closed
oriented geometric four manifold has zero minimal entropy if and only if it has
zero simplicial volume. We also show that if a four manifold M admits a
geometric decomposition, in the sense of Thurston, and does not have geometric
pieces modelled on hyperbolic four-space, the complex hyperbolic plane or the
product of two hyperbolic planes, then M admits an F-structure. It follows that
M has zero minimal entropy and collapses with curvature bounded from below. We
then analyse whether or not M admits a metric whose topological entropy
coincides with the minimal entropy of M and provide new examples of manifolds
for which the minimal entropy problem cannot be solved.
","[{""version"":""v1"",""created"":""Tue, 31 Jan 2006 10:45:15 GMT""},{""version"":""v2"",""created"":""Thu, 17 May 2007 16:28:29 GMT""},{""version"":""v3"",""created"":""Fri, 2 May 2008 14:48:36 GMT""}]","2014-10-01"
"math/0601760","Lando Sergei K.","M. E. Kazarian, S. K. Lando","An algebro-geometric proof of Witten's conjecture","12 pages, no figures",,"10.1090/S0894-0347-07-00566-8",,"math.AG",,"  We present a new proof of Witten's conjecture. The proof is based on the
analysis of the relationship between intersection indices on moduli spaces of
complex curves and Hurwitz numbers enumerating ramified coverings of the
2-sphere.
","[{""version"":""v1"",""created"":""Tue, 31 Jan 2006 11:35:49 GMT""}]","2015-06-26"
"math/0601761","Janusz Grabowski","Janusz Grabowski","Courant-Nijenhuis tensors and generalized geometries","10 pages","Monograf\'ias de la Real Academia de Ciencias de Zaragoza 29
  (2006), 101--112",,,"math.DG math-ph math.MP",,"  Nijenhuis tensors $N$ on Courant algebroids compatible with the pairing are
studied. This compatibility condition turns out to be of the form $N+N^*=aI$
for irreducible Courant algebroids, in particular for the extended tangent
bundles $TM\oplus T^*M$. It is proved that compatible Nijenhuis tensors on
irreducible Courant algebroids must satisfy quadratic relations $N^2-aN+bI=0$,
so that the corresponding hierarchy is very poor. The particular case $N^2=-I$
is associated with Hitchin's generalized geometries and the cases $N^2=I$ and
$N^2=0$ -- to other ""generalized geometries"". These concepts find a natural
description in terms of supersymplectic Poisson brackets on graded
supermanifolds.
","[{""version"":""v1"",""created"":""Tue, 31 Jan 2006 11:45:03 GMT""}]","2007-05-23"
"math/0601762","Jason Lotay","Jason Lotay","Coassociative 4-folds with Conical Singularities","48 pages","Communications in Analysis and Geometry, Volume 15, Number 5
  (2007), 891-946",,,"math.DG",,"  This paper is dedicated to the study of deformations of coassociative 4-folds
in a G_2 manifold which have conical singularities. We stratify the types of
deformations allowed into three problems. The main result for each problem
states that the moduli space is locally homeomorphic to the kernel of a smooth
map between smooth manifolds. In each case, the map in question can be
considered as a projection from the infinitesimal deformation space onto the
obstruction space. Thus, when there are no obstructions the moduli space is a
smooth manifold. Furthermore, we calculate a lower bound on the expected
dimension of the moduli space. Finally we show that, in weakening the condition
on the G_2 structure of the ambient 7-manifold, there is a generic smoothness
result for the moduli spaces of deformations corresponding to our second and
third problems.
","[{""version"":""v1"",""created"":""Tue, 31 Jan 2006 11:59:31 GMT""}]","2008-05-20"
"math/0601763","Antonio Montes","Montserrat Manubens, Antonio Montes","Improving DISPGB Algorithm Using the Discriminant Ideal","21 pages, see also http://www-ma2.upc.edu/~montes/","Journal of Symbolic Computation 41 (2006) 1245-1263","10.1016/j.jsc.2005.09.013","MA2-IR-04-00015","math.AC",,"  In 1992, V. Weispfenning proved the existence of Comprehensive Groebner Bases
(CGB) and gave an algorithm to compute one. That algorithm was not very
efficient and not canonical. Using his suggestions, A. Montes obtained in 2002
a more efficient algorithm (DISPGB) for Discussing Parametric Groebner Bases.
Inspired in its philosophy, V. Weispfenning defined, in 2002, how to obtain a
Canonical Comprehensive Groebner Basis (CCGB) for parametric polynomial ideals,
and provided a constructive method.
  In this paper we use Weispfenning's CCGB ideas to make substantial
improvements on Montes DISPGB algorithm. It now includes rewriting of the
discussion tree using the Discriminant Ideal and provides a compact and
effective discussion. We also describe the new algorithms in the DPGB library
containing the improved DISPGB as well as new routines to check whether a given
basis is a CGB or not, and to obtain a CGB. Examples and tests are also
provided.
","[{""version"":""v1"",""created"":""Tue, 31 Jan 2006 12:00:28 GMT""}]","2007-05-23"
"math/0601764","Jason Lotay","Jason Lotay","Calibrated Submanifolds of R^7 and R^8 with Symmetries","21 pages, minor corrections, section added containing further systems
  of differential equations defining calibrated submanifolds","Q J Math, March 2007; 58: 53 - 70.","10.1093/qmath/hal015",,"math.DG",,"  The principal theory of this paper comprises a technique for constructing
associative, coassociative and Cayley submanifolds of Euclidean space with
symmetries, using first-order ordinary differential equations. Explicit
examples of U(1)-invariant associative cones in R^7 and SU(2)-invariant Cayley
4-folds in R^8 are then produced using this method. Further examples of
associative 3-folds are presented, which are ruled, and other systems of
differential equations defining calibrated submanifolds in R^7 and R^8 are
given.
","[{""version"":""v1"",""created"":""Tue, 31 Jan 2006 12:19:42 GMT""},{""version"":""v2"",""created"":""Tue, 16 Jan 2007 16:06:45 GMT""}]","2008-03-04"
"math/0601765","Wolfgang Ziller","K.Grove, B.Wilking, L.Verdiani, W.Ziller","Non-negative curvature obstructions in cohomogeneity one and the
  Kervaire spheres","10 pages",,,,"math.DG",,"  In contrast to the homogeneous case, we show that there are compact
cohomogeneity one manifolds, that do not support invariant metrics of
non-negative sectional curvature. In fact we exhibit infinite families of such
manifolds including the exotic Kervaire spheres. Such examples exist for any
codimension of the singular orbits except for the case where both are equal to
two, where existence of non-negatively curved metrics is known.
","[{""version"":""v1"",""created"":""Tue, 31 Jan 2006 12:19:45 GMT""}]","2007-05-23"
"math/0601766","Abdenacer Makhlouf","Abdenacer Makhlouf","A comparison of deformations and geometric study of associative algebras
  varieties",,,,,"math.RA",,"  The aim of this paper is to give an overview and to compare the different
deformation theories of algebraic structures. We describe in each case the
corresponding notions of degeneration and rigidity. We illustrate these notions
with examples and give some general properties. The last part of this work
shows how these notions help in the study of associative algebras varieties.
The first and popular deformation approach was introduced by M. Gerstenhaber
for rings and algebras using formal power series. A noncommutative version was
given by Pinczon and generalized by F. Nadaud. A more general approach called
global deformation follows from a general theory of Schlessinger and was
developed by A. Fialowski in order to deform infinite dimensional nilpotent Lie
algebras. In a Nonstandard framework, M.Goze introduced the notion of
perturbation for studying the rigidity of finite dimensional complex Lie
algebras. All these approaches has in common the fact that we make an
""extension"" of the field. These theories may be applied to any multilinear
structure. We shall be concerned in this paper with the category of associative
algebras.
","[{""version"":""v1"",""created"":""Tue, 31 Jan 2006 12:28:29 GMT""}]","2007-05-23"
"math/0601767","Stefan Felsner","Stefan Felsner","Empty Rectangles and Graph Dimension",,,,,"math.CO",,"  We consider rectangle graphs whose edges are defined by pairs of points in
diagonally opposite corners of empty axis-aligned rectangles. The maximum
number of edges of such a graph on $n$ points is shown to be 1/4 n^2 +n -2.
This number also has other interpretations:
  * It is the maximum number of edges of a graph of dimension
$\bbetween{3}{4}$, i.e., of a graph with a realizer of the form
$\pi_1,\pi_2,\ol{\pi_1},\ol{\pi_2}$.
  * It is the number of 1-faces in a special Scarf complex.
  The last of these interpretations allows to deduce the maximum number of
empty axis-aligned rectangles spanned by 4-element subsets of a set of $n$
points. Moreover, it follows that the extremal point sets for the two problems
coincide.
  We investigate the maximum number of of edges of a graph of dimension
$\between{3}{4}$, i.e., of a graph with a realizer of the form
$\pi_1,\pi_2,\pi_3,\ol{\pi_3}$. This maximum is shown to be $1/4 n^2 + O(n)$.
  Box graphs are defined as the 3-dimensional analog of rectangle graphs. The
maximum number of edges of such a graph on $n$ points is shown to be $7/16 n^2
+ o(n^2)$.
","[{""version"":""v1"",""created"":""Tue, 31 Jan 2006 12:40:07 GMT""}]","2007-05-23"
