"astro-ph/0610178","Craig DeForest","C. E. DeForest","On the Size of Structures in the Solar Corona","To appear in APJ, June 2007; as accepted Feb 2007","Astrophys.J.661:532-542,2007","10.1086/515561",,"astro-ph",,"  Fine-scale structure in the corona appears not to be well resolved by current
imaging instruments. Assuming this to be true offers a simple geometric
explanation for several current puzzles in coronal physics, including: the
apparent uniform cross-section of bright threadlike structures in the corona;
the low EUV contrast (long apparent scale height) between the top and bottom of
active region loops; and the inconsistency between loop densities derived by
spectral and photometric means. Treating coronal loops as a mixture of diffuse
background and very dense, unresolved filamentary structures address these
problems with a combination of high plasma density within the structures, which
greatly increases the emissivity of the structures, and geometric effects that
attenuate the apparent brightness of the feature at low altitudes. It also
suggests a possible explanation for both the surprisingly high contrast of EUV
coronal loops against the coronal background, and the uniform ``typical''
height of the bright portion of the corona (about 0.3 solar radii) in full-disk
EUV images. Some ramifications of this picture are discussed, including an
estimate (10-100 km) of the fundamental scale of strong heating events in the
corona.
","[{""version"":""v1"",""created"":""Fri, 6 Oct 2006 17:21:53 GMT""},{""version"":""v2"",""created"":""Fri, 19 Jan 2007 05:13:03 GMT""},{""version"":""v3"",""created"":""Thu, 22 Feb 2007 21:23:05 GMT""}]","2011-02-11"
"astro-ph/0610205","Sebastien Lepine","Howard H. Lanning and S\'ebastien L\'epine","Proper Motions of Faint UV-Bright Sources in the Sandage Two-color
  Survey of the Galactic Plane","15 pages, to appear in Publications of the Astronomical Society of
  the Pacific",,"10.1086/510098",,"astro-ph",,"  Proper motions with values >10 mas/yr or <-10 mas/yr have been extracted from
the USNO-B1.0 and Tycho II catalogues for all Lanning UV-bright sources
identified in the Sandage Two-color Survey of the Galactic Plane and presented
in Papers I-VI. Of the 572 sources examined, we find at least 213 which exhibit
a significantly large proper motion. Based on the location of the sources in a
reduced proper motion diagram, we demonstrate that about two thirds of the high
proper motion sources are likely or very likely to be heretofore unidentified
white dwarfs.
","[{""version"":""v1"",""created"":""Fri, 6 Oct 2006 16:44:12 GMT""}]","2009-11-11"
"astro-ph/0610206","Letizia Stanghellini","Letizia Stanghellini","Planetary nebulae as probes of the chemical impact of AGB stars","Invited review, ""Why galaxies care about AGB stars"", Vienna, August
  7-11, 2006",,,,"astro-ph",,"  Planetary nebulae (PN) represent the evolutionary fate of the asymptotic
giant branch (AGB) stellar envelopes, thus are ideally suited to study the
chemical impact of AGB stars. Stellar evolution predict elemental enrichment
through the AGB evolution, and convective dredge-up episodes allow the products
of stellar evolution to reach the stellar outer layers. Planetary nebulae are
probes of these processes, and are also probes of the environment at the time
of formation of their progenitors, through the elements not affected by AGB
evolution. Ultimately PN may be used to test AGB stars as actors and probes.
Planetary nebulae are easily identified and detected in the galaxy, the
Magellanic Clouds, and beyond, thus they are probes of AGB evolution an stellar
populations in different environments as well.
","[{""version"":""v1"",""created"":""Fri, 6 Oct 2006 16:39:57 GMT""},{""version"":""v2"",""created"":""Tue, 10 Oct 2006 18:06:45 GMT""}]","2007-05-23"
"astro-ph/0610207","Aglae Kellerer","A. Kellerer, A. Tokovinin","Atmospheric coherence times in interferometry: definition and
  measurement","8 pages, 6 figures, A&A in press",,"10.1051/0004-6361:20065788",,"astro-ph",,"  Current and future ground-based interferometers require knowledge of the
atmospheric time constant t_0, but this parameter has diverse definitions.
Moreover, adequate techniques for monitoring t_0 still have to be implemented.
  We derive a new formula for the structure function of the fringe phase
(piston) in a long-baseline interferometer, and review available techniques for
measuring the atmospheric time constant and the shortcomings.
  It is shown that the standard adaptive-optics atmospheric time constant is
sufficient for quantifying the piston coherence time, with only minor
modifications. The residual error of a fast fringe tracker and the loss of
fringe visibility in a finite exposure time are calculated in terms of the same
parameter. A new method based on the fast variations of defocus is proposed.
The formula for relating the defocus speed to the time constant is derived.
Simulations of a 35-cm telescope demonstrate the feasibility of this new
technique for site testing.
","[{""version"":""v1"",""created"":""Fri, 6 Oct 2006 16:57:20 GMT""}]","2016-08-31"
"astro-ph/0610208","Floyd Stecker","F. W. Stecker","Upper Limits to Fluxes of Neutrinos and Gamma-Rays from Starburst
  Galaxies","4 pages, for Proc. TeV2 Conf., Madison, WI, to be published in J.
  Phys","J.Phys.Conf.Ser.60:215-218,2007","10.1088/1742-6596/60/1/045",,"astro-ph hep-ph",,"  Loeb and Waxman have argued that high energy neutrinos from the decay of
pions produced in interactions of cosmic rays with interstellar gas in
starburst galaxies would be produced with a large enough flux to be observable.
Here we obtain an upper limit to the diffuse neutrino flux from starburst
galaxies which is a factor of $\sim$5 lower than the flux which they predict.
Compared with predicted fluxes from other extragalactic high energy neutrino
sources, starburst neutrinos with $\sim$ PeV energies would have a flux
considerably below that predicted for AGN models. We also estimate an upper
limit for the diffuse GeV $\gamma$-ray flux from starbust galaxies to be
$\cal{O}$$(10^{-2})$ of the observed $\gamma$-ray background, much less than
the component from unresolved blazars.
","[{""version"":""v1"",""created"":""Fri, 6 Oct 2006 18:23:04 GMT""}]","2008-11-26"
"astro-ph/0610209","William Wall","W. F. Wall","Rethinking the N(H2)/I(CO) Conversion Factor","A very short and incomplete version of this appears in RMAA, 42, 117.
  Given that is a first draft, comments are appreciated. This first draft was
  updated - I removed an unnecessary warning on the first page. In the third
  revision I fixed some typos and beefed up the motivation: This is the first
  major improvement in understanding the X-factor since the '80s because it
  includes radiative transfer ... etc The fourth version is the same as the
  third version but I accidentally left an unnecessary warning in that version.
  The fourth version is free of that","Mon.Not.Roy.Astron.Soc.379:674-688,2007","10.1111/j.1365-2966.2007.11968.x",,"astro-ph",,"  An improved formulation for the X-factor is proposed. The statement that the
velocity-integrated radiation temperature of the $\COone$ line, $I(\CO)$,
``counts'' optically thick clumps is quantified using the formalism of
\citet{Martin84} for line emission in a clumpy cloud. Adopting the simplifying
assumptions of thermalized $\COone$ line emission and isothermal gas, an
effective optical depth, $\tef$, is defined as the product of the clump filling
factor within each velocity interval and the clump effective optical depth as a
function of the optical depth on the clump's central sightline, $\tau_0$. The
clump effective optical depth is well approximated as a power law in $\tau_0$
with power-law index, $\epsilon$, referred to here as the clump ``fluffiness,''
and has values between zero and unity. While the $\COone$ line is optically
thick within each clump (i.e., high $\tau_0$), it is optically thin ``to the
clumps'' (i.e., low $\tef$). Thus the dependence of $I(CO)$ on $\tef$ is
linear, resulting in an X-factor that depends only on clump properties and {\it
not} directly on the entire cloud. Assuming virialization of the clumps yields
an expression for the X-factor whose dependence on physical parameters like
density and temperature is ``softened'' by power-law indices of less than unity
that depend on the fluffiness parameter, $\epsilon$. The X-factor provides
estimates of gas column density because each sightline within the beam has
optically thin gas within certain narrow velocity ranges. Determining column
density from the optically thin gas is straightforward and parameters like
$\epsilon$ then allow extrapolation of the column density of the optically thin
gas to that of all the gas.
","[{""version"":""v1"",""created"":""Fri, 6 Oct 2006 19:06:52 GMT""},{""version"":""v2"",""created"":""Fri, 20 Oct 2006 21:18:39 GMT""},{""version"":""v3"",""created"":""Thu, 1 Mar 2007 20:49:34 GMT""}]","2008-11-26"
"astro-ph/0610210","David Seery","David Seery, James E. Lidsey and Martin S. Sloth","The inflationary trispectrum","23 pages, 2 diagrams drawn with feynmp.sty, uses iopart.cls. v2,
  replaced with version accepted by JCAP. Estimate of maximal tau_NL refined in
  Section 5, resulting in smaller numerical value. Sign errors in Eq. (44) and
  Eq. (48) corrected. Some minor notational changes","JCAP 0701:027,2007","10.1088/1475-7516/2007/01/027",,"astro-ph gr-qc hep-th",,"  We calculate the trispectrum of the primordial curvature perturbation
generated by an epoch of slow-roll inflation in the early universe, and
demonstrate that the non-gaussian signature imprinted at horizon crossing is
unobservably small, of order tau_NL < r/50, where r < 1 is the tensor-to-scalar
ratio. Therefore any primordial non-gaussianity observed in future microwave
background experiments is likely to have been synthesized by gravitational
effects on superhorizon scales. We discuss the application of Maldacena's
consistency condition to the trispectrum.
","[{""version"":""v1"",""created"":""Fri, 6 Oct 2006 19:14:21 GMT""},{""version"":""v2"",""created"":""Tue, 30 Jan 2007 12:16:50 GMT""}]","2010-10-27"
"astro-ph/0610211","Mark C. Neyrinck","Mark C. Neyrinck and Istv\'an Szapudi","Information content in the halo-model dark-matter power spectrum II:
  Multiple cosmological parameters","6 pages, 4 figures (1 clarified), MNRAS Letters, in press. Minor
  changes, suggested by referee","Mon.Not.Roy.Astron.Soc.375:L51-L55,2007","10.1111/j.1745-3933.2006.00275.x",,"astro-ph",,"  We investigate the cosmological Fisher information in the non-linear
dark-matter power spectrum in the context of the halo model. We find that there
is a plateau in information content on translinear scales which is generic to
all cosmological parameters we tried. There is a rise in information on smaller
scales, but we find that it is quite degenerate among different cosmological
parameters (except, perhaps, the tilt). This suggests that it could be
difficult to constrain cosmological parameters using the non-linear regime of
the dark-matter power spectrum. We suggest ways to get around this problem,
such as removing the largest haloes from consideration in survey analysis.
","[{""version"":""v1"",""created"":""Fri, 6 Oct 2006 20:02:39 GMT""},{""version"":""v2"",""created"":""Tue, 23 Jan 2007 23:09:51 GMT""}]","2016-08-15"
"astro-ph/0610213","Zhaoming Ma Mr.","Zhaoming Ma","The nonlinear matter power spectrum","Reference added, minor changes, accepted by ApJ","Astrophys.J.665:887-898,2007","10.1086/519440",,"astro-ph",,"  We modify the public PM code developed by Anatoly Klypin and Jon Holtzman to
simulate cosmology with arbitrary initial power spectrum and equation of state
of dark energy. With this tool in hand, we perform the following studies on the
matter power spectrum.
  With an artificial sharp peak at k~0.2 h/Mpc in the initial power spectrum,
we find that the position of the peak is not shifted by nonlinear evolution. We
also find that the existence of a peak in the linear power spectrum would boost
the nonlinear power at all scales evenly. This is contrary to what HKLM scaling
relation predicts, but roughly consistent with that of halo model.
  We construct two dark energy models with the same linear power spectra today
but different linear growth histories. We demonstrate that their nonlinear
power spectra differ at the level of the maximum deviation of the corresponding
linear power spectra in the past. Similarly, two constructed dark energy models
with the same growth histories result in consistent nonlinear power spectra.
This is hinting, not a proof, that linear power spectrum together with linear
growth history uniquely determine the nonlinear power spectrum. Based on these
results, we propose that linear growth history be included in the next
generation fitting formulas of nonlinear power spectrum. (abridged)
","[{""version"":""v1"",""created"":""Fri, 6 Oct 2006 20:13:55 GMT""},{""version"":""v2"",""created"":""Tue, 1 May 2007 13:56:56 GMT""}]","2011-02-11"
"astro-ph/0610214","Sandy Leggett","S. K. Leggett, D. Saumon, M. S. Marley, T. R. Geballe, D. A.
  Golimowski, D. Stephens, X. Fan","3.6-7.9 um Photometry of L and T Dwarfs and the Prevalence of Vertical
  Mixing in their Atmospheres","Accepted for publication in the Astrophysical Journal; 21 pages, 8
  Figures, 3 Tables","Astrophys.J.655:1079-1094,2007","10.1086/510014",,"astro-ph",,"  We present new L' (3.75 um) photometry of six L and T dwarfs, and M' (4.70
um) photometry of ten L and T dwarfs, observed at Gemini Observatory, and new
3.55, 4.49, 5.73 and 7.87 um photometry of nine L and T dwarfs, obtained with
the Spitzer Space Telescope. The sample includes unusually blue and red dwarfs
from our near-infrared studies. The data are combined with published L', M' and
Spitzer photometry of L and T dwarfs, and trends of colors with spectral type
and other colors are examined. Model atmospheres by Marley and Saumon are used
to generate synthetic colors for ranges of effective temperature, gravity,
grain sedimentation efficiency, metallicity and vertical mixing efficiency. We
explore how these parameters affect the mid-infrared colors of L and T dwarfs
and find that the data are modelled satisfactorily only if substantial vertical
mixing occurs in both L- and T-dwarf atmospheres. The location and range of the
L and T dwarf sequences in IRAC color-color and color - magnitude diagrams is
also only reproduced if this mixing occurs, with a range of efficiency
described by K_zz ~ 10^2-10^6 cm^2/s. The colors of the unusually red dwarfs
are best reproduced by non-equilibrium models with low sedimentation
efficiency, i.e. thick cloud decks, and those of the unusually blue dwarfs by
non-equilibrium models with high sedimentation efficiency, i.e. thin cloud
decks. The K-L' and Spitzer [3.55]-[4.49] colors can be used as indicators of
effective temperature for L and T dwarfs, but care must be taken to include
gravity and metallicity effects for late-T dwarfs and vertical mixing for both
late-L and T dwarfs.
","[{""version"":""v1"",""created"":""Fri, 6 Oct 2006 20:29:57 GMT""}]","2008-11-26"
"astro-ph/0610215","Curtis Struck","Curtis Struck","Triggering and Tempering Star Formation in Colliding Galaxies","4 pgs., 1 fig., for proceedings of Studying Galaxy Evolution with
  Spitzer and Herschel, eds. V. Charmandaris, D. Rigopoulou & N. Kylafis",,,,"astro-ph",,"  Recent observational literature suggests that only a small number of
colliding galaxies show substantial star formation enhancements before merging.
Most have SFRs comparable to those of late-type field galaxies. Preliminary
Spitzer studies (with data from the Spirals, Bridges and Tails and SINGs
projects) generally confirm this, though with some caveats. If star formation
in isolated disks is self-regulated, while collisions disequilibrate much of
the disk, then the similarity to star-formation in isolated disks is
surprising. Comparisons of observations and dynamical models suggest some
resolutions to this paradox, including the role of downsizing. The interesting
example of the Arp 82 system is presented.
","[{""version"":""v1"",""created"":""Fri, 6 Oct 2006 20:37:54 GMT""}]","2007-05-23"
"astro-ph/0610216","Jasper Wall","J. V. Wall","Steep functions in astronomy: the RQSO z-cutoff debate","Presented at 'Statistical Challenges in Modern Astronomy - IV', Penn
  State, May 2006; to appear in the conference proceedings edited by G. J. Babu
  and E. D. Feigelson, 2 pages, 2 figures",,,,"astro-ph",,"  Astronomers traditionally find steep, open-ended functions difficult: the log
N - log S curve for example, or the probability-area-radius relation in making
cross-waveband identifications. The debate over the existence of a redshift
cutoff for RQSOs (radio-loud QSOs; Jarvis and Rawlings 2000, Wall et al. 2005)
is a case in point: an instance in which a second-order effect involving
radio-variable QSOs, initially selected by survey from a population with a
steep source count, leads to discrepant results from different analyses. A
redshift cutoff is present in optically-selected QSOs of the SDSS and in X-ray
selected QSOs of XMM, ROSAT and CHANDRA. A similar cutoff for radio-loud QSOs
is important to establish, because if present, no known type of obscuration can
be responsible. Such a space-density diminution then defines an epoch of
creation for galaxy hosts of massive black holes powering AGN, a datum for
galaxy formation. I discuss the resolution of the debate: the issue is highly
relevant to modern surveys and their follow-up observations.
","[{""version"":""v1"",""created"":""Fri, 6 Oct 2006 20:38:03 GMT""}]","2007-05-23"
"astro-ph/0610217","Curtis Struck","Curtis Struck","Star Formation in Mergers and Interacting Galaxies: Gathering the Fuel","6 pgs., 2 figs., proceedings of IAU Symp. 237, Triggered Star
  Formation in a Turbulent ISM, eds. B. G. Elmegreen & J. Palous",,"10.1017/S1743921307001664",,"astro-ph",,"  Selected results from recent studies of star formation in galaxies at
different stages of interaction are reviewed. Recent results from the Spitzer
Space Telescope are highlighted. Ideas on how large-scale driving of star
formation in interacting galaxies might mesh with our understanding of star
formation in isolated galaxies and small scale mechanisms within galaxies are
considered. In particular, there is evidence that on small scales star
formation is determined by the same thermal and turbulent processes in cool
compressed clouds as in isolated galaxies. If so, this affirms the notion that
the primary role of large-scale dynamics is to gather and compress the gas
fuel. In gas-rich interactions this is generally done with increasing
efficiency through the merger process.
","[{""version"":""v1"",""created"":""Fri, 6 Oct 2006 20:58:57 GMT""}]","2009-11-11"
"astro-ph/0610218","Lee Armus","L. Armus, V. Charmandaris, J. Bernard-Salas, H.W.W. Spoon, J.A.
  Marshall, S.J.U Higdon, V. Desai, H.I. Teplitz, L. Hao, D. Devost, B.R.
  Brandl, Y. Wu, G.C. Sloan, B.T. Soifer, J.R. Houck, T.L. Herter","Observations of Ultraluminous Infrared Galaxies with the Infrared
  Spectrograph on the Spitzer Space Telescope II: The IRAS Bright Galaxy Sample","accepted for publication in the Astrophysical Journal","Astrophys.J.656:148-167,2007","10.1086/510107",,"astro-ph",,"  We present spectra taken with the Infrared Spectrograph on Spitzer covering
the 5-38 micron region of the ten Ultraluminous Infrared Galaxies (ULIRGs)
found in the IRAS Bright Galaxy Sample. Among the BGS ULIRGs, we find a factor
of 50 spread in the rest-frame mid to far-infrared spectral slope. The 9.7
micron silicate optical depths range from less than 0.4 more than 4.2, implying
line of sight extinctions of A(V) ~ 8 - 78 mag. There is evidence for water ice
and hydrocarbon absorption and C2H2 and HCN absorption features in four and
possibly six of the 10 BGS ULIRGs, indicating shielded molecular clouds and a
warm, dense ISM. We have detected [NeV] emission in three of the ten BGS
ULIRGs, at flux levels of 5-18E-14 erg/cm^2/sec and [NeV] 14.3/[NeII] 12.8 line
flux ratios of 0.12-0.85. The remaining BGS ULIRGs have limits on their
[NeV]/[NeII] line flux ratios which range from less than 0.15 to less than
0.01. Among the BGS ULIRGs, the AGN fractions implied by either the
[NeV]/[NeII] or [OIV]/[NeII] line flux ratios (or their upper limits) are
significantly lower than implied by the MIR slope or EQW of the 6.2 micron PAH
feature. Fitting the SEDs, we see evidence for hot (T > 300K) dust in five of
the BGS ULIRGs, with the fraction of hot dust to total dust luminosity ranging
from ~1-23%, before correcting for extinction. When integrated over the IRAC-8,
IRS blue peakup, and MIPS-24 filter bandpasses, the IRS spectra imply very blue
colors for some ULIRGs at z ~ 1.3. This is most extreme for sources with
significant amounts of warm dust and deep silicate absorption.
","[{""version"":""v1"",""created"":""Fri, 6 Oct 2006 21:37:12 GMT""}]","2010-04-06"
"astro-ph/0610219","Huw Morgan","Huw Morgan, S. Rifai Habbal","An Empirical 3D Model of the Large-scale Coronal Structure Based on the
  Distribution of Prominences on the Solar Disk",,,"10.1051/0004-6361:20066482",,"astro-ph",,"  Despite the wealth of solar data currently available, the explicit connection
between coronal streamers and features on the solar disk remains unresolved. An
empirical three-dimensional model, which reproduces the evolution of the
large-scale coronal structure starting from the solar surface, is presented.
The model is based on the view that the source of the large-scale coronal
structure, namely streamers, is a consequence of the evolution of twisted
sheet-like structures originating from prominences (or, equivalently,
filaments) at the base of the corona. The high-density sheets evolve and merge
with height into a final radial configuration constrained by the oberved
position of streamers stalks higher up in the corona. The observational
constraints are provided by white light observations from the LASCO/C2 data
during the declining phase of solar activity, spanning the end of Carrington
Rotation (CR) 2005 and the start of CR 2006, i.e. July-August 2003, and the
position of filaments from the corresponding H$\alpha$ synoptic maps of the
Paris-Meudon Observatory. The 3D model thus derived yields a reasonable
agreement with the observed large-scale coronal structure, in particular the
shape of large helmet streamers. These results give confidence in the
underlying assumption that large helmet streamers can be the result of the
convergence of two or more sheet-like structures originating from a
distribution of prominences on the solar disk. The model supports the view that
streamers, during that time of the solar cycle, are often associated with
multiple current sheets.
","[{""version"":""v1"",""created"":""Fri, 6 Oct 2006 21:58:03 GMT""}]","2009-11-11"
"astro-ph/0610220","Brett Friedman","Brett C. Friedman, Asantha Cooray (UC Irvine), Alessandro Melchiorri
  (Rome U. & INFN, Rome)","WMAP-normalized Inflationary Model Predictions and the Search for
  Primordial Gravitational Waves with Direct Detection Experiments","18 pages, 12 figures. Submitted to PRD. Low resolution figures
  submitted here. A copy with high resolution figures and software to generate
  numerical models can be obtained at http://www.cooray.org/inflation.html","Phys.Rev.D74:123509,2006","10.1103/PhysRevD.74.123509",,"astro-ph",,"  In addition to density perturbations, inflationary models of the early
universe generally predict a stochastic background of gravitational waves or
tensor fluctuations. By making use of the inflationary flow approach for single
field models and fitting the models with Monte-Carlo techniques to cosmic
microwave background (CMB) data from the {\it Wilkinson Microwave Anisotropy
Probe} (WMAP), we discuss the expected properties of the gravitational wave
background from inflation at scales corresponding to direct detection
experiments with laser interferometers in space. We complement the Monte-Carlo
numerical calculations by including predictions expected under several classes
of analytical inflationary models. We find that an improved version of {\it Big
Bang Observer} (BBO-grand) can be used to detect a gravitational wave
background at 0.1 Hz with a corresponding CMB tensor-to-scalar ratio above
10$^{-4}$. Even if the CMB tensor-to-scalar ratio were to be above 10$^{-2}$,
we suggest that BBO-grand will be useful to study inflationary models as the
standard version of BBO, with a sensitivity to a stochastic gravitational wave
background $\Omega_{\rm GW}h^2 > 10^{-17}$, will only allow a marginal
detection of the amplitude while leaving the tensor spectral index at 0.1 Hz
unconstrained. We also discuss the extent to which CMB measurements can be used
to predict the gravitational wave background amplitude in a direct detection
experiment and how any measurement of the amplitude and the spectral tilt of
the gravitational wave background at direct detection frequencies together with
the CMB tensor-to-scalar ratio can be used to establish slow-roll inflation.
","[{""version"":""v1"",""created"":""Fri, 6 Oct 2006 23:51:16 GMT""}]","2008-11-26"
