"astro-ph/0610221","Matthias Rempel","Matthias Rempel (HAO/NCAR, Boulder CO, USA)","Origin of solar torsional oscillations","11 pages, 7 figures. accepted by Astrophys.J","Astrophys.J.655:651-659,2007","10.1086/509866",,"astro-ph",,"  Helioseismology has revealed many details of solar differential rotation and
also its time variation, known as torsional oscillations. So far there is no
generally accepted theoretical explanation for torsional oscillations, even
though a close relation to the solar activity cycle is evident. On the
theoretical side non-kinematic dynamo models (including the Lorentz force
feedback on differential rotation) have been used to explain torsional
oscillations. In this paper we use a slightly different approach by forcing
torsional oscillations in a mean field differential rotation model. Our aim is
not a fully self-consistent model but rather to point out a few general
properties of torsional oscillations and their possible origin that are
independent from a particular dynamo model. We find that the poleward
propagating high latitude branch of the torsional oscillations can be explained
as a response of the coupled differential rotation / meridional flow system to
periodic forcing in mid-latitudes, of either mechanical (Lorentz force) or
thermal nature. The speed of the poleward propagation sets constraints on the
value of the turbulent viscosity in the solar convection zone to be less than
3x10^8 m^2/s. We also show that the equatorward propagating low latitude branch
is very unlikely a consequence of mechanical forcing (Lorentz force) alone, but
rather of thermal origin due to the Taylor-Proudman theorem.
","[{""version"":""v1"",""created"":""Sat, 7 Oct 2006 00:20:26 GMT""}]","2008-11-26"
"astro-ph/0610222","Piet Hut","Piet Hut (IAS, Princeton)","Virtual Laboratories","to appear in Prog. Theor. Phys","Prog.Theor.Phys.Suppl.164:38-53,2007","10.1143/PTPS.164.38",,"astro-ph physics.comp-ph",,"  At the frontier of most areas in science, computer simulations play a central
role. The traditional division of natural science into experimental and
theoretical investigations is now completely outdated. Instead, theory,
simulation, and experimentation form three equally essential aspects, each with
its own unique flavor and challenges. Yet, education in computational science
is still lagging far behind, and the number of text books in this area is
minuscule compared to the many text books on theoretical and experimental
science. As a result, many researchers still carry out simulations in a
haphazard way, without properly setting up the computational equivalent of a
well equipped laboratory. The art of creating such a virtual laboratory, while
providing proper extensibility and documentation, is still in its infancy. A
new approach is described here, Open Knowledge, as an extension of the notion
of Open Source software. Besides open source code, manuals, and primers, an
open knowledge project provides simulated dialogues between code developers,
thus sharing not only the code, but also the motivations behind the code.
","[{""version"":""v1"",""created"":""Sat, 7 Oct 2006 07:19:52 GMT""}]","2008-11-26"
"astro-ph/0610223","Piet Hut","Piet Hut (IAS, Princeton)","Modeling Dense Stellar Systems: Background","to appear in the proceedings for JD06, IAU Highlights of Astronomy,
  Volume 14, ed. K. van der Hucht",,"10.1017/S1743921307011180",,"astro-ph",,"  I provide some background about recent efforts made in modeling dense stellar
systems, within the context of the MODEST initiative. During the last four
years, we have seen more than fifteen MODEST workshops, with an attendance
between twenty and a hundred participants, and topics ranging from very
specialized discussions to rather general overviews.
","[{""version"":""v1"",""created"":""Sat, 7 Oct 2006 07:26:49 GMT""}]","2009-11-11"
"astro-ph/0610224","Giorgio Matt","Giorgio Matt","General Relativity effects and line emission","to appear in Astronomische Nachrichten, Proceedings of the ESAC
  Workshop ""Variable and broad lines around black holes""","Astron.Nachr.327:949-956,2006","10.1002/asna.200610670",,"astro-ph",,"  General Relativity effects (gravitational redshift, light bending, ...)
strongly modify the characteristics of the lines emitted close to the Black
Hole in Active Galactic Nuclei and Galactic Black Hole systems. These effects
are reviewed and illustrated, with particular emphasis on line emission from
the accretion disc. Methods, based on the iron line, to measure the two
astrophysically relevant parameters of a Black Hole, the mass and spin, are
briefly discussed.
","[{""version"":""v1"",""created"":""Sat, 7 Oct 2006 15:53:04 GMT""}]","2010-11-11"
"cond-mat/0610184","Leonardo E. Silbert","Leonardo E. Silbert","Force heterogeneities in particle assemblies: From order to disorder","To appear in PRE (7 pages, 10 figs)","Phys. Rev. E 74, 051303 (2006)","10.1103/PhysRevE.74.051303",,"cond-mat.soft cond-mat.stat-mech",,"  The effect of increasing structural disorder on the distribution of contact
forces P(f), inside three dimensional particle assemblies is systematically
studied using computer simulations of model granular packings. Starting from a
face-centred cubic array, where all contact forces are identical, an increasing
number of defects is introduced into the assembly, after which the system is
then allowed to relax into a new mechanically stable state. Three distinct
protocols for imposing disorder are compared. A quantitative measure of the
disorder is obtained from distributions of the coordination number and
three-particle contact angle. The distribution of normal contact forces show
dramatic qualitative changes with increasing disorder. In the regime where the
disorder is relatively weak, the pressure and the lowest normal mode frequency
scale approximately linearly in the coordination number, with distance from the
crystalline state. These results for P(f) are discussed in the context of
jamming phenomena in glassy and granular materials.
","[{""version"":""v1"",""created"":""Fri, 6 Oct 2006 16:23:39 GMT""}]","2011-08-02"
"cond-mat/0610185","Eytan Katzav","E. Katzav, M. Adda-Bedia and B. Derrida","Fracture surfaces of heterogeneous materials: a 2D solvable model","4 pages, 4 figures","EPL 78 46006 (2007)","10.1209/0295-5075/78/46006",,"cond-mat.mtrl-sci cond-mat.dis-nn cond-mat.stat-mech",,"  Using an elastostatic description of crack growth based on the Griffith
criterion and the principle of local symmetry, we present a stochastic model
describing the propagation of a crack tip in a 2D heterogeneous brittle
material. The model ensures the stability of straight cracks and allows for the
study of the roughening of fracture surfaces. When neglecting the effect of the
non singular stress, the problem becomes exactly solvable and yields analytic
predictions for the power spectrum of the paths. This result suggests an
alternative to the conventional power law analysis often used in the analysis
of experimental data.
","[{""version"":""v1"",""created"":""Fri, 6 Oct 2006 16:20:52 GMT""}]","2007-05-23"
"cond-mat/0610186","Marc Timme","Marc Timme","Does dynamics reflect topology in directed networks?","7 pages, 4 figures, Europhysics Letters, accepted","Europhys. Lett., 76 (3), 367 (2006)","10.1209/epl/i2006-10289-y",,"cond-mat.dis-nn q-bio.NC",,"  We present and analyze a topologically induced transition from ordered,
synchronized to disordered dynamics in directed networks of oscillators. The
analysis reveals where in the space of networks this transition occurs and its
underlying mechanisms. If disordered, the dynamics of the units is precisely
determined by the topology of the network and thus characteristic for it. We
develop a method to predict the disordered dynamics from topology. The results
suggest a new route towards understanding how the precise dynamics of the units
of a directed network may encode information about its topology.
","[{""version"":""v1"",""created"":""Fri, 6 Oct 2006 16:57:39 GMT""}]","2007-05-23"
"cond-mat/0610187","Brian P. Anderson","David R. Scherer, Chad N. Weiler, Tyler W. Neely, Brian P. Anderson","Vortex Formation by Interference of Multiple Trapped Bose-Einstein
  Condensates","5 pages, 3 figures",,"10.1103/PhysRevLett.98.110402",,"cond-mat.other",,"  We report observations of vortex formation as a result of merging together
multiple $^{87}$Rb Bose-Einstein condensates (BECs) in a confining potential.
In this experiment, a trapping potential is partitioned into three sections by
a barrier, enabling the simultaneous formation of three independent,
uncorrelated condensates. The three condensates then merge together into one
BEC, either by removal of the barrier, or during the final stages of
evaporative cooling if the barrier energy is low enough; both processes can
naturally produce vortices within the trapped BEC. We interpret the vortex
formation mechanism as originating in interference between the initially
independent condensates, with indeterminate relative phases between the three
initial condensates and the condensate merging rate playing critical roles in
the probability of observing vortices in the final, single BEC.
","[{""version"":""v1"",""created"":""Fri, 6 Oct 2006 16:59:18 GMT""}]","2015-06-25"
"cond-mat/0610188","Marc Timme","Marc Timme","Revealing Network Connectivity From Dynamics","10 pages, 4 figures","Phys. Rev. Lett. 98, 224101 (2007)","10.1103/PhysRevLett.98.224101",,"cond-mat.dis-nn q-bio.NC",,"  We present a method to infer network connectivity from collective dynamics in
networks of synchronizing phase oscillators. We study the long-term stationary
response to temporally constant driving. For a given driving condition,
measuring the phase differences and the collective frequency reveals
information about how the oscillators are interconnected. Sufficiently many
repetitions for different driving conditions yield the entire network
connectivity from measuring the dynamics only. For sparsely connected networks
we obtain good predictions of the actual connectivity even for formally
under-determined problems.
","[{""version"":""v1"",""created"":""Fri, 6 Oct 2006 17:13:42 GMT""}]","2009-11-11"
"cond-mat/0610189","Reyes Calvo","M. R. Calvo, A. I. Mares, V. Climent, J. M. van Ruitenbeek, C. Untiedt","Formation of Atomic-Sized Contacts by Electrochemical Methods","7 pages, 5 figures, submitted to PSS","Physica Status Solidi, 204, 1677 - 1685, 2007","10.1002/pssa.200675319",,"cond-mat.mes-hall cond-mat.other","http://arxiv.org/licenses/nonexclusive-distrib/1.0/","  Electrochemical methods have recently become an interesting tool for
fabricating and characterizing nanostructures at room temperature. Simplicity,
low cost and reversibility are some of the advantages of this technique that
allows to work at the nanoscale without requiring sophisticated
instrumentation. In our experimental setup, we measure the conductance across a
nanocontact fabricated either by dissolving a macroscopic gold wire or by
depositing gold in between two separated gold electrodes. We have achieved a
high level of control on the electrochemical fabrication of atomic-sized
contacts in gold. The use of electrochemistry as a reproducible technique to
prepare nanocontacts will open several possibilities that are not feasible with
other methodologies. It involves, also, the possibility of reproducing
experiments that today are made by more expensive, complicated or irreversible
methods. As example, we show here a comparison of the results when looking for
shell effects in gold nanocontacts with those obtained by other techniques.
","[{""version"":""v1"",""created"":""Fri, 6 Oct 2006 17:26:44 GMT""},{""version"":""v2"",""created"":""Wed, 17 Jun 2009 11:11:09 GMT""}]","2009-06-17"
"cond-mat/0610190","Yaroslav Tserkovnyak","Yaroslav Tserkovnyak and Bertrand I. Halperin and Alexey A. Kovalev
  and Arne Brataas","Boundary spin Hall effect in a two-dimensional semiconductor system with
  Rashba spin-orbit coupling","6 pages, 1 figure","Phys. Rev. B 76 (2007) 085319","10.1103/PhysRevB.76.085319",,"cond-mat.mtrl-sci cond-mat.mes-hall",,"  We derive boundary conditions for the coupled spin-charge diffusion equations
at a transmitting interface between two-dimensional electron systems with
different strengths of the Rashba spin-orbit (SO) coupling $\alpha$, and an
electric field parallel to the interface. We consider the limit where the
spin-diffusion length l_s is long compared to the electron mean free path l,
and assume that $\alpha$ changes discontinuously on the scale of l_s. We find
that the spin density is also discontinuous on the scale of l_s. In the case
where the electron mobility is constant across the interface, this leads to the
complete suppression of the expected spin injection from a region with
$\alpha\neq0$ into a non-SO region with $\alpha=0$.
","[{""version"":""v1"",""created"":""Fri, 6 Oct 2006 17:41:39 GMT""},{""version"":""v2"",""created"":""Sat, 4 Aug 2007 02:26:32 GMT""}]","2009-11-11"
"cond-mat/0610191","Malcolm Kennett","Malcolm P. Kennett and Ross H. McKenzie","Sensitivity of the interlayer magnetoresistance of layered metals to
  intralayer anisotropies","7 pages, 3 figures","Phys. Rev. B 76, 054515 (2007)","10.1103/PhysRevB.76.054515",,"cond-mat.str-el cond-mat.supr-con",,"  Many of the most interesting and technologically important electronic
materials discovered in the past two decades have two common features: a
layered crystal structure and strong interactions between electrons. Two of the
most fundamental questions about such layered metals concern the origin of
intralayer anisotropies and the coherence of interlayer charge transport. We
show that angle dependent magnetoresistance oscillations (AMRO) are sensitive
to anisotropies around an intralayer Fermi surface. Hence, AMRO can be a probe
of intralayer anisotropies that is complementary to angle-resolved
photoemission spectroscopy (ARPES) and scanning tunneling microscopy (STM).
However, AMRO are not very sensitive to the coherence of the interlayer
transport. We illustrate this with comparisons to recent AMRO experiments on an
overdoped cuprate.
","[{""version"":""v1"",""created"":""Fri, 6 Oct 2006 18:43:35 GMT""},{""version"":""v2"",""created"":""Tue, 21 Aug 2007 16:17:42 GMT""}]","2009-11-11"
"cond-mat/0610192","Gerardo Naumis","Gerardo G. Naumis, F.J. Lopez-Rodriguez","From the Hofstadter to the Fibonacci butterfly","7 pages, 4 figures","Physica B 403, 1755 (2008)","10.1016/j.physb.2007.10.016",,"cond-mat.mes-hall cond-mat.dis-nn",,"  We show that the electronic spectrum of a tight-binding Hamiltonian defined
in a quasiperiodic chain with an on-site potential given by a Fibonacci
sequence, can be obtained as a superposition of Harper potentials. The
electronic spectrum of the Harper equation is a fractal set, known as
Hofstadter butterfly. Here we show that is possible to construct a similar
butterfly for the Fibonacci potential just by adding harmonics to the Harper
potential. As a result, the equations in reciprocal space for the Fibonacci
case have the form of a chain with a long range interaction between Fourier
components. Then we explore the transformation between both spectra, and
specifically the origin of energy gaps due to the analytical calculation of the
components in reciprocal space of the potentials. We also calculate some
localization properties by finding the correlator of each potential.
","[{""version"":""v1"",""created"":""Fri, 6 Oct 2006 19:16:51 GMT""}]","2015-10-12"
"cond-mat/0610193","Alan Sokal","Youjin Deng, Timothy M. Garoni and Alan D. Sokal","Ferromagnetic phase transition for the spanning-forest model (q \to 0
  limit of the Potts model) in three or more dimensions","LaTex2e, 4 pages; includes 6 Postscript figures; Version 2 has
  expanded title as published in PRL","Phys.Rev.Lett.98:030602,2007","10.1103/PhysRevLett.98.030602",,"cond-mat.stat-mech hep-lat math-ph math.MP",,"  We present Monte Carlo simulations of the spanning-forest model (q \to 0
limit of the ferromagnetic Potts model) in spatial dimensions d=3,4,5. We show
that, in contrast to the two-dimensional case, the model has a ""ferromagnetic""
second-order phase transition at a finite positive value w_c. We present
numerical estimates of w_c and of the thermal and magnetic critical exponents.
We conjecture that the upper critical dimension is 6.
","[{""version"":""v1"",""created"":""Fri, 6 Oct 2006 20:00:58 GMT""},{""version"":""v2"",""created"":""Wed, 17 Jan 2007 18:50:55 GMT""}]","2008-11-26"
"cond-mat/0610195","Eric R. Weeks","Eric R. Weeks, John C. Crocker, David A. Weitz","Short and long range correlated motion observed in colloidal glasses and
  liquids","Submitted to J Phys: Cond Mat; for Workshop on Nonequilibrium
  Phenomena in Glasses (Pisa, September 2006)","J. Phys.: Cond. Mat. 19, 205131 (2007)","10.1088/0953-8984/19/20/205131",,"cond-mat.dis-nn cond-mat.soft",,"  We use a confocal microscope to examine the motion of individual particles in
a dense colloidal suspension. Close to the glass transition, particle motion is
strongly spatially correlated. The correlations decay exponentially with
particle separation, yielding a dynamic length scale of O(2-3 sigma) (in terms
of particle diameter sigma). This length scale grows modestly as the glass
transition is approached. Further, the correlated motion exhibits a strong
spatial dependence on the pair correlation function g(r). Motion within glassy
samples is weakly correlated, but with a larger spatial scale for this
correlation.
","[{""version"":""v1"",""created"":""Fri, 6 Oct 2006 20:40:40 GMT""}]","2007-08-09"
"cond-mat/0610196","Na Young Kim","Na Young Kim, Patrik Recher, William D. Oliver, Yoshihisa Yamamoto,
  Jing Kong, Hongjie Dai","Tomonaga-Luttinger Liquid Features in Ballistic Single-Walled Carbon
  Nanotubes: Conductance and Shot Noise","5 pages, 4 figures, RevTex4","Phys. Rev. Lett. 99, 036802 (2007)","10.1103/PhysRevLett.99.036802",,"cond-mat.mes-hall",,"  We study the electrical transport properties of well-contacted ballistic
single-walled carbon nanotubes in a three-terminal configuration at low
temperatures. We observe signatures of strong electron-electron interactions:
the conductance exhibits bias-voltage-dependent amplitudes of quantum
interference oscillation, and both the current noise and Fano factor manifest
bias-voltage-dependent power-law scalings. We analyze our data within the
Tomonaga-Luttinger liquid model using the non-equilibrium Keldysh formalism and
find qualitative and quantitative agreement between experiment and theory.
","[{""version"":""v1"",""created"":""Sat, 7 Oct 2006 03:42:30 GMT""}]","2007-07-17"
"cond-mat/0610197","Almas F. Sadreev","Evgeny N. Bulgakov, Konstantin N. Pichugin, Almas F. Sadreev, and
  Ingrid Rotter","Bound states in the continuum in open Aharonov-Bohm rings","5 pgaes, 4 figures",,"10.1134/S0021364006200057",,"cond-mat.mes-hall",,"  Using formalism of effective Hamiltonian we consider bound states in
continuum (BIC). They are those eigen states of non-hermitian effective
Hamiltonian which have real eigen values. It is shown that BICs are orthogonal
to open channels of the leads, i.e. disconnected from the continuum. As a
result BICs can be superposed to transport solution with arbitrary coefficient
and exist in propagation band. The one-dimensional Aharonov-Bohm rings that are
opened by attaching single-channel leads to them allow exact consideration of
BICs. BICs occur at discrete values of energy and magnetic flux however it's
realization strongly depend on a way to the BIC's point.
","[{""version"":""v1"",""created"":""Sat, 7 Oct 2006 09:38:40 GMT""}]","2015-06-25"
"cond-mat/0610198","David Petrosyan","David Petrosyan, Bernd Schmidt, James R. Anglin, Michael Fleischhauer","Quantum liquid of repulsively bound pairs of particles in a lattice","Corrected dimer energy & references","Phys. Rev. A 76, 033606 (2007)","10.1103/PhysRevA.76.033606",,"cond-mat.other quant-ph",,"  Repulsively interacting particles in a periodic potential can form bound
composite objects, whose dissociation is suppressed by a band gap. Nearly pure
samples of such repulsively bound pairs of cold atoms -- ""dimers"" -- have
recently been prepared by Winkler et al. [Nature 441, 853 (2006)]. We here
derive an effective Hamiltonian for a lattice loaded with dimers only and
discuss its implications to the many-body dynamics of the system. We find that
the dimer-dimer interaction includes strong on-site repulsion and
nearest-neighbor attraction which always dominates over the dimer kinetic
energy at low temperatures. The dimers then form incompressible,
minimal-surface ""droplets"" of a quantum lattice liquid. For low lattice
filling, the effective Hamiltonian can be mapped onto the spin-1/2 XXZ model
with fixed total magnetization which exhibits a first-order phase transition
from the ""droplet"" to a ""gas"" phase. This opens the door to studying first
order phase transitions using highly controllable ultracold atoms.
","[{""version"":""v1"",""created"":""Sat, 7 Oct 2006 09:44:57 GMT""},{""version"":""v2"",""created"":""Thu, 16 Nov 2006 09:43:01 GMT""},{""version"":""v3"",""created"":""Tue, 31 Jul 2007 11:28:40 GMT""},{""version"":""v4"",""created"":""Mon, 31 Mar 2008 10:56:48 GMT""}]","2008-03-31"
"cond-mat/0610199","Luca Salasnich","Luca Salasnich (CNISM and CNR-INFM, Padova) and Boris A. Malomed (Tel
  Aviv Univ.)","Vector solitons in nearly-one-dimensional Bose-Einstein condensates","7 pages, 6 figures; Physical Review A, in press","Phys. Rev. A 74, 053610 (2006)","10.1103/PhysRevA.74.053610",,"cond-mat.other nlin.PS",,"  We derive a system of nonpolynomial Schroedinger equations (NPSEs) for
one-dimensional wave functions of two components in a binary self-attractive
Bose-Einstein condensate loaded in a cigar-shaped trap. The system is obtained
by means of the variational approximation, starting from the coupled 3D
Gross-Pitaevskii equations and assuming, as usual, the factorization of 3D wave
functions. The system can be obtained in a tractable form under a natural
condition of symmetry between the two species. A family of vector
(two-component) soliton solutions is constructed. Collisions between orthogonal
solitons (ones belonging to the different components) are investigated by means
of simulations. The collisions are essentially inelastic. They result in strong
excitation of intrinsic vibrations in the solitons, and create a small
orthogonal component (""shadow"") in each colliding soliton. The collision may
initiate collapse, which depends on the mass and velocities of the solitons.
","[{""version"":""v1"",""created"":""Sat, 7 Oct 2006 11:52:59 GMT""}]","2009-11-11"
"cs/0610037","Nan Liu","Nan Liu and Sennur Ulukus","The Capacity Region of a Class of Discrete Degraded Interference
  Channels","7 pages, 1 figure; presented at the 44th annual Allerton Conference
  on Communication, Control and Computing, September 27-29, 2006",,,,"cs.IT math.IT",,"  We provide a single-letter characterization for the capacity region of a
class of discrete degraded interference channels (DDICs). The class of DDICs
considered includes the discrete additive degraded interference channel (DADIC)
studied by Benzel. We show that for the class of DDICs studied, encoder
cooperation does not increase the capacity region, and therefore, the capacity
region of the class of DDICs is the same as the capacity region of the
corresponding degraded broadcast channel.
","[{""version"":""v1"",""created"":""Fri, 6 Oct 2006 19:42:27 GMT""}]","2007-07-13"
"cs/0610038","Hannes Hutzelmeyer","Hannes Hutzelmeyer","Church's thesis is questioned by new calculation paradigm","32 pages",,,,"cs.LO",,"  Church's thesis claims that all effecticely calculable functions are
recursive. A shortcoming of the various definitions of recursive functions lies
in the fact that it is not a matter of a syntactical check to find out if an
entity gives rise to a function. Eight new ideas for a precise setup of
arithmetical logic and its metalanguage give the proper environment for the
construction of a special computer, the ARBACUS computer. Computers do not come
to a necessary halt; it is requested that calculators are constructed on the
basis of computers in a way that they always come to a halt, then all
calculations are effective. The ARBATOR is defined as a calculator with
two-layer-computation. It allows for the calculation of all primitive recursive
functions, but multi-level-arbation also allows for the calculation of other
arbative functions that are not primitive recursive. The new paradigm of
calculation does not have the above mentioned shortcoming. The defenders of
Church's thesis are challenged to show that exotic arbative functions are
recursive and to put forward a recursive function that is not arbative. A
construction with three-tier-multi-level-arbation that includes a
diagonalisation leads to the extravagant yet calculable Snark-function that is
not arbative. As long as it is not shown that all exotic arbative functions and
particularily the Snark-function are arithmetically representable Goedel's
first incompleteness sentence is in limbo.
","[{""version"":""v1"",""created"":""Sat, 7 Oct 2006 12:53:04 GMT""}]","2007-05-23"
