"gr-qc/0610023","Jorge Pullin","Miguel Campiglia, Cayetano Di Bartolo, Rodolfo Gambini, Jorge Pullin","Uniform discretizations: a new approach for the quantization of totally
  constrained systems","17 pages, Revtex, no figures, published version","Phys.Rev.D74:124012,2006","10.1103/PhysRevD.74.124012","LSU-REL-100606","gr-qc",,"  We discuss in detail the uniform discretization approach to the quantization
of totally constrained theories. This approach allows to construct the
continuum theory of interest as a well defined, controlled, limit of well
behaved discrete theories. We work out several finite dimensional examples that
exhibit behaviors expected to be of importance in the quantization of gravity.
We also work out the case of BF theory. At the time of quantization, one can
take two points of view. The technique can be used to define, upon taking the
continuum limit, the space of physical states of the continuum constrained
theory of interest. In particular we show in models that it agrees with the
group averaging procedure when the latter exists. The technique can also be
used to compute, at the discrete level, conditional probabilities and the
introduction of a relational time. Upon taking the continuum limit one can show
that one reproduces results obtained by the use of evolving constants, and
therefore recover all physical predictions of the continuum theory. This second
point of view can also be used as a paradigm to deal with cases where the
continuum limit does not exist. There one would have discrete theories that at
least at certain scales reproduce the semiclassical properties of the theory of
interest. In this way the approach can be viewed as a generalization of the
Dirac quantization procedure that can handle situations where the latter fails.
","[{""version"":""v1"",""created"":""Fri, 6 Oct 2006 17:09:40 GMT""},{""version"":""v2"",""created"":""Sat, 8 Sep 2007 15:58:55 GMT""}]","2008-11-26"
"gr-qc/0610027","Michel Leclerc","M. Leclerc","Modified Ostrogradski formulation of field theory","minor additions",,,,"gr-qc",,"  We present a method for the Hamiltonian formulation of field theories that
are based on Lagrangians containing second derivatives. The new feature of our
formalism is that all four partial derivatives of the field variables are
initially considered as independent fields, in contrast to the conventional
Ostrogradski method, where only the velocity is turned into an independent
field variable. The consistency of the formalism is demonstrated by simple
unconstrained and constrained second order scalar field theories. Its
application to General Relativity is briefly outlined.
","[{""version"":""v1"",""created"":""Sat, 7 Oct 2006 06:17:18 GMT""},{""version"":""v2"",""created"":""Tue, 19 Dec 2006 04:32:14 GMT""},{""version"":""v3"",""created"":""Tue, 27 Feb 2007 19:26:42 GMT""}]","2007-05-23"
"hep-ex/0610014","Stefan Soldner-Rembold","Stefan Soldner-Rembold","Standard Model Higgs Searches and Perspectives at the Tevatron","7 pages, 3 figures, submitted to proceedings of Les Rencontres de
  Physique de la Vallee d'Aoste, Italy, 5-11 March 2006",,,"FERMILAB-CONF-06-360-E, MAN-HEP-2006-26","hep-ex",,"  The status and perspectives of Standard Model Higgs searches at the Tevatron
experiments CDF and D0 are discussed.
","[{""version"":""v1"",""created"":""Fri, 6 Oct 2006 16:02:01 GMT""}]","2007-05-23"
"hep-ex/0610015","Emanuele Di Marco","Emanuele Di Marco (for the BABAR Collaboration)","Measurement of Direct CP Asymmetries in Charmless Hadronic B Decays","7 pages, 3 postscript figues, contributed to the Proceedings of
  ICHEP2006",,,"BABAR-TALK-00/094, SLAC-PUB-12148","hep-ex",,"  We present recent results on time integrated and time dependent CP violation
for charmless hadronic B decays using BABAR detector at the PEP-II B-factory.
","[{""version"":""v1"",""created"":""Fri, 6 Oct 2006 16:48:29 GMT""}]","2019-08-14"
"hep-ex/0610016","Alexei Sibidanov","R.R.Akhmetshin, V.M.Aulchenko, V.Sh.Banzarov, L.M.Barkov,
  N.S.Bashtovoy, A.E.Bondar, D.V.Bondarev, A.V.Bragin, S.K.Dhawan,
  S.I.Eidelman, D.A.Epifanov, G.V.Fedotovich, N.I.Gabyshev, D.A.Gorbachev,
  A.A.Grebenuk, D.N.Grigoriev, V.W.Hughes, F.V.Ignatov, S.V.Karpov,
  V.F.Kazanin, B.I.Khazin, I.A.Koop, P.P.Krokovny, A.S.Kuzmin, I.B.Logashenko,
  P.A.Lukin, A.P.Lysenko, K.Yu.Mikhailov, A.I.Milshtein, I.N.Nesterenko,
  M.A.Nikulin, V.S.Okhapkin, A.V.Otboev, E.A.Perevedentsev, A.S.Popov,
  S.I.Redin, B.L.Roberts, N.I.Root, A.A.Ruban, N.M.Ryskulov, A.G.Shamov,
  Yu.M.Shatunov, B.A.Shwartz, A.L.Sibidanov, V.A.Sidorov, A.N.Skrinsky,
  V.P.Smakhtin, I.G.Snopkov, E.P.Solodov, J.A.Thompson, Yu.V.Yudin,
  A.S.Zaitsev, S.G.Zverev","Measurement of the e+e- -> pi+pi- cross section with the CMD-2 detector
  in the 370-520 MeV c.m. energy range","11 pages, 4 figures","JETPLett.84:413-417,2006; PismaZh.Eksp.Teor.Fiz.84:491-495,2006","10.1134/S0021364006200021",,"hep-ex",,"  The cross section of the process e+e- -> pi+pi- has been measured at the
CMD-2 detector in the 370-520 MeV center-of-mass (c.m.) energy range. A
systematic uncertainty of the measurement is 0.7 %. Using all CMD-2 data on the
pion form factor, the pion electromagnetic radius was calculated. The cross
section of muon pair production was also determined.
","[{""version"":""v1"",""created"":""Fri, 6 Oct 2006 18:10:30 GMT""},{""version"":""v2"",""created"":""Fri, 6 Oct 2006 21:13:55 GMT""}]","2008-11-26"
"hep-ex/0610017","Marek Zielinski","Marek Zielinski (University of Rochester)","QCD and Top-Quark Results from the Tevatron","Presented at the Physics at LHC 2006 Conference for the CDF and D0
  Collaborations; submitted to Conference Proceedings 12 pp., 26 Figs","ActaPhys.Polon.B38:375-390,2007",,,"hep-ex",,"  Selected recent QCD and top-quark results from the Tevatron are reviewed,
aiming to illustrate progression from basic studies of QCD processes to
verification of perturbative calculations and Monte Carlo simulation tools, and
to their applications in more novel and complex cases, like top-quark studies
and searches for new physics.
","[{""version"":""v1"",""created"":""Fri, 6 Oct 2006 18:59:17 GMT""}]","2008-11-26"
"hep-ex/0610018","Evgeni Solodov P","The BABAR Collaboration, B. Aubert, et al","A Structure at 2175 MeV in $e^+ e^- \to \phi f_0(980)$ Observed via
  Initial-State Radiation","8 pages, 11 postscript figues, submitted to PRD-RC","Phys.Rev.D74:091103,2006","10.1103/PhysRevD.74.091103","BABAR-PUB-06/1482, SLAC-PUB-12146","hep-ex",,"  We study the initial-state-radiation processes $e^+ e^- \to K^+
K^-\pi^+\pi^-\gamma$ and $e^+ e^- \to K^+ K^-\pi^0\pi^0\gamma$ using an
integrated luminosity of 232 fb$^{-1}$ collected at the $\Upsilon(4S)$ mass
with the BaBar detector at SLAC. Even though these reactions are dominated by
intermediate states with excited kaons, we are able to study for the first time
the cross section for $e^+ e^- \to \phi(1020) f_{0}(980)$ as a function of
center-of-mass energy. We observe a structure near threshold consistent with a
$1^{--}$ resonance with mass $m = 2.175 \pm 0.010\pm 0.015 GeV/c^2$ and width
$\Gamma = 58\pm 16\pm 20 MeV$. We observe no Y(4260) signal and set a limit of
$BR_{Y\to\phi\pi^+\pi^-}\cdot\Gamma^{Y}_{ee}<0.4$ eV (90% confidence level),
which excludes some models.
","[{""version"":""v1"",""created"":""Sat, 7 Oct 2006 03:20:24 GMT""}]","2010-03-19"
"hep-lat/0610048","Michael A. Clark","M. A. Clark","The Rational Hybrid Monte Carlo Algorithm","15 pages. Proceedings from Lattice 2006","PoSLAT2006:004,2006",,,"hep-lat",,"  The past few years have seen considerable progress in algorithmic development
for the generation of gauge fields including the effects of dynamical fermions.
The Rational Hybrid Monte Carlo (RHMC) algorithm, where Hybrid Monte Carlo is
performed using a rational approximation in place the usual inverse quark
matrix kernel is one of these developments. This algorithm has been found to be
extremely beneficial in many areas of lattice QCD (chiral fermions, finite
temperature, Wilson fermions etc.). We review the algorithm and some of these
benefits, and we compare against other recent algorithm developements. We
conclude with an update of the Berlin wall plot comparing costs of all popular
fermion formulations.
","[{""version"":""v1"",""created"":""Fri, 6 Oct 2006 18:03:39 GMT""}]","2008-11-26"
"hep-lat/0610049","Harry Thacker","H. B. Thacker","D-branes, Wilson Bags, and Coherent Topological Charge Structure in QCD","15 pages, 3 figures. Talk presented at Lattice 2006, Tucson, AZ, July
  23-27, 2006","PoSLAT2006:025,2006",,,"hep-lat",,"  Monte Carlo studies of pure glue SU(3) gauge theory using the overlap-based
topological charge operator have revealed a laminar structure in the QCD vacuum
consisting of extended, thin, coherent, locally 3-dimensional sheets of
topological charge embedded in 4D space, with opposite sign sheets interleaved.
Studies of localization properties of Dirac eigenmodes have also shown evidence
for the delocalization of low-lying modes on effectively 3-dimensional
surfaces. In this talk, I review some theoretical ideas which suggest the
possibility of 3-dimensionally coherent topological charge structure in
4-dimensional gauge theory and provide a possible interpretation of the
observed structure. I begin with Luscher's ``Wilson bag'' integral over the
3-index Chern-Simons tensor. The analogy with a Wilson loop as a charged world
line in 2-dimensional $CP^{N-1}$ sigma models suggests that the Wilson bag
surface represents the world volume of a physical membrane. The large-N chiral
Lagrangian arguments of Witten also indicate the existence of multiple
``k-vacuum'' states with discontinuous transitions between k-vacua at $\theta=$
odd multiples of $\pi$. The domain walls between these vacua have the
properties of a Wilson bag surface. Finally, I review the AdS/CFT duality view
of $\theta$ dependence in QCD. The dual realtionship between topological charge
in gauge theory and Ramond-Ramond charge in type IIA string theory suggests
that the coherent topological charge sheets observed on the lattice are the
holographic image of wrapped D6 branes.
","[{""version"":""v1"",""created"":""Fri, 6 Oct 2006 19:07:51 GMT""}]","2008-11-26"
"hep-lat/0610050","Tomomi Ishikawa","CP-PACS/JLQCD Collaborations: T. Ishikawa, S. Aoki, M. Fukugita, S.
  Hashimoto, K.-I. Ishikawa, N. Ishizuka, Y. Iwasaki, K. Kanaya, T. Kaneko, Y.
  Kuramashi, M. Okawa, Y. Taniguchi, N. Tsutsui, A. Ukawa, N. Yamada and T.
  Yoshi\'e","2+1 flavor light hadron spectrum and quark masses with the O(a) improved
  Wilson-clover quark formalism","7 pages, 4 figures, talk presented at Lattice2006 (Hadron
  Spectroscopy), PoS format (v3: typos corrected)","PoSLAT2006:181,2006",,"UTCCS-P-24, UTHEP-531, KEK-CP-185, HUPD-0612","hep-lat",,"  We present a summary of results of the joint CP-PACS and JLQCD project toward
a 2+1 flavor full QCD simulation with the O(a)-improved Wilson quark formalism
and the Iwasaki gauge action. Configurations were generated during 2002-2005 at
three lattice spacings, a~0.076, 0.100 and 0.122 fm, keeping the physical
volume constant at (2.0fm)^3. Up and down quark masses are taken in the range
m_{PS}/m_V~0.6-0.78. We have completed the analysis for the light meson
spectrum and quark masses in the continuum limit using the full configuration
set. The predicted meson masses reproduce experimental values in the continuum
limit at a 1% level. The average up and down, and strange quark masses turn out
to be m_{ud}^{\bar{MS}}(\mu=2 GeV)=3.50(14)({}^{+26}_{-15}) MeV and
m_s^{\bar{MS}}(\mu=2 GeV)=91.8(3.9)({}^{+6.8}_{-4.1}) MeV. We discuss our
future strategy toward definitive results on hadron spectroscopy with the
Wilson-clover formalism.
","[{""version"":""v1"",""created"":""Fri, 6 Oct 2006 19:53:38 GMT""},{""version"":""v2"",""created"":""Mon, 30 Oct 2006 05:10:18 GMT""},{""version"":""v3"",""created"":""Mon, 16 Apr 2007 03:40:00 GMT""}]","2016-08-16"
"hep-ph/0610079","Oliver Brein","Oliver Brein and Thomas Hahn","On MSSM charged Higgs boson production in association with an
  electroweak W boson at electron positron colliders","25 pages, 10 figures (two in colour). Substantially improved on the
  MSSM parameter restrictions taken into account. Added some references","Eur.Phys.J.C52:397-411,2007","10.1140/epjc/s10052-007-0397-1","IPPP/06/67, DCPT/06/134, MPP-2006-128","hep-ph hep-ex",,"  We present a calculation of the cross section for the process e+ e- --> W+/-
H-/+ in the minimal supersymmetric standard model (MSSM) and the Two Higgs
Doublet Model (THDM). We study the basic features of the MSSM prediction for
some distinctive parameter scenarios. We find large effects from virtual
squarks for scenarios with large mixing in the stop sector which can lead to a
cross section vastly different from a THDM with identical Higgs sector
parameters. We investigate this interesting behaviour in more detail by
thoroughly scanning the MSSM parameter space for regions of large cross
section. For a charged Higgs boson too heavy to be pair-produced at such a
machine, it turns out that a large MSSM cross section with a good chance of
observation is linked to a squark mass scale below 600 GeV and a considerable
amount of mixing in either the stop and sbottom sector.
","[{""version"":""v1"",""created"":""Fri, 6 Oct 2006 16:05:07 GMT""},{""version"":""v2"",""created"":""Fri, 23 Mar 2007 16:23:17 GMT""}]","2010-10-27"
"hep-ph/0610080","Viacheslav Bunichev","E. Boos (1), V. Bunichev (1), L. Dudko (1), and M. Perfilov (1) ((1)
  Skobeltsyn Institute of Nuclear Physics, Moscow State University, Russia)","Interference between W-prime and W in single-top quark production
  processes","13 pages, 8 figures; added references [8], [31] for section 1","Phys.Lett.B655:245-250,2007","10.1016/j.physletb.2007.03.064",,"hep-ph",,"  The paper is devoted to studies of prospects to search for hypothetical
W-prime gauge bosons at hadron colliders via single-top quark production
process. A special attention is paid to the interference between the Standard
Model (SM) W and W-prime} boson contributions. A model independent analysis is
performed for a wide interval of W-prime} masses potentially acceptable for a
detection at the Tevatron and LHC. It is shown that the interference
contribution to the cross section of the most promising s-channel single top
production mode could be as large as 30 % for certain parameter points which is
comparable to NLO effects computed in previous studies separately for the
W-prime signal and the SM single-top background. The interference contribution
affects particle distributions and has to be taken into account for more
accurate W-prime signal and background simulation.
","[{""version"":""v1"",""created"":""Fri, 6 Oct 2006 16:41:13 GMT""},{""version"":""v2"",""created"":""Fri, 3 Nov 2006 09:25:09 GMT""},{""version"":""v3"",""created"":""Fri, 12 Oct 2007 10:07:01 GMT""}]","2008-11-26"
"hep-ph/0610081","Ingunn Kathrine Wehus","H. Alnes, K. Olaussen, F. Ravndal and I.K. Wehus","Resolution of an apparent inconsistency in the electromagnetic Casimir
  effect","v2: 7 pages, minor update, one reference added, published version","J.Phys.A40:F315-F320,2007","10.1088/1751-8113/40/17/F01",,"hep-ph hep-th",,"  The vacuum expectation value of the electromagnetic energy-momentum tensor
between two parallel plates in spacetime dimensions D > 4 is calculated in the
axial gauge. While the pressure between the plates agrees with the global
Casimir force, the energy density is divergent at the plates and not compatible
with the total energy which follows from the force. However, subtracting the
divergent self-energies of the plates, the resulting energy is finite and
consistent with the force. In analogy with the corresponding scalar case for
spacetime dimensions D > 2, the divergent self-energy of a single plate can be
related to the lack of conformal invariance of the electromagnetic Lagrangian
for dimensions D > 4.
","[{""version"":""v1"",""created"":""Fri, 6 Oct 2006 17:15:05 GMT""},{""version"":""v2"",""created"":""Wed, 11 Apr 2007 18:58:15 GMT""}]","2008-11-26"
"hep-ph/0610082","Jose Wudka","Bohdan Grzadkowski, Jose Wudka","Strategies and obstacles in constructing realistic higher-dimensional
  models","4 pages, 1 fugure; contribution to the SUSY06 proceedings","AIPConf.Proc.903:423-426,2007","10.1063/1.2735214","IFT-06-20; UCRHEP-T421","hep-ph hep-th",,"  We discuss several aspects of higher dimensional models that contain bulk
gauge and fermion fields only. In particular we argue that non-standard
boundary conditions involving charge-conjugate fermion fields offer attractive
model building possibilities. We also discuss a no-go theorem for 5-dimensional
models which severely limits their phenomenological relevance.
","[{""version"":""v1"",""created"":""Fri, 6 Oct 2006 20:26:33 GMT""},{""version"":""v2"",""created"":""Tue, 17 Oct 2006 22:29:40 GMT""}]","2008-11-26"
"hep-ph/0610083","Somorendro Singh shougaijam","S. S. Singh","Direct photon radiation from a rich baryon Quark-Gluon Plasma system","five pages, 6 figures and going to sumit in Journal of physics G",,,,"hep-ph",,"  The direct photon radiation from a hot and slightly strong interacting
fireball system of a rich baryon quark-gluon plasma, using the Boltzmann
distribution function for the incoming particles and Bose-Einstein distribution
for gluon and Fermi-Dirac distribution for quark,antiquark and Boltzmann
distribution for gluon are discussed subsequently. The first two distribution
functions are chosen for the photon production of the first case and the last
two functions are considered for the second case of my photon production. The
thermal photon emission rate is found that it is infra-red divergent for the
massless quarks and this divergence in the quark mass is regulated using
different cut-off in the quark mass. However, I remove this divergence using
the technique of Braaten and Pisarski in the thermal mass of the system in my
model of calculation with a coupling parameter of QGP fireball. Thus, the
production rate of the thermal photon is found to be smoothly worked by this
cut-off technique of this model and the result is found to be increasing
function with the increase of the variation in the value of the chemical
potential $\mu $
","[{""version"":""v1"",""created"":""Sat, 7 Oct 2006 05:55:55 GMT""},{""version"":""v2"",""created"":""Thu, 19 Oct 2006 07:15:30 GMT""},{""version"":""v3"",""created"":""Mon, 19 Feb 2007 10:50:57 GMT""},{""version"":""v4"",""created"":""Wed, 21 Feb 2007 08:35:47 GMT""}]","2007-05-23"
"hep-ph/0610085","Georgios Gounaris","Th. Diakonidis, G.J. Gounaris and J. Layssac","A FORTRAN code for $\gamma \gamma \to Z Z $ in SM and MSSM","13 pages, 7 figures Revised according to the EPJC Referee suggestions","Eur.Phys.J.C50:47-52,2007","10.1140/epjc/s10052-006-0202-6","PTA/06-48","hep-ph",,"  Through the present paper, the code gamgamZZ is presented, which may be used
to calculate all possible observables related to the process $\gamma \gamma \to
ZZ$, in either the Standard Model (SM), or the minimal sypersymmetric standard
model (MSSM) with real parameters.
","[{""version"":""v1"",""created"":""Sat, 7 Oct 2006 10:34:20 GMT""},{""version"":""v2"",""created"":""Sat, 2 Dec 2006 10:55:47 GMT""}]","2008-11-26"
"hep-th/0610075","Francisco Navarro-Lerida","Jutta Kunz and Francisco Navarro-Lerida","Non-uniqueness, Counterrotation, and Negative Horizon Mass of
  Einstein-Maxwell-Chern-Simons Black Holes","15 pages, 16 figures, MPLA style, invited review for Modern Physics
  Letters A","Mod.Phys.Lett.A21:2621-2636,2006","10.1142/S0217732306021864",,"hep-th gr-qc",,"  Stationary black holes in 5-dimensional Einstein-Maxwell-Chern-Simons theory
possess surprising properties. When considering the Chern-Simons coefficient
$\lambda$ as a parameter, two critical values of $\lambda$ appear: the
supergravity value $\lambda_{\rm SG}=1$, and the value $\lambda=2$. At
$\lambda=1$, supersymmetric black holes with vanishing horizon angular
velocity, but finite angular momentum exist. As $\lambda$ increases beyond
$\lambda_{\rm SG}$ a rotational instability arises, and counterrotating black
holes appear, whose horizon rotates in the opposite sense to the angular
momentum. Thus supersymmetry is associated with the borderline between
stability and instability. At $\lambda=2$ rotating black holes with vanishing
angular momentum emerge. Beyond $\lambda=2$ black holes may possess a negative
horizon mass, while their total mass is positive. Charged rotating black holes
with vanishing gyromagnetic ratio appear, and black holes are no longer
uniquely characterized by their global charges.
","[{""version"":""v1"",""created"":""Fri, 6 Oct 2006 18:16:10 GMT""}]","2009-11-11"
"hep-th/0610077","Alex Giacomini","Alex Giacomini, Ricardo Troncoso and Steven Willison","Three-dimensional supergravity reloaded","LaTex 24 pages, no figures. Minor changes, references added. Accepted
  for publication on Class. Quant. Grav","Class.Quant.Grav.24:2845-2860,2007","10.1088/0264-9381/24/11/005","CECS-PHY-06/18","hep-th gr-qc",,"  The locally supersymmetric extension of the most general gravity theory in
three dimensions leading to first order field equations for the vielbein and
the spin connection is constructed. Apart from the Einstein-Hilbert term with
cosmological constant, the gravitational sector contains the
Lorentz-Chern-Simons form and a term involving the torsion each with arbitrary
couplings. The supersymmetric extension is carried out for vanishing and
negative effective cosmological constant, and it is shown that the action can
be written as a Chern-Simons theory for the supersymmetric extension of the
Poincare and AdS groups, respectively. The construction can be simply carried
out by making use of a duality map between different gravity theories discussed
here, which relies on the different ways to make geometry emerge from a single
gauge potential. The extension for N =p+q gravitini is also performed.
","[{""version"":""v1"",""created"":""Fri, 6 Oct 2006 20:40:33 GMT""},{""version"":""v2"",""created"":""Tue, 21 Nov 2006 03:05:48 GMT""},{""version"":""v3"",""created"":""Thu, 3 May 2007 00:00:51 GMT""}]","2008-11-26"
"hep-th/0610078","Claudia de Rham","C.P. Burgess, C. de Rham, D. Hoover, D. Mason and A.J. Tolley","Kicking the Rugby Ball: Perturbations of 6D Gauged Chiral Supergravity","21 pages + appendices, references added","JCAP 0702:009,2007","10.1088/1475-7516/2007/02/009",,"hep-th",,"  We analyze the axially-symmetric scalar perturbations of 6D chiral gauged
supergravity compactified on the general warped geometries in the presence of
two source branes. We find all of the conical geometries are marginally stable
for normalizable perturbations (in disagreement with some recent calculations)
and the nonconical for regular perturbations, even though none of them are
supersymmetric (apart from the trivial Salam-Sezgin solution, for which there
are no source branes). The marginal direction is the one whose presence is
required by the classical scaling property of the field equations, and all
other modes have positive squared mass. In the special case of the conical
solutions, including (but not restricted to) the unwarped `rugby-ball'
solutions, we find closed-form expressions for the mode functions in terms of
Legendre and Hypergeometric functions. In so doing we show how to match the
asymptotic near-brane form for the solution to the physics of the source
branes, and thereby how to physically interpret perturbations which can be
singular at the brane positions.
","[{""version"":""v1"",""created"":""Fri, 6 Oct 2006 20:56:02 GMT""},{""version"":""v2"",""created"":""Mon, 16 Oct 2006 16:25:31 GMT""},{""version"":""v3"",""created"":""Mon, 19 Feb 2007 16:46:03 GMT""}]","2010-10-27"
"hep-th/0610081","Benjamin C. Harms","B. Harms and O. Micu","Noncommutative Quantum Hall Effect and Aharonov-Bohm Effect","9 pages, RevTeX4, references added, small changes in the text","J.Phys.A40:10337-10348,2007","10.1088/1751-8113/40/33/024",,"hep-th",,"  We study a system of electrons moving on a noncommutative plane in the
presence of an external magnetic field which is perpendicular to this plane.
For generality we assume that the coordinates and the momenta are both
noncommutative. We make a transformation from the noncommutative coordinates to
a set of commuting coordinates and then we write the Hamiltonian for this
system. The energy spectrum and the expectation value of the current can then
be calculated and the Hall conductivity can be extracted. We use the same
method to calculate the phase shift for the Aharonov-Bohm effect. Precession
measurements could allow strong upper limits to be imposed on the
noncommutativity coordinate and momentum parameters $\Theta$ and $\Xi$.
","[{""version"":""v1"",""created"":""Fri, 6 Oct 2006 23:24:52 GMT""},{""version"":""v2"",""created"":""Thu, 7 Dec 2006 00:03:15 GMT""},{""version"":""v3"",""created"":""Sun, 7 Jan 2007 16:41:09 GMT""}]","2008-11-26"
