"math/0608628","Pooja Singla","Satoshi Murai, Pooja Singla","Rigidity of linear strands and generic initial ideals","20 pages, the title was changed and some minor corrections were made.
  To apper Nagoya Mathematical Journal",,,,"math.AC",,"  Let $K$ be a field, $S$ a polynomial ring and $E$ an exterior algebra over
$K$, both in a finite set of variables. We study rigidity properties of the
graded Betti numbers of graded ideals in $S$ and $E$ when passing to their
generic initial ideals. First, we prove that if the graded Betti numbers
$\beta_{ii+k}^S(S/I)=\beta_{ii+k}^S(S/\Gin(I))$ for some $i>1$ and $k \geq 0$,
then $\beta_{qq+k}^S(S/I)= \beta_{qq+k}^S(S/\Gin(I))$ for all $q \geq i$, where
$I\subset S$ is a graded ideal. Second, we show that if $\beta_{ii+k}^E(E/I)=
\beta_{ii+k}^E(E/\Gin(I))$ for some $i>1$ and $k \geq 0$, then
$\beta_{qq+k}^E(E/I)= \beta_{qq+k}^E(E/\Gin(I))$ for all $q \geq 1$, where
$I\subset E$ is a graded ideal. In addition, it will be shown that the graded
Betti numbers $\beta_{ii+k}^R(R/I)= \beta_{ii+k}^R(R/\Gin(I))$ for all $i \geq
1$ if and only if $I_{< k >}$ and $I_{< k+1 >}$ have a linear resolution. Here
$I_{< d >}$ is the ideal generated by all homogeneous elements in $I$ of degree
$d$, and $R$ can be either the polynomial ring or the exterior algebra.
","[{""version"":""v1"",""created"":""Fri, 25 Aug 2006 11:26:41 GMT""},{""version"":""v2"",""created"":""Sat, 16 Jun 2007 02:49:45 GMT""}]","2007-06-18"
"math/0608629","Gabor Elek","G\'abor Elek and Tullio Ceccherini-Silberstein","Minimal topological actions do not determine the measurable orbit
  equivalence class",,,,,"math.DS",,"  We construct a minimal topological action $\wp$ of a non-amenable group on a
Cantor set $C$, which is non-uniquely ergodic and furthermore there exist
ergodic invariant measures $\mu_1$ and $\mu_2$ such that $(\wp,C,\mu_1)$ and
$(\wp,C,\mu_2)$ are not orbit equivalent measurable equivalence relations.
","[{""version"":""v1"",""created"":""Fri, 25 Aug 2006 11:49:06 GMT""}]","2007-05-23"
"math/0608630","George Molchan","G.Molchan","The Problem of Small Unilateral Deviations: the Existence of Decay
  Exponents","The corrected version",,,,"math.PR cond-mat.other",,"  Let x(s), s in R^d be a Gaussian self-similar random process of index H. We
consider the problem of log-asymptotics for the probability p(T) that x(s),
x(0)=0 does not exceed a fixed level in a star-shaped expanding domain TxG as
T>>1. We solve the problem of the existence of the limit, theta:=lim (-log
p(T))/(log T)^D, T>>1, for the fractional Brownian sheet x(s)on [0,T]^2 then
D=2 and we estimate the theta for the integrated fractional Brownian motion
then D=1.
","[{""version"":""v1"",""created"":""Fri, 25 Aug 2006 11:54:55 GMT""},{""version"":""v2"",""created"":""Wed, 1 Nov 2006 10:48:12 GMT""}]","2007-05-23"
"math/0608631","Jalal Fadili","Bo Zhang (AIQ), Jalal Fadili (GREYC), Jean Luc Starck (CEA Saclay),
  Seth W. Digel (SLAC)","Fast Poisson Noise Removal by Biorthogonal Haar Domain Hypothesis
  Testing",,,,,"math.ST stat.TH",,"  Methods based on hypothesis tests (HTs) in the Haar domain are widely used to
denoise Poisson count data. Facing large datasets or real-time applications,
Haar-based denoisers have to use the decimated transform to meet limited-memory
or computation-time constraints. Unfortunately, for regular underlying
intensities, decimation yields discontinuous estimates and strong ""staircase""
artifacts. In this paper, we propose to combine the HT framework with the
decimated biorthogonal Haar (Bi-Haar) transform instead of the classical Haar.
The Bi-Haar filter bank is normalized such that the p-values of Bi-Haar
coefficients (pBH) provide good approximation to those of Haar (pH) for
high-intensity settings or large scales; for low-intensity settings and small
scales, we show that pBH are essentially upper-bounded by pH. Thus, we may
apply the Haar-based HTs to Bi-Haar coefficients to control a prefixed false
positive rate. By doing so, we benefit from the regular Bi-Haar filter bank to
gain a smooth estimate while always maintaining a low computational complexity.
A Fisher-approximation-based threshold imple- menting the HTs is also
established. The efficiency of this method is illustrated on an example of
hyperspectral-source-flux estimation.
","[{""version"":""v1"",""created"":""Fri, 25 Aug 2006 12:44:01 GMT""},{""version"":""v2"",""created"":""Tue, 3 Apr 2007 07:16:59 GMT""},{""version"":""v3"",""created"":""Mon, 25 Feb 2008 15:00:07 GMT""}]","2008-02-25"
"math/0608632","Cornelia Yuen","Cornelia Yuen","Jet schemes of determinantal varieties","10 pages, this is part of the author's PhD thesis at the University
  of Michigan",,,,"math.AG math.AC",,"  This article studies the scheme structure of the jet schemes of determinantal
varieties. We show that in general, these jet schemes are not irreducible. In
the case of the determinantal variety $X$ of $r \times s$ matrices of rank at
most one, we give a formula for the dimension of each of the components of its
jet schemes. As an application, we compute the log canonical threshold of the
pair $(\mathbb{A}^{rs},X)$.
","[{""version"":""v1"",""created"":""Fri, 25 Aug 2006 14:10:45 GMT""}]","2007-05-23"
"math/0608633","Cornelia Yuen","Cornelia Yuen","One higher dimensional analog of jet schemes","14 pages, this is part of the author's PhD thesis at the University
  of Michigan",,,,"math.AG math.AC",,"  We develop the theory of truncated wedge schemes, a higher dimensional analog
of jet schemes. We prove some basic properties and give an irreducibility
criterion for truncated wedge schemes of a locally complete intersection
variety analogous to Musta\c{t}\v{a}'s for jet schemes. We show that the
reduced subscheme structure of a truncated wedge scheme of any monomial scheme
is itself a monomial scheme in a natural way by explicitly describing
generators of each of the minimal primes of any truncated wedge scheme of a
monomial hypersurface. We give evidence that the irreducible components of the
truncated wedge schemes of a reduced monomial hypersurface all have
multiplicity one.
","[{""version"":""v1"",""created"":""Fri, 25 Aug 2006 14:12:23 GMT""}]","2007-05-23"
"math/0608634","Martin Forde","Martin Forde","Tail asymptotics for diffusion processes, with applications to local
  volatility and CEV-Heston models","This paper has been withdrawn",,,,"math.PR",,"  This paper has been withdrawn
","[{""version"":""v1"",""created"":""Fri, 25 Aug 2006 14:59:07 GMT""},{""version"":""v2"",""created"":""Mon, 28 Aug 2006 12:56:21 GMT""},{""version"":""v3"",""created"":""Tue, 29 Aug 2006 17:19:36 GMT""},{""version"":""v4"",""created"":""Mon, 4 Sep 2006 15:48:47 GMT""},{""version"":""v5"",""created"":""Thu, 7 Sep 2006 20:39:49 GMT""},{""version"":""v6"",""created"":""Fri, 8 Sep 2006 22:21:00 GMT""},{""version"":""v7"",""created"":""Wed, 25 May 2011 13:19:58 GMT""}]","2011-05-26"
"nlin/0608058","Kristian Motzek","Kristian Motzek, Andrey A. Sukhorukov, Yuri S. Kivshar","Polychromatic interface solitons in nonlinear photonic lattices","3 pages, 5 figures","Opt. Lett. 31, 3125-3127 (2006);
  http://www.opticsinfobase.org/abstract.cfm?URI=ol-31-21-3125","10.1364/OL.31.003125",,"nlin.PS",,"  We demonstrate that interfaces between two nonlinear periodic photonic
lattices offer unique possibilities for controlling nonlinear interaction
between different spectral components of polychromatic light, and a change in
the light spectrum can have a dramatic effect on the propagation along the
interface. We predict the existence of polychromatic surface solitons which
differ fundamentally from their counterparts in infinite lattices.
","[{""version"":""v1"",""created"":""Thu, 24 Aug 2006 16:41:55 GMT""}]","2009-04-01"
"nlin/0608059","Martin Sieber","Jack Kuipers and Martin Sieber","Semiclassical expansion of parametric correlation functions of the
  quantum time delay","21 pages, no figures","Nonlinearity 20 (2007) 909","10.1088/0951-7715/20/4/006",,"nlin.CD",,"  We derive semiclassical periodic orbit expansions for a correlation function
of the Wigner time delay. We consider the Fourier transform of the two-point
correlation function, the form factor $K(\tau,x,y,M)$, that depends on the
number of open channels $M$, a non-symmetry breaking parameter $x$, and a
symmetry breaking parameter $y$. Several terms in the Taylor expansion about
$\tau=0$, which depend on all parameters, are shown to be identical to those
obtained from Random Matrix Theory.
","[{""version"":""v1"",""created"":""Thu, 24 Aug 2006 19:46:27 GMT""}]","2010-03-09"
"nlin/0608060","Sergei Elyutin","Sergei O. Elyutin and Andrei I. Maimistov","Propagation of videopulse through a thin layer of two-level atoms
  possessing permanent dipole moments","18 pages, 13 figures, PDF only",,"10.1117/12.740186",,"nlin.SI nlin.PS",,"  The excitation of a thin layer of two-level permanent dipole moment atoms by
ultimately short (less than field oscillation period) electromagnetic pulses
(videopulse) is observed. The numerical analysis of matter equations free of
rotating wave approximation and relaxation reveals a strong affect of local
field and Stark effect on temporal behavior of transmitted field. Specifically
it is demonstrated that a dense film irradiated by videopulse emits a short
response with a delay much longer even than the characteristic cooperative time
of atom ensemble. It is supposed that the local field in the thin layer of
permanent dipole atoms is able to re-pump the atomic subsystem. The close
analogy to nonlinear pendulum motion is discuused.
","[{""version"":""v1"",""created"":""Fri, 25 Aug 2006 07:00:10 GMT""}]","2009-11-11"
"nlin/0608061","Arseni Goussev O","Arseni Goussev and Klaus Richter","Loschmidt echo decay from local boundary perturbations","Final version; 4 pages, 3 figures","Phys. Rev. E 75, 015201(R) (2007)","10.1103/PhysRevE.75.015201",,"nlin.CD quant-ph",,"  We investigate the sensitivity of the time evolution of semiclassical wave
packets in two-dimensional chaotic billiards with respect to local
perturbations of their boundaries. For this purpose, we address, analytically
and numerically, the time decay of the Loschmidt echo (LE). We find the LE to
decay exponentially in time, with the rate equal to the classical escape rate
from an open billiard obtained from the original one by removing the
perturbation-affected region of its boundary. Finally, we propose a principal
scheme for the experimental observation of the LE decay.
","[{""version"":""v1"",""created"":""Fri, 25 Aug 2006 10:54:40 GMT""},{""version"":""v2"",""created"":""Wed, 10 Jan 2007 14:29:40 GMT""}]","2015-06-26"
"nucl-ex/0608044","Bernd Krusche","B. Krusche","In-Medium Properties of Hadrons","Proceedings of the Meson2006 IX Int. Workshop on Production,
  Properties and Interaction of Mesons, Cracow, Poland 09 - 14 June, 2006, to
  be published in Int. J. Mod. Phys. A","Int.J.Mod.Phys.A22:406-415,2007","10.1142/S0217751X07035598",,"nucl-ex",,"  A diverse experimental program for the study of the photoproduction of mesons
off nuclei has been carried out - and is still running - at the Mainz MAMI and
Bonn ELSA electron accelerators with the TAPS, Crystal Barrel, and Crystal Ball
calorimeters. It is motivated as a detailed study of the in-medium properties
of hadrons and the meson - nucleus interactions. Typical examples for the
in-medium behavior of vector mesons ($\omega$), scalar mesons ($\sigma$), and
nucleon resonances (P$_{33}$(1232), S$_{11}$(1535), D$_{15}$(1520)) are
discussed. Special attention is paid to meson - nucleus final state
interactions.
","[{""version"":""v1"",""created"":""Thu, 24 Aug 2006 16:22:41 GMT""}]","2011-07-19"
"nucl-ex/0608045","Stephan Pomp","S. Pomp, U. Tippawan","An iterative procedure to obtain inverse response functions for
  thick-target correction of measured charged-particle spectra","14 pages, 8 figures, submitted to NIM A","Nucl.Instrum.Meth. A572 (2007) 893-898","10.1016/j.nima.2006.11.058",,"nucl-ex",,"  A new method for correcting charged-particle spectra for thick target effects
is described. Starting with a trial function, inverse response functions are
found by an iterative procedure. The variances corresponding to the measured
spectrum are treated similiarly and in parallel. Oscillations of the solution
are avoided by rebinning the data to finer bins during a correction iteration
and back to the original or wider binning after each iteration. This
thick-target correction method has been used for data obtained with the MEDLEY
facility at the The Svedberg Laboratory, Uppsala, Sweden, and is here presented
in detail and demonstrated for two test cases.
","[{""version"":""v1"",""created"":""Fri, 25 Aug 2006 11:29:12 GMT""}]","2009-11-11"
"nucl-ex/0608046","Roy Lacey","Roy. A. Lacey (Chemistry Department, Stony Brook University, Stony
  Brook, New York, USA)","Is there a Sonic Boom in the Little Bang at RHIC?","Proceedings, International Conference on Strong and Electro Weak
  Matter, Brookhaven National Laboratory, May 10 - 13, 2006","Nucl.Phys.A785:122-127,2007","10.1016/j.nuclphysa.2006.11.141",,"nucl-ex",,"  The use of elliptic flow and correlation measurements as constraints to
establish the transport properties of hot and dense QCD matter is discussed.
Measured Two- and three-particle correlation functions give initial hints for a
""sonic boom"". Elliptic flow measurements give the estimates $c_s \sim 0.35$ and
$\eta/s \sim 0.1$ for the sound speed and viscosity to entropy ratio.
","[{""version"":""v1"",""created"":""Fri, 25 Aug 2006 15:12:36 GMT""}]","2008-11-26"
"nucl-th/0608054","Leonid Grigorenko","L.V. Grigorenko, M.V. Zhukov","Problems with interpretation of $^{10}$He ground state","14 pages, 13 figures, 1 table",,"10.1103/PhysRevC.77.034611",,"nucl-th",,"  The continuum of $^{10}$He nucleus is studied theoretically in a three-body
$^{8}$He+$n$+$n$ model basing on the recent information concerning $^9$He
spectrum [Golovkov, \textit{et al.}, Phys. Rev. C \textbf{76}, 021605(R)
(2007)]. The $^{10}$He ground state (g.s.) candidate with structure
$[p_{1/2}]^2$ for new g.s. energy of $^9$He is predicted to be at about
$2.0-2.3$ MeV. The peak in the cross section associated with this state may be
shifted to a lower energy (e.g. $\sim 1.2$ MeV) when $^{10}$He is populated in
reactions with $^{11}$Li due to peculiar reaction mechanism. Formation of the
low-energy ($E< 250$ keV) ``alternative'' ground state with structure
$[s_{1/2}]^2$ is highly probable in $^{10}$He in the case of considerable
attraction (e.g. $a<-5$ fm) in the s-wave $^9$He channel, which properties are
still quite uncertain. This result either questions the existing experimental
low-energy spectrum of $^{10}$He or place a limit on the scattering length in
$^9$He channel, which contradicts existing data.
","[{""version"":""v1"",""created"":""Thu, 24 Aug 2006 16:36:18 GMT""},{""version"":""v2"",""created"":""Tue, 5 Feb 2008 12:26:36 GMT""}]","2013-05-29"
"nucl-th/0608055","Arturo Samana","A. Samana (CBPF-Brazil), F. Krmpoti\'c (IFUSP-Brazil), A. Mariano
  (IFLP-Argentina) and R. Zukanovich Funchal (IFUSP-Brazil)","A Reanalysis of the LSND Neutrino Oscillation Experiment","REVTEX4, 14 pages, 3 figures, accepted for publication in Phys. Lett.
  B","Phys.Lett.B642:100-105,2006","10.1016/j.physletb.2006.08.071",,"nucl-th",,"  We reanalyse the LSND neutrino oscillation results in the framework of the
Projected Quasiparticle Random Phase Approximation (PQRPA), which is the only
RPA model that treats the Pauli Principle correctly, and accounts
satisfactorily for great majority of the weak decay observables around 12C. We
have found that the employment of the PQRPA inclusive DIF 12C(nu_e,e-)12N
cross-section, instead of the CRPA used by the LSND collaboration in the (nu_mu
->nu_e) oscillations study of the 1993-1995 data sample, leads to the
following: 1) the oscillation probability is increased from (0.26 +/- 0.10 +/-
0.05) percents to (0.33 +/- 0.10 +/- 0.13) percents, and 2) the previously
found consistence between the (sin^2 2theta, Delta m^2) confidence level
regions for the (nu_mu -> nu_e) and the (bar{nu}_mu -> bar{nu}_e) oscillations
is significantly diminished. These effects are not due to the difference in the
uncertainty ranges for the neutrino-nucleus cross-section, but to the
difference in the cross-sections themselves.
","[{""version"":""v1"",""created"":""Thu, 24 Aug 2006 21:51:44 GMT""}]","2008-11-26"
"nucl-th/0608056","Toshio Suzuki","Toshio Suzuki, Satoshi Chiba, Takashi Yoshida, Toshitaka Kajino and
  Takaharu Otsuka","Neutrino Nucleus Reactions based on New Shell Model Hamiltonians","11 pages, 14 eps-figures, to be published in Physical Review C (in
  press)","Phys.Rev.C74:034307,2006","10.1103/PhysRevC.74.034307",,"nucl-th astro-ph",,"  A new shell model Hamiltonian for p-shell nuclei which properly takes into
account important roles of spin-isospin interactions is used to obtain cross
sections of neutrino-^12C reactions induced by decay-at-rest (DAR) neutrinos as
well as supernona neutrinos. Branching ratios to various decay channels are
calculated by the Hauser-Feshbach theory. Neutrino-^4He reactions are also
investigated by using recent shell model Hamiltonians. The reaction cross
sections are found to be enhanced for both ^12C and ^4He compared with previous
calculations. As an interesting consequence of this, a possible enhancement of
the production yields of light elements, ^7Li and ^11B, during supernova
explosions is pointed out.
","[{""version"":""v1"",""created"":""Fri, 25 Aug 2006 05:12:17 GMT""}]","2008-11-26"
"nucl-th/0608057","Ludmila Malinina","N.S. Amelin, R. Lednicky, T.A. Pocheptsov, I.P. Lokhtin, L.V.
  Malinina, A.M. Snigirev, Iu.A.Karpenko, Yu.M. Sinyukov","A Fast Hadron Freeze-out Generator","28 pages,7 figures","Phys.Rev.C74:064901,2006","10.1103/PhysRevC.74.064901",,"nucl-th hep-ph",,"  We have developed a fast Monte Carlo procedure of hadron generation allowing
one to study and analyze various observables for stable hadrons and hadron
resonances produced in ultra-relativistic heavy ion collisions. Particle
multiplicities are determined based on the concept of chemical freeze-out.
Particles can be generated on the chemical or thermal freeze-out hypersurface
represented by a parameterization or a numerical solution of relativistic
hydrodynamics with given initial conditions and equation of state. Besides
standard space-like sectors associated with the volume decay, the hypersurface
may also include non-space-like sectors related to the emission from the
surface of expanding system. For comparison with other models and experimental
data we demonstrate the results based on the standard parameterizations of the
hadron freeze-out hypersurface and flow velocity profile under the assumption
of a common chemical and thermal freeze-out. The C++ generator code is written
under the ROOT framework and is available for public use at
http://uhkm.jinr.ru/.
","[{""version"":""v1"",""created"":""Fri, 25 Aug 2006 08:32:14 GMT""},{""version"":""v2"",""created"":""Mon, 28 Aug 2006 12:15:30 GMT""},{""version"":""v3"",""created"":""Wed, 30 Aug 2006 13:44:23 GMT""},{""version"":""v4"",""created"":""Fri, 13 Oct 2006 13:17:35 GMT""}]","2008-11-26"
"nucl-th/0608058","Jan-e Alam Dr.","Jan-e Alam, Abhee K. Dutt-Mazumder and Pradip Roy","Collisional energy loss and the suppression of high $p_T$ hadrons","Presented at the international conference on strong and electroweak
  matter 2006, May 10-13, Brookhaven National Laboratory","Nucl.Phys.A785:245-248,2007","10.1016/j.nuclphysa.2006.11.145",,"nucl-th",,"  We calculate nuclear suppression factor ($R_{AA}$) for light hadrons by
taking only the elastic processes and argue that in the measured $p_T$ domain
of RHIC, collisional rather than the radiative processes is the dominant
mechanism for partonic energy loss.
","[{""version"":""v1"",""created"":""Fri, 25 Aug 2006 11:22:12 GMT""}]","2008-11-26"
"nucl-th/0608059","Allan Widom","A. Widom, L. Larsen","Theoretical Standard Model Rates of Proton to Neutron Conversions Near
  Metallic Hydride Surfaces","ReVTeX format 12 pages and 4 *.eps figures",,,,"nucl-th",,"  The process of radiation induced electron capture by protons or deuterons
producing new ultra low momentum neutrons and neutrinos may be theoretically
described within the standard field theoretical model of electroweak
interactions. For protons or deuterons in the neighborhoods of surfaces of
condensed matter metallic hydride cathodes, such conversions are determined in
part by the collective plasma modes of the participating charged particles,
e.g. electrons and protons. The radiation energy required for such low energy
nuclear reactions may be supplied by the applied voltage required to push a
strong charged current across a metallic hydride surface employed as a cathode
within a chemical cell. The electroweak rates of the resulting ultra low
momentum neutron production are computed from these considerations.
","[{""version"":""v1"",""created"":""Fri, 25 Aug 2006 12:02:42 GMT""},{""version"":""v2"",""created"":""Tue, 25 Sep 2007 19:54:41 GMT""}]","2007-09-25"
"physics/0608236","Joseph P. Zbilut","Elio Conte, Gianpaolo Pierri, Leonardo Mendolicchio, Andrei Yu.
  Khrennikov, Joseph P. Zbilut","On some detailed examples of quantum like structures containing quantum
  potential states in the sphere of biological dynamics",,,,,"physics.gen-ph",,"  In the first part of the present paper we give an analysis of the ontic
nature of quantum states to be intended as potentialities and of the central
role of spin to be considered as the basic essence of quantum mechanical
reality: using an algebraic quantum like structure we give mathematical proof
on the transition from potentiality to actualization : we recall here what was
recently given by us in arXiv quant-ph/0607196. However, as may be expected, it
is not so easy to introduce examples containing an adequate description of
ontic potentialities through detailed models of systems. The central aim of
this paper is to attempt to reach this objective giving direct cases of systems
in which ontic potentialities act jointly to actualization. Our aim is to
provide evidence for the possible importance of potential states in the sphere
of the biological dynamics giving detailed examples of interest for biological
studies. We outline the possible implications of potentialities at the level of
linear and non linear biological dynamics.
","[{""version"":""v1"",""created"":""Thu, 24 Aug 2006 18:14:48 GMT""}]","2007-05-23"
"physics/0608237","Ming Bai","N. Garcia and Ming Bai","Theory of Transmission of Light by Sub-wavelength Cylindrical Holes in
  Metallic Films","13 pages and 9 figures",,"10.1364/OE.14.010028",,"physics.optics",,"  This paper presents theory and finite-difference time-domain (FDTD)
calculations for a single and arrays of sub-wavelength cylindrical holes in
metallic films presenting large transmission. These calculations are in
excellent agreement with experimental measurements. This effect has to be
understood in terms of the properties exhibited by the dielectric constant of
metals which cannot be treated as ideal metals for the purpose of transmission
and diffraction of light. We discuss the cases of well-differentiated metals
silver and tungsten. It is found that the effect of surface plasmons or other
surface wave excitations due to a periodical set of holes or other roughness at
the surface is marginal. The effect can enhance but also can depress the
transmission of the arrays as shown by theory and experiments. The peak
structure observed in experiments is a consequence of the interference of the
wavefronts transmitted by each hole and is determined by the surface array
period independently of the material. Without large transmission through a
single hole there is no large transmission through the array. We found that in
the case of Ag which at the discussed frequencies is a metal there are
cylindrical plasmons at the wall of the hole, as reported by Economu et al 30
years ago, that enhanced the transmission. But it turns out, as will be
explained, that for the case of W which behaves as a dielectric, there is also
a large transmission when compared with that of an ideal metal waveguide. To
deal with this problem one has to use the measured dielectric function of the
metals. We discuss thoroughly all these cases and compare with the data.
","[{""version"":""v1"",""created"":""Thu, 24 Aug 2006 18:17:41 GMT""}]","2009-11-13"
